id,title,author,grade,text,char,valence,arousal,dominance
55066,The Boy,breanna,6,الفتى الذي أحبه لطيف جداً لديه شخصية رابحة لا يمكن هزيمتها لديه ابتسامة مبهرة تجعلني أذوب أنا أحبه كثيراً,144,4.555321216583252,3.886305809020996,3.396198034286499
44018,I like Bugs,breanna,6,حشرات رائعة. تتذبذب وتضحك. تجعلك تضحك. تدغدغ حقاً. يمكن أن تكون بحجم مخلل. عندما تخطو عليها تجعلك ترتجف.,161,3.898853302001953,3.66672420501709,3.3056442737579346
101015,I am Thankful,breanna,6,أنا شاكرة لبصري حتى أرى ليلاً ونهاراً أنا شاكرة أن على الأرض حيث أنتمي لذا أستطيع أن أبتهج وأغني أغنية أنا شاكرة لحقي في عبادة الله بكل قواي أنا شاكرة لشعر قصير وطويل على حد سواء,544,3.808454990386963,3.506582260131836,3.3127574920654297
59522,The dog,breanna,6,كان هناك كلب على سجل في الضباب مع ضفدع,63,2.8242344856262207,2.9949936866760254,3.095609188079834
20737,Fall,breanna,6,اوراق او اوراق اوراق الاوراق التي تحت اقدامي هذا هو مثل هذه المعاملة الخاصة لا يمكن التغلب على عشاء عيد الشكر,125,3.957205057144165,3.634861469268799,3.3902833461761475
24541,Love is sweet,breanna,6,الحب الحلو هو حل حلو كما أن حب السكر هو الحب الحلو أحب الحب,166,4.260730266571045,3.6754326820373535,3.29809308052063
95207,T0rnad0 rumbling,breanna,6,لقد كان ذلك مثل صوت معدتي. لقد كان صوتها يشبه صوت معدتي. لقد كان صوتها يشبه صوت معدتي. لقد كان صوتها مائلاً. لقد كان صوتها مائلاً وصوتها مائلاً لليسار. لقد كان تقريباً,490,2.4229331016540527,3.5610837936401367,2.903355836868286
103230,Life,breanna,6,الحياة مثل حياة عظمة مكسورة لا تكون دائماً لها نهايات سعيدة الناس لطفاء والناس لطفاء الحياة هي الحياة مثل عظمة مكسورة أحياناً تحصل على ما تريد أحياناً,338,2.413572072982788,3.239750385284424,2.947679281234741
110442,Road Trip!!!,breanna,6,حيث تم صنع العلم الأمريكي حيث يحصل الكثير من العمال على أجر يُدفع لهم، وهذا هو المكان الذي فيه! مع الطرق النظيفة وعروض العشاء,235,3.297879219055176,3.2540249824523926,3.2714805603027344
40044,Cats,breanna,6,والقطط حلوة جداً، والقطط ستفعل أي شيء، لتجعلك تعتقد أنها أنيقة.,95,4.06403112411499,3.627800464630127,3.320741891860962
54319,Tiger named Goerge,breanne,6,ذات مرة كان هناك نمر يُدعى (غورج) الذي أحب حقاً أن يأكل الـ(بوريج) ذلك النمر السخيف كان,135,3.1803998947143555,3.1604151725769043,3.1916821002960205
24140,ANTHONY,breanne,6,هو الريح التي تهب في شعري. هو الحب الذي يقف هناك. هو صديقي الذي يكون صحيحا. وسيكون صديقي ما دمت اعيش في هذا العالم. احبه الى الابد. يضيء عالمي بالفرح والسعادة.,244,4.175045490264893,3.780095100402832,3.371864557266236
25559,Family,breanne,6,أحياناً تشعر أنك قد تهرب بعيداً لكنك تعلم أنهم ما زالوا يهتمون. عندما تكون غاضباً تشعر بالحزن الشديد. عائلتك ستكون هناك حتى النهاية,235,3.351578712463379,3.471101760864258,3.205727815628052
26340,Robert,breanne,6,لقد مر وقت طويل وأنا ضائع بدونك قلت أنني سأحتاجك، كنا أصدقاء أيضاً، والآن هو بجانبي وأنا لست ضائعاً بعد الآن,208,3.6455135345458975,3.5420095920562744,3.2703850269317627
24137,FUN,breanne,6,f للأصدقاء الذين يفعلون أشياء لـ gegehther o هو بالنسبة لك ولي n في أي مكان في أي وقت على الإطلاق.,98,3.060577392578125,2.945446491241455,3.2319204807281494
26539,Friends,breanne,6,أصدقاءك هم من تحبهم وتتبعهم ويرشدونك على طول الطريق؛ هو أو هي يمكن أن يكون مرتبطاً بالدم أو الزواج يمكن أن يكونوا حبيبك أو حبيبتك أو صديقك أو صديق,233,3.6989359855651855,3.428372859954834,3.3465168476104736
36220,Day Dreaming,breanne and fiona,6,كما كنت جالسا في الفصل في وقت متأخر من بعد ظهر أحد الأيام، الاستماع إلى حديث المعلم وكنت أجلس هنا منذ الظهر. ثم فجأة تغير عالمي إلى الحلم الذي كان لي الليلة الماضية. كان هناك رقص الدببة والوحيد، الأرجواني والأشجار الوردية الجنيات تحلق في كل مكان حتى في الحديث النحل. ثم فجأة قالت زهرة، انظروا إلي! بدأ في القيام برقصة مضحكة أمام عيني مباشرة، ثم سمعت المعلم ينادي، ينادي اسمي. أعتقد أنه ينبغي لي أن أدفع، هناك اختبار الأسبوع المقبل، في المرة القادمة سأعرف أفضل وأنقذ أحلامي لليلة.,589,3.2773070335388184,3.456725597381592,3.128645420074463
59530,My Brother Stinky  Feet,breauna,6,رائحة أقدام أخي مثل الأطباق التي تُركت في المغسلة لمدة أسبوع لذا هذا هو مدى سوء رائحتهم عندما يعود إلى المنزل من (تاك),206,2.3953914642333984,3.255012989044189,3.045835018157959
48446,Simile,bree,6,هو أخضر.. حاد كالعشب كما رطب مثل الماء كما جامبي كضفدع,68,3.021399974822998,3.097020149230957,3.180493116378784
48424,Sun,bree,6,إنّها شمس حمراء حمراء، مشرقة لمسة حارّة جدًّا جدًّا، سوف تموتين مع أشعّتها الحرّة الحارّة.,89,3.0691146850585938,3.300997257232666,3.1050069332122803
112074,The breeze,bree,6,في الصيف الحار، أشاهد الرياح تهب في الوقت الذي أجلس فيه هناك هناك إنفجارات قوية و إنفجارات خفيفة ولكن أنا أحبهم كل أيام مثل هذه,192,4.203784942626953,3.735335111618042,3.348210096359253
45398,A Limmerick By Breeze,breeze,6,ذات مرة كان هناك رجل مسمّى سو. الذي يحلم كلبه ذهب 'moo'. استيقظ مع الخوف. في منتصف الليل. ليجد أن حلمه قد تحقق.,156,2.9478673934936523,3.430483102798462,3.0078749656677246
45408,A Limmerick Breeze,breeze,6,ذات مرة كان هناك رجل اسمه سو. الذي كان يحلم أن قطته ذهبت 'moo' استيقظ مع الخوف. في منتصف الليل. ليجد أن حلمه تحقق,157,3.0253705978393555,3.353285789489746,3.0453813076019287
31480,A Book,brei,6,ملايين الصفحات من الضوء و البني قرأته كثيراً كثيراً الكتاب يُهدر لكن مع ذلك أنا أفتحه كل ليلة و أقرأ بجانب ضوء الشمعة أعرف الكلمات من القلب التي ترينها لكن مع ذلك يبدو الكتاب جديداً بالنسبة لي,452,3.494270801544189,3.465634346008301,3.253085136413574
31511,Yesterday I was a Hat,brei,6,أمس كنت قبعة قبعة جميلة سمينة قليلا قبعة سوداء قليلا قبعة أمس كنت ثعبان مع جسم طويل نحيل كثعبان ليلة أمس كنت قطعة من دجاج مقلي لطيف ولعق دجاجة لذيذة,353,3.344731330871582,3.3134584426879883,3.264879941940308
102420,The fat sumo wrestler,bren,6,ذات مرة كان هناك مصارع سمو سمين لم يحب سمنته لذا ارتدى حفاظة كبيرة و عمل في الصالة الرياضية لكنه ما زال لا يستطيع تخفيف وزنه كان حزيناً جداً جداً,329,3.421544551849365,3.422293901443481,3.239361524581909
102415,Bren and gabes awesome adventures,bren,6,أنا و(جابي) لدينا العديد من المغامرات بعضها فقط مدهش (جابي) أنقذ حياتي من العديد من الأشياء أحياناً أتساءل لماذا أنا ما زلت على قيد الحياة,477,3.7192306518554688,3.515347003936768,3.343591451644897
35383,My Pumpkin,brenda,6,لديّ يقطينة على شرفتي مع شعلة بداخلي رجاءً لا تحرقي.,136,3.5653018951416016,3.402902364730835,3.353580474853516
34557,Baby,brenda,6,طفل لطيف، مبتسم، طفل سعيد، طفل سعيد.,40,4.491322040557861,3.7674288749694815,3.3563835620880127
78104,Cat,brenda,6,امرأة كانت ترتدي قبعة حمراء وبدأت في مطاردة قطة، وركضت خلف القطة وفقدت قبعتها، ورجل ساعدها على ذلك.,160,2.863323926925659,3.270942211151123,3.0392985343933105
102515,Green Wonder,brenda,6,لقد تم هدمها على طول الطريق إلى الأرض! أوه، قلبي المنكسر هناك طريقة جديدة للبدء. فقط كن أخضر جديد بالكامل، وسترى العجيب,204,3.5014424324035645,3.830038547515869,3.316091299057007
17492,ROSES,brenda,6,"""الوروز حمراء البنفسلات الزرقاء زرقاء"" ""النجوم لها السماء"" ""لكني أملكك""",76,3.530390977859497,3.2964117527008057,3.252244710922241
19721,Cali the Calico Cat,brendan,6,القطة الكاليكية مثل القطة الرائعة كالي القطة الكاليكية مغطاة باللون الأبيض واللون الأسود والكالي الأسود القطة الكاليكية لها عيون محيطية زرقاء مشرقة,197,3.857367038726807,3.404343605041504,3.3118138313293457
26100,I Used to Chase,brendan,6,لقد اعتدت على المطاردة، ولكن الآن أنا أختبئ كنت أركض، ولكن الآن أنا أسير كنت أصرخ، لكن الآن أنا أهمس أنني كنت سلسلة، ولكن الآن أنا جورب كنت معتاد على أن أكون جورب، ولكن الآن أنا عصا كنت أفكر، ولكن الآن أنا فعلت أنا كنت شجرة، ولكن الآن أنا نخب كنت كنت هناك، ولكن الآن أنا هنا كنت هنا، ولكن الآن أنا هنا أنا كنت هنا، ولكن الآن أنا هناك كنت أسير، ولكن الآن أنا أركض أنا اعتدت على المطاردة، ولكن الآن أنا أختبئ.,399,2.753013610839844,3.107661962509156,3.0636777877807617
29864,Be the Worst Kid Possibly,brendan,6,أنا هنا لأتحدث إليكم عن كيفية أن تكون سيئاً، والآن لنبدأ في الاستماع إلى الصغير. أولاً، أذهبوا إلى المدرسة، وتصرفوا بشكل رائع ثم كونوا سيئين حقاً، عندما يسأل معلمكم سؤالاً,692,2.9865758419036865,3.4812026023864746,3.358009099960327
101380,Joy,brendan,6,العالم مسالم جداً، محب، لامع، معطاء، وفرح هذه الخمس أشياء تجعل موسم عيد الميلاد.,110,4.411624431610107,3.77298641204834,3.4199228286743164
34473,Field of Dreams,brendan,6,ابحثوا عن كرة سريعة، كراك، قيادة طويلة يسار الحقل انها ذهبت، والحشد يذهب البرية.,88,2.938509702682495,3.561207771301269,3.1650750637054443
34449,Maniac Magee,brendan,6,كان هناك في وقت ما يتيم يدعى مجنون ماغي. لم يكن لديه منزل كما ترى. لقد بقي بالخارج طوال الليل، دون أي خوف،,143,3.1730644702911377,3.364935874938965,3.170954465866089
47017,Down by the Seashore,brenna,6,تغمض الرياح اللطيفة الماء، وتحثه على النهوض كصديق له كلمات مشجعة. مع تحطم وزئير تسقط الموجة إلى الرمال،,464,3.4956371784210205,3.521904468536377,3.263880968093872
106640,The Rabbit,brenna,6,الأرنب يقفز حول الحقل بدون أي علامة على أنهم سينتجون أنوفهم يرتجف، وفرهم الناعم نادراً ما يقبض عليهم في جحور صغير، وحساس أيضاً ربما يبتعد عنك طفله الصغير كالحجر، أتساءل إن كانوا يرغبون في أكل الصنوبر؟ الأرنب حيوان لطيف، لا حاجة للخوف من الأرنب يجعل الصوت ناعماً، يقفز من خلال أوراقك الأرنب هو لطيف بقدر أي شيء يمكن أن يكون.,433,3.4716930389404297,3.34246563911438,3.2147765159606934
106659,The Cat,brenna,6,ستسمعه يطير بينما تمشي بجانب القطة، مع مشرقة، تلمع العين القطة، مع ذيلها طويل جدا القطة، أنها سوف تعيش إلى الأبد على القطة،,273,3.728002548217773,3.5323894023895264,3.3253986835479736
106657,The Dog,brenna,6,الكلب هو صديقك المقرب انه هناك كلما احتجت اليه انه يهز ذيله ثم اللعاب عليك طوال الليل الكلب سيجيب على مكالمتك,287,4.005496978759766,3.677958011627197,3.361765146255493
75314,Animals at Breakfast,brenna,6,أكل الموظ بعض الفطائر، أكل البقرة بعض الفطيرة، صنع الكلب بعض الفطائر، أكل السمك بعض البطاطا المقلية، أكل الخروف بعض الكعك البري، أكل الجرو الكعك، أكل القط بعض الأصباغ.,359,3.2186028957366943,3.0383358001708984,3.1911275386810303
94752,Nothing&apos;s Impossible,brenna,6,لا شيء مستحيل، عندما تؤمن، قد لا تكون أعمى، ولكن لا يمكنك أن ترى، العالم من حولك،,143,2.938987970352173,3.180248737335205,3.161952495574951
38814,Pro Bass Fisher,brennan,6,يَجْلسُ على سطح السفينةِ في انتظارهم يَلْكمونَ ويَمْضأونَ يَأْكلُ لحمَه البقريّ ويَتْركُ بطنَه الخشنَ يُعلّقُ خارج قميصِه. يَتمنّى بأنّه يَحْصلُ على شيءِ إلى جانب a صخرة، الصياد يَنَامُ بينما يَرْفسُ بَعْض رائحةِ اللحم البقريةِ اللذيذةِ.,278,3.332315444946289,3.2755017280578613,3.2465994358062744
16002,The Rain,brent,6,المطر هو متعة ولكن في بعض الأحيان انها لا تدمر المطر ولكن في بعض الأحيان المطر لا تدمر المطر ولكن في بعض الأحيان لها متعة الصيف الاستحمام ثم تتوقف ثم تتوقف,175,3.8437907695770255,3.452255725860596,3.316273927688598
120623,Haunted House,brentyn,6,كل صرخة عندما تدخل إلى الداخل مع ضوضاء من كل جانب. الناس المخيفون على مهبل، أصوات لا يمكن تجنبها من دون أي خيار، العناكب المطاطية قليلا من العضاضلات، مخلوق شبيه بالكلاب بدون ميزة، فتاة تزحف على المنشار، تقفز خارج الجوارج قائلاً إنه تعذيب، مهرج قاتل يركض في أرجاء المدينة، يرن الهاتف بنغمة مخيفة، من خلال متحدث حتى ولو كان مزعجاً، هواء سام، يبدأ الخوف يخرج قليلاً، لكنه كان يستحق كل شيء.,495,2.6801180839538574,3.58198881149292,2.9831244945526123
41972,The Tide,bretanne,6,المد يأتي في المد والجزر يخرج عندما تغرب الشمس,65,2.960198879241944,2.9336283206939697,3.068104982376098
116568,Game,brett,6,أنا ألعب لعبة لها الكثير من الشهرة و كل شخص حول العالم يلعبها. ألعبها. ألعبها طوال اليوم و كل يوم لن أهتم أبداً بها. هذه لعبتي الوحيدة,166,3.51836371421814,3.562451362609864,3.371509313583374
34485,The McNab&apos;s House,brett,6,الزبيب في كل مكان، هل الصراصير تتسلق أعمدة السرير؟,73,2.6448721885681152,3.1676177978515625,3.072683811187744
111619,I am Green,breyaunna,6,أنا الطفل اليتيم الذي هربت منه مرات عديدة جداً من الناس الهمجيين يقولون أنني يجب أن أرتكب جريمة ركضت إلى الغابة لم أسمع شيئاً لكن حيوانات الأدغال التي لم أكن قد أكلتها منذ فترة,661,3.078369617462158,3.422121047973633,3.151972532272339
26002,Wishes,bri,6,أتمنى لو أستطيع أن أطير عالياً جداً أتمنى لو أستطيع لمس الغيوم في السماء أتمنى لو لا يوجد شيء كسلاح أتمنى أن يحظى به كل الأطفال,296,3.072450637817383,3.426492214202881,3.1347298622131348
115464,The Light,bri,6,ظلال الظلام تحيط بي، في أسود و رمادي، لقد كنت دائما وحيدا، كل الأضواء تبقى بعيدا، لا شيء أبيض، لا شيء برتقالي،,496,3.212846279144287,3.429933786392212,3.096635580062866
28940,The blue mountain,brian,6,الجبل الازرق بارد مع الناس بارد على، والعطس والعطس والدهشة الدهشة الدهشة انه يتجمد ما البرد البارد قال,167,3.540897846221924,3.567927360534668,3.2862637042999268
84918,My Family Members,brian,6,كل ليلة تقريباً، آكل الدجاج بشوكة لامعة. قبل أن أقول تصبح على خير، آكل فطائراً مكدسة على لحم الخنزير. عندما تكون أمي حزينة، تأكل الفاصوليا مع ملعقة. في كل مرة تكون غاضبة، تأكل برغر شحيحاً في فترة ما بعد الظهر. اليوم يشعر أبي باللون الأحمر، يأكل لحوم الأرنب مع أعواد الطعام. من الأفضل أن أصنع له خبزاً لطيفاً، أو لن يعلمني أبداً أي خدع للبطاقات. تقريباً في كل ليلة مليئة بالقمر، تطير أختي بالطائرات الورقية المجنونة. هذه الليلة لا أرى أي شيء في الأفق، لأننا كنا نخوض قتالاً كبيراً.,517,2.710835218429565,3.22562837600708,3.152723550796509
110222,I am Poem,brian,6,أنا جيد في كرة القدم، دائماً أجعل الناس يسقطون، تعاملي مع الناس سميك، أنا صغير كالعصا، عندما يرونني أحمل كرة القدم،,227,3.4111557006835938,3.4756627082824707,3.356023073196411
94688,MY MIRROR,brian,6,لمرّة ظننتُ أنّي كنتُ أرى اثنتين لكن الآن أعرف ما هو الحق الحقيقي حقاً تجلس المرّة هناك,451,3.160703420639038,3.253262996673584,3.13990330696106
29920,Sweets,brian,6,أَحبُّ أَنْ أَأَكْل الحلو يَذُوقونَ عظيمَ جداً جداً جداً جداً لكنّهم يَجعلونني سمينة وهذا هو,97,3.053266286849976,3.3139336109161377,3.211141586303711
36558,The Game,brian,6,جولة، جولة، جولة نذهب رش بعضها البعض مع خرطوم المياه. صعودا وهبوطا، صعودا وهبوطا في الشجرة وفي الشارع تشغيل، تشغيل، تشغيل مطاردة، مطاردة، مطاردة. يجب عليك حقا أن تلعب هذه اللعبة لأنها ممتعة حقا.,220,3.663532733917236,3.643983840942383,3.374074935913086
48808,THE LETTER,brian,6,عزيزتي السيدة (كوبر)، أتمنى لو كنتِ هناك شاطئ (كارلينيا) المكان كان فيه السعادة هو لو كنتِ تمشين لا يمكنكِ أبداً أن تكوني سعيدة في شاطئ (كارلينيا) الشاطئي (كارلينيا),550,3.806823492050171,3.56221890449524,3.329167127609253
52231,Sledding,brian,6,تَرى الثلجَ مَع تَوَجُّهه المتوهج المتوهج يَدْرُك في تَدَوْلٍ لطيف ، يَسْوَكه الله في تَوْس تَوْزَك تَسَدَّدَدَ وتَسَدَّدَدَ وَجَوْزًا شديدًا شديدًا شديدًا شديدًا شديدًا شديدًا شديدًا شديدًا شديدًا شديدًا شديدًا شديدًا شديدًا شديدًا شديدًا شديدًا شديدًا شديدًا شديدًا شديدًا شديدًا شديدًا شديدًا شديدًا,66,3.2492032051086426,3.039035558700561,3.189440488815308
102271,When I woke up one day,brian,6,عندما استيقظت ذات يوم وجدت بقرة مستلقية على رأسي البقرة كانت بحجم القطرة عندما حركت البقرة,164,3.212184429168701,3.6376357078552246,3.2255349159240723
29763,BIRTHDAY,brian,6,اليوم هو عيد ميلادي، لا أطيق صبراً لرؤية كل الهدايا، تُعطي لي.,78,4.150957584381104,3.703348159790039,3.371647596359253
60140,Love is,brian,6,الحب هو ما يجعل الحب هو ما يجعل الأرض تبدو مشرقة مثل النهار، الحب هو مثل الغروب على خليج، الحب هو مثل الحب هو مثل ما يجعل الموسيقى حيوية، الحب هو شيء لا يمكنك اختياره، الحب هو شيء لا يمكنك أن تخسره، الحب هو مثل,2652,3.591284275054932,3.4056549072265625,3.275604724884033
65324,Sports Worts,brian,6,أنا ألعب الرياضة في صباح أحد صباح يوم ما وجدت أن لدي ثعابين وثرات وثرات وثرات رياضية وثاء والألم الذي سأفوته في المباراة بسبب بلدي الورتس الرياضية,128,2.300975561141968,3.271793842315674,2.926198720932007
46917,The Race,brian,6,"""المحركات التي تهدر سباقات السيارات تصطدم في الجدران"" ""المنتصر سريع""",72,3.262356996536255,3.6265032291412354,3.287168264389038
17013,Down by three,brian,6,هناك قاعدتان مُحمّلتان و أسفل بثلاثة. الجمهور يَذْهبُ صامتاً. الضربة الواحدة صَرختْ المضربَ. والضربة الثانية ضربت الثانية صرخَ إثنان صرخَتْ المكعبَةَ. الرمية تَستعدُّ إلى خلال كرة سريعة. والرمية أَتأرجحُ تَذْهبُ تَذْهبُ تَذْهبُ. الحشد يَذْهبُ يَذْهبُ. نَرْبحُ. نَرْبحُ اللعبةَ.,301,3.3145110607147217,3.524721622467041,3.312021017074585
46955,The Swing,brian,6,المرمى قادم في الضربات تتأرجح مضربه الكبير المضرب والكرة تتقابلان,79,3.0892333984375,3.1143147945404053,3.2120842933654785
46910,Bob the Chicken,brian,6,كان هناك دجاجة ذات مرة من جبابرة اسمه حدث أن كان بوب انه يأكل زبدة الفول السوداني فطيرة نعتقد أنه جاء من السماء لحسن الحظ بالنسبة لنا، انه ليس نابلا.,153,3.1497702598571777,3.096315383911133,3.183619737625122
32798,The Scar,brian,6,إنه هناك، طوله 3 بوصات. إنه صغير جداً ولكنه حكيم جداً. إنه يروي لي قصصاً؛ ومع ذلك فهو صغير ومجرد حكايات في الغرفة. إنه علامة على أن خيطاً جراحياً يتخلّص من المسبح، يفعل ما يجب أن يفعله، ثم لا يترك أي أثر إلا ندبة صغيرة...,285,2.915118455886841,3.047534704208374,3.094794750213623
65988,The Beach,brian,6,ستستمتع تحت الشمس إذا كنت تركض و تأكل الأطنان من الكعكة إذا كان لديك كرة شاطئية ستدعو الكرة,174,3.56049919128418,3.396512031555176,3.3345744609832764
114782,A night In the sky,briana,6,أنا أشاهد بينما تغرب الشمس أحياناً يمكنها أن تذكرني بمهرج أنا أشاهد النجوم تطير و أشاهدها تطير عبر السماء أحياناً أتسائل أين ستذهب,209,2.896686315536499,3.184633016586304,2.995931386947632
35137,Money,briana,6,من اجل المال يجب ان يستخدم بطريقة جيدة. لان المال لا يُمدح انه يُستخدم لشراء حاجات معينة. لان المال لا يُعبد.,141,2.975300073623657,3.0375096797943115,3.2707040309906006
15508,Tears,briana,6,دموعي تنزل كعاصفة أشعر كما لو كنت وحيداً طوال حياتي أنا أفتقد أمي لكنني أدرك أنه مجرد حلم,139,2.219198703765869,3.360149383544922,2.8090829849243164
74246,Flowers of  the Meadow,briana,6,قد تبدو أزهاراً في المزروعات صفراء تماماً لقد أرسلوا لها رائحة عرض غرفتي وأزهار الملتقى,134,3.415249824523926,3.1977734565734863,3.22705626487732
