id,title,author,grade,text,char,valence,arousal,dominance
108207,Misunderstood,dani,9,في وقت من الأوقات كانت هناك هذه الفتاة وقد تم فهمها. شعرت أن عائلتها لا تحبها ولا أصدقائها. بحثت عن الحب في جميع الأماكن الخاطئة ولطالما خرجت مؤذية. حتى يوم ما قابلت هذا الفتى الذي وعد بأنه لن يؤذيها مرة أخرى. لم تكن تعلم ما إذا كان الصبي جديرا بالثقة، لكنها أعطته فرصة. ذهبت إلى البيت في تلك الليلة وأخبرت الجميع عنه. كان رسم حب حلو واقفا و ينتظرها. شعرت بأنها بحاجة إليه. لماذا فعلت ذلك لها؟ كانت فتاة حلوة! لقد خانها وضرب عقلها وروحها. هو السبب في أنها كانت تمشي ورأسها إلى أسفل دون أن تشعر بالجمال. جعلت فتيات أخريات يشعرن بالجمال أكثر منها أو هي. ولدت لتكون نجمة وجعلتها متهورة. هل كان من السهل على الفتاة أن تتعافى؟ لا! ولكن كان من السهل عليها أن تنسى أمره وتنتقل إليه. ما لم يعرفه الصبي كان لديها خطة خلفية. كانت على استعداد لتركه. كان دائما يتساءل عما إذا كانت تتركه وفعلت.,1002,2.956417322158813,3.5024309158325195,3.098836898803711
20006,A WALK IN THE WOODS,daniel,9,مشيت في الغابة ووجدت سجلاً، ذهبت إلى السجل ووجدت كلباً، ثم هرب الكلب، لذا تابعت المشي بعيداً، وركضت إلى صقر لم يتحدث، ثم طار بعيداً،,442,2.624309062957764,3.4050517082214355,2.92948317527771
106360,Just a page of what i feel,daniel,9,أنتِ رائعة كما أنتِ جميلة عينيكِ جميلة كما أنتِ جميلة كما أنتِ رائعة الشمس ليست مشرقة بقدر ما أنتِ أنتِ مشرقة بقدر ما أنتِ أنتِ مُلونة بقدر ما أنتِ يمكنكِ أن تكوني لديكِ الشخصية المثالية أنتِ أهم شيء في الحياة,478,4.032816410064697,3.8220410346984863,3.420172452926636
29443,Music,daniel,9,يمكن أن يكون مزاجه حزيناً أو مبتهجاً بطرق عديدة. يمكنه أن يتوقف أو يذهب ما يمكنني قوله. يتحدث من خلال ديناميكية تتحرك بسرعة مختلفة. لا أحد يعرف متى يمكن أن تكون كاملة. إنه يصنع من العديد من الملاحظات مرتبة ترتيباً إيقاعياً. دائماً ما يعبر عن أفكار أحياناً يقتبس. إنه يُعبّر عن طريق الصوت الذي يسهّل من خلال الروابط. كل مجموعة من الموظفين تكسرها الخطوط المتوازية. إنه يجعل المرء يفكر ويفتح الذكريات. إنه يجعل العقل يتخيل الكثير، الكثير، الأشياء! هذا ما أسميه الموسيقى!,574,3.484951972961426,3.479801654815674,3.258030652999878
17696,Love for an Angel,daniel p.,9,يا إلهي العزيز، إذا تركت حبي، من فضلك أرسله إلى السماء، لأنه كان مقدراً فقط لملاك.,101,3.445800304412842,3.59842300415039,3.202047824859619
103417,John and jacob and joey and jason,daniela,9,جون وجاكوب و جوي و جيسون طاروا إلى جاميكا لقضاء عطلة وانقلبوا على قارب، صرخ طلبا للمساعدة، لكنه لم يعرف أحد، و جاكوب فقد محفظته الخضراء الكاملة، ثم وجدها في جيب خليلته الخلفي؛ و جوي وقع في الحب مع فتاة، ولكن بمجرد خروجهم، كان على وشك أن يقذف: و جيسون طار على مظلة، وانتهى به الأمر بدون بدلة سباحة، لذلك، في أي وقت تذهب في أي إجازة، البقاء بعيدا وحذر من هذه الحالات.,473,2.621561050415039,3.3510007858276367,2.984549760818481
95959,Skateboards :],danny,9,أنا أركب قطعة من الخشب حول كل يوم,587,2.899143695831299,3.4782934188842773,3.3311784267425537
68121,chips and fish,daquan,9,تقريباً كل ما بعد الظهر آكل السمك و الرقائق كل مساء في الساعة السادسة آكل السمك مع الغمس,88,3.344954490661621,3.1129870414733887,3.2478864192962646
21966,Winter,darius,9,الجاكيتات مُغلقة، الشوكولاتة مُغطّاة، الشتاء هنا، لكن لا تخافوا، يمكننا اللعب في الثلج، وقد نحظي بعاهرة!,129,3.495286464691162,3.601153612136841,3.3658106327056885
108035,Skating,david,9,لقد تزلجت بالأمس ثم كل الفتيات قالوا مرحباً,51,3.337067127227783,3.185400009155273,3.2280967235565186
66860,Shark Poem,david,9,لأسماك القرش أنف حساسة. لأسماك القرش جلد لجعلهم يسبحون بسرعة. تستخدم أسماك القرش ذيلها لتسارع. ك لأسماك القرش قتلة الذين يبحثون عن الطعام. لأسماك القرش سباحة عظيمة سواء كان ذلك سرعتها أو استقرارها.,250,3.1102309226989746,3.1459403038024902,3.1940550804138184
94049,I&apos;m Strong.,dayna,9,أنا أعلم أنك كنت تعتقد أنني كنت ضعيفة أنا قوية أنا حصلت على ركلة بينما أنا أسفل وفي الليل أبكي في الليل أنا أبكي,376,2.2562267780303955,3.415369749069214,2.980355978012085
117457,Back to Our time,deasia raee,9,أريد أن أعود إلى الوقت الذي كنت فيه سعيدة بالوقت الذي لا يهم الوقت الذي أقع فيه في الحب الوقت الذي لم يكن فيه أحد يهم إلا أنت وأنا كنا مثل القمر والنجوم في السماء حيث كنا في حالة حب,609,3.1664681434631348,3.620120048522949,3.154719114303589
38659,Not Even close,debbie,9,هناك قطعة، قطعة تذهب إلى أحجية حياتي، أحجية عرضها مليون ميل، هذا اللغز الذي لا أستطيع وضعه معاً وحدي.,137,3.2688474655151367,3.3108012676239014,3.2345640659332275
116236,Snow,deedee,9,تُصبحُ a شتاء يَنْظرُ إلى كُلّ جماله يَتدفّقُ خلال النسيمِ الحياة قصيرةُ لكن الثلجِ الطويلِ جداً مثل a مليون ماس يُشرقُ هو الشيءُ الوحيدُ الذي أَحبُّه,197,4.040358066558838,3.6587073802948,3.3708107471466064
115678,As Days Pass,deepthi,9,كما تمر الأيام، يا إلهي! الناس يميلون إلى تغيير واحد كان دورنا ضدنا كأيام يمر يا إلهي لماذا يغير الناس ما يؤذوننا كثيراً عندما ينسوننا كأيام يمرون؟,538,2.4198293685913086,3.320576906204224,2.873817443847656
103692,New love,deja,9,عندما التقت عيني بعالمك، رأيت عالما جديدا. حصلنا على تعريف جديد للحب، يمكننا كلانا التدريس. لم نعرف أن الحب حلو جدا. بدونك قلبي لا ينبض. حبك فتح عيني لرؤية السماء اللانهائية. أنت لي ولك. هو شيء يبدو جديدا جدا. بدونك أيامي ستكون زرقاء إلى الأبد. حصلت على ما يكفي من الحب لك فقط. هذا الحب جديد جدا. الآن أنا أعرف لماذا أحلم بك. لأنك تجعل الحياة تستمر.,434,4.114671230316162,3.8084778785705566,3.394489288330078
111454,Her Heart.,dellene,9,(ب) أن يكون قلبها، قلبها، قلبها، قلبها، قلبها، قلبها، قلبها، قلبها، قلبها، قلبها، قلبها، قلبها، قلبها، قلبها، قلبها، قلبها، قلبها، قلبها، قلبها،,2211,2.537858486175537,3.45077919960022,2.951758861541748
111455,One Day Too Late.,dellene,9,هل سيكون هناك يوم لن أكون فيه ثانية في عينيك؟ هل سيكون هناك يوم لن أرى فيه مدى ألمك بي؟ هل سيكون هناك يوم ترى فيه دموع الدم يبكي قلبي؟ هل سيكون هناك يوم لن تكون متأخراً؟ هل سيكون هناك يوم أنا لست مجرد شخص ما، هل سيكون هناك يوم لن أكون فيه ثانية في عينيك؟ هل سيكون هناك يوم يوماً ما لن أرى فيه كم يؤلمك لي؟ هل سيكون هناك يوم سترى فيه دموع الدم في قلبي يبكي؟ هل سيكون هناك يوم يوماً ما لن تكون متأخراً؟,742,2.366847515106201,3.388844013214112,2.9355647563934326
111456,A Mother.,dellene,9,كل حياتي كنت أتساءل، أتساءل كيف يبدو الملاك الحارس، أتساءل عما إذا كان لدي ملاك حارس، أتساءل من الذي يتأكد من أني آمن، لقد صليت وأطلب من الله أن يريني، لا أستطيع أبداً أن أفهم لماذا لا يفهم، دائماً أفكر أنني لا أملك ملاكاً حارساً، حتى الآن، حتى اليوم ظننت أني لا أملك واحداً، كما أنا مستلقي على سريري جاء إلي للتو، أمي أنت ملاك حارسي، كنت دائماً ملاكي الحارس، تراقبني!,1175,3.3495235443115234,3.5071187019348145,3.181968688964844
111052,I Want Answers,delma,9,لقد سمعت أن الموت له معنى لما لا يفسره أحد هل يمكن أن تساعديني يا أمي. أريد إجابات مدفونة في أعماق رأسي. أريد إجابات مدفونة في أعماق رأسي... ... تماما مثل السرطان يشعرني مع الخوف... ...,396,2.3812079429626465,3.539928913116455,2.8558831214904785
84773,Lovely fire,delvon,9,نار جميلة، يمكن أن تكون زرقاء أو حمراء، حارة ليست باردة، إنها لُعبة نار بها، ويحترق جونا الخاص بك.,104,3.7303452491760254,3.429329395294189,3.34336519241333
100034,Daddys little girl,denilyn,9,أبي لا يهتم حقاً إن كنت سيئاً لكنه يهتم إن كنت حزيناً عندما أبكي هكذا هو يبكي,184,3.882447242736816,3.6634459495544434,3.351040363311768
87915,My Loveable Pet,dennis,9,قطتي ضخمة، قطتي كئيبة عندما أكون في المنزل، قطتي تأكل كثيراً، لكنّه وضعني مُرضياً أمام الطعام، قطتي غاضبة معظم الوقت، لكنّه لا يعضّ يدي أكثر من ذلك قطّتي كسولة، لكنّي دائماً ما أكاد أخطو عليه، لذا فهو حيوان محبوب.,274,3.2825655937194824,3.367194175720215,3.2520124912261963
112883,True love,deovano,9,في المرة الأولى التي قبلتك فيها، شعرت بأنني حيّة جداً، لأنّكِ سيّدتي الأولى، وهذه ليست كذبة. حبّنا قويّ جدّاً، حيث ننتمي.,673,3.7879621982574463,3.5737247467041016,3.326411962509156
113017,Love is for real,deovano,9,الحب الوحيد هناك لا يوجد حب فقط لا يوجد كره لحبنا,438,3.979607105255127,3.805942296981812,3.4251153469085693
26754,Why,devin,9,لماذا؟ لماذا تسأل لماذا؟ لماذا؟ لماذا؟ لماذا؟ لماذا؟,25,2.644309759140014,3.225369453430176,3.0758185386657715
93141,Wondered Love,devron,9,في بعض الأحيان اتسائل عنكم، فالأميراء لا يفكرون فيك، والأميراء فيك، والأميراء لا تفكرون فيك، والأميراء هي في السماء، والشعر الخاص بك هو ما أعشقه فيك، والشاطىء المالى هو البركة هي الطازجة هي الطازجة التي دائما ما تلبسها للامامام، والمهرج في الحفلات الكراهة في كل مكان بغض النظر عن المكان الذي تذهبون إليه كل توقفهم وتحدهم. والبحيرات الكريهة في المحيطات ثابتة سوف تحب صغير أو كبير، والمدرسة طويلة جداً، وشعرك,1067,3.654737949371338,3.5685477256774902,3.282611608505249
111458,1857,dheeraj,9,وكانت الأرض كلها حمراء من الكره بذبحة اليهود ، ولكن كل شيء ذهب سدى ، وجاء المزيد من الأوثان الدامية ، من أرض من فوق البحار .,147,2.220702171325684,3.317289590835572,2.9518282413482666
65116,A year Ago.,dia,9,يبدو لاحقاً قبل عام، الألم والحزن مجرد ذكرى الآن، غسل بعيداً هو كل دموعي. الضحك والابتسامة، هما مجرد حلم مسكون. ولكن يبدو الآن مرة أخرى كشبح منسي. من السخف كما قد يبدو أن مسحوقي في المستقبل يبدو مشرقاً بقدر ما يبدو أكثر. هواء من المؤامرات المشتعلة ولكن شرارة النار قد ذهبت منذ زمن بعيد. آمل أن القلب لا يزال ينتظر إحياء أغنيته. للأسف سيترك مرة أخرى مع لا شيء غير الأحلام يحلم به. الوقت سيتدفق ويتدفق بينما العاطفة تخرج نفسها.,538,2.837120294570923,3.3222732543945312,2.970003843307495
17532,Dah&apos;lin,diamondlover,9,(داهلين)، خذي قبلتك على اليد، لأن كل الفتيات يردن، أن تكون حقيقة، هو في الواقع مجرد ألماس، (داهلين)، لا تعرفين. لأن الماس هو أفضل صديق للفتاة، (داهلين)، لا تعرفين. لأنه بينما القبلة على اليد عاطفية جدا، الماس هو أفضل صديق للفتاة. إذا لم يكن لا يلمع، على الرغم من أن حبك ثمين جدا،,415,3.4779469966888428,3.3711931705474854,3.317920923233032
66858,Sharks,diana,9,إنّها مُضحكة، يُمكنها أن تجعلك تهرب، يا فتى، هل أنت في مأزق؟ إذا حاولت أن تدغدغ، لأنه إذا وضعتها في العين. ستخبر الشرطي بالكذبات حول كيف لم تلمسها. إنها فقط سمعت أصواتاً من البوق. الأصوات أنهت نومها. وأيقظت من الشعور باللؤم. أسماك القرش خطيرة. أسماك القرش مرحة. يمكن أن تكون خائنة. ويمكنها أن تجعلك تهرب.,414,2.6400225162506104,3.353032350540161,3.130329370498657
29015,Friends And I,dianne,9,بعض الناس الذين أحبهم وأثق بهم هم أصدقائي، لكن هذا واجب عليهم أن يساعدوني عندما أكون في الأسفل حقاً سوف يساعدوني في تحويل يومي حولهم أحياناً نتشاجر وسنتشاجر,461,3.552147626876831,3.4213929176330566,3.3049232959747314
38310,I AM,dimisha,9,أَنا a طير للطيرانِ؛ أَنا a زهرة تَنتظرُ الإزْهارَ؛ أَنا إلى صغيرِ جداً للمَشَيْك، أَنا a بنت تَكْبرُ إلى قريباً.,118,3.575806140899658,3.4008679389953613,3.278815507888794
40903,&apos;&apos;Promises&apos;&apos;,dina,9,لقد قلت لي أنك أحببتني ثم استيقظت وغادرت وكذبت وخدعت قلبي هزمته وثقت بك تماماً من كل قلبي,379,2.199212074279785,3.5569493770599365,2.976097822189331
120899,Bloody heaven(kashmir),divyanshi,9,في الشمال السماء تقيم بين دولتين حيث انقسامات الإنسانية تترك الثلج يسقط على وجهي نحن نقاتل من أجل شيء ليس لنا مثل هذا العار على الرغم من أن المشهد جميل,518,2.580972671508789,3.391901969909668,3.027864694595337
15742,Fluffy,dol,9,قطة كبيرة كبيرة قديمة ذات أنف أحمر كبير وقبعة تجلس على ثوبك تحدق فيك بعينيها الكبيرتين ذات اللون الأزرق,131,3.0780694484710693,3.1895885467529297,3.1321191787719727
15744,Sun,dol,9,نجمة ساطعة تتوهج في ضوء النهار السماء مغطاة بالظلام بمجرد أن يكون الليل,94,3.026309967041016,2.991040706634521,3.06323504447937
96030,My Teddy Bear  Came Alive,dominiuqe,9,استيقظت في أحد الأيام صباحًا دبي المحشو كان يتحدث عن أنه كان حيًا ففزعت! لقد صرخت في جريمة قتل صرخة,181,2.869814395904541,4.086296558380127,3.173202991485596
50656,Thoughts,don,9,الأفكار من عقلي ليست بالعقل بل الكراهية والشهوة تلتصق في ذهن ذلك النوع.,104,2.3879318237304688,3.4052634239196777,3.0711095333099365
64622,Autumn,donnerj,9,أرى الأوراق الملوّنة المختلفة، وأشم نسيم الخريف. أرى السماء تتغير، والسحب تُعيد ترتيبها. ألاحظ الطوق تحت أقدامي، والشمس بالكاد لديها أي حرارة. أسمع الطيور تهتز، وألاحظ أن الخريف قد أتى.,228,3.357434034347534,3.250727653503418,3.204033613204956
24478,Day by day,donovan,9,الصباح صباحاً قد وُلِدَ صباحاً صباحاً وظهر بعد ظهر النهار وقريباً بالليل وصل الوقت قد حان للاحتفال بالليل,120,3.4785757064819336,3.362945556640625,3.290514707565308
93176,The Sky,dorothy,9,السماء جميلة جداً، تتوهج حقاً بهدوء. النجوم كلها متحرّكة، مسالمة كما تتدفق الأنهار. القمر مشرق جداً جداً. كل هذا منظر جميل جداً! ثم، في الصباح، لا تزال غير مملة. مع الشمس تتألّق و تشرق دائماً. بينما تختفي النجوم على الجانب الآخر من الكرة. إنها فقط تأخذ أنفاسي بعيداً كما هناك على العشب الذي أضعه.,365,3.950974225997925,3.6483871936798096,3.294260025024414
110529,Model United Nations,drew,9,ذهبت في رحلة مع نموذج u. n. كنا مقيمين في واشنطن d. c. هناك التقيت بعض السادة المحترمين المحترمين جدا تمكن الطلاب الأكبر سنا من توجيه لي الحديث العام قد لا تكون مهارة قوية، ولكن رغبتي دفعتني إلى المغادرة على الرغم من أن الرحلة خلقت فاتورة عالية،,528,3.3742594718933105,3.2664833068847656,3.3170197010040283
115817,A true african,duduzile,9,أن تكون أفريقياً، ما يجعلك أفريقياً، ما الذي يجعلنا أفريقياً؟ إبداعنا، معرفتنا، الطريقة التي نلبس بها، الطريقة التي نتفوّه بها، والطريقة التي نتصرف بها. نحن الأفارقة تأتي من خط طويل من التاريخ، لكننا لن نتحول أبداً بوحشية لأننا نحن الخلائق القديمة وهذه الخلائق من المفترض أن تدوم. كوننا أفريكانية، ما هو رائع، أنيق، خليقتها، خليقة ماجيكية.,1015,3.78135347366333,3.5876235961914062,3.378016710281372
51646,The little dog,dustin,9,كان هناك كلب صغير أراد أن يكون كبيراً أكل الكثير من الطعام وأخيراً أصبح ضخماً,88,3.160795211791992,3.180027961730957,3.164973735809326
113063,Hunting,dylan,9,في الخارج في البرد المرير في الخريف صباحًا... .............................................................................................................................................................................................................................................................................................,371,3.021516799926758,3.4352283477783203,3.2148423194885254
105689,Car&apos;s,dylan,9,بعض السيارات سريعة، وبعضها بطيئ، وبعضها فاخر وبعضها يفعل كل شيء، وعندما تشتري سيارة يكون لديك الخيار الصعب للون.,146,3.3401992321014404,3.220673084259033,3.256993532180786
93821,Brilliant Whit Birch Trees,dylan,9,"Dylan m Oktober 28, 2008 wenglish 9, b2 شجرة بيضاء رائعة: هل اكتشفت الطريقة العلمية في يوم الماء؟ هل سارت إلى الحافلة من بابي الأمامي، نظرت إلى الضوء الرمادي، li file filed frame like frailed sky. كان ذلك اليوم هو يوم الماء، وهو اليوم الذي كنا ننفقه خارج المدرسة، ولم يكن بإمكان معلمينا أن يختاروا يوما أفضل لتمثيل مثال التهطال في دورة المياه. عندما كان في الحافلة، لاحظت عدد أكبر من المعلومات التي يمكن أن تساعد في تغيير",4049,3.194744110107422,3.1637723445892334,3.1991240978240967
87536,Love for the game,dylon,9,حبي للعبة وضع الآخرين للعار. أريد أن أرى اسمي على قميصي. الأوراق والحواسيب هي عرجاء. تسجيل سلة يتركهم في رحمة. لجعلها إلى المستوى الاحترافي هو حلم. مهمة شبه مستحيلة بالنسبة لي. إلى يوم واحد جعل ذلك في فريق محترف حقيقي. أريد أن أكون أفضل منه. أنا أقوى منه. أنا قوي مثل التمساح. أنا سريع مثل النمر الأسود. أريد أن أكون لاعب إن بي أي. لجعله يجب أن أكون أسرع. حلم مستحيل ممكن. الحلم على الأرجح غير محتمل.,508,3.333319187164306,3.4967312812805176,3.26460599899292
19482,Barns and Alleys,ed,9,صبي يجلس في كرسي بلا شيء ليكتبه، ومع ذلك يستمر في الخدش طوال الليل. يطير قلمه في رحلة لا نهاية لها، وملؤ عقله بالرعب؛ خاف. يحارب دماغه معركة لا نهاية لها. اليد اليسرى ثابتة كطائرة ورقية؛ اليد اليمنى مملوءة بألم يعض. على رؤيته تزحف.,635,2.41735315322876,3.421790361404419,2.8896822929382324
19156,Untitled,ed,9,هناك زقاق لا يسمع به إلا في الليل. عندما تذهب أضواء الشمس من البصر. تدق التي تقرع صوت ساعة جوفاء من المحنة. إنها زققة تأتي من العمق في نفسك. إنها تعني أنك حي ؛ حياتك على لفة ؛ تروسك طاحنة ؛ دوران مقبضها. إنها ساعة ، لكنك لا تستطيع قراءتها وترى متى تنتهي ، عندما تتوقف عن ذلك. أحيانا ، عندما تكون حزينا ، الصوت الموقوت يمكن أن يدفعك إلى الجنون. أحيانا ، عندما تكون صغيرا ، الدق يكون له لسان شوكي. أحيانا ، عندما تكون قديما ، تتحدث عن نهاية البرد. فقط تذكر ، عندما تخفق القرعة قلبك إلى نوبات وزوال ، يكون هناك جزء أكثر قسوة بكثير ، عندما تتوقف.,734,2.7489304542541504,3.275199174880981,3.043353319168091
19269,Nicotine Dreams,ed,9,كمان أبيض يحلم بسرطان. يدورون على براميل من نشوة، راقصات شيطانيات. حبات حب في شكل حمامات غير منقوشة على شكل ما تحلمين به.. بكاء دموع من الكآبة في الرحم، كنت كاذبة. جالسة ثعابين في أكوام من بريار؛ كنت قد حصلت على المفتاح، لماذا لا تجربين؟ هناك نداء على كفك من النقر النقري النقري النقر في بارد.,447,3.032464504241944,3.4777307510375977,3.160738229751587
19271,Untitled,ed,9,الظلام. عندما تُسحب الشمس تحت الأفق بيد غير مرئية تُدعى الوقت، فإن السواد سوداني يُغرق في المفترق. تبدأ الظلال بالتسرّب والنمو. تنهار كوابيس، ليس كثيراً في البداية، ثم تتدفق إلى الخارج من مجاميع كبيرة مثقلة بكتل من مخيلتنا. الظلام. الليل يسقط ويهمس في آذاننا. مع غطاء مسحوب والعالم البصري مخفي من النظر، شرور جديدة تفجر الشر في أدمغتنا. صرخات تنفجر من أفواه لم نكن نعلم بوجودها.,829,2.533252716064453,3.4241981506347656,2.952826023101806
16982,Why?,ed,9,مرحباً، اسمي هو الحب، لماذا تسألين، هل أحشر؟ لماذا، هل أنتِ متألمة؟ لماذا؟ لماذا، هل أضرب على قميصك؟ لماذا، هل أضيق و أضغط؟ لماذا، هل أقبض و أخنق؟ حسناً، صديقي (وأنتِ صديقتي)، أخبري، يمكنني، لكن في النهاية الرسالة ستكون أفضل إذا لم أنقر على الإرسال.,299,3.1195850372314453,3.5368142127990723,3.165088891983032
