id,title,author,grade,text,char,valence,arousal,dominance
38369,All About Me,alex,4,اسمي (أليكس) حسناً، لدي شعر أشقر لدي أخ صغير يزعجني في كل مكان، أمي في الخامسة والثلاثين، والدي في نفس الحالة، أنا في العاشرة من عمري، وأنا لست من السهل أن أزن 72 رطلاً,1152,3.1376852989196777,3.057593822479248,3.194891452789306
107316,WINTER,alex,4,يَصْبَحُ هُنَا يَوْطَانُ هُنَا يَوْطَانُ هُنَا يَوْطَنَا,56,3.1101293563842773,3.1815261840820312,3.175821542739868
120530,Tree and Me,alex,4,gt; مائل و رقيق مع الكثير لتعرفه ، و الأغطية و الإرتجاف في الثلج الشتوي البارد. لديه عائلة كبيرة معاً فقط ، لكن الناس سيعرفون أنهم لا يعيشون على إلى الأبد. قد تضحك قد تبكي ، ولكن لا تقول أبداً وداعاً الناس يقطعونك بالحزن و الحزن ، ولكن بعد ذلك تنتقل ليوم آخر غداً.,315,2.622225761413574,3.192154884338379,3.019084215164185
105382,See stars,alex,4,كانت الشمس حارة وكانت النجوم مخبأة ولكن النجوم ترى النجوم تشتعل كالنار مثل الشمس! عدت في ذلك اليوم بعد الظهر، لكنها اختفت، فقط النجوم في الليل السماء كانت هناك.,176,3.1983916759490967,3.566864490509033,3.103421449661255
24250,Basketball,alex,4,أنا ألعب كرة السلة كل يوم، إنها رياضتي المفضلة أحب الطريقة التي ترش بها إلى الطوق أحب صوت قفز الكرة,143,3.917189598083496,3.533832550048828,3.353827476501465
63040,Green Blob,alex,4,كان هناك بقع خضراء في الشارع، كان بها فقاعات، نقاط، وأقدام أرجوانية. بعض الأطفال التقطوها وسميها ببابي، هذا الفتى كان متكبراً جداً.,150,2.815259456634521,3.127661943435669,3.114230394363404
33130,Billy,alex,4,أتمنى لو أن (بيلي) كانت حبيبتي لأنني أحب ذلك عندما يبدو كمنتشي. هناك البدين الصيني واليباني. أكره السمين الحزين. و البدين السعيد يبدو مضحكاً مثل البدين. لا يوجد دمية أفضل من دمية (بيلي).,243,3.53779935836792,3.411503314971924,3.2716293334960938
33137,Dipsy Dopsy Doo,alex,4,"أبحرت (دودودووس) إلى جزيرة (ماجو) عندما قال (الروبوت) في الغراب (الغرابة) (يهو هولاند هوو هوو) ، (دوبي) هل سبحت الدوة إلى الشاطئ ، حيث رأى الطيور الدودودوو يسأل لماذا تعيشون هنا فقط؟) قال الدودووس ""لأننا أغبياء جداً لا نعرف كيف نطير"" ، القائد كان أصغر الطيور ، بعد خمسة أيام من حصول الدودوس على الانفلونزا ثم أبحر إلى بيرو.",425,2.7013099193573,3.128172874450684,3.0456762313842773
16051,Chad,alex,4,ذات مرة كان هناك فتى اسمه (شاد) الصغير الذي يعيش مع أمه ووالده كان لديه غرفة صغيرة,151,2.9160099029541016,2.886532783508301,3.127846002578736
14969,Fred,alex,4,ذات مرة كان هناك رجل يدعى (فريد) الذي كان ينام على سريره الكبير وجلس على برغوث,132,2.4195685386657715,3.1129815578460693,2.934013843536377
16362,Matt,alex,4,ذات مرّة كان هناك صبيّ يدعى (مات) كان لديه مضرب كبير جداً ضرب رأسه ثم ذهب للفراش ذلك الفتى المسكين تعلم ألا يستخدم مضرباً,133,2.463921546936035,3.1840415000915527,3.100468873977661
29811,Hahaha,alex,4,هاهاهاهاهاهاهاهاهاهاهاهاهاها هذه هي الطريقة التي تضحك بها أمي هاهاهاها,83,4.189178466796875,3.881402730941773,3.3689985275268555
104848,Pat and mat,alex,4,كانت دائماً مسطحة لم يسبق لهم أبداً أن قاموا بأي دورات لذا أصبحوا سمينين جداً وجلسوا على القطة هناك,130,2.733644962310791,2.9272990226745605,3.038865566253662
101533,W is for Winter,alex,4,لشتاء عيد الميلاد هو على طريقة قدوم الشتاء و أفضل عطلة,82,3.861243724822998,3.464383602142334,3.3919968605041504
43080,The Duck,alex,4,"عندما استيقظت في صباح أحد الأيام. كانت هناك بطة على رأسي. سألت: ""ما الذي تفعله هناك؟"" نظرت إلي وقالت لي: ""لا، لا، لا، لا تخرج من السرير"" ""أنا متعبة جداً كما ترون بوضوح، لذا عودوا إلى السرير واسمحوا لي أن أكون!"" ""أخرجوا من غرفتي أو سأركلكم في الرأس!"" ""أنا أتضور جوعاً جداً حتى أنكم سترحلون قريباً!""""",355,2.6756038665771484,3.6081771850585938,3.244734287261963
30008,Spring,alex,4,الربيع هو عظيم. الربيع يمكن أن يوقفك في مساراتك. فقط لرؤية العشب الأخضر الجميل الذي يرتفع تحت السماء الزرقاء.,157,3.997307538986206,3.519956588745117,3.3035783767700195
30005,Spring,alex,4,يَرْوَحُ يَوْمٌ مِنْ مَوْسِسٍ مِنْ أَفْضَلِ مَلَكَةٍ لِلْعِبَةِ ٱلْعَبْرِ يُمْكِنُكَ أَنْ تَلْعَبَ! في الأيامِ الحارَّةِ أنت يُمْكِنُ أَنْ تَذْهبَ إلى البركةِ. النسيم اللطيف يَشْعرُ بالعظمةِ عندما خارجكَ,312,4.00434684753418,3.616247177124024,3.3762948513031006
14096,When you where a baby,alex,4,عندما كنت طفلا، كنت تبكي كثيرا. كنت تقودنا للجنون عندما قلنا لك لا. كنت تصرخ وتصرخ في منتصف الليل. وبعض الجيران ظنوك كمنظر غريب. ولكن الآن أنت لست طفلا وأنت لست كذلك على الإطلاق إلا أنك تقودنا للجنون في مركز التسوق.,309,2.4607832431793213,3.430861473083496,3.108614206314087
63560,Trees trees,alex,4,اشجار اشجار اشجار مجيدة الاشجار كيف أنها تضع الكثير من الاوراق في فصل الخريف الربيع وأشجار الصيف تبرد في الشتاء,115,3.519289255142212,3.320463180541992,3.232088565826416
14205,SkinnyBones,alex,4,..................................................................................................................................................................................................................................................................................................................................,106,2.319355726242065,3.062838077545166,2.9455246925354004
14188,SkinnyBones,alex,4,2 - أنين، غير عظيمة، غير ناضجة، غير مكتملة، 4، حزينة، وحيدة، ملتقطة على 5.,87,2.2243921756744385,3.082072734832764,2.938615322113037
116357,HAIKU,alex,4,فأر صغير صغير كبنس يضرب ظهر سلحفاة قديمة,64,2.986345052719116,2.9539904594421387,3.1244266033172607
106904,Nintendo,alex,4,نينتيندو هو متعة ولعب في كل مكان. دسي، ويي، ps3، وbaceboy هو الكثير من المرح. لدي في الغالب كل شيء بنفسي. ولكن ليس مربع x وps.,143,3.888185501098633,3.499019145965576,3.371535539627075
106916,Diaper,alex,4,حفاضات الأطفال كريهة الرائحة جداً ومع ذلك مقرفة. إذا كان عليك تغيير الإجمالي. لا تلمسهم أو تضطر إلى العديد من الحفاضات.,126,2.4090914726257324,3.208415508270264,3.155148267745972
14057,A boy named It,alex,4,في وقت ما كان صبي اسمه يلعب وحيداً في حديقة. كان لديه صديق. أمه لم تحبه دائماً كانت تلعنه في وجهه. أراد أن لا يُكره. كان دائماً يُحكم عليه من خارجه وليس من داخله. كان لديه صديق لا يستخدمه حقاً. من المحزن جداً أنه يكره نفسه. أخلاقيات هذه القصة لا تحكم على الناس من الداخل,539,2.358526945114136,3.188118934631348,2.915351152420044
17598,Halloween true,alex,4,ذات يوم كنت أمشي على الهالووين ونظرت إلى الخلف رأيت مهرجاً صغيراً,154,2.4544382095336914,3.4842801094055176,2.968125581741333
17408,Crisco,alex,4,ذات مرّة كان هناك كلب اسمه (كريسكو) الذي أراد الذهاب إلى (سان فرانسيسكو),151,3.143430233001709,3.1715307235717773,3.189682722091675
69008,Cash,alex,4,- - - - - - - - - - - - - - - - - - - - - - - - - - - - - - - - - - - - - - - - - - - - - - - - - - - - - - - - - - - - - - - - - - - - - - - - - - - - -,39,3.6899876594543457,3.281381607055664,3.3450214862823486
32144,Who am I.....,alex,4,أنا شاعر، ولم أكن أعرف ذلك، أنا كاتب بدون أزهار. أنا فتاة، بدون لؤلؤة. أنا صبي، مع لعبة. أنا جاسوس، مع عين. أنا أنا أنا أنا، ليس كل شيء تراه!,190,3.090418577194214,3.223498821258545,3.276013135910034
92102,Harder than a brick.,alex,4,أصعب من حجر عالق في جدار، أصعب من باب مصنوع من الخشب، أصعب من لوح خشبي مكتوب عليه، أصعب من أرضية مصنوعة من خرسانة، أصعب من خزنة مصنوعة من معدن، أصعب من مضرب مصنوع من الألومنيوم، أصعب من الماس في كهف، هذا هو مدى صعوبة رأس إخواني.,316,2.64082932472229,3.290610313415528,3.065092086791992
48471,ALEXANDRA,alex,4,تفاح وغذاء تُركت وتُترك وتذهب وتذهب أشياء أخرى وشيء آخر آخر الأشعة السينية والصورة,73,2.85707426071167,2.8755078315734863,3.0755720138549805
117509,Basketball,alex,4,كرات كرة السلة، أطواق، نقاط، علامات، تدحرج، قَطْع، عبور، ذَهبَ يميناً مرّرْهم بالكرةِ، ثلاثة مؤشراتِ، حبّْ للعب كرةِ السلة، يَرْسى ويَجْعلُه، رمية خاطئة، يَفْقدُ أَو يَرْبحُ!,196,3.691272258758545,3.681265830993652,3.40671181678772
117497,Gum,alex,4,مضغ، نكهة، لزج، لزج، مضغ، إفتتاح، أكل نفخ فقاعة عالقة على فمي لزجة!,98,2.593536376953125,3.531963348388672,3.073631525039673
117493,Cold Winter,alex,4,الشتاء البارد، الرياح، الثلج، الثلج، التزحلق على الجليد، الطلاء، الرياح!,56,2.8986971378326416,3.452277183532715,3.137012004852295
117494,Spring,alex,4,حارة، أزهار، مزهرة، مركضة، راكبة، نحلة في كل مكان حولي مشتعلة!,66,3.624295711517334,3.786125659942627,3.315830707550049
99359,Swimming with tim,alex,4,أحب أن أسبح، مع (تيم)، (تيم) هو شخص يحب الفوز حتى أسمح له، الجميع يحب أن يضايقني لأنني أخسر دائماً، على الأقل أعرف كيف أربط حذائي!,168,3.435638904571533,3.416869163513184,3.303293466567993
90987,Tacky Hair Day,alex,4,لقد مررت بيوم سيء اليوم لأنه كان لدي يوم شعر مبتذل و جرح رأسي و جرح رأسي و جرح أنفي و جرحت كل أصابع قدمي المهتزة و بدأ كل شيء في ذلك الوقت في مدرستي القديمة,287,2.9842453002929688,3.6513288021087646,3.094945192337036
108653,The Ralfo,alex,4,عندما ترى الرافو و هو في سيارتك يصرخ فيو! انه يحب ان يأكل سيارتك! احذر! الرافو لديه عينك لكي يحب ان يأكل افخاذك. انه يأتي فقط في الليل و هو أحمر داكن. اذا مر به في بلدة صغيرة من الراي في حجرة صغيرة في حجرة خشبية صغيرة جدا imangine ذلك!!,283,2.7224104404449463,3.8113160133361816,3.2079312801361084
87770,Baseball,alex,4,مُرح بيسبول، مُثير، مُثير الركض، مُضرب، مُغازلة، مُطاردة ألعب أول قاعدة في الوقت الماضي لـ(أمريكا),119,3.708956718444824,3.444276571273804,3.3492374420166016
15943,I Am,alex,4,أنا فتى رياضي يحب الدببة، أتسأل كيف سيكون الأمر أن تكون محترفاً، أسمع الضربات القوية على اللاعبين، أرى المراوح المجنونة مطلية باللون البرتقالي والأزرق، أريد أن أرى الدببة تفوز بالوعاء الكبير، أنا فتى رياضي يحب الدببة، أتظاهر أني أنا روزفيلت كولفن ألتقط تمريرة، أشعر بالأدوات الحمقاء، ألمس المطبات على كرة القدم ذات الحجم المحترف، أنا قلق بشأن الفوز بالعربات، أنا أبكي عندما تخسر الدببة في المباريات، أنا فتى رياضي يحب الدببة. أنا أفهم أن الدببة لديها بعض الفصول السيئة، أقول أن الدببة تجعل التحدي يلعب في أوقات حاسمة، أحاول ألا أستمع للكلمات السيئة، آمل أن يكون موسماً مثالياً 16-0، أنا فتى رياضي يحب الدببة.,747,3.466104984283448,3.4677276611328125,3.284461259841919
18395,The Stork That Liked My Head,alex,4,عندما استيقظت في صباح أحد الأيام، كان هناك ستورك على رأسي. سألت 'ماذا تفعل هناك؟ نظرت في وجهي وقالت، 'أعتقد أن رأسك بدا لطيف جدا، كنت متأكدا من أنه لم يكن القمل،,251,3.3476381301879883,3.338917016983032,3.236733913421631
38365,I ONCE HAD A FRIEND,alex,4,ذات مرّة كان لديّ صديق سيسرق طعامي في حقيبتي كان لديّ صديق كان سريعاً في اللّكمة ذات مرّة كان لديّ صديق لم يكن رائعاً كان لديّ صديق كان مرحاً جداً,244,2.793501853942871,3.197091579437256,3.0721354484558105
100175,A bad day,alex,4,استيقظت في أحد الأيام عندما كان هناك ثعبان في سريري حاولت رميه من النافذة لكنه عضني على رأسي,251,2.236785650253296,3.505714178085327,2.925731420516968
90137,Wind,alex,4,رياح بشعري ريح في أذني ريح قوية جدا ريح قوية جدا ريح خفيفة ريح ريح نفخة ريح تشعر بالرضا قد لا تراها ولكن يمكنك الشعور بها,134,3.487847328186035,3.4290213584899902,3.2573511600494385
33647,Annoying Fleas,alex,4,عندما لم أستطع أن أعزف التشيلو، ولم يكن صوته مائلاً، نظرت إلى يدي، هناك جلست مجموعة من البراغيث تبحث عن كبير. حُشدت في برج، كم هي وقحة وحامضة. جعلتني أنزل تشيلو، الذي جعلني رجلاً مجنوناً. حتى تطير تلك البراغيث بعيداً، لن أرتاح طوال اليوم. بمجرد رحيلها، يمكنني أن أعزف أغنية عظيمة.,327,2.4879839420318604,3.438560009002685,3.1051018238067627
47371,School,alex,4,كُلّ شخص يَقُولُ بأنّه a أحمق. أعتقد هو مِنْ a بركة. هناك قاعدة غبية في مدرستنا. كُلّ شخص يَجِبُ أَنْ يَكُونَ عِنْدَهُ a مقعد. أخبرتُك مدرستُي a مكان مُهِرّ.,340,2.351634979248047,3.301818370819092,3.084465742111206
54081,Old man from Iraq,alex,4,كان هناك رجل عجوز من (العراق) يريد حقاً قطة سمينة الرجل أكل فأراً يدعى نفسه بـ (سلس) وهذا هو العجوز من (العراق),139,2.6600501537323,3.094233274459839,3.117064476013184
78734,The Silly Dog.,alex and austin.,4,لقد كان سخيفاً جداً اسمه كان (بيلي),68,2.658377170562744,3.194035053253174,3.05092453956604
27159,The Sleeping Bear and Me,alex and collin,4,"عندما استيقظت في أحد الأيام، دب نام على رأسي. سألت: ""ما الذي تفعله هناك؟"" نظر إلي وقال ""هل يمكنني استخدام سريرك؟"" 'لا، قد لا تستخدم سريري، أو رأسي!' قلت بعيدا جدا ذهب الشعور بالحزن وذهبت إلى السرير شعور سيئة. عندما استيقظت قفزت من سريري ودعا خارج نافذتي وقال. 'لا تذهب بعيدا أنا لست غاضبا' لذلك عاد يشعر بالفرح!",380,2.967396974563598,3.5793652534484863,3.094151735305786
97103,WATER,alex and daniel,4,ماء ماء ماء ماء ماء ماء ماء ماء ماء ماء ماء ماء ماء ماء ماء ماء ماء ماء ماء ماء ماء ماء ماء ماء ماء ماء ماء ماء ماء ماء ماء ماء ماء ماء ماء ماء ماء ماء ماء ماء ماء ماء ماء,118,2.832571268081665,3.1802070140838623,3.26540207862854
115067,To cool,alex&apos;&apos;avier,4,أن أذهب إلى المدرسة لكي أبرد أمي لرؤية أمي كي ترى معلمي,81,3.814379930496216,3.511777400970459,3.2893099784851074
106925,HOME SWEET HOME!!!!!!!!,alex/britney,4,و للحب الرسمي هو للأمهات و للتسلية هو للحب الحلو و هو لما تحبه أكثر و هو للإثارة و للخبرات و للكنوز في الحياة,291,4.000372409820557,3.6567611694335938,3.3314926624298096
27574,Ice Cream!,alexa,4,كل يوم في السادسة من كل يوم، آكل مثلجاتي مع عصا. كل مساء، أحب الآيس كريم مع لعق. في الثانية، آكل الآيس كريم مع حذاء. تقريباً كل يوم في الظهيرة، آكل الآيس كريم مع رجل. كل يوم في الثالثة من كل يوم، آكل الآيس كريم مع نحلة.,351,3.328472137451172,3.2185683250427246,3.292054891586304
23781,DUNCAN,alexa,4,سترة حمراء، عيون بنية. يحب عظمه كما يعزف، لكن عندما تلعب لا يعض، بينما يضرب الكرة. هو كلبي وأنا أحبه. (إلا عندما يكون مجنوناً).,172,3.651303768157959,3.451734066009521,3.3459455966949463
46592,The Sun,alexa,4,الشمس تشرق مشرقة الشمس تأتي ضوءاً... ربما تكون متعباً... لذا خذ قسطاً من الراحة إلى الليل... وفي الصباح التالي...,168,3.504286050796509,3.363180160522461,3.2848880290985107
40830,Birthday Party,alexa,4,إنه يومي، حان وقت اللعب، البالونات والهدايا والحلوى والكعك، ثم جاء جرس جرس الباب إلى الجميع هنا، نلعب طوال اليوم حتى يحين وقت العودة إلى المنزل، إنه يومي، حان وقت اللعب، البالونات، الهدايا، الحلوى، الكعكة,237,3.6510281562805176,3.428419589996338,3.3007757663726807
14239,Butter,alexa,4,لكن الزبدة كانت مرّةً جداً حتى أنّ (بينير) اشترت زبدة أفضل قليلاً,112,3.0433146953582764,2.9977598190307617,3.197787284851074
106198,cinderella,alexa,4,كانت لدى (سيندريلا) مظلة فقدت حذائها ولم تفعل الآن ما عليها فعله,72,2.336137533187866,3.142646074295044,2.7989718914031982
28546,My Favorite Foods,alexa,4,أطعمتي المفضلة هي البسكويت و الكعك الذي هي الأشياء التي تصنعها أمي أعلم أنك تعلم أنها الأفضل,177,3.926117420196533,3.517510414123535,3.3741018772125244
54686,I WISH JELLO WAS YELLOW,alexa,4,كيف ليت أن (جيلو) كان أصفر يجعلني حقاً أشعر بالشفقة لأنني عندما أفكر في (أصفر جلو) أريد أن أكون في الكيكين أصنع الأشياء أصفر,147,3.2308554649353027,3.474644899368286,3.229581594467163
28990,Colors,alexa,4,هو الأسود هو الحزن ظلام الأزرق المظلم هو اليوم الذي ريش من الجاي الأخضر هو العشب تنانير لكسر أصفر هو الشمس التي تحتها نجري الرمادي,348,3.166933536529541,3.173126697540283,3.1421916484832764
49009,Piggy things to eat,alexa,4,لدي خنزير يحب أن يأكل يأكله يأكل الدجاج الذي يأكله يأكله يأكل ما يأكله يأكل ما لا أختاره أبداً يأكل سجد,142,3.089381217956543,3.3252158164978027,3.2616448402404785
74002,Skating,alexa,4,التزحلق هو الشيء الخاص بي صديقي (غابي) يحب التزحلق على التزلج هو حقاً ممتع (ليسا) مدربي في التزحلق على التزلج على التزلج هو مدرب جيد جداً,131,4.005751132965088,3.496943712234497,3.342963695526123
16009,Dreaming,alexa,4,"اليوم انزلقت على المربى ولحم الخنزير وساندوتش ثم شعرت بالغثيان تماماً، ذهبت إلى السرير مع ضربة على رأسي. عندما استيقظت انزلقت على قطتي وفقدت رأسي. عندما استيقظت قلت لنفسي ""شكراً لله كان حلماً"".",222,2.464386224746704,3.4020438194274902,2.7940127849578857
58627,Running,alexa,4,تركض بهذه السرعة عبر حصان آخر يركض من قبل بعضهم البعض يجتازون صخرة و شجرة يمرون عبر بحيرة تسير على طولك تركض,181,2.8389666080474854,3.3564202785491943,3.085195779800415
58611,Horse,alexa,4,ننام مُنْعَمْنَنَّةً في حين تُرْكك الآخرين مِن بعدك ، في حين تُرْكك,70,2.463506937026977,2.992976665496826,2.861464023590088
77140,The Monster [that I sortof saw],alexa,4,وكان الوحش كبيرا ومخيفا وكان كبيرا وحاريا كان له كبير يقطّع الذي. ولما تحرك جعل صراخا... كان منظرا شاسعا. كان والداي يقولان فقط ليلة سعيدة.,194,3.551003217697144,3.8424458503723145,3.1879751682281494
77083,Soccer,alexa,4,كرة القدم ممتعة جداً، كرة القدم للجميع، كرة القدم للجميع، كرة القدم تركض وتلعب، كرة القدم لكل يوم، كرة القدم رائعة!,142,4.218162059783936,3.859916687011719,3.5027871131896973
77171,Little Me,alexa,4,أتمنى أن يرى الناس ما بداخلي، أنا صغيرة جداً وأنتِ كنتِ قادرة على رؤيتي، عندما ألعب أنا أصرخ بـ (هيف هوري) لكن الآن يمكن لأحد أن يسمعني، أيها الصغير!,181,3.2863831520080566,3.629118919372559,3.2493512630462646
31153,Sun,alexa,4,والشمس ممتعة، والشمس الخبيثة تسخن ولا تشرق أبداً، والشمس دائماً ستكون نقطة.,146,3.559974670410156,3.376697540283203,3.2436931133270264
15988,Soccer,alexa,4,كرة القدم رائعة للعبها. أنت تمرر أعلى و أسفل الملعب ثم أخيراً إذا كنت محظوظاً تسجل هدفاً. تشعر وكأنك تطفو عبر الملعب. إنه صعب لكنه ممتع.,172,3.922830581665039,3.6718599796295166,3.347342729568481
36997,School,alexadnra,4,المدرسة المدرسية يمكن أن تكون دائماً مصدر ألم بالنسبة لك قد تقع في النوم في الصف إنه مثل أن تكون في سلسلة في بعض الأحيان أنظر إلى الزجاج (نافذة) كثيراً ما أكتب الكثير من التعلم لكن المشاهدة تحرقه.,215,2.9192707538604736,3.298989772796631,3.0504775047302246
104483,I see you,alexander,4,أراكِ في المنتزه تأكلين بعض الفطائر في حديقة التزلج ورأيتكِ مع عربة حلوى تأكلين بعض الفطائر الحلوة,154,3.707432270050049,3.392329692840576,3.295491933822632
18328,Snakes,alexander,4,"عندما استيقظت في الصباح، كان هناك ثعبان على رأسي. سألت ""ما الذي تفعله هناك؟"" نظر إلي وقال: ""لقد دخلت بيتك وتسلقت على سريرك، وجلست على رأسك."" 'أنا أردت مكانا للنوم والأكل، وفكرت أن رأسك لا يمكن ضربه!' قلت للثعبان، أنا أخبز له كعكة جبنة إذا كان يستطيع أن ينزع نفسه من رأسي. فقال الثعبان، 'أنا أفعل أي شيء من أجل كعكة الجبن.' بعد أكل الجبنة حصلت الثعبان على ألم سيئ...",518,2.8790645599365234,3.5617871284484863,3.166038990020752
42726,Spring Break,alexander,4,لعب لعب لعب لعب لعب لعب لعبة اللعب على الجليد بدون العاب عمل,44,3.0425562858581543,2.8731205463409424,3.1636297702789307
