id,title,author,grade,text,char,valence,arousal,dominance
104987,I Love The Zoo,,1,الورود حمراء، البنفسج زرقاء أنا أحب الحديقة، أليس كذلك؟,62,3.782155513763428,3.3670382499694824,3.2775728702545166
67185,The scary forest.,,1,الغابة مسكونة حقاً، أعتقد أنها كذلك لكن بعد ذلك سنذهب للتخييم,87,2.792827844619751,3.1498241424560547,3.0690455436706543
103555,A Hike At School,1st grade-wh,1,أخذت نزهة في المدرسة اليوم وهذا هو ما رأيته يقفز كرات الفتيات الدردشة ضد الجدران الأطفال تسلق على بارات القردة حتى أنني رأيت بعض سيارات المعلمين 'الرياح كانت تهب شعري في وجهي رأيت بركة الوحل، ولكن فقط تتبع كل هذه الأشياء لاحظت للتو في نزهتي الصغيرة.,324,3.167750358581543,3.3023056983947754,3.1766536235809326
112483,Computer,a,1,يمكنك أن تفعل ما تريد يمكنك أن تلعب لعبة تلعب لعبة يمكنك أن تفعل أشياء كثيرة، يمكنك القراءة و الكتابة,106,3.477606773376465,3.2537190914154053,3.373314380645752
74516,Angel,aab,1,ملاك أو زاوية أنت تدور مثل ملاك أعلى الملاك أو ملاك لن تتوقف أبدا لا يمكنك أن تشعر بالهواء,164,3.598559856414795,3.8438332080841056,3.248240232467652
114693,Nature Nature and Nature,aadhya,1,انظر إلى الشمس، يا له من يوم جميل. تحت الأشجار، يمكننا أن نهرب ونلعب. جمال الطبيعة، نحب أن نراها، من حشرة صغيرة إلى شجرة غريبة. إنها مكان للجلوس والتفكير، الطبيعة والإنسان يتشاركان في أعمق صلة. الطبيعة لها محيط، وهو في الحركة. الطبيعة لها شجرة، الطبيعة لها نهر. إذا دمرنا الطبيعة التي لن نكون أحرارا أبدا. طبيعتنا تبقينا أحياء، يجب أن نحميها، لكي يزدهر المجتمع. نحن نفسد الطبيعة، نحن نفسد المستقبل. هيا مع الطبيعة، من أجل مستقبلك الأفضل.,491,3.619388341903688,3.381725311279297,3.330548048019409
46453,Jack,aaliyah,1,الكلب اللعوب، والنابض، والركض، والقفز، ومواجهة بلدي هو صديقي جاك,74,3.547236442565918,3.4499447345733643,3.304936647415161
57397,When I awoke one morning,aanna,1,"عندما استيقظت في صباح أحد الأيام، كان كلب على رأسي. سألت: ""ما الذي تفعله هناك؟"" نظر إلي وقال ""Wof!"" ""ألا تحب أن تكون بالخارج تلعب؟"" قال الرجل ""أنا أقيم هنا وألعب هنا."" قال الكلب الذي لعبه طوال الليل والنهار. دخل منزله الجديد ولعب داخل يوم رطب رطب.",325,3.166578769683838,3.4037539958953857,3.157470226287842
77201,My Blue Berries and  My Cherries,aarathi,1,ذهبت إلى شجرة توتتي الزرقاء لم يجدوا التوت الأزرق الذي وجدت أنني ذهبت إلى شجرة أخرى للحصول على بعض أكثر حرية ولكن لم يجدوا شيئاً سوى الكرز المستدير.,143,2.7250418663024902,2.9712209701538086,3.059244155883789
40520,A snowy day,ab.,1,وخرج الأطفال ليلعبوا في الثلج وقذفوا الكرات الثلجية وركبوا وزلقوا وجعلوا الثلج. ثم دخلوا ليشربوا شوكولاتة حارة دافئة. وكان يوماً مرحاً مثلجاً.,199,3.9233105182647705,3.47171688079834,3.3112905025482178
44943,Mac n&apos; cheese,abbey,1,أنا حقاً كسول حقاً أأكل مثل ما آكل دائماً أقول من فضلك,76,2.53799819946289,3.176530122756958,3.061232089996338
44939,Know your song,abbey,1,أعلم أن أغنيتك خاطئة، أعلم أن أغنيتك هي الحق في الإيمان بنفسك تأخذك في رحلة إلى أي مكان تريد أن تعرف أن أغنيتك خاطئة,232,3.4099156856536865,3.3336181640625,3.3726789951324463
83650,LADYBUG!,abby,1,رأيت سيدة حشرة، كان إسمها يقاضيها، لقد جربت الغراء، أخبرتها ألا تفعل ذلك.,75,2.778353452682495,3.134200096130371,3.1340582370758057
28360,How   I    Eat    Hotdogs,abby,1,تقريباً كل ما بعد الظهر، آكل النقانق على ملعقة. في كل مساء في الساعة السادسة، آكل النقانق المكدسة على الطوب كل يوم اثنين في الساعة الخامسة، آكل النقانق بينما أقود. في الساعة التاسعة، آكل النقانق حتى لو تجاوز وقت نومي. هكذا آكل النقانق كل يوم.,370,3.222961902618408,3.132664203643799,3.263188123703003
82912,Frends,abby,1,من الممتع أن تذهب هي إلى السطح لكن أنت منزعج مني أيضاً أتمنى أن تكون مني وداعاً!,94,3.887195110321045,3.737418413162232,3.318544626235962
105919,My Best Friend,abdu,1,أول أفضل صديق لي هو لطيف هي الأفضل. صديقتي المفضلة التالية هي (كايتي) اللطيفة التي أعطتني اختباراً. صديقتي المفضلة الثالثة هي (السانيا) اللطيفة التي سمحت لي بإستخدام ستنسلها. صديقتي المفضلة هي (نيفاه) السخيفة التي أعطتني قلماً.,247,3.931786775588989,3.458462953567505,3.299068212509156
119110,Lost in Love,abey,1,أنا هنا، أنا هنا، هنا في داخلي، هناك في مستقبلك كنت قد نظرت، طالت للأيام، لكن الليالي أطول، أطول من الأيام. الماضي حتى الآن، الذكريات طازجة جداً، أكثر طهارة من صديق، سمك مقلي. أنا هنا، أنا هناك لأنه لا يوجد شيء يمكن أن أقوله، من البقاء، البقاء إلى الأبد، وتركك لا تكون هناك أبداً ليس بعيداً، ولا قريباً جداً، لأنني سأكون سعيداً للجلوس،,627,3.505375385284424,3.4284863471984863,3.32350754737854
115461,Teddy bear,abhishek,1,سألتك هل تذهب إلى حديقة الحيوان؟ بعد سماع كلماتي مرتدياً حذاءاً. رأينا حيوانات رئيسية ولعبنا باللعبة. حصلت أنا و(تادي) على الكثير من الفرح. سألت (تادي) دعونا نعود إلى البيت، وإلا سنعضضض من قبل الموم. أجاب (تادي) انتظر إلى الجانب الخارجي. أجبرت (تادي) على السير معي، تقول أن الألم الخشن في ركبتي.,359,3.698000907897949,3.703201770782471,3.2695016860961914
104796,My  freind,abigail,1,أول أفضل صديق لي هو سباق حسّاس تحب أن تلمس الكثير. ثاني أفضل صديق لي هو الكلامي نيفاه ذهبت إلى بنسيلفانيا. ثالث أفضل صديق لي هو ماكر لويس يحاول أخذ قلمي. أفضل صديق لي هو الرياضيات أودايا حاولت أن تأخذ علمي. أعتقد أن لدي ما يكفي من الأصدقاء.,306,3.0693700313568115,3.1940019130706787,3.1787526607513428
30206,Hats,abigail,1,كيف أحب أن أرتدي قبعة، قبّعات صغيرة وصغيرة جداً، يمكن أن تكون ممتعة، يمكنهم الركض وارتداء قبعة.,134,3.823227643966675,3.513075828552246,3.3769710063934326
115234,Cat and rat,abigail,1,تطارد القطة فأراً على حصيرة، وتطارد الجرذان لكي تصبح سمينة.,63,2.7224907875061035,3.0938720703125,3.132397413253784
47958,What&apos;s Wrong,adam,1,أَنا اسمُي مَحْفرُ وجهُي أحمرُ وجهُ وجهي أحمرُ لا أَنا لَستُ ميتَ أنا فقط سَقطتُ مِنْ سريرِي,73,2.523477554321289,3.3622305393218994,2.9852511882781982
91722,Happiness,adam,1,السعادة، حسناً، السعادة، حسناً، حسناً، كل شخص نقوم به يأتي إلى الحياة، الحياة، الحياة. ما أقوله هو أنك تقوم به للقلب. ربما، أسهل قليلاً بالنسبة لك.,258,3.769135236740112,3.4651906490325928,3.3526418209075928
91965,Graduation Day,adam,1,الزهرة حمراء، الزهرة زرقاء، التخرج هنا، وأنت أيضاً! الزهرة زرقاء، الورود حمراء. التخرج هنا! لقد قيلت الأغنية!,148,3.842951774597168,3.677052974700928,3.378974199295044
91992,J-J-J-J-Duffyback,adam,1,(ج-ج-ج-ج-د-ج-تفيباك) (Jor-ji-jern-jerry-duffack) (Jour-ji-jern-jerry-duffack).,60,3.0654544830322266,2.8856070041656494,3.1465892791748047
92291,Cenical Calupalarry,adam,1,هذه الشخصية الصغيرة، تأتي من كل الطريق. من أوتاوا إلى برامبتون، من برتقالفيل إلى فكتوريا. بعيداً، بعيداً جداً، بعيداً جداً عن السفر، أووووووووووه!,178,3.6482255458831774,3.653842926025391,3.3226356506347656
84155,My Dog,adam,1,كلبي مضحك وسخيف وأحمق قليلاً لكلابي الأخرى و هو في ملعب كلبي,95,3.603094100952149,3.280603408813477,3.2215585708618164
112397,A kid in a box,aden,1,كان يحب ذلك الصندوق، وحصل على بعض الجوارب، لكنه أراد حيوان أليف بدلا من ذلك.,69,3.4060845375061035,3.25782322883606,3.2559587955474854
118713,A stork was on my head,adereon,1,عندما استيقظت في أحد صباح يوم ما، كان ستورك على رأسي سألت ما الذي تفعله هناك نظر إلي وقال أنني كنت أنام على رأسك,136,2.9388763904571533,3.3485260009765625,3.0525450706481934
62545,CATTY,aditya,1,لماذا أنت غاضب؟ (كاتي) قالت لي، أنا جائع، لكن إن أعطيتني سمكة...,142,2.964094877243042,3.274367332458496,3.21260929107666
98307,soccer,adrian,1,أنا أركض أنا أرفض ما تطلقينه عليكِ لكن إذا فشلتِ في تشغيلكِ أنتِ تمرّين تمرّين تمرّين تمرّين تمرّين تمرّين مرّ مرّة أصوّر ثمّ نحرز ربحنا في اللعبة مجدداً,99,3.454991340637207,3.407033443450928,3.397578954696656
98305,soccer,adrian,1,في كرة القدم التي تركضينها، تمررينها، تطلقين النار عليكِ، تربحين ابتسامة فزنا بها!,67,4.002994060516357,3.865715980529785,3.530251264572144
112420,The Cat In  My Clothes,adrianna,1,القطة في قبعتي. القطة في قميصي. القطة في ثوبي. القطة في سترتي. القطة في قوسي. القطة في حذائي القطة في حذائي,172,3.1828975677490234,2.993919610977173,3.230558156967163
28359,Gummy Worms,adrianne,1,تقريباً كل صباح عندما أستيقظ، آكل ديداناً مع كرة. في كل مرة أتناول الغداء، آكل الديدان مع النعناع.,249,3.3761115074157715,3.236433744430542,3.286621332168579
110819,Kindness,advaith,1,لا تغيّر رأيك، لا تكن جامحاً، كن طفلاً صالحاً,83,3.290488243103028,3.177982807159424,3.4284346103668213
86966,Home Alone Sick,ainsley and sophie,1,أنا سعال، أنا عطس، أنا في المنزل لوحدي مريض. لدي درجة حرارة هي 196. أنا أشاهد التلفاز، أنا أقرأ كتاباً. أنا أسعل بشدّة جداً في منزلي فقط مهزوز. أنا أشعر بالمرض الشديد، بدأت أرتجف. كنتِ تعتقدين أني حارة جداً لكنني بدأت أرتجف. أشعر كأني موزة في دمية. أفضل أن أشعر كأني دجاجة، لقد صدمت رأسي، أريد الذهاب إلى السرير. هذه هي النهاية يا صديقتي.,407,2.3929662704467773,3.368126392364502,2.938974142074585
112140,Jump,aissata,1,لا يمكنك القيام باللعبة التي لا يمكنك القيام بالاسم لكن يمكنني كتابة كلمة قفزة يمكنني القفز يمكنني القفز يمكنني القفز مع الفرح أستطيع قراءة,130,3.7150182723999023,3.721695899963379,3.4272735118865967
16699,Abc&apos;s,alessandro,1,"أحب هذا الـ "" جـيـكـلـمـانـوبـكـيـك "" و هـذا هـو الـرـستـوف الـعـظيـم و هـو الـوكسيـز الـبارـد",72,4.09495210647583,3.5145325660705566,3.315776824951172
107569,Fire,alex,1,النار حارة مثل الشمس و النقانق الساخنة التي خرجت للتو و شخص مجنون,90,2.651735544204712,3.671027421951294,3.2620604038238525
102613,My Turkey,alex,1,عندما استيقظت في صباح أحد الأيام كان الديك الرومي على رأسي. سألت، ما الذي تفعله هنا؟ نظر إلي وقال..,268,2.890988111495972,3.50679898262024,3.0802338123321533
44630,My Frog,alex,1,ضفدعي يعيش في مستنقع هل كان في السابق مُصاباً بالغثيان؟ لا، هذا صحيح، لقد كان مُغفلاً، يبدو مثل لون الفحم، وآمل ألا يسقط في حفرة! (إذاً أعتقد أن حيواني الأليف التالي سيكون مُجرّد مُجرّد مُخدّر).,213,2.8427953720092773,3.22310209274292,3.125451803207397
35706,Alex Pie,alex,1,أنا أحب الفطيرة، الفطيرة تحبني أن أتركهم جميعاً معاً وماذا ترى؟ فطيره اليكس!,97,3.7885046005249023,3.7563421726226807,3.411738634109497
93777,Dog on My Head,alexander,1,عندما استيقظت ذات يوم، كان كلب على رأسي. سألت ماذا تفعل هناك؟ لقد نظر إلي وقال. ذهبت للنوم على رأسك. أريدك أن تنزل من سريري. أريد أن أبقى معك. أنا آسف لأننا انتهينا.,227,2.592552661895752,3.35730242729187,2.9986913204193115
28794,Big Fat Liar,alexandra,1,مهلاً، أنا كاذب كبير، سأشعل النار في بنطالك وإذا صدقتني، من الأفضل أن تنظر وترى,106,2.191436290740967,3.792759418487549,3.5111899375915527
86880,Talking anamils,alexandra,1,عندما كان (آر) فأراً يتحدث، قلت له مرحباً، كيف، كيف، أنت، هل أنت، هل أنت؟ هل قال الجرذ، اسمي (راتي) ما هو اسمك؟ ثم رأيت قطاً يتحدث كان يرتدي قبعة زرقاء صغيرة. نظرت إليه، مرحباً قلت لك كيف حالك؟ أنا بخير بعد ذلك رأيت كلباً يتحدث، اسمي (بوب دوغي). عندما عدت إلى المنزل كل الحيوانات التي قابلتها,367,3.3581326007843018,3.2266504764556885,3.185308694839477
28345,How I Eat Cookies,alexandria,1,تقريباً كل ما بعد الظهر، آكل الكعك مع ملعقة. كل مساء في السادسة، آكل البسكويت المكدس على الطوب. كل يوم اثنين آكل البسكويت، على المسمار. كل يوم من الأيام أتناول البسكويت، على مسمار. كل يوم في النوم تماماً، أكل الكعك مع التوت الأحمر الأحمر الأحمر.,226,3.3115711212158203,3.205330848693848,3.264803171157837
87540,Sharing,alexandria,1,أنا لا أحب أن أشارك كتابي المفضل. أحب أن أشارك سيارتي الباربي. لا أحب أن أشارك ألعابي. أحب أن أشارك طباشيري. لا أحب أن أشارك تفاحة بلدي. أحب أن أشارك هذه الأشياء مع القدر وأختي.,225,2.989641666412353,3.0530765056610107,3.1795318126678467
104574,My life,alfikar,1,أحذاقي زرقاء أقدامي رائحة أقدامي رائحة مثل رائحة الغراء أحب لعب لعبة الحرب الحديثة 2 Warfarre 2,81,3.049892902374268,3.235059261322021,3.170518159866333
17906,The bad DAy,alfred,1,استيقظت في صباح واحد رمادي لم أستطع الخروج من السرير علمت أنه كان علي الذهاب إلى المدرسة لذا ذهبت إلى هناك بدلاً من ذلك في الرياضيات كان لدينا اختبار البوب,306,2.235236644744873,3.2586934566497803,2.858177423477173
19263,MY SPORT,alina,1,أنا أسير على يدي بدلاً من قدمي، وأأخذ فرامل حتى أستطيع الأكل. أنا أقوم بالعربات في كل مكان، أحياناً أهبط مع رطل. يجب أن أتحرك قبل أن أبدأ، بحيث عضلاتي لن تترافع. في الملعب أنا نجم، تتأرجح من بار إلى بار إلى بار. أنا أتقلب وأقلب على الأرض، حتى تألم ذراعي حقاً. أنا أمشي على العارضة، وأنا في الفريق. أنا أمارس رياضتي في صالة رياضية، ومدربي هو. إذا كنت لا تزال تتساءل ماذا أفعل، أنا أمارس الجمباز! ماذا عنك؟,490,3.2190840244293213,3.300673007965088,3.249195337295532
81924,Roses are Red,alisha,1,الورود حمراء، البنفسجيات زرقاء، أنت لطيفة، و(الكينسلي) كذلك.,67,3.6335606575012207,3.163022994995117,3.245957851409912
95925,The  three little pigs,alivia,1,ثلاثة خنازير صغيرة كان لديها باروكات وأحبوا أن يأكلوا التين وعاشوا في منزل مصنوع من الأغصان,104,3.10439395904541,2.980912208557129,3.1766865253448486
24287,Dancing,allison,1,أسمع الموسيقى في أذني، أشعر بالموسيقى في قدمي، لا أستطيع بعد الآن الجلوس في مقعدي. حتى أذهب على أحد أصابع قدمي. أرى لي، أرى لي هنا أذهب. أنا أدور، أدور على المسرح. أنا أقفز وأدور حتى النهاية!,218,3.39896559715271,3.678035497665405,3.326984643936157
89931,Daffodils,allison,1,أَحْبُّ أَنا أَحْبُّ أَنا أَنا أَحْبُّ أَنْفُولَسَ أَبْطَلُ أبيضَ كمركز ثلجِ برتقالي كa تزحلق يَبْدو مثل a بوق أَحْبُّ a يَحْبُّ a يَحْبُّ أَحْبُّ أَنْفُولَ.,127,3.603671073913574,3.1646928787231445,3.2323920726776123
118910,NATURAL AFFECTION,alok,1,يا أيها الذين صدَّقوا الله ورسوله وعملوا بشرعه ، أحسنوا في كل مكان دينًا من المحبة ، واصبروا على طاعة الله ، واغفروا له ، واعملوا على إحسانه ، واعملوا على إحسانه ، واعملوا على إحسانه ، واعملوا على إحسانه ، واعملوا على إحسانه ، واعملوا على إحسانه ، واعملوا على إحسانه ، واعملوا على إحسانه ، واعملوا على إحسانه ، واعملوا بما فيه خيره ، واعملوا على إحسانه ، واعملوا بما فيه خيره ، واعملوا بما فيه خيره ، واعملوا على إحسانهتمامه .,543,3.5675830841064453,3.341511011123657,3.3312442302703857
120103,A Week of joy,aman,1,يوم الاثنين للإجتماع، لكن يوم الثلاثاء للكلام! يوم الأربعاء للانتظار. ولكن يوم الثلاثاء للتفكير. يوم الجمعة للصيد، ولكن يوم السبت للجلوس فقط! يوم الأحد للشمس، مع الجميع التمتع!,360,3.5151376724243164,3.4448630809783936,3.25730299949646
109490,Thunder,amanda,1,"""الرعد هو الرعد"" ""الرعد المظلم"" ""يجعلك تقفز""",57,2.7753913402557373,3.623670339584351,3.0010228157043457
28353,There&apos;s a tiger on my head,amanda,1,"عندما استيقظت في ليلة واحدة، كان التايجر على رأسي. سألت، ""ماذا تفعل هناك؟"" نظر إلي وقال..",226,2.6827523708343506,3.634644985198975,3.150238275527954
27197,French Dancer,amandeep,1,ذات مرة قابلت فتاة من رانق أحبت الرقص كل يوم لكن عندما فعلت آذيت طفلاً تلك الفتاة الغريبة,132,2.4346039295196533,3.597128391265869,3.07978892326355
84156,Cat,amaya,1,قطتي سيئة، قطتي قطتي قطتي قطتي قطتي قطتي قطتي قطتي قطتي قطتي,157,2.180513381958008,3.3427700996398926,2.981640100479126
23079,THE BALL,amber,1,كان لديّ كرة كانت صغيرة تسلقت الجدار وخرجت منه,69,3.106450319290161,3.104166507720948,3.1720964908599854
105813,A  Spider Is  on  my head.,amber,1,عندما استيقظت ذات يوم، كان العنكبوت على رأسي. سألته ماذا كان يفعل وقال جالساً على رأسك.,118,2.758967638015747,3.2615816593170166,3.007037401199341
90326,The Monkey,amber,1,عندما كنت مستيقظاً في أحد الأيام صباحاً كان هناك قرد على رأسي سألت ما الذي تفعله هناك نظر إلي وقال لديك رأس كبير لماذا تتحدث معي,203,2.814875602722168,3.4218990802764893,3.1736044883728027
116805,O GOD O GOD,ambuj,1,يا الله يا الله أنت أبي، أنا طفلك الصغير، أعطني حبك، أرني نورك، لأتبع الطريق، إلى الخيرات، والأمور الصحيحة، صلاتنا، إلهنا العزيز يقول، لكل النعمة، يوما بعد يوم، لأجل تلك السماء، لأجل الشمس والمطر، للطعام والشراب، لكل واحد.,300,3.878341436386109,3.5618321895599365,3.2821950912475586
47117,My day,amelia,1,عندما استيقظت من نومي، كنت أعد بعض الأغنام، عندما نزلت إلى الطابق السفلي حصلت على القليل من المتعة، عندما وصلت إلى طاولة الإفطار، كنت أتناول علاجي!,160,3.880366563796997,3.775271892547608,3.4252779483795166
46605,My Day,amelia,1,عندما استيقظت من نومي، كنت أعد بعض الأغنام، عندما ذهبت إلى الطابق السفلي، حصلت على القليل من المتعة، ولكن عندما وصلت إلى طاولة الإفطار، كنت أكل علاجي! عندما ذهبت إلى متجر، كان كل شيء رخيص!,210,3.707502841949463,3.688677549362183,3.39597225189209
47132,My day,amelia,1,عندما استيقظت من نومي، كنت أعد بعض الأغنام، عندما نزلت إلى الأسفل حصلت على القليل من المتعة، عندما وصلت إلى طاولة الإفطار، كنت أتناول علاجي! عندما ذهبت إلى متجر، كل شيء كان تشيب! عندما عدت إلى النوم، كنت أعد بعض الخراف.,262,3.815660953521729,3.745352029800415,3.397390127182007
18503,Sunshine,amelia,1,"""أشعة الشمس في الصباح"" ""أشعة الشمس في المساء"" ""أشعة شمسي""",66,3.952655553817749,3.763742685317993,3.310065031051636
24471,Away we go,amy,1,نَذْهبُ إلى الحقولِ في السماءِ نَصْعدُ أعلى وأعلى حتى نحن يُمْكِنُ أَنْ نَرى الناسَ مثل النملِ فقط بعيداً نحن نَذْهبُ نحن طيورَ,129,3.0760231018066406,3.1274445056915283,3.153004646301269
115238,SPRING COMES,amy,1,يخرج الربيع ويفتح الأزهار يتساقط المطر ويرفرف,76,3.643198966979981,3.3519206047058105,3.215801477432251
34439,Hi,ana,1,صديق مُحَقْق,15,3.3274712562561035,2.98507046699524,3.168566942214966
115665,A pen in the pen stand,ananya,1,قلم في كشك القلم كان مُقَرَّسًا. القلم كَسرَ. والقلم كَسرَ ساقَه.,82,2.4844236373901367,3.2181930541992188,2.8963308334350586
72959,The Little Fortune Teller,anastasia,1,ذات يوم كنت جالساً تحت شجرة تفاحتي و طير صغير قال لي أرى المستقبل و مستقبلك صحيح,240,3.425438165664673,3.485623836517334,3.343993186950684
119586,Role Around,andrew,1,"عندما كنت مستيقظاً في صباح واحد وكانت الكرة على رأسي. سألت: ""ما الذي تفعله هناك؟"" نظرت إليّ وقالت: ""تدحرج فقط."" لماذا تتدحرج؟ لتجد طريقي في الأرجاء. لتجد طريقك حول ماذا؟ لتجد طريقاً حول رأسك. لماذا لا تقوم بدور حول رأسي بدلاً من الدوران فوق رأسي؟ لن يكون هناك مرح في ذلك!",361,2.647010326385498,3.429197311401367,3.077144861221313
105287,Reading and Math,andrew,1,أحب أن أقرأ (غارفيلد) لأنها مضحكة أكثر شيء مضحك أكثر هو الرياضيات لأنني أحب التعدد,107,3.712907075881958,3.374692440032959,3.312103033065796
48991,Fox,andy,1,ذهبت للصيد في الليل المظلم لأحضر الطعام لعائلتي وطاردني تمساح بري و فيل أيضاً,191,3.800134897232056,3.712723731994629,3.364783525466919
