id,title,author,grade,text,char,valence,arousal,dominance
76666,The Game,donovan,1,في يوم ما بدأت ألعب لعبة. كانت تنطوي على الكثير من الأسماء. لم تكن كلها متشابهة. لأنها كانت في إطار صورة.,134,2.8603992462158203,3.013858795166016,3.06600022315979
29597,Acrostic,dontaesha,1,دمية تُطِعُ دميةً تُطِعُ إِطَاعَةً إِطَاعَةً إِطَاعَةً إِطَاعَةً إِطَاعَةً أُمِّي لَمَا يَكُونُ كَثِيرَ مِنَ ٱلْكَثِيرِ مِنَ ٱلْكَثِيرِ تَأْكلُ كَثِيرَ كَثِيرًا مُسْجِدًا جَيِدًا جِدًّا جِدًّا,70,3.898347139358521,3.383462429046631,3.29508900642395
58406,beach,drake,1,الماء هو أزرق الماء هو أزرق هو مرح الرمل هو بني بني الشاطئ مثل a بحيرة,74,3.929489850997925,3.4330759048461914,3.289973497390747
16583,Boats poem,drew,1,القوارب هي قوارب عظيمة تأخذك إلى أماكن لهذا السبب أحب القوارب,64,3.865931034088135,3.420094013214112,3.3953399658203125
16808,A  chree      pom.,drew,1,أنا سعيد أنني أحب تسلق الأشجار أحب التأرجح على الأشجار,82,4.101836204528809,3.518465518951416,3.2812693119049072
112422,My crazy brother,drew,1,أخي مجنون في الليل يسقط من سريره يأكل البيتزا بالعكس يقول كلمات مجنونة يدور مثل الباليه,125,2.8903398513793945,3.4300432205200195,3.0808098316192627
112402,A Kid in a Box,drew,1,طفل في صندوق له ثعلب. ذلك الثعل كان له ثور. وتلك الثورة كان لها بعض الجوارب والجورب لم يكن.,103,2.9467787742614746,2.989462375640869,3.170578718185425
74179,Animals,drew,1,حيواني المفضّل هو خروف، لديّ سمكة، أحبّ سمكتي، رأيت حمار وحشي في حديقة الحيوان، إنّه أسود وأبيض.,121,3.6186811923980713,3.304240703582764,3.285416603088379
43669,Ham,drew,1,في الليل في سريري، آكل لحم الخنزير مع قطتي بعد المدرسة على سطحي آكل لحم الخنزير مع أخي,102,3.240757942199707,3.196184635162353,3.2451412677764893
81237,balls,drew,1,هناك مثل رواد الفضاء يقفزون على القمر مثل عجلات تتدحرج مثل الأرانب الأرانب,92,3.175642251968384,3.2119712829589844,3.144329309463501
81488,the gym,drew,1,الصّنادية الجمنازات الرياضية الأرضية,74,3.0969014167785645,2.9813122749328613,3.1810085773468018
28346,Snake on My Head,duane,1,"عندما استيقظت بعد ظهر أحد الأيام، ثعبان كان على رأسي. سألته: ""ما الذي تفعله هناك؟""؟ نظر إليّ وقال...",201,3.077080249786377,3.755914688110352,3.251878023147583
42519,Apple,dumb,1,التفاح جيد لك!,60,3.932661056518554,3.7107667922973633,3.4340615272521973
47155,The Stairs of Terror,dylan,1,لقد انتظرتني. بينما انتظرت في الصف لذلك. بقيت العصبية حتى التصقت بها. ثم بدأنا في الصعود. وصلنا إلى الأعلى، حيث ارتفعت الضربة. جلست خائفاً كما يمكن، وسقطت العربة بسرعة وأسرع. الرياح انفجرت في وجهي، وفجرتني من مقعدي. ثم انتهت التجربة.,338,2.6692519187927246,3.451653480529785,2.890330076217652
16617,Books,dylan,1,"""الكتب تُمَرّ بقراءة الكتب"" ""الكتب تُحب أن تكون الكتب مرحاً مرحاً مرحاً""",95,4.2111897468566895,3.638736486434937,3.408480644226074
17077,My  dog   chester,dylan,1,من هو الذي يلعق وجهي؟ من هو الذي يطرد يدي منه.,94,2.6046857833862305,3.2812743186950684,3.1297640800476074
116975,The liqued with eyes,eden,1,ذهبت لأحضر مشروباً لكن فجأة رأيت عيناً كانت تنظر إليّ كانت ترمش و تحدق بي,132,2.433778047561645,3.732041597366333,2.8591554164886475
31659,Butterfly Garden,eileen,1,هنا تأتي فراشة واحدة، تحت شجرة، تنظر إلى عينيها، سعيدة بقدر ما يمكن!,89,4.151009559631348,3.7621123790740967,3.3938305377960205
84503,Isolated and alone,eleanor,1,لا يمكن لأحد أن يعرف أن ما هو غير عذب، وأنه من الصعب أن يتحمل ولا يمكن لأحد أن يرى، الألم الذي أحمله داخلي، ويتساءل معلموّي لكنهم لا يقولون، بدلاً من ذلك، يراقبونني، طوال اليوم، بسبب الكرب الذي حُبس بعيداً، لم يرغب الكثير في أن أبقى، وقفت في الزاوية وشاهدت الناس يذهبون، كانوا سعداء ويضحكون بينما كنت أريد أن أبكي، مع عبء الخوف المحترق،,1935,2.4104132652282715,3.3502657413482666,2.8967316150665283
103524,flags,eli,1,إنّها 50 نجمة لـ 50 إحصاء,54,3.263664960861206,3.088137626647949,3.231252908706665
83656,I  Drew,eli,1,رسمت كلبا طار مع الريح وسقط على ضفدع,59,2.999602794647217,3.0561914443969727,3.1077706813812256
76665,My Need to Read,eliza,1,أريد أن أقرأ عن بذرة ثم سأكتب دليلاً عظيماً جداً,68,3.497711181640625,3.318427085876465,3.389906406402588
51227,My Pumpkins,elizabeth,1,اليقطين بيضاء اليقطين البيضاء هي صفراء لكن الآن يهم ماذا ستكون دائما الألغام حتى لو كانت قبيحة,108,3.1431005001068115,3.1000349521636963,3.2751123905181885
94693,Snowflake,ella,1,السترات التي تبقيك دافئاً وضحكاً جديداً في الداخل، البوم تصيح، الرياح لطيفة ورائعة، طقس رائع، بحيرات مجمدة معاً، كل شيء هادئ جداً، تقبّل أطفالك ليلة سعيدة، متلهّف أننا سنلعب في الثلج غداً!,221,3.945635318756104,3.694643974304199,3.3623287677764893
95284,Winters Day,ella,1,أَنْ أَقُولَ بأنّني سَأَحبُّك إلى هذا اليومِ.,140,4.308239459991455,3.820019245147705,3.3614256381988525
105829,When I woke up,ella,1,"ذات صباح كان لدي ضفدع على رأسي، قلت ""لماذا أنت على رأسي؟"" قال لأنك في سريري ""نظرت حولي ووجدت نفسي في سريره وكان على رأسي.",179,2.8201472759246826,3.467856407165528,3.03690767288208
113148,The butterfly and the bee,ellie-rose,1,فراشة ذهبت للعثور على نحلة النحلة ذهبت للعثور على الفراشة وهذا ما تسميه فراشة ونحلة!,125,3.4611704349517822,3.596604347229004,3.328299760818481
97047,Bears,ellis,1,الدببة السوداء تأكل كثيراً الدببة السوداء تصطاد السمك والمكسرات الدببة السوداء تحب السباحة,87,3.156008720397949,3.0515947341918945,3.188241481781006
42014,The Snake,elly,1,كان هناك ثعبان يعيش في بحيرة ويحب أن يأخذ قيلولة كان يحب أن يهتز ويحب أن يخبز,135,3.094688415527344,3.005305767059326,3.1045312881469727
42013,The Dog,elly,1,كان هناك كلب كان لديه ضفدع، ركض إلى سجلّ، كان يحبّ الركض وكان يحبّ خنزيراً.,99,3.46845817565918,3.407121658325196,3.186755895614624
103385,the things i like to do,emilio,1,أنا سعيد جداً أن أكون مُرتفعة جداً أحب أن أقوم بواجباتي وأحب أن تكون النهاية لأصدقائي,79,4.03229570388794,3.48120641708374,3.3678019046783447
32348,MY  MOM,emily,1,من الصعب إعادة فهم اسمها لكن أراها عندما أستيقظ يخبرني أن أنهض للمدرسة وأحبها,146,3.765461444854736,3.5693016052246094,3.3179361820220947
82925,Spring flowers,emily,1,أزهار الربيع هي حمراء و زرقاء و خضراء و وردية و رائحتها جيدة أيضاً,83,3.9149045944213854,3.4178683757781982,3.28396987915039
90510,pokemon,emily,1,يمكن أن يتحول النكهة إلى أنواع عديدة من الحيوانات. يمكنك أن تقاتل بفريند الخاص بك. كزمون هو بارد!,99,3.814997673034668,3.600025177001953,3.3646371364593506
105027,Almost Every...,emma,1,تقريباً كل ما بعد الظهر آكل الفطائر مع شرنقة يرقة في السابعة أتناول في الجنة مع ليمونة لأنها ممتعة جداً في السابعة,146,3.9607088565826416,3.65368390083313,3.3408939838409424
119318,The Bird Flew Away,emma,1,"عندما استيقظت في أحد الأيام كان طائر على رأسي. سألت: ""ماذا تفعل هناك؟"" نظر إلي وقال: ""مرحبا كيف حالك؟"" ""مرحبا كيف حالك؟"" طار الطائر بعيداً، احتاج بعض الطعام ليومه.",218,3.064122676849365,3.29272985458374,3.079885959625244
94061,A Dog was on my Head,emma,1,"عندما استيقظت ذات صباح، كان كلب على رأسي. سألت، ""ماذا تفعل هناك؟"" نظر إلي وقال. أنا على سريرك لأنني بحاجة إلى التمرين على رأسك ولن يستغرق وقتا طويلا.",199,3.094752788543701,3.287184476852417,3.2192752361297607
99725,Joe Blue,emma,1,لقد كان طياراً وصديقاً جيداً مع (تشارلي) و(ماري جاين) كان رأسه مستقيماً وتغيّر العالم كله وأصدقاؤه لم يكونوا متشابهين فقط أعطوني خمس دقائق وسأكون على ما يرام,790,2.83042049407959,3.242058277130127,3.021535873413086
97069,Silver Moonlight,emma,1,أنظر للأعلى لأرى النجوم، أنظر للأسفل لرؤية البحر، لا أستطيع أن أرى بقدر ما هو المريخ لكن هذا جيد بالنسبة لي. أستطيع أن أرى ضوء القمر الفضي، يتوهج عندما يكون حزيناً، إنه يفهم مشاكلي، لكنه يطاردني عندما يكون سيئاً!,215,3.307794570922852,3.384275436401367,3.175410985946656
55169,The Snake,emma,1,ثعبان، ثعبان، خذ كل ما تحتاجه، سيعضنا، لكنه مزيف فقط,93,2.541135787963867,3.791201591491699,3.179119348526001
55215,When is your Birthday?,emma,1,عندما يكون عيد ميلادك؟ إن عيد ميلادي في جون، و عيد ميلادي في يوليو، و هو قادم قريباً، و عيد ميلادي في المباركة و المباركة، و ربما، ولكن عليّ أن أتأكد من أنه بعيد عن الطريق.,169,3.2292871475219727,3.186262607574463,3.224117994308472
55170,EASTER,emma,1,اختبئ بعض البيض الذي يمكنك العثور عليه بساقيك أو برأسك أو بشعرك لكن تأكد من أنك لا تجد دباً,152,3.4019885063171387,3.618070602416992,3.411821126937866
119316,The mouse in my house,emme,1,عندما استيقظت في أحد الأيام عندما كان فأر في منزلي سألته ما الذي تفعله قال أني أبحث عن (فريد) من هو (فريد)؟ قلت أنه صديقي لن ينتهي أبداً,167,2.840273857116699,3.4207653999328613,3.076135873794556
47464,Chicken,eric,1,أنا أحب الدجاج,17,3.357682704925537,3.133052110671997,3.2641079425811768
98968,bees,erica,1,النحل المزدحم، هنا وهناك، النحل المزدحم في كل مكان!,49,3.5284056663513184,3.631303071975708,3.33122181892395
106484,I Eat Strawberries,erica,1,تقريباً كل ما بعد الظهر، آكل الفراولة مع ملعقة كل مساء في تمام الخامسة، آكل الفراولة عندما أقود!,121,3.720555305480957,3.721181869506836,3.441599130630493
20404,All About A Cat,ernest,1,كل شيء عن القطة هو مجرد أنها صغيرة طويلة و سمينة أيضا كسولة حزينة مع قبعة هم شجعان عندما يتعلق الأمر بالجرذان السمينة الكبيرة... ... هم مجانين وخائفون عندما يتعلق الأمر بالمضرب... ...,296,2.7467079162597656,3.1480250358581543,3.088160276412964
114125,The Frog and the Hog,esme,1,كان هناك ضفدع جالس على سجل. خنزير جالس على سجل. الخنزير والضفدع قفزا على نفس السجل. ثم جاء على طول كلب. الكلب طارد الضفدع والخنزير.,156,2.8491311073303223,3.173875331878662,3.0833969116210938
40323,The Stork,ethan,1,"عندما استيقظت في صباح يوم من الأيام، كان ستورك على رأسي. سألت: ""ما الذي تفعله هناك؟"" نظر إلي وقال: ""سأعيدك إلى أمك."" ثم قلت ""مستحيل!"" فقال: ""أين أخوك؟"" قلت: ""عود في يوم آخر!""",251,2.669328689575196,3.686034202575684,3.1469926834106445
60219,The Ginger Bread Boy,eva,1,إنه ذكي ولطيف إنه فتى صغير جداً وصغير جداً جداً أيضاً,402,3.6616811752319336,3.5944743156433105,3.3426454067230225
29881,SNOOP    DOG,evy,1,إنه صاخب جداً كل ليلة لا يتوقف عن النباح كيف سأنام؟,108,2.3868539333343506,3.3575563430786133,2.9495975971221924
117539,The Life And The World.,faisal,1,في الوقت الذي لا نهتم فيه، ننسى ما نخافه. كان من الأفضل أن نساعد الفقراء، لكننا ننجس كل ساعة. كان من الأفضل أن نساعد المحتاجين، ولكننا نميل إلى أن نكون جشعين. كان من الأفضل أن نتذكر الإله، ولكن علينا أن نثني على الإحتيال. علينا جميعا أن نغادر وأن نواجه خطر الموت، ولكن أولئك الذين سينجحون هم العظماء. في سباق العالم المادي، أصبحت حياة الناس ملتفة. على الرغم من حقيقة ترسيم اللون والمذهب، لا يزال الرب يصنع الغذاء. الركض نحو السماء والجحيم، بدأ الإنسان دينه للبيع. لا مزيد من الفضاء للأبناء المتروكين الآن هنا، التفكير في الخطايا في كل مكان. العالم ليس سوى ميدان للصلاة، لكننا ننسى الخالق يوما بعد يوم. لا شيء يمكن أن نتعافى، كما أن بركات الله في كل مكان.,857,2.768909454345703,3.1578688621521,3.0872323513031006
51642,Hi,fat,1,الهوكي أفضل من البيسبول، لأن الهوكي جيد، ولكن البيسبول هو أبله للغاية,93,2.884218692779541,3.152257204055786,3.313605070114136
74577,Little stars,felicia,1,عندما أنظر خارج بابي أرى الكثير من النجوم الصغيرة. أنظر إليها تبدو كما لو أن ثاي كان ينظر للخلف. أقول لنفسي أتمنى لو كنت واحداً من تلك النجوم الصغيرة.,254,3.545504808425904,3.528492927551269,3.23865818977356
64931,Winter Is....,filip,1,يبدو الشتاء مُثلجاً جداً. يشعر الشتاء بالبرد. أستطيع اللعب بكرات الثلج. أصوات الشتاء هي أنني أستطيع سماع الثلج يتساقط. مذاق الشتاء مثل الماء الذي هو مثل الثلج. رائحة الشتاء مثل رائحة أمي تصنع الكعكة. الشتاء لطيف. الشتاء ممتع. الشتاء مرح و يقفز في الثلج. الشتاء هو ثلج. الشتاء هو ثلج. الشتاء يسير ببطء. الشتاء بارد. الشتاء بارد.,323,3.551075935363769,3.333937168121338,3.2118148803710938
114145,Sring  time,finley,1,« إنكم » يا أهل مكة « لتلعبون » في الدنيا « خارجين » حال « أو تمكثون » في الدنيا .,68,3.0140380859375,2.9671998023986816,3.144339799880981
75366,It&apos;s Halloween,first grade,1,يمكنك أن ترى الخفافيش والقطط السوداء. هناك أزياء في كل مكان، يا لها من رعب! نحصل على العلاجات، التي نحب أن نأكلها. دعونا نعطي صرخة، إنه عيد الهالوين!,162,3.7135860919952393,3.920253753662109,3.4031431674957275
107562,Pizza,frank,1,تقريباً كل ليلة تقريباً، آكل البيتزا مع ضوء كل مساء في السادسة، آكل بيتزا مكدسة على الشوكولاتة,108,3.449846744537353,3.32250452041626,3.319838047027588
107550,Pig,frank,1,"عندما استيقظت في صباح أحد الأيام، كان خنزير على رأسي. سألت: ""ماذا تفعل هناك؟"" نظر إلي وقال ""هل تحب ماكدونالدز؟""",141,2.781091690063477,3.330047130584717,3.0737948417663574
74578,Banana,frank,1,موزة، موزة، ناعمة، حلوة في الوسط، موزة، موزة كلها ذهبت!,93,2.9129409790039062,3.3104074001312256,3.085047483444214
53045,I LIKE SPORTS DAY,freddy,1,أنا أحب الرياضة في اليوم لا عمل فقط لعب واللعب وكل السكاكريمات وكل الصيحات و كل الصيحات لكن عندما يكون وقت اللعب الصباحي,128,3.3413748741149902,3.163879871368408,3.271945238113404
102611,Super Bird,gabe,1,عندما استيقظت في صباح يوم من الأيام، ساءلت ما الذي تفعله هناك نظر إلي وقال... النوم، الهدوء، الشخير! عندما استيقظ قال: 'أنا غاضب منك، كنت تشخر طوال الليل. 'اخرج من بيتي أو أنا سوف ركلك خارجا! '!' ركلة ثم ظهر عصفور كبير وقال 'سوف أنقذك!' وقد فعل!,317,3.003386974334717,3.858290672302246,3.287923574447632
84153,"Go Dogs, Go Cats",gabe,1,هيّا، هيّا، هيّا، هيّا، هيّا، هيّا، هيّا، هيّا، هيّا، هيّا، هيّا، هيّا، هيّا، هيّا، هيّا، هيّا، هيّا، هيّا، هيّا، هيّا، هيّا، هيّا، هيّا، هيّا، هيّا، هيّا، هيّا، هيّا، هيّا، هيّا، هيّا، هيّا، هيّا، هيّا، هيّا، هيّا، هيّا، هيّا، هيّا، هيّا، هيّا، هيّا، هيّا، هيّا، هيّا، هيّا، هيّا، هيّا، هيّا، هيّا، هيّا، هيّا، هيّا، هيّا!,262,3.628448486328125,3.830218315124512,3.4051830768585205
108462,Dogs,gabriela,1,أحب الكلاب لأنهم يركضون وينبحون فوق التلال التي يحبون القفز عليها، يتبعون أصحابها ذهاباً وإياباً، لديهم الكثير من الحب ليتشاركوا به.,157,3.7388508319854736,3.4176645278930664,3.2988343238830566
119603,Mother,gauri,1,حياتي هي أنت، أنت لي، لا شيء جميل إلا أنا وأنت، قوتي هي ضعفي هو أنت، سأحبك حتى تكون لي. لكنني سأحبك أكثر عندما أكون لك، أنت تلك الإبتسامة،,292,3.945326328277588,3.7292659282684326,3.388790369033813
16585,Dog,george,1,أنا أحب الكلاب الكلاب تكون سعيدة أنا أحب الكلاب لأنها تحميك,71,4.015449523925781,3.442723274230957,3.3168294429779053
16345,My Ball,george,1,لدي كرة صغيرة اشتريتها من مركز التسوق عندما سقطت,75,3.112626075744629,3.0612871646881104,3.196809768676758
28289,Basketball,george,1,كرة السلة في الصيف، كرة السلة مع العرق على قدمي، كرة السلة في كل مكان، كرة السلة في وجهي، لعب كرة السلة لا يمكن أن تتوقف، أحب أن ألعب كرة السلة حتى أسقط!,194,3.82011079788208,3.839164018630981,3.416393756866455
88950,Roses Are Red,gianni,1,الأزهار حمراء. & lt; bry & gt; vioolles هي زرقاء. & lt; bbr & gt; هذا هو اليوم الذي وجدتك فيه!,81,3.669454574584961,3.4791452884674072,3.325576066970825
48563,Parrotfish,giselle,1,ببغاء البحر لديه أم ببغاء و ببغاء ببغاء يمكن للسمك أن يسبح ببغاء يمكن أن يأكل ببغاء البحر أن ينجب طفلاً,129,3.4580979347229004,3.142975330352783,3.2437498569488525
110272,The Honey Bee&apos;s Weapon,glory,1,نحل العسل يطير عبر السماء مع لدغاتهم يخبرون أعدائهم، وداعاً لأسودهم ولوناتهم الصفراء مشرقة جداً، لذا، لا تتجرأ على أخذ قضمة!,169,3.1917967796325684,3.614107131958008,3.342386484146118
58281,I  like dogs,grace,1,أنا أحب الكلاب، أليس كذلك؟ الكلاب لطيفة، أليس كذلك؟ أنا أحب الكلاب عندما تنبح، أليس كذلك؟ بعض الكلاب تحبها عندما تكون مظلمة، أليس كذلك؟ الكلاب فقط مثل الماء، أليس كذلك؟ الكلاب تنام على الأرض، أليس كذلك؟,203,3.482828378677368,3.4084959030151367,3.2844550609588623
37879,Butterfly,grace,1,فراشات الفراشات في السماء، تبدأ بجذب عيني، تقترب بما يكفي لتلمسها تطير بسرعة ثم يأتي الرعد مع زئير ولا أرى السيدة فراشة بعد الآن,189,3.2369208335876465,3.472259998321533,3.114084482192993
88858,I love  summer,grace,1,أنا أحب الصيف والشمس لا تبرد أبداً في الصيف أخرج إلى جانب و أحظى بوقت ممتع ليس الصيف,120,3.681316375732422,3.5722134113311768,3.337547540664673
99114,Mouse In The House,grace,1,كان هناك فأر يعيش في المنزل كان خائفاً جداً من أن يكون هناك,77,2.2997612953186035,3.3747029304504395,2.81756854057312
112026,Louder than wind.,grace,1,أعلى من ريح أعلى أعلى من أبّي مِصْرَفَاتِ ذلك كَمْ أمّي تَنْخرُ! !,79,3.0095622539520264,3.7157254219055176,3.287358522415161
94110,Mothers Words,graham,1,نادرا ما تُسمع كلمات الام ، ولكن كثيرا ما نتذكر . الكلمات التي تلتقطنا عندما ننزل ، وتحمينا من السقوط . كلمات الإلهام هذه نستخدمها من يوم الى يوم . الكلمات التي تعلمنا ما يجب فعله ، وفي كثير من الأحيان ماذا نقول . هذه الكلمات سوف ننقلها الى عائلتنا ، لقرون قادمة . سوف نتذكر دائما الكلمات الخالدة لأمنا .,349,3.377605438232422,3.258514881134033,3.29705023765564
105917,ALMOST EVERY DAY,grant,1,تقريباً كل ما بعد الظهر آكل الملاعين بشوكة كل مساء في السادسة تماماً آكل الملاعين على الطوب,114,2.423770904541016,3.239781856536865,3.167646169662476
88623,Aliens: A Haiku,green ancillary,1,الأجانب الأجانب الأجانب الأجانب,51,2.209186553955078,3.500858783721924,3.2591164112091064
115403,Summer,habeeb,1,تقفز في زهرة نظيفة من البركة، وتقيم في أماكن الأصدقاء المزدهرة للعب في المخيم,83,3.492872953414917,3.161776304244995,3.2695248126983643
105797,I saw a bird,hailee,1,طير جاء على رأسى و أختى قالت,44,2.907003402709961,3.332781791687012,3.040774345397949
103382,good  dog   don&apos;t  fly,hailey,1,الكلب الخارق يطير في السماء ضرب رأسه على الصخرة,58,2.7906289100646973,3.349881172180176,2.92870831489563
109102,Mat The Cat,hailey,1,-القطّة التي كانت جالسة على حصّة كان إسمها القطّة في النهاية,134,2.945887804031372,2.9261274337768555,3.1593780517578125
94924,bat,hailey,1,مضرب الطفل أصابه الخردة وصرخ على ضوء الظلام أنا خائف من الضوء,83,2.3756136894226074,3.4290504455566406,2.924243450164795
110664,The Bird That Frightened Me,hailey jo,1,طير خاف مني ذهب. قلت له تحياتي. قلت وداعي. ببطء شديد لم أر الطائر مرة أخرى من ذلك اليوم.,154,2.2682547569274902,3.500826835632324,2.896848440170288
30721,Birds,haley,1,وعندما تأكل الطيور خبزها ، سرعان ما تذهب الى الفراش عندما تذهب الى الفراش لترتاح على رؤوسها ، تسقط احيانا في الازهار !,133,2.824510335922241,3.3287973403930664,3.069710731506348
87992,Cat&apos;s Cat,hanna,1,القط القط القط القط القط القط القط القط القط يذهب إلى السباق مع خفافيش المضرب مضرب مع الدهون الدهون الدهون الدهون الدهون الدهون الدهون التي أكلت حتى وقفة الهوت دوغ كله، أوه لا! تم إلغاء السباق بسبب الفرقة!,179,2.296363353729248,3.6177921295166016,3.0674002170562744
74191,spring poem,hanna,1,تُنَمِّي الرياح تُزَوَّجُ أزهارًا في النسيم,75,3.3836565017700195,3.084869384765625,3.208444356918335
