id,title,author,grade,text,char,valence,arousal,dominance
57819,Â“The English letterÂ”,kylie,12,لا يوجد أحد يعيش هنا بهذا الاسم، ويكتب بالكلمات من لعبة عقلية، وأضع هالة الغطرسة فوق اسمي، وأين تجد عيني الخضراء القدرة؟ أن أركز على الأكاذيب، وأن أسكب من فائدة الفك، أي نوع من لغات اللسان سبع عشرة سنة في نظريتي، وكيف يمكنني أن أصل إلى أسفل؟ وكيف يمكن أن أكسر العداوة؟ الحلقة خمسة مليارات من قلقي، أوديوم متطرف يبدو لي أنه يغمرني، لماذا أبدو بحاجة؟ للدفاع عن عجزك عديم الفائدة؟ أن أتعاطف في صورة نظرية، مثل هذا الجبين القوي، انقسام بين سلوك قناع، يجعلك تشعر على ما يرام، وأنا بحاجة إلى بداية، لا شيء مثل هذا السلام سيبقى على الإطلاق، على أساس المنزل، وأنا أتعلم أن أسامح وأن أنسى، ولكن رقص ضوءا ثانيا، ثم أرقص على ضوء ثان، ثم على ضوء آخر، ما الذي تتوقعه؟ النفاق المخفي هو كل ما تحصل عليه أبداً، أي شيء جديد غير مهتم بالتدليس، ربما يوم واحد، ما الذي تعطيه لك، معلمك الوحيد الميمون، مع العار على كتفي، ما الذي تتوقعه؟ النفاق المخبأ هو كل ما تحصل عليه، ثم تحصل على جرعة، ربما تكون غير حريصة، ما، ما، ما الذي تعطيه، مع المعلم الوحيد، مع العار على كتفي، مع العار على كتفي، ما، أنا أحاول وا وا، واجد، وا، وا، وأجد، وأجد، وا، وأجد، وأجد، وأجدة، وأجد، وأجد، وا، وأجد، وا، وا، وا، وا، وا، وا، وأجد، وا، وا، وا، وا، وا، وا، وا، وا، وا، وا، وا، وا، وا، وا، وا، وا، وصورة، وا، وا، وا، وا، وا، واي، واي، وا، وا، وا، واي، وا، واي، واضع، واضافة، واي، واضع، وا، واي، وا، وا، وا، وا، واضع، واضع، وا، واي، ربما، واي، واي، وا، وا، وا,1103,2.5964667797088623,3.3974742889404297,3.11143445968628
117913,World,kyrex,12,ما هو هذا العالم؟ لم أعتقد قط أنني سأتي إلى هنا هذه معجزة جئت إلى هنا، ولكن يجب أن أقبل حقيقة أني حبست هنا للمرة الأولى التي جئت بها إلى الآن خياري للبقاء معهم أنا ممتن لذلك في هذا العالم، لقد قابلت الكثير من الزميل شوال الذي نبصق معاً كشخص مجنون هذه هي اللحظة الثمينة في حياتي ولكن عندما رأيت واحداً تلو الآخر ترك هذا العالم أخيراً أعرف ما يقوله الناس في كل بداية يجب أن تكون هناك نهاية لذلك في كل اجتماع يجب أن يكون هناك وداع,1099,3.3092360496521,3.4486613273620605,3.1709635257720947
35006,Heart of mine,la mona,12,لقد وجدتُ ما أردتُه، ظننتُ أنّي فعلتُه على الأقل، الأمور معكِ ممتعة لكن يصعب التعامل معها، وجدتُ قلبي ضائع وميؤوس منه وسألته إن كان مستعداً للمضي قدماً، فقد كان مجروحاً ومشوشاً جداً لدرجة أنه لم يستطع الإجابة. ما الذي تظنّين أنّ عليّ فعله لجعله أفضل؟ لكن لا أعلم، أخشى أنّي لا أستطيع التداعي أيضاً!!,565,2.420465469360352,3.5364012718200684,2.9102261066436768
35146,Can I Runaway With You?,la mona,12,هل يمكنني أن أنسى ما حدث بيننا؟ هل يمكن أن يكون كل شيء على ما يرام معنا؟ هل يمكن لثلاثة منا أن يهاجروا وأن يكونوا سعداء؟ أشعر أنك تحاول، ولكن ليس من الصعب التأكد من أنك حب حياتي أو أنني مشوشة؟ هل ينبغي لي أن أغمض عيني وأترك الأمور؟ ولكن لماذا هذا الحب هو ما أشعر به داخلي أو هل هو مجرد مسألة وقت؟ هل يمكنني أن آخذك بعيداً وأترك قلبي يقرر؟,416,3.344489336013794,3.645336627960205,3.1824724674224854
50025,NOT AFRAID,lafayette,12,أعلم أني قد أبدو خائفة لكن لا أخشى أن أقف واقفة و أتكلم نيابة عنك لكن أنا فقط في 3 درجات,101,2.682968616485596,3.1813435554504395,3.063805341720581
117697,Lakisha,lakisha,12,المناصرة المناصرة والنوع المناصرة,60,4.1062493324279785,3.438843250274658,3.329408407211304
117693,Concrete,lakisha,12,المقص هو أن تقص، تقطعه، تمزقه، تمزقه، تسحبه، وتقطعه من قطع الأوراق.,111,2.8608956336975098,3.140793800354004,3.2414066791534424
120527,The essence of your words,lakshya,12,لكن كيف نستخدمها لا يمكن تفسيرها من قبل جميع الأبجديات الستة والعشرين بعض الكلمات '' لديها القدرة لذوبان قلبك قد تكون في قصيدة أو اقتباس، عندما يتعلق الأمر بالأحداث التي حدثت أو التي حدثت في حياتك. ولكن قد تقتل شخصا من الداخل، إذا لم تستخدم كلمة '' بك بحكمة، سواء أسأت استخدام أو قلت لهم خطأ 'كلمتك' قد تجعل الشخص سعيدا,545,2.942976951599121,3.237950801849365,3.150848627090454
84703,God,lalitha,12,في ابتسامتك في شروق الشمس في الأوراق الخضراء في الزوايا الزرقاء بينما استلقي على ظهري وانام في سرير الطبيعة يمكنني ان اشعر بلمسة من الله,756,3.7207846641540527,3.619052171707153,3.2351460456848145
113361,Faint Emotions,laquitta,12,ان الحب هو الحزن المتطرف والحزن هو السعادة القصوى والحزن هو السعادة القصوى,344,3.8332772254943848,3.6701526641845694,3.298482179641724
84496,A Woman&apos;s Dance,laramie,12,أنا أسحق الأرض تحت أقدامي، الهواء يدور حولي حلو، العاصفة في الداخل تفسح الطريق إلى الهدوء، كما يتدفق الحجاب ويرفرف في ذراعي. المطر يتألق في عيني، الليل المخملي والسماء النجمية، ابتسامة الفرح، لمحة من الحزن، أعيش اليوم وأمل الغد. هذه رقصة المرأة، نعمة الوجود والثقة، لم تولد من الشباب أو حتى الجمال، بل من العيش، التنفس، الإبداع.,413,3.935125827789306,3.748613595962525,3.3167686462402344
64301,&apos;&apos;Let Me Be The One&apos;&apos;,latisha,12,عندما تحتاج إلى الاهتمام، أريد أن أكون في جدل. عندما يتطلب المزاج للرومانسية، هيا يا فتى خذ فرصة. عندما تحتاج إلى شخص ليهتم هو لي الذي سيصبح هناك الحق. في حياتك في قلبك اسمحوا لي أن أكون واحد. دعونا نتشارك لمسة الحبيب عندما تكون اللحظة تعني الكثير. أريد أن أكون بعيدا عن كل ما أنت عليه إذا كان الحب يأخذنا إلى هذا الحد. شخص ما يحتاج لك الحب,429,3.662298202514648,3.625671625137329,3.437478542327881
33818,Never stay home alone,latoya,12,لا يبقى أبداً وحيداً عندما يكون القمر مشرقاً,47,2.863184928894043,3.046753168106079,3.196916580200196
49927,Limerick,lauds,12,كان هناك ذات مرة صبي يدعى جيروم الذي ينسى دائما أن يجلب الأشياء من منزله كتب لي رسالة نُسِيَ توقيعها كإرسال وأرسلها إلى ماين بدلا من روما!,172,2.9432573318481445,3.308213233947754,3.213514804840088
62544,Love,laura,12,الحب هو شعور لديك لشخص ما في أعماق داخلك وتهتم بهم كثيراً، عندما تحب شخصاً كل يوم، تعتني بهم دائماً، وتكون معهم، حتى لو كان لديهم يوم حزين،,838,4.015023231506348,3.757389068603516,3.355924367904663
20492,ONLY YOU,laura,12,لقد شاهدتك طوال ساعة منتصف الليل على أمل أن أعانقك أنا و أنتِ لكن لكن لم أعانقكِ لكن لكن لكن لم يكن سوى مقصّ أشتاق لقبلاتكِ الرقيقة,255,3.764183282852173,3.669542789459229,3.2777647972106934
89925,Chicken,laura,12,تقريباً كل صباح آكل دجاجاً مع ملعقة كل مساء في السادسة تماماً آكل دجاجاً على عصا,231,3.777030467987061,3.506983518600464,3.4213685989379883
118785,My brown hairy couch,lauralee,12,لدي أريكة بنية كبيرة ناعمة كسحابة. إنها جيدة لمشاهدة الأفلام عندما لا تكون عالية جداً. أطفالي يحبون القفز منها، لكنهم يعرفون أن القفز غير مسموح. الكلاب تحب النسيج وتترك شعرها حولها.,355,3.653782367706299,3.3983163833618164,3.3073818683624268
92571,The Fat Funky Ferrets,lauren,12,"النمسات المرحات السمينات يطيرن حولهن، يرفرفن ويقلبن ويصرخن بصوت عال، ""ابتعدوا! ابتعدوا! لا أستطيع أن آخذ أكثر من ذلك بكثير!"" لأن كل واحدة من هذه النمسات رائحتها مثل السماد. ""أنت نتن!"" انهم يبكون مع الاشمئزاز ومع القلق، يمسكون أنوفهم بمخالب شديدة الغضب. بعد ذلك، عيونهم تتسع - هذا لا يمكن أن يكون! هذه الرائحة الرهيبة قادمة مني؟",393,2.3272411823272705,3.889907836914064,3.12762188911438
96104,The Fat Funky Ferrets,lauren,12,"النمسات المرحات السمينات يطيرن حولهن، يرفرفن ويقلبن ويصرخن بصوت عال، ""ابتعدوا! ابتعدوا! لا أستطيع أن آخذ أكثر من ذلك بكثير!"" لأن كل واحدة من هذه النمسات رائحتها مثل السماد. ""أنت نتن!"" انهم يبكون مع الاشمئزاز ومع القلق، يمسكون أنوفهم بمخالب شديدة الغضب. بعد ذلك، عيونهم تتسع - هذا لا يمكن أن يكون! هذه الرائحة الرهيبة قادمة مني؟",399,2.3301053047180176,3.890763521194458,3.133746385574341
120160,If We Meet Again,lauren,12,توقف عن إخبار نفسك أننا سنجتمع مرة أخرى، وتقع في الحب فقط لتجعل نفسك تشعر بالتحسّن من فقدان فرص لا حصر لها لتخبرني أنك تحبني، أو لتعاملني بشكل أفضل لأن لديك الكثير من الفرص ولم تأخذها فحسب. وأعدك أنه إذا اجتمعنا مرة أخرى ذات يوم، بسبب تحول المصير العجائبي، لن أقع في حبك. لن نعيش بسعادة إلى الأبد. كل شيء لن يكون منسياً. سوف تكون دائماً الصبي الذي أحببته بشدة جداً وسوف أكون دائماً الفتاة التي لم تكن تستحق القتال.,563,2.9796180725097656,3.5252811908721924,3.232227563858032
64729,Flow The Dog,lauren,12,ذات مرة كان هناك كلب اسمه تدفق الذي أكل الكثير من الثلج لكن الثلج لم يمانع أن يعامل معاملة قاسية جداً,148,3.222846984863281,3.1929678916931152,3.1997230052948
34540,Life- Is it Hope?,leah,12,هل هو أمل؟ هل هو أمل؟ هل هو فرح؟ هل هو ما لدى الجميع ولن يتخلوا عن المحاولة؟ لن ينجح فيه الجميع، ولكن الآن نعرف ما هو، إنه أملنا وأحلامنا!,177,3.878878593444824,3.713657379150391,3.398627996444702
118898,Project management,leanne,12,الفن هو أن تؤمن بنفسك وتسيطر على خيول الحياة هو أن تسيطر على كل أفكارك معا لخلق سلسلة كاملة من القوة بمجرد أن تكون. لديها قوة لديك الانضباط والبقية تقع في مكانها مثل سلسلة واحدة,644,3.437917709350586,3.38917875289917,3.3738017082214355
100738,Wonderful,lee,12,.............................................................................................................................................................................................................................................................................................................................................................................................................................................................,337,3.663647413253784,3.692728281021118,3.211047649383545
118116,Soul of sprit,lee,12,ما هي الحياة العجيبة رأسي في يديّ نفسي قد وصلت إليه. كما تعثرت بالأفكار في ذهني. من السعادة بعيدا عن السعادة التي ارسمها خط مستقيم لخلق كلمات ممزقة في ظلال الظلمة,491,3.7749063968658447,3.645832538604736,3.3093128204345703
101892,HOW TIME LAPSED,lekshmi mini,12,لم أعرف أبداً كيف كان الوقت قد حلّق في وجهي كلّ شيء الآن أنّه كان يوماً جميل الوجه الذي كنت أملكه كان محبوباً من قبل الجميع. لم أكن أعرف أبداً الوقت الذي وقعت فيه في حبّي,2027,3.148192882537842,3.434060573577881,3.0479607582092285
74160,Trickle Down Theory,len,12,(ج) أين هي أرض الخبز والعسل؟ أين هي أرض الحليب والوعد؟ لقد كان التألق واليأس واليأس بالنسبة للسيدات والأكياس، على الجانب الشرقي والجانب الغربي، على الجانب الشرقي والجانب الغربي بشأن ميناء الفقر والجانب الآخر منه، وليس قوارب الحياة التي تُنفَض من خارجها، حيث يُعَبَأَرْفَأَةُ، ويُعَبَّأَةُ العجائب.,1371,2.4260058403015137,3.144887924194336,2.905543565750122
119569,WE ARE FAMILIY,leovilin,12,أتمنى أن يكون الناس مثلك أفضل، وراقصات لطيفات مثل كل زهرة التي تحزن لكونها سعيدة هو مجرد جزء من كونها القرابة محبة صديقي الجديد في مكان حيث ترتاح الملكة ابتساماتها تلمسني بشكل غير متوقع,330,4.140778064727783,3.761776924133301,3.351346731185913
89942,Moon Apples.,leslie,12,عندما أنظر إلى القمر، آكل التفاح في غرفتي. عندما تشرق النجوم، آكل التفاح كل ليلة.,111,3.5400333404541016,3.304750919342041,3.309234857559204
103616,Dog,leslie,12,إنها تحب أن تحفر تحت الوسائد و ملاءاتي,91,3.350098133087158,3.177985668182373,3.2209279537200928
115765,Princess Kamo,letsaba,12,(ب) جمالكِ، باب السماء، شفتيكِ، آخر تذوّق من الترمل في جسمكِ، وجيّتي، وخيّرتُكِ.,618,3.966273307800293,3.673530817031861,3.3279597759246826
103988,Dive,levi,12,عندما تشرق الشمس، يصعد رأسي للأعلى أنظر إلى الشمس وأشعر بارتباط آخذه إلى قدمي و أدرك أن حظي هو العالم هو محاري، أنا حر كالدلافين الجائلة,485,3.6652331352233887,3.501140117645264,3.3370792865753174
109082,Winter is here,levi,12,الشتاء هنا من قبل مواقع ليفي هو هنا وشتاء الشتاء هنا، وكذلك هو الثلج الناس يغنيون والثلوج تتدفق الشتاء عظيم يمكنك مشاهدة عرض عيد الميلاد يمكننا أن نأكل الكعك الذي يصنع منه يمكن أن يكون ممتعاً,525,3.588050842285156,3.417844295501709,3.319328546524048
115999,Through My Eyes,lexie,12,أنا لا أستطيع أن أرى العالم من خلال عيوني هو صعب يمكن أن يكون من الصعب أن أترك نفسي أفقد كل ماي من غير وامنات وتشوك التي لا ترينها - كل ما يمكنني فعله -,1202,2.482494354248047,3.3511886596679688,2.8650786876678467
101300,Chasing paper,leyana,12,ورقة مني و مني نطارد ورقة من ورق لم تحصل على أي مال حتى تتمكن من اللحاق بنا في وقت لاحق,126,2.853978157043457,3.30324125289917,3.194803476333618
116413,Nice,liam,12,الناس اللطفاء في كل مكان، لا يعرفون ما هو العار، أن الغم على الهواء. الناس السيئون إلى جانب، أناس لطفاء لا يعرفون، أن الشر موجود. ولكن الناس الطيبين لا يفهمون، حيث تنشأ المشاكل، أن ذلك يجعل الناس السيئين موجودين. لماذا يوجد أناس سيئون؟ من ينزلون بالآخرين، ويلحقون بهم الضرر من الداخل إلى الخارج. من كانوا لطفاء ذات يوم، الآن يفكرون مرتين، سواء كانوا سيئين أو لطفاء. والآن من الصعب أن يكونوا موجودين، في عالم اليوم. لقد ولدنا أبرياء، وماتنا متغطرسين. لكي نصل إلى مكان ما، في عالم اليوم، أصبح عليك أن تكون سيئاً، لأن الرجل اللطيف يموت، مع عدم وجود شيء لنظهره في حياته.,604,2.400956153869629,3.17920994758606,3.0512003898620605
104229,Ticking Clocks,lian,12,الساعات الموقتة والأصوات المهمسة، محاولات فاشلة تفسر مشاعر الحب بالنسبة لك، فقط زيادة، مع كل شعور قلوب تدق العقول تتسابق فقط العد التنازلي الأيام كل شيء كل شيء,319,3.759963989257813,3.695487499237061,3.280892133712769
110861,What i love about you,libby,12,أنا أحب الطريقة التي تنظرين بها إليّ عندما ترينني أحب الطريقة التي تبتسمين بها لي عندما ترينني أحب الطريقة التي تضعين بها ذراعك حولي,166,4.524292469024658,3.873774528503418,3.3877110481262207
86527,MY MATHEMATICAL LOVE,lilimei,12,حل مشكلة حبي هو اصعب شيء للقيام به هو مثل ايجاد الجذر التربيعي لـ -2 انا اعلم انه سيكون من المستحيل ان اعوض عن الاجابة لكن انا متأكد انه ليس رقما خياليا,821,3.0309600830078125,3.357234001159668,3.1649768352508545
109524,Cat Atack,lily,12,في يوم من الأيام، قامت فتاة اسمها كارلي بفتح الباب للحصول على ورقة الأخبار تُكبّبّ كُتب قطّة، دعتها أمّها، قالت أمّها ما قالته عمّا فعلته قالت أنّها إتّصلت بوالدها وقالت أنّها اتصلت بوالدها وقالت أنّ والدها قال ما دعاه الراهب لأصدقائه أنّهم جاؤوا وتعلّقوا,293,2.941462755203247,3.1651551723480225,3.0938217639923096
23529,My teacher&apos;s desk,lily,12,"رأيت الفوضى التي كانت عليها، مكتب معلمي سيء جداً، مع كل الخردة التي انقسمت عبره، أقول أنه يبدو حزيناً جداً، سألتها إن كان بإمكاني تنظيفه، كل ما فعلته هو هز رأسها، قالت، ""أنا أنتظر استراحة، علي أن آكل بدلاً من ذلك."" سحبت سندويتشها، وتركت الغلاف هناك، حصلت على الخردل على مكتبها، والاتشب في شعرها. ثم شربت بعض من حليبها،",483,2.448272705078125,3.305342674255371,3.023033380508423
112774,My Best friend,lincy,12,أنت لا تستطيع أن تعطي أجوبة على كل مشاكلي أو شكوكي أو مخاوفي. لكنك استمعت وأعطتني خيارات. لم تستطع تغيير ماضيي بكل أحزانه وآلامه، أو مستقبلي بقصصه. لكنك كنت في الجوار للعناية. لا تستطيع أن تبقيني بعيداً عن كل مشاكلي، لكنك عرضت يدك التي قد أحملها وليس تسقط. ففرحك، انتصاراتك، نجاحاتك، وسعادتك ليست لي؛ ولكن يمكنني أن أشاركك في ضحكك، حتى وإن كنت فشلت مرات عديدة. قراراتك في الحياة ليست لي لأصنعها، أو لأحكم؛ حاولت أن أدعمك وأساعدك كلما طلبت ذلك. لا أستطيع أن أمنعك من الوقوع بعيداً عن هذه الصداقة، أو عني. ولكن يمكنني فقط أن أتمنى لك الأفضل والأمل في التحدث إليك الآن وبعد ذلك حتى أرتاح. لا أستطيع أن أعطيك حدوداً التي قررتها لك،,1265,3.168375253677368,3.350426197052002,3.1815707683563232
118045,THE LITTLE GIRL INSIDE MY HEAD,linda,12,هناك فتاة صغيرة داخل رأسي رأسي التي تبكي كل ليلة وأنا أذهب إلى السرير. تبكي لأمها التي هي منذ زمن بعيد ذهبت. وتبكي لوالدها الذي تركها وشأنها. تبكي للأوقات التي تتذكر فيها الماضي. والألم الذي عانته إلى الأبد. تبكي من ذكريات البراءة التي فقدتها عندما كانت في العاشرة من عمرها. وتعيد إحياء الذكريات مرارا وتكرارا. تلك هي قصة الفتاة الصغيرة داخل رأسي التي تبكي كل ليلة بينما أنا أذهب إلى السرير،,502,2.374934673309326,3.3095922470092773,2.897543907165528
33860,The Image in My Dream,lindsay,12,كل ليلة منذ كنت في الثالثة عشرة من عمري كنت أحلم بفارس في درع ساطع جاء لينقذني. لم أر وجهه من قبل حتى اليوم الذي رأيت فيه وجهك وتلك العينين. كما سرت نحوي ببطء، لم تنطق كلمات بعينيك لأنك تكلمت. علمت أنك أنت من لي. كانت أفكاري صحيحة تلك الليلة عندما في أحلامي ملأ وجهك الفراغ على فارس الحصان الأبيض الذي جاء ليأخذني بعيدا.,467,3.383817672729492,3.5779995918273926,3.2068121433258057
115993,Morning Attitude,lindsay,12,لا أحب الإستيقاظ مبكراً في المدرسة. ربما أحد أسوأ الأشياء التي أقوم بها دموعي تسقط في حوض سباحة، وأنا أستعد، كل ما أعتقد أنه هراء. ذلك أن الوقت بالتأكيد غير ضروري، وينبغي أن أكون في السرير لمدة ست ساعات أخرى للبقاء في سريري، هو ما كنت أتضرع إليه. صرخاتي من غرفتي قادرة على التمكين. موقفي على الأرجح أسوأ. بغض النظر عما أكره الجميع. في أي وقت قد ينفجر غضبي بحلول الساعة الثامنة صباحاً. لقد انتهيت بالفعل ولكن بحلول الفترة الرابعة كان لدي بعض الطعام,526,2.339689254760742,3.513027667999268,3.01900053024292
66846,Mr. Puff,lindsey,12,لا أحد يستطيع التوقف عن الابتسام باسمه هنا لديه موقف و لا يذكر المظهر الجيد مع الكثير من الطلاب من هو هذا الشخص الرائع؟ لماذا هو السيد انفخ دميتي 4 انشات,228,3.713375806808472,3.670312166213989,3.329487562179565
50574,The Beauty That Once Was,lisa,12,كان يأتي كنجم مشرق يطوف في نسيم الصيف. شعره ذهبي كالشمس. كان له حب عميق لا يعرفه احد غيري وحده. كان يرتج تاجا على راسه النبيل. كانت اجزاؤه فضة وذهب ولكن ليس كل تلك الشمعات ذهب. في ارض بعيدة حلم احلامه بسحر نقي. كان هناك ملائكة في العمل سعدوه. كانت عيونه تعكس تعاطفا وحبا نقيين للجميع. كان جميلا كزهرة. لكنه في النهاية لا يرى. لم يراها ولم يشعر بها. صارت رحلته نهاية. وفي النور صارت روحه حرة مرة أخرى.,609,3.71094012260437,3.55389404296875,3.2294118404388428
