id,title,author,grade,text,char,valence,arousal,dominance
47601,Brothers,annie,4,هناك يَذْهبونَ يَذْهبونَ يَذْهبونَ ثانيةً يَتصارعونَ مثل a طفل رضيع نمر فقط مستيقظ فقط يَستيقظُ فقط يَنْكحُ مثل a ضبع ضبع في الليل يَشتكي مثل a ذئب جائع عندما جائع يَذْعبُ يَهْعبُ مثل a ثعبان يَزْحفُ مثل a ثعبان يَنْزلُ وراءكم الإخوة، يُضايقونَ الأولادَ الصِغارَ,223,2.3320798873901367,3.493015050888061,3.0418734550476074
47610,Friendly Faces,annie,4,الوجوه الودودة التي تنعكس على الحائط تجعلني أشعر بالدفء بداخلي عندما يهتزون، يجعلونني أضحك أنا لدي وجوه ودودة حولي في كل مكان أذهب إليه، أرجوك ابق و لا تذهب.,187,3.815892457962036,3.62021541595459,3.2830049991607666
101566,My Life is wonderful,annika,4,حياتي، حياتي، حياتي الرائعة حياتي الرائعة مليئة بالسعادة، الحب، الشجاعة، وعائلتي! إنهم يحبونني ويهتمون بي وأنا أعيش!,140,4.398090839385986,4.01349687576294,3.5027220249176025
101568,My world of learning,annika,4,عالم التعلم هو حول الأطفال الذين يقولون كلمتهم الأولى كما أنهم أول صوت صغير صغير لطيف الذي يمكن أن يتكلم!,121,3.878399848937988,3.703118801116944,3.424751281738281
101567,The World,annika,4,العالم مليء بالسحر، العالم مليء بالحب والحياة مليئة بأبواب البيت في الدول والدول. العالم مليء بالطبيعة الجميلة الحساسة وتوازنها!,199,4.236826419830322,3.847105264663696,3.42160964012146
40183,I Love to Swim,annika,4,أشعر وكأن طائراً يطير جنوباً للشتاء أشعر أنه لا يوجد ماء يحملني أنا أطير في البركة أحب السباحة,159,4.0141191482543945,3.853171586990357,3.408437967300415
117276,MY House,annika,4,"عندما استيقظت في صباح أحد الأيام، كان ستورك على رأسي. سألت: ""ما الذي تفعله هنا؟"" نظر إليّ وقال ""هذا منزلي"". ""أنا لست فأراً أعيش في منزل""",227,2.822816133499145,3.721988677978516,3.32012677192688
84027,ME,annika,4,انا احب ان اسبح يا رجل لقد ارتطمت من على الحافه انت اعطيتها الكرة الاساسية انا ايضا لدي احذية كرة القاعدة عندما اركض من خلال البسط الابقار تذهب,173,3.712851285934448,3.6223225593566895,3.331886053085327
120111,My hands,annison,4,يداي رائعتان، يداي باردتان، يساعداني على الأكل حتى أستطيع أكل اللحم، ويساعداني في انتزاع الأشياء، بدون يدي لن أكون قادراً على فعل أي شيء. أحب يدي.,175,4.175102233886719,3.784164905548096,3.398800611495972
50080,HAPPY MOTHERS DAY,annissa,4,نحن نتشارك قلوبنا مع أمهاتنا و عائلاتنا كل يوم,219,3.7595114707946777,3.488905191421509,3.2516109943389893
54735,When I Was Walking Down The Street,annmarie,4,عندما كنت أسير في الشارع رأيت سلحفاة كانت بنية وبطيئة وكانت تدفع كل شيء للخروج من الطريق. عندما رأيت ضفدع. ثم رأيت فيل كان أنيقا جدا. عندما لاحظت أن هناك ختم. لذلك ذهبت إلى حديقة الحيوان للتحدث إلى بو. وقال انها مأساة ولكن كنت أبكي أكثر مثل القمامة. عندما لاحظنا أن جميع الحيوانات تأتي مرة أخرى مع قطعة من الزبدة والماك.,390,2.7526330947875977,3.3655014038085938,2.9772870540618896
45227,Hockey,anonymous,4,يجب أن تكون قاسياً في لعب الهوكي لأن الهوكي صعب حقاً سماع الجمهور يزأر اللاعبون يخرجون من الباب باز باش بانغ! ضربة كبيرة لا يستطيع الحكم تجاهل العقوبة,470,2.738574981689453,3.441358089447021,3.1256027221679688
45285,Dogs,anonymous,4,تحتضن الكلاب، وتحفر جذورها، وتحصل على كل شيء قذر، تمضغ على العظام، تمضغ على العظام، تحفر الأزهار، تأكل أثاثك، لكنها لا تزال لطيفة كطفل حديث الولادة، وعندما لا تقوم بتدريبهم، يقومون بأعمالهم في أي مكان، ينبحون ويصرخون ويهدرون، لكنهم مع ذلك لطيفون، محبون ورائعون، كيف جعل الله الكلاب مدهشة هكذا؟ ربما لأن الله مُتَهجَّأ لليمين هو كلب!,406,3.8112988471984863,3.67468786239624,3.3475582599639893
45220,Hair,anonymous,4,شعرها نادر جداً، أنا أحب هذا الشعر لامعاً كطائرة من الزجاج، شعر ثقيل على رأسها، في الصباح صاحب الشعر كان مفترساً، مصرخاً، مصففاً شعرها، صفع، ضرب، ضرب، ركل، لكنه ظل جامحاً، هي حقاً لا تحب هذا الشعر، لذا قامت بقصه!,285,3.559079885482788,3.814450263977051,3.3780882358551025
45274,The car crash of Friday the Thirteenth,anonymous,4,في يوم من الأيام كان الرجل متأخراً عن موعد في سيارته ثم ذهب إلى بيته ثم ذهب ببطيء كالحشرة. أصبح مجنوناً لذا ذهب مائتين وثمانين مرر الرصيف وفقد أعصابه,441,2.350048065185547,3.413938522338867,2.9318788051605225
45289,Volleyball,anonymous,4,يمكنك أن تلعب كرة الطائرة بدون أن تكون طويلاً يمكنك أن تخدم، تصطدم و ترمي القمامة في القمامة يمكنك أن تلعب أي عمر و لا تزال تدير صفحة كرة الطائرة تناديك,472,3.1835083961486816,3.385108470916748,3.34106183052063
34952,Morgan horses,anonymous,4,العيون الجريئة الكبيرة، تسمعني، تسمعني، تسمعني، أنت تحب، أنا أحب سلالة الخاص بك.,117,3.9514198303222656,3.687236785888672,3.3841006755828857
36729,Mystery Guest,anonymous,4,في صندوق غذائي كان فراءاً، مخلوقاً صغيراً لو كنت أكلته، ربما كان قد تذوق المر. كان هذا القارض الصغير سريعاً قدر الإمكان! حتى أنه حاول إخافتي! هذا الوغد كان بطيماً و رمادياً، لكنه بقي ليوم واحد مثير! هذا الضيف الصغير ظن أن الـ (ب-11) هو الأفضل! هل يمكنك أن تخمّن ضيفنا الغامض!,341,3.687244176864624,3.8583250045776367,3.3585824966430664
59969,Above Me,anonymous,4,عالي عالياً فوقي رأيت شيئاً منفوشاً قال أن اسمه كان بافي أخبرته أني سكروف,97,2.908154487609864,3.195145606994629,3.1409904956817627
41357,NO SMOKING!,anonymous,4,التدخين هو شيء سيء أن تفعل ليس فقط لا التدخين يقتلك ولكن يعطيك نفساً كريهاً أيضاً,94,2.3254594802856445,3.156988859176636,3.0823025703430176
20589,My cat,anonymus,4,اسم قطتي (جورج) بعض الناس يقولون أن (جورج) يحب العصيدة، لكن (جورج) يكره العصيدة لأن (جورج) فتاة.,126,2.812424659729004,3.0636510848999023,3.167015790939331
46622,Smelly Feet,ansaar,4,أَستيقظُ كُلّ صباح لرَائحَة أقدامِي النتنةِ. أَتّصلُ بصديقِي إنتهى لذا أنا يُمْكِنُ أَنْ أَتْركَهم يَجتمعونَ. الشيء التالي الذي لاحظتُ صديقَي قالَ هم يَفْكُّونَ.,242,2.8132741451263428,3.655919551849365,3.252556324005127
110536,Balloons,anshika,4,عائماً، عالياً في السماء، وقريباً ما تصبح لُوحات ملوّنة، بعد ذلك، لم تعد مرئية,99,3.043498039245605,3.067330837249756,3.09641432762146
99990,Summer,ansley,4,ازهار ازهار ازهار ازهار ازهار ازهار ازهار تكتب قصصاً تحب مواعيد اللعب,88,3.982202291488648,3.4055333137512207,3.294046640396118
116869,Softball Softball,ansley,4,كرة السلة الناعمة لكل أنواع الفتيات من جميع أنحاء العالم. الكرة الناعمة هي من أجل جميع أنواع الفتيات من جميع أنحاء العالم. الكرة الناعمة هي من أجل جميع أنواع الفتيات من جميع أنحاء العالم. الكرة الناعمة الناعمة هي الضربة التي تتأرجح بها الوطواط، وانظروا إلى القفاز. أوّل عزف لباس يمدّه رجل، من الأفضل لكم أن تمسكوا بتلك الكرة الناعمة التي لم تمسكوا بها. والآن عليكم أن تعطوني 10 لفات. كرة السلة الناعمة قد انتهت الآن ونحن نضربها، وقد ضربناها للتو. كرة الناعمة الناعمة 3 في وقت لاحق من 10 إلى 18 في وقت لاحق من 10 إلى 18.,483,3.270951271057129,3.292882442474365,3.3299436569213867
102409,A man in puro,anthony,4,ذات مرة كان هناك رجل في بورو أنه كان يحلم أنه كان يأكل حذائه ثم صفع مؤخرته حتى تحول إلى أزرق صغير ثم ذهب الرجل الفقير على الطريق,292,2.846177577972412,3.42184853553772,3.088794946670532
46595,Fast !!!!!!,anthony,4,أسرع من قطّة صغيرة أسرع من قطّة صغيرة أسرع من جرّين متسرّع أسرع من جرو أسرع من جرو جرو أسرع من جرو دائِل أسرع من,534,3.312743902206421,3.392429113388061,3.2249202728271484
15667,My Room,anthony,4,يا إلهي، لقد تم الانتهاء من واجبات الساعة السابعة، حان وقت الصعود إلى الطابق العلوي، إنه أشبه بعربات الميليون. العبث مع جواربي التي تلعب بألعابي وتثير الكثير من الضجيج. أنظر إلى الخارج قد يكون هناك هوك نوب، ليس هناك فقط سأعود إلى المعرض.,251,2.7688329219818115,3.316081523895264,3.110145807266236
114158,HOW DO YO YOU KNOW IS LOVE?,anthony,4,الحب صعب جداً، لكن ماذا لو كان الشخص ليس مناسباً لك؟ أنت تعلم أن هذا الشخص جيد عندما تنظر إليهم في العين ووجههم يشرق,381,3.3747715950012207,3.529179811477661,3.2491650581359863
63635,Anthony,anthony,4,"""مُنْذُ فَرَعْ فَرَعَ فَجْدِيًّا""",51,2.333847522735596,3.325876474380493,3.118804216384888
92099,Bigger than a elephant,anthony,4,أكثر من فيل أكبر من كنيسة أكبر من مدرسة أكبر من مدرسة أكبر من ملعب كرة قدم أكبر من بحيرة أكبر من,197,3.226250648498535,3.2799999713897705,3.226884126663208
63630,Wank,anthony,4,ذات مرة كان هناك فتى يدعى (وانك) الذي دهسته دبابة وصديقه (غوهين) كان (بابون),96,2.4212207794189453,3.124849319458008,3.0277278423309326
63651,My life!,anthony,4,عندما كنت في السادسة من عمري الحرب العالمية الأولى بدأت! عندما كنت في السابعة من عمري الملكة بلغت الحادية عشرة! عندما كنت في الثامنة من عمري كيلي مات! عندما كنت في التاسعة من عمري جون هوارد ولد! عندما كنت في العاشرة الحرب العالمية الثانية بدأت عندما كنت في الحادية عشرة كنت في السماء!,225,3.664750337600708,3.737208604812622,3.362637519836426
24934,Sam Surfs,anthony,4,فَمَاذَا يُمْكِنُنَا أَنْ نَتَعَلَّمَ مِنَ ٱلْمَسِيحِيِّينَ ٱلْمَسِيحِيِّينَ ؟,127,3.280578851699829,3.075871229171753,3.19866156578064
64022,The Sun,anthony,4,الشمس كالنار المشتعلة حريق لا يحترق أبداً ورم يحترق في النهار ويخمد في الليل,114,3.552218198776245,3.743110179901123,3.283310651779175
63786,Anthony,anthony,4,مُتَزَوِّجٌ مُتَزَوِّجٌ مُتَزَوِّجٌ مُتَعَلِّقٌ مُتَعَلِّقٌ بِشَعْرَةٍ فِرَةٍ فِرَعَةٍ,60,2.125690460205078,3.4624176025390625,3.1391584873199463
102003,Lemon-Meringue Pie,anthony,4,تقريباً كل صباح أُعطي الرجل تحذيراً بأن لا يأخذ فطيرة الليمون أو سأذهب بعيداً وأبكي,119,2.262937545776367,3.523589849472046,3.093062162399292
118736,Just one more thing,anthony,4,كل مرة أقول شيئاً آخر أغضب فيه عندما أقول هل يمكننا أن نذهب لشيء آخر إذا لم تتوقف عن قول شيء آخر فقط,294,2.170553684234619,3.566243886947632,3.085151195526123
111398,The Weather,anthony,4,المحيط أزرق والسماء أيضاً الرياح باردة جداً وكذلك أنت,77,3.9557583332061768,3.499077796936035,3.257927894592285
46600,The End,anthony,4,النهاية هي آخر صفحة في كتاب أو قبضة المحتال عندما تنتهي من أكل وجبة أو توقيع صفقة ربما عندما تنتهي من يوم مثالي أو آخر يوم في مايو/أيار اليوم الذي تنفجر فيه الأرض أو آخر رشفة من الكأس عندما تتحول ابتسامتك إلى عبوس أو عندما أضع قلمي في الأسفل.,533,3.1776721477508545,3.112224817276001,3.1879138946533203
28852,Me and my grandmother,anthony,4,أنا و جدتي نحب بعضنا البعض مثل (جيلي) نحب زبدة الفستق إنها حلوة لا أحد يستطيع أن يهزمني,203,3.9909067153930655,3.62166428565979,3.366186141967773
39800,Smell,anthony,4,أنا أشم شيئاً ليس هواءاً لكنه هناك ليس قلمي لكن ما هو إذاً أعتقد أنه صديقي (ستيفان),116,3.011012554168701,3.166877508163452,3.136699914932251
64455,Subway,anthony,4,مترو الأنفاق إلى التلال الجنوبية من مركز البوابة، جولة حول المدينة للدخول.,76,3.110795497894287,2.904534101486206,3.177427053451538
117956,The best part of me,anthony,4,أفضل جزء مني هو أن أسبح بيدي لأكتب لأحمل أشياء لأثبت أشياء لأثبت أشياء ربطة عنق أرضية,108,3.293933629989624,3.27003812789917,3.2468101978302
107466,My class is loud,anthony,4,فصحتي صاخبة بصوت اعلي من زئير الاسد. هي اعلي من صاخبة صاخبة اعلي من باب صاخب.,114,3.042428970336914,3.7220888137817374,3.230874300003052
107468,Can i,anthony,4,هل يمكنني الذهاب لمكان ما يمكنني اللعب بكرتي هل يمكنني الحصول على بعض المساحة أعتقد أنني قد أقع هل يمكنني أن أمسح الأرضية إذا لم توافق على إغلاق الباب,148,2.4521164894104004,3.2709481716156006,3.0174481868743896
103644,Faster than an eagle flies,anthony,4,أسرع من طير النسر أسرع من ركض الأسد أسرع من ضربات الإضاءة أسرع من ركض النمر أسرع من ركض الفهد أسرع من طير الغراب أسرع من طير الغراب أسرع من طير الغراب,188,3.25301194190979,3.471997737884521,3.241960048675537
17236,Homework Drives Me Crazy,anthony,4,هذا يجعلني مجنوناً جداً بعض أصدقائي يدعونني بالكسالى عندما أحدق بهم متبوعة بخوف صغير واشرح بهدوء أن الواجبات المنزلية تقودني للجنون,304,2.359993934631348,3.4956440925598145,3.139766931533813
103640,Faster than an eagle flies,anthony,4,أسرع من النسر يطير أسرع من الأسد يركض أسرع من الضربات الإضاءة أسرع من النمر يركض أسرع من الفهد يركض أسرع من الذباب,161,3.242560625076294,3.4495365619659424,3.22437596321106
62282,Aiden McQuin,anthony,4,هناك شاب عجوز اسمه (ايدن ماكين) يحب أن يلعبه، لا أن يغني سوف يأخذ نظارات عينك,157,3.476099729537964,3.333203315734864,3.3455474376678467
114853,I see the light in the mist of fright,anthony,4,لقد أسقطت دراجتي وركضت أسرع من أن أطير بطائرة ورقية. أغلقت المرأب واختبئت في الخوف.,379,2.404191970825196,3.71164608001709,2.829087495803833
53019,My Bad Day,anthony,4,لقد قابلت شامة عندما سقطت في حفرة؛ فضحك في وجهي، فصرخت في وجهه؛ وخدشني حتى كنت في منتصف الطريق ميتاً؛ كان هناك خدش كبير على قمة رأسي؛ هربت بعيداً وقابلت عملاقاً لقد ناداني على رأسي وركلته على ساقه؛ حاول أن يركلني لكنه ركل الصخرة بدلاً من ذلك؛ فهربت منه وقابلت أورجاً؛ حاول أن يلعقني بفأسه، لكنه علق في الأرض؛ استخدم قبضته الضخمة للهجوم، لكنني تجنبتها وقلت سأعود قريباً.,493,2.5253219604492188,3.483982801437378,3.0262162685394287
43086,The Dog On My Head,anthony,4,"عندما استيقظت في صباح أحد الأيام، كان كلب على رأسي. سألت: ""ماذا تفعل هناك؟"" نظر إلي وقال: ""كنت سآخذ قيلولة الآن، ولكن سأخبرك بدلاً من ذلك. فقد غضب مالكي وطردني من المنزل، ثم هبطت فجأة على رأسك.",271,2.6013224124908447,3.457417726516724,3.008331060409546
99561,ANTHONY,anthony,4,المحولات الرياضية اللطيفة والمحولات 2 وأول واحد سعيد لرؤية أخي برتقال شاب أنيق,94,3.846701860427856,3.4015135765075684,3.336503744125366
104783,Bed Time,anthony,4,في سريري الدافئ الدافئ الدافئ، مع قطتي بالقرب من رأسي في سريري الدافئ الدافئ، مع طائر أزرق كبير,182,3.6755220890045166,3.3382015228271484,3.2377333641052246
30909,Spaghetti,anthony,4,السباغيتي هي وجبتي المفضلة. عندما آكلها، كم أشعر بشعور جيد. أحب ذلك عندما تكون لذيذة، مع جبنة بارميجيانو، و مرق. عندما تُقدّم بشكل لطيف و حار، أستمتع بأكلها كثيراً. يُقدّم مع الخبز الإيطالي، والنبيذ المنزلي الصنع الذي هو أحمر. أنا جائع الآن، وأنا أتمنى ذلك، أمي سوف تطبخ تقليد سيرتشيا.,324,3.837552547454834,3.4731903076171875,3.3425891399383545
116878,The horseshoe,anthony,4,قال حاذوس الحصان أن الحصان شيء رائع القول أنه يمكنك أن تطير عالياً في السماء إذا كنت ترتدي حديقه حصان يمكنك أن تطير عالياً,207,3.688614845275879,3.505971670150757,3.3258979320526123
33206,Snow is Good,anthony,4,عندما أستيقظ أرى الثلج، جاء الشتاء وأنا أعرف حقا. أنا أعرف حقا لأنني أرى. انها حقا لامعة، أوه نعم في الواقع. إنها تلمع لطيفة، إنها تشرق أنيقة تقريبا مثل الشمس في البحر.,190,3.8359875679016113,3.57167387008667,3.3193840980529785
87801,The dog and cats,anthony,4,ذات مرة كان لدي كلب أكل الكلب خنزير الكلب ذهب للضباب ذهب الكلب للضباب القطة ذهبت لالتقاط قبعة القطة كانت الدهون القطة جلست القطة,130,2.4533464908599854,3.168600559234619,2.992863893508911
120189,Jumping!,anthony,4,"عندما استيقظت في صباح أحد الأيام، كانت هناك خروف على رأسي. سألت، ""ما الذي تفعله هناك؟"" نظر إلي وقال، ""يقفز!"" عندما استيقظت في الصباح التالي، كلب كان على رأسي. سألت، ""ما الذي تفعله هناك؟"" نظر إلي وقال، ""يقفز!"" وعندما استيقظت في الصباح التالي، كانت بقرة على رأسي. سألت، ""ماذا تفعل هناك؟"" نظر إلي وقال، ""يقفز!"" أخيرا، سألت الحيوانات، ""لماذا تقفز على رأسي؟"" نظروا إلي وقالوا، لأننا نحاول مساعدتك على النوم.",529,2.9521851539611816,3.52341365814209,3.129162549972534
104828,My Mother And My Brother,anthony,4,وامّي وأخي لطفاء الى آخر. امي واخي مهزومان جدا لانهما دائما ما يلبسان حذاء. يحييان دائما الى الملوِّث. عندما يصنعان فطيرة تمس السماء. امي وأخي مختلفان جدا عن بعضهما البعض.,263,3.80000376701355,3.4360265731811523,3.315746545791626
96064,My wii,anthony,4,كان هناك يوم كنت ألعب فيه الواي عندما حصلت على رغبة مفاجئة للذهاب والتبول فركضت بأسرع ما يمكنني,214,2.7115519046783447,3.412384271621704,3.0268139839172363
90323,Baseball,anthony,4,أنا أحب أن ألعب رياضة البيسبول. والدي هو المدرب لذلك أحاول بجد. عندما أغط في النوم في الليل أحلم بالبيسبول في رحلة. أنا أحب الرياضة، وأنا أحب اللعبة، وأنا سوف تظهر أبي I'm قاعة البيسبول من الشهرة.,225,3.82584285736084,3.6047983169555664,3.3934366703033447
42424,Hello my name is joe,anthony &amp; matt,4,أنا متشرد أحب أن أذهب في الثلج مع إصبع قدمي المسمّى مو أنا أحبّ ماك دونالدز كما تعلمون اسمي جو وأصبعي مسمّى o,128,3.3367035388946533,3.155467748641968,3.27356219291687
104974,Cheese,antiyonna,4,أكره الجبنة التي تجعلني أعطس، أكره الجبنة التي تصيبني بمرض، أكره الجبنة، لزجة جداً، أكره الجبنة التي تجعل كلبي يحصل على البراغيث!,142,2.175049066543579,3.663593292236328,3.189399480819702
104955,Love hurts,antiyonna,4,عندما يجرح حبّك كلّه في جانب أنت تحبّ الحبّ جيد لكن في وقت ما هو ليس لكن الحبّ مجروح فقط كن لطيفاً و سيكون لديك حبّ مرّتين,214,3.365774631500244,3.340414047241211,3.318254470825196
75161,Orange Suit,antoinnette,4,برتقالي، برتقالي، برتقالي، برتقالي، برتقالي، برتقالي، برتقالي، برتقالي، برتقالي لطيف في بدلتك البرتقالية اللامعة,123,3.470179557800293,3.262098789215088,3.274644374847412
61955,All my Heart with God,antoino,4,« في عيني » أي في عيني « من كل قلبي » من كل قلبي « ويفرحني » بالياء والتاء « في الحياة الدنيا عند الله » أي الجنة « والله عليم » بخلقه « حكيم » في صنعه .,77,4.184768199920654,3.69014835357666,3.4079270362854004
91443,Scooter Patooter,antonia,4,اسمه هو سكوتر، لقبه هو الباتوتر. هو حيواني المحشو، مع شعر بري رمادي طويل. في بعض الأحيان يمكن أن يكون مثل هذا المعطف.,159,3.1336236000061035,3.0561814308166504,3.2057576179504395
66931,The  Monster,antonio,4,رأيت وحشاً يأكل كركنداً في المعرض على أساس التكلفة كان الوحش صغير جداً لذا الطريقة الوحيدة التي يمكنني أن أراها هي لأنها كانت لامعة كان الوحش أخضراً لكن عندما أخذته للمنزل صرخت أمي,622,2.6224639415740967,3.4241766929626465,3.045311450958252
116676,Cats,antonio,4,أريد أن تذهب قطة إلى متجر للحيوانات الأليفة أريد قطة تشتري طعاماً للقطط أريد قطة تشتري أطباقاً للقطط,267,3.2911124229431152,3.221588134765625,3.2588083744049072
104982,Football,antonio,4,أدعى (أنتونيو) ألعب كرة القدم وأنا أبدو موحلاً جداً لأنني ألعب فقط مع كرة القدم أنا ألعب مع أصدقائي,177,3.545586109161377,3.380183219909668,3.326308012008667
21605,Hammer,antonio,4,وارى ان المقبض الخشبي والقمّة اسود او ايّا كان لونه ولكن هذا هو الجزء الاثقل. عندما تدق على الخشب يكون صاخبا.,133,2.861730098724365,3.1341328620910645,3.1603896617889404
102999,Cheese,antonio,4,أَكلتُ a جبنة عفنة تَشتمُّ مثل a جبنة عفنة اللون كَانَ أخضرَ الثقوبَ كَانتْ زرقاءَ,94,2.4028611183166504,3.1768925189971924,3.024019956588745
