id,title,author,grade,text,char,valence,arousal,dominance
18164,Zack Be Jumble,ashley,6,zack zack zak zack أن تكون الدهون zack مطاردة من قبل فأر سمين,57,2.48835563659668,3.2525382041931152,3.1887662410736084
19193,Sabrina,ashley,6,قطتي برتقالية و سوداء تحب أن تضع على ظهرها,94,3.475639820098877,3.237516403198242,3.2130863666534424
17753,Bob,ashley,6,لدي صديق اسمه (بوب) لديه أسنان أرجوانية ولديه أنف أصفر ويحب أن ينمو بطاطس. (بوب) لديه قبعة بها قطة وردية في المقدمة. يرتديها في كثير من الأحيان. (بوب) يقول مرحباً لكل فتاة ورجل يمر من هنا.,234,3.435288906097412,3.1721506118774414,3.253330945968628
27667,Love,ashley,6,الحب هو شيء يمكنك أن تجده. الحب هو الصبر. الحب هو نوع. الحب ليس وقحاً. الحب ليس فخوراً. الحب ليس فخوراً. الحب ليس عالياً. الحب ليس عالياً. الحب شيء يمكن أن يأتي إليك أو يمكنك أن تجده، الأمر متروك لك. يمكنك أن تعطي الحب في أي مكان، ولكن الحب ليس شيئاً يجب أن نجنبه الحب هو حقيقة. أظهره حقيقة لأن الشخص الذي تحبه قد يحتاجك حقاً.,508,3.600383281707764,3.4221014976501465,3.384927988052368
19573,Hi,ashley,6,# هناك قيد الثبات هناك #,17,3.548368453979492,3.178682327270508,3.206047534942627
14783,Door knob ditch,ashley,6,يَرْكضُ ويَختفي ثمّ يَرْكضُ ثمّ يَعُودُ ثمّ يَعُودُ ويَضحكُ بالفخر ما أنت عَمِلتَ كَانَ مرحَ حقاً لكن إذا إكتشفوا بأنّك من الأفضل أن تَرْكضُ,128,3.3201866149902344,3.4964585304260254,3.351015329360962
20335,Inside-Outside Poem,ashley,6,أنا نفسي الداخلية والخارجية مختلفة كما يمكن أن تكون. أنا نفسي الخارجية تختلف عن بعضها البعض. أنا أتفاوت من حيث الطول ولها شعر بني قصير. مع بالكاد أي نمش وعيون زرقاء خضراء زاهية. مع اختلاف أسناني المستقيمة والكثير من الناس الذين يحبون نفسي الداخلية,481,3.364488124847412,3.392124652862549,3.226775646209717
85537,Love,ashley,6,استيقظت الليلة الماضية عندما رأيت حمامة هناك جاء شعور بالحب. كنت مستلقيا هناك في السرير أفكر في ما رأيت الحمامة، بدأ للتو في النوم. استيقظت في الصباح وشعرت بالارتجاف جدا واكتشفت أن كل شيء كان حلما.,260,3.525108337402344,3.630402088165283,3.118491649627685
27664,Love,ashley,6,الحب هو شيء يمكنك أن تجده. الحب هو الصبر. الحب هو نوع. الحب ليس وقحاً. الحب ليس فخوراً. الحب ليس فخوراً. الحب ليس عالياً. الحب ليس عالياً. الحب شيء يمكن أن يأتي إليك أو يمكنك أن تجده، الأمر متروك لك. يمكنك أن تعطي الحب في أي مكان، ولكن الحب ليس شيئاً يجب أن نجنبه الحب هو حقيقة. أظهره حقيقة لأن الشخص الذي تحبه قد يحتاجك حقاً.,549,3.600383281707764,3.4221014976501465,3.384927988052368
26950,My class,ashley &amp; sonja,6,في وقت الاستراحة وقت اللعب لكن في بعض الأحيان نقوم بعمل مختلف على أي حال. عندما يكون وقت الغداء لدينا لتناول الطعام.,342,2.598708152770996,3.1849732398986816,3.0515658855438232
66199,Bluebells,ashley mae,6,ازرقاء الازرق ازرق امي لديها الانفلونزا اتمنى لو كان لدي ازهار,80,2.4552927017211914,3.145819187164306,2.897749423980713
19572,Cat,ashley*,6,هل تعرف أين تقع قطتي السمينة؟,57,2.9772210121154785,3.080953598022461,3.141732215881348
101061,My Cat,ashli,6,لقد كانت غاضبة جداً لقد كانت تتصرف بسوء شديد كانت لديها شوكولاتة على مخالبها وعلى مخالبها الصغيرة,178,2.659179449081421,3.5447802543640137,3.1414225101470947
43807,My Siblings,ashliegh,6,أختي وأخي الصغيران لطيفان جداً أحبهما مثل كيس من الغنائم,188,4.455133438110352,3.941582679748535,3.409248113632202
75250,Summer Time,ashlin,6,إنه ممتع حقاً لكن من الواضح لي أنه يأتي مرة في السنة أعتقد أنه قد تم تقريباً في الصيف,220,3.1562154293060303,3.3894433975219727,3.1469626426696777
103548,The Most Wonderful Time of the Year,ashlye,6,تزخر الطيور بالنسيم تهب الشمس تشرق الشجيرات تُبرِز الأزهار الموجة التي يُوجّه بها الهواء الدافئ,171,3.7034947872161865,3.5126895904541016,3.2827091217041016
120525,Broken Cracked Sidewalk,ashlyn,6,أنت لا تزال واقفاً على هذه الأرض حرّة جداً. شقوقك تملأها المياه عندما تُمطر. حُفُزك تُرق وتسقط من وقت لآخر. أنت تحمل وزني بينما أسير عبر سطحك. مكسورة مكسورة. مكسورة. مُحطمة. مُحطمة. يريدون أن يُمزّقونك. لا يريدون إصلاحك. لا يريدون أن يُساعدوك. لا يريدون مساعدتك. لا يريدون مساعدتك. لا يريدون مساعدتك. لا يريدون ذلك. لا يريدون أن يساعدوك.,1277,2.8050239086151123,3.223236083984375,3.0840394496917725
108624,Sorry,ashlynn,6,أنا آسف لأنني لا أعرف ما يجب أن أكتبه لأن كل شيء أبيض! أحيانا أشعر بالإحباط حتى يرفعني عن الأرض! أحياناً أشعر بالأعلي وأحياناً للأسفل حتى يعيدني أصدقائي إلى هنا. أحب أيضاً أن ألعب إذا أردت أن تلعب بشكل جيد ثم أريد أن أبقى!,375,3.0393452644348145,3.7400405406951904,3.161355972290039
106642,Lions-,ashton,6,في النهار يذبحون صلاهم ليأتوا بالطعام الى البيت لاشبالهم الذين هم وحيدون لهم عمل كثير قبل ان يناموا يريحون اولادهم وهم يبكون.,184,2.7357428073883057,3.218942642211914,3.017053365707397
16272,Dogs,ashton,6,هم يأكلون كالخنازير هم لا يحبون العققاق فقط الكلاب فقط هم يحبون لعب لعبة فريزي شعرهم هو حقاً فريزي هذا يجب أن يكون كلب عادي كبير وصغير و طويل حقاً يحبون لعب الكرة هذا هو كلب عادي,219,3.293953895568848,3.167231321334839,3.246500253677368
28826,Basketball,ashton,6,أنا أحب اللعبة كما يتم لعبها في الملعب بشكل رفيع ونظيف جدا ونظيف صفراء و ازرق و ازرق كل كل لطيف وطلت الشباك معلقة من السقف كل كل الأبيض و نظيفة كرة السلة كرة السلة,245,3.8915507793426514,3.5041658878326416,3.386274099349976
110375,Pens Erasers and Pencils,ashtyn,6,أنا خائفة من المحن، بسبب ما يفعلونه. حقيقة أن شيئا ما يمكن محوه بهذه السهولة. غير طبيعي وغير مسموع به. مثل الآخرين: أريد أن أكون قلما غير مثبت وترك علامتي. لا أريد أن أكون بيرونا آخر يموت بسهولة في فيلم. لا أريد أن أكون قلما؛ أريد أن أكون قلما.,313,2.7208738327026367,3.352537155151367,3.199930191040039
95154,FRIENDS,asia,6,الاصدقاء هم الاصدقاء عندما لا يكون احد غيرهم لا يضغطون عليك مثل العنب الازرق,276,3.219773054122925,3.2387466430664062,3.239197015762329
94431,Track,aspen,6,هو حقاً ممتع إذا كنت ترغب في الركض الآن بما أن لدي لحم الاختبار أستطيع أن أتفوق على أفضل ما يمكن حتى إذا كنت ترغب في الحصول على الكثير من المرح,174,3.803649663925171,3.559144973754883,3.440139055252075
84512,Best friends,aspen,6,أفضل الأصدقاء لم ينتهوا أبدا الحصول على ظهورنا تلك هي الحقيقة أبدا كذبة إلى جانبنا الحب بعضنا البعض مثل الأخت أو الأخ سوف يهتف لك,207,3.822263717651367,3.76403284072876,3.45464301109314
45944,Flowers,asya,6,الأزهار حلوة هناك جميلة وجميلة رائحة تلك المصاعد في الضوء المبكر الأزهار تأتي فقط في أوقات معينة,171,3.870559930801392,3.386847496032715,3.28490948677063
45350,Dogs,asya,6,هناك كلاب لطيفة هناك، الفراء والحلوى، هناك متعة للعب مع، أنها يمكن أن تكون أفضل صديق الخاص بك رفع عالمك أعلى ثم أي وقت مضى الكلاب.,154,3.926553249359131,3.438244342803955,3.304319143295288
120805,A good friend,asya,6,اذا كنت في حاجة يكونون كبذرة. تعلّم وتنمو كواحد. هي السحابة. انت المطر. هم حقا صديق صالح.,140,3.522982120513916,3.248321056365967,3.27412486076355
83932,Beliveing,atanas,6,أن تؤمن بنفسك ما هو الشيء الشائك الذي تفعله لتؤمن بنفسك تؤمن بأنك تستطيع أن تفعلها من خلال أن تسألني ماذا أفعل.. أن تؤمن بك.,176,3.2170138359069824,3.4125304222106934,3.2935550212860107
35524,This Place,atom,6,هذا المكان، هذا المكان هو حار. هذا المكان بارد. هذا المكان من التفكير. هذا المكان قديم. هذا المكان هو بيتي وهذا هو المكان الذي أعيش فيه.,163,3.22566032409668,3.1626996994018555,3.1793859004974365
114801,Why A Stork?,aubree,6,ذات ليلة كنت مستلقياً في السرير ثم فجأه كان ستورك على رأسي ثم مع كل الخوف استخدمت كل ما لدي من قوة لتحريك اللقلق وسعيدة أنها لم تعض,424,2.584350347518921,3.6662962436676025,2.9404163360595703
29022,My World,aubrey,6,"مرحباً بكم في عالم الألغام هذا. إنه لطيف جداً ومقدس! لا تجلسوا هناك وتتنهدوا كما تقولون ""رجاءً!"" يمكنكم الجلوس طوال اليوم بهدوء. يمكنكم البقاء طالما تحتاجون ستجدونه لطيفاً تماماً كما تتقدمون! السماء حمراء العشب رمادي ولكن أبقوا قليلاً على أي حال. بعيد عن كل مخاوفكم لا تخافوا. لا حاجة للدموع! بعيداً عن كل مشاكلكم وأفكاركم في عالمي سوف تضيعون.",437,3.9753689765930176,3.695443630218506,3.3706610202789307
110189,The Beautiful Tree,aubri,6,شجرة جميلة خارج بيتي. الشجرة الجميلة كانت أكبر من فأر. شجرة جميلة مليئة بالضوء. حتى في الليل المظلم. أنا أحب شجرتي الجميلة الصغيرة ولا أطيق الانتظار لرؤيتها. شجرة جميلة صغيرة تعيش بداخلي، تتحول إلى شجرة كبيرة جميلة.,302,4.179433345794678,3.7136292457580566,3.389148235321045
53300,Beautiful Horse,aubrianna,6,حصان أحلامي... ......................................................................................................................................................................................................,359,3.9049015045166016,3.6448705196380615,3.3255364894866943
28232,Dolly,aubry,6,(دولي) كلبي حيوان أليف رائع، (دولي) كلبي لا يحب أن يتبلل، (دولي) لا يستحم في الماء كما هو الحال في أغلب الأحيان، (دولي) يستحم في الشمس، ويخبز مثل الخبز. تحب الركض واللعب مع كل يوم. إنها تهدر وتنبح في السناجب يوما بعد يوم. تحب علاجها وتتوسل إلى أكثر من ذلك. تلعب دور الميتة وتسقط على الأرض. (دولي) تفتش الساحة بحثاً عن الأصدقاء للعب. تأمل أن تكون صديقة لبطة يوماً ما. في النهاية، (دولي) أفضل صديقة لي.,459,3.657147884368897,3.3641486167907715,3.271308422088623
51904,Sammy,audrey6h,6,إنها تجعلني سعيداً، هي لا تفشل أبداً! عندما تذهب للخارج، تطارد كل القطط، كانت تطارد أي شيء، من قطة إلى فأر!! إنها تهتم بنا جميعاً. ولكن عندما ترى عظمة أو علاجة، كانت تقايضنا بسرعة كبيرة!,314,3.9383277893066406,3.8696038722991934,3.3957459926605225
109120,Sunny Day!!!!!,audrie,6,الملاك سيكون لديه الكثير من المرح مع صديقتها هذا الصيف تحت الشجرة كل شيء مشكوك فيه خلال اليوم الذي قررنا الذهاب فيه إلى الأماكن المرحة التي كنا نخطط للركوب في السيارة كمرح كما يبدو,891,3.7763168811798096,3.5202670097351074,3.295231819152832
105396,aunyae,aunyae,6,Habl & lt; b & b & b & b & gt; unique & & nat & nat & lt; bab & gt; 21 & gt; b & br & gt; amzene & & lt; b & Wgt; sy,86,3.646760940551758,3.3031959533691406,3.273137331008911
103340,Rain and snow,auralily,6,تجمّد الامطار ، تجمّد الامطار ، تجمّد الارجاء ، تشعّل ، تبصق ببرودة ، تتجمّد ، تسقط ، تجمّد ، تجمّد الثلوج ، ابيض ، حليب ، جليد .,108,2.9316205978393555,3.165716648101806,3.103539228439331
100972,Veterans,austin,6,المهم جداً منذ البداية يدخل الجيش من أجل حريتنا يبذلون قصارى جهدهم للحفاظ على سلامتنا في العمل الإضافي في نهاية اليوم يجري من خلال معارك رهيبة في الشجاعة لا أحد يفهم ألمهم وخسارتهم,267,3.167959213256836,3.3580193519592285,3.1996288299560547
95308,The boy and the bee,austin,6,كنت أسير في الشارع و دست على نحلة و لم يكن لدي حذاء على قدمي و لدغتني و أخبرت أمي بما حدث و حاولت أن تخرجه,288,3.009737968444824,3.384202003479004,3.124656915664673
79039,Little Rori,austin,6,تركض بوحشية في الرياح تركض بسرعة مع ابتسامة تشعر بالرضا عن الشعور بالحريّة مع القليل من (روري) وأنا,118,3.937309980392456,3.6706933975219727,3.337413787841797
102265,Morning,austin,6,فلما استيقظت من نومي صباحًا، كانت على رأسي قافلة. سألت: ماذا تفعل هناك؟ نظرت إليَّ وقالت.. لا شيء على رأسك.,151,2.8546392917633057,3.3239784240722656,3.0581605434417725
51506,austin,austin,6,اسمي اوستين انا رائع لكل القراء انا حقا احمق يذهب الى المدرسة,85,2.974159240722656,3.2435617446899414,3.274565458297729
30114,My New Dog,austin,6,كتبت هذه القصيدة قبل ست سنوات عندما كنت في الصف الأول اسم كلبي الجديد هو (ديزي) إنها مجنونة جداً لدرجة أنها ستقفز على ركبتي في الطابق العلوي,177,2.8481574058532715,3.505060195922852,3.097053289413452
24123,My dog,austin,6,كلبي هو كلوز، يركض إلى الجدران، يضرب رأسه، عادة ما يزحف. إنه أبيض في كل مكان، لديه أنف صغير، لديه عينان بنيتان، لا ينمو أبداً.,191,2.925323486328125,3.2594234943389893,3.145182847976685
94143,Dogs,austin,6,الكلاب لطيفة ومضحكة هناك صغيرة وسريعة بعضها كسول جداً وبعضها ليس سريع جداً مثل البولدوغ البعض مثل الماء وبعض الصيد. البعض يبقى صغيراً والبعض الآخر ضخم جداً.,168,3.512258291244507,3.336259126663208,3.2707197666168213
65462,Summer,austin,6,إنّه رائع أيضاً لأنّكِ لن تذهبي إلى المدرسة الصيفيّة ممتع لأنّكِ مدرسة مجانيّة قد إنتهت، ولديّ (جلي) الصيف رائع لأنّكِ يمكنكِ السباحة في حوض سباحة,239,3.910470962524414,3.521176815032959,3.3078558444976807
47058,Sleepy Head,austin,6,استيقظت وخرجت من الخرز واصطدمت برأسي ولبست ثيابي وبدوت كفوضى فعلت ما بوسعي لكنني لم أستطع القيام بالباقي لذا فحصي كان أكبر حشرة الآن أستلقي لأرتاح,175,2.265919685363769,3.360210418701172,2.885882616043091
83218,"Short, tall, big, small",austin,6,بعض الناس قصيرة وبعضهم طويل وبعضهم طويل وبعضهم البعض كبير وبعضهم صغير وبعضهم صغير مع كل هؤلاء الناس مثل مكان رائع للرقص والغناء والغناء,213,3.824197769165039,3.4111762046813965,3.3677279949188232
95353,Ode to rusty,austin,6,رائحتها مثل معطر الهواء، لونها بني أسود وأبيض وأبيض ولطيفة وتبدو مثل النباح,136,3.5261802673339844,3.326135873794556,3.1851613521575928
23151,Silly Hawk,austin,6,ذات مرة قابلت صقراً كان يأكل جورباً قذراً قلت أنه كان لي قال أنه قال جيداً ووجد ممسحة ثم بدأ بالقفز,125,2.81272840499878,3.1326797008514404,3.151804685592652
61477,My Shoes,austin,6,لديّ حذاء أحبّه حقاً، أكثر من دراجتي الجديدة، أحب الطريقة التي يسيطرون بها على الأرضية، لذا لا أنزلق من الباب. في حذائي أحبّ أن أركض، لأنّه بالنسبة لي من الممتع حقاً أن أرتديها كل يوم، لكن قريباً سيزولون.,249,3.749788999557495,3.456503391265869,3.3707058429718018
61498,My Tooth,austin,6,لقد فقدت سنّي فقط بالأمس، فقدت سنّي قبل أن أضربه، ووضعته تحت وسادة، و حلمت بعمتي (ويلو) عندما استيقظت ونظرت إلى سنّي، لم أستطع أن أجده على السقف. عندما بحثت تحت سريري، وجدت ربعاً بدلاً من ذلك. سألت أمي أين ذهب، لكنها أجابت بأغنية بسيطة عن بعض جنية الأسنان الغامضة، التي تأتي وتأخذ اليوبيل. وفي البديل، تترك المال، فقط لا تضحك لأنه ليس مضحكاً.,597,2.475327968597412,3.325225591659546,2.921109914779663
77334,My Puppie,austin,6,إنّه أفضل أصدقائي الذين يناحبهم ويهدرهم في الكلاب الأخرى.. ذيلي الجرو يهتز ويهتز ويهتز.. يجلس ويقف ويحصل على شيء مدهش,301,3.702581882476807,3.434733867645264,3.314673900604248
15748,The critters of the bay,austin,6,وصلنا إلى هناك على مسار الحافلات، ولكن للعثور على صياد السمك اصطاد حصان بحر، حصلت على الصيد في شبكة الصيادين،,168,2.6869497299194336,3.066214084625244,3.0627033710479736
93691,Bored,austin,6,أشعر بضجر، أشعر بالملل أنّي سألعب معه، الملل هو عكس المزاح، الملل ليس سعادة، الملل هو حزن!,123,2.116607189178467,3.4967687129974365,2.9444286823272705
48832,I Used to Believe,austin,6,لقد اعتدت ان اعيش ببنط التأجيل لكن الان انا اذهب الى النوم في الليل مع العلم انه لن يأتي احد من الناس الى اسفل المدخنة ووضع الهدايا تحت الشجرة. اعتدت ان اعيش في رجل الرقص ولكن الان انا لست خائفة انه لم يزعجني في الليل ولم يزعجني منذ ذلك الحين انا كنت اؤمن بالارنب الفصح الان انا اعلم انه اذا ذهب ارنب كبير,508,2.973095893859864,3.260747194290161,3.159633159637451
96249,Jeff the Manatee,austin,6,يهف الحوت، بقرة البحر، يأكل عشب البحر، ويسبح ببطء شديد، رمادي كالحوت، ذيل أصغر،,165,3.3601419925689697,3.4712014198303223,3.2784578800201416
96276,Reading books,austin,6,قراءة الأبواق ممتعة للقراءة عندما تكون وحيداً القراءة ممتعة جداً يمكنك أن تشعر بالتوتر تقرأ كتباً جديدة والكتب الجديدة من الممتع قراءتها.,146,4.057738780975342,3.5491888523101807,3.4136738777160645
101020,Shocking machin,austin,6,أشعر وكأنني مصدومة من آلة (كودي) الصادمة,80,2.552553176879883,3.558807849884033,2.878992795944214
85022,MY DOG SUGAR,austin,6,السكر في كلبي هو أفضل جرو تركض لتقول له مرحباً عندما تظهر هي تعطيني قبلات عندما أتأذى ثم تذهب لتلعب في التراب هذا هو السبب في أنني أحبها,208,4.015625953674316,3.8555831909179688,3.470488786697388
103251,Baseball,austin,6,أنا في الخارج في الحقل الخارجي أشتم العشب المقطوع الطازج و أسمع الصوت الطفيف للأطفال يصرخون في المسافة ينتظرون أن تأتي الكرة إلي,255,3.073310375213623,3.351670742034912,3.189208030700684
93396,My Dad,austin,6,أبي رجل عظيم شجاع وطويل، أبي شخص ليس بمجمع تجاري، أبي في بعض الأحيان صارم، لكن ليس طوال الوقت، إنه يعلمني كرة السلة، يساعدني في واجباتي، لكن أعلم أنه لا يريد ذلك، لكن لا بأس لأنه يحاول أن يجعلني شخصاً أفضل.,269,3.414794921875,3.249506711959839,3.3073103427886963
114084,A day with my family,austin,6,يوم مع عائلتي يا له من شيء فظيع إذا بقيت فقط ساعة رأسك سوف يرن ولكن إذا بقيت هادئة وتركتهم وشأنهم,190,2.3944525718688965,3.3741605281829834,2.9518983364105225
110108,A Fright In the Night,austin,6,استيقظت في منتصف الليل. كما سمعت صراخ صاخب من الخارج في الليل. ولكن عندما خرجت لم يكن هناك شيء في البصر الا الإضاءة تتحرك بسرعة الضوء.,186,2.921279191970825,3.4132885932922363,3.0079150199890137
83051,My Little Dog,austin,6,كانت أذناها هشتان كما هو الحال بالنسبة لأذنيها في ذلك اليوم المميت الذي دهست فيه أذناها بواسطة تلك الدراجة التي نقلناها بها إلى غرفة الطوارئ كان عليهما أن يقطعاها مع طفرة كبيرة منذ ذلك اليوم المميت,632,2.274500608444214,3.39444899559021,2.961597919464112
114820,The strange thing that landed on me,austin,6,كنت ألعب كرة السلة ثم سقطت حشرة غريبة على رأسي وبقيت هناك لبضع ثوانٍ وبثتني نظرت إليه كان عنكبوت طائر وتسائلت ماذا كان يفعل,235,2.387052536010742,3.443356513977051,2.8905904293060303
34479,John&apos;s Frog,austin,6,كان هناك مرة ضفدع من النهر. قبض عليه جون وبدأ في الإرتجاف. ألقى به بسرعة حقيقية، ضرب واحتاج إلى جبيرة، وأيضاً ماذا عن كبد جديد؟,162,2.81878662109375,3.234602451324463,3.11186146736145
94808,&apos;&apos;Homework&apos;&apos;,austin,6,لقد فقدت واجبي المنزلي، لا أعرف ماذا أفعل، إنّه غداً، أحتاجه اليوم.,83,2.3126049041748047,3.232419013977051,2.9246127605438232
28237,Red,austin,6,الأحمر هو أحمر هو lke رائحة من a مثل طعم من a إلى بعيد أحمر هو مثل الشعور إذا أقدامي محروقة بالشمس الحمراء الساخنة.,251,3.340749740600586,3.441336154937744,3.1843020915985107
31949,Detention,austin hart,6,عندما أكون في الحجز، أشعر وكأني في المنزل، أستطيع أن آكل، أنام، وأعمل واجبات منزلية هناك، عندما أكون في الحجز، لا أبالي، لديّ تلك الفائدة الإضافية، لكن الآن أريد أن أكون في أي مكان آخر غير الاحتجاز.,212,3.044017791748047,3.3318748474121094,3.201995611190796
83465,The Monkey On the Ball,"austin, donovan, anthony",6,أنا قرد، أنا حقاً غريب الأطوار. أقفز على الكرات، و أقفز من الجدران. أنا لست طويلة، أنا لست صغيرة. أنا متوسطة، مثل كرتي الحمراء الكبيرة.,157,3.199751615524292,3.177009105682373,3.240029573440552
26280,My Brother&apos;s Fish Tank,austyn,6,لم تلاحظ حتى الوقت الوحيد الذي تلاحظ فيه أنه عندما يحين الوقت لإطعام السمكة,239,2.840245723724365,3.0055091381073,3.039334774017334
