id,title,author,grade,text,char,valence,arousal,dominance
99733,Silver Sliver,anna,6,جديد، نصف، نجوم ربع سنوية هي أنها مسطحة من الفضة، مشرقة، مشرقة في الليل ترفرف، عائمة، عالية في السماء الوقت، الفضاء، الحياة لا تزال,222,3.377038717269897,3.2528891563415527,3.227948904037476
60981,Bungie swing,anna,6,انظر إليّ أرجح، أقفز عبر الهواء، على الأرجوحة، أتراجع، مع النسيم، ابدأ من جديد، ابدأ من جديد،,235,3.669170379638672,3.532876968383789,3.34907341003418
60982,Funny Bunny,anna,6,ذات مرة قابلت أرنباً مضحكاً، ناعماً كالريش، وكأخضر كالمال، بالتأكيد كان يطير، عندما التقطته، ثم عبأته، ثم طار، لقد وجدت الآن، ما هو الأرنب هذا،,268,3.616803169250488,3.4882540702819824,3.2696895599365234
75379,Home Sweet Home,anna,6,مكاني المفضل هو في مكان ما حيث أكون في بعض الأحيان لوحدي حيث يمكن لعقلي أن يتجول، وحيث يمكن لأفكاري أن تتجول مع الكراسي المريحة والناعمة، والأسر الدافئة والحرائق عندما يكون مكاني المفضل بارداً,830,3.739952802658081,3.481447219848633,3.303922653198242
96678,My Dog,anna,6,يُطاردُ ذيلَه، مضحك مثل عندما يَضِعُ أَبَّي كلبَي تحت الغطاءِ، هو مُدمنُ كلبِي.,91,3.365275859832764,3.4226791858673096,3.286728620529175
96665,My Niece,anna,6,ككب كيك، وضوء و مُضحك، بعمر شهور طويلة، يقف على نيتي,74,3.855263948440552,3.521817207336426,3.3145458698272705
100640,Ode to Winter,anna,6,لا أحد يستطيع أن يقارن بجمال لا يمكن لأحد أن يكون قاسياً أو متغطرساً ببطانيات رائعة من الثلج الأبيض العمي كيف يمكن لأي شخص أن يستدير إلى ظهره ويقول لا يوجد سحابة سميكة قد تغطي السماء الزرقاء الأزرق ولكن الجميع يعلم أن الشتاء ليس رجلاً سيئاً في الشتاء,907,3.2669715881347656,3.445375919342041,3.1802961826324463
99722,Student,anna,6,أنا طالبة في وظيفتي هي أن أتعلم أني طالب أنا طالب عقلي يتقلب عقلي ويدور مدرسيني رائعين! مديري رائع! أنا طالب بيتي في المدرسة.,172,4.104068279266357,3.783223152160645,3.4258298873901367
118655,Summer,anna,6,مع الشمس نسبح بينما هناك نسيم نحب المرح الصيفي,88,4.094130516052246,3.56243109703064,3.38997220993042
87097,The Missing Shoe,anna,6,حذائي كان حذائي، فقدت حذائي وأنا حقاً أحتاج ذلك الحذاء، كان تحت سريري كيف أفلت، أنا حقاً بحاجة إلى ذلك الحذاء آمل أن أجده.,152,2.6001670360565186,3.3996782302856445,3.059403657913208
87106,Colors,anna,6,هناك ألوان في جميع أنحاء العالم، العالم مثل قوس قزح هو أحمر، أبيض وأزرق مثل العلم الأمريكي هناك أخضر مثل العشب الرائع الذي أحب الألوان هناك في جميع أنحاء المكان.,194,3.996917724609375,3.572449207305908,3.330411434173584
103553,Less is More,anna,6,ببرود بارد ورطب يزدهر و ضعيف جداً و ضعيف جداً يَمُوتُ,66,2.585823535919189,3.0936808586120605,2.9642436504364014
105233,Masha,anna,6,أنفها وردي كضوء البحر. عندما تركض تبدو وكأنها قطيع من الأحصنة. أسودها وأبيضها ناعم مثل الوسادة المخملية. تحب أن تلعب الحيل على الناس من أجل الطعام. وعندما تشعر بالوحدة تأتي وتعانقك.,247,3.5412771701812744,3.403698682785034,3.180562257766724
53680,Annabana is my name,anna,6,"اسمى هو ""نا بانانا"" و ""باننانانا"" ليست غير مهذبة إنها مصفرة مع النقاط الحمراء (لا يوجد لديها جدرى) تحب الرقص طوال اليوم ثم تغني أغنية ""بانانا""",191,3.341896772384644,3.2538695335388184,3.251788377761841
65595,dreamz,anna,6,هناك الكثير من الأشياء في الحلم أنه من الضروري جداً أن ترى ur justv a dw,82,3.731718063354492,3.495743751525879,3.255866765975952
34421,Busy Streets,anna,6,الناس، الناس في كل مكان يسيرون في الشوارع، يعودون إلى ديارهم من العمل في سن الخامسة مستخدمين أرجلهم المُتعبة قرونهم تُزمّرُ أضواءَ يُغيّرُ الناسَ يَصْرخونَ ' tatci! '! ' الشمس تَغْلقُ طبخ العشاءَ يَستعجلُ لِكي يَكُونَ بيتاً.,231,2.907735586166382,3.609067440032959,3.1067495346069336
100201,Drifting in a Far Away Land,anna,6,سحابة تتقلب في الهواء، السماء تطفو بشكل جميل، النجوم تتألق ليلة سعيدة!,80,4.098703384399414,3.764434576034546,3.350287437438965
52282,Wishes,anna,6,"ضوء نجمي، نجمة مشرقة، نجمة أول نجمة أراها الليلة، أتمنى، أتمنى لو، أتمنى، أتمنى أن أتمنى هذه أمنيتي هذه الليلة. الدب القطبي ينظر إلى البحر اللامع ويفكر ""ألن يكون لطيفاً إذا عادت السيدة الربيع مرة أخرى وذوبان الجليد البارد المظلم!",466,3.182377338409424,3.3754241466522217,3.134944200515747
52284,Wishes,anna,6,ضوء نجمي، نجم مشرق، نجم مشرق، نجم أول نجمة أراها الليلة، أتمنى لو، أتمنى، أتمنى لو، أتمنى، أتمنى هذه الأمنية أتمنىها هذه الليلة. الدب القطبي ينظر عبر بحر مشرق ويفكر,172,3.280848979949951,3.313084840774536,3.1758859157562256
93453,A Scary Teddy,anna,6,دميتي مشعرة جداً لدرجة أنها مشعرة ومخيفة - دميتي عبارة عن هيكل عظمي للهلوين مما يجعلها أكثر رعباً -,120,2.425624370574951,3.3781380653381348,2.975862503051758
51376,Mr. Mean,anna,6,هو لا يريدني أن أذهب لكن ألا يعرف أن يساعدني مع الشك بأنه هو,179,2.389124870300293,3.406119108200073,3.1580965518951416
92489,The sun gave me something,anna,6,"الشمس أعطتني شيئا. تبدو وكأنها ريح برائحة جميلة. سقطت كبطانية تغطيني باللينة. تجعلك تشعر بالشجعان ، وتضحك مرة أخرى لتضحك لتجعل الكئيب الصغير يفشل إليك. أعطتني الشمس شيئا لا يمكنك أن تراه لا تأكله ولكن يمكنك أن تبتسم به. تساعدك على الوقوف مرة أخرى من الحزن ، الحزن ، واليأس . تساعدك على الابتسام مرة أخرى ، ودعك تقفز أعلى من الزمان. كان ""شيء"" حاضرا يسمى ""أشجع"".",587,3.8028528690338135,3.590292453765869,3.293907403945923
38102,SNOW,anna,6,"الثلج الخارجى مثل التندرة البيضاء، إنه أبيض مثل البومة الثلجية، إنه هادئ جداً بالخارج، هادئ جداً يمكنك هنا عواء الذئب. الشوارع سميكة جداً مع الثلج، لذا ذكية وممتع أن تنزلق عليها، لكن إذا حدث أن انزلقت وسقطت، انهض بحذر إضافي. الناس صعوداً وهبوطاً، هم خارج الطريق، يبنون رجال الثلج، وعندما يمشي الناس بجوار منازلهم، يصيحون، ""هيه الرجل""! معارك كرة الثلج ممتعة أيضاً، لا تضربني في وجهي، ارمي بقدر ما تستطيع، إذا أردت الفوز بالسباق.",503,3.3981337547302246,3.490481376647949,3.309434652328491
102251,The DogDozer,anna,6,(لدي كلب اسمه (بيلا) أدعوها كلب (دوزر) أدعوها بهذا لأنها إذا قابلت شخصاً ما لا تعلم أنها ستجرفهم على أنها كلب محب جداً,252,2.779406785964966,3.335186243057251,3.2182066440582275
27865,You Can,anna,6,يمكنك أن تكون بطلاً، يمكنك أن تكون عاجزاً، يمكنك أن تكون صفراً، فقط لا تتصرف بحماقة. إذا قلت أنك تريد ذلك، هيا، إذا أردت أن تكون مناسباً، لا تبقى في السرير. إذا كنت تريد أن تكون نجماً، أو تعزف غيتاراً، يمكنك أن تذهب إلى أقصى حد تتمنى، يمكنك حتى أن تصطاد سمكة. شغل ضوءك، وتسلق تلك التلال، أظهر أنك مشرق، وابقى بعيداً عن الحبوب. إذا ذهبت بعيداً عن المسار، أو حتى الرحلة والسقوط، عد إلى الوراء، وانهض.,447,3.170344829559326,3.394155502319336,3.3929662704467773
97559,Summertime,anna,6,الصيف مع الايس كريم، والرش والحلوى الساخنة على القمة، بارد بارد يبرد في حلقي.,83,3.181717157363892,3.3802168369293213,3.141697645187378
18967,The Beach,anna and olivia pms,6,كيف يمكن للشمس أن تتألق في يوم صيفي؟ كيف تتألق المياه اللامعة؟ في الوقت الذي تقدم فيه الرذاذ. الجلوس في الشمس أصبح أكثر سخونة بكثير. أثناء الليل هناك العديد من البوم. بدون كرة الشاطئ أشعر بعدم اكتمالها. في الوقت الذي لا نتعلم فيه عن السندلات. أذهب إلى الحانة والبيتزا التي آكلها هي الجلوس على الشاطئ وشرب كوكايين بارد. الشاطئ دائماً لطيف، ساخن، ومشمس. في اللطف، بارد، ماء، أحب أن أغرق. الأطفال على الشاطئ مضحكون حقاً. وقت الشتاء محبط جداً. في الشتاء، هناك طقس بارد.,575,3.4517412185668945,3.3538498878479004,3.2187068462371826
78306,About Me,"anna,maria",6,أنا صغير كما كنت صغيراً، وأنا سريع الوتيرة كالدب، أنا جميل مثل الفراشة، أنا سريع مثل الهارب، أنا سريع مثل الهارب، أنا مهذب مثل الظربان، أنا شهواني كالظربان، أنا غبي كالأنملة، أنا ذكي كالقرد، أنا ذكي كالقرد، أنا مخيف كالغورة، أنا خجول كاللينكس، أنا خجول كاللينكس، أنا أغني مثل الطير، أنا مثل الطير، أنا مثل الثيران، أنا محبوب كالطيور,933,3.423281669616699,3.340512275695801,3.223599433898926
28810,MY DAY,annabelle,6,يوم جميل آخر، يوم مشمس آخر وحياة أخرى، الشمس مشرقة، أريد أن أصرخ، الهواء يهب على وجهي، أريد أن أستلقي وأشعر بالهواء.,170,3.828769207000733,3.740697145462036,3.3280723094940186
25208,U are,annais,6,كل ما أفعله هو التفكير في (أو) أنا أحب (أو) أنا أحب (أو) كثيراً كل ما يمكنني قوله هو (أو) أن قلبي (أو) هو كل ما أريده,260,4.342299938201904,3.909446477890015,3.326653957366944
102113,Harry the chihuahua,annalise,6,(هاري) حلوّ كحلوّ قليلاً، مُتعَاقَبَة، يَجيءُ إلى كُلّ نَحْوِكَ هو مُكَبَّدُ على الخارج ناعم و محبوب في الداخل هو a جيد مُعانق و a مُقَبَّل mooch! هو يَحبُّ أنْ يَكُونَ كسولَ مَسْكُوس على الأريكةِ في الشمسِ كُلّ يوم قلبه شجرة خشبية حمراء كبيرة هو الكلب المثالي ولا أحد يُمْكِنُ أَنْ يَأْخذَه مِنْي.,327,4.131308078765869,3.77007794380188,3.3625338077545166
52276,Winter in July,anne,6,لقد كان الجو حاراً، رطباً، رطباً، متقياً، متعرقاً. اليوم هو بارد، أسنان تثرثر، ثلجية، متجمدة,291,2.7992732524871826,3.2483153343200684,3.041475534439087
31894,Pat,anne,6,ظننت أني أحببتك، أظن أني كنت مخطئاً، لقد حطمت قلبي وجعلتني أبكي، أعطيت العالم لك، أليس هذا كافياً؟ لا تأتي باكياً لي، عندما يتم التلاعب بك,330,2.1928091049194336,3.7615067958831774,3.1714179515838623
59425,summer,anne,6,النحل يحصل على العسل، الحلو، الدافئ، والكلاب المشمسة تجري بشكل مضحك.,64,3.7760910987854,3.41890025138855,3.26357102394104
39306,The Ghost Mare,anne,6,لقد سمعت حكايات محفورة من الهواء، تقريباً... شبح الفرس. قالت لي أن أخرج في الليالي المظلمة على الكثير من الناس الذين تركت لهم علامتها. ولكن مع ذلك، ليس هناك شيء أكثر من لمحة. إنها تمر بجانب رقصتها في منتصف الليل. جميلة، غامضة، أرى سبب خوفها. أنا أنظر مرة أخرى، إنها اختفت.,374,3.247297763824463,3.4406168460845947,3.182446479797364
46958,The Call Of The Robin,anneliese,6,"من شجرة إلى شجرة تسأل في أغنية ""تنضم إليّ""! نظرت في الأرجاء لأرى إن كان هناك أحد يتجسس. ""حسناً،"" قلت تهتف. لا أعرف كيف، لا أعرف لماذا ولكني بدأت أطير! ومعاً ترفرفرفنا من شجرة إلى شجرة. كان ممتعاً، كان عظيماً، صدقني!",293,3.867619514465332,3.777742385864258,3.319873571395874
75318,Lights are flashihg,annemarie,6,هم قادمون إلى اليوم! من، ماذا، لماذا؟ يجب أن نموت! يجب أن نهرب. نحن؟ نعم، نعم، يا لها من فوضى. من فضلكم أخبروني من هم؟ من هم؟ كائنات فضائية! مع البليين! يجب أن نطير إلى اللقاء! إلى اللقاء! إلى اللقاء!,266,2.749917984008789,3.965463638305664,3.136814594268799
108150,Alone,annemarie,6,لا أحد يفهم، t t t t n t n t n t n t t n t t t t n t n t n t t n t t t t t t t t t t t t t t t t t t حياة n t t t t t t t n n t n t t n t n t n t n t n t n n n n n t t t t n n n t t t n n t t t n n t n t n t n t n t n t n t n t n t n t n t n t n t n t n t n t n t n t n t n t n t n t n t n t n t n t n t n t n t n t n t n t n t n t n t n t n t n t n t n t n t n t n t n t n t n t n t n n n n n t n n n t n n t n n t n n n n n n n t n n n,527,2.8420543670654297,3.114900588989258,3.1026201248168945
52521,The green grabbig grass,annette,6,الشمس مشرقة، أشعر أني أطير العشب يمسك أصابع قدمي، أنا سعيد أنه ليس أنفي. بدأت أضحك و أضحك، قلبي فقط يريد أن يتذبذب. في النهاية، يتحول إلى الظلام، أنا الآن جالس على لحاء الشجرة.,211,3.958740472793579,3.85345196723938,3.2919905185699463
108223,My Life is a Bike Trail,anni,6,حياتي هي درب دراجة، لها بداية، لها نهاية، حياتي هي كتاب، كل يوم أكوّن صديق جديد، حياتي هي قلم، تكتب كل خطوة في الطريق، حياتي نهر، تتدفق على طول يوم بعد يوم، حياتي سلم، أصعد كل سلم حتى أصل إلى القمة.,283,3.342650890350342,3.142472743988037,3.2349414825439453
32717,Dictonary,annie,6,ثم قلت أني بحاجة للذهاب إلى السرير قلت بعد أن سقطت على رأسي ولكن بعد ذلك قلت يمكنني أن أتهجأ واقفاً على رأسي في السرير,176,2.4133479595184326,3.325169563293457,2.8596527576446533
32712,9-11,annie,6,لقد حدث ذلك اليوم في ذلك اليوم الذي يذرف فيه العالم دمعة بكل طريقة ممكنة تتدفق في كل طريقة ممكنة تتدفق باللون الأحمر والأبيض والأزرق من أجل آباءنا قاتلوا من أجل الأرض التي نحبها الذين يراقبوننا من فوق لذا عندما حدث يوم السبت الحادي عشر في ذلك اليوم الذي يذرف فيه العالم دمعة في كل تدفق ممكن,373,3.606029510498047,3.689666271209717,3.274470090866089
59526,Socks,annie,6,أنا أحب قطتي وهو يحبني وفروه مثل بطانية ناعمة في الليل عيناه تتوهجان في الظلام مثل مصباحين صغيرين يحدقان بي,147,3.907450675964356,3.6006407737731934,3.261554002761841
72084,Colors,annie,6,عالم مليء بالألوان الساطعة عالم مليء بالحياة,75,3.9873061180114746,3.591937780380249,3.335149049758911
109609,Horses,annie,6,« و » اذكر « إذ رأيت » يا محمد « خيلا حسناء » خيلا « فإذا رأيت » أي الخيل « فتعجب » تتعجب « من حالهم » حال « إذا سقطتم من لا تخافوا » منه « فارجعوا إلى حالكم » حال من الأحوال « فاشعروا أنف أحصانكم » أي أنفكم « الناعم » من الخيل « يبتسمكم » يبتسم لكم « فإذا حصلتم على قُبلة من خيلكم » أي قبلة من خيلكم « جعل يومكم » أي يومكم « خير الخيل من يعانقكم ويقبلكم » أي يقبلكم « إن الخيل هي أطيب الخيل » هي الخيل « النعمة » .,406,4.116437911987305,3.759053230285645,3.3784663677215576
111561,Rolanda&apos;s weave,annie,6,هو اللون الأحمر لون لأوراق (رولندا) التي علقت في حزمة من الأوراق عندما علقت هي قالت ياك وهي لم تخرج حتى عشية الهالو,149,2.528599262237549,3.0747690200805664,2.978180170059204
72049,Summer,annie,6,تَطِيرُ تَطْرِين مُنْزِعةً على الشاطئِ الساخنِ الرمليِ الآيس كريم يَذْنُ,71,2.657107353210449,3.1645288467407227,3.018129110336304
32800,I don&apos;t,anomynous,6,أنا لا أريد أن أخرج اليوم هو حار جدا للخروج واللعب أنا لا أريد أن أذهب إلى المعرض أنا لا أريد أن أذهب إلى المعرض أنا لا أريد أن لا أريد أن ألعب لا أريد أن ألعب,333,2.556839942932129,3.2126617431640625,3.130336046218872
19659,Day,anon,6,الأطفال الذين يتعلمون الأساتذة يتحدثون أن المدرسة رائعة,51,3.6920461654663086,3.3081631660461426,3.3000733852386475
17377,Hiccups,anon,6,لديّ فُصُوقاتُ أَكْرهُ فُصُقَاتَ أَكْرهُ فَتَقْلَبَاتِهَا أَنتظرُ أن يَذْهبُ أولئك الـ فُصُقُوبُ بعيداً,82,2.582496166229248,3.244547128677368,2.993701219558716
18279,Kids,anon,6,نحب أن نتحدث، نحب أن نسير، نحب أن نتحدث!,54,3.886115550994873,3.653509140014648,3.3823845386505127
18536,School,anon,6,أحب أن هذا يَعْرفُ لِماذا تَتكلّمُ بدون دور؟ أَنا آسفُ، أنا لَمْ أُردْ أَنْ أَكُونَ وقحَ رجاءً اغفر لي فرصة أخرى لتحظى بيوم جيد,161,3.8142268657684326,3.5119564533233643,3.336832046508789
59682,Kody,anonamous,6,من الرائع أن يذهب إلى المدرسة إنه أحمق,47,2.5799360275268555,3.277790069580078,3.2836673259735107
64644,Grapes,anonmous,6,العنب مرتبط بمقوم آخر. جعل سلسلة من صالح. في الأخضر والأحمر والعنب الأسود تشكيل سوار في الحديقة. العنب. حتى يتمكن الناس من التمتع.,190,3.362687826156616,3.068573236465454,3.259622812271118
17383,Animals,anonymou,6,كل الحيوانات كبيرة والبعض الآخر صغير يمكن أن يكون قصيراً وبعضها طويل القامة والبعض من الفراء والبعض الآخر مشعر,174,3.322277069091797,3.150318622589112,3.262603282928467
34248,Harry Potter,anonym,6,السحرة، السحرة، العفاريت، العفاريت، أوجرز، لديهم إنفجار في الحثالة، غريفندور المنزل فرز يصيح، غراب كلاو يصرخ عندما يأتي الطالب التالي ليتم فرزه. التالي اثنين من الطلاب,315,3.3807687759399414,3.701736688613892,3.402163028717041
17769,Class,anonymous,6,الأطفال الذين يدرّسون معلمين يروّجون كتباً يدرّسون فيها,64,3.351222515106201,3.118521451950073,3.2341315746307373
18816,Cool,anonymous,6,« لبني أرضنا » أرض أرض أرض أرضنا « قائمون » قائمون « ومحبون » للمؤمنين .,53,3.954290151596069,3.4480228424072266,3.408318281173706
102017,Special to Me,anonymous,6,ما يقلقني هو غيابك، ما يفرحني هو حضورك. أريدك أن تعرف أنني سأكون هناك من أجلك، عندما يحين الوقت للتحرك الكبير. سأبكي على كتفك، موجة وداعًا، تسألني لماذا عليك الرحيل؟ لا تقلق يا صديقي العزيز، كل يوم رسالة سوف أرسلها. سأتصل بك على الهاتف، لذا لا تشعر بذلك وحدك.,574,3.48656964302063,3.489613771438598,3.285851240158081
39795,Free as a bird.,anonymous,6,أتمنى لو كان بإمكاني الهروب من الجدران أتمنى لو أستطيع الصعود إلى السماء المفتوحة أتمنى لو أن أصدقائي يستطيعون معي على حريتي أتمنى لو أن أصدقائي يمكنهم الإنضمام لمملكتي أتمنى لو أستطيع أن أجد مكاناً يمكننا فيه جميعاً أن نجد السلام أتمنى لو كان بإمكاننا أن نعيش حياة بدون خوف,464,3.047169208526612,3.4113783836364746,3.083447456359864
48685,You,anonymous,6,ربّما تكون قد دستَ في بودي، لكنّ ذلك لا يهمّ، ربّما تكون قد دستَ بعض الزبدة.,121,2.735440254211426,2.959582567214966,3.1146628856658936
48727,Myself,anonymous,6,.......................................................................................................................................................,392,2.980356216430664,3.2163426876068115,3.133309125900269
40732,Do&apos;nt look,anonymous,6,الصداقة خطأ كبير الناس يعتقدون أن التسكع ممتع لكن بعد ذلك طعنة ظهرك للمتعة,102,2.469663619995117,3.533776044845581,3.160366535186768
48674,Friends,anonymous,6,الاصدقاء مثل اوراق الشجره انهم هناك واثير تحتاجهم او لا تحتاجهم اذا احتجت الى صديق,159,3.4107666015625,3.2867207527160645,3.357966184616089
38151,The Fishrew,anonymous,6,أطقم السمك جديدة على المحيط لا تخاف منك ستفعل ما تريد وسوف تحدث لأنها حقيقية,126,3.145979881286621,3.2809371948242188,3.286798477172852
15130,My Little Fishy,anonymous,6,لدي سمكة صغيرة اسمي اسم سمكتي اسم سمكي اسمي هو مفتوح أنا أحب بلدي قليلا سمكي قليلا ولكن ليس عندما هو حزين اسم سمكتي هو فريدي اسميته بعد أبي وعندما أنا لا أطعمه انه حقا مجنون حقا,193,2.82059097290039,3.2129955291748047,3.1626641750335693
34747,Who are you?,anonymous,6,أنت، أنت أنت، لا تتسائل دائماً. إنه لغز عظيم لا تحله أبداً. من أنت الذي أنت، ألا تعتقد، يوماً ما ستجد نفسك الحقيقي داخلك. أين أنت متى ستتعلم أن من تظن نفسك، أنت.,260,3.0935091972351074,3.230851888656616,3.166378736495972
43300,I love you,anonymous,6,أنا أنتظرك الآن، أنا متلهف، أبحث عنك، لكن لا أستطيع أن أجدك، تعال إليّ، أريدك يائساً، أين تحب؟,184,3.3911938667297363,3.825026035308838,3.2021901607513428
43303,Breaking Up,anonymus,6,لقد عانقتني بالأمس، ثم اليوم تخليت عني، ظننت أنني توقفت عن الإعجاب بك، لكن عندما غادرت لاحظت أنني أحببتك، بكيت وبكيت عندما كنت غائباً، خصوصاً عندما رأيتك مع كل صديقاتك الجديدات،,383,3.4304745197296143,3.8687896728515625,3.274087190628052
43304,I love you (not anymore),anonymus,6,لـ(سارة) التي بكيتِ لها لكنتِ قد مُتّي والآن بالرغم من أن حياتي سعيدة بقدر ما يمكن، أتمنى لو أنكِ بكيتِ من أجلي.,129,2.4658970832824707,3.4640259742736816,2.932079792022705
