id,title,author,grade,text,char,valence,arousal,dominance
84711,My Inspiration,amanda,9,أنت الوحيد الذي يستطيع سماعي أدعو. إلهامي. الوجه فارغ. لكن القلب دافئ. يرفع قلبي يغرق. لديك هذا السحر. محفزي شخص ما يفهمني. صديق ليكسب. شخص ما ليمسك بيدي. ليوقفني من الألم. حياتي تألق. لأنه لطيف جداً. حنون جداً. يساعدني على التخلّص منه. هو فقط ذلك الجريء. وحتى في كل هذا التعقيد، سيكون دائماً إلهامي.,530,3.6766653060913086,3.5896787643432617,3.303872585296631
84712,Forever And For Always,amanda,9,أن يفتقدوا الحب ، أن يهربوا ، أن يهربوا ، أن يقبلوا ، أن يعانقوا ، أن يقولوا أخيراً : أنا أحبك ، الحب المشترك ، الحب المشترك ، الحب الحلو جداً ، أبقى هنا ، زوجاً جميلاً ، ولا شيء يمكن أن يهزم ، حبي عزيز جداً جداً ، بالنسبة لك فقط ، أنت تمسك بي قريباً ، إعصرني بإحكام ، وأنا أتمسك أيضاً ، وأنا أيضاً ، وتماماً تقريباً ، هذه آخر ليلة لنا ، لأنني أحبك ، وسأفعل دائماً ، لقد وقعت ، لقد وقعت في الحب ، قلبي كان ممزقاً ، لقد كسرت التعويذة ، لأنك تحبني أيضاً ، إلى الأبد ، وإلى الأبد,487,4.1050639152526855,3.8731026649475098,3.3814380168914795
118901,Love poem,amanda,9,عندما ننمو سنتعلم أنه حتى الشخص الذي كان غير قادر على أن يخذلك سوف يزعجك سوف يكون قلبك مكسور أكثر من مرة و أكثر في كل مرة. سوف تكسر القلوب أيضا. لذا تذكر كيف شعرت عندما تحطمت خاصتك. سوف تحارب مع أفضل صديق لك سوف تلوم حبا جديدا، لأن الأشياء التي قام بها عجوز ستصرخ لأن الوقت يمر بسرعة كبيرة، وسوف تخسر في نهاية المطاف شخصا تحبه,1027,2.4967613220214844,3.4751055240631104,2.994800806045532
88572,Dreams,amanda,9,عائمة على سحابة، منجرفة عبر السماء، أحلامي وآمالي ورغباتي، تمر بسرعة. لقد وصلت إلى أعلى مستوى لانتزاعها، لكنك سحبتني إلى الأسفل. أردت شيئاً آخر لي، تجاهلت عبوسي العميق، لم تدرك أن هذه هي حياتي، لدي أشياء أخرى أريد القيام بها، أريد استقلالي، أريد الحق في الاختيار.,361,3.388594150543213,3.609586715698242,3.244201898574829
21945,Jerron,amanda,9,قل الكلمات، لذا ببطئ قلها بدون خوف أنت لن تتحول للذهاب أنت لن تتركني هنا في الماضي كل ما نعرفه أن الذكريات واضحة كنت أتمنى لو كنت هنا. إذا قلت لك، هل كنت تستمع؟ هل كنت تعلم هذا من البداية؟ هل تطابق التواريخ بالضبط؟ خطتك، متى سنفترق؟ إذا لم أنتظر لسنة أخرى، أعتقد أنك ستكسر قلبي،,537,2.638356924057007,3.3654379844665527,3.0145740509033203
120639,The Moment I Knew,amaria,9,لقد نظرت إلى طريقك، فوجدت نفسي قد اشتعلت، كانت تلقائية، كانت عيون بنية معدومة، عيون روحانية، الوقت يقف بلا حراك. بدوت على علم بكل قلبي، كل ما كنت أحمله على جسمي كان حقا سلكا حيا، العالم حولنا يصبح صامتا، لأنه لا شيء منه يهم أخذته في كل سمة من ملامح وجهك المجيد: غمازاتك، شوكولاتك، وابتسامتك أعدت كل اللحظات المؤدية إلى الآن، وجعلت هذا الأمر أكثر حتمية؛ جميع الليالي المتأخرة، والضحكات، والخجلات. كيف يمكن أن تجعلني أشعر بالغرق والهلعون مثل لا أحد آخر يستطيع ذلك. لم أستطع أن أبدو أن أتحرك، لأن لحظتنا فترة أطول قليلا، فقط أنت وأنا موجود. فجأة، على ما يبدو في حركة سريعة، كان كما لو لم يحدث أبدا، بدأ الصوت مرة أخرى، والناس الذين يتحركون حولنا،,1525,3.361447095870972,3.5552945137023926,3.1438686847686768
68040,Don&apos;t junk up your life,ameila,9,لقد حلمت ذات مرة أن أغير جسمي رقيقاً نحو هدفي، مكتئب ووحيد أصبحت... أحقق هدفك، أن أكون الشخص المناسب لك!,150,3.4692816734313965,3.622113943099976,3.35038161277771
22470,See,amii,9,هل ترى وجهي؟ هل تراني أنا وأنت في مكان آخر؟ هل تعتقد أن هذا حقيقي؟ هل ترى كيف أشعر؟ هل تريد أن تكون مثلي وترى كيف يمكنني أن أحبك؟,200,3.2514572143554688,3.47121524810791,3.194225788116455
31302,Lessons Learned,amy,9,أتذكر عندما كنت في الخامسة من عمري لا أركض في الحمام قيل لي من أجلك قد تسقط وتكسر رأسك وإذا فعلت ذلك ربما ينتهي بك الأمر ميتاً حاولت وحاولت بكل قلبي,968,2.367038488388061,3.5479581356048584,2.949401378631592
31306,Pray,amy,9,ما هو في قلبك؟ ما هو في نفسك؟ هل تشعر به الآن؟ هل تشعر بأن العاطفة تزداد عمقا اليوم؟ بعض الناس لا يريدون أن يقبلوا به لا يريدون أن ينموهم هم ضعفاء في الكلمة التي هم ضعفاء فيها في طرقه عندما تذكر يسوع؟ هل يشعرون به الآن؟ هل تشعرون به؟ هل يسمعون منه من قبل؟ بعض الناس لا يريدون أن يقبلوا بها هم ضعفاء في الكلمة هم ضعفاء في الكلمة التي هم ضعفوا بها في طرقه عندما تذكرون يسوع في طرقه عندما يقولون هل يسألون من هو؟ هل يسمعون عنه من قبل؟ من سار على الماء الذي أنقذ انفسنا الذي أنقذ انفسنا من انفسنا قد ينكره البعض ويلعن اسمه المقدس,1049,2.966343402862549,3.326190710067749,3.1354310512542725
36983,Being a Kid,amy,9,أن تكون طفلاً هو أن تكون حراً تحلم بما يكبرك لكي تكون عليه الجبال في شكل تلال لديها مهارات صيد الضفادع. الحصول على الطين واللعب في المطر كونك طفلاً يعني أن تكون مجنوناً,736,3.4038801193237305,3.4815449714660645,3.222552299499512
108113,Gang life,ana,9,(هذه القصة أساسية على حياة صديقي) في حياة العصابة. من الصعب عليك أن ترى الدم والأشياء التي لم تكن حتى صورة. تاريخ 2 سنة ووقتها للقيام بتغيير. ولكن أنا بحاجة إلى المساعدة. الليلة الماضية كان لدي حلم بك ولي. كنت أفكر كثيراً أني سقطت نائماً. بعض الذكريات ماضياً، والوقت يطير. لأنني أعرف الحقيقة أنت والأشياء,1402,2.385319232940674,3.328022718429565,2.946282386779785
118705,Despondent,anam,9,"كنت أنا الكذاب لإخفاء كل دموعي من قبل. الخراب الذي مررت به، ترك كل ما رسمته لنفسي عندما ألمت، ""الألم"" هو كل ما كسبته. العيش مع رغبة، هو لا شيء يمكنني اكتسابه. وكذلك أنا محبطة، مع حياة ذكية جداً.",289,2.22389554977417,3.3439621925354004,2.804621934890747
86616,Disconnected,anbrid,9,يَحْملُ النسيمُ كلماتَ ورُوحَ من الأماكنِ، بعيداً عن الخارج وبعيداً، كما أَشْعرُ مِنْ العالمِ أحياناً فوق أحياناً في غرفتِي، النسيم لا يَستطيعُ رُؤيتي، لا يُمْكِنُ أَنْ لا يَستطيعُ أَنْ يَنْظرَ,315,3.199846744537353,3.338467836380005,3.16899847984314
18374,Baby Tigers,andera,9,في عيون النمر الصغيرة سوف تفاجئين برؤية جوهرة جميلة كأزرق كبركة,90,3.7460782527923584,3.5008108615875244,3.317341089248657
113861,The Feeling of Love,andie,9,رؤيتك هو نسيم دافئ يهب في طريقي في منتصف يوم الصيف,67,3.617507934570313,3.279963254928589,3.2731101512908936
62543,Love,andre,9,أحب الطريقة التي أنت فتاة صغيرة تحتاجني أن أقبل كل الألم، ومن ثم هزة الفرح التلقائي عندما تقول أنك تحبني مرة أخرى. أحب مرساتي في بحر متصاعد، وشريكي يسير في سماء مظلمة، ورفيقي الذي يحب اللعب معي، مرآتي وهدفي، كلمتي، عيني. أحب الشخص الذي يسمح لي أن أعيش كاثنين. كل هذا أنت لي، وأنا لك.,562,4.072569370269775,3.842720270156861,3.360287666320801
40595,Empty,andrea,9,لا شيء من الداخل، فارغ، لا شيء على الإطلاق، منعوق عن العالم، لا حياة على الإطلاق، لا حياة على الإطلاق، فارغ، لماذا؟ أنا فقط لا أستطيع أن أشرح، أزمة أنا أمر بها، والتي قد تبقى نفسها. فارغة. لا تريد أن تكون ممتلئة. فارغة، تحاول أن تكون باردة.,238,2.2705702781677246,3.181464195251465,2.825358390808105
21662,The scary ball,andrew,9,لأنني أرى كرة مخيفة صغيرة خارج نافذتي تماماً، إنها من خلال جدار طويل كبير خارج بابي تماماً، تلك الكرة المخيفة الصغيرة التي سارت مرّة في ردهتي لكنّي أحبّ تلك الكرة القاسيّة الصغيرة، لأنّه (هاري)، أرنبي الجميل، فقط مليء بالرفوف، أنا أحبّ تلك الكرة المخيفة الصغيرة.,272,3.719659805297852,3.596879005432129,3.3038456439971924
66834,Sharks,andrew,9,يصطاد البعض خلال النهار بينما يحارب آخرون خلال الليل. لأسماك القرش فك يتجاهل كل القوانين البشرية. ليست بلا فك ولكنها قادرة على ذلك، وهي بلا عيوب.,164,3.221887588500977,3.230401039123535,3.2589099407196045
64433,The Championship Game,andrew,9,اللاعبون متوترون، والمدرب متحمس، وأظافري هناك فقط لا أستطيع إلا أن أعضهم بينما نركض إلى المحكمة المعجبون يصبحون أعلى، و أعلى. البداية تشرق و كذلك اللاعبون بعد ذلك. الأول، الثاني، الثالث، و كل ما عدا النغمات النهائية من الربع الرابع تمر، و النتيجة تبقى مقيدة. عندما تمر الكرة إليّ تبدو كما لو أن العالم يأتي ليرتاح على كتفي.,556,3.356153964996338,3.55063533782959,3.29303240776062
64437,Sunny days,andrew,9,تأتي أيام ممطرة في الذهاب، ولكن عندما تخرج الشمس من شر الشمس، تتوهج ابتسامتي، وعندما تمطر، أشعر بالحزن عندما يأتي المطر، يجعلني أشعر بالغضب أيام مشمسة هي أفضل أيام ممطرة عندما أرتاح في أيام أخرى تأتي وتذهب,283,3.457724571228028,3.4483046531677246,3.2269082069396973
85809,Judgment,andrew,9,حولكم من كل جانب امامكم انه يحرس وراءكم. لن يستريح ابدا لا يتوقف. انه يراكم. ولكن لا تستطيعون رؤيته يتكلم. ولكن لا يمكنكم سماعه. ما هو قوله. اتبعوني الى السماء الارضية. هناك النور ، القوة غير المدهونة ، القداسه كلها ، القاضي ، سيحكم عليكم ، الانسان ، كفرد. ماذا سيقول ؟ فقط حياتكم هي التي تقرر.,392,3.170481443405152,3.274644613265991,3.188586473464966
31230,HaTerz,anethia,9,أنا أشعر بالتعب من الطريقة التي أنت أسفل لي لا يمكن أن يبدو على الاستيلاء على حلمي أنت لا تفهم لي الذي هو هو هو... ... يبدو أنك لا تهتم على الإطلاق... ...,398,2.9359335899353027,3.378404140472412,3.2549006938934326
26546,Danisha,angel,9,"""أعمل دائماً في وقت غير مناسب"" ""فتاتي، صديقي، دائماً هناك من أجلي""",120,3.626183032989502,3.491727828979492,3.308321714401245
48042,Melissa,angel,9,إن الإصغاء إلى فتاة رائعة مثلى تماماً مثلى و أنا أشعر بالحزن و الحزن مثلى,72,3.992149829864502,3.777831077575684,3.3036954402923584
91083,Lost,angel,9,لقد حان وقتي، وهكذا ذهبت إلى مكان أفضل الآن، بعيداً جداً أحبكم جميعاً كما ترون لأنني حر,121,3.661886692047119,3.503063678741455,3.3502118587493896
66825,sharks,angel,9,مفترسات المحيطات التي تحاول البقاء على قيد الحياة يومياً خطيرة جداً,69,2.44783353805542,3.2209911346435547,2.96935772895813
35785,My Inner Self,angela,9,أنا أرى فتاة تمشي ببطء، وهي ليست محاطة بالأصدقاء، وهي وحيدة وبعيدة عن كل شيء، كما لو كانت في عالم آخر، وهو ما يمكن أن تراه ولكن لا يستطيع الوصول إليه،,1641,2.6949996948242188,3.3299906253814697,2.95724892616272
36898,Growing Up,angela,9,عندما كنت أصغر، كنت أتساءل لماذا تخاصم والداي، الآن بعد أن أعرف، كنت أتمنى أن لا أفعل. عندما كنت أصغر سنا، كنت أتساءل ما هو المكان، الآن بعد أن أعرف، كنت أتمنى لو لم أكن. عندما كنت أصغر سنا، كنت أتساءل ما كان الموت، الآن بعد أن عرفت، كنت أتمنى لو أنني لم أفعل. عندما كنت أصغر سنا، كنت أتساءل كيف يبدو الحصول على المزيد من المعرفة، الآن بعد أن عرفت، كنت أتمنى لو لم أفعل.,384,2.5455572605133057,3.1838388442993164,2.9349477291107178
33863,How I feel,angela,9,أنت كل ما أحتاجه وأكثر من أنني لم أحب أحداً كهذا قبل أن أحب الطريقة التي تحضني بها أنا واقع في حبها مع أو ألا يمكنك أن ترى؟ أريد أن أكون معك مدى الحياة,596,3.8337416648864746,3.807255268096924,3.3834688663482666
20277,The World is Full of Vultures,angela,9,- إن العالم مليء بالخصائص التي تنتظرها، وهي تنتظرها ضحية جديدة تتنحى جانباً في فريستها، ولا تترك سوى بقع قليلة من اللحم، وتُعثِف على العالم، وتُعَثِّر عليه، وتُعَدُّ عليه، وتُعَلَّقُ نحو المراهقات المستضعفات هو أيضاً لدغة أخرى مُعَوِّقة ومُضَرَّعة، من ثقتهن الخاصة بهن وقيمة ذاتهن، إلا أنه، في يوم ما، جاء الأسد والشجاع والأسد قوته وجماله خوفاً من المعانيين، وافترضت النسور أنه كان لديهم مُحَلَّل جديد، ومع ذلك، فإن هذا الأسد المُصَدِمِر قدّم النسور بدلاً من ذلك، وقد ذهب إلى أحد الضحايا الذين كانت النسور قد صُدمت، والغضب، وصمم على جعل هذا الأسد من ضحاياهم العديدة، كلماتهم، البادئة، لم يكن لهم تأثير على هذا الأسد، حيث بدأ هذا العمل، بدلاً من ذلك،,1896,2.7680089473724365,3.4186882972717285,3.061120748519897
92858,My life,angelica,9,قد تكون حياتي مليئة بالكذب لكن هذا لا يغير مشاعري عندما أنظر في عينيك أرى الأم التي يمكنك أن تكون أنت تحارب و تحارب,411,3.3237380981445312,3.4858009815216064,3.315137386322021
20495,&apos;&apos; I WONDERED&apos;&apos;,angelina,9,عندما جلست عند النافذة ذات يوم، نظرت إلى الناس ينظرون إلى الناس نظرة حزينة فجأة، وكنت أتساءل إذا كنت قد فعلت الشيء الصحيح، تسائلت إذا كنت قد خذلتهم بطريقة ما، تسائلت إذا كانوا يكرهونني بسبب ذلك، تسائلت، عندما نظرت إلى صبي صغير يبكي ويرغب بأمه بينما ينظر إلي، تسائلت، تسائلت إذا كنت قد فعلت شيئاً خاطئاً يزعجه،,640,2.2766828536987305,3.4111227989196777,2.7829020023345947
31668,Clueless,angelique,9,أنا لا أحب.. ولكن أنا أكره.. ولكن أنا لا.. ليس لدي أي فكرة، وأنا أكره أنني لن..,95,2.239436626434326,3.308838129043579,3.046527862548828
54914,I miss you,angie,9,الآن خمسة عشر الآن سبع سنوات مرت من دونك هنا يتساءل إذا كنت تراقبني أنا متأكد من أنك تفعل بالطبع أنا ابنتك الصغيرة أكره أنك ذهبت,294,2.661843776702881,3.343082427978516,2.981645345687866
62673,The man with a ram and a lam,angus,9,رجل مع كبش وكعب وحمل كان هناك رجل كان لديه كبش وكشك وحمل في ساحته بالقرب من كهف من الغنم. استمر الرجل في الصراخ والصراخ بينما كان يضرب على الأرض بالألم. استيقظ وهو في المستشفى يبكي في حالة لم تكن الممرضة هناك لمعالجة ذلك. صعد وقيد وصرخ بصوت عال وصرخ بصوت عال. في السيارة التي تسوق إلى البيت كل وحده سار بغضب حولها وحولها. وجد طريقه إلى البيت على الهاتف لأمه البكمة. وجد الغنم يقفز على جيبه يقفز نحوه وهو يلتصق عليه ويهبط عليه. ركض داخله كالمجنون مثل الوليبي كما فعل جده في ذلك اليوم نفسه. في الليل ركض ليحصل على كبشه الذي كان في السد بالقرب منه وهو يهتز حوله. ركض بسرعة كصاروخ من السد مع كبشه وحمل إلى البيت حيث وجد فأرا في بيت عصفور. بنى بابا بزوجته وزينه في ذلك اليوم بوزن خفيف. وكانت الغنطة خائفة لأن الباب كان مهذبا كما كان الرجال يتاجرون.,1026,2.4449357986450195,3.4678916931152344,2.994414091110229
40262,Just Me,anita,9,الإبداع هو مثل فقاعة الانفجار. خيالي مثل غابة برية أحاسيسي للأسلوب هي مثل نموذج الأزياء ابتسامتي هي جميلة كما أن أميرة قلبي يحمل عطش بلدي من قراءة الكتب التي هي هائلة كأسد أعيش في المكتبة وأكل الكتب.,263,3.942462682723999,3.743996143341065,3.318279504776001
67129,Things I can do,anju,9,أستطيع أن أقف على رأسي، ألمس أصابع قدمي، أرفع أزراري وأربط أقواسي. أساعد في التسوق، أطعم الطيور، أختار كتبي الخاصة وأقرأ كلماتي الصغيرة. أرش في حمامي، أتسلق الدرج، أركع على سريري وأقول صلواتي.,228,3.594998359680176,3.314732074737549,3.274610757827759
120858,Noir,anna,9,إحتفظ بها قريباً إلى الأبد، لحظة من كنزنا الهروب إلى أضواء المدينة في النصر، فقدت بصي لي زهرة صغيرة رقيقة، اقتربت مني في ساعتي الأخيرة، أظهر الطريق،,438,3.382293224334717,3.546327829360962,3.242774248123169
42256,Anxiety,anna,9,بينما أجلس في غرفتي، وحدي على سريري، أحاول أن أفكر في الأشياء التي تجري في رأسي. أشعر بالضوء الذي يتدفق عليّ مثل بقعة من العشب في البرد، والثلج الأبيض، أشعر وكأن الجميع يحدقون بي، لكن هذا الشعور، لا أحد آخر يعلم. الغرفة مكتظة بالناس، ومع ذلك أشعر أنني ضائعة رغم أنها دافئة في الخارج، جسدي محاط بالصقيع. أريد أن أبكي، أريد أن أصرخ كل شيء في نفس الوقت،,907,2.4973223209381104,3.428030490875244,2.8964293003082275
106355,My Love to Thee,anna,9,الحب هو ما أشعر به داخل أعماقي، هو ما يجعلني أبتسم عندما تكون قريباً، أنت كل حبي يمكن أن يكون، كلماتك حلوة جداً والطيبة هي كل ما أسمع، أنت جولييت محبوسة في برجها،,557,4.157493114471436,3.860394954681397,3.348828077316284
104932,Eyes of a Dove,annaliese,9,فما هو نوع الجنس الذي يمكن أن يعطي المرء هذا الشعور الكامل؟ إنه شعور كامل بالفراغ في قلب قلبها ذاته. كيف تعرف متى يتوقف العالم، ومتى سيرحل هذا الطفل؟ ما هو هذا الضرر الذي يسبب له الكثير من الحزن في ظلها؟ هذه الفتاة، ولكن الطفلة، تفقد فقط، لا تفهم، لا ترى كثيرا، هي فقط، إنها لا تستطيع أن ترى حياة من الفرح والأمل، فقط الحياة التي مزقت أحلامها إلى أبعد من ذلك. كل جانب من جوانب حياتها يرتدي قناعا، وكل جانب من جوانب حياتها يمكن أن يخرج منه، يمكن أن يضيع، إذا كان هناك مشكلة في تمييز اللطف الحقيقي عن التصرف. من الصعب أن يقال متى، إذا كان من أي وقت مضى، من شأنه أن يُقطع الأمل. إذا كان يقول كل شيء، فإن الأمل سيخطو فيه. إذا كان يقول كلماته هو الذي ستسمعه هو فقط بيسر. إنها تفقد جزءا من هويتها الحقيقية. إنها تفقد جزءا من هويتها الحقيقية، وهي لا تستطيع أن تغرق في ألمها وتضيع في قلبها، ويمكن أن تُؤثَرَقَب، أو يُمَلُ، إذا كانت تُؤَلِكُلُ، أو يُحَمْلُ، إلى أي شخص سيكرس لحظة من يومهم، وإلى الجلوس، إلى عالم، وإلى الجلوس، وإلى الجلوس، وإلى حياة منه، وإلى ذلك، وإلى ذلك، وإلى حياة من خلاله، وإلى حياة من خلال، وإلى حياة، وإلى حياة، وإلى حياة، وإلى حياة، وإلى عالمه، وإلى ذلك، وإلى ذلك، وإلى حياة، وإلى حياة، وإلى حياة، وإلى حياة، وإلى حياة من حياة، وإلى حياة، وإلى حياة، وإلى حياة، وإلى حياة، وإلى حياة، وإلى حياة، وإلى حياة من حياة، وإلى حياة، وإلى حياة، وإلى حياة، وإلى حياة، وإلى حياة، وإلى حياة، وإلى حياة، وإلى حياة، وإلى حياة، وإلى حياة، وإلى حياة، وإلى حياة، وإلى حياة، وإلى حياة، وإلى حياة، وإلى حياة، وإلى حياة، وإلى حياة، وإلى حياة، وإلى حياة، وإلى حياة، وإلى حياة، وإلى حياة، وإلى حياة، وإلى حياة، وإلى حياة، وإلى حياة، وإلى حياة، وإلى حياة، وإلى حياة، وإلى حياة، وإلى حياة، وإلى حياة حياة حياة حياة حياة حياة حياة حياة حياة حياة حياة حياة حياة حياة حياة حياة حياة حياة حياة حياة حياة حياة حياة حياة حياة حياة حياة حياة حياة حياة حياة حياة حياة حياة حياة حياة حياة حياة حياة حياة حياة حياة حياة حياة حياة حياة حياة حياة حياة حياة حياة حياة حياة,3774,2.4185564517974854,3.2542734146118164,2.8924448490142822
93537,No Words,annastasia,9,هناك أوقات في الحياة حيث الكلمات لا تعني شيئاً سوى الصمت ولكن في ذلك السكوت، هناك كلمات الكلمات التي تنطق بلمس، الكلمات التي تنطق بأعين، الكلمات التي تنطق بوجودك فقط,278,3.170449733734131,3.1772403717041016,3.195619583129883
