id,title,author,grade,text,char,valence,arousal,dominance
74177,SCENERY.,lauren,1,اشجار جميلة كجمال الازهار الرعد مشرقة مثل الشمس النجوم صغيرة كالجرذ,176,3.593800067901612,3.422159671783448,3.2249579429626465
108531,A Dog,lauren,1,ذات مرّة كان هناك كلب، وفي يوم ما هرب. ثم وجده شخص في منتصف الشارع.,158,2.846498489379883,3.137178421020508,3.062284231185913
82935,Lollipops,laurenf.,1,أجل، يمكنني أن أخبرك كيف مذاقه، مذاقه مثل الحلوى الحلوة,96,3.856535434722901,3.575596809387207,3.294370412826538
29911,Oh Gosh Sosh,lea,1,لا يمكنه الخروج للعب داخله يجب أن يبقى ليشمم مزهريتي من الورود و الازهار و يحصل على اللقاح في كل انحاء انفه! انه يملأ الشاشات نعم انه يحب أي شيء أخضر! انه يبصق على كل نباتات أمي حتى وهو يغسلها في مزرعة عنكبوت طويلة جدا يحب الشموع مع العطور و هو يحرق الفراء فوق انفه لكنه لا يزال لا يحزن حتى لو كان أكل كل الشمائم انا سعيد جدا انه لا يزال على قيد الحياة,479,3.646744728088379,3.618476867675781,3.2937023639678955
49530,WATER FALLS,leah and joe,1,فتساقط المياه بارد، وسقوط المياه ممتع، لا تضع معطفاً أبداً لأنه قد يُصبح مُرطباً برياً، ولا يمكنك أن تُغيّره أكثر من ذلك.,133,3.587246894836426,3.375443458557129,3.257103681564331
83043,Hugging Hat,level 6,1,مُذَكِّرًا بِسَمَاعِي فِي بَيْتِي بِحَرْقِ شَعْرِي مَذْكُورًا بِشَعْرِي .,74,3.144692897796631,3.050798892974853,3.195454835891724
16437,Nightmare Ocean,levi,1,في الأعماق العميقة من البحر الأزرق الداكن يكمن شيء يشبه الوحش، قد تقول. ولكن قد لا يؤذيك إذا لم تضايقه. يمكنه أن يرى على قاع المحيط الأسود، والذي لا يستطيع أحد أن يراه. لكن إذا كنت تجرؤ على الدخول، قد تعتقد أنك شجاع، ولكن كل ما تفعله هو جعل نفسك أحمقا، لأنك دخلت البحر الأزرق العميق. هذا الشيء مثل الوحش، كيف يمسك فريسته، لا يمكنه أن يرى جيدا جدا، ولكن لديه ضوء مشرق، على طرف أنفه. هذا الكوابيس ينظر إلى المخلوق يمكن أن يكون مخيفا جدا. اسم هذا الوحش يسمى سمك الزاوية. أنا لا أعرف لماذا يسمونه ذلك الاسم. إذا كنت تجرؤ على دخول هذا المحيط، من الأفضل أن تأخذ غواصة، أو أنك لن تعيش أبدا.,734,2.658656120300293,3.302352905273437,3.0677287578582764
26572,MY  CAT  Who  loves    rats,lexiss,1,قطتي تحبّ فئرانها. قطتي سمينة يغضب من ذلك. قطتي تحبّ الفاكهة التي لا يحبّها.,136,2.812474250793457,3.297107219696045,3.1959922313690186
37658,"Stressed, Busted Free",liban,1,صرخة في الليل عندما تُعلّق جثة أخي عالياً. أمّي مُشدّدة، بكابوس في الليل الثقيل لا تنام طوال هذا العام. صراخها من فضلك يا رب: بناء ابني قوياً ليعرف متى يكون ضعيفاً و شجاعاً بما فيه الكفاية ليواجه عندما يخاف، كن لطيفاً في النصر. كُلّ الرغبات مثل ضوء الليل اللطيف لا تأخذ أبداً. أتساءل عن كلّ هذه الأسئلة.,348,2.440646171569824,3.4439828395843506,2.948312997817993
119374,Fly Away,lila,1,"عندما استيقظت في صباح أحد الأيام، كان ستورك على رأسي، سألت ""ماذا تفعل هناك؟"" نظر إليّ وقال: ""أنزلني الآن!"" ""أطير بعيداً، أنت تعرف كيف!""",171,2.843445301055908,3.904263019561768,3.3321361541748047
105800,The Big Black Banana,lily,1,لدي موزة سوداء كبيرة أود أن آكلها، أريد أن أمضغ عليها. لقد أكلت للتو ثمانية موزات كبيرة وسوداء. أتمنى أن أتناول كل يوم نفس وجبة خفيفة. أيضاً، لن تصدقوا أن الموزة تحدثت معي.,286,3.924549102783203,3.615349531173706,3.302821636199951
103948,Ice CeamÂ— Yummy!,lily,1,كل عصر تقريباً، آكل الآيس كريم مع ملعقة. كل مساء، في السادسة من كل مساء، آكل الآيس كريم المكدس على الطوب. إذا أكلت كثيراً، ستنفجر بطني. لذا.. في اليوم التالي سأأكل تماماً وأستطيع الحصول على المزيد في تلك الليلة. أحب مثلجات الآيس كريم الكبيرة. إنها لذيذة جداً في بطني. أفضل أنواعي هي الشوكولاتة الآيس كريم والبسكويت والكريم.,431,3.789487361907959,3.5418505668640137,3.342895746231079
51668,The BFG,lily,1,لقد أخذ (باف) صوفيا بكت بكت لكنه أصبح أعز صديق لها في تلك الليلة حتى يمكنك أن تغمض عينيك,99,3.1108875274658203,3.4750895500183105,3.140911817550659
91178,My  dog   and   I.,lily,1,أنا فتاة صغيرة، اسمي (مينغ)، لدي كلب، اسمه ملك، يتبعني إلى الملعب، نتأرجح على الأرجوحة، يدفعني على الأرجوحة.,151,3.47227430343628,3.269106864929199,3.2719523906707764
76405,The monkeys,lisa,1,خمسة قرد صغير يقفز على السرير سقط واحد منه وصدم رأسه الأم اتصلت بالطبيب و الطبيب قال لا مزيد من القرود تقفز على السرير!,151,2.7582921981811523,3.494145393371582,3.2373735904693604
99730,"Star, Star",lisa,1,نجمة، نجمة، نجمة،,16,3.271653175354004,2.9862608909606934,3.1927950382232666
14033,Once There Was A Bluebird,lisa,1,"ذات مرة كان هناك طائر أزرق يستطيع أن يقول كلمة واحدة فقط الكلمة الوحيدة التي يمكن للطير أن يقولها هي ""الطير"" لذا لا تهرب",124,2.735257148742676,3.092564344406128,3.0393314361572266
14035,Cherry Wo Ho,lisa,1,الدببة مثل التوت، التوت مثل ماريز، ماري مثل الكرز، الكرز هوو.,78,3.120420455932617,3.004096746444702,3.170531749725342
14761,"Happy, Happy Me",lisa,1,أنا أحب الأشجار، أحب النحل، سعيد، سعيد، سعيد، سعيد، سعيد لي. أحب الكلاب، أحب الخنازير، سعيد، سعيد، سعيد، سعيد أيضا.,105,4.304962635040283,3.656321048736572,3.333719491958618
14760,Myself,lisa,1,عيوني زرقاء، أسناني بيضاء، شعري عسل بلون، أظافري لامعة، أصابع قدمي لامعة، أصابعي طويلة، أقدامي طويلة،,258,3.534930944442749,3.697930812835693,3.2367987632751465
47541,Zebras,lisabel,1,« و » اذكر « آيات بيضاء وسوداء تجري في ظلالها » أي ظلامها « تبحث عن طعام في أعشاب تأكل » منه .,96,3.0234971046447754,3.115471363067627,3.1389620304107666
40343,Time flies,lola,1,الوقت الذ الذبذبات الوقت لذا الوقت السريع هو ثمين و دائماً ما يعامله كما لو أن وقت الأحجار الكريمة ثمين و لا تهدره,107,3.537593364715576,3.311732769012451,3.324596643447876
84158,Easter,lora,1,الشرق، الشرق، الشرق، الشرق، الشرق، الشرق قادم قريباً، الشرق، الشرق، الشرق!,203,3.910552978515625,3.723531246185303,3.382802963256836
103169,Love,lora,1,أوه حبّ! أوه نار تحترق في أعماقي أبق أصدقائك مقرّبين، نعم أبقي أعدائك أقرب لكنّ حبّي رسم لي خزانة كلّ شيء بقبلة طويلة واحدة,238,4.186896800994873,4.019798278808594,3.3933279514312744
118459,Work Hard,lottie,1,إِنَّ ٱلْمَسِيحِيِّينَ سَيَكُونُونُونَ مَضِيًّا ، مَضِيًّا .,67,3.641077995300293,3.4258229732513428,3.416471004486084
118458,Work Hard,lottie,1,و مستقبلك سيكون مشرقاً ، مشرقاً ، مشرقاً ، مشرقاً ، مشرقاً ، مشرقاً ، مشرقاً ، مشرقاً ، مشرقاً ، مشرقاً ، مشرقاً ، مشرقاً ، مشرقاً ، مشرقاً,64,3.711355209350586,3.478238582611084,3.439615726470948
112404,Max had a thorax,lucas,1,لم يكن يعرف لماذا. لم يكن أي حشرة ولا حتى ذبابة زبدة. ربما ولد مع واحدة تأتي للتفكير في ذلك أو أنها مجرد تجربة قام بها يوم الجمعة؟ أو أنها كانت مجرد تلك الحشرة التي عضتني الأسبوع الماضي؟ لذا ربما كانت أننا ما زلنا لا نعرف لماذا.,282,2.596008062362671,3.080920696258545,3.021421194076538
107853,Love,lucy,1,أنا أحبّني، أحبّني، جميعنا نحبّ بعضنا البعض.,50,4.501368999481201,3.825655937194824,3.418879747390747
26959,If I were in Time,lucy,1,لو كنت في الوقت المناسب كنت سأتكلم مع دونغ بونغ كنت أرتجف في الوقت المناسب قال صديقي جاك كان لديه أخت اسمها جيل كانوا متشابهين,230,3.0088658332824707,3.4798359870910645,3.106041431427002
93596,The Silly Christmas Tree,luke,1,ذات مرة كانت هناك شجرة عيد ميلاد استيقظت ذات يوم وقالت,64,3.145778179168701,3.101567506790161,3.195106744766236
93597,Snow,luke,1,هناك بعض الثلج على الأرض، لكنه لن يذهب أبداً لأنني أعرف، حتى تخرج الشمس يوماً ما، ثم ستذوب بعيداً.,132,2.65301513671875,3.024585962295532,3.025545835494995
93598,The Grumpy Day,luke,1,إنه يوم، لكن لا أحد يريد اللعب العالم كله يمطر، والجميع يشتكي!,97,2.2204408645629883,3.384961128234864,3.0185558795928955
100557,You and I,lynn,1,كل الألعاب الناريّة تصنع شرارة تنضمّين إليّ بينما أجلس على العشب مستمتعاً بدفئكِ، آمل أنّه في نهاية المطاف تُسلّم الشعلات إلى الفتيات الصغيرات,296,3.87760066986084,3.5689313411712646,3.3317673206329346
93792,A Fox On My Head,lysander,1,"عندما استيقظت في صباح أحد الأيام، كان ثعلب على رأسي. سألت: ""ما الذي تفعله هناك؟"" نظر إلي وقال. عندما استيقظت ذات ليلة، كان عين في عيني. وأعطاني مثل هذا الخوف. وكان البطريق حزينا ولكن الثعلب كان سعيدا.",232,2.910566806793213,3.4010088443756104,2.986104965209961
116789,The cat is on the street,mackenna,1,وخرجت قطة ذات يوم في الشارع. وسار القطة في الشارع بقدميه. وغلقت القطة تحت الشجرة.,114,3.0754663944244385,3.117271423339844,3.131748914718628
43889,"Dogs, dogs, dogs",mackenzie,1,الكلاب، الكلاب، الكلاب تقفز كالضفادع، الضفادع، الضفادع التي ينامون فيها مثل الجذوع، الجذوع، الجذوع تلتصق في المستنقعات، المستنقعات، المستنقعات تأكل كالخنازير، الخنازير، الخنازير تركض وتهرول، الركض، الركض، الركض أنا أحب الكلاب، الكلاب، الكلاب!,187,3.350630760192871,3.4275362491607666,3.305683851242065
109237,Bees,mackenzie,1,النحل يصنع المنازل. النحل يصنع البيوت. النحل يصنع البيوت على الأشجار. النحل يصنع المنازل على الأشجار و أنت تعلم أن هذا رائع جداً لكن بالنسبة لك أعني أنه ربما لا. النحل يمكن أن يلسعك و يمكن أن يؤذيك,327,2.7234015464782715,3.176432132720948,3.1321072578430176
109238,Friends,mackenzie,1,(ميغان) و(جايدن) أكثر أصدقاء لطفاً وأفضل مستمعين على الإطلاق,113,4.340124607086182,3.670095443725586,3.3429958820343018
83651,Drawing,mackenzie,1,أنا أرسم و أرسم حتى صوري طارت و طارت!,53,3.707821369171143,3.810868263244629,3.364718198776245
28340,JERRY THE GIRAFFE,macy,1,"عندما استيقظت في صباح أحد الأيام، كانت هناك زرافة على رأسي. سألت، ""ما الذي تفعله هناك؟"" نظرت إلي وقالت...",252,2.8608672618865967,3.674283027648926,3.2122550010681152
21698,Grapeaccoon,maddison,1,حيواني الأليف المفضل هو العنب. كل يوم ينام حتى الظهر. يشنق من أشجار ذات ذيل مخطط، لديه قناع وهو شاحب نوعاً ما.,139,3.469645500183105,3.185241222381592,3.208002805709839
68250,Weather,madeleine,1,الطقس يمكن أن يكون مشمساً الطقس بارد,62,3.1552977561950684,2.92349910736084,3.1153998374938965
68539,Ha Ja,madisyn,1,إذاً لا، لا، لا، لا، لا، لا، لا، لا، لا، لا، لا، لا، لا، لا، لا، لا، لا، لا، لا، لا، لا، لا، لا، لا، لا، لا، لا، لا، لا، لا، لا، لا، لا، لا، لا، لا، لا، لا، لا، لا، لا، لا، لا، لا، لا، لا، لا، لا، لا، لا، لا.,83,3.032195806503296,3.0830154418945312,3.0601158142089844
58224,Mckenzie,maggie dee,1,شعر (ماكنزي) أصفر و بني، (ماكنزي) سعيد، (ماكنزي) لطيف (ماكنزي) مثل (كاسزي),102,3.859647274017334,3.312523603439331,3.2451632022857666
58222,Rachel,maggy,1,هي سعيدة جداً كل يوم هي حقيقية حقيقية حقيقية حقيقية حقيقية حقيقية حقيقية كبيرة حقيقية كبيرة هي تماماً مثل كيسي,124,4.016932487487793,3.6416444778442383,3.3642826080322266
55171,What Do I Eat?,mahima,1,ما الذي آكله؟ ما الذي آكله؟ هل آكل طائراً صغيراً أم آكل بعض الأوراق؟ أم آكل بعض الكلمات؟ لا أعرف ماذا سأأكل اليوم. أعتقد أنني سأأكل قليلاً. لا أعرف ماذا سأأكل.,267,2.562314748764038,3.104691982269287,2.946972608566284
55172,Did You Ask Me Something,mahima,1,هل سألتني إن كان الطير يستطيع التحدث أم الأكل؟ هل سألتني شيئاً؟ ما هو اسمك؟ هل سألتني شيئاً؟ أريد منك أن تسألني شيئاً!,177,2.833653211593628,3.544951915740967,3.332441091537476
108806,I&apos;m a little cupcake,mahita,1,أنا قليلاً من الكعكة القصيرة والحلو هذا هو بلدي تأبلي و هذه هي كعكة بلدي عندما الناس يعضني الناس، وأنا أقول,105,3.5615122318267822,3.387861967086792,3.2898824214935303
108814,I&apos;m a little cupcake,mahita,1,أنا كعكة صغيرة، قصيرة و حلوة هذا هو بلدي التضخيم وهذه هي كعكة بلدي عندما الناس يعضني، وأنا أقول 'أووو' كل ما عليك القيام به هو قشر غلاف خارج!,159,3.525831699371338,3.645472288131714,3.3825809955596924
42521,MY  MOM SNORES,malik,1,أنا أنام بهدوء هادئة كالفأر وكل ما أستطيع سماعه في منزلي الأخضر الكبير أمي تشخر بصوت عالي مثل تنين,217,2.439448356628418,3.268423557281494,2.875206708908081
119825,I will always love you,manish,1,سأظل دائما أحبك، أينما تعيش، سأموت فقط عليك، أينما كنت تعيش، يا حبيبي، كنت فقط حياتي، ولكن أنا سعيد، لأنك سعيد، أنا لن أبكي أبدا، أينما كنت تعيش، أنا لن أدعوك أينما كنت تعيش، ولكن أنا سوف أحبك دائما، أينما كنت تعيش، أينما كنت تعيش، أينما كنت تعيش.,315,4.009368419647217,3.758457660675049,3.3762757778167725
120488,You,mann,1,وقفت قرب النافذة، لأراقب النجوم، ولكن في قضبان مغلقة. أنظر حول الظلام لأبحث عن الضوء.. ولكن عالقة، كما لم يكن هناك شيء مشرق.. طلبت المساعدة لأن كل شيء كان يتلاشى..,298,2.7018628120422363,3.190834283828736,2.893336772918701
62058,dinosaur went to the Mall,mann,1,كان (دينوساور) طويلاً بينما كان ذاهباً إلى مركز التسوق رأى سقوط ماء,140,3.266709566116333,3.161621332168579,3.192272186279297
62558,Kate and Jake,mann,1,(كيت) و(جيك) يحبان التزلج و سباق (كيت) صنعا كعكة (كيت) طاردا (كيتي) بالجاك كلاهما تسابقا في مكان ما للفوز بالفوز بالسباق الذي أكلا فيه الكعكة في وقت متأخر جدا من البحيرة,198,3.404120445251465,3.266932487487793,3.257277011871338
18876,Cat on my Head,manuel,1,"عندما استيقظت هذا الصباح. قطة كانت على رأسي، سألت ""ما الذي تفعله هناك؟"" نظرت إلي وقالت ""لقد خرجت للتو من السرير"" أحضر لي الطعام، أي شيء، السمك هو طبقي، أريد الحليب للشرب.",206,3.10943341255188,3.344622135162353,3.20939564704895
30277,Kids,manuel,1,أطفال رائعون يقفزون في حوض سب,37,3.736734390258789,3.423692226409912,3.3398773670196533
94072,The Rudest Elephant in the World,marc,1,الفيلة تُحرّطُ الكثير من الفيلة تُحاربُ الكثير من الفيلة تَستحمُّ الكثير من الفيلة تَأْكلُ الكثير,86,2.763279438018799,3.058030605316162,3.110741376876831
48987,My Seal,maria,1,ختمي ابيض ختمي بييض ختمي جميل ختمي جميل ختمي به سوائل طويلة,211,4.038345813751221,3.657436847686768,3.322863817214966
113271,Winter is here.,mariana,1,الشتاء هنا سيكون يوماً عظيماً,46,4.096560001373291,3.509754180908203,3.379908561706543
45896,You,marisa,1,أحبك كما تحبني,28,4.63224458694458,3.935755252838135,3.4112398624420166
105803,Something Is On My Head!,marissa,1,ذات صباح استيقظت مع حبة على رأسي، سألتك ماذا تفعل على رأسي؟ لقد قال أني أرتاح على رأسك!,124,2.799920558929444,3.5137243270874023,3.120017766952514
94400,Balamory,marky,1,لنكتشف اليوم ما هي القصة في البلامورية هل سنذهب إلى هناك اليوم؟,104,3.1165030002593994,3.075444221496582,3.2175962924957275
118618,2 hearts,martha,1,عندما تكون مريضاً عندما تزيف ابتسامة عندما تخبرني بالخطأ أن كل شيء على ما يرام أعلم أنني أعرف ما تشعر به لأنني في أعماقي أشعر بنفس الشعور 2&gt إذا حصلت على صديق يعني لك الكثير مثل الكوكو,464,3.333160400390625,3.3777506351470947,3.2882230281829834
34539,The Danielle and Martin Poem,martin,1,كان هناك طفلان، كانا يعضّان على الأغطية مع أمّ وأبّ، أصبحا غاضبين جدّاً عندما أعطاهما قبلة,193,2.575034618377685,3.3233330249786377,3.0277411937713623
49445,Chance,mary,1,حصان يدعى بالصدفة مع معطف بني جميل هو حصاني المفضل,119,3.549686908721924,3.274869918823242,3.285786390304565
93733,Pie,mary,1,الفطيرة، نسيم سينموني يُهاجمُك، يُمّ.,50,3.860016107559204,3.5750327110290527,3.384012460708618
62783,Back to school,mary,1,"""ينتهي الصيف والليالي"" ""ترجع المدرسة القصيرة في دورة""",64,2.823204755783081,2.953425884246826,3.07928204536438
55168,The lonely bird,mary p,1,ذات مرة كان هناك طير صغير كانت وحيدة جداً يوماً ما قابلت صديقاً ثم كانت سعيدة جداً في اليوم التالي,172,4.108691692352295,3.666591644287109,3.346630334854126
43672,Pizza,matthew,1,تحت الماء في النهر آكل البيتزا بينما أرتجف في الشتاء في شجرة آكل البيتزا بينما النحل يطاردني,109,3.0057148933410645,3.242530107498169,3.141505241394043
112396,Foxs Box,matthew,1,لدي ثعلب يحب أن يُعلّب صناديق الثعلب في الجوارب,56,3.1561219692230225,3.003355026245117,3.2516257762908936
83653,A  Seed,matthew,1,زرعت بذرة، نمت، الرياح جعلت أوراق الشجر تسقط، سميت نبتتي (سو),79,3.358359336853028,3.1233434677124023,3.3183534145355225
107795,The big day,matthew,1,و(جاك) و(زاك) ذهب في نزهة في يوم جميل كان يوم جميل كان فيه (جاك) و(زاك) ذهب في نزهة,115,3.759359359741211,3.3617382049560547,3.3127310276031494
93790,A Cat on My Head,matthew,1,"عندما استيقظت في صباح أحد الأيام، كانت قطة على رأسي. سألت: ""ما الذي تفعله هناك؟"" نظر إلي وقال. ""لن أنزل من رأسك. سأبقى على سريرك.""",180,2.6503801345825195,3.534491539001465,3.251436948776245
37705,Friends,matty,1,يمكن للأصدقاء أن يضحكوا، والأصدقاء أن يلعبوا.,39,3.78898859024048,3.351047992706299,3.3832218647003174
93788,A Mouse on My Head,maximus,1,"عندما استيقظت في صباح أحد الأيام، كان فأر على رأسي. سألت، ""ما الذي تفعله هناك؟"" نظر إلي وقال. أوه لا، الفأر على رأسك! قلت، ""لا لا لا"" قال، ""نعم نعم"" ، أنا أركض ، لقد فاز.",202,2.830094814300537,3.698899269104004,3.22931170463562
103942,Rainy seaon,maya,1,في بداية الربيع كانت مملة وشعرت بالوحدة و لكن عندما تشرق الشمس أتمنى لو أستطيع الخروج,112,2.463024854660034,3.0459232330322266,2.881768226623535
28337,Potato Chips and Foods,mckeely,1,كل مساء في السادسة تماماً، آكل رقائق البطاطا المكدسة على الطوب، آكل البطاطا مع العصي، آكل البطاطا في المزيج، آكل البطاطا مع الكيك!,216,3.434871196746826,3.479054450988769,3.376004219055176
58221,Kassey,mckenzie,1,عيون (كاسي) خضراء أحياناً تكون مبتهجة وجميلة جداً و(كاسزي) مثلي نوعاً ما,102,3.7201218605041504,3.292478561401367,3.201855421066284
97045,Bears,mckenzie,1,إنهم سمينون جداً، ثم يسمنون ثم قطة ثم يصطادون سمكاً، يأكلونه على طبق، تخيل ذلك!,95,3.271087646484375,3.5089774131774902,3.254702568054199
46654,She gets things,meg,1,عندما كانت هناك فتاة تدعى (مايا)، كانت دائماً تحصل على أشياء. يوماً ما لم تحصل على أشياء. كانت غاضبة جداً. ثم بكت وبكيت بشدة. لذا أعطتها أمها أشياءها. كانت سعيدة جداً لأنها كانت سعيدة جداً,259,3.6524837017059326,3.511627435684204,3.1708555221557617
51787,roses are red violet are blue,meg,1,الورود حمراء البنفسج زرقاء إذا كنت تحب الورود أنا فقط من أجلك,70,3.7746424674987793,3.548020362854004,3.320626974105835
90394,The apple,megan,1,تفاحه جميله وجميله جداً جداً جداً لذيذه جداً و لذيذه جداً و لذيذه جداً,166,3.848778247833252,3.4960708618164062,3.335294485092163
93782,A  Pig on my Head,megan,1,"عندما استيقظت في صباح أحد الأيام، كان خنزير على رأسي. سألته: ""ما الذي تفعله هناك؟"" نظر إلي وقال: أنا أتمرن. حسناً! ""أنت تثار على رأسي"" ، قلت: يجب أن تذهب. قال: ""لا!"" قلت: ""يجب أن تذهب!""",236,2.8787686824798584,3.6055173873901367,3.3178253173828125
84699,The Fly on my Head,megan,1,عندما استيقظت في صباح أحد الأيام، كانت ذبابة تحوم حول رأسي. سألت، ماذا تفعل هناك؟,99,2.842956066131592,3.4737024307250977,3.001649618148804
70628,The Wind is Gone,megan,1,لقد انبثقت الرياح والرياح قد هطلت كل الأزهار تنمو الآن,86,3.4537386894226074,3.228766441345215,3.26318359375
91660,Apple,megan,1,كبير ومثير ولتر; bry&gt; shiny وحلوى &lt; bry&gt; take a بيسبول&lt; bry & gt; ذلك جيد للأكل! & lt; bry & gt;,107,4.003361225128174,3.654754638671875,3.3594839572906494
73774,Invisable Boy,melina,1,هل يمكنك رؤية حساءه الذي لا يقاوم؟ أستطيع، لكن فقط في خيالي!,102,3.4980056285858154,3.723268985748291,3.3144290447235107
