id,title,author,grade,text,char,valence,arousal,dominance
87057,The Pencil,josh,6,أداة كتابة العالم إذا لم يكن لدينا قلم رصاص العالم سيكون تقريبا عديم الفائدة. فقط فكر في ما يفعله قلم رصاص لنا ، قم بعملك ، وقم بتوقيع الأشياء ، ترسم الصور ، ومن القشور تكتب القصائد. إذا لم يكن لدى العالم قلم رصاص فلا يمكنك أن تفعل أشياء كل يوم.,268,3.1752922534942627,3.163415908813477,3.2786858081817627
86476,Big dog,josh,6,الكلب الكبير كان واقفاً على سجل في منتصف المستنقع الضبابي حيث التقى بضفوق ضفدعي الذي كان متوتراً جداً الذي كان مختبئاً في بساط مثل الحشرة ولم يُرى أبداً مجدداً,149,2.4818568229675293,3.1416215896606445,2.9412102699279785
23533,My Dog Fenway,josh,6,في الليل كلبي هناك لي ينتظرني على سريري انه يقع علي ان اشاهد السقف كما لو اننا ننظر الى النجوم في الصباح تجلس معي منتظرة ذهابي,340,3.911612033843994,3.695745706558228,3.3091673851013184
18546,Josh,josh,6,الجوش هو وعاء من القرع يحب النجوم ويبغض المارشات,62,3.086850643157959,2.9998159408569336,3.178420305252075
48738,My little dog,josh,6,كلبي الصغير كلبي الصغير الذي ضيعه في الضباب هنا يأتي من على رصيف,164,2.3566713333129883,3.253378629684448,2.7822930812835693
28151,Bravery,josh,6,الشجاعة هي أن القوات تحارب في العراق من أجلنا. الشجاعة هي الشرطة من أجل إخراج الجرائم من الشوارع. الشجاعة هي الرئيس لقيادتنا في وقت الحاجة.,225,3.313443183898926,3.303391218185425,3.3171699047088623
24298,The Man From Nantucket,josh,6,كان هناك رجل من نانتوكيت. كان على وشك ان يركل الدلو. واضطجع على سريره ويداه على راسه وكان ذلك نهاية حظيرته.,155,2.571603775024414,3.272824287414551,2.99919056892395
103214,An Apology,joshua,6,نحن جميعا نتذكر، تلك الأيام من المحرقة. نحن جميعا نتذكر أولئك الناس الذين فقدت حياتهم. نتذكر تلك الأيام عندما حكم هتلر العالم، لم نكن نستطيع أن ننسى الأيام، عندما حولوا عالمنا، إلى عالم تحت الأرض. لم نكن جميعا نستطيع أن ننسى، ومع ذلك كل هؤلاء الأبرياء، والأطفال تم حبسهم في زنزانة مزدحمة جدا. لكل أولئك الناس الذين فقدوا حياتهم، لكل أولئك الأطفال الذين فقدوا حياتهم، نحن كالعالم، نعتذر. هذه القصيدة كانت مكرسة للناس الذين فقدوا حياتهم في تلك الأيام من المحرقة.,549,2.3654890060424805,3.299288749694824,2.9991841316223145
26010,The snake,joshua,6,ذهب الوحش المفترس إلى حفرة الفأرة. كان الجرذ يركض بأسرع ما يمكن للابتعاد عن الزواحف المفترسة. استمر هذا بحرية إلى الأبد في النهاية الانتهاء عند نهايتهم.,239,2.9713385105133057,3.2818100452423096,3.1587846279144287
16440,My Hamster,joshua,6,هو لطيف وصغير جداً جداً، يحب أن يركض في كرته، يركض في عجلة عجلته، لكنه لا يئن,101,3.844241142272949,3.537214994430542,3.3012168407440186
85401,Bedtime,joshua,6,كان على (تيد) و (د) أن يناما قبل تسع ساعات,54,2.7064433097839355,2.9393367767333984,3.0716774463653564
22962,Snow,joshua,6,صامتاً كالفأر يزحف، يهب غرباً كسحابة يبكي، يبطن الأرض بالأبيض، كالدببة القطبية التي تنام ليلاً: بينما أجلس وأستمع إلى الريح الصفيرة أفكر في قتال كرة الثلج.,215,2.940370559692383,3.39683198928833,3.146734952926636
115016,Football,joshua,6,يركضون ويحاولون اللحاق بالكرة. جريمة القذف بالكرة والاعتراض. واللعبة كانت فوق الصقور البحرية.,152,2.7636077404022217,3.0484752655029297,3.0841901302337646
110379,Family,joshua,6,مُتَعَلَّمَةُ مُوَجَّهَةٌ مُوَجَّهَةٌ مُوَجَّهَةٌ لَكُلُّكُمْ عِنْدَكُمْ واحد,60,4.309274673461914,3.7871484756469727,3.440569400787353
60252,What I Want,joshua,6,أريد بعض الجبنة مع بعض من فضلك مع تفاحة وبعض من النهاش أريد بعض من فضلك أريد البعض أريد البعض أريد بعض منه من فضلك أنا أتوسل على ركبتي,205,2.940934419631958,3.3011834621429443,3.2815041542053223
60258,Electronics,joshua,6,طريقة للإبقاء مشغولاً بالتسلية، المدهشة، الإسترخاء أفضل شيء مُختَرَع,105,3.839452981948853,3.491323471069336,3.3817379474639893
65960,Amp at the camp,joshua,6,أنا أعيش في معسكر اعتقال وهناك طرقة على الباب وأنظر إلى الأرض لأجد أنه مجرد مخيّم لكلبي,140,2.5905795097351074,3.2698910236358643,2.99119234085083
65934,Summary,joshua,6,ذات مرة كان هناك رجل من بيرو الذي حلم انه كان يأكل حذائه استيقظ بخوف في منتصف الليل ليجد ان حلمه قد تحقق,169,2.825010299682617,3.50291109085083,2.9756968021392822
49979,Thunderstorms,joshua,6,آمل أن لا يكون المطر ثقيلاً ورياح. يبدأ المطر بالتنصت و الترنح في البداية، لكنه الآن ينزل مع طفح! هل لديك القطة؟,312,3.256901979446411,3.665182113647461,3.15954065322876
85745,My feelings for you,joshua,6,قد حطمت قلبي الصغير. من فضلك اوقف غضبي! العاطفة: الحب والموضوع الكريه: ابي.,139,2.445481777191162,3.644041538238525,3.187459707260132
102802,Summer In The Air,joshua,6,الصيف في الهواء، والشمس في الهواء، والشمس في ضوء ما تبقى من مياه الأمطار من الربيع في عينيك. الصيف في الهواء، والبط والبجع يسبح عبر بركتها بفخر. الصيف في الهواء، يترك الأولاد والفتيات مدرستهم بفخر مع صيحات من الصيحات! ووو! الصيف في الهواء، الدفء الذهبي يأتي من خلال جلدك. الصيف في الهواء، حيث الرحلات الميدانية إلى حدائق الحيوان هي الأكثر شعبية. حقوق الطبع والنشر.,494,3.8780672550201416,3.610156536102295,3.280955076217652
84255,My Cat,joshua,6,لدي قطة، وهو سمين، ويحب الهرب، وأحيانا تسقط، تتصرف وكأنها غبية، وتهاجم الناس من العدم، وكأنها لا تهتم حتى، وهذه قطتي السمينة، واسمه بات.,200,2.7157580852508545,3.2817752361297607,3.143961191177368
84253,My Cat,joshua,6,لدي قطة، وهو سمين، ويحب أن يهرب، وأحيانا تسقط، تتصرف وكأنها غبية، تهاجم الناس من العدم، وكأنها لا تهتم حتى، وهذه قطتي السمينة، اسمه بات.,199,2.720815420150757,3.2912027835845947,3.1487419605255127
73932,Your grandparents,joshua,6,هم يحبونك من كل شيء ويحمونك من كل ما هو مقدّر. يشترون لك ثيابا واحذية. هم جدك بلا شك.,156,3.4910755157470703,3.323452949523926,3.292477369308472
22175,I Need A Girlfried,joshua,6,هل تحتاج إلى صديقة؟ من الحب لن ينتهي أبدا. هل تحتاج إلى فتاة مكسيكية ذات شعر جميل كبير؟ هل تحتاج إلى شخص طويل القامة ويذهب إلى المجمع؟ أنا أحب الناس الصغار، واتصل بي.,214,3.47683048248291,3.410907030105591,3.2868309020996094
107638,War inspied by Arnold Adolf,joshua,6,إطلاق النار دائماً من ساحة المعركة بعيداً عن البلاد,364,2.79307222366333,3.618459939956665,3.091570854187012
17793,The pool,joshua,6,كان (ألبرت) في حوض سباحة، كان رائعاً جداً، ثم ذهب إلى المطبخ وجلس على مقعد.,93,3.718996524810791,3.32015323638916,3.2126615047454834
18548,The Winter,joshua,6,أنا أعلم أنها سوف تثلج والرياح هي نفخة حقيقية، وتركت الوجوه في الثلج، ولكن الآن هو ذاهب إلى أن يكون التجميد، حصلت على قفازات بلدي على للذهاب إلى الخارج، ولكن بلدي لا هو حقا التجميد.,195,2.488932132720948,3.1513590812683105,2.9900803565979004
14118,The Beach,joshua,6,أشعر بالرمال تحت قدمي، أتذوق السمكة التي أحبها على الأقل أجلس على الشاطئ وأحلم بمحتويات قلبي بينما أسمع الزوايا تغني,205,3.869957208633423,3.639589786529541,3.2613329887390137
47091,Dux,joshua,6,لقد عاملني كأخ لا مثيل له، لقد علمني الكثير، لكنه كان جزءاً من مؤامرة الرب الكبيرة. لدينا كلب جديد، وهو حقاً كلب مختل عقلياً. لا تزال ذكرى دوق على قيد الحياة، إلى سوء بالنسبة لي الآن هو ذهب.,312,2.763237476348877,3.310641050338745,3.0788400173187256
92131,A Cat and a Rat,joshua,6,أكل القطة فأراً سميناً، واستلقى على حصيرة، لكنه جلس على قبعة.,63,2.548733711242676,3.0464978218078613,3.0564396381378174
107713,Monsters,joshua,6,هناك وحش في خزانتي هناك وحش في سريري لكن عندما أخبر أمي أنها تقول أن كل شيء في رأسي وعندما أذهب إلى المدرسة في اليوم التالي,383,2.9236762523651123,3.50234317779541,3.114593505859375
45138,Open,joshua,6,كنت في البحر في عرض البحر في عرض المحيط ذاهباً إلى أراضٍ بعيدة,79,3.0601725578308105,2.9721450805664062,3.1228187084198
20866,School,joshua,6,لكن في بعض الأحيان أفشل في كل يوم المدرسة هو بارد ولكن بعض الناس يدعونني مدرسة غبية يمكن أن تكون مملة في بعض الأحيان أنا في نهاية المطاف في المدرسة الشخير هو شيء أنا في حاجة إلى عطلة من،,213,2.810980319976806,3.2460708618164062,3.166900634765625
43151,My Dog Named Mut,joshua,6,ذات مرة كان لديّ مقبض، كان اسمه مجنوناً، كان كلباً، لكنه كان يبدو كضفدع، كان لديه أنف، وكان يحب ارتداء ملابس، كان يشرب وعاءاً، ملأنا بخرطوم الماء، أحببت كلبي، الذي كان يشبه الضفدع، لكنه كبر في السن، واستقر.,253,3.208071708679199,3.084523677825928,3.199819803237915
120460,Morning Dew,joshua,6,والورود حمراء، والزهريات هي زرقاء، والصباح الأزرق هو الحلو الحلو، وكذلك أنت عندما أذهب خارج، أرى سماء الصباح في بعض الأحيان أعتقد، أريد أن أطير,142,3.769675493240357,3.551234245300293,3.260132312774658
84805,Freinds,joshua,6,تأتي الأحصنة في كل الأشكال والأحجام. قد تعطيك حتى بعض المطورات. يمكن أن تكون الأحصنة مشعرة. يمكن أن تكون الأحصنة مخيفة. وهناك أسماء قد تكون حتى توت. ولكن هناك شيء واحد بالتأكيد أنا أعرف أن هذا صحيح. هناك حتى أفضل الأحصنة.,237,3.328854560852051,3.3141777515411377,3.2594540119171143
84813,This land,joshua,6,إلى البحر الأزرق الأزرق الأزرق. هذه هي الأرض التي أستطيع رؤيتها. بركات نارية، إلى الجانجل السميك السميك. هذه هي الأرض التي أستطيع رؤيتها!,156,3.4076151847839355,3.616440773010254,3.259443521499634
110565,Stella Artois,joshua,6,شيطان شقي، نباح يسبب الزلازل بسرعة كفهد.,69,2.441879272460937,3.31015419960022,3.0858407020568848
16077,ME,joshua,6,ليس لدي أي أنف أشم رائحته مثل الورده مثل الورده,88,2.469886779785156,3.1640515327453613,3.012084722518921
110383,I am a Ranger,joshua,6,أنا حارس، أتساءل إن كنتُ متسولاً، أسمع إطلاق نار من قوسي أرى الغابة من حولي، إنه منزلي أريد أن أكون أسطورياً أنا حارس، أتظاهر، أنتظر لا أشعر بالثقة من قبل الرجال في القلعة,564,2.640834331512451,3.313469409942627,3.0332419872283936
20790,Funny things,joshua prime,6,الأشياء المُضحكة في كل مكان، الأشياء المُضحكة على الأرض، الأشياء المُضحكة التي أحبك فيها الأشياء المُضحكة تفعل ما تفعله.,109,4.048985958099365,3.615511417388916,3.392939805984497
45141,Listen,joshus,6,يمكنك سماع الدلافين تصرخ في المحيط الأزرق، يجب أن يكون الحزن..,96,2.43319034576416,3.219383716583252,2.872532606124878
103247,The Unlucky Horseshoe,josie,6,في أحد الأيام عندما كنت أسير على طول الشارع، نظرت إلى الأسفل للعثور على شيء ما عند قدمي، لقد كان حصاناً قديماً وفكرت أنه ربما يكون أمراً محظوظاً إلى أي مدى كنت محظوظاً! لقد التقطت الخيل كُل شيء لكن حظي تغيّر بسرعة كبيرة جداً,927,3.023427248001098,3.610804557800293,3.194525957107544
118664,The Gingle Gog,josie,6,(ج) أن تكون حذرة من الغوغس الذي يرفرف مثل الخنزير الرهيب، فإنه يتلوّث من خلال المستنقع المظلم، ويتنفس منه، لأنه عندما كنت في الخليج، أصبح المكان مظلماً جداً بالنسبة لي للعب، لذا جلست على بعض القرع، ثم سمعت شخصاً يقول: 'الجوج الجاعد هو على فضفاض، رأيت ذلك يأكل a، لذا تشغيل وإختفاء، قبل أن يأكلكم جميعاً أحياء! لذا ركضت، لكنني كنت متأخراً جداً، لم أصل إلى بوابتي،,1020,2.6446571350097656,3.501532554626465,3.050315618515014
114368,Flowers,josie,6,أنواع مختلفة من الأزهار هناك اصفر اخضر اخضر اخضر ابيض كثير من انواع الازهار المختلفة,149,3.33211612701416,3.029856443405152,3.1973555088043213
93005,The Dirt,josie,6,كيف نعرف أنه لم يظهر بطريقة خاصة. ماذا لو أنه سقط من السماء بعد الطيران كطائر. هناك فرصة أنه ظهر مقابل ما سمعناه. ولكن حتى مع عدم معرفة أنه لا يزال لا أحد يتأذى حقا. لأنه تراب، فقط تراب، لا شيء أكثر من تراب.,317,2.7550835609436035,3.139182806015014,3.0768513679504395
93009,The Lion,josie,6,الاسد تنتظر بصبر ولكن لا يزال صحيحا انها تشاهد فقط لا تقترب او قد تأكلك لانها جائعة وقوية جدا,301,2.8295884132385254,3.4338619709014893,3.2150065898895264
104472,Dance,josie,6,ليس هناك مكان آخر مع الكثير من الموسيقى ليس هناك مكان آخر مع الكثير من الأصوات الكثير من الناس يعملون بجد الضحكات يتحدث,152,3.4193379878997803,3.699967861175537,3.345104455947876
28437,Friendship,josie,6,الصداقة كالكنوز والصداقة كالأزهار والصداقة كالكلب والصداقة كالكلب والوقوف الى جانبك مهما حدث والصداقة كخريطة تقودك الى الطريق الذي يجب ان تذهب اليه,252,3.646017074584961,3.412352561950684,3.285916805267334
33453,Cats,jourdan,6,قطط صغيرة، لكن لديها كؤوس كبيرة تحبها في القاعة، جدا جدا جدا جدران كبيرة جدا كبيرة جدا كبيرة، أنها لا تحب أن حفر ليس لديها باروكات، ولكن لديها أغصان.,148,3.172903537750244,3.1228115558624268,3.225306272506714
110545,Summer,jovanny,6,في المنزل يراقب المشط. في المحيط يشعر بالاضطراب. في المحيط يضع المرطب على المستحضر.,116,3.0880889892578125,3.087958335876465,3.1264963150024414
32655,HI,joy,6,انا لم ارك من قبل وانا احب اسم ايلينور انتظر لقد رأيتك من قبل كان لدينا جالور لذا اذا رايتني يوما ما,184,3.683123588562012,3.724059581756592,3.3831045627593994
40625,Sunrise,joy,6,إنّها قاسية ولا تعني رؤية جيدة، إنّها فظيعة، إنّها مؤلمة، إنّها مظلمة، إنّها باردة، خُذ نظرة حول المكان وسترى كلّ الأسرار القاسيّة المظلمة التي تعيش على روحك،,374,2.523165702819824,3.390853881835937,2.9384562969207764
93010,The Wizards Manners,joy,6,"عندما ذهب إلى عشاءٍ مُبَتَّر، كان المُفَجَّع أنه كان سيقابل الملكة. عندما خرج الطعام بدأ بالصراخ وقال ""أنا لا أريد الديك الرومي! العيون تحدق في وجهي مباشرةً!"" لقد كان خائفاً جداً كما لو أنه رأى دباً. ""يجب أن أخرج من هنا!""",418,3.2021255493164062,3.8043441772460938,3.272284746170044
93008,My day at the park,joy,6,كان يومي في الحديقة مظلماً جداً. مظلماً جداً لدرجة أنني لم أتمكن من رؤيته. بما أنني لم أستطع أن أرى نفسي أركض إلى شجرة. أوشي! يومي في الحديقة كان مظلماً جداً وبدأ يمطر. بما أن الماء كان يذكّرني نواة وبركه. رأيت سنجاباً يركض بجانب الشجرة عندما لم أستطع أن أرى. سقطت قدمي في جو. ذلك عندما تذكرت الحيوانات على سفينة نواة التي ذهبت على السفينة اثنين تلو الآخران. لم أستطع أن أتخيل كل تلك الحيوانات. لا بد أنها كانت حديقة حيوان! كان يومي في الحديقة مظلماً جداً وبدأ يمطر. أخيراً خرجت الشمس وكنت سعيداً جداً لدرجة أنني استطعت أن أصرخ! كان ذلك يومي في الحديقة مظلماً وممطراً ولكن الآن أستطيع أن أقول... أن يومي في الحديقة كان مشمساً لبقية اليوم وكل شيء سار في طريقي.,742,3.4184250831604004,3.5710160732269287,3.131782293319702
57242,*shopping*,joyce,6,التسوق ممتع جداً لدرجة أنه في بعض الأحيان عليك فقط أن تدير الدببة الصغيرة تحب أن تشاركه ما يحصل عليه من المتجر الذي يدعى (كليرا) معظم الوقت الذي أقف فيه في خط طويل وأنا دائماً ينتهي بي الأمر في وقت ينفذ مني الوقت عندما أتسوق,520,3.4503824710845947,3.594433307647705,3.3097097873687744
22571,Fall,joyce,6,الاشجار التي لا ورقة لها على الارض تلمع الناس خارج منازلهم تقع في كل مكان!,137,3.352342367172241,3.515697717666626,3.225578546524048
87105,My Shoes,jozie,6,لقد حصلت عليهم منذ اسبوعين انهم ازرق مثل السماء الزرقاء الازرق الكبيره,215,4.424000263214111,3.912267208099365,3.452524423599243
33730,WHAT IS SPRING ABOUT,jr,6,الربيع هو وقت لأشياء تنمو فيها أزهار تتفجر في جنة مثل الرابع من يهوية. صخور تخرج من الأشجار، الريح تمر عبر السماء تسافر من مكان إلى آخر. الطيور تصنع عشا جديدا لعائلة أحدث وأكبر. هذا هو كل شيء عن الربيع.,282,3.6653127670288086,3.3885085582733154,3.2962684631347656
33745,FAMILY,jr,6,لدينا معاً حياة من الحب لحظات من السعادة و السعادة المثيره الناس الذين يعيشون و سنوات التعلم و سنوات من المزيد من الأسرة,145,4.181870937347412,3.728810787200928,3.433884620666504
52253,The love germ,juan,6,الحب هو مثل الرش الجرثومي لكل زوجين كل يوم نتشارك قلوبنا لنهتم بحبنا الذي نتشاركه مع الناس الذين نحبهم ونضحك معهم كل يوم,154,4.089938640594482,3.698485851287842,3.399815320968628
66757,My  Life,juan,6,أعيش في منزل أحب أن أأكل طعاماً جيداً,51,3.7919459342956543,3.3818163871765137,3.3851563930511475
48781,Wish you were here,juan,6,أمّي العزيزة، أتمنى لو كنتِ هنا (كانكون)، لو كان هناك الكثير من أشجار النخيل لو أنّ (جوز الهند) في كلّ الهواء... يمكنكِ أن تشتمّي المحيط حيث الماء صافي. عندما يخرج شروق الشمس يمكنكِ رؤية المنظر الجميل،,605,3.794419288635254,3.537795066833496,3.2590579986572266
48365,Dog,juan,6,كلب مُخلص، مُفعّل، يُديرُ مسرحيّاتَ، نَحْب يَبْدو مثل ذئب ذئب,106,3.3051130771636963,3.2351889610290527,3.222312688827514
114879,The dog,juan,6,الكلب لم يكن مثل الكلب الذي يستطيع المشي والتحدث. كان يستطيع أن يركض بقدمين. كان ذكياً جداً. كان يستطيع الذهاب إلى المدرسة ويمكنه أكل الطعام. كان يعرف الرياضيات والعلوم. إنه ليس مثل أي كلب.,198,3.3894848823547363,3.224360227584839,3.296570301055908
110335,The languages of the kitchen : Chopnese,juan,6,إذا كنت بطيئ الطعام، في المرة القادمة قم بهذا. إمسك بسكينة، اقطع، اقطع، اقطع، اقطع، ولا تنسى أن تقوم بالتخبط. أولاً، اذهب للتقطيع ثم التثبيت، بعد ذلك اذهب إلى البلازما. اقطع، اقطع، اقطع، ثم اقطع ثم اسقط، ثم اذهب، اسقط، سعادتي لن تتوقف. استمر في التقطيع، اقطع، اقطع، اقطع، اقطع، اقطع، اقطع!,289,3.383796215057373,3.5760092735290527,3.408688545227051
50937,Stork and bread,juan,6,"عندما استيقظت في صباح يوم من صباح ذات صباح، كان على رأسي لقلقة. سألت: ""ماذا تفعل هناك؟"" نظر الي وقال..",203,3.109750986099243,3.2479937076568604,3.1587109565734863
45468,Spring Time,juanita,6,حدث حدث أحداث خاصة في الربيع حيث تنمو الأزهار في الربيع تظهر أقواس القوس في الربيع أنا من أجل الثلج أن يشرب ويأكل أياماً جميلة في الربيع,263,3.675346374511719,3.32661247253418,3.318255662918091
101028,About me,judiah,6,(جوديا أريزونا) ابن (مايك) و (روبيا إيليشا) و (دافيد) و (ماكنك) كلابيّ كلاّ كلاّبَيّ نمراً و كلمو و قطّة أَحبّ أصدقائي و عائلة,363,3.830976963043213,3.5181820392608643,3.30351185798645
15773,Sourcrout,judson,6,يجب عليك أن تكون مهذباً جداً أنت بغيض جداً ليس لديك أنيق,130,2.126744270324707,3.551274299621582,3.2726142406463623
37568,Changing,judy,6,تغير جانبين، مثل الناس. التغيير هو أمر مؤلم، التغيير يجعلك تشعر بالفخر. كانت المرة الأولى التي شعرت به، في الصف الخارجي. مثل أن تكون مغلقاً في غرفة مظلمة، محصوراً، وحيداً. كان الأمر كما لو أنني كنت ممزقاً إرباً وحياة مظلمة، عندما كان علي أن أترك صديقي. عندما قال وداعاً، بالنظرة في عينيه، كان الأمر كما لو أنه قال حكمي بالإعدام. لقد تغيرت، لقد تغير. ظننت أنه كان كابوساً، مثل عندما تتحول السلعة إلى فراشة مشوهة. ظننت أنني لن أشعر أبداً أبداً بالمتعة،,702,3.009812355041504,3.439279079437256,3.026618242263794
104747,Skins,juho,6,قدح جلدي الذي يتدفق على اعضائي. لبن جلدك الذي يدور حول اصابع قدمك. جلده الذي يغطي انفه. جلده بقع على كعكة كريم.,174,3.5125269889831543,3.3442418575286865,3.226064920425415
48319,Penguin,julain,6,لطيفة، وبطيئة، والسباحات، والانزلاق، والنوم لطيف مثل جرو,58,3.918398857116699,3.472283124923706,3.2978312969207764
