id,title,author,grade,text,char,valence,arousal,dominance
62682,Weekdays,jed,9,في يوم الإثنين أذهب للتدريب مع فريقي يوم الثلاثاء ألعب بقدمي مع جميع أصدقائي في يوم الأربعاء أمارس الجنس في التدريب وأحظى بالمتعة في يوم الأربعاء أجلس في المنزل وأشاهد التلفاز يوم الجمعة أذهب إلى المدينة مع عائلتي يوم السبت ألعب كرة القدم مع فريقي يوم الأحد أركب الخيل في منزل أصدقائي,296,3.572338581085205,3.32202672958374,3.316813707351685
53613,Track,jeff,9,عندما تفوز، لكن عندما تخسرها تترك مجرّة، رعب لديك مدى الحياة، يؤلمك أن تخسر، لكنّك تعمل من أجل الفوز.,126,2.8850605487823486,3.28970718383789,3.1462175846099854
99899,faded love,jeffrey,9,عندما يكون بحر الحب الآن هو يئوس من الدم والحب المفقود، كما أن العوامة الميتة فوق الآمال والأحلام المفقودة، الحب في الهواء الآن مسمّس الأفكار، فقط الشهوة تبقى بلا حب أو وعود، ذكرياتنا تتلاشى الآن في الأسود والأبيض، لا ألوان للتعبير عن الشعور الذي كان لدي،,515,2.348947048187256,3.442028522491455,2.8679304122924805
113086,Birds,jeffrey,9,هم يصعدون في السماء. دائما ينتظرون في الاشجار. يتساءلون عما يمر. من يستطيع معرفة ما يراه. أتساءل إن كانوا يبكون عندما يغادر الطفل. لماذا لديهم مناقير. هل يتكلمون. هل يتكلمون؟ هم لا يمشون حتى.,226,2.642435312271118,3.140249252319336,2.9067583084106445
38121,Petals of Love,jenessa,9,بتلات الحب تضيء الغرفة بألوان نابضة بالحيوية تنفخ قلبي مع سعادة الحياة، آمال الحب، أحلام كل بتلة أصلية,236,4.260709762573242,3.9439573287963854,3.3969147205352783
38122,Just One Lie,jenessa,9,الأكاذيب الصغيرة، تتدفق معاً. تنمو، تظهر إلى، المحيط الذي يبدو أنه يستمر في المضي فيه تمتصك فيه، تتدفق بسرعة كل موجة بسرعة,435,3.397534370422364,3.56824254989624,3.1661975383758545
96235,"This Life, This World",jeniffer,9,تَحْدثُ الأصواتُ كلماتَ غير معروفةَ أَشْعرُ بالأسى للذين يُشوّهونَ الوعودَ مثل ريش الطيورِ. أنا لَيْسَ لَيْسَ عِنْدَهُ إختيارُ أنا أعْمَلُ أنا لَيْنَ أَنْ أعْمَلُ. أنا لَيْسَ أَنْ أعْمَلُ.,951,2.969611644744873,3.3441686630249023,3.124132871627808
31279,Unconditional Love,jennie,9,الحب غير المشروط هو، تيدي، دبي الصغير المتقلب، عينيه الزجاجية والفرو الناعم يملأني بالسعادة، عندما ينام لا يمكنك أن تفعل شيئاً سوى الإبتسامة. عندما يكون مستيقظاً هو يحب بعد ذلك متقلباً. جسمه الهش، أرنبه مثل كفوفه الخلفية. يتدحرج على ظهره، وينظر إليّ بوقاحة وبقر. لديه حب نقي في عينيه الذهبيتين الأصفرتين، الحب غير المشروط.,370,4.079452037811279,3.7800180912017822,3.3135793209075928
62448,My Poetry,jennie,9,شعري هو الشيء الوحيد الذي يعرّفني. الشيء الوحيد الذي أحبه. الشعر هو ضعفي و أحياناً يتحكم بي. هذا كل ما يمكنني التفكير به عن بيوتري هو حياتي المعرب عنها بالكلمات. حياتي على الورق و أنا أتحكم كيف تنتهي القصة.,244,3.4217987060546875,3.330533742904663,3.330450296401977
33929,What is a Friend,jennifer,9,صديق هو شخص يمكنك أن تثق بشخص يمكنك أن تهتم به عن العكس التام للشهوة. هناك أشخاص يدعون أنهم لم يكونوا هناك أبداً,201,3.069770812988281,3.246849536895752,3.259680986404419
84505,Don&apos;t know why?!,jennifer,9,لا أعرف لماذا الفتيات الكبيرات لا يبكين؛ لا تبكِ؛ لا تبكِ الألم يتورم في صدري أعتقد أنني سأستلقي لأريح الدموع,408,2.290083408355713,3.545921802520752,2.9537031650543213
34714,Deeply Damaged,jennifer,9,لكنكم لن تعرفوا أبداً كيف أشعر بداخلي وأنا أزرع أكاذيبكم بسرعة هي مثل السرطان عندما تخفون الحقيقة المؤلمة وراء إجابة أخرى غير واهية,459,2.3542022705078125,3.4706735610961914,2.878650426864624
34713,To Me YouÂ’re Everything,jennifer,9,في أوقات كهذه عندما تُقبّلني هنا، لا شيء يبدو منطقيّاً... أعلم فقط أنّي أعلم أنّه يُفترض بنا أن نكون مندمجين في حبّك... أشعر أنّي حرّة جدّاً ومحميّة لأفكّر وأفكار غير متأثّرة...,1031,3.677944421768189,3.753515720367432,3.3177237510681152
18462,What is Love?,jennifer,9,الحب هو حنون. الحب هو حلو. الحب يمكن أن يوصلك عن قدميك. الحب أعمى وغير لطيف جدا. الحب ليس سهلا. من الصعب جدا إرضاء لي. الحب هو مجنون. الحب غير مستقر. لا تقع في الحب إذا لم يكن قلبك جاهزا.,241,3.8940975666046143,3.780379056930542,3.274877548217773
18465,Friends,jennifer,9,كان هناك صديق مشى. كان هناك صديق تحدث. كان هناك صديق أحب. كان هناك صديق ابتسم. كان هناك صديق بكى. كان هناك صديق مات.,285,2.894690990447998,3.355103015899658,3.0379254817962646
31313,ME,jennifer,9,اعتدت أن أكون عاطفياً جداً، كنت غاضباً جداً، لكنني اكتشفت شيئاً عن نفسي، أنا شاعر، مررت بأوقات عصيبة، بعض الأصدقاء كانوا هناك عندما احتجتهم،,369,3.3336217403411865,3.363595962524414,3.260432243347168
101784,Thinking of you,jennifer,9,كما كنت هناك أفكر فيك، كل أفكاري الرمادية والأزرق، أتمنى أن نكون معاً، أتمنى لو كنا نستطيع أن أتمنى لو أحببتني كما أحبك. <3>br>\n\n\n\t\t\t\t\t>>>br>,177,3.162187337875366,3.372764110565185,3.098576784133911
54844,Stars,jenny,9,نجمة طائشة تطير مثل طير تقول وداعاً بلون أبيض ساطع. كيف تلمع وتلمع! كيف تبتسم لك، تحميك ليلاً ونهاراً. الذين يجعلونك سعيداً جداً داخلك,417,4.13013219833374,3.8798437118530273,3.3268275260925293
24557,She is the one,jeremiah,9,هي الشخص، بعينيها الحقيقيتين والأزرق، عيناها زرقاء جداً، تقريباً كما لو أن عيناها هي البحر الأزرق العميق، العطر الذي ترتديه يجعلني أعتقد أنني في السماء، كل دقيقة أكن كنزاً، هو مثل كنز مدفون لا يمكن تأسيسه، هي مثل جزيرة غريبة التي تخبرك ألا تعود أبداً، تحزم حقائبك وترحل، ثم أقول يجب أن أعود،,475,3.7024056911468506,3.672513246536255,3.254720687866211
106947,&apos;&apos;Love is Powerful&apos;&apos;,jeriesha,9,الحب هو شعور قوي. الحب يمكن أن يكون حلو مثل البتلات الوردية. ولكن الحب يمكن أن يكون أيضا عذبا مثل تفاح أخضر. عندما في حبك يمكن أن يكون أروع شعور في العالم. تفكيرك دائما في ذلك الشخص المعين الذي يجعلك تشعر بالتميز، مثل الشخص الوحيد في العالم. الحب يمكن أن يتغلب عليك. الحب هو خارج عن متناول يدك. الحب يستطيع السيطرة على كل عبث في جسمك. الحب يدفعك إلى فعل أشياء قاسية. عندما حب حياتك لا يعود يحبك،,699,3.7212977409362793,3.806018590927124,3.2745039463043213
106951,&apos;&apos;Who Am I&apos;&apos;,jeriesha,9,أنا إنسانة ذات مشاعر وعواطف، أتألم، أبكي، أشعر بالألم، لكن من أكون؟ أنا إنسانة ذات أحلام أنا على استعداد لتحقيقها,261,3.489814281463623,3.5187134742736816,3.3261706829071045
107093,&apos;&apos;Love Hurts&apos;&apos;,jeriesha,9,ما الذي أفعله؟ أنا متعب من الشعور بهذه الطريقة. قلبي ينبض كل يوم يفكر فيك، يريدك أن تعود إليّ. لقد عنيت كل شيء لي، لكنه يؤلمك معرفة أنني لم أقصد لك شيئاً. كنت حبي. أنا ضائع في هذا العالم ولا أعرف ماذا أفعل. حلم عنك كل ليلة على أمل أن تعود إليّ. لكنك تحب شخصاً آخر الآن. ولا شيء أقوله أو أفعله سيعيدك. لم أرد أن أتخلى عنك، لكنني أدرك أنني فقدتك إلى الأبد.,465,2.569967269897461,3.453453540802002,2.931384563446045
107195,&apos;&apos;Hide In the Shadows&apos;&apos;,jeriesha,9,أريد أن أختبئ على الظلال المظلمة أريد أن أكون وحيداً ولن يجدني أحد كل يوم أشعر بالألم والحزن والاكتئاب أشعر أنه ليس لدي من ألجأ إليه أريد أن أختبئ في الظلال المظلمة,406,2.0368690490722656,3.4820821285247803,2.7399206161499023
102263,The boy how thinks he can play ball,jermaine,9,عندما رأى هدفاً وكرة سلة لذا التقطه وأطلق النار عليه وفي رأسه يعتقد أنه الأفضل لكنه لعب دور الكثير من الناس وخسر لذا فهو يعتقد أنه سعيد واكتشف أنه ليس جيداً في المكان,256,3.362541675567627,3.4045419692993164,3.213465690612793
102064,Unending love,jerry,9,ذئبان يركضان جنباً إلى جنب، سعيدان ومبتسمان، طلقة رنّة وسقط ذئب، الذكر ينوح لأيام، ليس للأكل، أو النوم، ويموت بدون فعل شيء. للذئاب يتزاوجون مدى الحياة ولا يتبادلون الشركاء. الفراق هو حزن كبير.,236,2.800400733947754,3.463876724243164,3.0314033031463623
83759,The Hippy Hippo,jess,9,في أسفل البحيرة كانت أعلى الشجرة تُنزلق على قمة الشجرة أشجاراً مظلمة طويلة جداً. شيء ما خارج اليوم، مختلف وغريب. أسد قرد a a مجنون. الورك يَرتفعُ يَتْركُ إلى الجانب الأيمن إلى جانب يَصْدمُ ويَطْحنُ كُلّ الوَقت. الهيباديي هوب زلقة تَتْركُ الهيبو لتَمرير الوقتِ.,314,3.1062541007995605,3.257735252380371,3.1172049045562744
17985,ASK THE GIRL IN THE RIVER,jesse,9,اسأل الفتاة التي في النهر أن تسأل الفتاة التي في النهر هي التي تشعر بالضيق أن تسأل الفتاة التي في النهر مع الدمعة التي تتدحرج على وجهها، واسأل الفتاة التي في النهر,492,2.7747764587402344,3.111847400665283,3.053587913513184
22533,Why do these tear drops fall down my cheek ?,jessica,9,لماذا تسقط هذه الدموع أسفل خدي؟ لماذا هذه الدموع تجعلني ضعيفة؟ هل أنا سعيد أم أنا حزين؟ أو هل أنا أفكر في أبي؟ لماذا تسقط هذه قطرات الدموع في خدي؟ لماذا هذه الدموع تجعلني أبكي؟ هل أنا مجنون؟ أو هل أنا مجنون؟ أو هل أنا أفكر في الأشياء اليومية فقط؟,301,2.424782514572144,3.385664463043213,2.8769471645355225
55143,I Have A Dream,jessica,9,لدي حلم بأن الجائعين والمشردين لن يضطروا للمعاناة بعد الآن، لدي حلم بأنهم لن يتم تجاهلهم. لدي حلم بأننا لن نضطر للقتال فيما بينهم، لدي حلم أنه في يوم ما سنبدأ التصرف مثل الأخوات والأخوات. لدي حلم بأن الأمريكيين الأفارقة الذين قاتلوا من أجل حريتنا يمكنهم أن يروا كيف تغير عالمنا،,1097,3.4366488456726074,3.412717819213867,3.293316125869751
92484,Goodbye flower,jessica,9,صغير كالفأر، كبير كشجرة أحب أن أجلس وأفكّر بك و بي. على الرغم من أنّك زهرة، يجب أن أقول حقاً أنّي أودّ رؤيتك في كلّ أيام الربيع. رأيتك في الصيف وأيضاً في الربيع، في كلّ مرّة أراك قلبي يرنّ,442,2.984747648239136,3.340648889541626,3.1146464347839355
92774,Curiosity,jessica,9,المستقبل هو مشرق المستقبل هو قاتم يعتمد على الشعوب الضوء وعلى خطاياها نتساءل إذا كان الاختيار سواء كان سيئاً أو لطيفاً هو المفتاح لصوت جديد من النصر أو الهزيمة للكراهية أو للحب أو للحب لجعل واحد حامض أو حلو للادخار أو لدفع لإعلان الحرب أو السلام,451,3.266085624694824,3.319380044937134,3.2922284603118896
95413,The Dolphin,jessica,9,الدلافين، جلد فضي، يقفز بلعب عبر الموجات، مخلوق جميل ومفتخر، ملكة البحر.,122,3.9418845176696777,3.6068274974823,3.328404188156128
111210,Live on,jessica,9,نعم، بارك الله فيني، أعيش في يوم آخر، أعيش لأبكي عندما أؤذيك، وأؤذي عندما تعيدك إلى الوراء، ظهري ضد العالم بالنسبة لك، العالم مكان قاسي مظلم نعيش عليه،,464,3.33195161819458,3.65940523147583,3.2238881587982178
95951,The Two Sides To Love,jessica,9,لكن الحب ليس بهذه السهولة، أليس كذلك؟ فكرة أنه يحبك، أنت لا تقتل. تتمنى أن تجعل الشعور يحذف. فقط أنت تدرك أنك تحب الإثارة. المطر مع الحب يتدفق للأسفل والأزهار تتبع. أنت تأمل أن تستمر الأمطار إلى الأبد. ثم تدور عاصفة رعدية مرة أخرى، وهكذا تتغير الأشياء مرة أخرى ليست ذكية تماما. نحن جميعا نريد أشياء لا يمكننا الحصول عليها، الحب واحد. المشقة تجعل الحب، إذا لماذا تريد الآن؟ الحب يأتي، لكنك لن تعرف بعد,617,3.630238056182861,3.616233348846436,3.231831789016724
35513,Always,jessica,9,أنت تراني واقفاً هناك مع دموع تنزل إلى وجهي دون أن أعرف ما كان يحدث، مع عقلي تماماً في الفضاء أحاول أن أصف نفسي مرة أخرى في الواقع,695,2.508475542068481,3.4248766899108887,2.9124104976654053
35435,Beneath,jessica,9,فكّر بالشفقات على وردة ناعمة جداً لتلمس. شعور مثل هذا سيجعلك ترغب كثيراً. ترى جمالاً ومثل الرائحة تختلف عني. أرى أنها شوكات وأنها تذبل في نهاية المطاف. يجب أن يكون هناك المزيد خلف ما نراه يومياً. شيء نعتقد أنه صغير جداً جداً يمكن أن يكون له الكثير ليقوله. ليس لدينا الحق في الجلوس وافتراض أن لدينا معرفة من البصيرة الأولى. نحن نخدع أنفسنا ونخفي عواطفنا؛ هل نحن خائفون جداً من الخوف؟ انظر إلى ما بعد وتحت المرة القادمة التي تظن أنك تعرف فيها. 'أكره أن أكون الشخص الذي يعود ويقول 'أنا أخبرك بذلك'.,570,3.4015088081359863,3.496046543121338,3.259567975997925
46433,Nicole,jessica,9,كنت أعرف فتاة اسمها نيكول تحب أن تلتقط أنفها ذات يوم أنف النكولات بدأت تنزف لم أكن أعرف ماذا أفعل لذلك أنا فقط ربطت حذائها.,143,2.341528415679932,3.245079040527344,2.9341042041778564
87901,From This Moment,jessica,9,أليست رائعة؟ تمشي نحوك، أسفل الممر المزهر، لباسها المتدفق، شعرها البري، وعيناها عميقة مع العاطفة،,377,4.069550037384033,3.938124656677246,3.318411350250244
99740,Late at Night,jessica,9,في وقت متأخر من الليل كنت أتسكع ولا أدير أي شيء أشعر أنه الحق في هذا الحرق المؤلم ولكن أنا فقط حصلت على نفسي اللوم! كان علي أن أقاتل للحفاظ على الشعلة. والآن تؤلمني بعمق في قلبي. تقع هذه الطفرات العاطفية من جانبي. الآن أنت ذهبت تقف وحيدا. هذا يبدو خاطئا جدا. فقط أمسك الهاتف وأخبرني أنك تريد أن نكون. ثم يمكنني أن أتباهى والعالم يمكن أن يرى ما أراه في وقت متأخر من الليل,505,2.2198190689086914,3.463172912597656,2.905846118927002
53872,I Thought Wrong!,jessica,9,أعتقد أنك أحببتني، وأننا يمكن أن نكون دائماً، لكن أن تأتي لتكتشف أنّك تحبّها هي وليس أنا... أعتقد أنّ الأمور لا تتغير أبداً، لأنّ كلّ مرّة أنظر في عينيك أرى نفس الألم القديم الذي احتقرته، لكن في أعماقنا كلانا يعلم أنّي ما زلت أحبّك التي تنمو وتنمو.,305,2.5913000106811523,3.318594455718994,3.0234405994415283
38702,My Under Skin Feeling,jessica,9,لا يمكنني أن أطلب يوماً في اليوم الذي آخذه فيه كالدواء الذي أشعر به، لذا لوحدي أحاول أن أتمسك به، مهما كان ما تبقى من هذا الألم فقد غبت هذه المعاناة عن أغنيتي أنا تقريباً متعب جداً جداً,1085,2.2677865028381348,3.5371527671813965,2.9386982917785645
100214,The One For Me (part 1),jessica,9,هل سبق لك أن كان لديك شخص لا يحبك؟ لا تستسلم لأنه هناك شخص خاص ينتظرني و أنت؛ أحيانا الحب صعب العثور عليه؛ فقط الثقة و الإيمان و ترك ماضيك وراءك؛ شخص يحبك مهما يكن؛ حتى عندما تكون الأوقات صعبة و قاسية؛ شخص ما دائما بجانبك؛ شخص ما ليحبك ويرشدك؛ شخص يحبك بدون شروط؛ و لا يترك حبك مثل نوع من الغموض؛ لذا نصيحتي لك,515,3.5332484245300293,3.461874008178711,3.3419859409332275
100212,Life,jessica,9,أنا دائماً أتحدث عن أختي التوأم (جانيت) وهي ذهبت لفترة طويلة إلى كوكب آخر، وكتابة الشعر لجعل عقلي حراً، لكن على الأقل أنا أعرف أن (جانيت) مرتفعة، مرتفعة، عالية، عالية، أعلى من الأشجار؛ لقد أخبرت أمي الحقيقية قامت بالكثير من المخدرات؛ و هي لم تهتم إذا كنت أعيش في منزل مليء بالعناكب والحشرات؛ و الآن أنا مباركة على الكثير من الأشياء لأم مثل أمي التي تهتم بي وتحبني؛ عندما أرى توأماً أنا أبكي دائماً؛,784,3.035736322402954,3.429986000061035,3.1219494342803955
100215,The One For Me (part 2),jessica,9,كنت أنت الشخص المناسب لي، هذا ما فكرت فيه ولطالما آمنت به، فكرت في إعطائك فرصة ثانية، وربما يوماً ما ستسألني,144,3.4344191551208496,3.360383987426758,3.3525078296661377
111171,As I Wait For You,jessica,9,أنا أجلس هنا هذه الليلة. الدموع تتدفق كما أفكر بك. أحبك بكل قوتي، وأصرخ إلى الله من أجلك. أن ترى نوره المنقذ، وتبقى مخلصاً وحقيقياً. أدعو أن يبقيك على مرأى منه، وأن تحبني أيضاً. أطلب منا ألا نخاف، بل نبقيه دائماً في عين الإعتبار. أتوسل إليه أن يعلمك ما هو صحيح،,447,3.3830394744873047,3.4887382984161377,3.1693739891052246
100213,Never Able 2 Trust A Boy,jessica,9,لا تستطيع أن تثق في صبي؛ 2 ضحكة ولعبة وامكانة 2 التمتع؛ شخص ما الذي هو دائما هناك؛ شخص ما 2 يعاملك بالحب و الرعاية؛ شخص يحبك من كل قلبه؛ شخص ما 2 يخبرك,193,3.8160977363586426,3.524851083755493,3.368196487426758
100216,The One For Me (part 3),jessica,9,أنا أتذكر الأوقات الجيدة التي تشاركنا فيها، ولكن أفضل الأوقات كانت عندما أظهر لي يوي أنك تهتم حقا، عندما كنت في حاجة لك، كنت دائما هناك، ولكن ترك ونسيان كنت واحدا من أكبر مخاوفي، عندما أنظر إلى السماء،,447,3.008320569992065,3.4047863483428955,3.045668363571167
66838,shark,jessica2,9,.................................................................................................................................................................................................................................................................................................,77,2.8448777198791504,3.220176696777344,3.145540475845337
23766,Feelings,jessika,9,كلمات الحكمة تأتي من قلب الشخص الذي يقول كيف تشعر، ولا يعرف من أين تبدأ قريباً بما فيه الكفاية يخرجون جميعاً بدون تمزيق دمعة واحدة,210,3.362354755401612,3.3452253341674805,3.243232488632202
93211,Somewhere,jesslyn,9,"في مكان ما هناك طريقة، في مكان ما يوجد مكان، في مكان ما يوجد شخص ما يبحث عني في الخارج. في مكان ما فكرة، في مكان ما هناك مذكرة، وفي مكان ما وقت، حيث يكون الحب. لكن في بعض الأحيان لا توجد طريقة، وفي بعض الأحيان لا يوجد مكان اليوم. في بعض الأحيان لا يوجد أحد في الخارج يمكنك أن تقول ""هناك صديق لي"" ولكن مجرد فكرة أن العد هو الأفضل في هذا العصر. في بعض الأحيان لا توجد ذكريات، في بعض الأحيان لا يوجد وقت كاف،",594,3.3723702430725098,3.328406810760498,3.2285897731781006
66859,Sharks,jesus,9,بعض أسماك القرش كبيرة، وبعض أسماك القرش صغيرة، وبعضها قصيرة، وبعضها طويلة، وبعضها تعيش في المياه العذبة، وبعضها تعيش في المياه العذبة، وبعضها تعيش في المياه المالحة، وبعضها تحب المضغ، وبعضها تحب المضغ،,220,2.942203521728516,3.123358249664306,3.217591047286988
94910,nugget,jhon,9,ذات مرّة كان هناك رجل يعيش في (ماكدونايدس) كان يباع بثمن ما في وجبة أطفال في النهاية,99,3.0306711196899414,2.964796304702759,3.177866220474243
84466,Summer camp,jibri,9,استيقظت اليوم مع هزة عندما بدأ جسدي بالزلزال بسبب المخيم الصيفي. غسلت أسناني و غسلت وجهي لأجعل نفسي ما زلت مستيقظاً ليومي الأول في المخيم الصيفي. دخلت بخطوات سريعة لا تزال تمسح من وجهي,441,2.502649307250977,3.468957901000977,3.059938669204712
115968,Socks,jimmy,9,لم يكن لديك أي مشاعر إن فعلت كيف ستشعر حيال أن تكون مدوساً على ممزقات ممزقة إرباً هل تشعر بألم أن لديك عملاً شاقاً أو هل تشعر بالفخر أنك قمت بعمل جيد في خدمة هدفك؟,289,2.626883745193481,3.3001999855041504,3.084316730499268
115967,September,jimmy,9,أنا أحب أن أخرج في وقت متأخر من أيلول/سبتمبر. لا أن أسخن وليس بارداً جداً، فقط تماماً مثل الذهب. إذا شعرت السماء مثل أي شيء سيكون هذا، نعمة نقية. أوراق تبدأ بالتغير، ولكن ليس السقوط. مزيج من الأصفر والأخضر يبدو مثل واحة الصحراء. رائحتها لطيفة، لا تلوث، لا ثلج، فقط نظيفة. إنها تجعلك تعيد التفكير بالأوقات الجيدة. تلك الأفكار الحزينة يمكن أن تنتظر يوماً، أو يوماً ممطراً،,466,3.981043577194214,3.610515832901001,3.3582799434661865
