id,title,author,grade,text,char,valence,arousal,dominance
101094,Louder than,alisha,4,أعلى من صوت فيل أعلى من صوت حادث سيارة، أعلى من صوت وحش مشعر، أو عدة أطفال يبكون، أعلى من صوت فيلم في السينما، أو رشة في حوض سباحة هذا هو صوت عائلتي!,206,3.307268619537353,3.8125405311584473,3.3467371463775635
63788,Turkeys,alisha,4,الديك الرومي هو لحم خنزير، يبدو مثل المحار.,46,3.070618152618408,2.930427312850952,3.1753079891204834
85712,It Is Cloudy With a Chance of  Pizza,alisha,4,لقد استيقظت في صباح أحد الأيام و كانت هناك بيتزا. سألت أمي ما الذي كان يجري قالته للتو، نحن نتناول البيتزا إلى الليل لذا ذهبت إلى الخارج لأرى,373,3.347062826156616,3.415792465209961,3.2899105548858643
65479,Windy Wind,alison,4,والرياح قوية جداً وقوية جداً وخطيرة ولكن ليس دائماً في بعض الأحيان محارها.,88,2.6678295135498047,3.228451728820801,3.1062018871307373
72434,aBOUT alison,alison,4,اسمي (أليسون) لدي ابن اسمه (بالسون) إنه لطيف أنه يلعب الناي,83,3.643152952194214,3.317648410797119,3.282553672790528
34746,Rainy Days,alison,4,كان يوماً ممطراً، ليلة ممطرة، كنت أنا وأختي وشقيقتي خائفين كثيراً، ذهبت تحت بطانيتي للاختباء هناك وجدت أنّي وجدت ملابس داخلية مُخيفة، ذلك لم يكن كلّ خوفي، الشيء التالي الذي علمتُ أنّي فقدتُ بصري، وأخيراً استيقظتُ من كابوسي المُخيف، أنا سعيد أنّي كان لديّ دبّي.,290,2.82311487197876,3.534531116485596,2.9335944652557373
47520,The Frog from Japan,alison,4,كان هناك ضفدع من اليبان. كل حين كان يصعد على رجل. فأكل كل يوم واحتفظ بالطعام. ذلك الضفدع كان من اليابان.,141,3.0367095470428467,3.033146858215332,3.1413614749908447
83981,Movies,alison,4,أذهب إلى السينما كل يوم واحد أتمنى لو أستطيع البقاء طوال اليوم أذهب في يوم الإثنين يوم الثلاثاء الثلاثاء الثلاثاء يوم الثلاثاء,169,3.070725917816162,3.202206611633301,3.2008092403411865
32534,And The Ansew Is.......,alison,4,من فضلك لا تنظر إليّ، الإجابة هي مُضيّ، أنا أنظر إلى هواء رفيع، أنا أنزلق إلى كرسيّ!,130,3.0011000633239746,3.689239501953125,3.287621021270752
32276,At The bottom of The Hill!,alison,4,في قاع التل كان العشب الأخضر ينمو، في أسفل التل كان النزهة يجلس الناس، في أسفل التل,216,3.429749011993408,3.379734992980957,3.2789852619171143
32574,When I Awoke,alison,4,عندما استيقظت في صباح أحد الأيام صقر مثقوب على رأسي. سألت ماذا تفعل هناك؟ لقد نظر إليّ وهرب.,115,2.632822036743164,3.419269561767578,2.9445507526397705
17360,Faerie,alissa,4,أَبْنَيْنَا شَيْرَيْنَيْنِ رُبِطَا وَجَهْدًا عَلَى عَبَاءِ عَلَى عَيْنِ عَيْنَيْنِ حَجْزَيْنِ حَيْنِ حَجْزَيْنِ,126,3.137997627258301,3.119722604751587,3.117692708969116
17362,The Mermaid,alissa,4,إنها تغني أغنية مائلة بينما يحلم البشر على الوسائد,141,3.383436679840088,3.2067720890045166,3.213475227355957
17365,The Unicorn,alissa,4,"""وحيث وحيد القرن مع عيون كأعين كأقمار من فضة فضية متدفّق"" ""أحبّ وحيد وحيد القرن البري"" ""حبّاً لا أستطيع أن أحتويه""",156,3.883922100067138,3.576240062713623,3.269561529159546
21575,The Big Fat Cat,alix,4,عندما وصلت رأيت حيواناً ولكن في الحقيقة كانت قطتي، كان اسمه السيد بليتن ولكن يا له من قطة جائعة. كان يجب أن أعرف ذلك اليوم أن أبقى بعيداً فقط. وإذا كان عليك أن تعرف. فقط اذهب وأنظر إلى الداخل. وبالمناسبة أنت لا تفعل. أو سيحدث لك نفس الشيء.,420,2.833247661590576,3.2279064655303955,3.1380560398101807
24165,A Thousand Dreams,alixandria,4,إذا وقف صبي على القمر، كل السماوات تدعو الزوايا حولية، وقفت الدموع من السماء المضطربة، من السقوط إذا كان الصبي واقفا على القمر,415,3.6167025566101074,3.594174861907959,3.277392625808716
49174,My Little Angel,aliyah,4,ملاكي الصغير، هي جميلة بقدر ما يمكن أن تكون، أنا لا أعرف ما أود أن أفعل، إذا لم تكن معي، عندما تبتسم لي,185,4.2147603034973145,3.913611888885498,3.396199941635132
116395,Being In Prison Is No Fun,aliyah,4,وجودي في السجن ليس مرحاً، قطعة خبز وماء حار لا تنجز العمل، الحمامات باردة ومظلمة، وقلوب رجال الشرطة صغيرة وحجرية، أحلم باليوم الذي أستطيع فيه الهروب من هذا المكان بدون شمس، لأن البقاء في السجن ليس مرحاً!,284,2.269340991973877,3.454036235809326,2.9449775218963623
29469,Love,all,4,الحب مثل الحمامة، مثل الفراشات في بطنك، الحب ليس دمية، سوف تقع في الحب في أي يوم.,104,4.135566711425781,3.817285537719727,3.361790418624878
87674,my teacher and me,allaha,4,إنها في الـ 25 من عمري أنا وهي نحب أن نساعد بعضنا البعض,100,3.828877449035645,3.381304979324341,3.2888786792755127
87395,Heaven,allan,4,السماء مكان جميل جداً، لا تستعجل في الحصول على إيقاعك.,64,3.644196510314941,3.389782428741455,3.3028175830841064
73402,happy,allen,4,أنا سعيدة طوال الوقت عندما أرى أصدقائي كل يوم وعندما أجد قرشاً,80,4.041656017303467,3.5826215744018555,3.3789055347442627
26833,Dogs Dogs Dogs,allen,4,كلاب رائعة، كلاب حلوة، كلب جاء يركض إلى ركبتي,77,4.31195592880249,3.722790718078613,3.3533313274383545
39279,Winter,allen,4,الشتاء عادة ما يكون بارداً ما عدا عندما تكون في وادي الموت,342,2.78832745552063,3.3299951553344727,3.059659242630005
45261,The Game of Hockey,allen,4,الهوكي، الهوكي، الهوكي أفضل لعبة في الديك الرومي، تستخدم عصا الهوكي لتصفع و تمرير القرص، تحتاج إلى معدات الهوكي لحمايتك من العصى، المرمى يحتاج إلى عُدّة المرمى لإنقاذ العصى. تم إسقاط العصى واللعبة العظيمة تسير،,388,3.518312931060791,3.553434133529663,3.353627443313598
31921,Cat &amp; Rat,allen,4,الجرذ يركض من القطة القطة سمينة جداً حتى أنها تنام على السجادة والجرذ يختبئ في القبعة والجرذ آمن,111,3.032310485839844,3.1762945652008057,3.1711232662200928
87701,A Man Named Flappy,allen and justin,4,كان دائماً سعيداً جداً جداً كان يحب الرقص حقاً مكانه المفضل هو فرنسا,149,3.780218601226807,3.431499481201172,3.285529613494873
92463,summer,alleyne,4,أنا أحب الصيف لأنه حار. أنا أكل الآيس كريم والآيسكريم.,62,3.7246999740600586,3.313884019851685,3.2618725299835205
90901,Bunny Honey,"alli, aniya, jessica, and morgan",4,أرنب يحب ذلك العسل القديم الحلو والآن هو مضحك جدا قبل أن ذلك الأرنب قال نعمته كان لديه كل ذلك العسل على وجهه الآن أن الأرنب ذهب إلى السرير ولكن لا يزال لديه العسل على رأسه عندما استيقظ الأرنب رأى أن العسل في كأسه,264,3.679526090621948,3.457566738128662,3.281514883041382
27686,The Goblin Who Will Take My Cake,allie,4,"في يوم السبت ذهبت إلى الداخل في محاولة لخبز كعكة. ثم ابتسمت ونظرت إلى نفسي وقال: ""أنا في حاجة إلى مفرقعة."" أنا أيضا بحاجة إلى ثعبان، شريحة لحم، وأنا بحاجة إلى جعل ذلك في بحيرة. ثم سأتركه ليأخذ. ثم عندما يستيقظ سوف يعتقد أن كل شيء كان مزيفا!",282,3.254525661468506,3.4220175743103027,3.2986395359039307
118732,Ellie ellie,allie,4,(إيلي إيلي)، جميلة وجميلة جداً، لديها شعر بني وعيون هازيلة، لديها ابتسامة لطيفة،,153,4.156365871429443,3.623092651367188,3.2676258087158203
118740,The creepy stare,allie,4,جاري لديه تحديق مخيف، أراه مشرقاً، في الهواء، حتى عندما لا يكون هناك شيء هناك، تحدقه الشريّر، يبقى في الهواء.,120,2.603217124938965,3.3741977214813232,3.043888807296753
118749,Writing a poam is fun,allie,4,كتابة الأبراج ممتعة، يمكنها أن تجعل قلبك يرن، أخذ الكلمات وتغريدها معاً يمكن أن يكون الكثير والكثير من المرح.,121,3.968295097351074,3.542664289474488,3.376332998275757
78016,Funny bunny,allie,4,لدي أرنب هي مضحكة حقا نحن نحب اللعب في الثلج نقول الكثير من النكات أنا أحبها.,101,4.133263111114502,3.637167692184448,3.3753135204315186
84008,Under my bed,allie,4,لا أحاول إزعاجك، لا أحاول أن أكون حشرة، لكنها حقاً فوضوية جداً، لا أحاول التوسل، لكن لن يقتلك تنظيف سريري، رجاءً!,203,2.504864454269409,3.59778094291687,3.350641250610352
108001,My Family is A Jungle,allie,4,عائلتي هي غابة. ابي هو النمر الذي يحمينا. امي هي البونة التي تهتم بنا. اخوتي هم الياقور الذين ينشطون ويركضون بسرعة. انا الباندا الذي هو حلو ومحبوب.,204,3.536642551422119,3.284260034561157,3.2162351608276367
17611,Stickers,allie,4,أنا أحب الملصقات بكل بساطه أنا سوف أزيلها ثم ألصقها في أي مكان لدي كل أنواعها مثل الضبابي ، المتوهج ، المتوهج في الظلام أنا أحبهم,250,4.007330417633057,3.708253860473633,3.3988401889801025
109902,Puppy day,allie,4,في أحد الأيام كان هناك جرو وحيد في حديقة الكلاب. لم يكن هناك أحد للعب معه. فجأة فجأة جرو صغير و الجرو الصغير و الجرو الآخر كان لديهما الكثير من المرح معا. ومن ذلك اليوم على كل منهما جاءا إلى حديقة الكلاب في 1: 30 مساء يوم السبت والجمعة. ولكن في أحد الأيام توقف الجرو الصغير عن المجيء إلى حديقة الكلاب. ولكن فجأة جاء كلب كبير إلى حديقة الكلاب كان الجرو الصغير خائفا. ولكن الكلب الكبير كان لديه نفس المالك كما فعل الجرو الصغير كان الجرو الصغير هو الجرو الصغير الذي كبرت عليه.,512,3.349433660507202,3.342991828918457,3.190449953079224
106199,My Uncle Patt,allie,4,عمّي Patt &lt; bro & gt; له a قطّة & lt; b & gt; الذي يرتدي قبعة & lt; bry & gt; و ينام على a حصيرة.,94,3.0929067134857178,2.9221713542938232,3.1591813564300537
77198,An elephant followed me home,allie,4,فيل تبعني إلى المنزل اليوم بعد أن انتظر خارج صفي كان يتسكع بصبر طوال اليوم يلعب لعبة هوب سكوتش و يمضغ العشب,143,3.1363344192504883,3.05213475227356,3.119081258773804
47399,I do not get it!,allie,4,الأولاد يقودونني للجنون أنا لا أفهم! البعض يمكن أن يتلاعب بيد واحدة فقط! بعضهم مجانين وبعضهم كسالى، لا أفهم! أنا لا أفهم! أتساءل كيف سيتصرفون عندما يكونون رجالاً.,197,2.302590131759644,3.5703582763671875,3.07357120513916
21524,Pumkin touch,allie,4,أرى يقطينة على حائط لذا أشعر أنها تبدو وعرة عندما أضع يدي في أسفل في هو يشعر بالسكينة.,103,2.6709799766540527,3.075773239135742,2.9909567832946777
73754,Homework,allie and kara,4,الواجب هو شيء ممل، يجب أن نعطيه لملك، لدينا حقا الكثير منه، مثل الكثير من الكرات في قفاز واحد.,122,3.109621047973633,3.2126212120056152,3.291533231735229
44515,Spring Break,allison,4,أرمي ذلك الرماة، وكلي شريحة لحم، من أجل مصلحتك، أنت لست مزيفة، أصنعي كعكة، وخذيها إلى البحيرة، من أجل عطلة الربيع.,136,3.18353009223938,3.424251079559326,3.4685986042022705
44503,Ox,allison,4,"رأى زاخ ثورا، كان يلعب مع كتل، في صندوق، كان ذاهبا إلى القول، ""'انتبه لذلك الثعلب، ثور!'' لكنه رأى، أن الثعلب كان على الجوارب والصناديق النوائية، بعد ذلك نظر إلى الساعات، ورأى بعض الصخور، ثم نظر إلى الأعلى ورأى أغنام الصقور مع الأقفال، إلى سيئة زاخ، لم يكن لديك قبعة.",307,2.7838120460510254,3.2279317378997803,3.1253883838653564
27790,Christmas,allison,4,عيد الميلاد هو عطلة أحب عيد الميلاد عندما تحصل على هدايا عيد الميلاد هو عندما ترى الأسرة الكريسوس هو عندما تحصل على سنة جديدة! وأنا أحب عيد الميلاد مهما كان.,175,4.298834323883057,3.753508090972901,3.421039342880249
105286,Parade,allison,4,أطفال صاخبون و صاخبون يتظاهرون بأنهم طائرات فتيات صغيرات يبكون الأولاد كانوا يسمونهم أسماء أولاد صغار يتصرّفون بمسيرات بريئة يمكن أن يكون مرحاً فقط تأكدي من أنك لن تضيعي,198,3.4173178672790527,3.3819894790649414,3.2619307041168213
108084,The Pool,allison,4,والرياح القوية التي تهز المياه وأمي والشمس تحمي الناس بينما يرتدونها وأخي الخرسانة لم ترد أبداً لمس الماء,240,2.540225982666016,3.387924194335937,2.876500129699707
107995,Hamster,allison,4,"""الهام من أجل ""هامستر",27,3.187511682510376,2.9612584114074707,3.232970952987671
108006,Ocean,allison,4,عائلتي تعيش في المحيط. والدي هو القرش الأبيض العظيم الذي يحمي الجميع. أمي هي الدلفين الذي يعتني بنا. أخي هو السمكة المهرجة لأنه دائماً يهرج حولها.,298,3.587040901184082,3.403916597366333,3.2828776836395264
107997,Pizza,allison,4,بيتزا مثالية جداً,26,4.134636402130127,3.534674644470215,3.386258363723755
107989,Star,allison,4,نجمة نجمة ترفرف بنجمة نجمة ساطعة أرى في الليل نجمة نجمة أحلم أن آمل أن تتحقق تلك الليلة,118,3.742209434509277,3.6214194297790527,3.281825304031372
107985,Love,allison,4,الحب في الهواء الحب في كل مكان الحب في كل مكان,89,4.236695766448975,3.772670269012451,3.3540616035461426
27852,My teacher,allison,4,معلمتي لطيفة جداً لكنها تعطي الكثير من الواجبات المنزلية أتمنى لو أنها لا تفعل لأنها لطيفة جداً تحب أن تعطي الهجاء والرياضيات والقراءة الكثير من المشاكل لذا أعتقد أنها تعطي 50 أو 20 معاً,257,3.275420665740967,3.145026206970215,3.214785575866699
42972,ALARM   CLOCK,allison,4,"أعلى من بوق ضباب أعلى من صافرة قطار أعلى من إنذار حريق هذا هو الصوت العالي لـ ""ساعة الإنذار""",122,2.9485716819763184,3.5338521003723145,3.188451051712036
47939,Quieter Than a Pin Dropping on the Floor,allison,4,أكثر هدوءاً من دبوس يسقط على الأرض، أو قلم رصاص يتدحرج من مكتب، أكثر هدوءاً من شخص يكتب على باب، و قطة تتسلل في فوضى، أكثر هدوءاً من فأر يأكل الجبن، أو سمكة تسبح في بركة، أكثر هدوءاً من كولان من النمل الذين يهتمون بالبازلاء، أو الرياح تهب حول فون طفل،,357,2.900501251220703,3.1864709854125977,3.1094958782196045
47627,May,allison,4,مُسَلِّياً جداً,32,4.162691593170166,3.563047170639038,3.33617639541626
93501,Family,allison,4,أهم شيء في العالم هو الأسرة التي لا نفكر كثيراً في ما هو العمل ولكن قريباً سوف نفعل أنا وأنت الكثير لنا ولكن ماذا نفعل لهم؟ أتمنى أن تدرك قريباً ماذا سنفعل بدون عائلة؟ بالطبع أنت تحاول أن تدرك أن الأسرة هي أهم شيء في العالم!,333,3.257833480834961,3.492098569869995,3.30541729927063
24596,Didn&apos;t  You  Hear?,allison,4,بعد 16 يوماً في الغلاف الجوي متجهاً إلى الوطن فقدت. أجزاء من المهمة منتشرة على تلك الولاية العظيمة تدعى تكساس. ألم تسمع أن سبعة فقدوا وأن خمس عائلات أعضاء مفقودين؟ ألم تسمع؟ نعم صحيح، ما يقولونه عن الكولمبيا..,284,2.486910343170166,3.1887593269348145,2.981147527694702
38238,Equality,allison,4,يخجلون الى الابد لانه لا نتقاسم حقوقنا معك. هل نعطيهم اياها ابدا. ماذا وعدنا نحن. هل أصلحنا حقا خطئنا. ام لا يزال هناك. فليرن الحرية اخيرا كما قال الدكتور الملك انت وانا نشترك في عار ان لا نعاملهم كما نعاملهم.,281,2.761417388916016,3.326436996459961,3.147639036178589
30035,"Hello,you&apos;ve been stung by a Bee",allison,4,لقد تم ضربي من قبل نحلة، وأنا لن أقول لكم أين. انها تهجئ شيئا عليه، ولكن لا أعرف حقا ما إذا كان هناك. ولكن الآن أستطيع أن أقول أن هناك هناك على لي. والآن على مؤخرتي أستطيع أن أرى، انها تتهجأ، 'مرحبا، كنت قد اللدغة من قبل نحلة.',232,2.562154769897461,3.374918937683105,3.0141897201538086
15377,Friends,allison,4,الاصدقاء مضحكون يحبون اللعب اصدقائك هم افضل اصدقائك بغض النظر عما يقولونه,102,3.9356942176818848,3.4892048835754395,3.360743522644043
106280,Wind,allison,4,الرياح تهب، عينيّ تُغمّسُ عيونَي تُميّزُ الموجاتَ spelesen وأنا أَستمعُ لكن الصوتَ الوحيدَ الآخرُ الذي أَسْمعُه هو الريحُ,109,3.028226852416992,3.2514877319335938,3.0828397274017334
27233,My Dog,allison,4,لم يتوقف أبداً عن دفن أنفه في الثلج إنه دمي الكلب إنه سخيف لأنه لم يتوقف أبداً عن دفن أنفه في الثلج,133,2.614966869354248,3.2273285388946533,3.115962266921997
103218,My brother,allison,4,أخي يأكل أكثر مني. أخي يغني كحبل. أخي كيف يزعجني، لكن الصبي هو منقذ للحياة. إنه يقع في ورطة بدلاً مني،,260,3.2176668643951416,3.4605071544647217,3.265554904937744
103267,Just a test,allison,4,انه مجرد اختبار فقط اختبار فقط اختبار فقط مجرد اختبار اهتمام اختبار انه مجرد اختبار اختبار فقط اختبار فقط اختبار,137,2.9074926376342773,3.231548309326172,3.10420823097229
103262,Dead,allison,4,لا يمكنك أن ترى أني ميت اليوم لذا كيف أذهب إلى المدرسة اليوم. جلدي مهتز.,167,2.4699296951293945,3.4298572540283203,2.92008113861084
37301,Drinking,allison,4,أنا أشرب عصير التفاح، أنا أشرب عصير البرتقال، أنا أشرب هذا، أنا أشرب هذا أمي تفكر في التوقف عن الشرب لكنني ما زلت أشرب ولن أتوقف أبداً,182,2.729090690612793,3.705267429351807,3.4143874645233154
65398,"Roxy, Roxy",allison,4,"Roxy, Roxy, Roxy compies مع ماكر ذكي, ذكي, ذكي, ذكي يحب النوم أبدا لا يقفز أبدا... ... وقالت انها تخيف القط ما يصل مع ذلك. Roxy يحب طعامها و يعرف لا يأكل الأحذية. كلبي ذكي هي أعظم كلب في الحديقة.",224,3.481241464614868,3.374687671661377,3.321326971054077
103215,Randomness Randomness,allison,4,عشوائياً أو عشوائياً كم أنت عشوائياً. نظرتك العشوائية قد جعلتك بعيداً. لكنك سوف تذهب أبعد بكثير كما ترى. لأنه يمكنك أن تكون عشوائياً مثلي!,151,3.141146659851074,3.559810400009156,3.3671789169311523
103216,My brothers feet,allison,4,يا اقدام اخوتي يا له من شيء قبيح. يشمون وينتنون يتعفنون ويفوحون. يا اقدام اخوتي الصغار.,120,2.2496981620788574,3.782065153121948,3.105273962020874
38197,My dog,allison,4,لدي كلب، اسمه هو (جاك)، هو جاك، مع بقع على ظهره، هو يحب السير على الشواطئ الرملية، يحب طعام الكلاب والخوخ الدائري الجميل، لكن الأهم من كل شيء هو كلبي.,201,3.523805618286133,3.2788233757019043,3.302029848098755
38609,Claire,allison,4,ذات مرة كانت هناك فتاة اسمها كلير، والتي لم يكن لها شعر على الاطلاق، كانت أصلع جدا، لم تكن طويلة جدا، والدببة كانت خائفة من كلير.,141,2.5052709579467773,3.1127402782440186,2.9886953830718994
38083,A Day In Outer Space,allison,4,إذا كان لديك يوم في الفضاء الخارجي، سيكون عليك أن تتسارع، بما أن الكواكب بعيدة جداً عن بعضها البعض، سيكون عليك أن تفعل ذلك مع كل قلبك.,159,3.124366521835327,3.401203155517578,3.224945068359375
38084,Fish Rules,allison,4,إذا كان لديك سمكة هنا هي القواعد، لا تأكل السمك، أمام سمكتك، أو تواجه التهالك السمكي، وإذا واجهت التماثيل السمكية، سيكون عليك أن تقفز إلى البركة، وعندما تقفز إلى البركة، سوف تزحف السمكة عليك في كل مكان.,240,2.8544235229492188,3.334883451461792,3.231388092041016
38087,Peace,allison,4,الرياح تهب، جرو نابض صغير، يرقد من قبل قطة.,66,2.576361656188965,3.102837562561035,3.013141632080078
38610,Leaves,allison,4,أوراق الشجر تسقط، تصنع حائطاً ملوّناً ضخماً.,44,3.315869808197021,3.134852409362793,3.2370870113372803
29580,A little Lizard,allison,4,خلال العاصفة الثلجية، وجدت سحلية، التي تعتقد أنه كان ساحرا.,70,2.994572877883911,3.215053081512451,3.142084836959839
107279,Shoes,allison,4,كل شخص يرتدي أحذية مختلفة بعضها قديم وبعضها جديد وبعضها متسخ وبعضها نظيف وبعضها أزرق وبعضها أحذية خضراء تأتي بطرق مختلفة وفيها يمكننا الركض لأميال,192,3.180668354034424,3.0868077278137207,3.266851663589477
33650,A horse in my bed,allison,4,"عندما استيقظت في صباح أحد الأيام، كان الحصان واقفاً على رأسي، سألته: ""ماذا تفعل هناك؟"" فقال: ""أردت أن آتي وأتشارك سريرنا."" نظرت إلى الحصان وقلت له بالطبع ""يمكنكم أن تناموا في سريري ما دمتم لا تقفون على رأسي."" لذلك كان الحصان مستلقياً بجانبي وكان يشرب كوباً من الشاي. فقررت أن أن أنضم إليه أيضاً ولكن شربت كأسي من حذائي. وجعلنا متعبين ونائمين، مما جعلني أشعر بنوع من الفزع لعدم وجود حصان في سريري نائم بجوار رأسي!",529,3.0005972385406494,3.2844486236572266,3.161581993103028
55585,Love never  fails,allison,4,"الحب لا يفشل أبداً أبداً ليس عن طريق الهاتف ولا عن طريق البريد لذا في المرة القادمة عندما تفكيرك في """" الحب فشل """,141,3.407435655593872,3.386280536651612,3.3668720722198486
