id,title,author,grade,text,char,valence,arousal,dominance
112393,Life,amani,4,« و » اذكر « إذ » بدل من إذ قبله « يضيء عليَّ الشمس » أي الشمس « في وجهي » أي وجهي « كما يمهلني ربي » في الدنيا « شكرك ربي على إيقاظي » أي إيقاظي « إني مسرور أن أحيا » في الدنيا « وما هو خير من متشرد » منه « على واقٍ » فراش « وصابر » منه « متاعا » خمرا « شكورين » .,232,4.065752506256104,3.6508381366729736,3.277601957321167
39617,Silly slugs,amani,4,إنّها كالحشرات تماماً كلّ يوم آكله وأطلب منهم أن يأخذوا مقعداً يأكلون الملفوف كلّ يوم لا يكترثون بما يأكلونه بأيّ طريقة يأكلون فيها أيضاً أرزّاً وجرذاً قبيحاً يوماً ما أقاموا حفلة,268,2.8667266368865967,3.466148376464844,3.206526756286621
114950,soccer,amari,4,فالكرة ناعمة والرطب هو الماء والضوء يشع على الكرة.,80,3.2173051834106445,2.9673011302948,3.1636271476745605
114954,Ice cream,amarion,4,أنا بارد ويمكنك أن تأكلني. إذا أكلتني بسرعة كبيرة جداً وستصاب بتجمد في الدماغ. الآيس كريم لذيذ جداً لديه نكهات الفراولة والفانيلا والشوكولاته.,233,3.701690196990967,3.455465793609619,3.3566644191741943
115045,Get the ice cream,amarion,4,الحصول على الآيس كريم ليس بعيدا الذهاب إلى شاحنة الآيس كريم والحصول على أفضل شريط الخاص بك أي من النوع المفضل الخاص بك انها على ما يرام لا تتخلى عن على الآيس كريم انها على ما يرام.,162,3.5412757396698,3.2952895164489746,3.3462042808532715
115066,Make your ice ceram,amarion,4,تحصل على حليبك ثم تخلط الحليب ثم تسخن الحليب ثم تضيف نكهة ثم تحركه للأعلى ثم تبرده ثم تحصل على مثلجات مخروط ثم تبرد ثم تحصل على المثلجات في بطنك,211,3.331396579742432,3.128690958023072,3.274619579315185
23522,Belly,amaris,4,بطنك مضحكة أعتقد أنك ستكونين أماً,51,3.942290782928467,3.572028398513794,3.317593812942505
117882,The Stuffed Animal Dog,amaya,4,أرى أن هذا الكلب المحشو يمكن أن تراه أيضاً؟ أرى أنه ينتظرك هناك، ينتظر، بالنسبة لك أرى تلك الآذان الكبيرة المرنة، وتلك العيون الكبيرة من الكعك هل يمكنك أن تراها أيضاً؟ أراه جالساً هناك، ناعماً جداً و منفوشاً، مثل إهدار صفحات كتابك المفضل، هل يمكنك رؤيته أيضاً؟,278,3.4434776306152344,3.3295257091522217,3.183410167694092
102882,Weight and numbers,amaya,4,أنت تعلمني كيف أني حصلت على طرقي مثل الموجة المدية 1، 2، 3 العد على ركبتيك 2، 2، 4، 8 دعونا نحتفل,112,3.622969150543213,3.597348928451538,3.391254425048828
86302,I awakened with a feeling,amber,4,أنا مُمَنْعَمَل بa شَرْق الذي لَمْ يَكُنْ خافاً بشكل مفاجئ بعد شيءِ أَكلَ الريشَ في وسائدِي على الليلِ.,114,2.3336009979248047,3.3839995861053467,2.9702742099761963
35601,What is Kindness,amber,4,اللطف هو عندما تكون لطيفاً مع شخص في كل مكان تذهب إليه وتكون لطيفاً معه كل يوم يمكنك تكوين صداقات أنت لطيف مع صديق يمكنك أن تتسكع معهم كثيراً إن كنت لطيفاً,191,3.6412415504455566,3.268137693405152,3.3036482334136963
109899,The great A student,amber,4,في يوم من الأيام، كان هناك طفل لديه درجات سيئة حقاً، كان اسمه قد حاول جاهداً للحصول على درجات جيدة، لكنه لم يستطع أن يفعل ذلك في كل مرة حصل فيها على بطاقة التقرير كان يبكي لأنه كان لديه درجات سيئة وقال أمه كلما حصل على درجات سيئة كان سيعاقب لمدة سنة. وفي اليوم التالي ذهب إلى المدرسة مع أمه للنظر في درجاته لأنه كان مؤتمر معلمي الآباء وعندما نظرت أمه إلى درجاته قالت له أن (أوستن) يتركه يخرج من الخارج لدقيقة,1337,2.6863677501678467,3.224086284637451,2.9951350688934326
84653,Going     To     The    Mall,amber,4,سأذهب إلى المركز التجاري لشراء بعض الملابس للمدرسة، والحصول على زوج من الأحذية أمي وأبي وأخي وأختي ذهبت معي لأحضر الملابس، الأحذية في المركز التجاري لقد قضيت وقتاً ممتعاً مع أمي، أبي، أختي، أخي,253,3.572963237762451,3.2523787021636963,3.278536558151245
19925,&apos;&apos;Dogs&apos;&apos;,amber,4,تركض الكلاب و تركض و تنهار أخيراً,79,2.6892032623291016,3.235026359558105,2.940359354019165
19678,Nature,amber,4,في الغرب الأحمر، والبرتقالي، والبرتقالي، والأصفر، والأخضر، والأزرق، والأزرق، والأرجانيات التي تختبئ خلف الأفق,91,3.0474181175231934,2.971730709075928,3.0977213382720947
31891,Amber,amber,4,اسمي (آمبر)، لستُ تاجاً، أعيش في مدينة، وعبوسي يرتفع وينخفض، اسمي (آمبر)، أتجول في المدينة.,121,2.9066975116729736,2.9870288372039795,3.1013357639312744
14189,Rose of Ozarks,amber,4,........................................ .....................................................................................................................................................................................................................................................................................................................................................................................................................,94,3.737227916717529,3.496410369873047,3.277238607406616
45053,Alexis,amber,4,ذات مرة كانت هناك فتاة تدعى (أليكسيس) جاءت من ولاية (تكساس) أرادت كلباً,139,2.628100872039795,3.2276320457458496,3.098475694656372
35490,My Love,amber,4,حبّي، حبّي، أعطِ عناقَي سوية نَشتركُ في a كأس نحن لَنْ نَستسلمَ أبداً. دعنا نَحْزرُ مَنْ الحبّ يُمْكِنُ أَنْ يَكُونَ أنت لَنْ تَعْرفَ أبداً لَكنَّه سَيَظْهرُ.,150,4.28943395614624,3.950082778930664,3.394339084625244
18599,Flower,amber,4,طويل، جذر، جذر، جذر، أوراق أوراق، خضراء، زرقاء، ريغو، مشرقة، مشرقة، بتلات، بورفورمر، اللقاح، الفراشات، الأرجواني، الأحمر، الجميل، الملون، ذو الرائحة,120,3.448582172393799,3.214485645294189,3.2112820148468018
28967,Blue Flu,amber,4,أزرق، أزرق، أزرق، يجب أن أنحني، أزرق، أزرق، أزرق، أزرق، أعتقد أني حصلت على الانفلونزا الزرقاء!!!!!!!!!!!!!!!!!!!!!!!!!!!!!!!!!!!!!!!!!!!!!!!,88,2.7232320308685303,3.605625629425049,3.163582563400269
26352,Chocolate,amber,4,ناعمة وكريمة وحلبية وذائبة في فمك الشوكولاتة، السميكة، لذيذة تجعلني أسترخي,89,4.075820446014404,3.696830034255981,3.36829161643982
100193,If i was a dog...,amber,4,لو كنتُ كلباً، أودّ أن أهتزّ، كنتُ لأتسوّق حتّى أسقطتُ و لا أستيقظ حتّى أحصل على المكياج، وهذه نهاية قصّتي.,139,2.8205363750457764,3.1739442348480225,3.1451478004455566
100354,Mrs.p,amber,4,الآن علينا أن نحصل على معلمة جديدة آمل أن نستعيدها آمل أن ننال منها الآن,171,3.5009407997131348,3.4496216773986816,3.223596811294556
30605,I remember,amber,4,"""أتذكر جدتي وابتسامتها"" ""أتذكر موتها""",81,2.663985013961792,3.4213600158691406,3.02347469329834
111690,Asleep in Bed,amber,4,عندما سقطت على رأسك كنت نائماً في السرير، كنت نائماً لم يكن هناك أي شيء، كنت أشعر بالحزن عندما لم يكن هناك أحد في الجوار، كنت سعيداً ولكن الآن أنا سريع، كنت تبدو رائعاً حتى لعابك، أنت مجنون، ولكن أكثر كسول الآن يجب أن أذهب لأن عائلتي في صف دودة، كان من اللطيف أن ألتقي بك لذا الآن أنت صديقي (سو) القديم,353,3.0998644828796387,3.360294342041016,3.1362361907958984
52192,Thanksgiving,amber,4,شكرًا للثلج هذا العام الذي يأكل الديك الرومي، المرق، تحطّم، تحطّم الإسكواش، أنا لا أُخبرُ a يَكْذبُ توت توت صلصةً على نخبِي أوه! أنا لا أَستطيعُ الإنتِظار!,209,4.160818576812744,3.8234453201293945,3.449101209640503
68550,why,amber,4,لماذا تسأل لماذا؟ لماذا؟ لماذا؟ لماذا؟ لماذا؟ لماذا؟ هل تحب أن تقول لماذا؟ لماذا؟ لماذا؟,79,2.651209831237793,3.198979139328003,3.062718152999878
111684,My Cat,amber,4,لدي قطة، قطتي أحبت قبعتي، قطتي جلست قطتي، قطتي لم تكن تحب مضربي، قطتي وجدت فأراً، ثم وجد ناتاً، كان يضعه تحت السجاد، كان سميناً جداً،,341,2.858050346374512,3.143521308898926,3.1308226585388184
50644,Egg Race,amber,4,لقد قمت بسباق حملت بيضة على ملعقة لا أعرف ماذا أفعل صديقي قال نظرة هل رأيت ذلك الطائر؟,265,2.9325671195983887,3.260317325592041,3.123543262481689
36844,Walking with my Heart.,amber,4,أنا أقدر قلبي بكل قلبي وأحبه أيضاً و هذا من أعماق قلبي,100,4.303191184997559,3.6836283206939697,3.313007116317749
89697,Mommy,amber,4,أمي، لقد إعتنيتِ بي طوال هذه السنوات، إعتنيتِ بي من خلال بكائي و دموعي، بقيتِ مستيقظة معي في وقت متأخر من الليل، لأنني راودني كابوس، كان مخيفاً، هذه هي الطريقة التي أقول بها شكراً لكِ في عيد ميلادكِ,236,3.805884599685669,3.6144261360168457,3.192084550857544
45483,Mean Jean,amber,4,"لقد صرختُ في (جان)، أنتِ لئيمة! لقد أخبرتني، لقد بدوتُ مثل نحلة سمينة، وصرختُ إلى الخلف ""تبدو مثل العم (ماك)!"" ""أوه حسناً،"" قالت، ""أنا ذاهب إلى الفراش."" نحن لا نهتم، ربما يجب أن تركبي فرساً، لا، (روبن)، أنتِ تعلمين أنني لن أقول ذلك مجدداً، لا تقولي، حسناً قلتُ ""أرنم لحناً""",474,2.3987607955932617,3.7903146743774414,3.234891891479492
21870,The day of Winter,amber,4,في يوم الشتاء خرجت لألعب في الثلج لكن بعدها سقطت في حفرة كبيرة مسطحة بدأت أضحك ثم كنت بارداً و عدت لأتناول كأساً من الشوكولاتة,167,3.326777458190918,3.4054017066955566,3.185320377349853
21872,Friendship,amber,4,مَنْ يَهتمُّ به، هو أَو هي، هو دائماً عادلُ، ناس، صداقة!,173,3.6682448387146,3.5266354084014893,3.3782718181610107
63417,Denists,amber,4,ذات مرة كانت هناك فتاة إسمها لامعة، كان لديها الكثير من التجويف، كان لديها شفقة على أسنانها، فوق أعلى وتحتها، ثم أصبحت هادئة، الآن يمكنك أن ترى، أنها مثلي. هل تعرف من أنا؟ أنا خروف نتن.,228,2.9933295249938965,3.231215715408325,3.1269984245300293
45842,Me,amber,4,الآن لا تريني في كل مكان؟ الآن لا تريني. أراك وكذلك أنت. نرى بعضنا البعض في كل مكان ونحن نفترق.,139,3.20353364944458,3.3069751262664795,3.262800693511963
30850,Sadness,amber,4,مات عمي وذهب إلى السماء. أعتقد أن الموت هو أسوأ شيء على الأرض. كان وقت حزن بالنسبة لي. كان قاسياً ومحزناً بالنسبة لي.,139,2.2175493240356445,3.3022055625915527,2.893904447555542
29705,Violet,amber,4,الورود حمراء البنفسج زرقاء أنا أحب البنفسج، ماذا عنك؟,62,3.343524217605591,3.07105016708374,3.202920436859131
72539,windblows,amber,4,والرياح الباردة التي تضرب شعري وهي تدفعني وتلتقطني وتطير بعيداً لا تعود أبداً إلى الوطن.,94,2.287601947784424,3.4315061569213867,2.803133726119995
87330,Mark the Shark,amber,4,لدي قرش اسمه هو علامة يحب أن يذهب إلى الحديقة في يوم من الأيام ذهبنا رأينا سمكة قرش نباح اسمه كان لارك,224,3.2401883602142334,3.177119255065918,3.181368827819824
54164,JELLY BEANS,amber/dustin,4,يمكن أن تكون الفاصوليا لذيذة البعض يمكن أن تكون سيئة مثل تلك التي يمكن أن تشتري ذلك الطعم مثل speghetti، الصابون وحتى المخاط أنها تأتي في أشكال متحولة، أحجام أيضا ألوان مثل الارجوانية الصفراء والبرتقالية. أساسا أي لون يمكنك أن تفكر حتى في البولكا dotted منها.,257,3.149161100387573,3.117211103439331,3.2214152812957764
67043,Green Ginourmus Frog,amelia,4,على الوسائد التي تقفز في البركة تتدفق في المنزل ينتظر أن تخبز أمه كعكة,92,3.165393829345703,3.042074680328369,3.180954694747925
120839,Mine all Mine,amelia,4,يداي هي سمة خاصة بي. هما أنا وهم، مقدر لنا أن نكون. يساعدانني على لبس ملابسي، ويغسلان شعري. يفعلون ذلك بدون أي اهتمام. يمكنهم مساعدتك في الحصول على عمل، وعندما أنتهي,335,3.980189800262451,3.726422309875488,3.404650926589966
107292,Babies,amelia,4,العديد من الولادات تحدث على الأرض كل يوم. الأطفال لطفاء، حلوّون ومضحكون يبدون مثل الأرانب الصغيرة. على الرغم من أنهم يركلون، يصرخون ويبكون حبّي للرضع لن يموتوا أبداً.,186,4.128500938415527,3.780047655105591,3.3543477058410645
54188,The,amelia,4,أنا أحب هذه الكلمة!,23,4.582198619842529,3.922915935516357,3.44671368598938
22747,Dance,amelia,4,يرقصون حول الغرفة يضحكون، يضحكون، يركضون يرقصون حول الغرفة، يقفزون، يقفزون يرقصون حول الغرفة يقفزون، يقفزون،,202,4.036740303039551,3.861063957214356,3.2436978816986084
22754,Christmas,amelia,4,عيد الميلاد سعيد جداً وممتع عندما يكون المنزل مليئاً بـ(هولي),68,4.235177993774414,3.5960261821746826,3.3188908100128174
110541,Out of School,america,4,أَنْ أَكُونُ أَبْقى للمُرَرَرَرَكَة ذلك المُسْتَعْوِلَة المُعَوَّلة على الحلقةِ الدائريةِ تَأْكلُ بَعْض الشوربةِ لتَمْرير البعضِ مِنْزِلِ قبيحِ,139,2.4203410148620605,3.169850349426269,2.9377129077911377
110503,Feelings,america,4,السعادة صفراء ساطعة، رائحتها مثل وردة حمراء، أطعم مثل لحم الخنزير المقدد، تبدو وكأنها طفل يضحك، تبدو وكأنها جلد أطفال!,140,4.098264217376709,3.894003391265869,3.3854568004608154
110514,Ann,america,4,كانت هناك فتاة اسمها آن عاشت في شاحنة بيضاء كانت مليئة بالحمقى لم تستطع فتحها,164,2.563612461090088,3.3345654010772705,3.075584888458252
117065,One Morning,amerie,4,"عندما استيقظت في صباح أحد الأيام، كنت أسبح في حوض سباحة مع بامبونز. سألت، ماذا تفعل هنا؟ وقالت: ""أريد أن أهدأ أيضاً، ماذا عنك؟",160,3.064124584197998,3.229712009429932,3.1272051334381104
18590,Rainy Days,aminata,4,اليوم هو ممطر اليوم هو محزن أن المدفئات لا تعمل وأنا غاضب جدا اليوم أنا ذاهب إلى التجميد ووصية نظرائي عطست الأشجار,213,2.337231397628784,3.3814496994018555,2.972174882888794
19255,A Stork and His Ice,amitai,4,أعرف ستوركاً قال شيئاً لطيفاً قال أنه يحب الثلج المقطوع حقاً قال أنه يحبه بالتوابل والشرائح و النرد قال أنه يحبه على الستيكس في السادسة على قيد الحياة في الخامسة و أكثر و أكثر في الرابعة,203,3.4926564693450928,3.203120708465576,3.278132200241089
15632,I Lost My Duck,amuelsay,4,كنت جالساً في مكان ما عندما أطلقت النار على بطة، كانت مبطنة، وهي مبطنة، بينما سقطت سقطت، أطلقت عليها النار في الهواء، وسقطت على دب، راهنت على دولار،,257,2.854687690734864,3.2547760009765625,3.1602137088775635
47685,Hamsters,amy,4,والهامسترز لطيف جداً وناعم جداً ويلعبون معك عندما يملّون من جعلهم لا يملّون هو أنّه من الممتع أنّ الشمس تلمع والهامستر متيقظون,284,3.8844590187072754,3.5566422939300537,3.3469698429107666
100744,I love you,amy,4,أنت تجعلني أضحك أنت تجعلني أبكي أنا سوف أحبك دائماً,59,4.343329429626465,3.879523277282715,3.40591049194336
47356,Where Is My Homework?,amy,4,لم أكن أعرف أني نظرت في فم كلابي ونظرت في الثلج، نظرت في حوض أسماكي لم يكن هناك، نظرت في درجي لكن درجي كان عارياً، نظرت في حمامي و...,274,2.649024724960327,3.1625866889953613,2.9746105670928955
28041,The Race of Time,amy,4,كل ثلاثة أذرع تركض في سباق كل خطوة هو متر كل رقم هو كيلو متر أتساءل كم من الوقت سيستغرق؟ ساعة واحدة أو ثانية واحدة أتساءل أي واحد سيفوز إذا انتهى الوقت؟,191,2.782348155975342,3.3242673873901367,2.99106240272522
84379,Birds,amy,4,تطير طيور من فوق السماء وتصرخ عندما امر. ولكن عندما اصعد شجرا تروق لي بشكل مشبوه.,111,2.9374589920043945,3.208939790725708,3.111140489578247
38420,Practice test,amy,4,"آمل أن تكون أمي في مزاج جيد، وآمل أن يكون لديها الموقف الصحيح. في اختبار الممارسة في الصباح، من فضلك لا تقول أنه سيكون مملا. عندما تعود، سوف أسأل، ""كيف فعلت؟"" أتمنى أن تقول، ""لقد حظيت بيوم عظيم"" عندما تحصل على النتائج سوف أتصرف كبالغة، آملة أن تحصل على ""أ+!""",325,3.511253833770752,3.476648330688477,3.3107426166534424
25318,Puddles,amy,4,تغوص، تقفز، تقفز وتقفز وتصنع رشة من الفوضى.,97,2.551581859588623,3.14044189453125,3.0159080028533936
40630,The Silly Cat,amy,4,القطة كانت ناعمة و منفوشة. كانت تجلس على مضرب مع بعوضة على جرذ. الخفاش كان خشباً مثل قلم رصاص. كان قليلاً من النخاع كالتشيلو. يمكن أن ينكسر بسهولة مثل الجيلو.,173,3.2553231716156006,3.0183591842651367,3.184948444366455
59850,The vet,amy,4,(بوكي) لديه طبيب بيطري (بولكي) الطبيب البيطري هو دمية بيطري (بوكي) طبيب بيطري مبلل,63,2.8426764011383057,3.024330139160156,3.100788116455078
103705,Ted the mouse,amy,4,"عندما استيقظت في صباح أحد الأيام، كان فأراً على رأسي، سألته: ""ماذا تفعل هناك؟""؟ نظر إلي وقال... ""أنا أبحث عن منزل وكان يجب أن أجلس على رأسك"""". ""لا لا لا لا لا"" قلت وساقلت من سريري للتحدث إلى العم تيد. ""فإن فأراً على رأسك!""",531,2.9186832904815674,3.785365104675293,3.1468939781188965
55130,Peach,amy,4,الخوخ يريد ان يأكل شعير ولكن بعد ذلك يكره ان يأكل شعير لذا اكل اخيه. لم يزعج نفسه.,128,2.4858880043029785,3.0899100303649902,3.0672316551208496
32916,The Black Death,amy,4,تتدفق المجاري في وسط الطرق وتجذب الجرذان ومؤخرات الجرذان تحمل مجموعات من البراغيث التي لها مرض يقتلك. بعد موتك تصير اسود.,199,2.322124719619751,3.248729705810547,3.0211987495422363
29713,My Dog,amy,4,كلبي سخيف جداً، إنها تعوي طوال الوقت أحياناً أتمنى لو كانت العواء جريمة,85,2.414183616638184,3.366079568862915,3.0444955825805664
38668,Kate&apos;s Kangaroo,amy,4,كنغر كيت يذهب، إلى الطاحونة. لقتل الكبير الكبير، كبير السن، landy lill. kate يجد landy lill، أسفل الطاحونة. للعثور على من كنغرها، ذهب لقتل. landy lill يرقد هناك، اضطر إلى المعاناة. كانغرو كيت كان، لم يكن مسموحاً أبداً للأذية.,242,2.351571559906006,3.280169010162353,3.0312440395355225
25453,Roses,amy,4,كانت هناك وردة لا تزهر، كانت أفظع وردة في الغرفة، ذات يوم استيقظت وكسرت نكتة ثم قررت أن تزهر.,143,2.583634853363037,3.339848518371582,3.079774141311645
116338,Good bye butterfly,amy colle,4,ألتفت للنظر. ذاكرة! أبقوا لا يُبهت كل حياتي بالنسبة لي تلك الصورة مع سمتها اللامع من العوامة والوج الوجه الوهمي، التي نظرت إلى الوراء على طول السياج، حيث، ترتفع أعلى، تطفو في ذلك الحين، شيء رائع من يوم الصيف سحر ابني في طريقه. من زهرة إلى أزهار خطواته التي قادتها، انتظر لحظة، ثم هربت؛,456,3.496559858322144,3.53794527053833,3.2044332027435303
64666,Blue,amysue,4,لماذا تبدين زرقاء جداً؟ لون السماء مثل الرجل العادي. لون الماء نقي ونظيف جداً، التمهيدي للّون فوق الخطط. الأكثر روعة لأن هذا هو لونك. لماذا أنت حزينة جداً، عندما يجب أن تكوني سعيدة!,258,3.661482810974121,3.578144073486328,3.280404806137085
21590,My Kitten,ana,4,إنها تعتقد أنها تملك العالم. إنها سعيدة وسخيفة وفخورة بقدر الإمكان. من الواضح أن لا أحد يستطيع أن يرى. من المحزن أن قطتي مغرورة جدا. لأنها في الحقيقة سهلة جداً!,260,3.435464859008789,3.531151533126831,3.2604682445526123
90693,Bye-Bye,ana,4,أمي طلبت مني أن أقول وداعاً لذا قلت وداعاً إلى عين ثور وأعطيته راحة من الخبز وحصلت على سرير,146,2.8583130836486816,3.1763834953308105,3.1128904819488525
21626,Leaves,ana,4,بعض الألوان لها الكثير من الألوان مثل شعر أخي. تسقط. تسقط. تسقط مثل الطائرات التي تصنع دوائر في السيرك. كبيرة. بعضها كبيرة ولها شكل مثل الخنزير. الأشجار. أوراق تجعل الأشجار جميلة، تخيلها تصلي. في النهاية، خضراء كالنظيفة.,292,3.3117620944976807,3.0809106826782227,3.208268880844116
92046,Stronger than.,ana,4,أنت أقوى من أقوى رجل أقوى من أقوى رياح أقوى من رجال النار أقوى من ثلاثة أسد رجال أقوى من ثمانية رجال أقوى من أربعين كرة سلة,311,3.5451536178588867,3.60147762298584,3.35973858833313
108649,Princess,ana,4,من سحر وحيد القرن الذي تصنعه الأميرة تاجها من الزهرة رائحة الأميرة تصنع فستانها لا عجب أننا نعتقد أنهم مخلوقات عظيمة,335,3.6247153282165527,3.4206972122192383,3.2620270252227783
49588,Ansaar,anab,4,أنسار يضرب رأسه في السرير بينما يحاول أن يمزق قلبه أعلم أنه ذكي لكنه لا يستخدمه أبداً,201,2.4864392280578613,3.9507012367248535,3.249037504196167
41608,Water,anabel,4,ماء، الماء سخيف، مثل بيلي الكبير الكبير، الماء في البركة.,81,2.9287803173065186,3.10007905960083,3.1347219944000244
