id,title,author,grade,text,char,valence,arousal,dominance
52823,True Love,bethany,6,إنه أمر غريب، كيف نبحث عن حياتنا من أجل الحب، كما لو كان هدفنا الوحيد في الحياة. ولكن عندما ينتهي الحب أخيراً على عتبة بابك، نحن نعيده وحده ليس كافياً لك أمامي، الحب الحلو، وأعتقد أنني لا يفترض بي أن أتخلى عن كل شيء من أجلك؟ أليس من المفترض أن أتخلى عن كل حلم، كل أمل، كل شيء أحبه، بالنسبة لك؟ أليس من المفترض أن نمتلك بعض الأراضي وأن ننجب أطفالاً,559,3.446434497833252,3.635547637939453,3.2277214527130127
47304,Sugar Rush,bethany,6,الإثارة في الكوابيس، الشوكولاتة النافعة، ليس فقط في الحديقة فقط الحلوى السكرية المغلفة التي طعمها مثل السماء، والشوكولاتة الملتف في كل مكان مع الحاجة إلى سرعة,414,3.876543045043945,3.696855545043945,3.376338243484497
27675,MY DOG,bethany,6,"اسم كلبي هو توزى، وهو صغير جداً ومزعج جداً طوال اليوم ويغني أغنيته المفضلة التي يعزفها ويلعبها، ولا أهتم طالما أنه يريد أن يجعل كل أصدقائي أمثاله يقومون بتوريط كل أصدقائي مثله كثيراً في كل مرة هنا يتصرّفون على هذا النحو. كل فجأة هو في الطين ""لا، لا تزيه"" في الحوض. أحياناً يكون سيئاً وأنا أغضب ولكن....",442,3.6132524013519287,3.5303094387054443,3.3167521953582764
53117,"Heather, O, Heather",bethany,6,(هيثر)، كم أفتقدك، أتمنى لو أستطيع رؤيتك، ولا أتركك أبداً، أنت أعز أصدقائي، والحب سيعيش معنا دائماً!,147,3.9114818572998047,3.8125112056732178,3.321890354156494
53098,My Sister,bethany,6,أختي أفضل صديق لي، ونحن نركض معاً في الرياح، بينما نحن نركض نتحدث مثل الأصدقاء، أحب أختي، أستطيع التحدث معها، على الرغم من أنها أصغر مني،,207,4.034730911254883,3.701629877090454,3.390531301498413
100155,Stuck,bethany,6,أنا عالقة في الزاوية في قوقعتي الصغيرة التي لا يمكن كسرها. أنا عالقة داخل نفسي ونادراً ما تظهر. أحياناً أنزلق، ومشاعري تُرى,403,3.013878583908081,3.4848709106445312,3.110502481460572
72175,Creek,betina,6,تُشكلت أحجار مدورة,95,3.0295557975769043,2.925436496734619,3.136741876602173
102510,The Cat,beto,6,عندما استيقظت ذات يوم ذات يوم كان هناك قطة على ظهري,68,2.8493659496307373,3.1603736877441406,3.0642240047454834
23222,My Room,bevin,6,غرفتي حارة، غرفتي باردة حفرت حفرة، وجدت وعاء كامل من الذهب غرفتي نظيفة لهذا أنا أعيش حياة الملك.,138,3.872579574584961,3.587601661682129,3.4401204586029053
23051,My Room,bevin,6,غرفتى حاره غرفتى بارده لقد حفرت حفرة لقد وجدت الكثير من الذهب غرفتى نظيفه انها الجنه لان الاطفال ينادوننى بالسماء السابعه,150,4.158265590667725,3.811589479446411,3.420696258544922
33284,My freind bob,bharath,6,"""أُحِقُ بِأُحَقُ أحَقُ أحَقُ أُسَ اسمي هو ""بوب أنا لا أَحْبُّ جيلو هذا يَجْعلُني مُتَعَبِّبَة لَرُبَّمَا مجنونَ لَرُرُبَّمَا لكن ماذا أنت أنا لَرُبَّمَا أَكُلُّ فَأَنْ كُلِّي اسمكَ لذا تَعْرفُني مثل أَخّ أنا لَنْ أُشوَفَ المزيدَ",188,2.8479127883911133,3.128955364227295,3.105843544006348
52712,Boys and girls club,bia,6,الأطفال يلعبون يلعبون ويلعبون حتى يتعبون أو حتى يكون هناك آباء,119,3.19392991065979,3.053304672241211,3.211881399154663
32440,The bightly colored flowers,bianca,6,« أولئك » أي أهل مكة « مثل » صفة « السماء » أي مثل « الليل » أي مثل السماء « كل » منها « أصفر » أي أصفر « تريدون أن تقولوا تحية » حال « ولكن تعلمون أنهم لا يردُّون » يردُّون « فيخرجون » عن الإيمان .,162,3.570070266723633,3.464808940887451,3.1445114612579346
16128,This Butterfly Is For Me,bianca,6,هذه الفراشة بالنسبة لي إنها تتجول في الأرجاء مثلي تماماً كما تذهب بعيداً عني أتمنى لو أستطيع الذهاب معها للطيران بعيداً بينما تتجول بحرية أشعر وكأنني أستطيع الهروب معها,465,2.773468494415283,3.478074073791504,3.0836174488067627
42540,Teachers,bianca,6,معلّم يُدرّس صباح أمس على نسيم مشمس و دافئ معلّم يساعد في يوم ريح بارد جدا مع بباضات في سباق رياضي جدا بينما يعلّم أطفال ألف أو أكثر,208,3.321892499923706,3.187284708023072,3.234619617462158
24863,SPORTS,bianca,6,هل سبق لك أن لعبت نوعاً من الألعاب مثل: كرة القدم، كرة السلة، كرة السلة، التنس، كرة القاعدة، كرة الطائرة؟ هناك أكثر من ذلك بكثير ولكن سيستغرق مني وقتاً طويلاً لأبتعد عن قدميك و ألعب بعض الألعاب الرياضية التي ستستمتع بها.,236,4.013107299804688,3.741956233978272,3.4376702308654785
103345,Sky and Grass (Diamate poem),bianca,6,السماء، والمشرق، والأزرق، والأزرق، والضوء، والضوء، والأزرق، والازرق، والأزرق، والأزرق، والأزرق، والاسترخاء، والحاد، والميسر، والخضرة، والأخضر، والطول،,124,3.497392416000366,3.187709093093872,3.210820436477661
85118,Christmas,bianca,6,هل تشعرون بأن عيد الميلاد قادم؟ إنه وقت العطاء والمشاركة الجميع مشغول بتغليف الهدايا بغض النظر عن مقدار الهدية,235,3.9749696254730233,3.559037685394287,3.326718807220459
77472,Kittens,big bertha,6,القطط لطيفة جداً، إنها لطيفة وودية جداً، نحن نحبها كثيراً!,76,4.499162197113037,3.782325744628906,3.35966157913208
31547,Last Day Of School,bigd,6,إنه آخر يوم، يمكنني أن أصرخ على غيرهم هناك، وأنا هنا، نحن لا نذهب إلى المدرسة، لذا سألعب في البركة,139,2.9598617553710938,3.3832225799560547,3.1622331142425537
90597,Cheese,bill,6,هناك كل أنواع الجبن، المفضل لدي هو الجبن المضغوط! على البسكويت، الخبز، أو حتى بحد ذاته، الجبن هو أفضل جبنة يمكنك الحصول عليها!,156,3.8807199001312256,3.675946712493897,3.433814287185669
18540,Kids,bill,6,1 خ م، 1 خ م، 1 خ م،,34,3.198262453079224,3.011561393737793,3.2000436782836914
15042,Me,bill,6,إن أنفي متفحّص، عيوني خضراء، أسناني بيضاء ورأسي بيضة رقبتي قصيرة، رقبتي قصيرة صدري,180,3.2568633556365967,3.280350923538208,3.2625081539154053
15048,Me,bill,6,إنّ أنفي ماثِلُ أن عينيّ خضراوان... ... رأسيصنعليحلمذراعيّ... ... يُذكّرُني بالمضربِ... ... وأنا أَعْرفُبعضالحقائقِ رقبتي طويلةُ صدري... ...,199,3.0168685913085938,3.225749015808105,3.146268606185913
99774,rose and vilots are sweet,billie,6,الورود حمراء و سكر أزرق حلو و كذلك أنت,63,3.340841770172119,3.0526158809661865,3.2274529933929443
24439,Legolas,billy,6,« ما يجعله حبا » حبا « له ما له من » أي ما له من شيء خلقه من شيء خلقه من شيء خلقه من شيء خلقًا لا له من شيء خلقه من شيء خلقه من شيء خلقًا خلقًا عظيمًا لا خلقه ولا خلق خلقه وخلقه وخلقه وخلقه لا خلقه وخلقه وخلقه وخلقه وخلقه وخلقه وخلقه وخلقه وخلقه وخلقه وخلقه وخلقه وخلقه وخلقه وخلقه وخلقه وخلقه وخلقه وخلقه وخلقه وما خلقه وخلقه وخلقه وخلقه وخلقه وخلقه وخلقه وخلقه وخلقه وخلقه وخلقه وخلقه وخلقه وخلقه وخلقه وخلقه وخلقه وخلقه وخلقه وخلقه وخلقه وخلقه وخلقه وخلقه وخلقه وخلقه وخلقه وخلقه وخلقه وما خلقه وخلقه وخلقه وخلقه وخلقه وخلقه وخلقه وخلقه وما خلقه وخلقه وخلقه وخلقه وخلقه وخلقه وخلق ، وخلقه وخلقه وخلقه وخلقه وخلقه وخلقه وخلقه وخلقه وخلقه وخلقه وخلقه وخلقه وخلق ، وخلق ، وخلق ، وخلق ، وخلق ، وخلق وخلق وخلق ، وخلق ، وخلق ، وخلق ، وخلق وخلق وخلق وخلق ، وخلق وخلق ، وخلق ، وخلق وخلق ، وخلق ، وخلق ، وخلق ، وخلق ، وخلق ، وخلق ، وخلق وخلق وخلق وخلق وخلق وخلق وخلق وخلق وخلق وخلق ، وخلق ، وخلق ، وخلق ، وخلق وخلق وخلق وخلق وخلق وخلق وخلق وخلق وخلق وخلق وخلق وخلق ، وخلق ، وخلق وخلق وخلق وخلق وخلق وخلق وخلق هو وخلق هو وخلق وخلق وخلق وخلق وخلق هو وخلق وخلق وخلق وخلق وخلق وخلق وخلق وخلق وخلق هو وخلق هو وخلق هو وخلق هو وخلق هو وخلق هو وخلق وخلق وخلق وخلق وخلق وخلق وخلق وخلق وخلق وخلق وخلق هو وخلق وخلق وخلق وخلق وخلق وخلق وخلق وخلق وخلق وخلق وخلق وخلق هو وخلق هو وخلق وخلق وخلق وخلق هو وخلق هو وخلق وخلق وخلق وخلق وخلق وخلق وخلق وخلق وخلق وخلق هو وخلق وخلق وخلق وخلق وخلق وخلق وخلق وخلق وخلق وخلق وخلق وخلق وخلق وخلق وخلق وخلق وخلق وخلق وخلق وخلق وخلق وخلق وخلق وخلق وخلق وخلق وخلق هو قد قد قد قد قد قد قد قد قد قد قد قد قد قد قد قد قد قد قد قد قد قد قد قد قد قد قد قد قد قد قد قد قد قد قد قد قد قد قد قد قد قد قد قد قد قد قد قد قد قد قد قد قد قد خلق وخلق وخلق وخلق وخلق وخلق وخلق وخلق وخلق وخلق وخلق وخلق وخلق وخلق وخلق وخلق وخلق وخلق وخلق وخلق وخلق وخلق وخلق وخلق وخلق وخلق وخلق وخلق وخلق وخلق وخلق وخلق وخلق وخلق وخلق وخلق وخلق وخلق وخلق وخلق وخلق وخلق وخلق وخلق وخلق وخلق,82,3.1405062675476074,3.194045066833496,3.1901631355285645
108246,Bi-Planes And Jets,billy,6,الطائرات مثل الطائرات النفاثة، كلاهما سريع، أحب الطائرات النفاثة والطائرات.,70,3.4179415702819824,3.173905849456787,3.2080347537994385
83322,yo mama,billy,6,رأيتُكِ أمّاً على اللاما في (بوهاما) في ثوب سباحة بينما كانت تُشوّي (ويني),82,3.0538313388824463,3.1257858276367188,3.1758391857147217
26158,I wish...my dog,billy,6,أتمنى لو كان لدي كلب يستطيع التحدث، كلب لا يحتاج إلى مشي واحد، كلب مع أكبر أفواه كبيرة، الذي لا يمكن أن يكون أكثر سعادة، أعلم أنه سيحبني كثيراً،,437,3.811243534088135,3.720242500305176,3.337646245956421
103698,Jellybeans,billy,6,من الممتع أن يأكلوا عندما يقفزون ويطيرون,84,3.574441909790039,3.3092682361602783,3.2901408672332764
15621,I am Content,billy,6,الموجات الرعدية تضرب ضدي، الأختام الأنيقة تسبح من قبلي. النوارس البحرية العاجزة التي تسرق الغداء، طلاءي يتقشر لأنني كبير جداً في السن.,261,2.83888578414917,3.2826223373413086,3.065083742141724
18900,Sports,billy,6,كرة القدم: التصدي، والتهرب، والمرور، والرجم، والخوذ، والخنازير. الهوكي؛ التزلج على الجليد، والتدقيق، والعقوبات، والعصا، والعصا، ومرمى الهدف. بيسبول؛ الكرة، والمضرب، والقفاز، والقفاز، والقبعة، والبريق، والصيد، والإنقاذ، والألعاب الرياضية، والتسلية، والخير للقلب!,308,3.4727091789245605,3.3581223487854004,3.298178434371948
37054,Funny School,birdget,6,مدرستي هي دب لأنها تعرف كيف تفزع. نحصل على حلويات للغداء، وواجبنا المدرسي نمضغ. مدرستي مضحكة جداً، لأن المدير أرنب.,219,3.609252452850342,3.4082465171813965,3.253821611404419
105118,Humdy dumdy,blade,6,واضافت على شجرة أن نحلة لدغته في الركبة وسقط سقط سقط أسفل ضرب رأسه وظن أن اسمه كان مسطوراً,114,2.402418851852417,3.2050933837890625,2.893309593200684
108217,MY Life,blaine,6,حياتي تذكرني بالصيد. ذراعي هي قاع المسدس لأن ساقي في قاع جسدي. حياتي هي غزال يمر به كل يوم. حياتي سمكة تسبح في كل مكان وأنا أيضا أفعل الكثير من الأشياء له.,224,3.1760687828063965,3.220289707183838,3.2253358364105225
50915,POEM 1,blaine,6,مرحباً كيف حالك؟ لقد كنت نائماً هناك ماذا تفعلين هناك في الأعلى كنت فقط أنظر حولك,141,2.919854164123535,3.0844602584838867,2.94238543510437
35996,Someone Special,blaine,6,هناك شخص مميز أعشقه شخص مميز عند الباب شخص مميز جميل و طويل شخص مميز في المركز التجاري شخص مميز ذو شعر أشقر,259,4.059611797332764,3.799591064453125,3.4303553104400635
64050,Independence Day,"blaine, breean, sara",6,"ثلاثة عشر مستعمرة تحكمها بريطانيا أرسل الملك جورج جنوداً ليفرضوا عليها ضرائب. لقد ظن المستعمرون أن ذلك غير عادل، ولكن القليل لم يعرفوا أن الحرب ستبدأ قريباً. بعض المتمردين شكلوا مجموعة، لجنة تسمى قريباً الوطنيين. كتبوا إعلاناً، منحهم الاستقلال. جمعوا التواقيع، وأرسلوها إلى الملك. الملك جورج أرسل بعض القوات؛ لم يكن سيأخذ هذا. قاد جورج واشنطن المستعمرين، قاتلوا طويلاً وبشدة. ثم انتهت الحرب، وفازوا، وحصلوا على الاستقلال؛ وقد بدأت أمريكا. كانوا يحتفلون بالثامن، والآن نحتفل بالرابع. نحن نأكل النقانق، والبرغر، والذرة، ونسبح، ونتحدث ونتذكر ما حدث من قبل. نشاهد الألعاب النارية، وكلنا نقول ""واووووو"" بينما نشكر آبائنا، على الحرية التي لدينا الآن.",802,3.303072929382324,3.3203060626983643,3.294839143753052
91745,Candy,blair,6,الحلوى حلوة و لذيذة بالنسبة لي أحب الحلوى إنها رائعة و عظيمة حلوى القرفة هي نوعي المفضل لدي شيء لأعترف به أحب الحلويات,195,4.389354228973389,3.759474277496338,3.4216198921203613
95975,Teachers,blair,6,معلمييي يُعلّمُني أَتعلّمُ الكثير من معلوماتِ دماغي يَضْخُّ,57,2.493826389312744,3.135679006576538,2.9838695526123047
95280,Fall is Here,blaire,6,كل شيء ملوّن ومشرق مع اللّون الأرض حمراء وبرتقالية وبنيّة. إنّه أفضل وقت لصنع حبّات الورق. بينما أقود في جميع أنحاء المدينة أرى كلّ شيء كان في ياردات في الشارع وفي كلّ مكان لإنقاذ العشب للاستعداد للشتاء.,299,3.5472750663757324,3.317660331726074,3.284982442855835
94493,Allison,blaire,6,لشعرها البني القصير الذي يتم مدسوسته دائماً أن تؤخر أذنيها. كؤوسها تمسك شعرها للخلف. هي صغيرة وتحب أن تتسكع مع أصدقائها. لا تفعل شيئاً بدون أصدقائها بجانبها. لا يمكن أن تكون بدون أحد أصدقائها.,254,3.14909029006958,3.108005285263061,3.1598870754241943
107700,Whats the Problem,blake,6,مشكلتي يمكن أن تكون أنا. مشكلتي يمكن أن تكون أنت. أتمنى لو كنت أعرف تلك المشكلة. ربما رأسي. ربما يكون الدليل.,179,2.3594446182250977,3.158926010131836,2.9686295986175537
59532,The Stop Sign,blake,6,علامة التوقف كبيرة جداً و حمراء دائماً تؤلم رأسي علامة التوقف الحمراء الكبيرة تجعلني أبكي لكنني حقاً لا أعلم لماذا تلك العلامة الحمراء الكبيرة,163,2.268301486968994,3.571211576461792,2.84491229057312
88264,Laura,blake,6,(لورا) سخيفة جداً، اسمها يجب أن يكون (بيلي)، إنها طويلة جداً، تبدو وكأنها ستسقط، تحب الكلاب، عندما تراها في الضباب.,140,3.1530747413635254,3.248480319976806,3.166083574295044
32003,WAR,blake,6,أنا في حالة حرب، أنا وجنودي سوف نُعيد (غلور) إلى وطننا، أرضنا تُصلّي ليلاً ونهاراً، بينما نقاتل بكل قوتنا.,191,3.3751978874206543,3.4643454551696777,3.42390775680542
23156,Me and My Dog,blake,6,كلبي هو خنزير تأكله طوال اليوم عندما تنتهي هي تحب أن تلعب تحب أن تلعب هي تحب أن تلعب لعبة الجلب مع كرة تنس صفراء عندما يحين وقت الدخول,322,3.2596635818481445,3.1654038429260254,3.204240322113037
15865,I.........,blake,6,أحب أن آكل لحماً لا أحب أن أحصل على بيـت (بـيـت يـمـنـي أن أشرب نبيذاً ثم سأشعر أنني بخير,94,2.863778591156006,3.052281856536865,3.1385152339935303
31492,I See,blake,6,هذه قصيرة، ومخالب قصيرة، ومخالب على أرجل سميكة وابتسامة يبدو أنها تلمع. أنف صغير رطب الذي شكله مثل الوردة والآذان البنيّة المجعدة التي أراها,217,3.4888064861297607,3.5196659564971924,3.1784145832061768
93075,Bike,blake,6,ذهبت للحصول على دراجة ذهبت مع تدفق كان كل ما كان لديهم كان تريك ولكن قلت،,81,2.8066444396972656,3.039758682250977,3.1249876022338867
93069,The Bear,blake,6,ذهبت للنوم على سرير كان في غرفة نومي وأستيقظت مع دب على رأسي وبدأت في ضربه بمكنسة.,127,2.459845781326294,3.4262351989746094,2.955017328262329
51235,Cousins,blake,6,لدي الكثير من أبناء عمومتي، واحد اسمه كاتي، واحد اسمه بيتي، واحد اسمه فريد، واحد اسمه تيد، لدي الكثير من أبناء عمومتي، جميعهم خرجوا من الباب حتى أراهم مرة أخرى,204,3.2569174766540527,3.123582363128662,3.223932981491089
51021,The Bus,blake,6,أَنْهضُ كُلّ صباح وأَنْهضُ كُلّ صباح ويَلْبسُ أَلْبسُ الملابسَ. أَجْلبُ حقيبة كتابِي وأتسابق خارج البابِ. هناك أَنتظرُ في الشارعِ لقلّةِ الحافلاتِ. ثم أَصْعدُ على الحافلةِ وأَعمَلُه مرة أخرى,177,3.210873603820801,3.4711084365844727,3.326225519180298
111543,Four wheeleers,blake,6,أربع عجلاتِ حبّي عاطفي جداً هم لَيسوا مرحَ مالم تَأخُذُ طينَ لذا مرحَ مَع كُلّ شخصِ,102,3.8618595600128174,3.7520594596862793,3.412121534347534
75515,Window cat,blake,6,وجلست قطة النافذة كجرذ سمين ولكن بدلا من ذلك شعرت بالرياح من السماء. لذلك جلست قطة النافذة مثل فأر سمين.,115,2.677410840988159,2.9776268005371094,3.028276205062866
30745,Forest,blake,6,مكان حقيقي لتقدير الطبيعة، مع أشجار رقيقة، رسمية وحكيمة، أزياء مهدئة من الطيور، التي غنت الأغاني العجائبية لأعمار لا تحصى، قطعة من الأرض التي هي مكان طاقة، تمشي في... ... أغمض عينيك... ... و تجد الطبيعة حقا على قيد الحياة.,261,3.7857511043548575,3.482978820800781,3.3173582553863525
16131,Cookies in My Pocket,blane,6,بسكويت في جيبي، هناك بسكويت في جيبي، هناك دافئة، لذا فطائر في جيبي، لطيفة ودافئة من الفرن. بسكويت في جيبي، أريد صندوقاً كاملاً منهم. بسكويت في جيبي، هناك بدأ يصبح بارداً، بسكويت في جيبي، ليس جيداً عندما يكونون كباراً. بسكويت في جيبي، من الأفضل أن تأكله الآن! بسكويت في جيبي، مشكلة واحدة فقط، كيف؟ النمل دخل في سروالي وأخذه بعيداً!,444,3.3133373260498047,3.5072031021118164,3.3067753314971924
102937,football,blayne,6,هي لعبة جيدة للعب من أجل المرح والخير للاعبي كرة القدم. والمتعة للعب إلى,92,3.7382771968841553,3.3309993743896484,3.3508427143096924
34466,West End,blaze,6,في وقت ما كان هناك مكان يسمى نهاية غربية. حيث ينام المهووس في قلم الجاموس. ذات يوم سوف يجتمعون في نهاية الشرق، ثم كل القواعد سوف تنحني، حتى ذلك الحين دعهم يختلطون.,169,3.0412168502807617,3.035774707794189,3.1929678916931152
18582,Poetry is for Guys,blondie,6,الشعر للرجال مثل البرغر والبطاطا المقلية. يمكنهم الكتابة جيداً، كما يمكنهم أن يدروا جيداً. الشعر للرجال مثل النظارات والعينين. يمكنهم الكتابة جيداً، كما يمكنهم أن يقاتلوا جيداً. الشعر للرجال مثل الافتراءات والأكاذيب. يمكنهم الكتابة جيداً، كما يمكنهم المشي جيداً. في كل شيء، أعتقد أنك تحصل على الدليل.. ذلك الشعر للرجال.,336,3.283720016479492,3.116660118103028,3.3120901584625244
100198,A LETTER TO MY FATHER,blossom,6,كوحيدة وهي تنتظر الضربة الرعدية مثل الصفعات من الأيدي الثقيلة رعب على روحها، مسببة ألماً على حد سواء لا أمل في موسم لاحق,523,2.689269542694092,3.4883108139038086,3.015956163406372
47289,The alien from outer space,bo,6,كان للأجنبي من الفضاء الخارجي وجهاً مضطرباً جداً جاء ليقابل والده الذي كان سيئاً جداً جداً لكن مشكلته هي أنه لم يستطع إيجاد موقف للسيارات,150,2.326752185821533,3.1929421424865723,2.8948099613189697
109127,Who are You Going  to Belive,bo,6,صديق هو شخص يمكنك الاعتماد عليه. شخص لا يريد أن يتخلى عنك. شخص يهتم بك هو ما أفكر به، ليقول لك الحقيقة. إذا كان لدي صديق حقيقي، أريد صديق يأخذ رصاصة بالنسبة لي. هل تريد صديق يتركك إذا حدث شيء ما؟ مثل إذا كان شخص قريب لك ذهب إلى الأبد؟ الآن مع كل شيء قلت، آمل أن تختار صديق جيد جدا,492,3.19763708114624,3.4183216094970703,3.339080572128296
85960,the old ball game,bo,6,في لعبة الكرة القديمة تشاهد و تسمع الكثير من الأشياء تضرب الضربة الثالثة أنت خارج,80,2.8269119262695312,3.163710355758667,3.135526657104492
101260,Things I Think I Think,bob,6,أعتقد أني أفكر في أشياء لا يجب أن تكون رائعة أعتقد أنني أفكر في أشياء لا يجب أن يجبر الناس على التفكير فيها,167,2.671371936798096,3.1004934310913086,3.12244725227356
101230,Things I Think I Think,bob,6,أعتقد أني أفكر في أشياء لا يجب التفكير بها أعتقد أنني أفكر في أشياء لا يجب على أحد أن يجبر على التفكير,200,2.571146249771118,3.114470958709717,3.115128993988037
