id,title,author,grade,text,char,valence,arousal,dominance
30943,She Was Gone,jessica,6,عندما كنت صغيرة كنت أعرف فتاة تعيش بجانبي. صباحاً حتى الليل كنا نلعب طوال النهار، لا ترى أنها تعنيني. أخبرتني أسرارها الكثير من المشاكل والوفيات التي عانت منها عائلتها. وكان حلمها الأكبر هو أن تطير بعيداً حيث لا أستطيع أن أقول. وفي أحد الأيام استيقظت في الليل فقط لأدرك أنها اختفت. ووجدت ضوءها.,348,2.955137252807617,3.3339810371398926,3.032344102859497
21520,Halloween,jessica,6,هو وقت ممتع يجعل الأطفال الصغار يصرخون ويصرخون لذا دعونا نخرج ونحظى ببعض المرح,114,3.8475379943847656,3.727817535400391,3.440893173217773
15056,Spring Snow,jessica,6,حيث لا يهم اينما تنظر الثلج هو في الهواء يهبط كالريشة التي تلمع كما ترى الثلج هناك والثلج هنا هو عليّ,163,3.2340245246887207,3.3227286338806152,3.222450017929077
115656,The mask,jessica,6,بعض الناس يضعون قناعاً للاختباء ليبتعدوا عن العالم. لا تدرك أبداً كيف يشعرون أو إذا كانوا هناك حزينين أو في الواقع سعداء. حتى تضع قناعاً حتى تدرك ماذا يفعلون طوال الوقت.,209,2.613201379776001,3.222337245941162,2.937007188796997
32809,Sunset,jessica,6,# # ## # # # # # # # # # # # # # # # # # # # # # # # # # # # # # # # # # # # # # # # # # # # # # # # # # # # # # # # # # # # # # # # # #,70,3.3036959171295166,3.1304867267608643,3.156719446182251
75753,Friends Forever,jessica,6,أصدقائي يقفون بجانبي. أصدقائي يقفون من أجلي. نحن أصدقاء إلى الأبد. مهما كان الأمر، نبقى معا. أصدقائي سيكونون هناك عندما أكون حزينا. أصدقائي سيكونون هناك عندما أكون غاضبا. في المطر وفي الثلج، أصدقائي سيكونون هناك من أجل العرض. أصدقائي سوف يضحكون معي عندما أكون سعيدا، ويبكون معي أيضا عندما أكون حزينا. سواء كنا قريبين أو بعيدين جدا، أصدقائي سيكونون دائما في قلبي.,426,3.5513916015625,3.4951095581054688,3.2864177227020264
40105,Gocart,jessica,6,الرياح، والرياح السريعة تطير عبر الهواء يطير عبر الغبار الجوي يطير مثل وقت مجنون لوضعه فوق ليلة سعيدة,151,3.188645124435425,3.264507293701172,3.2133142948150635
22699,(Cinquain Poem),jessica,6,كان الكلب يركض طوال الوقت,81,2.985422134399414,3.020890712738037,3.136101007461548
43472,The stork,jessica,6,"عندما أوقِعَتُ على رأسي مرة واحدة صباحاً، سألتُكَ ماذا تفعل هناك؟ قالَ ""يُعجبُني أن أشاهدَ الحشرات على رأسكَ تشاهدهم يركضون من حوله."" لا تلمسني! لا تلمسني! لديّ قمل و القمل لا تَحْبُّ الفئرانَ أو الطوابق. قالوا أنهم سيتحرّكون إذا لم يكن هناك ستورك على رأسي في الصباح. أستطيع سماعهم يتحركون. قلتُ للستروك إذهب و أحضر فأراً، قملاً مثل الفئران التي تراها. لذا قلتُ للقميص مع الفأر فوق رأسي هل تذهب أو تبقى؟ لا لن نذهب. رجاءً أنا أتوسل منك أن يكون لدي لعبة بيسبول كبيرة و أريد الذهاب. لدي فأر فوق رأسي يتدلى بذيلها الآن سأدعه يفعل ذلك إذا لم تذهب أو ستبقى؟ جيمي، جيمي، جيمي استيقظ وأنت ذاهب إلى المدرسة في وقت متأخر.",758,2.689887046813965,3.416808605194092,3.207808494567871
40584,MOTHER,jessica,6,الى من له اجمل الاسماء ، ويضيف وسامة الى نفسه . الى من يهتف عندما يحزن او يغضب اعظم صديق كان لي على الاطلاق . لأنه لا يوجد آخر يمكن أن يأخذ مكان أمي العزيزة .,190,3.566988706588745,3.4788174629211426,3.2590231895446777
34240,The Quite Stork!,jessica,6,كل شخص يلاحظني لذا أتيت أيضاً إلى منزلك تماماً كالفأر,96,3.1969380378723145,3.1447408199310303,3.228872060775757
39519,Penny the Pig,jessica,6,بنس الخنزير يحب أن يحفر، في أعماق التراب! بنس قرر أن يفعل إلى الصين، ولكن كان عليها أن تجد مجرفة. حفرت إلى الوسط ولعبت بسببها الكمان كانت مملة جدا. استمرت في الحفر والحفر حتى لم يكن لديها المزيد للحفر، سقطت حق رمي الأرض، وهناك درس لجميع يا الحفارين، بعض الناس يدعون لها مول، لذلك كن حذرا قد تسقط من خلال حفرة لها!,399,2.6201395988464355,3.3092246055603027,3.104328393936157
109701,Dad,jessica,6,أبي، لماذا فعلت هذا بي؟ لقد كسرت قلبي لقد فرقتنا بعيداً مع خيارك الغبي طلبت المغفرة كان قرارك أن تفعل ما فعلته,285,2.2533090114593506,3.494635820388794,3.115133047103882
109710,Shopping,jessica,6,عندما أذهب للتسوق مع أمي أشعر بالإثارة لأنها سمحت لي بشراء الأشياء أحب الذهاب للتسوق مع أمي كثيراً أحياناً أنا وأمي نذهب للتسوق معاً أحياناً أمي تذهب لشراء الطعام وأذهب معها وأمي تحب التسوق كثيراً,256,3.86393976211548,3.592362880706787,3.3235318660736084
51509,Friends,jessica,6,الاصدقاء مثل الورود، حنونة وطيبة، يجب ان تعاملهم دائما بصدق، مهما كان ما يدور في ذهنك.,109,3.92316484451294,3.449986457824707,3.331594228744507
51515,Our  World...,jessica,6,فعالمنا هش، لا من أي نوع آخر، ليس مميزا فحسب، بل محبا ونوعا.,91,3.947020530700684,3.5328972339630127,3.28638768196106
51521,Lies...,jessica,6,لا تكذب، في عالم من الإنكار، فإنه سوف يجعل فقط الأشياء أسوأ، إذا كنت حقا تقول لعنة.,101,2.3155593872070312,3.315238237380981,3.228545904159546
51525,School...,jessica,6,قد تكون المدرسة رائعة، ولكن ليس للبعض، في الواقع أنها تأتي، لتعلم أشياء جديدة.,78,3.028992176055908,3.129359006881714,3.23999571800232
40066,TEACHERS,jessica,6,المعلمون هناك متسلطون جداً لكن معلمتي ممتعة جداً ورائعة حقاً إنها أعظم واحدة على الإطلاق إسمها سأقول السيد (سبينوزا),135,4.112063884735107,3.8619251251220703,3.4217774868011475
17024,When You Mix...,jessica,6,عندما تخلطان مع:#x85; 1.5/2 لتر من شقيقة A1.5/4 كأس من الأخ، 1 لتر من الأب، و 1.3.5، 4 ملعقة من الشاي للأم. 6/7 صفائح من الأعمام والعمات، 3/5 ملعقة مني، 8/9 كرتون من كبار الوالدين، وكلب واحد، إذا أمكنكم رؤية. 7/8 يد مليئة بالعناية، و 1.5/2 وعاء من الحب، و 3 غالونات من الضحك و#x85؛ تحصلون على عائلتي.,305,3.609827995300293,3.394382238388061,3.31145977973938
30947,Sunset,jessica,6,الخالق يعمل بقوته لصنع لوحة، أوه! لطيف جداً، إنه يتفوق على البشر بأفضل صورة بثلاث مرات. الخالق هو يهز الرسام بالرغم من أن فنه يزداد خمولاً يوماً ما. التفسير لا يهم؛ على الرغم من ذلك، بالنسبة لي، فإنه يعني الكثير. الجلوس هنا، أنا أنظر إلى طريقك، وأرى كم أنت لطيف تنظر اليوم، ورؤيتك تعيش حياتك، بلا اهتمام، لسبب ما، أتمنى لو كنت أنا، لا أقلق، لا أهتم، أنا أحسدك، هناك، أنظر إلى الوراء، عيني عنك،,650,3.79426908493042,3.621070384979248,3.3265469074249268
28389,Your eyes,jessica,6,عيونك كبيرة وبنية جدا ما الكلمات التي يقولونها بدون كلمة عيونك هي مثل مكان سري الذي يقول مشاعرك كلمة كلمة بكلمة الآن هنا,214,3.439237117767334,3.590775966644287,3.15816593170166
90466,The Day I Met Peach Cobbler,jessica,6,كان يوم الجمعة اليوم اليوم هو اليوم الذي دعوت فيه الموت في اليوم الذي حاولت فيه أمي أن تصنع شيئاً جديداً يا فتى كيف أنها فجرت لم تجعله صحيحاً لذا كنا نحاول أن نبقى بعيداً عن الأنظار دائماً ما تم القبض علينا,485,3.0381388664245605,3.586252450942993,3.089652299880981
84470,10 Thousand steps,jessica,6,عشرة آلاف خطوة، حتى تتعلم كيف تمشي، عشرة خطوات، عشرة خطوات، حتى تتعلم الكلام. عشرة آلاف خطوة، حتى تتعلم القراءة، عشرة آلاف خطوة، حتى تنمو بذرة. سوف تتخذ خطوات عديدة، ولكن عشرة آلاف خطوة هي كل ما تحتاجه. عشرة آلاف خطوة، للوصول إلى البحر المالح، عشرة آلاف خطوة، للوصول أخيراً إلى مجد قوس قزح!,341,3.572847366333008,3.4713258743286133,3.33701229095459
73990,Brother,jessica,6,أخي طويل القامة أخي هو بارد أخي في بعض الأحيان يمكن أن يتصرف مثل أحمق انه ليس ساطع جدا أو مجنون,164,3.244425773620605,3.5530385971069336,3.311552286148072
87598,Pigs are crazy,jessica,6,خنازير مجنونة أنا أقول لك من الرأس إلى أصابع القدمين، خنازير ترتدي شعراً مستعاراً بينما أنت لا تنظر إليهم,134,2.721447706222534,3.3192808628082275,3.2944085597991943
87583,My Fish,jessica,6,أتمنى، أتمنى سمكة وغائط هناك في طبقي سأدعو جميع أصدقائي حول السمكة التي تمنيتها للتو على طبقي,226,3.20383882522583,3.5039453506469727,3.2268168926239014
62835,My Family,jessica,6,أبي يعمل بجد كل يوم، لكنه لا ينسى أن يستمتع ويلعب. إنه يحب أن يأكل البيض، النقانق، والنخب، لكنه لا يزال يحبنا أكثر. ماما مهووسة بالطبخ، إنه جيد جداً جداً لدرجة أنك لا تستطيع التوقف عن الأكل. إنها تحتفظ دائماً ببعض الطعام بجانبها، وهذا هو السبب في أن خصرها واسع جداً. إن خيالها يمكن أن يصل إلى أبعد من الفضاء الخارجي، يمكنك حتى أن تقرأ القصة على وجهها. إنها مضحكة جداً ولطيفة، حقاً، أنا أقول لك الحقيقة. كل يوم الكثير من الأشياء تدور في رأسي، وهذا هو السبب في نهاية اليوم الذي أنهار فيه في سريري. أحلم أن أصبح كاتبة، أو رائدة فضاء، أو كاتبة قصص، ولكن اليوم سوف تتخذ خطوة في الوقت وتمضي اليوم مع عائلتي التي تحبني إلى الأبد.,762,3.8898730278015137,3.572134256362915,3.321733236312866
62920,The Missing Coin,jessica,6,في المدينة التي ترفرف بشكل سليم، العملة تدور في الشوارع بأمان. يحلم الأطفال، كل الناس ينامون، العملة المفقودة في رحلتها. في ضوء الفجر الناس مستيقظين، فطور لذيذ سآخذه. في وقت لاحق بعد الظهر، أصرخ مع البهجة،,261,3.791948795318604,3.7754836082458496,3.365135908126831
39291,Night Flower,jessica,6,بتلاتك من مخمل وثلج ابيض. وعلى الرغم من انك تفتح فقط في امواج الليل، فإن وجهك يجلب الدفء والفرح للذين يرون. عندما ينكسر النهار، تختبئ فقط لتستيقظ الى ليلة النهار. ثم متى كنت حقا تنتمي، زمانك ومكانك الخاص. تجلس نفسك في طين او قدحش في جنة. في أي مكان، ولكن ستكون مختلفا عن الآخرين. لماذا تعيش في طرق شاذة كهذه؟ ربما لا يعرف أحد من قبل. لانك نفسك غامض.,505,3.5135915279388428,3.3587288856506348,3.246368169784546
39292,Trapped Elements,jessica,6,"إذا إلتقيت بصديق يتجول على طول هذا الطريق المروع، سأهمس ""مرحباً"". وأمسكهم أخوياً وقريباً. سأخبره ألا يخاف، لأنه تحت ضوء القمر، سيرى أني هنا. ستزول مخاوفه ولن تستيقظ أبداً أبداً. حينئذ سيكون حراً في السفر والصيد بآماله وأحلامه. ويعود إلى حياته الساذجة، حيث يوجد مجرد ضوء القمر. وأنا أحاصر ضوء الشمس واليرقات.",438,3.326120376586914,3.3649210929870605,3.283634662628174
39293,The Moment of a Leaf,jessica,6,ريح خريفية قوية وهاوية حقيقية. أطلقت أنا من الجزء الخاص بي من الفرع. بهدوء، بلطف أطفو إلى أسفل، كل شيء حولي. يبدو أن الغابة قد ذهبت إلى مرحلة. الطيور في شجرة قديمة بلدي توقفت عن الغناء. السماء أعلى من قبل. الغيوم أيضا. أسفل أقربائي متشابكة، شيء ما سأقوم بفعله أيضا. الأرض تقترب مني، أقرب إليّ. أجسام إخوتي من الأعماق والضوء البني. من بعيد، هذا يمكنني أن أراه. أنا أصطدم بهدوء، بهدوء، بالتربة الباردة، التي هي الأرض. الغابة المحيطة بي تبدو وكأنها تهتز. هل أنا باستثناء بيتي الجديد والمصير؟ من خلال أشقائي تلمع شريحة جديدة من ضوء الشمس. نعم، هذا هو بيتي الجديد في وقت متأخر.,697,3.145345687866211,3.219698429107666,3.1152501106262207
80703,blurry summer,jessica,6,لقد كادت المدرسة أن توشك على الانتهاء وكذلك الشتاء إذا لم أستعجل الصيف سيكون ضبابياً,85,2.591233730316162,3.091957092285156,3.016902208328247
78170,All about me,jessica,6,أنا جميلة وذكية، هل أنت ذكية؟ هل أنت جميلة؟,62,3.886387348175049,3.615343809127808,3.3184142112731934
51303,My Memories...,jessica,6,في يوم أمس، كان يوم أمس، لا يمكنك أن تفعل أي شيء لتغيير الماضي غدا هو لغز، ما يكمن في مستقبلك. ____________________________________________________________________________________________________________________________________________________________________________________________________________________________________________________________________________________________________________________________________________________________________________________________________________________________________________________________________________________________________,673,3.443641185760498,3.3976855278015137,3.2349278926849365
87342,When I Woke Up,jessica,6,"عندما استيقظت هذا الصباح كان هناك قطة على رأسي. سألت، ما الذي تفعله هناك؟ قال، ""لماذا هو أنعم من سريرك!"" نظرت إلى القطة وقلت، ""أبتعد عن رأسي.""",185,2.624241352081299,3.601545572280884,3.206373929977417
29962,Sugar,jessica,6,الازهار هي الازرق والسكر الازرق هو حلو لكن الازهار محصولة الازهار الازهار ميتة البنفسجية وعاء السكر فارغ وكذلك راسك,151,2.6804771423339844,2.9881691932678223,3.022335290908813
22313,My Dog,jessica m. evans,6,كلابي الرائع ليس مثل ضفدع أخي فراءها الجميل لا يتطابق مع قطة متكبرة كما ترى انها مثالية بالنسبة لي انها صديقتي المفضلة بدون اتجاه لا يمكنها التحدث,320,3.630103588104248,3.4744155406951904,3.3493237495422363
39909,The Bright Blue Sky,jessica pomeroy,6,السماء الزرقاء شيء غريب يمكنك رؤية أشياء في السماء إذا نظرت، يمكنك رؤية أشياء في السماء كالكلاب، الطيور، الأسماك، وأحياناً الناس في النهاية,162,3.2703418731689453,3.1314139366149902,3.1716318130493164
64067,HALLOWEEN ISNT BUT IS.,jessica tai,6,الهالوين هو عام الخدعة، لمرة واحدة في حياتك، إلبس في الطوب. ساحرة أو غول، أياً كان اختيارك، تأكد دائماً من حصولك على متعة أو خدعة.,348,3.40472412109375,3.5698280334472656,3.413872003555298
66017,What  fun  is  to  me,jessie,6,من الممتع بالنسبة لي أن أحظى بالمرح أن أحظى بيوم جميل مثل هذا اليوم معاً,119,3.9589591026306152,3.473918437957764,3.386606454849243
88330,Chiffon,jessie,6,أي حيوان محشو ليس مهماً بالنسبة لي. الشيء الذي أقلق أكثر، هو (شيفون)، كلبي. فروها طويل جداً، حريري و ناعم. إنه يسحب على الأرض. عليّ أن أمسك أعلى أعلي أعليها. تحب الإستحمام. دائماً تنبح:,234,3.316218852996826,3.350379943847656,3.2519948482513428
31925,EIGHTH GRADERS,jessie,6,الصف الثامن لئيم، لا داعي للحرص، إنّهم وقحون مع الشدّ والشرّ والأخضر، لهذا السبب يعني ذلك!,115,2.149674415588379,3.588644027709961,3.3189809322357178
22963,Snow,jessie,6,كرات قطن كبيرة تسقط من خلال الهواء السكوت قادم بينما تلعب بسعادة في الخارج هناك هواء شتوي سريع صفعات على وجهي,252,3.6975462436676025,3.668671607971192,3.3354246616363525
72818,Cats,jessie,6,أنت مثل سحابة بيضاء ناعمة طوال الوقت؟ أنت ترقد هناك كل شيء على ما يرام؟ تنظر إليّ كأنني جديد عليك؟ كان لديك الوقت؟ لهذا أحبك؟,242,3.622256278991699,3.4595446586608887,3.229621410369873
74697,my cat in a hat,jessie,6,قطتي لديها قبعة لكنها مسطحة لكنه يعتقد أنه شيء عظيم لكنه مزيف بالفعل,78,2.828253746032715,3.0872879028320312,3.124805212020874
87048,The Weird Potato,jessika,6,فالبطاطا تأكل رقائق بطاطس وامامها كبيرة وشفاتها الرديئة الارجوانية. تأكلها مع بعض الجبن النتن وتقول هل لي بالمزيد من فضلك.,138,2.80122971534729,3.1370327472686768,3.1101233959198
29454,The hardest favor in life,jesstina,6,هذه الليلة أطلب منكم اصعب معروف في حياتي و ذلك المعروف هو أن تنسوا أنكم تعرفوني من أي وقت مضى تفقدوا رقمي وعندما تروني أمشي أو أقود,197,2.474941730499268,3.519349336624145,3.0868821144104004
29456,I wish,jesstina,6,أتمنى يوماً ما أن أقابلك يوماً ما وعندما تكون تلك الأمنية مستحيلة لأنني لا أعرف من أنت أو أين أنت لذا الشيء الوحيد الذي يمكنني فعله هو أن أتمنى يوماً ما أن أقابلك,248,3.169823169708252,3.673248767852783,3.22859001159668
85646,Wild Horses,jessy,6,خيول برية تجري بحرية، حوافر تدق مثل الرعد على العشب الأخضر. خيول برية تسير بسرعة، أسود، أبيض، كستنائي، والكثير من الألوان الأخرى. خيول برية أتمنى لو كنت مكانك، تجري بحرية في المروج المفتوحة. أتمنى لو كنت مكانك!,248,3.3690602779388428,3.6561121940612793,3.1899492740631104
95217,So much depends upon a,jesus,6,ضفدع أخضر صغير يجلس على وسادة ليلى في بركة الثيران يأكل ويتخلص من البعوضات الصغيرة المزعجة.,109,3.382215738296509,3.066833734512329,3.22735333442688
101946,My Little Brother,jesus,6,إن أخي الصغير لطيف جداً، فهو حلو كحلوى حلوى القطن ومع ذلك يرتعش كحلوى الحامض، ويمكنه أن يكون قاسياً ويمكنه أن يكون قاسياً، وهو مثل ملك البيت كأنه فأر صغير، ويمكنني أن أرى كيف هو مع الغرباء وعندما يكون محاطاً به في غرفة، ويمكنني أن أسمعه يبكي أستطيع سماعه يضحك، حفاضات، حفاظات، رائحتها سيئة جداً، أنا سعيدة جداً أنه ليس من دواعي سروري أن أرميها خارجاً,424,3.575892448425293,3.5020089149475098,3.2251017093658447
105352,Things i do,jett,6,أحياناً أعتقد أني لا أفعل الكثير من الأشياء لكن عندما أصنع قائمة أفعل الكثير من الأشياء أسير على كلبي وأقوم بعملي,194,3.278140068054199,3.157773494720459,3.319746255874634
28808,Air,jett,6,مكان باتمان هو كما هو الحال في حالة العمل. كرات كبيرة تتناغم مع الطول الحقيقي. يتماشى مع الوقت عندما أكتب هذا هو لجريمتي. شعري يسألك هل تذهب معي. الخفافيش سيئة كالقطط وهذا كل ما في الأمر.,246,2.8421521186828613,3.127618789672852,3.156654596328736
89700,Swept away by sea,jewels,6,لا شك أنه تم سحبي بعيداً عن طريق الغنائم البحرية وأنا أُسحب تحت سقف البحر على أمل أن أخرج من حياتي,528,2.8602304458618164,3.530951499938965,2.9136407375335693
28925,The Flag,jewels,6,لو كنت أنا العلم كنت سأتجه إليه و أطير بجرأة لأظهرت أنني أنتمي إلى أمريكا,95,3.23474645614624,3.669473648071289,3.4822657108306885
89460,I have a brother,jhon,6,أخي هو بعض الوقت المرح وبعض الوقت يبكي بصوت عال أخي لديه الكثير من الألعاب ويحب أن يلعب مع طفل آخر,322,2.961852550506592,3.262650966644287,3.1337978839874268
101257,My Young Brother,jhon,6,انه يحبني انه يلعب معي انه يلعب معي انه يجرح لي انه يؤلمني أنا لن أختار أي شخص ما عدا هو ليكون أخي الصغير,103,3.374642133712769,3.5951502323150635,3.261230945587158
23550,Molly,jill,6,أنفها هو الفانيليا قطرات العينين كبيرة كما لو أن اللؤلؤة المصاصة اللسان لينة و لزجة دافئة جدا الفرو مثل سحابة,252,3.1192269325256348,3.221027612686157,3.0998575687408447
18619,Creation,jill,6,صنع الله كل شيء. صنع كل شيء. صنع كل اشجار. صنع الله كل انواع الاشجار. صنع ايضا النحل الخانق. صنع كل سحابة رقيقة من خليقته هو فخور جدا. صنع الله كل شيء حي. يمكننا ان نحمده عندما نغني. يمكننا ان نحمده في طرق كثيرة. نسبحه في كل ايامنا. صنع الله انت وانا. قال انه في عبادتنا يجب ان نكون احرارا.,396,3.701067924499512,3.4449307918548584,3.34415340423584
18144,Terrorists,jill,6,رعب إرهابيون إرهابيون رعبوا أبراجاً متلازمة,51,2.258737564086914,3.377670764923096,3.0190775394439697
18074,Flowers,jill,6,رائحة البتلات حلوة بعض اللقاح يمكن أن تجعلك عطسة هذه الأشياء هي الأزهار.,84,3.3448944091796875,3.2952208518981934,3.2163124084472656
39877,Nothing But Net,jill,6,أنا أحب أن ألعب كرة السلة، أصرخ على الحكم 'ما هو النداء.' حصلت على لقطة قفزة مايكل جوردان، ولكن سأهب في الماضي مثل جيف جوردون. سترى ثلاثة مني ينفخ الماضي، ثم أقول له ليلة جيدة وقبّله من الزجاج. حصلت على تقاطع آي، كسر كاحليك.. عبر لك، قدمك في تشابكات. أنا لاعب حقيقي في الشوارع، وأنت لا شيء سوى مطلق النار الحقيقي. سوف تبدو مثل رمية حرة وأنا أطلق النار من نصف محكمة. إذا كنت لا تعرف كرة السلة هي رياضتي المفضلة.,504,3.3539786338806152,3.490279197692871,3.384183168411255
