id,title,author,grade,text,char,valence,arousal,dominance
39570,Civil war,john,6,صرخة، صرخة، صرخة، ذهبت مع لونها. صرخة ذهب الحشد الحمقاء. الدولة ضد الدولة. والأخ ضد الأخ. المسدسات تسلط الناس على السقوط. الرجال ينوحون، صرخات النصر صوتها نفس الصوت، في حين صرخات دموية من الهزيمة بعيدا. البنادق تفرغ، غير محملة، أوك، استعداد للنار! الانفجار ذهب المدافع، البوب ذهب البنادق، البوب ذهب السيوف وسقطت السيوف وسقطت جحافل الرجال الذين كانوا نفس الشيء ولكن لعبوا لعبة مختلفة. روبرت لي ضد المنحة. يعرفون نفس الشيء في نفس الوقت. الموت، الدمار. الحرب ليست هي نفسها أبدا.,538,2.56923770904541,3.524595022201538,3.055898904800415
49846,&apos;&apos;Life in the Wild&apos;&apos;,john,6,لا يمكنك أن تفكر أو ستحصل على شجرة واحدة هناك في ميل واحد من الحياة في البرية من الخطر أن تكون فريسة إذا تعبت من الركض، أو الغوص، أو القفز، أو البط من مجموعات الحيوانات التي لا يمكنك البقاء على قيد الحياة في البرية بدون الغذاء الحياة في البرية هو أمر خطير. من الصعب عليك أن تكون خادعاً.,1044,2.486785411834717,3.290400266647339,3.013190746307373
18570,The sound that a worm makes,john,6,الديدان التي تحفر في التراب تسحق وتلتوي وتلين وتطحن إلى أن يتم القبض عليها وتضعها في صندوق وصراخ صامت كما تضع على خطاف تهزها وتدحرج وتترنح في الألم وتطير من خلال تهوية الهواء، تهش بينما يهتز الهواء. ثم تقذف رشة رشة تتناثر دودتنا الدودية تبدأ بالغرق. ماء بارد في أي وقت من الأوقات على الإطلاق.,407,2.7029175758361816,3.407580137252808,3.0118730068206787
101746,Faster than,john,6,أسرع من سيارة رياضية أسرع من طائرة أسرع من طائرة أسرع من البرق,87,3.172245979309082,3.419814109802246,3.2345669269561768
101724,the frame,john,6,الإطار لديه العديد من الذكريات مع خارج مع ملاحظة أنه نحن فقط نتركه وحده,74,3.0551607608795166,2.9755420684814453,3.158017158508301
33439,Nantucket Sunset,john,6,يَدْعَى مَغْبٌ سَابِقٌ سَامِحٌ لَكَ لِلْمُرَاقَبَةِ. رَحْمٌ لَيْسَ لَكَ أَنْ تُرَاقِبَ . رَجُلٌ لَيْسَ لَيْسَ لَدَيْهِ أَقْدَامَكَ ، كَمَا تُرَاهِبُ ٱلْغُرْبَ يَسْحِقُ ، أَنْتَوْجِدُ ٱلْمَوْجُودَ ، أَنْ تَسْتَغْلِقُ أَنَا . تُحْتَمِلُ ٱلْمَرْفَلَقَ يَسْتَطِيرُ بِأْرَةٍ أَوْمِيْلَى . وَكَا أَنْ تَنْ تَكُوْتَلُوْتَ .,468,3.594207286834717,3.433107852935791,3.2401700019836426
42080,Colors,john,6,السماء زرقاء، وأنت على الأرض بنية بنيان مثل البلدة الأشجار خضراء، وكذلك حبة الفول,111,3.1277389526367188,2.90717887878418,3.1637136936187744
48321,Night is Death,john,6,"""الظلام يحدث فجأة في الظلام"" ""ومازال يخرج من العدم""",69,2.587449312210083,3.2467548847198486,2.867868423461914
80048,People,john,6,هو صديق جيد و صديق جيد يحب الحيوانات و لديه رأس كبير,57,3.2592597007751465,3.068103551864624,3.231750726699829
33251,Fear,john,6,خافوا من بريق يسيل من على رقبتكم، الخوف يسير وحده في الليل مظلمة كالقطة السوداء، وطالما أن خوفكم يمكن أن يكون في المقدمة أو وراءكم، فإن المخلوق الذي تعرفونه لا لون له كاليد الميتة، من أجل أن يتم إنقاذكم ببطل متوهج، ينتظر، ينتظر، ينتظر، ينتظر بطلكم، الآن يأخذني المخلوق ويجعلني بطله الذي ينتظره دائما.,427,2.999734878540039,3.5535545349121094,3.052900075912476
105297,The Hunt,john,6,ليس هناك وقت لتفريغه وهناك حشرات في شعري تحاول يائسة للعثور على ديك رومي يمشي في كل مكان ينظر إلى الأرض ثم أرى تلال يمكن أن يكون ديك رومي؟,204,3.021556854248047,3.4036245346069336,3.0915565490722656
95981,I&apos;m Going Away,john,6,كل شخص سأسافر بعيداً قد لا أعود حتى وداعاً أمي، وداعاً أبي آمل ألا تحزني قد أستقل قطاراً,192,3.364421844482422,3.562793731689453,3.212923288345337
91379,The Beast,john,6,في أرض بيت المزارعين القديم كان هناك وحش لم يكن وحشاً عادياً كان وحشاً ضخماً ضخماً كان وحشاً ضخماً ضخماً,264,3.31834363937378,3.317766666412353,3.2188050746917725
31490,ME,john,6,أنا في الصف السادس، أنا طفل طبيعي، أحب أن ألعب كرة السلة، أصدقائي هم بريان، دان، أليكس، ريان، بليك، كولبي، تانر، ديلون، ليكور، ديتشان، دونتي، دالاس,203,3.230976819992065,3.0379371643066406,3.2189552783966064
47994,Poems,john,6,عندما أكتب الكلمات المشاعر التي تحصل عليها منهم دعهم يبقون أحياء,76,3.4124109745025635,3.207783460617065,3.338040590286255
43603,The Bucket,john,6,كانت هناك فتاة ذات مرّة من (نانسيتيتيت) التي حلمت أنها كانت تبحر في دلو أبحرت بعيداً في ذلك الدلو طوال اليوم,191,3.0908544063568115,3.1958940029144287,3.1529128551483154
95655,Tullula,john,6,هي بيضاء وسوداء و هي لا تكذب ابداً انها مهذبة و لطيفة وذكية جداً,185,3.413684368133545,3.1410956382751465,3.258772611618042
48825,Wish You Were Here,john-paul,6,يا عزيزي، أتمنى لو كنت هنا، حيث الشمس مشرقة جداً و دافئة جداً، سعيدة لرؤيتها الطيور تبدأ في تشجيع المحيط الأزرق,418,4.0896897315979,3.729200839996338,3.322995901107788
87178,The reindeer named Bob,john.cody,6,(بوب) لم يحصل على وظيفة أخرى، لكن (بوب) لم يحصل على وظيفة أخرى أبداً لكنه أصبح سميناً على الذرة,219,2.677671194076538,3.003296375274658,3.0878264904022217
100293,My dog,johnathan,6,كلبي أبيض، صغير، وفي بعض الأحيان عالي. يمكنه أن يشم كل شيء تقريباً. أذنيه طول جورب. يقفز إلى الناس عندما يأتون. ينام كثيراً ويلعب أيضاً. عندما يأكل يصنع فوضى. يعض عندما يغضب. يهرب من البيت ليلعب مع أصدقائه.,282,2.8977365493774414,3.222574234008789,3.151484727859497
27652,The Hill,johnathan,6,كنت أسير على التلة وتعلمت مهارات جديدة عندما وصلت إلى القمة رأيت ممسحة جديدة أمسح تلك التلة بمهاراتي الجديدة لذا عدت إلى الأسفل ورأيت مهرجاً مضحكاً كان صغيراً جداً,315,3.543025016784668,3.488016128540039,3.324798107147217
101013,John,johnnie,6,انا اعيش في انديانا. ابن شانا s. erl t. i لدي 1 سيس و 1 برو من قبل شانا. arl t. I تملك 1 كلب و 1 سمكة. أنا أحب عائلتي. أخشى أنه عندما تموت عائلتي أن عالمي سيتغير. أود أن أرى جدتي/جدي. الهدية التي أعطانيها الله لي هي أن ألعب كرة السلة. ما أشتاق إليه هو عائلتي. أنا أحتفل بيوم العائلة/عيد الميلاد. الناس يصفونني على أنني مضحكة، لطيفة، ومحترمة.,410,3.627601861953736,3.3716509342193604,3.2738192081451416
95201,Mysterious Guy,johnniece,6,"كان هناك رجل لا ينظر إليه في عينه على الرغم من أنه كان دائماً يقول ""مرحباً"" أردت أن أكون لطيفاً لذا صنعت له فطيرة",218,2.439972162246704,3.3658366203308105,2.977487325668335
114207,My dog,johnny,6,"""كلبي وردي وردي"" ""كلبه مليء بالحبل"" ""الأذنان تمسح الأرض"" ""القدمان تلمسان السماء التي يحب أن يركض بها""",96,3.6222481727600098,3.489407539367676,3.239586114883423
104879,The Climate,johnny,6,لدينا مناخ غريب، يكون حاراً عندما أضبطه. في الشتاء يكون الجو بارداً، تُباع الجاكيتات دائماً. في الربيع يكون الجو بارداً، الطقس دائماً ما يحكم. في الصيف يكون الجو حاراً، البركة هي البقعة. في الخريف يكون هناك نسيم، الذي يسقط من كل الأوراق.,271,3.2233924865722656,3.1107707023620605,3.19406533241272
15404,I Am,johnny,6,أنا الجيل الذي سيحل محلك. أتساءل عما يحمل المستقبل رأساً. أسمع أن هناك العديد من الطرق التي يمكن أن تسلكها حياتي. أرى العواطف في طريقي. أريد أن أتخذ الخطوات الأولى التي ستقود الطريق. أنا المنظمة التي ستأخذ مكانك. أنا أتظاهر بأن هذا العالم سيكون دائماً صديقي. أنا أتصور أن هذا العالم سيكون دائماً صديقي. أنا أشعر بالألم الذي في قلبي. أنا ألمس من يبدو أنه لا يشعر. أنا قلق لأنني لا أعرف أين أقف. أنا لا أعرف أين أقف. أنا أبكي على فقدان ما لن يعود أبداً. أنا الجيل الذي سيأخذ مكانك. أنا أفهم أن الحياة ليست سهلة القهر. أنا أقول أنا لا أخسر أي شيء إذا حاولت. أنا أحلم بأي أيام ستشرق حياتي. أحاول أن أدع روحي تطير في السماء الزرقاء العميقة. آمل ألا يتحطم أبداً. أنا الجيل الذي سيأخذ مكانك. أنا الجيل الذي سيأخذ مكانك.,783,3.204481601715088,3.365501642227173,3.2162625789642334
25708,Billy Bob,johson,6,لم يكن لدى (بيلي بوب) شعر (بيلاي) لم يجرؤ أبداً على فعل ذلك كما أنه كان يحب الرجال الذين كان لطيفاً معهم وأحب الجميع,113,3.578490257263184,3.247844696044922,3.290116786956787
53795,STAR,joi,6,منذ البداية كانوا يعرفون أنها ذكية من الطريقة التي تحدثت بها إلى الطريقة التي سارت بها كانت ملكة دراما وأحبت أن تغني لساعات وساعات في الاستحمام. حلمت بأن تكون نجمة وذهبت إلى أبعد من ذلك. حصلت على رجل كبير لا يريد أن يبدأ كلام والدتها، لكنها ذهبت على أي حال والآن ليس لديها أصدقاء للعب.,412,3.28903603553772,3.3235158920288086,3.2145144939422607
48124,She&apos;s Up There and I&apos;m Down Here,joi,6,أنا لست مستعداً لكل شيء مُتعجّب أشعر بالنار كلّ أنّك متأكد من أنّي قد دفعت كلّ ما دفعه سرقة كلّ ذلك الكذب كلّ ما يُؤذيه...,471,2.3927273750305176,3.471624851226806,2.9569342136383057
48126,She&apos;s Up There and I&apos;m Down Here,joi,6,أنا لستُ مستعدّاً كلّها فجأة أشعرُ أنّي مشتعلة كلّ ما يُؤكّد أنّي دفعت كلّ ما دفعه سرقة كلّ ذلك الكذب كلّ ما يُؤذيه... أحتاج ماءاً...,470,2.416194438934326,3.484960556030273,2.96978759765625
110267,Since 9,joie,6,بما أني كنت في التاسعة من عمري حبي للكتابة كان إلهياً والعالم كله,167,3.7129759788513184,3.656412363052368,3.3787872791290283
18629,I Wanna Help,jolene,6,ألف ألف كلمة في عقلي هل ينبغي لي أن أذهب وترك كل شيء وراءي؟ لم أكن أعرف ما الذي سأفعله في محاولة الهرب ومطاردة ما هو حق حقي في الألغام؟ ينبغي لي أن أقول أنه واحد من نوع,859,2.55592942237854,3.401503562927246,3.0258800983428955
92625,Audrey Hepburn,jolie,6,إنها تبدو تماماً مثل الدمية السوداء اللباس الأسود واللؤلؤ أكثر رقية من الفتيات الأخريات في طريقها إلى (تيفانيس) النموذج المثالي لي,178,3.644664287567138,3.3800642490386963,3.278190851211548
92627,Beauty,jolie,6,ما هو الجمال الحقيقي؟ هل هو غروب الشمس أم قوس قزح؟ لا، هل هو لتشيزي. هل هو شقراء جميلة مع رقم ضئيل؟ لا، هذا هو أيضاً أو دانديري. الجمال ليس بالضرورة ما يعتقد معظم الناس أنه هو. هو مخبأ في أكثر الأماكن غير المرجحة، ويمكن أن يدوم فقط لدقيقة أو مدة حياة كاملة. ليس دائماً مثالياً، في الواقع معظم العيوب هي أجمل من الأشياء المثالية. الناس ينشغلون كثيراً بالنظر إلى الوردة الحمراء لدرجة أنهم يفشلون في رؤية الأشواك المنتفخة على الجذع. تلك الشوك تحمي الزهرة وتبقيها على قيد الحياة، وهذا هو الجمال الحقيقي للنبات بأكمله. الكثير من الناس يذهبون طوال حياتهم دون رؤية شيء جميل حقاً. ولكن ذلك بسبب عدم نظرهم إلى المكان الصحيح.,732,3.0952353477478027,3.222795963287353,3.173232316970825
48219,Peanut butter &amp; jelly,jon,6,في يوم من الأيام قرر زبدة الفستق أن يصبح متحداً لذا أخذ نزهة و دفع ثمله,122,3.641209602355957,3.495961904525757,3.3458516597747803
37470,Jon,jon,6,وكان ذات مرة رجل اسمه يون لانه كان مجرد خدعة. فقال انه لا يزن شيئا. لكنه وزن طنا اكل رقائق ولم يقص العشب.,152,2.640279054641724,2.993721008300781,3.11255431175232
107729,The fluuu,jon,6,"الانفلونزا سيئة, الانفلونزا تجعلك حزيناً ثم تسأل والدك هل حقاً بهذا السوء؟",90,2.257121562957764,3.2191786766052246,2.895366668701172
72168,Lightning Bugs,jon,6,في الليل، العديد من الأنوار، مخلوقات صغيرة تضيء الليل، منظر رائع.,80,3.9735898971557617,3.587984561920166,3.3284270763397217
32005,Hockey,jon,6,أنا لست فارساً أحب الثلج لأن دفاعه وهجومه اللطيفين أعجبني كلاهما الـ77 trurgon اللاعب المفضل لدي هو أيضاً vibrater,152,3.726053237915039,3.3497142791748047,3.342346906661988
39256,TRAFFIC,jon,6,"ازدحام المرور , ازدحام المرور , ابحثوا عن مقهى انظر , لقد ذهب هناك ازدحام ازدحام ازدحام , ازدحام المرور , اصنع بعض السلال , انتظر , حصلت على سترتي",215,2.662440061569214,3.2969887256622314,3.066778898239136
93335,Atrocious Neno,jon&apos;nae,6,هناك كلب كلبي كلب شرير شرير,163,3.622955799102783,3.6748135089874254,3.3811686038970947
102116,The sleepy funny dog,jonah,6,هناك كلب اسمه (ريد) كان يحب النوم على سريري عندما أستيقظ في الصباح أراه نائماً و يشخر بذيله على رأسي، كلبي المسمّى (ريد) مضحك يجب أن تراه يطارد أرنباً، يقفز صعوداً وهبوطاً في جميع أنحاء المدينة حتى يستيقظ دميته، في نهاية اليوم ينتهي من سباقه مع ابتسامة على وجهه ومستعد للنوم على سريري مجدداً.,376,3.729775667190552,3.5724668502807617,3.3008198738098145
119956,I wish,jonah,6,أتمنى لو كنت تعرف الطريقة التي شعرت بها في كل مرة أنظر إليك، أتمنى لو كنت قد اخترتني عليه، أحتاج إلى امرأة تأخذ فرصة على حب يحترق عالياً جداً،,292,3.478267431259156,3.680079221725464,3.3597640991210938
92399,Story of a cookie,jonah,6,ذات مرة كان هناك كعكة تحكم العالم كله يقول بعض الناس أنه أكله مع السلامة,88,2.8580617904663086,3.1066362857818604,3.1409502029418945
45131,A Juicy Moose,jonah,6,ذات مرة كان هناك حيوان موس الذي كان يحب أن يشرب الكثير من العصير وسكب بعضه على شعره الآن,142,2.989612579345703,3.138704776763916,3.223173856735229
73937,Birds,jonas,6,بعض الطيور كبيرة بعض الطيور صغيرة ولكن عندما يطلق الصيادون النار عليها في الهواء تبدأ بالسقوط. بعض الطيور يمكن أكلها,203,2.797189474105835,3.093313694000244,3.1982696056365967
108825,Breakfast,jonathan,6,في صباح أحد الأيام استيقظت، وكان لا يزال مظلماً، ذهبت إلى الطابق السفلي من منزلها، كان صوت صوت أمّي كانت تُجنح مثل (ميدوسا) لشعرها مثل الثعابين، الميكروويف صوته بيبي، ثم عرفت، الشوكولاتة الساخنة رائحتها لذيذة جداً، ألمستها وكانت ساخنة كالبركان.,255,3.5891120433807373,3.608875274658203,3.259692430496216
46982,The Game Of Golf,jonathan,6,في الهواء على أمل الحصول على الكرة على الأخضر تُحلق الكرة مثل النسر ولكن فقط للذهاب في فخ الرمال يأتي غضب يأتي على,550,3.267111301422119,3.4682745933532715,3.2624175548553467
73483,Ants haiku,jonathan,6,وزحفت النملات هذه الأرض نحو وبعيداً عن ديارهم وجنود من القوم الحمر,69,2.875338792800904,3.064230442047119,3.2290380001068115
39242,&apos;&apos;Jonathan&apos;&apos;,jonathan,6,ابتهج الى الآخرين الذين يطيعون امي بلطف لأناس نشطين عندما يلعبون بخداع في الاختبارات التي تساعد الفقراء المتعصبين لتعني ان الناس ليسوا كاتبين جيدين .,153,3.529681921005249,3.1902194023132324,3.235497236251831
92410,In your mind,jonathan,6,عندما يكون العالم في عقلك و لن يخرج من عقلك و لن يخرج منه تجاهلهم فقط فقط اربطهم و هذا سيفعل نفس الشيء,123,2.634528636932373,3.186281204223633,3.213486433029175
38821,Hi And Low,jonathan,6,يمكنني أن ألمس السماء أستطيع أن ألمس الأرض أستطيع أن أتسلق شجرة أستطيع أن أحفر حفرة أستطيع أن أطير في طائرة,234,3.505812168121338,3.40861177444458,3.334460496902466
59681,i love that dog,jonathan,6,ذلك الكلب الذي في الزاوية ذلك الكلب الذي تحت خرزتي ذلك الكلب الذي يلعق وجهي ذلك الكلب الذي أحبه,92,3.940773487091065,3.615227222442627,3.351808786392212
92406,UFO abduction,jonathan,6,(أوفوس) يختطفونك عندما تكون وحيداً في غابة مظلمة سيختبرك الفضائيون ثم يعيدونك بنصف دماغك,170,2.4884042739868164,3.284523725509644,2.9378087520599365
46790,"Victory, victory",jonathan,6,النصر، النصر أنت لطيف جداً جداً أنت تَعْرفُني بأنّني جِئتُ على نجاحي أنت تَعْرفُني بأنّه كان هناك سبب لتَكَوُّن النصرِ، النصر هو حلوُّ جداً a شيء للقاء النصرِ، إنتصار مَرّة حلوة للتَعَبُّد منك مَع تَوَفُّقِي أنا يَجِبُ أَنْ أَجتمعَ. والآن أَتْركُك أَجْلسُ في كآبةِ تَنْهِي الهزيمةِ، يَهْزمُ لماذا أنت تَسْرقُني مِنْ النصرِ حلوّ جداً؟ الهزيمة، الهزيمة، الهزيمة، الهزيمة، الهزيمة، الهزيمة أوه النصر، النصر، لماذا تَكْسرُ لماذا تَكْسرُ أنت تَتْركَني؟ ماذا سَيَكُونُونُ a إستهزاء؟ تَتْني؟ تَتْركُني خلفيُ في صفوفِ التجاهلِ.,651,3.76352596282959,3.7275404930114746,3.34391450881958
19518,Nothing to do with the Owl,jonathan,6,فسمع القطة والبومة رخوة على الباب مع السجادة الخضراء. فذهبوا الى الباب وسمعوا زئيرا وسقطوا الى الارض الصعبة جدا. فأخذوا ركبهم وفضّوا من بواغرهم وقالوا من هو الرضّ. فنظرت الزرع القطة حصاة كانت خضراء ولكنها لم تكن ما كان يعرف باسم الحصيرة الخضراء. فتحت القطة الباب الذي هو عملة لانه وراء الباب جلس فأرا سمينا ضخما جدا. وهذا التعريف كان كذلك.,486,2.719188928604126,3.413745880126953,3.014888048171997
23712,Dreams,jonathan,6,أرى أشياءً عندما أنام أتساءل إن كنت أستطيع أن آكلها ليس أنني أهتم لكنني حقاً لا أشعر بالرغبة في الذهاب إلى هناك. لماذا يجب أن أنام إذا كنت لا أستطيع أن أفكر لماذا ينبغي لي أن أمشي إذا كان هناك من لا يستطيع حتى الكلام. إن أحلامي مخيفة ومشعرة حقاً أحلامي تهطل وهي ضبابية حقاً. هذا كل ما في الأمر، لا مزيد من اللحم الفاسد.,323,2.3856096267700195,3.2759456634521484,2.9618079662323
24579,The Big Game!,jonathan,6,لقد كان وقت المباراة، كنا مستعدين كانت المباراة الثالثة، حتى أننا خسرناها بقوة، كانت لعبة صعبة، كنت مرهقة، وكانت هذه هي اللعبة الكبيرة!!!!!!!,156,3.264237880706787,3.6343398094177246,3.2911360263824463
84878,Football,jonathan,6,أنا أحب أن ألعب كرة القدم يمكننا أن نضرب بقوة ونصنع العدسات. الـ qb يمررها إلى الـ wr والـ wr cates في لـ a هبوط في النهاية منطقة. ثم ركلة الركلة إلى نقاط الهدف لـ a تربت. ثم يحصل الفريق الآخر على الكرة يحصل rb على الكرة ويحملها إلى نهاية المنطقة.,294,3.4830594062805176,3.392688751220703,3.341892004013061
48570,The Darkness of the Oceans,jonathan,6,المحيط هو أسود كقلب شيطان. أظلم يصبح كلما ذهبت إلى الأسفل. عضلاتك تشتد كلما استمريت. قريباً يصبح أسود. قريباً لا تستطيع التنفس. قريباً لا تستطيع أن تتنفس.,423,2.478318452835083,3.4527783393859863,2.8449578285217285
39523,The Wind,jonathan,6,الرياح باردة كالجليد الجليدي ولكن ساخنة كالبركان المستعد للنفخ. الرياح غالباً ما تجذب بابي لكنها تقنعني بعدم الدخول. أنت تحاول إيقافها لكنها فقط تستمر في الدخول. ما هي الريح التي تقولها. تتدفق في يوم جيد وسيء وسعيد.,302,3.203134059906006,3.3308751583099365,3.187518835067749
44071,How  I am,jonathan,6,يمكنني أن أكون سعيداً، يمكنني أن أكون حزيناً، أنا.. أنا..,105,2.468287944793701,3.2893972396850586,2.9505324363708496
84849,Every friday,jonathan,6,كل يوم جمعة في الصباح آكل الحبوب مع ملعقة وكل مساء في الخامسة آكل الحبوب مع خنزير,105,2.7605199813842773,3.001118898391724,3.1503374576568604
48345,A zit is a fly,jonathan,6,دائماً ما تُضايقُك هناك عندما أنت لا تُريدُه أَنْ يَكُونَ,62,2.687438488006592,3.124564409255981,3.059983730316162
34595,Love is.....,jonathan,6,الحب هو العلاقة بين شخصين ربما في يوم من الأيام يتشابكان أيديهما أسفل البديل. الحب هو الصديق الذي تحتاجه في يوم سيء وأخيراً وليس آخراً الحب هو الرابطة التي يملكها الناس إلى الأبد.,235,3.929157733917236,3.6267104148864746,3.3282723426818848
