id,title,author,grade,text,char,valence,arousal,dominance
50439,Bananas,sandy,1,تقريباً تقريباً كل ما بعد الظهر آكل الموز مع ملعقة مع ملعقة مع ملعقة كل مساء في الساعة السادسة تماماً,104,3.1327872276306152,3.125684976577759,3.2527575492858887
102714,Money Madness,sangeeta,1,المال يدفعك إلى الجنون، والمال يزعجك، والمال يعطي الحياة، والمال يأخذ الحياة! هل المال هو المال؟ هل المال يجعلك صغيراً، والمال يكسبك مالاً كبيراً يجعل منك مهنة، والمال يعطي مؤهلاً، والمال يعطي توصية؟ هل المال هو إله؟ المال منفصل عن الابن والوالدين؟ المال يرتفع إلى الجوع، والمال يذهب إلى الخلق، ولكن المال يؤدي أيضاً إلى الدمار؟ هل المال هو الذي ينتقد أحباءك؟ هل المال يتلاعب بمشاعرك؟ إنه يثير توترك؟ أنت لا تحصل أبداً على الرضا، لا يمكنك الحصول على الحب الحقيقي، لا يمكنك الحصول على تضحيات، لا يمكنك الحصول على صديق حقيقي! أنت تحصل على إغاثة من الله، وليس بالمال يا عزيزي!,1145,2.734090805053711,3.316041946411133,3.1090664863586426
27504,Cotton Candy,sanofar,1,و لكن من الممتع أن تأكل هل ستأتين معي اليوم لتشتري بعض حلوى القطن ثم سنلعب,141,3.855055570602417,3.5131893157958984,3.3366775512695312
60220,The Bad Giant,santiago,1,في وقت ما كان هناك عملاقا سيئا. انه لئيم جدا. انه يقطع الأشجار. لا تقترب منه، انت طعامه. انه يبطنك. بدلا من وضع اللحم على هامبرغره يضعك. عندما ابتلع شخصا في عضة واحدة. انت لا تريد ان تكون صديقه او هذه هي نهايتك. انه يعيش في كوخ بحجم 3 ترريكسات. لا تقترب منه او انه سيضربك. انه لئيم جدا. انه كبير مثل واحد تركس.,400,2.34732723236084,3.4175808429718018,3.171832799911499
105028,My Best Friend,sanya,1,أول أفضل صديق لي هو العجب من أنها أعطتني فطيرة. ثاني أفضل صديق لي هو سمكة ماكرة تحب أن تقبلني في عيني. ثالث أفضل صديق لي هو القطة السحرية التي تفعلها هي السحر بالنسبة لي. الرابع أفضل صديق لي هو الطيران هو المفتاح الذي تقوم به هي تطير بالنسبة لي. بلدي الخامس أفضل صديق هو ثلاثة أصابع هي تقبلني في أنفها وهؤلاء هم كل أصدقائي لدي.,352,3.76533555984497,3.585231304168701,3.266031503677368
119921,Friendship,sanyukta,1,عندما مشينا أنا وصديقي، هناك تحدثنا بكل لطف، كان هناك الكثير من الضحك، لم نتذكر كيف مر الوقت بسرعة كبيرة، أختي صديقتي، لأنه لا يوجد أحد غيرها التي يمكنني الاعتماد عليها،,280,3.679533481597901,3.4429736137390137,3.270817518234253
116772,Its you,sapana,1,أردت أن أتألق في عالمك. لكنك خدعتني ومصيري. كلماتك كانت جديرة جداً بالثقة بالتغير المفاجئ فيك كانت أسوأ حقيقة. لم تكن صرخة الناس مندفعة تسبب انفجار قلبي. لكن صمتها المروع في قلبك تلك القلوب الحقيقية. سخرية الناس تجعلني أبكي. فيضان الدموع يسيل من عيني كل مرة أريد أن أخفي دموعي. لكن من الصعب جداً ابتسامة مزيفة لأرتديها. أريد أن أعفى من سلسلة الأحزان. عندما يأتي اليوم أو إلى اللحد. تركتني مع الألم الكامل كخيارك. واليوم أنا أعطيه صوتاً.,587,2.396677017211914,3.417306900024414,2.969202756881714
83658,night,sarah,1,« في الليل » أي في كل ليلة « يكون القمر » فيكون « فتدقه في عينيَّ » في عيني « ثم يطير » في السماء فيكون في السماء .,73,3.156039237976074,3.2704906463623047,3.1575028896331787
81595,Poetry,sarah,1,(ب) و(ب) و(ج),28,3.159261703491211,2.916266202926636,3.1655595302581787
111314,Grace,sarah,1,لم تعرف الحب حتى عبرت خط النعمة. لم تشعر بالرغبة حتى فقدت الحق في الإيمان. لم تكن تعرف الصلوات التي تقولها، نحن نكتب لك. لم تكن تعرف أبداً الإله الذي تحبه يختارك. لم تستطع أن تسميه يوماً، لم تستطع أن تستقر لثاني أفضل، كان عليك أن تصدق، لم تستطع فقط أن تسير مع التدفق. تلك الحياة التي أردتها، كانت مخططة لك.,390,3.598479986190796,3.6153059005737305,3.265553474426269
16485,The Fairy,sarah,1,الجنيّة لديها قطّة القطّة تتفاوت بدانة القطّة التي أرادت القيام ببعض الرياضيات لكن الجنيّة وضعتها في الحمّام.,108,2.9655978679656982,3.037452220916748,3.134192705154419
97646,Flowers Colors,sarah,1,الورود حمراء البنفسج زرقاء الزهرة المفضلة لديك لون الإنفلونزا,68,3.2546310424804688,2.9985623359680176,3.176254272460937
65199,Looks like rain,saralin,1,الشمس صفراء، والسحب بيضاء، وأنا في موقع ممطر، الزلبيات التي على العشب حمراء.,109,2.9623336791992188,2.989955186843872,3.029958963394165
96286,PIZZA,sarin,1,تقريباً تقريباً كل ما بعد الظهر آكل البيتزا مع ملعقة مع ملعقة مع ملعقة كل ليلة تماماً في الساعة الثامنة,105,3.1862807273864746,3.281457662582397,3.251246929168701
53457,I am eating jellybeans,sasha,1,"أَأْكلُ حباتَ الهلامية للغداء هم لذيذون - unch, unch, munch, munch i يأكلون هلام البينات في التاسعة مع الفستق في المحلول",124,3.836299419403076,3.4794726371765137,3.372953653335572
54103,My dram boy,savannah,1,هذا الفتى لطيف اسمه تشانز يركب حافلتي التي هي الحافلة رقم 27 لديه حمالة صدر لكنه لا يزال لطيفاً أتمنى لو كان لي,124,3.9240810871124254,3.530806541442871,3.243565320968628
101164,Me,scott,1,أنا سمينة جداً أنا لست كذلك أنت لست كذلك لكن أرجوك لا تتنمر في مدرستي,121,2.6423821449279785,3.3941030502319336,3.4181618690490723
93794,A Lion On My Head,sean,1,فلما استيقظت في صباح احد الايام كان اسد على راسي. سألت ماذا تفعل هناك. فنظر الي وقال. زئيرا. افزعني وقال انا ذاهب لاكل سريرك الكبير.,181,2.5274126529693604,3.977729797363281,3.051072835922241
52995,Bagels,sebi,1,"في الصباح في الساعة الثامنة تماماً، آكل الكعك مع (ماري كيت) وهي تأكل الموز مع أصابع قدميها وتسعد من خلال أنفها ثم يأتي (سيبي) مع رفيقه المُتَجَلِّل ويُحدثون فوضى في لحظة ربما أقل حتى أقول لهم أن يخرجوا. ""اذهبوا إلى مكان آخر!"" أصرخ وأصرخ. وخرجوا مباشرة من الباب مع حيوان عائلتنا الأليف، الخنزير.",350,2.610138177871704,3.4811601638793945,3.207331895828247
21702,Twirlamouse,serra,1,تدور طوال الليل، وتدور طوال النهار في مجد الضوء اللامع تتداول الضوء بسرعة، وتدور جميع العوالق تذهب إلى الماضي تماماً، وتتوقف في وجهي التدوريات تذهب إلى المدن والبلدات تظهر تحركاتها، وهي تقفز وتقفز من مكان إلى مكان تنظر إليّ في الأسفل، وتدور نحوي.,270,3.441810607910156,3.4906489849090576,3.2137205600738525
103362,You are good,seth,1,"تفاني إلى أبّ. & lt; bb & b&gt; & & lt; br & gt; لا تُدخّن أبداً, & لا تُدخّن; b و gt; لا تشرب أبداً, & لا تشرب أبداً; لا تشرب أبداً; لا تشرب أبداً; لا تشرب أبداً; لا تشرب أبداً; لا تشرب أبداً.",101,3.109370708465576,3.035327434539795,3.286724805831909
58440,scarry bull,seth,1,كان له قرون حادة شعرت أنني شجّعت الثيران قصّة هو مثل a بقرة,64,2.806873321533203,3.3231515884399414,3.1334574222564697
66732,I Really Like Popcorn,seth,1,الفشار حلو، الكركلر حلو أيضاً يعجبني حقاً,63,4.3582305908203125,3.664384365081787,3.368394374847412
32405,BOY ATE CANDIES,shahbaz,1,كان هناك متجر به اسم جميل كان مالكه فتى ضفدع تفاجأ لرؤية ذلك المحل سعيد جداً,295,4.03432559967041,3.6489102840423584,3.320852041244507
37022,A Day Gone By,shakil,1,يكون الصباح مشرقاً عندما نرى الشمس الليل مظلماً عندما نرى القمر كيف يكون عندما تترك الشمس بصرنا.,132,3.105492115020752,3.0395750999450684,3.098916530609131
107532,Pig,shakirah,1,"عندما استيقظت ذات يوم، كان خنزير على رأسي. سألت ""ماذا تفعل هناك؟"" نظر إلي وقال ""هل تعرف أمي وأبي؟""",155,2.8369803428649902,3.307807922363281,3.0675642490386963
107619,Chicken,shakirah,1,كُلّ مساء تقريباً، أَأْكلُ دجاجَ مَع a شرنقة. كُلّ مساء حَسَناً في 6، أَأْكلُ دجاجَ مُكَدَّسَ على الطوبِ.,129,3.184536457061768,3.1207637786865234,3.250734567642212
19832,The Day the Sun Danced,shana,1,أنا الشمس لدي الكثير من المرح وأنا دائماً أرقص وأرقص دائماً أحب الرقص أحب الرقص أحب الرقص,134,4.147551536560059,3.8676071166992174,3.448275089263916
54723,Ocean Noises,shanda,1,من الأطفال إلى الكبار يفرقون الشاطئ. طيور البحر تتلوى بحثاً عن الأسماك.,157,2.911824941635132,3.455527782440185,3.0538747310638428
97046,Bears,shannon,1,دبي مهرج. ليس له عبوس. يحب طبقه. يأكل سمكا جيدا. هو مهرج بني.,115,3.4354119300842285,3.18048357963562,3.2517335414886475
97048,Bears,shannon,1,الدببة تحارب من أجل بقعة صيد الدببة لديها أنوف كبيرة وطويلة,85,3.224775075912476,3.0846710205078125,3.2152438163757324
113002,SNOWY,shannon,1,يُمْكِنُ أَنْ يَراك بعد الخريف أنا سَأَراك قريباً تَرْقصُ، يَذْهبُ مَع أزرقِ الصيفَ.,202,3.8352866172790527,3.469639301300049,3.2986867427825928
117606,Wanna hold your hand,shanu,1,أنا أعلم أنك ستأتين عندما يأتي الشتاء تتدفق الدموع تتدحرج في شيكات مع التاكيد العميق للحزن وتريد أن تتسكعي معي وأقول أنه سيكون على ما يرام لكنني لا أستطيع لأنه تم سحبي لوحدي في الماضي على الرغم من أنني لا أستطيع أن أكون مستقبلك,625,2.5731358528137207,3.398823976516724,2.9479475021362305
26556,My poem,shea,1,من ستلتقين؟ من ستقابلين؟ من ستقابلين؟ من ستقابلين؟ من ستقابلين؟ من ستقابلين؟,120,3.045747756958008,3.2139968872070312,3.1740024089813232
116619,Bright dazzling light,sheena,1,عندما فتحت عيني رأيت من أول نظرة لي الضوء اللامع اللامع للشمس القوية، لقد ضربني للتو، وظل يتبعني حتى شقت طريقي إلى مدرستي، كما دخلت مدرستي، كان مثل ذلك الضوء الثمين الذي اختفى... كل ما كنت أراه الآن هو الضوء من جسم اصطناعي...,475,3.0619683265686035,3.446749925613404,3.0382978916168213
113742,My Ball,sheila,1,لدي كرة حمراء، جعلت سقوطاً عظيماً.,43,4.008670806884766,3.531347751617432,3.4172451496124268
106522,Pritty cat,shelby,1,القطة الجميلة ما اسمك اسمي هو (إيلا) التي تعرق كثيراً منكِ (إيلا) لمساعدتي، سأراكِ مجدداً,111,3.675969123840332,3.368128776550293,3.230646848678589
48855,Roses,shellyu,1,"""الورود حمراء البنفسق زرقاء"" ""أحبك في الصين""",55,3.954739570617676,3.499110698699951,3.348449945449829
94325,The lady,shernet,1,وجهها كان له لهجة من قبل الشمس عيناها وحفرة عيناها التي لا تفلت من أي شيء لها الأنف لها,206,3.216371536254883,3.1799113750457764,3.2160909175872803
64547,My Family Loves Me,shiann,1,عائلتي تحبني كثيراً جداً جداً، نحب أن نعانق و نقبل و نلمس ونفعلها كل يوم، ما عدا عندما نكون بعيدين,117,4.113653182983398,3.711494445800781,3.3434298038482666
118052,"Goodbye Poems, True Loves Grasp",shishir,1,ممسكة بيدي مستلقية في احضاني وناشدة لي اقرب واحكم قبضتها ووجهها في الرمل والماء البارد والسوداء وواثقة من آخر كلماتها ولا تعود ابداً. غاضبه ومزعجة ومحطمة القلب وحزناً واريدها بين ذراعي واريدها في ذراعي واريدها شراً حقيقياً كما تفلت دموعي واحتضنها ولن تكون كما هي ابداً,342,2.5840084552764893,3.6404528617858887,2.9900267124176025
77421,What A Sight,shiskaboba,1,منظر جميل، غروب الشمس رائع، مثل هذا المكان لتكون,68,4.365784168243408,3.772052764892578,3.4192795753479004
53028,I am falling of a mountain,shivangi,1,انا اسقط من جبل اسقطه من جبل ، اهبط عبر الفضاء ، قد ترون ان هذا لا يرضيني بالعبوس على وجهي . وبما ان الارض تقترب اكثر من ذلك ، فمن السهل ان اقول ان لدي معضلة بسيطة ، ان يومي لا يسير على ما يرام . ان سرعتي تزداد ، انا اسقط كالحجر ، استطيع ان افعل ذلك ببعض المساعدة ، هل هناك شخص استطيع الاتصال به ؟ على الرغم من انني لا اخاف من السقوط ، فانني مضطر الى القول ان الهبوط يقلقني ، وليس لدي وقت طويل للانتظار . انا لا املك خيارات ، وهناك شيء واحد فقط متبقي لأجربه في الإحدى عشرة ثانية القادمة ، علي ان اتعلم الطيران !,653,2.585693120956421,3.3471388816833496,3.0073001384735107
81789,Spring  is   Fun,shivanjali,1,أحب أن أركض وأزهر الزهور وأحب الشمس أيضاً,74,4.218328952789307,3.5699915885925293,3.331493616104126
115854,The Cracked Wall,shroan,1,"رأيت جداراً متصدعاً، حالة ""فقير""، ثم يمكن للمرء أن يقول، يمكن أن يسقط في أي وقت. لكن كان واضحاً من يوم، الكلمة استخدمت بطرق عديدة. المكان بين أربعة جدران هو مثل السجن، ليس حر مثل الهواء، حيث لا أحد يهتم، من أين أهرب اعتدت على الفشل. يظهر السلبية، السلبية الكاملة، ولا النسبية تظهر الروابط المكسورة، بجانب أنها ترقد بحيرات وبركات كثيرة. ولكن لا يوجد جدار، بيني وبين صديقي، ليس على الإطلاق. لأن صداقتنا لا يمكن أن تنتهي أبداً. لا أحد يحب سلبية الجدار، ولكن الهدوء، والصمت، والقوة التي يمكن للمرء أن يشعر بها، هو حقاً أمر عظيم.",612,2.806133508682251,3.2008919715881348,3.0599310398101807
35187,Dad,sid,1,أبّي الشخص الذي يملأ حياتك، أبّي الذي يعتني بوالد منزلك الذي يعلّمنا الأشياء، لهذا السبب أبي لطيف جداً,166,4.0071282386779785,3.5280966758728027,3.3448402881622314
106496,All  about  me,sinterica,1,أنا حلوة مثل مايزي، ورائحتي جيدة كالزبدة، وكسولة كالجرايسي، لا أحب الأيام الضبابية و المزلقات المجنونة.,123,4.007716178894043,3.621591567993164,3.2866461277008057
52720,math,skygirl,1,عندما يعلّمني المدرسون الرياضيات يجعلني غاضبة آمل أن أستطيع أن أبلي حسناً في الرياضيات,93,2.5990939140319824,3.230477809906006,3.0566747188568115
107578,Pig,skylar,1,"عندما استيقظت في صباح أحد الأيام، كان خنزير على رأسي. سألت: ""ما الذي تفعله هناك؟"" ""نظرت في وجانب على!",159,3.303180694580078,3.5826127529144287,3.1512084007263184
107522,Cat,skyleigh,1,عندما استيقظت في صباح أحد الأيام، كانت قطة على رأسي، سألتك ماذا تفعل هناك؟,131,3.6306891441345215,3.446390151977539,3.239487409591675
107533,Cake,skyleigh,1,تقريباً كل يوم آكل الكعك مع قش كل مساء في الثانية أتناول الكعكة على القمر,93,3.64799690246582,3.383114814758301,3.316976547241211
116801,Day Dream,snake,1,لقد اقتحمت حلمي. لا أجرؤ على التذكر أنه كان حقاً أنت بجانبي. هل كنت أنا من سمح لك بالدخول؛ أو في الواقع أنت من اختار أن تأتي؟ يجب أن تذهب على أي حال مثل كل الأحلام التي كانت لدي من قبل. لكن طوال الصباح كنت أحاول البحث عن أعذار لأكتب لك. لسنوات كنت أتظاهر بالبرودة معك وأحاول العيش وحيداً. لكن الوقت يقول فقط لا: أنت بحاجة إلى وقت أطول وربما هذا ليس كافياً. للأسف! ما زلت أبحث عن ظلك بين تدفق الناس في كل مكان حتى في الجزء الآخر من العالم.,556,2.662017345428467,3.298425912857056,2.987121343612671
107094,"Oh, Man!",solo,1,أنت غريب جداً بالنسبة لي، يجب أن أتحرك يا رجل، يا رجل، يوم غريب إنه يوم غريب يا إلهي، أتمنى لو لم يكن يوماً غريباً,174,2.997915744781494,3.7621278762817374,3.0270564556121826
67942,Puppy,sonya lee,1,لطالما أردت جرو والآن لدي واحد اسمها (شو شينج),73,3.5379929542541504,3.319753170013428,3.339158296585083
74396,Craze,soo,1,عندما آكل كسارة، تقول أمي أنني في حالة صدمة! هناك شيء في الداخل يجعلني أشعر بالإستياء، وهذا يجعلني متعصباً! وعندما أشعر بالإحباط، أستمع للأغنية عابسة. عندها سأشعر بالسعادة الشديدة وأغني الأغنية إذا كنت سعيداً وتعرفها، سأصفق بيديك، وسأشعر بالعظمة والمعجبة! وهذا سيجعلني بارداً، لا يجعلني أحمقاً. وعندما أحتاج أصدقائي، سأدعوهم على الهاتف،,517,3.868213176727295,3.894951820373535,3.3983168601989746
112398,My Na Is Joe,sophia,1,اسمي جو. أود أن أقول مرحبا. لدي عدو. بعد ساعة واحدة. إلى اللقاء مع العدو. في اليوم التالي أكلت كثيرا. أنا ممتلئة. سأذهب لأجد ثورا.,151,3.296297550201416,3.260803699493408,3.251270532608032
114179,Backpack zipper,sophie,1,سحابة سحابة سحابة مثل أسنان سمك القرش التي تجعله مفتوحاً وقريباً,71,2.9131827354431152,3.136732816696167,3.0867908000946045
92014,ME,spencer,1,أسناني مصنوعة من الذهب، أحب الشطرنج، مشروبات الطاقة تجعلني متعباً، أحب الرسم. الطبخ هو شغفي، أريد أن أكون مهندساً معمارياً مهذباً.,151,3.775815725326538,3.505472183227539,3.312098264694214
93793,A Koala Bear On My Head,spiro,1,"عندما استيقظت في صباح أحد الأيام، كان دب كوالو على رأسي. سألت، ""ماذا تفعل هناك؟"" نظر إلي وقال. لن أنزل من رأسك لأنه مريح على سريرك.",196,2.982616901397705,3.379347801208496,3.188693284988404
23659,Smoile,stacy,1,أو الإبتسامة، هكذا تسير الأمور، أو كيف يتدفق الهواء؟,68,3.24108624458313,3.0870110988616943,3.190619945526123
47121,The girl who lost her hamster,stacy,1,"كانت هناك فتاة اسمها كريستين و أرادت حيوان أليف قالت: ""أريد خنزيراً."" قال والدها: ""لا!"" قالت أنني أريد هامستر ثم قال نعم! ثم قالوا نعم!",252,3.041830778121948,3.473063468933105,3.177683591842652
112147,My dad car,starlyn,1,في وقت كان فيه أبي عندما كان في سيارة لكنه يحتاج إلى 100 ماوني وأنا أقصّد له أنه يمكنني مساعدتك في الحصول على موني,237,3.264624118804932,3.25722074508667,3.266268014907837
35341,Happiness,starressa,1,السعادة لغز عندما تُغادر، لن تعود حتى يموت قلبك إلى أن يذهب، لن يعود. لكن حيثما يكون هناك أمل، يكون دائماً هناك ولكن أحياناً، لا يُلائم. بالرغم من أنك تتمنى عودته، لن يعود، حتى لا تُريده.,291,2.5929431915283203,3.127661228179932,2.922189235687256
103909,Readers,steffani,1,بهدوء ، وقراءة في عقولهم دائما القيام بعمل جيد دائما تذهب إلى مكان هادئ حيث لن يتم ازعاجك أثناء القراءة الذكية,121,3.2111620903015137,3.072062969207764,3.30669379234314
67264,Goldie,stephen,1,(غولدي) لديه معطف طويل من الفراء... ... وقالت إنها تطارد ذيلها... ... أحب أن تقفز لها على لي... ... أحب أن أسمعها تأكل طعامها... ...,169,3.4039077758789062,3.317943572998047,3.249029397964477
60422,Spelling Bee,stephiya,1,حصلت على اللدغة من قبل النحلة وأنا لن أقول لك أين. حصلت على اللدغة من قبل النحلة كنت مجرد مستلقية هناك،,189,2.34592342376709,3.6125741004943848,3.0167105197906494
93779,Bananas,steven,1,تقريباً كل أسبوع، آكل الموز بذروة، تقريباً كل أسبوع، آكل برتقالاً حلوّاً.,100,3.5701684951782227,3.252264976501465,3.3154942989349365
47533,Fireflies,steven,1,ويرقات النار لديها ضوء يخرجون في الليل مع النجوم والقمر أضواءها تخرج في الأشجار التي تعيش في الظلام.,136,3.18513822555542,3.0733888149261475,3.1227729320526123
112480,My 100 gift,steven,1,في وقت من الأوقات كان يوم خطتي في مايو 2 وأعطوني 100 هدية وافتحها وافتحها وافتحها,231,3.330498218536377,3.235420227050781,3.236355781555176
112145,The dog,steven,1,عندما أذهب إلى الأنمالز و بعض الخيرات و المُزارع المُحْتَلِف يُمْكِنُك أَنْ تَبقي الكلبَ يَجْلبُ الشهرةَ وهو يَحتاجُ ميني للكلبِ وهو يَبِيعُ الأشياءَ وهو يَبقي الكلبَ النهايةَ,172,3.224844217300415,3.143473148345948,3.28228497505188
85921,Weasels funny sleeping places,stuart,1,"عندما استيقظت في صباح أحد الأيام، جلس ابن عرس على رأسي، سألت، ""ماذا تفعل هناك؟"" نظر إلي وقال، أحب أن أنام على رؤوس الناس.",151,2.9743807315826416,3.2290573120117188,3.1183760166168213
99645,Birdful Help,sue,1,"عندما استيقظت في صباح أحد الأيام، كان هناك طائر على رأسي. سألت، ""ما الذي تفعله هناك؟"" نظر إلي وقال: لقد جئت أطير في النافذة، ورأيتك مستلقياً هناك. أخذت نظرة أخرى وهبطت في شعرك. في تلك اللحظة، فكرت الآن ماذا سأفعل؟ فتحت عينيك وبدأت تنظر إلى الأزرق تماماً. ماذا، ما هي المسألة؟ هل هناك شيء يمكنني فعله؟ لديك وجه حزين الآن، أريد أن أساعدك خلال ذلك. أخبرته عن مشاكلي. بدأ يضحك علي.",688,3.037338972091675,3.403106927871704,3.074584484100342
38881,Sunset,sumbel,1,في الصباح، أراك مشرقاً جداً، في وجهي.,55,3.70120906829834,3.6372551918029785,3.293907642364502
