id,title,author,grade,text,char,valence,arousal,dominance
119413,SITUATION,shloka,12,« و » اذكر « يومئذ » بدل من يوم القيامة « أَذْكُرُ » أذكر « الركض » في الجوار « ولا أَفْهَمَ » أعلم « ما العمل ومن يدعو » من الناس « وما » ما « يقول » له « ما يحدث الآن » أي ما يحدث الآن « فجاء » بالبعث « فذهب فذهب أبي » إلى الدنيا « فرأيت وجه أمَّتي » في الدنيا « وأضرت أختي » في الآخرة « قالت » لهم « كذبت عليها » فكذبت « فكيف أقول لها هي بعيدة عنا » عنا « في دار تجري فيها إجراءات أبي ولم تؤمن أمي ثم علمت ثم انكسرت مثل الثمرة من الشجرة » من الشجرة « فما نحن إلا لِمَ نحن » أي لا « إن » ما « هذا » الأمر « لَمُحِبَّةٌ » مجيبة على ما ذكر « إن الله كان عليما » بخلقه « حكيما » في صنعه « حكيما في صنعه » في صنعه « حكيما في صنعه » في صنعه « حكيما » في صنعه « حكيما في صنعه « حكيما » في صنعه « حكيما » في صنعه « حكيما في صنعه « حكيما » في صنعه « حكيما » في صنعه « حكيما » في صنعه « حكيما » في صنعه « حكيما » في صنعه « حكيما » في صنعه « حكيما » في صنعه « حكيما » في صنعه « حكيما » في صنعه « حكيما » في صنعه « حكيما » في صنعه « حكيما » في صنعه « حكيما » في صنعه « حكيما » في صنعه « لا في صنعه « لا في صنعه « حكيما » في صنعه « حكيما » في صنعه « حكيما » في صنعه « حكيما » في صنعه « لا في صنعه « حكيما » في صنعه « حكيما » في صنعه « حكيما » في صنعه « حكيما » في صنعه « حكيما » في صنعه « حكيما » في صنعه « في صنعه « حكيما » في صنعه « حكيما » في صنعه » في صنعه « في صنعه « لا في صنعه « لا في صنعه » في صنعه « حكيما » في صنعه « حكيما » في صنعه « في صنعه « في صنعه « لا في صنعه « في صنعه,509,2.1785330772399902,3.468535900115967,2.806771993637085
100064,The Beauty Within,shonda,12,الناس ينظرون إلى الخارج ولكن كل ما يرونه هو فئة لا ينظرون إليها أبداً في داخلهم لا تحاول أبداً أن ترى القصة الخاصة بك، سواء كانت سمينة أو نحيلة أو طويلة أو قصيرة، هل يمكننا أن نتعاطف؟ أو أن نفكر؟ إنها مهمة نلغيها. ما أحاول أن أقوله لكم جيداً هو أنه ليس من الصعب أن تلتزموا عندما ترون شخصاً ما في أي مكان ينظر إلى الجمال في الداخل.,351,3.298421621322632,3.359827995300293,3.290142059326172
120703,Just so that someone listens,shreya,12,أنا أحرق السكر لشخص آخر لكارميل، أنا أحترق على اقتراض أشعة الشمس، أنا أقترض الشمس المُستعارة... أنا خلفية الموسيقى لشخص آخر...,183,2.7254605293273926,3.119081258773804,3.0929770469665527
120704,Scribble of illusions,shreya,12,انا افقد اشياء مثل التغير السريع احب الاشياء كما لم تكن هناك ابدا انا افتقدك كما كنت اعرف انك اكرهك بالرغم من انني مازلت انتظرك انا انتظرك حتى عندما اعلم انك لن تأتي ابدا,402,2.857013702392578,3.4663474559783936,3.121898889541626
116203,You and i,shreyas,12,لقد كانت شهوراً وسنة، الأوقات كانت سهلة وأوقات كانت صعبة، لكن الحب الذي نتقاسمه كان دائماً هو نفسه أحياناً نحن نتجادل كثيراً، لكننا لا نستسلم أبداً، نحن نواصل إبقاء بعضنا البعض على قيد الحياة هناك ضوء في حبنا، قلوبنا قد تصبح مظلمة في بعض الأوقات،,1028,3.40889835357666,3.418240547180176,3.22820782661438
120161,Schizophrenia,shuchita,12,أستطيع أن أراهم، هناك، أعلى، في الزاوية، الشياطين التي أجلس فيها خائفة في الزاوية الأخرى ورأسي مدسوس في ذراعي ملفوفة حول ركبتي. إنهم مخيفون جداً، دائماً ما يهددونني. سوف يموتون، سوف يقتلونني، أرجوكم يساعدونني، شخص ما ينقذني. لقد كنت دائماً محبوساً في غرفتي بسبب هذا السلوك الذي تظهر فيه الشياطين دائماً ولم يكن لدي أي منقذ. صرخت لكن لم يستمع أحد قط، خدشت الجدران، أظافري كانت مكسورة. دموعي ملأت الدلوات، ولكن لم يستمع أحد من قبل. وفي يوم ما، جاء شخص ما إلى غرفتي، كان مستمتعاً، لأن غرفتي كانت بها بقع دمي أيضاً. سألني بعض الأسئلة وخلص أخيراً إلى أني غاضب لأنني ظننت أنه كان فاقد الوعي لأنني كنت أعرف أنني كنت مصاباً بالفصام.,770,2.3491673469543457,3.4943552017211914,2.9257583618164062
116121,I love myself,shwetha,12,أتمنى من نفسي أن أكون صادقاً أن أعرف نفسي أحب كثيراً أن كل يوم أنا جديدة جداً,122,4.177199840545654,3.7468435764312735,3.4554011821746826
114252,You And I,shyam,12,إنه أنا الذي في السماء يغني، ومعي أنت الملهم الأيام لنا، وأنا أقول، لأنني ألعب المزح معك الوقت هو وقتنا، مؤكد تماماً، ولن أسافر بعيداً أنا واحد خلال النهار والليل، سوف نكون واحد، أنت و أنا.,457,3.4413161277771,3.470709562301636,3.364615201950073
114253,A Broken Thing,shyam,12,شيء مكسور يمكن أن يكون هنا، شيء مكسور يمكن أن يكون هناك. شيء مكسور يمكن أن يكون من حجر مهزوم، شيء مكسور يمكن أن يكون من عرش مهيب. شيء مكسور يمكن أن يكون ملك عظيم، شيء مكسور يمكن أن يكون من جناح عصفور. شيء مكسور يمكن أن يكون من قلب حبيب، شيء مكسور يمكن أن يكون من جزء من الحياة. شيء مكسور يمكن أن يكون من جمال بلا حدود، شيء مكسور يمكن أن يكون من معاهدة الأمم. شيء مكسور يمكن أن يكون من فتى حالم، شيء مكسور يمكن أن يكون من طروادة ذهبية. لذلك كل شيء يمكن أن يكون مجرد شيء مكسور.,554,3.0468015670776367,3.168801784515381,3.1534526348114014
114254,The Lady That Came In His Dream,shyam,12,ما الذي يمكن أن تكون عليه؟ هل أنت كذلك؟ ما الذي يمكن أن تُحَمِّلَه؟ ما هي نظرتك وما الذي يناسبك أيضاً؟ ما الذي يمكن أن تكون عليه، أُحَمِّل، أُبْلِك، لا أُبْدِيَ فيك؟ لا أرى أن ما نراه غير صحيح. 'لقد قابلتُ فتاةً في حلمي تُسْرقُها حُرْمُزُجُها كقُدْرَةٍ وَتَنْفُخُ شَعْرَةً وَوجَهَا وَرَأَتْهَا كَانَتْ فِي أَلْبَيْسِهَا وَلَدَهَا وَلَدَهَا وَلَدَيْهَا وَرَأَتْتْنِيْهَا وَأَرَتْأَنَهَا وَنَا لَنَا لَيْسِيْرَا وَا وَا لِيْرَا لَا لَا لَا لَهَا وَا لَنَا لَا لَا وَا لَا لَا لَا لَيْسَا لَا لَا لَا لَا لَا لَا لَا لَا لَا لَا لَا لَا لَا لَا لَا لَا لَا لَا لَا لَا لَا لَا لَا لَا لَا لَا لَا لَا لَا لَا لَا لَا لَا لَا لَا لَا لَا لَا لَا لَا لَا لَا لَا لَا لَا لَا لَا لَا لَا لَا لَا لَا لَا لَا لَا لَا لَا لَا . وَا لَا لَا لَا لَا لَا لَ,1240,3.1848180294036865,3.482755184173584,3.125128030776977
116838,Musings at Midnight,sid,12,تلمّع وتلمّع وتلمّع، فالنجوم تتألق وتشتّخ في أروقتها وتُعلّق الضوء عليها، ليس مشرقاً، ومع ذلك يُمَكِّنُ نظر صوفي الأرض على هذه الليلة الرائعة,933,3.4584312438964844,3.3693501949310303,3.2039623260498047
42217,Worse than pain,sidney,12,لا يُمكن أن يُوضّح لي أنّ الجرح الذي لديّ لن يُشفي حزناً يُؤخّرني,73,2.172779321670532,3.28865909576416,2.869438409805298
118820,A.D,sihle,12,أتذكر عندما رأيتك لأول مرة كنت أعتقد أنك متشددة جدا وكنت على حق كنت منزعجة من وقت الضحك الذي مر من قبل كنا نتحدث لفترة من الوقت كنا نتحدث في حين أننا لم نكن نعرف لماذا تغيرت مشاعري,602,3.2393369674682617,3.596489429473877,3.1904189586639404
110620,Mirrored Worth,siliane,12,نحن نعيش في عالم حيث سيحاول الرجال أن يظهروا للمرأة أنها تستحق ذلك، سيشترون لنا الألمس واللؤلؤ وإذا استطاعوا أن يشتروا العالم لكن ما هو عليه من صبغة طبيعية,2029,2.8098440170288086,3.314467191696167,3.1447174549102783
22199,I don&apos;t want too,silly,12,أنا لا أقول شيئاً تقول أياً كان ما أقوله إذا قلت ذلك,93,3.312443256378174,3.25037693977356,3.3143627643585205
119276,NOT HURT BUT WOUNDED,simbongile,12,أنا لست مجروحاً بل مجروحاً. لقد تحدثت عن لسان لا أعرفه ولا ستعلمه أختي الحبيبة أبداً. لقد جرحت قلبي بفظاظة في قلمي,527,2.7974853515625,3.5133700370788574,3.1950037479400635
120699,Flying Stars,simon,12,هم مثل شمس صغيرة، إشعال الليل. عرض مبهر للألوان، مثل النجوم التي تسقط من قمامة السماء. هناك شيء حزين قليلاً حول الألعاب النارية رغم ذلك. يشعون بمثل هذا التألق، وللحظة، ضوءهم يملأك بالدفء. يتلاشى بعد لحظات فقط، يملأك بالوحدة. ليتحول إلى مجرد وهم، يضيع في النسيم. ليختفي أمام عينيك، مع فقط ذكرياتك الدافئة المتبقية. عندما تفكر في ذلك و#x85; هناك شيء وحيد حقاً حول الألعاب النارية.,532,2.83824110031128,3.2376456260681152,2.997680902481079
105260,??????? idk,simona,12,أنا أحب تشيز,15,3.70894193649292,3.2858150005340576,3.265753030776977
110402,Alligators,sincere,12,كل مرة يضربون فيها المشي المرئي خارج الماء بينما ينظرون إلى كل التماسيح الوضيعة تكون متكدسة جداً، وهي دائماً عصبية جداً. جلدها خشن أيضاً، نوع من العطب. التماسيح طويلة جداً يمكنك أن تلعب كرة الطاولة. من الغريب فقط أن التماسيح لا تخاف أبداً.,311,2.7618930339813232,3.158724784851074,3.0669727325439453
73948,Panaromic Ideogram,sindhu,12,إن هذا هو الرأي الذي يعكس في تلاميذي، أو في كل مرة يكون لدينا لقطات من الأحمر يتساقط من الأرض، أو في كل مرة يكون لدينا في نهاية المطاف، وهذه هي النتيجة، تثبت عظمته وقوته تماما، وتجلب الإنسان إلى قمة الإدراك، وأن المتعة العالمية هي كل ما يحيا من أجله، وأنه يتحكم في كل شيء وكل شيء في نهاية المطاف. لا تختبر صبره، وإلا فإن التدمير لن ينتهي أبدا، ولن تقطع أنت من يطيل حياتك، ولن تفرض هذه المعاناة على الإنسان.,1127,2.61514663696289,3.2979989051818848,3.0709989070892334
115538,Never too late,sisqo,12,« و » اذكر « إذ » لام قسم « نفك » نسير « في الأدمة » الكفر « إلى أن » لام قسم « نُصَدِّق » نأمر « بالباطل » بالباطل « إن نحسِّر » نحسِّن « ونريد أن نرجعه » إلى ما قبله « فلا نؤخر أنفسنا » نرجعه « حتى تكون الأبواب » أي الأبواب « قريبة » من بعضها بعضاً « والقول » أي ما ذكر « هو خير » من ذلك « لو كان باب واحد » من أبواب الدنيا « مفتوحاً » .,286,2.844019651412964,3.194780111312866,3.185712575912476
116648,The Devil&apos;s Harvest,siyabonga,12,"لقد زرعت بذرة في وسط حديقتي، وسقيتها بمشاكلي، نمت بكل ما في وسعي. استنزاف قوتي، إلى جرة من الضعف. أنزلني إلى أسفل منخفض جداً، إلى أن لم يكن هناك شيء غير معروف. ساعدتني على التضحية باحتياجاتي، من أجل رغباتي. أعماني من أفكاره، في الواقع لا أستطيع أن أرى. إلى أن جمدت للحصاد. آخرون يدعونها خيانة، أقول ""الحصاد الشيطاني"""".",1791,3.169058322906494,3.037999629974365,3.2013914585113525
116296,I don&apos;t know,skk,12,لا أعرف أسباباً غريبة، خارج نطاقي، لا أعرف أشخاصاً حول العالم يلجأون للتموي، لا أعرف و أنا لا أعرف و أنا أحمق،,282,2.3242616653442383,3.3587770462036133,2.758798837661743
28652,The Bees,skratchingweasel,12,وكان في وقت من الايام سرب من النحل. الذي كان ساكنا في موقف من الاشجار. وكان هناك قد جاء على طول نسيم. فباتوا كلهم يتجمدون.,123,2.7149345874786377,3.0771875381469727,2.9793813228607178
103979,Just A Girl?,skyler,12,أنا حصلت على هذه الفتاة الجميلة جالسة بجانبي، أتمنى لو كان لديها شيء لي مع شعرها الطويل الأشقر، وقالت انها سوف تجعلك مفتونة انها جميلة جدا... ... انها جميلة جدا... ...,352,4.11884355545044,3.9259886741638175,3.4012346267700195
55100,school,smokey,12,كم من الوقت نتعلمه فقط 13 سنة منه فقط تعلم لا لا لا لا,78,3.4060206413269043,3.2646803855896,3.198565721511841
55054,coo,smokey,12,* * * * * * * * * * * * * * * * * * * * * * * * * * * * * * * * * * * * * * * * * * * * * * * * * * * * * * * * * * * *,34,2.8353047370910645,3.137094020843506,3.047194242477417
120479,I am still standing,sneha,12,"هناك طريقان أمامي أسأل نفسي، ألا ترى؟ ""لا تزال أجزاء قلبي المكسور تتكسر وتنهار في أحد الطرق تجعل والديّ يفخران بالآخر، بلدي فخور بمسار يطلب لعقل مفكر آخر، قلب قائد غير ذاتي ولكن عندما أبدأ بالسير في طريق مفكر يبدأ قلبي بالغناء أن أغنية مختلفة أعلى من أغنية الذنب والتشويش احتجاجاً على أن الأخرى المناسبة لي بالكمال أنا ذاهب لاختيار المسار الآخر",1564,2.80552077293396,3.330493688583374,3.089009046554565
116803,Love for my sister,sohil,12,الحب لأختي عظيم جداً، أفتقدها حتى أيام الغروب. قلبي يذوب عندما أتذكرك. يا إلهي! لا يوجد سبب يجعلني أستطيع أن أنساك. رغم أنها أختي من أم أخرى،,427,4.068068981170654,3.780467748641968,3.3537580966949463
115697,Cruise on Mandovi River,soma,12,لقد كان من حسن الحظ أن يكون لدي رحلة بحرية على نهر ماندوفي. مع مخدوع من الدخان، تركت سانتا مونيكا الأرض بشكل خطي. قامت بتشديد سردها على طول الجدول، وتدوير الماء بعيداً وواسع النطاق في ضوء شعاع القمر العاكس. بينما بدأ النسيم من البحر، كانت الاشجار على الضفاف تشتعل مثل الفزاعة. بينما تحركت السفينة أكثر مع هز الماء، كان الناس على اليابسة يبحثون عن واحد تلو الآخر. القوارب الأخرى والحروف الأخرى كانت تمر صعوداً وهبوطاً، كانت أضواءها الداخلية تشبه النجوم والقمر. وكان القمر والنجوم بجمالها وجمالها أغلى كرامة للطبيعة. في الكوخ، كنّا في عالم غامض - المواد الغذائية، الغناء، الرقص، كل شيء، كان لدينا. وكان المغني يغني بصوت مضغوط، كان يزيد من فرحة المسافرين. كثير منهم كانوا يرقصون وينسجمون مع الهتاف حيثما كانت المرحلة بعيدة أو قريبة. كان ذلك هو السحر المذهل الذي انتهى في ساعة ونصف الساعة، ثم عادت المغنية إلى الوراء إلى ضفة النهر مرة أخرى، وكان هناك الكثير منهم يرقصون وينسجمون بالبهجة حيث كانت المرحلة بعيدة أو قريبة.,1115,3.5383505821228027,3.42880916595459,3.228748083114624
111085,Dead Girl,sonia,12,لا عيون، لكنها لا تزال ترى كل شيء، لا أنف، لكنها لا تزال يمكن أن رائحة السقوط، لا الشفاه، لكنها لا تزال قادرة على قبل، لا قلب، لكنها لا تزال تشعر به كسر، لا عصبية،,237,2.532994747161865,3.4816861152648926,2.91028904914856
100130,The light and the darkness of my Lady Vivian,sorin,12,سأبذل كل ما في وسعي لإنجاز مشروعك، الله يبتسم لي، ولأنني سعيد جداً داخل نفسي كشاعر متوهج أنا الحياة الحزينة جداً معارضة، وأنا لا أعرف ما يمكنني أن أختار الأبيض أو الأسود! كل هذه من أجل حياتنا هي سؤال بسيط: أن يكون أو لا يكون! هل هو أبيض! هل هي صباح، أسود هي الليالي التيتان والضوء بدون النجوم,735,3.548239231109619,3.5196774005889893,3.215727090835572
53684,Im cool,soumya,12,أنا جميلة جداً جداً جداً جداً جداً جداً جداً جداً جداً يا لجمالي كم أنا جميلة نعم نعم نعم لك ولي,123,4.360431671142578,3.846827507019043,3.3673949241638184
102045,Love,sovanny,12,لماذا هو يسمى الحب إذا لم يكن الحب مؤلماً يجب أن يكون شيئاً سعيداً لماذا الحب دائماً يجلب الكثير من الألم للقلب! هل تعتقد أنه سهل أن يحب؟ الحب يؤلم أكثر من أي شيء تريد فقط أن تشعر بالأمان والطمأنينة ولكن لا أحد تحب أن يحميك!,276,2.7592215538024902,3.584531784057617,3.058096170425415
116033,Car crash,spencer,12,بدأت تمطر في الساعة الثالثة من صباح هذا اليوم لذا كانت الشوارع مبللة عندما كنت أقود بينما كنت أقود بينما كنت أدير سيارتي تسيلت بدون سابق إنذار لتجنب السكة الحديدية كنت أسعى,590,2.6894876956939697,3.2778263092041016,2.999009847640991
76532,Fun,spencer,12,العالم ممتع، بينما يمضغ الكعكة، العالم ممتع! لماذا هناك يا راهبة! العالم مرح! والآن أنا انتهيت، أكل الكعكة! العالم ممتع!,161,4.529612064361572,4.032215595245361,3.4999818801879883
118708,Good Bye,srija,12,بعد اليوم لا أعتقد أننا سنلتقي ولكن ذكريات الأيام التي قضيتها معك هي حلوة جداً. هل سبق لي أن قلت لك أن ابتسامتك تركتني غير مهذبة؟ لا أملك أي كلمة لأشرح لك أنني قد تحطمت، أنا لن ألومك لأنني أعتقد أنك لم تكسر قلبي حان الوقت الذي خانني، الذي حطم، دمر، دمر كل ما لدي من ائتمانات. هل يمكنني يوماً ما الحصول على الحق لأحلم بك؟ حتى لو كان كابوساً، بالنسبة لي سعادته لرؤيتك,710,3.370657444000244,3.6150107383728014,3.207283496856689
99686,Just Me,stacey,12,"كنت أتمنى لو أستطيع أن أكون، الشخص الذي أحب أن أراه. مرة واحدة فقط لا يمكن أن يقولوا، ""يستطيعون البقاء."" ملكة حفلة موسيقية أتمنى لو أستطيع أن أكون، التي أحب أن أراها. ""ضع التاج، الجانب الأيمن للأسفل."" في مشهد الفيلم، أتمنى لو أستطيع أن أكون، الشخص الذي أحب أن أراه. ""هذا هو دورك، إنه دورك، حان دورك أن تقاضي."" أنا الشخص الذي أحب أن أرى من أستطيع أن أكونه هو ""فقط أنا"".",385,3.506635904312134,3.4206578731536865,3.293332576751709
21774,Loving Her,stacy,12,عندما أكون معك الخلود هو خطوة بعيدة، حبي لك يستمر في النمو مع كل يوم يمر. كنز الحب هذا الذي أعزه في نفسي، كم أحبك لن تعرف أبدا. تجلب الفرح إلى قلبي لم أشعر به من قبل،,479,4.111545085906982,3.783867359161377,3.367806196212769
21869,Lust or Love?,stacy,12,لجعلها في الحياة أن تكون زوجة شخص ما إلى الحب، الشرف، والاعتزاز للمشاركة في وثني الذي من شأنه أن يتألف من لا شيء ولكن الحب أن يكون تكريم,232,3.5125439167022705,3.622986078262329,3.383859872817993
53001,AS SOON AS FRED GES OUT OF BED --- My Version,stan,12,بمجرد خروج (فريد) من السرير، وملابسه الداخلية على رأسه، والعديد من المرات قال والده،,102,3.0374884605407715,3.220313787460327,3.1969032287597656
119456,Winter.,stanzin.,12,مغلفة ببطانية. منطقة مغطاة بالدخان. يمكن رؤية المصممين، فقط في المسكن. إنه موسم الاجتماع. على عكس الثلاثة. الأشجار العارية، الحائط النصف عاري، لها جمالها الخاص. واجبها يجب أن يتم من خلال مواجهة هدية باردة. هذه علامة على الصبر، العمل الشاق والحب. القيود. المطحونة. ولكن أولئك الذين تغلبوا على انطباعه إلى الأبد. إنها تجربة حياة ربما تكون قد خلقت. الكل يجب أن يمر، حيث لا مكان لفرصة ثانية. وبالنجاح، البقاء يصبح ممكنا. إنها طريقة جيدة للتحقق من صبرهم، ومثابرتهم، وقدراتهم، وما إلى ذلك.,570,3.315718650817871,3.2137725353240967,3.239132642745972
95102,Water,stars,12,عندما يتساقط شيء ما أسفل ظهري، يعرف ماءه من دون نقص. يمسح قميصي نظيفاً وجافاً، فهو أيضاً لا شيء. بسبب النهر الذي حفظه.,161,3.013805389404297,3.18131685256958,3.200069665908813
111938,Be well,stefan,12,لا يمكننا البدء في فهم سبب ذهابك سريعاً إلى الحب للاستماع إلى الفهم هو ما فعلته، بدون مطلب لماذا يذهب الناس ويتركوننا هذا شيء لن نعرفه أبداً,390,3.071012496948242,3.3422114849090576,3.117055177688598
105907,The Perfect Summer,stefanie,12,في الصيف أحب الذهاب إلى الشاطئ، بدلاً من أن يكون شخص ما يُعلّم الصيف هو 100 حلم مثالي في كل شيء ولكن يبدو أنه قد لا ينتهي أبداً يجب أن أخبرك شيئاً واحداً على الرغم من ذلك،,404,4.230258464813232,3.893224954605103,3.4626896381378174
74361,Feelings...,stephan,12,لقد قابلت هذه الفتاة ذات مرة وظننت أن لدي فرصة حياتي البسيطة في رقصة رائعة كانت لدينا لحظاتنا و بسرعة سقطت عندما فجأة تحولت إلى جحيم تحدثنا لفترة و تبادلت الكلمات لم تشعر بأننا كنا على حق,449,3.767441511154175,3.838155746459961,3.308082342147827
52834,Darkness,stephan,12,حركة في الظلام المتحرك بشكل غامض,58,2.940596580505371,3.0837836265563965,2.994715690612793
