id,title,author,grade,text,char,valence,arousal,dominance
120523,The sun in my life,jacqueline,12,"the day we met we where both shy,  not really talking as time went on we shared things our dreams, thoughts, even our future.  you made me smile in my darkness moments you are the sun in my life,  when you leave my sun will no longer be with me i will be put back into darkness",275,3.6540780067443848,3.603845596313477,3.25396990776062
91074,Pritty picture,jade,12,there is a picture in my house that just sits there. its an angle holding a dark red flower with its petils ready to fall.  and the frame is gold with little dotes and swerves thye angle is pale.  that is my pritty picture. ,223,3.125317096710205,3.160308837890625,3.183411836624145
120909,Quintessential Quiet,jaelie,12,"the frost of winter warms my trodden heart to hear footsteps crunch on the frozen lake while my eyes whisper the coldness of art and shivering lovers reach for snowflakes.   knitted by christ; kissed by god trees struggle to move their white branches under that holy blanket sacredly marked by the snowflakeâ’s dances  back mindedly,  questions arise of this purity:  a speckled fawn nibbles at the spotted snow oblivious to where it came from or where it may go. ",464,3.3623287677764893,3.3787589073181152,3.2148196697235107
120908,My First Sonnet,jaelie,12,"sandy feet trampled the gravel softly while burnt ears remained open and afraid,  while their sun-kissed backs turned to the shadows,  asking their creator,  â“why are we scarred?â” faith gone,  nothing was heard.  subconsciously,  however,  the brains of the broken saw their master violently running through fields of black and white petals on one flower.  tripping over their heartsâ’ wishful thinking and falling into ditches of despair,  they clung on to their last vision of hope.  while finding their glory,  they knew they were no longer separated by pigment.  joined,  heart to heart,  for blood is red in all. ",608,2.801438808441162,3.4150874614715576,2.9895522594451904
22903,See me,jaime,12,see me do you trust my life do i come to you with tears upon my open eyes see me do i care look upon my misery do i even dare to end a life  so precious and full of layers that are full with emotions that the world seems to never care see me do i looked thrilled to be in a world full of chills `cause of all the hate of our enemies raping all of our memories by shedding the innocent peoples' wills why stop peace? for it is well it stops people from hating and stops our blood from being spilled. ,502,2.4120795726776123,3.5202040672302246,2.928300380706787
94231,Pain,jake,12,"surrounded by fire my clothes inflame my skin burns,  i have now reached the point of no return.  the smell of burnt flesh travels in the air,  then the screams of pain apear out of no where.  where am i? is this hell? what did i do to deserve this? are the questions that are running through my mind.  hoping to find an answer of some kind.  im scared.  i donâ’t know what to do.   this hurts.  im frying.  god please help.  please help.  i didnâ’t do anything to deserve this.  please help.  please help.  please help. ",508,2.279847383499145,3.6230974197387695,2.878450870513916
103518,Ozzy,jake,12,"ozzy,  the little devil he'll never stop he'll never calm down ozzy,  chasing him around the yard  having to give him a bath ozzy,  the love of my life the reason i get up in the morning the reason i dont get up in the morning ozzy",231,3.619821548461914,3.757280826568604,3.3638269901275635
116050,Sonnet 1,james,12,writing tis a loss of valuable time it leaves my peanut mind aâ’scrambling how doth a single soul make his work rhyme all the pointlessly tick tock rambling oh and i think where to i go aâ’flow topics leading me to total dismay alas i still do not completely know for it seems my mind it cannot quite say oâ’but the wonders of it bring me joy and yet unto this momentous moment my wondrous mind it can tend to ploy the thoughts that seem to fully dissolve it writing is a mind-boggâ’ling puzzle game no two works are exactly the same,536,3.273205518722534,3.5059962272644043,3.1155202388763428
91077,Green,james,12,green is like money in the bank           green sounds like rusting leaves         green taste like greens                   green is a great color to think about,165,3.5066938400268555,3.211354255676269,3.231373786926269
60274,The waves of the seas,james,12,the waves smashed and clashed  towards the darkness of a flash  it seemed like the clouds were suddenly mourning for mash!,125,2.4697251319885254,3.5470616817474365,2.912388324737549
108115,Watermelon Kiss,james,12,"stars so bright against the darkening night i search and search for one just right.   i look for only a second and already i reckend that a star like this does not exist.   but then i look to my side and what do i find? laying next to me a star so divine.   not up in the sky where she ought to be but laying right here next to me.   the most amazing star  that i ever did see sent from the skies to me how could this possibly be?  i've never done anything to deserve being handed everything but here you are my shining star.   my heart's about to burst love i no longer thirst for in you i have found the greatest love around.   but looking back on  all the pain,  the hurt and the lies shows me you really are a star and they were just fireflies.   but i'm no longer a kid with a net chasing flies i'm all grown up and ready to shoot for the skies.   but i can only make it halfway so once again i ask you to fall and i promise to catch you can you trust me? it's your call.   so if you fall an i catch you i will never let go and believe me when i say this because it's my heart telling you so.   so there's two things i ask of you your love is one and the other is this a watermelon kiss. ",1186,3.5930004119873047,3.662174701690674,3.308363676071167
119712,Sippy cup,jamie,12,my mommy never gave me my first sippy cup.  my mommy never gave me my first birthday present .  my mommy never gave me my first christmas present my mommy never gave me a chance too meet her my mommy gave me away like she never wanted me my mommy really hated me my mommy never wanted me i am her mistake of her life she never gave me a chance too call her mommy she is my stranger that i never met in my life,410,2.400952816009521,3.429041862487793,2.938401460647583
109215,One Divided by Two,jamilah,12,"i,  me,  myself,  two personalities very diverse as i walk through rough ways and hallways,  i find myself to be masculine,  not masculine as a man to be.   i seem to be the boss of my own authority i hold my ground and manage to make it seem as if i have strength of a body builder.   i admit,  i have muscles to hit someone harder like a boxer at a box meeting for training,  my status is an aggressive woman of light brown tone,  shorts,  button down shirt,  not your normal 17 yr old female.   growing on the south side streets of chicago made me that way,  white t-shirts and hoodies,  aggressiveness throughout every street and subway station.   other 50 percent of me is sweet,  sometimes shy and loving,  dislike to fight,  but to fight with my kindness,  i would rather have you to talking and wasting your breath,  instead of me hitting back 10 times harder i use my words of wisdom.   sweet as a honey bee,  i'll give a shirt that lies on my back,  a shoe that my foot sinks into,  my hairs give to donate.   i'm not your average person.  i'm sweet as honey,  but i can sting like a bee,  or maybe a snakes two front teeth.   i am who i say i am,  i can do what everyone is capable of doing,  i have two personalities,  i am me. ",1214,3.0908145904541016,3.317790269851685,3.3079323768615723
111466,Waiting,jana,12,waiting i sit in the dark waiting for him to come back to me can he hear my cry? can he feel my tears? can he sense my breaking heart? god only know such a fact why i waiting for him,185,2.3568248748779297,3.3761229515075684,2.7821004390716557
100153,Love Kills,janedra,12,"i am pouring my heart and soul to you seems as if you can't appreciate whats real or the truth i think it was stupid of me to express my feelings i should have known it was a dangerous hand i was dealing you should have jumped on it and made some out of it then i would have put that gun down and release the trigger yes i was about to kill myself if we couldn't be one it's the truth no need to front i love you that much i would take my life leaving family and friends is something i would sacrifice i can't stay on earth and see you happy with another girl so it makes no sense to stay in this world if i can't have you i don't need nobody else because you were the only good thing i had left so if we can't be together so long my friend dang i shouldn't have let this begin i just can't stay and struggle seeing you glad cause i'll be depressed and stupid mad it's time for me to take my last breath wish you were here to witness my death it's all your fault that i'm feeling crazy all you should have did was let me be your baby (pow)one to the heart (pow)one to the head on the floor in my blood, now i'm dead!!!!",1121,2.388145923614502,3.62486720085144,3.0507595539093018
110837,Greed,jasemin,12,wanting more money power all tho more more more take what i can  give nothing back greed that  is who i am that is all i will be   put you agents me and we shall see who is the best at greed you or me,203,2.934584140777588,3.2639660835266118,3.312705039978028
58716,love me,jasmine,12,love me one   love me two  but i love you,44,4.482158660888672,3.832090139389038,3.4223473072052
104120,My Brother,jasmyn,12,"i am sunshine.  i wonder if i can bring my brother back.  i hear his voice inside of my head .  i see his reflection in the mirror.  i want to see him one last time.  i am lonely without him.  i pretend not be sad.  i feel sad, frustrated, and angry.  i touch his clothes and his most pride possessions.  i worry about how my life will be without him.  i cry everyday when i see his pictures.  i am liked a lizard without its tail.  i understand that he is in heaven.  i say to myself",472,2.450995922088623,3.4097273349761963,2.917307615280152
104330,Falling in love,jasmyn,12,falling over someone is very beautiful.   but when you get heartbroken you cry.   crying over someone you are really falling for is stupid.   they takes it has a joke. ,167,2.450803756713867,3.5071511268615723,3.023407459259033
32470,Kids,jason,12,kids are like a spaceship you try t okeep them on target sometimes they stay off course sometimes you lose contact but one things for sure they always come home,163,3.168506622314453,3.157589912414551,3.249128580093384
32472,Life,jason,12,life is like a rollercoaster you have your ups and downs it goes faster when you want it to go slower but when the ride comes to an end  so do you!,153,3.215543746948242,3.6365129947662354,3.28287935256958
32475,911,jason,12,flying high in the sky  unseen by the normal eye iam about to strike with fury as the sky turns black against that  blue sky your never safe,148,2.581584453582764,3.66733455657959,3.1411209106445312
32301,Animal,jason,12,i trot through the darkness the moonlight shining a path  i am a creature of the night unseeen by the human eye i lay in the brush  waiting for my prey then i strike. ,169,3.009220838546753,3.3558950424194336,3.2302372455596924
36917,America&apos;s Halo,jason,12,you've ripped the wings  off of butterflies spilled the youth  out of children's eyes cut the rope we wanted to climb but your demon stare doesn't scare me in paradise you lit a fire called it hell they believed you for a while you know your your illusion is  about to expire and now i can see who is really alive time  and  time again i searched this world for something  something that would last and time  and time again i see the shadows of what once was pass  just to find  gemini and a scarabs night open the doors to the other side. ,542,2.877211570739746,3.4591140747070312,3.1341707706451416
111512,Praise GOD,javier,12,"though this feels hopeless and with no point,  i will thank the lord and with all my heart rejoice. ",101,4.147279739379883,3.74917221069336,3.3473615646362305
107441,Kobe bryant,jay,12,they call he the the best all most better then jordan he beat the all time lakers scored points one game he score 61 points in 1 game i think he is the best ever but not better then jordan i think he can be a legend number 8 and 24 can go down in history lakers won 8 championship boston has won 9 championships i think kobe can dunk good to me some people like kobe better the leborn,387,3.5781874656677246,3.4746439456939697,3.382807970046997
119572,Rarely Found,jaykob,12,"i am out of reach from most.  i am an eternity of happiness and affection yet is found by little.  i am a easily comprohendable subject.  i am seen by all found by little.  i am hope,  trust,  and togetherness yet different intirly. ",229,3.480563163757324,3.3384358882904053,3.211989164352417
50147,Are you dead or are you sleeping,jaymes,12,hey sam they  said what are you doing sleeping dead sleeping i know  quietl-ee whatis that  sleeping dead sleeping or are you dead sleeping i said sleeping give us your mind sam entire body dead sleeping dead where you were  i know of nothing but life and death and sleep,274,2.561413288116455,3.25974702835083,3.0061724185943604
115994,Charcoal Reign,jazmin,12,"you believe you know what you are saying,  but in reality you donâ’t have a clue.  i think your judgement might be decaying,   because your statements seem to be untrue.  youâ’re always in command,  to never sway,  with eyes of burning pieces of charcoal.  where caged in this jail you force me to stay,  i am losing myself,  my heart,  my soul.  i am strong,  but you know where i am weak you use my own fears against me in vain,  like you will earn you the respect you seek,  but i will give you not respect but pain.  but not for too long,  your reign will soon fall.  my will is strong and my shadow is tall. ",599,2.486661434173584,3.313527107238769,3.044447183609009
110693,"Hey God,",jean,12,"hey god,     did u mess up?  when u made mankind.   i mean the different  different races of humankind.    hey god,   did u think  this out,   the human race.   hey god,   there, s a mess down   here-on your earth.   hey god,   i hope l'm not wrong  in asking?  hey god,   we need help,    hey god,   could we human have  heaven.  now?",326,2.842756509780884,3.374100685119629,3.0992696285247803
36187,Nature&apos;s Song,jeanette,12,"i get up in the morning.  go to the river to wash up.  i hear the trees whistling,  i smell the flowers.  i hear the ducks quacking.  i see the trout jumping.  i go back to the house to get my fishing stick.  go down by the docks.  the pond is like a flowing blanket of water,   i put my line in and wait for bite i lay back and watch the ducks soar listen to the trees sing there song smell the different fragances of summer lunch time as arrrived time to pack up and fish another day i walk down the trail there was a squirrel on the red maple tree munching on a niblet of corn each side of the trail you see for miles pine trees &amp; oak trees. ",643,3.30603551864624,3.153839349746704,3.21741247177124
52164,Where do dreams come from?,jeanie,12,"why does the wind whisper through the hollow trees,  where no one wanders,  looks,  or sees.  how can it be that it is make believe,  or a fairy tale under lock and key?  in this place a star will shine,  and is smaller than a ball of twine.  with crystal spectrums through a glass,  or is calmer than a rambunctious class.   when discoveries do take place,  finding them will take no hace.  when in doubt you do find out,  where this place is donâ’t shout it out.   from the back of childrenâ’s audacious minds,  where ideaâ’s and pretending make a chime.  for this is much very much more,  than behind your own secret door.  \t\t\t",621,3.112492084503174,3.234695672988892,3.19905424118042
89840,River,jeehan,12,i have been in the river  it is cool like silver     i have been on the bridge  looking dawn at the river     i have seen ducks in the river moving  the view is normal and amazing     the river is like life it is moving  never have to end and stopping      if you have been in the river after the rain the water goes so fast like a train,346,3.73431921005249,3.489738941192627,3.2870748043060303
111979,For Whom The Bells Toll,jeff,12,"in the darkness i lay my head the shadows my pillow,  fear my bed this empty black is comfort,  it is my home i canâ’t escape it,  no matter where i roam once i was happy and garbed in light but the darkness came and gave me night i watch them all,  the ones that grieve i envy them for they can leave and i am stuck,  trapped in this hell and i am sick,  never to be well i envy them for they are free and that is something iâ’ll never be but they donâ’t know the power i grab and with it i choose who i stab they will come with me and they,  iâ’ll break if they knew,  iâ’d burn at the stake but that is useless for i cannot die so forever i am trapped in this lie to madness the darkness has me driven and for my crimes,  iâ’ll never be forgiven this is my life,  and eternal plight and i canâ’t break free,  no matter how i fight i am the cause of all that is bad and the source of all that is sad so i sit waiting for the end and the will the guides me refuses to bend i am trapped,  watching the free i envy them for the things iâ’ll never see and i take them,  each has their turn they will come with me,  come to learn they hide in shelter to wait for knock shut their doors and twist the lock but they canâ’t escape the darkness from which i stem and now they know i do not envy them for i am death,  and their lights start to dull for i am death,  and for them the bells toll",1373,2.7226195335388184,3.3379814624786377,3.0151984691619877
84485,Words,jeff,12,"words they are near or far short and slim they come from within releasing, telekinising pleasing my inner membrane no longer bcoming insane   a changed melody another felony  but still the same words absurd to some but my purpose in earth release these words before my mind bursts resorting to writing when my life hurts down on my last dollar not letting it show most dont know it but my lifes one of a poet.  jk",414,3.132363796234131,3.335427761077881,3.2140512466430664
104547,Let me love you,jeff,12,day by day night by night the moon in the sky shining so bright theirs  many things i love and only few things i like the first time i saw you i knew you was my type  the outstanding love you show and give make life for me easier to live as we lough play and feel baby. i want you by my side till the day i die,312,4.101863384246826,3.824636697769165,3.4203145503997803
69576,Aiagater,jeffery,12,crunch crunch munch munch that's the thing he did b4 he was in my lunch,76,3.0840234756469727,3.020249366760254,3.223769187927246
57645,the pink slothes with no noses,jeffery willis,12,look a daisy i think i'm crazy how would i tell since i dont have  a sense of smell,86,2.6938695907592773,3.164422512054444,3.068365335464477
94740,The Most Amazing Hat,jeffrey,12,i've made the most amazing hat it sparkles and it shines its tall and pointy at the top with intricate designs  nine puff balls line the outer brim and bangles hang below the inside is a crimson red striped with bands of yellow  sporadic bursts of red and green splash its felted cloth its flashy with metallic gleam like an exotic moth  because i love my hat so much i'll wear it every day upon my head forever more my hat is here to stay,445,3.7874698638916016,3.591424465179444,3.3753974437713623
22406,Motherhood Is...,jen,12,your heart filled with joy as you watch your baby grow and with sadness at the same time.  your cheeks burning from smiling continuously at your little one just to see him smile back at you.  your tired eyelids as you rock your baby into a sleep that evades him.  your calm as you watch your little one peacefully sleeping in your arms.  your happiness as your baby squeals in delight at the little things.  your sense of pride with each new ability your little one develops.  your fear as you realize the awesome responsibility of raising this baby into an adult.  your outlook on life changed completely and forever.  your heart walking around outside of your body for the rest of your life. ,688,3.937601089477539,3.688022613525391,3.3063974380493164
113410,Writings,jenavieve,12,"sometimes i think my words are never beautiful that my words are only 26 letters of mundane all my words will ever be  are from a girl who is she?  iâ’ll write and write and write then one day,  maybe,  someone might say this,  this is my favorite  itâ’s all i ever wanted",273,3.5502610206604004,3.5521206855773926,3.317089557647705
116132,Mother,jenifer,12,"each step i hike up,   each strength of mine hike down the ship ,  each step i hike up the ship,  tears roll over my cheeks,   i turned back and saw my mum sorrow .      without hesitation,  i made a dash and told her,       watered plants are  not blooming,       unfed birds are still chirping ,       oh lord,       oh lord ,       oh lord ,       why are these happening ?      did you ever wonder it ? i know the answer,       the unbloom flower are waiting for your touch ,        the unfed birds are calling you to live in them for rest of days .   your memories ,   remain fresh in me . ",581,2.584808826446533,3.41263747215271,2.9704625606536865
49621,Trapped!!!,jenna,12,for sapphires we are held here only you can end our fear  until dawn we cannot speak  no words come from this sad beak  the first thing  you read contains the clue:  the initial way to speak to you,200,2.723867416381836,3.2734122276306152,3.049295663833618
118869,For He Is Mine,jenna,12,"you cannot have him for he is mine  on february 20th 2007 it was no longer miles that kept us apart,  but lifetimes.  it was then that i understood the void i felt when you left due to days of work would no longer be relieved with your return and only leave me with hurt something that a seven year old struggled to comprehend only with time did it take me to fully understand that with each day that passed,  your jacket would never leave the rack and never again would i have you there to always proudly pat my back you left me with sorrow,  a pain at which i had never endured a pain i felt so vividly,  an emotion that will never be cured with more questions than answers as to what was going to come i wanted nothing more than to leave this earth and be done as they packed your casket away into a wall that i'll never be able to reach any reason for the purpose of living became mildly oblique  no fury for a innocent child so badly scorned i became furious with my god who i no longer adorned whom i once believed to be my ultimate protector and guider above had selfishly ripped away the only person who i had every truly loved i begged and i pleaded for the chance of having more time i cried out to god you cannot have him for he is mine the only thing i have left of you now is of course your last name at which i proudly proclaim as it reminds me of the journey i overcame.  although you have missed so much,  and couldnâ’t watch your children grow that void once possessed me,  oh how little do you know i try to carry you with me every where i go hoping and praying that i have something for me to show that i have found my purpose in life again a meaning to life i am now able to comprehend healing my soul and minding my thoughts trying to make you proud with each chance i got your memory and absence can still bring me sorrow however it reminds me to be grateful of life and hope for tomorrow because with each new day im given im hopeful and pray that your watching me and guiding me each and every day i miss your mighty laugh that was able to fill any room and the presence you made known in which caused everyone to swoon the cussing,  the snoring,  and even the days with you that were boring you are nothing but a memory to me now but for this i must say,   the unconditional love i have for you will never go away.  i will no longer let your memory be plagued by grief and sorrow because your memory gives me a purpose for living and healing tomorrow and although though i know there will be tough days in which i'll make it out of just fine it won't take me long to remember that you are,  and always will be mine.  the best dad i could ever have through the test of time. ",2698,2.685508728027344,3.4139583110809326,3.0325286388397217
40737,Why Not,jennerfer,12,why not take a crazy chance why not it's a new romance just walk a little slower open up you eyes a little lower why not take a crazy chance why not it's a new romance,171,3.363607406616211,3.3511557579040527,3.296245574951172
40727,Snow,jennifer,12,"delicate snow is falling on my yard it covers the grass,  the walks and the boulevard.  the world looks so safe,  so clean and so sweet i put on my coat and put boots on my feet the children all play for hours on end  a huge snowball from my yard,  right at you i'll send",271,4.011917591094971,3.719039440155029,3.403674364089966
27338,My mom,jennifer,12,"my mom is the best,  she knows how to treat a guest,  she knows me like a book,  she is a good cook that is why my mom is the best. ",131,4.000151634216309,3.573968410491944,3.412806510925293
