id,title,author,grade,text,char,valence,arousal,dominance
32393,Markashia,markashi,2,hi my name is markasshia you should like me they say i am frindly i am shy   i like to eat pizza i like to typ and right when i grow up i want to be   a singr. ,162,3.376547813415528,3.2147035598754883,3.223646402359009
32387,Love,markasshia,2,ther onch was a man and a wormin and they were in love thay had 2 cildrin brother and sister they were a family they loved each other the end,144,3.764314651489258,3.4956729412078857,3.24182677268982
90378,Goofy Gordy,marlaneh,2,"goofy gordy went walking down town.  everyone thought he was weird.  the next day he went to town.  crazy on an electric scooter,  screaming and yelling,  ''woooooohooooooo!''",173,3.0136663913726807,3.8546104431152335,3.13000226020813
108266,Dangerous and Hungry,marley,2,"gray,  dangerous wolf hunting for food he feels full now!",59,3.392585515975952,3.711560249328613,3.3356077671051025
106435,This is a riddle poem,marlinie,2,it is either the sitting or waiting speed is the name of the game do not wish to be crushed spending time in space is agonizing time is money for some,153,2.529480457305908,3.117788076400757,2.9812204837799072
89662,My Sister,marterrion,2,"sister    annoying, small    biking, playing, jumping,      daycare, cake, cupcake, girl    running, laughing, talking,     funny, wild,     keyzaera",140,3.86197566986084,3.6512563228607178,3.3290932178497314
96327,I love my mom,martin,2,"i love my mom,  when she goes to work and when she stays home .  i get to have fun with her and she gives me hugs and kisses.  sometimes i call her mommy . ",156,4.195387363433838,3.6971359252929688,3.337152004241944
22668,Voice,mary,2,"there's a voice inside of you that whispers all day long.  it's telling you that you've done wrong.  no teacher,  parent,  wiseman nor friend can make you decide if you want to spend your life on poetry!",202,2.553297281265259,3.6012449264526367,3.228827714920044
57771,My Mom is Cute,mary,2,"roses are red,  violets are blue,  my mom is really cute,  and so are you!",74,4.185669422149658,3.7330782413482666,3.354846715927124
107893,Loving  my mom  and  dad,mary,2,i love  my mom and  dad i love  them so much that  i hug kiss  them,70,4.415541172027588,3.793179035186768,3.387352228164673
87219,Mother,mary,2,"mother   kind,  patient   loving,  snuggling,  caring   a special person in my life   friend",92,4.043893814086914,3.506293773651123,3.3651998043060303
106163,morshello eating,mary,2,every day at six  i eat marshmellow on a stick.  i eat tacos with kevin. ,74,3.1744585037231445,3.0407845973968506,3.242579936981201
27450,Sneezes,mary,2,"sometimes it hurts,  sometimes it tickles,  sometimes it runs,  sometimes it trickles. ",86,2.617410898208618,3.1954078674316406,2.972241163253784
85113,In the city,mary,2,"here we go out to the city,  where there are lots of cars and traffic.  here we go out to the city,  where there are skyscrapers,  the city has everything except for grass. ",172,3.1814498901367188,3.093735694885254,3.2141730785369877
85126,Good-bye!,mary,2,"now it's time to say good-bye,  but now  i don't have time to cry. i wish you could just stay my friend till the very very end.  i don't know if i'll ever see you again,  but if i don't i'll just have to make a new friend all over again.  now i've said to much,  so  if i don't say good-bye right now i'll never be able to talk to you again. ",338,2.3567538261413574,3.371697187423706,2.916677713394165
25770,Multiplication,mary,2,"oh,  multiplication oh,  multiplication you are not the least bit of a sensation why do i have to do you on vacation? why do i write you on the train station? oh,  multiplication oh,  multiplication you are not the least bit of a sensation. ",239,2.8132145404815674,3.175211191177368,3.041377544403076
85114,Halloween is the best,mary,2,"halloween is the best.  i like the witches,  ghosts and black cats.  i like the scarecrows and monsters.  i like the pumpkins and goblins,  but there is something i like even more,  the scares!",190,4.041255474090576,3.782953977584839,3.3612654209136963
85115,The earth,mary,2,the earth is a wonderful place where people and animals grow.  the earth is a wonderful place with beautiful areas.  the earth is a wonderful place that lets people live.  the earth has so many wonderful things about it. ,220,4.009803295135498,3.433504104614258,3.3518245220184326
26622,Pimple on my chin,mary,2,"i have a pimple on my chin.  it's like a brown bump on my skin.  once i poked it with a pin,  the cut was bright red and very thin.  that's what happened to the pimple on my skin. ",178,2.6881115436553955,3.1457090377807617,3.0769784450531006
26623,Black Cat,mary,2,"when i was coming home from school,  i saw a cute black cat.  upon the brick wall he sat.  when i was pretty close to home,  i saw a big brown bat he was busily chatting with a very nasty gnat.  he seemed to like the gnat,  i forgot to tell you that.  when i finally got home i wiped my feet on the mat. ",299,2.9921059608459477,3.2047011852264404,3.097163200378418
85292,Who I Am,maryann,2,my mom is cool acts silly sometimes really likes school yo-yos are cool apples are good nice noodles are my favorite,119,3.9377191066741934,3.4384357929229736,3.354902744293213
106725,Easter Eggs,maryelizabeth,2,"easter eggs,  easter eggs,  hard to find,  easter eggs,  easter eggs,  on my mind",79,2.7169413566589355,3.1382875442504883,3.0063366889953613
74180,The day I Saw a Superhero,marynna,2,one day i went to the park i saw a superhero it flied right by good night mom will you take me to the park yes there is the superhero the park is on fire the superhero will save us  we are saved  what is your name? the whateler,231,3.5873305797576904,3.6155660152435294,3.351616621017456
65133,The      Sky,mashaal,2,birds are flying up high in the sky.   sun is shining and making sky so bright.   rainbow also look so nice up high in the sky.   sky is filled with lots of stars and moon up so high. ,184,3.877105474472046,3.4739174842834477,3.259682893753052
106164,Eating,mason,2,"almost everyday at 2:00,  i eat icecream with a moo.  everyday right at 5:00,  i eat pizza with a knive. ",104,3.329771041870117,3.105294704437256,3.2389237880706787
106014,floor,mason,2,almost every afternoon i eat pie with a fly. almost every afternoon at four i eat soup off the floor. ,103,2.82667875289917,2.9816956520080566,3.097936153411865
107895,King fisher,mateus,2,kingfishers eat fish they're blue' green' brown' orange' gray and red they go in water it grabs  a fish  then it eats the fish,129,2.8289499282836914,3.165177822113037,3.128521680831909
119336,Morning,matilda,2,"when i awoke one morning  syssie was downstairs.  mandy was making breakfast,  because she really cares.  i changed clothes  i felt an itch on my nose  i went to play,  i was home to stay!",187,3.424562454223633,3.590518951416016,3.3211653232574463
84093,The Piggy,matt,2,"when i awoke one morning,  a pig was on my head.  i asked, ''what are you doing there?'' it looked at me and said,  ''my name is ted.  what's yours?'' ''matt,  get off me. ''  i said. ",200,2.8439059257507324,3.3579301834106445,3.2088983058929443
18393,Funny Animals,matt,2,"animals are fun,  wild,  weird and funny.  hey look,  there's a bunny.   animals can be pets too,  dogs,  cats,  fish,  birds,  snakes,  goats,  horses,  cows,  roosters,  chickens and pigs.   farm animals and wild animals are two different kinds of animals. ",247,3.5696825981140137,3.3916001319885254,3.291294813156128
29364,Easter  Egg,matthew,2,easter egg delivered by the bunny to everybody's house on easter day to make children happy. ,95,3.664486169815064,3.316196918487549,3.306910753250122
29424,I Wish,matthew,2,"i wished for a cat,  that was half bat,  with an eye patch,  using a match,  that was gray,  like a sting ray,  that says neigh,  and eats hay.  may i have this wish?",161,2.9155375957489014,3.139612197875977,3.1043789386749268
16590,Paramus 2-H,matthew,2,"tacos, tacos, taco i like the sauce.  you are my  buss.  you are very messy but i eat youer mauce. ",97,3.641794443130493,3.404310703277588,3.347283363342285
55597,the bees,matthew,2,"one day at five, i hit a bee hive, the bees stung me, but i only ate three. ",76,2.4506430625915527,3.3168671131134038,3.0337374210357666
82540,A Ball,matthew,2,i play with a ball oh look a wall  pop!!! game over!!,56,3.730834484100342,3.870869874954224,3.4534623622894287
53458,Whale Whale,matthew,2,"when i woke up  one morning a whale was on my head. i asked  what are you doing  up there? well,  you got washed  out to sea - so i made a bed. ",144,2.541508436203003,3.336372375488281,2.9842076301574707
78924,My Cool Teachers,matthew,2,my cool teachers go to movies with special features. ,56,3.646870613098145,3.380002021789551,3.2986297607421875
85731,My  dog is having  clog  lessons,matthew,2,my dog is having clog lessons.  he is late for a 3 day jog. he went to his hogs house. ,89,2.583547592163086,3.056556701660156,3.012148141860962
117526,The wacky warthog,mattie,2,there was a warthog who ate slimy stuff his name was pumba and he was like a puff. he had big nose and very small toes. he sang with a bang when i was a young warthog!,168,3.4101357460021973,3.542973518371582,3.2748520374298096
107907,My  friends,maureen,2,myfriends                                  myfriends                                 are the best                              my friends are wonderful  loving caring my friends,181,3.933871269226074,3.436650276184082,3.3124454021453857
15363,Pop Bottles Pop,maurquice,2,pop bottles pop  they pop all day  they pop so much  they go crazy  bing bang  there they go poppin  you better cover your ears  cause here comes  pop bottles pop to do pop mania. ,182,3.2876667976379395,3.588395118713379,3.231728792190552
16110,Meany  Moose and the Goose,max,2,"meany moose is meaner than ever! he bosses his parents around! his enemy,  the goose gave him a black eye! and meany moose cried so mean,   he was not called meany moose.  he was called baby moose!",197,2.242776393890381,3.74493408203125,3.1564645767211914
92494,Mac and Chees,max,2,cheesy cheesy mac and chees i want some noodols with extra chees. give me a doller mom pleas pleas i want some mac and chees. ,127,3.229866504669189,3.275961399078369,3.275243043899536
99125,My name is max,max,2,hi my name is max    i play the sax    and i always come home with tax    and then i go to jack's. ,101,3.2118847370147705,3.037287712097168,3.2190210819244385
107347,My     Dog,max,2,my dog likes to cuddle her colors are white and brown   she likes to play ball i think she is very tall she comes wen you  call   her name is ginger,151,3.4107446670532227,3.1907262802124023,3.2579119205474854
95521,Mom and Dad,maximo,2,"mom and dad by maximo    mom and dad you make me feel so good.   mom and dad,  you make me feel so calm,   mom and dad,  you really are the bomb.   i love you!",163,4.4796319007873535,3.921083927154541,3.3865675926208496
45991,Mrs. Fisher,maxine,2,genius the best works very hard works all the time i love her; i do good teacher nice person kind pretty likes kids,118,4.051683902740479,3.4850049018859863,3.375941514968872
44133,STARWARS ATTACK,maxwell,2,as i climbed into my fighter i wondered if i would survive.   the comander cried tie fighters coming in.  i shot bam wam kaboom i cried whaho three ties down.  three more to go said the comander.    so i shot again bam wam kaboom 0 left i cried so we landed back at base.  whaho i cried i survived. ,296,2.511037826538086,3.3990392684936523,2.8943419456481934
90536,Stormy,maya,2,&lt;br&gt;stormy is my dog. &lt;br&gt;he doesn't like frogs. ,62,2.861328125,2.919743537902832,3.136253118515014
90530,Dolphins,maya,2,i met a dolphin. &lt;br&gt;that lived in a coffen. &lt;br&gt; &lt;br&gt;,73,3.217409133911133,3.0771329402923584,3.159172296524048
89025,Panda Cubs,maya,2,i love panda cubs&lt;br&gt;then i found one in the bath tub,62,3.788054943084717,3.397615671157837,3.3408052921295166
89018,A Ballon Leapord,maya,2,ballon leapords are very rare but most people see them there    not on the ground there in the sky and thats how you see them,128,3.0424318313598637,3.0567798614501958,3.193805932998657
102125,Crazy Little Snowflakes,maya,2,"snow flakes falling on my nose,  plugging up my garden hose.  see them twinkle in the sky,  it just makes me want to fly! crazy little snow flakes all around,  feel the winter all around!",187,3.658291816711426,3.7632741928100586,3.3011012077331543
103210,Cat,maya,2,"a cat is loyal,  a cat is kind,  a cat is defensive and always on my mind,   a cat is furry,  sits on your lap,  a cat also takes a very happy nap. ",145,3.759035587310791,3.4475865364074707,3.290952205657959
107899,Flamingo,maya,2,"flamingo, flamingo running with pink flames graceful, peaceful  long black burnt wings beautiful, adorable, colorful, smooth running, racing, zooming by getting ready to  fly",170,3.812848091125488,3.555624723434448,3.2831592559814453
46503,Sun,mayur,2,"sun  is so dun,  dun  is so yun,  yun is so ton,  ton is so lon,  lon is so bun,  lun is so fun. ",94,4.008927822113037,3.627974033355713,3.3108160495758057
102543,Only  cake,mckenna,2,"oh mckenna oh mckenna what do you want to  eat?  ''cake'' i say  it's always cake how about some meat  eat vegetables and try my  soup  with  carrot  ''no soup,  just cake'' well,  maybe i can have carrot cake. ",213,3.4070043563842773,3.244712829589844,3.267751455307007
117192,My trip to spain,mckenna,2,"on my trip to spain i ate some rain and found a main, on my way to the bay, but the main turned out to be a man from maine, that trip turned out to be insane!",158,2.8014822006225586,3.547340154647827,3.111778497695923
117248,log,mckenna,2,"the dog licked the log,  the log didn't like the dog,  but the dog hid from the log",84,2.7224252223968506,3.1982667446136475,3.090216875076294
112517,Kids,mckenzee,2,"kids are pretty,  kids are witty.  some fly,  and some say bye bye.  some have fun,  and some run.  some like hats,  and some have cats.  some see bats,  some see rats. ",163,3.581723213195801,3.3202075958251958,3.260486364364624
53663,Cutie Pie Precious,mckenzie,2,"my baby sister is so-o-o cute,    she's a precious cutie pie.   she's gone ''ha !  ha!'' twice !  i love my baby sister,  you will too.  but the worst thing is. . .  stinky diapers,  crying,  weeping,  this is what i think,  wah,  wah,  wah!",231,3.9021658897399902,3.985352754592896,3.3778984546661377
100947,baby,mckenzie,2,baby  are  cute  baby  are  soft  baby  loves  us also  their  mom,69,4.200835704803467,3.675595760345459,3.385031223297119
56952,Rainbow,mckenzie,2,"red,  orange,  yellow,  green,  blue,  all the colors bend some say theres gold at the end",88,3.375332832336426,3.240324020385742,3.2352139949798584
56955,Turtle,mckenzie,2,"there was a little turtle,  who lived in the rocks,  before the rain destroied his box,    home is where the turtle lives. ",123,3.035914897918701,2.987889289855957,3.1368212699890137
56953,Fat cat,mckenzie,2,"i have a fat cat,  he's lazy,  he ate daisy,  that cat,  he ripped my  hat,  i said scat,  what a cat, ",99,2.1479172706604004,3.640099048614502,3.2433598041534424
78088,Rainbow,me&apos;shira,2,a rainbow a rainbow i like them they are pretty because they are  colorful some people like them  some people don't i like to see a rainbow,142,3.644329071044922,3.2972488403320312,3.237919807434082
28111,About dreams,meagan,2,"if you have a hard time dreaming,  think of reading.  think of colors in the sky,  and think if you could fly.    if you think of books,  and if your mom's a cook,  you're doing just fine in the time. ",198,3.389636516571045,3.2035470008850098,3.3061368465423584
21819,If my Mom were,meagan,2,"if my mom were a tree she'd be an oak standing.   if my mom were an animal she'd be a dog that would run as fast as a deer in the meadow.   if my mom were a bird,  she'd be a robin singing in  a tree.   if my mom were a rose,  she'd have millions of butterflies surrounding her.    if my mom were a mom she'd be exactly as she is. ",327,3.3360488414764404,3.2080955505371094,3.203949213027954
83038,Blueberry Pie,meg,2,"it could be hot,   it could be cold,  it could be in your frig.  but mark my word. . . your'll like it, jest don't throw a  fit. . . you will like every bit of it. ",160,3.614212036132813,3.3732593059539795,3.413909673690796
95605,My teacher,megam,2,very nice great singer faithful worker truthful person excellent teacher,75,3.892456531524658,3.3304600715637207,3.3303041458129883
47437,Flowers,megan,2,i wonder if they like to bloom.  i quess they do.  they are always near another bloom.  they never are lonely.  some people cut them for display.  they are beautiful anyway. ,171,3.532322645187378,3.257669448852539,3.283501386642456
69885,Frogs,megan,2,my frog is quick but if he kisses me i think i'll be sick.  my frog is also green but some childrn think he's really not so mean that little slimy thing. ,155,2.6554818153381348,3.2508082389831543,3.105196237564087
22183,One Morning,megan,2,"when i awoke one morning,  a monkey was on my head.  i asked him,  ''what are you doing?'' it looked at me and said,  ''you look like a monkey and you look like me too. ''  when i awoke one morning ,  a stork was on my head.  i asked,  ''what are you doing there?'' it looked at me and said,  ''i'm playing a game it's called pull your hair. ''",338,3.078472375869751,3.370628595352173,3.160393476486206
48537,Morning,megan,2,"when i awoke one morning,  a stork was on my head.  i asked,  ''what are you doing there ?'' it looked at me and said. . . .    i am   to say  i have to warn you i have to",167,2.6419894695281982,3.6922311782836914,3.155916929244995
106128,Almost Every Afternoon,megan,2,"almost every afternoon,                    i eat ice cream with a raccoon.         every evening right at six, i eat bread fresh on sticks. ",139,3.3775124549865723,3.159665107727051,3.272042989730835
57157,Heather,megan,2,happy person energetic athletic terrifect has faith easy going royal,71,3.783012390136719,3.3900070190429688,3.333105087280273
15990,The Rainbow,megan,2,"rainbow,  rainbow,  rainbow,  sunny rainbow,  rainny rainbow,  beautiful,  wonderful,  colorful, rainbow last of all best of all,  best rainbow rainbow,  rainbow,  rainbow,   i like rainbows,  rainbow are colorful all the time,  last of all best of all,   prettiest rainbow. ",262,4.2191033363342285,3.753040790557861,3.3198184967041016
15920,Earth,megan,2,"earth,  earth,  earth,  planet earth,  america earth,  green,  blue,   american, earth last of all best of all,   best earth. ",119,3.54012393951416,3.2926275730133057,3.3020896911621094
15869,America,megan,2,"america,  america,  america,  state   america,   united america,  people,  animals,   flag,   america freedom for the people   america,  last of all best of all,  america!",164,3.5382299423217773,3.5917983055114746,3.3805601596832275
55692,WHAT?,megan,2,every dinner after my pork i decide to eat my soup witha frok!,65,3.73256254196167,3.7016172409057617,3.430059671401977
108800,Little Rose,megan,2,"little rose you are everywhere outside, playground little rose i love you!i wonder how you live? do you know?",111,4.079114437103272,3.760605573654175,3.353250503540039
16634,Spincih 2-D,megan,2,"i hate spincih,  it`s really yucky,  it`s really bad and really bucky.  it`s really really mucky,  to bad  it`s not so funky. ",126,2.269979238510132,3.1573638916015625,2.9470925331115723
106491,Mittens,meghan,2,"mittens oh mittens how warm they are,  that's it this is to hard!!!!!",71,3.2669899463653564,3.6514697074890137,3.196866750717163
102759,What  am I ?,meghan,2,i am very soft.  i have a very long tail.  i can be black.  i can be orange.  i can meow.  i like to lick.  i like to sleep and i pounce.  i like to cuddle up.  i chase mice.  i live in a house. ,188,3.342151641845703,3.2143659591674805,3.230001449584961
107688,Gods on earth- The V.I.PÂ’S,mehak,2,"ordinary people who clear the toughest tests,  become eligible to rule the rests.  earlier,  the people who had minimum value in the society,  now have power to rule the people full of anxiety.   these scholars open for themselves a different world,  now eat dishes different then dal and curd.  like every expensive piece of jewelery ,  there are different colored lights to adorn their precious gallery,  governments serve as gods in giving these lights to people of different ages,  and using these lights the v. i. p rules over a couple of roadside rages.   besides the precious lights to adorn their cars,  these gods are also blessed with guards making them the real stars .  these guards have different guns,  to secure their precious funs.  moreover , on the roadside , their cars too get protection,  as the geeps of the escorts drive away people of every section.   on the whole if gods exist in this world of fame they remain engulfed in partial blame. ",947,3.2018775939941406,3.192577362060547,3.249398231506348
105891,MY MOTHER,meina,2,"my mother is pretty and beautiful.  my mom is cool when i get good grade.  my mom likes glod  and rings.  my mom likes pink, purple and white color.  my mom likes flower and plants. ",179,3.945744514465332,3.438570022583008,3.269984245300293
119892,My Big Toe,melanie,2,my big toe always first the leader of my body knows where to go  i love my big toe round and fat  glistening with red polish standing in line ready for a show  my big toe is brave and ready to save the day although she can be stubbed it doesnâ’t bring her down she keeps on going  as she walks me around,309,3.7320377826690674,3.642521381378174,3.3801276683807373
42107,My  Seeing  Eye  Puppy,melanie,2,he is very cute.  fosse is a  great dog.  i  love  him very much,65,4.311716556549072,3.620469331741333,3.354196310043335
21823,If I was,melina,2,if my mom was a bird she would fly up in the sky  if my dad was an oak tree he would be strong  if my cousin was a unicorn she would let me ride on her  if i was a cat i would play nice  if my mom was a cheetah she would run as fast as a car  if my cousin was a spider he would make a spider web  if my mom was a dolphin she would jump waves. ,345,3.3463897705078125,3.29774808883667,3.220790147781372
29369,"Owl, Owl",melissa,2,"owl,  owl in a tree at night  you hoot so loud it gives me a fright your hoots go on all though the night my ears are hurting and it's almost daylight. ",153,2.7406609058380127,3.532140254974365,3.0255048274993896
40000,Animals,melissa,2,harry scary animals.  i like them because  they are merry.  wow those are cool  say my freinds.  they usually will  say can i have  one.  and guess what  i say. that is right! i will say no way.  they are mine don't you  think they are mean? no they are cool says my friends. ,272,3.668854713439941,3.618335008621216,3.346386671066284
103177,Babys,melissa,2,babys are cute babys whine babys cry all the time  likes to play with you sometimes scream and yells but happy all the time  babys babys fuss and whine babys cry all the time!,178,3.43926215171814,3.549041748046875,3.279327154159546
63192,I Like,melody,2,roses are red    roses are red  violets are blue i like my hair more than you!,86,3.7878808975219727,3.672958850860596,3.30898666381836
74437,Uhhhh,meranah,2,i don't know i don't care i don't even wear my underwear! i went to school and i felt like a fool.  now i don't share!,120,2.0277113914489746,3.889145612716675,3.229827642440796
106665,Cats cats,meredith,2,could a cat be on a car a cat could be on many things tee - hee cats are silly say someone is on my car!!!!!!! again a cat on  a car today is an odd day someone is on my car. . . ,183,2.3777894973754883,3.676468849182129,3.131894826889038
36249,Books,meredith,2,"books,  books,  don't judge them by looks.  some are fat and some are thin,  and some you don't want to begin. ",109,2.880136728286743,3.001872301101685,3.226383924484253
109859,Life as an Apple,meredith,2,i am an apple.  i sometimes hang high from the sky  and sometimes i hang low.  i am so juicy  i donâ’t need to worry about water.  i just take a bite and suck and if i am  hungry  i will just eat myself.   i could eat and eat for hours  but then i would become too skinny.   all i would have is my feet and i would eat my arms.  i would reach the village and they would say what happened you are too skinny . ,405,3.3153796195983887,3.520473957061768,3.3181395530700684
112499,Merritt,merritt,2,my backhandspring is pretty good even my brother can do a cart weel rides every rollercoster righing is my favrite subject i have a cat a mom a dad and a brather tries to help every one toutlly loves dounuts and olaf,219,3.807530403137207,3.4803712368011475,3.3503258228302
107357,Jellybeans,mia,2,almost  every morning. . . . . . well my friend think its boring i eat jellybeans.           sometimes i eat them with a fork some days i eat them with a snork.    i like to eat them in my house. sometimes i invite a small gray mouse.    i love to eat them in the sand . i like to eat them  with my hand.    i like to eat them with a frog and sometimes with a old hound dog. ,365,3.245418071746826,3.106630325317383,3.2087504863739014
28379,A  Rainbow,mia,2,"rainbows are colorful and bright.  some colors are yellow,  blue,  red,  green,  orange,  pink,  purple,  and black.  there also other colors.  if you get to the end of one,  you may find a pot of gold. ",194,3.5277745723724365,3.2839980125427246,3.2651965618133545
39412,Stinky Cheese,micaela,2,stinky cheese you make me sneeze.  i'm not pleased stinky cheese.  i got measles from you stinky cheese.  mom has died and you ruined my pride.  my dad sighed.  now i have to go bye and i think i know why. ,203,2.04941463470459,3.5531222820281982,3.0629546642303467
