id,title,author,grade,text,char,valence,arousal,dominance
101591,Colorful books,sara,4,"i can see a book that is red,  in my own garden shed,  there are many books that are green,  mostly it is read by teens,  i saw a book that was yellow,  it had information about marshmallow,  i am reading a book that is blue,  would you like to come read too?",302,3.224317789077759,3.106405258178711,3.1998870372772217
14006,Everyday,sara,4,everyday i wake up everyday i eat syrup everyday i go to school everyday is alwyas cool,90,4.001014709472656,3.6215803623199454,3.3769452571868896
118352,My hair,sara,4,"oh i love my hair,  the best part of me it helps keeps my neck warm and in the summer i put my hair in a pony tail to stay cool.  the 1st thing that people see is the best part of me.  i can do it in waves , curly , straight pig tails,  and a pony tail.  this is my first accesorie when i dye it,  or even fry it .  this is my hair,  smooth blond and even tangeled .  this is my heads arrangement so i style it. ",403,3.763604402542114,3.468351364135742,3.354710340499878
47403,Hands on Homework,sara,4,"hands on homework  oh,  great i canâ’t go out to play iâ’m trying so hard to finish but,  it feels like  i wonâ’t be done until day problems swirling in my head in a minute,  i might have a fit! but sometimes i just have to do it as long as i keep fighting i canâ’t start writing,  but i need to go out to play!",321,2.7535319328308105,3.594331741333008,3.159723997116089
47404,The Joys of Cake,sara,4,the joys of cake                                                                 icing purple sprinkles green inside moist and creamy words on top curled and white                        the heavenly taste so dreamy,219,3.999828815460205,3.593966245651245,3.297112464904785
47637,The Sailing Prep Work,sara,4,"the sailing prep work  iâ’m bringing my boat to the dock oh! just hauling i always hear the sea calling then,  i quickly turn to hear my teacher telling me to come oh! how i yearn! i can never start sailing soon enough sometimes though itâ’s tough just before,  i just have to learn more!",290,3.5461585521698,3.759120464324951,3.3304436206817627
42981,School,sara,4,"school is sometimes a pain,  when i make a b-.  mom and dad always say atleast you did your best.  how can you do the ar test when you have all that mess  your desk.  and so when you forget your homework the teacher will say don't blame it on your mom!  that's how school is. ",274,2.4717156887054443,3.289199113845825,3.091905355453491
27693,The Butterfly Who Wanted a Pie,sara,4,"one day a butterfly went out to buy,  a cherry,  cherry pie.  the owner said hi,  but he started to fry,  his new purple tie.  then he said that i,  should try,  to fly back later.  because there was a crater.  i did a sigh,  then started to cry,  and then i yelled,  ''i want my pie. '' and then i ''flew'' away. ",302,2.6143174171447754,3.458977699279785,3.0077264308929443
34007,The  School,sara and heidi,4,"my school is filled with many things,  like mean old teachers with golden rings when i go to lunch,  the teachers say: ''be quiet!''and get out of my way so as you can see,   the school is not a fun place to be!",211,2.6303248405456543,3.521371841430664,3.1508629322052
23786,Bunny,sarada,4,"i know a bunny,   that is really funny;  i  can not believe that,  that funny old bunny,  that little one,  is my honey. ",119,3.997747182846069,3.658921957015991,3.3264105319976807
60145,Crasy morning,sarah,4,i wake up and  i trip on my skatebord. then i look at the t. v and the news laidie says its april 1.  i go down stairs and i read a list of what my mom  says to do in the morning its always a dumb highgen thing and it said :have pissa for breakfast then coke to ddrink and candy for dinner and some selters on the side and at the end it says love         mom     p. s april fools!!!!,382,3.3787660598754883,3.514192581176758,3.278075933456421
52612,Spirits,sarah,4,"spirit of darkness spirit oflight guide me to the sweet sping nights,  winter be gone spring be here stop the darkness that i fear. ",133,3.5846850872039795,3.4689643383026123,3.2577900886535645
55941,sunshine,sarah,4,the sun is yellow the sun is blue all i want to say is love you. ,68,4.065835475921631,3.676058053970337,3.2773399353027344
28046,Candy,sarah,4,"candy is so very dandy.  i almost wish my name was mandy.  although the candy was very sandy,  brandy bought me some delicious candy",132,4.014121055603027,3.598417282104492,3.36676287651062
91135,"Children, oh children",sarah,4,"children,  oh children, you surley are cute.  when we go on th playground again we can go up the chutes.   children,  oh children,  i've always had fun playing with you.  since i love you so much i'll buy you new shoes.   children,  oh children,  i love you dearly.  thank you for loveing me back careingly. ",299,4.205714702606201,3.6899003982543945,3.3531181812286377
86748,Snow,sarah,4,the feeling of snow           is fluffy and cold        i like the way it feels                  my dog likes                 the cold ice          that she can put in her mouth                    i like the snow                    i really do                   i like to play and                      figure skate,317,3.73052978515625,3.39939022064209,3.278527021408081
42458,My New House,sarah,4,"my new house is full of charm,  we have 6 cows &amp; a little farm.  it's old &amp; shady with a couple of trees,  it's a great house for me &amp; my family.  my new house is warm &amp; comfertable,  this house is extremely wonderful. ",232,4.117424488067627,3.611594676971436,3.37909197807312
54461,Dark colors.,sarah,4,dark colors scars buildings nort-dame de paris i wish you'd lighten up i dream of chocolot with in you so i ask you one more time lighten up those dark colors of yours,170,3.089341878890991,3.2648262977600098,3.189427137374878
27872,Say a Prayer,sarah,4,"when it's morning time,  and i say a prayer,  i wish i am with god.  i say a prayer,  and love goes out,  to every soldier there.   say a prayer,  say a prayer,  pray for those that are in the war.   say a prayer,  say a prayer,  say thanks to those that are there.   pray that it will end very soon.  and that all will be ok.  say a prayer. ",332,3.404751300811768,3.3199520111083984,3.206530809402466
34709,Horses and Me,sarah,4,horses and me are the best i can be.  i love horses with tan patterns.  when i'm with horses i feel like i'm a horse and i feel safer than at home.  i also feel like i rule the world. ,183,3.9288482666015625,3.618186235427856,3.4370672702789307
26822,Cats,sarah,4,i have a cat.  it eats rats.  it sleeps in hats.  it plays with bats.  it rubs on mats.  i love my cat. ,101,3.85390853881836,3.5062263011932373,3.329579591751098
104240,Dragon,sarah,4,when i awoke one morning a dragon was on my bed. i said get off of there your messing with my head. it got off there and i said im going to bed. ,145,2.557546854019165,3.433137893676758,3.2198381423950195
118281,Why I love my legs,sarah,4,my leg are brown like the color of the ground my legs are very soft like the snow  i can walk or run  i can dance to  music and i  love to dance. ,148,3.8162899017333984,3.52679443359375,3.310704469680786
34419,Poetry on the Sun and Sky,sarah,4,the sun is red the sky is blue there beautiful and so are you.  the sun brings light the sky brings rain they're both wonderful but they are not the same.  the sun is great the sky is too.  i like them both but how about you? i liked them both i hope you did too.  they are wonderful and so are you!,298,4.18987512588501,3.739875316619873,3.3414433002471924
61900,I have everything,sarah,4,"i have everything, i have everything             i have           a aunt pam           a aunt spam              and a         uncle sam      i also have        a ham and some spam       oh, i also have a          life!!!!!!!!!!!!!!!!!!!!!!!!!!!!!!!!!!!!!!!!!!!!!!!!!!!!!!!!!!!!!!!!!!!!!!!!!!!!!!!!!!!!!!!!!!!!!!!!!!!!!!!!!!!!!!!!!!!!!!!!!!!!!!!!!!!!!!!!!!!!!!!!!!!!!!!!!!!!!!!",378,3.6125006675720215,3.4760184288024902,3.34991192817688
104245,Ice Cream,sarah,4,"almost every afternoon, i eat icecream with a spoon. six o'clock is ice cream time. i eat lots of icecream with a mime. ",119,3.553467273712158,3.201790571212769,3.272134780883789
19248,THE BRID AND ME,sarah,4,"when i awoke one morning,  a stork was on my head.  i asked,  ''what are you doing there?''  it looked me at me and said,   ''i care about your hair'' and i was sitting on a chair.  and that's the end of my daring poem. ",217,3.1057467460632324,3.31499457359314,3.2019779682159424
107203,Cookies,sarah,4,"cookies are sweet, cookies are yummy, cookies can fill tummy. i can live with cookies and cookies can live with me. you want to know why cookies can live with me?because cookies are my dogs and they mean everything to me. ",220,4.022909164428711,3.673099994659424,3.424137830734253
47585,Chores,sarah,4,i hate chores boring  stupid  get a maid  iâ’m to lazy  mom goes ballistic  the closet of doom  the chores closet  brooms mops  vacuum cleaners  every cleaning item you can imagine  ahh! chores  like sitting on rough sandpaper  falling in a dark deep hole  getting eaten by a bear  mom sends me to my room  i pout  and pout  and pout some more  i finally go down and do my chores and get myself out of the mess i got myself into,434,2.578558921813965,3.506641149520874,3.1189095973968506
47593,Piano,sarah,4,playing fast and fierce  playing songs of the south  dixie land  beautiful dreamer  playing bach or beethoven  looking at the notes  feeling the music fingers moving fast  keys being pushed down white rectangular keys piano playing sweet songs,247,3.6972246170043945,3.5334603786468506,3.267864942550659
43878,Sisters,sarah,4,sisters    mary-kate &amp; ashely.  they care about each other.  hilary &amp; halie duff.  there for each other.  and they never will leve each others hearts.  nicky &amp; paris hilton.  there always with each other.  amanda bynes   &amp;  gennie garth . ,250,3.2725579738616943,3.0464959144592285,3.191536664962769
36998,How I Lost My Coat,sarah,4,"one day in the moat     while toting a boat      i unfortunately was trampled      by a crazy goat!           in the tumble      my bread was a crumble,       my coat was afloat,       and i was stung by a bumble!       as i sadly walked home       i saw a gnome        who laughed at the bump on my hand       i ignored him and smiled my way home. ",349,2.63901162147522,3.4778075218200684,2.9843456745147705
108701,Friends,sarah,4,"friends, friends  wonderful friends i never want my friendship to end",71,3.8214073181152335,3.497287511825561,3.3135368824005127
111704,The Girl with a Pearl,sarah,4,the girl with a pearl the girl had a lot of pearls that she wore. ,69,3.181415319442749,3.03262996673584,3.181194543838501
25592,The Girlscout Fun Night,sarah,4,i ate a pickled pie one day.  when i was at my friends house to play.  we bought some cookies for the night.  next we had a pillow fight.  then one day we saw some goats.  after that we hung up our coats.  the next day was sunday.  i saw a bluejay.  on monday we had a meeting.  we started it with a greeting. ,303,3.1997663974761963,3.147402048110962,3.1852927207946777
86346,The double me,sarah,4,i have a double me stuck high in a tree ohhh nooo! he screamed oh yesss! i beamed ohh how i have a funny double me,117,3.620705127716065,3.954507350921631,3.335565090179444
53429,Puppies,sarah,4,"puppies are cute and they toot.  they are small all the time  and they never do a single crime.  i have on or two,  and they are never blue like they sky. oh i forgot,  they also  like blueberry pie!",197,3.764570713043213,3.585322380065918,3.348608016967773
29679,MY   STEPSISTER,sarah,4,my stepsister is a migit like a  cricit and she' a brat and she likes hats she yells like this no no no and she is theer years old old old. ,142,2.459076166152954,3.308468818664551,3.1721229553222656
109998,Soccer,sarah,4,"soccer is so fun  it is outside in the sun  you have to kick the ball you also sometimes fall  it is so cool  it's cooler then a pool the goalie has to punt  but they can not bunt  you can head it with your head  it makes you want to go to bed soccer,  oh soccer you make me have to go to the doctor",304,3.623136520385742,3.62740707397461,3.309364080429077
68415,My Protector,sarah,4,"baring her sharp teeth and growling loudly,   my protector stood her ground  until the intruder retreated from our yard.   i was so proud the day my cat scared away that dog!",175,3.463274955749512,3.933862209320069,3.412444829940796
76089,PORK cHOP,sarah,4,"when i awoke one morning,   a stork was on my head.  i asked,  ''what are you doing there?''  it looked at me and said .  .  . ''i am a stork and my name is nork, and if you don't like me being on your head. . . . i'll turn you into pork. go back to sleep and your bed will be nice and neat. ''nork the stork said to the little boy. so the boy went back sleep and when he woke up the stork was gone and his bed was neat but when he looked up an egg was on his head and it had a note on it, it said. . .  ''see you later pork chop!'' when he looked at him self he was a pig!",558,3.128134250640869,3.3223090171813965,3.230079412460327
60278,Limes Attack,sarah,4,"limes attack  limes can commit a crime.  they donâ’t even get fined a dime! yesterday they went,  â“chime,  chime. â” most people are afraid of a lime,  but the only person i know that isnâ’t is a mime.  they arenâ’t afraid of a single line.  they donâ’t worry about the time,  and. . .  they really,  really like to eat slime. ",320,2.7199482917785645,3.4091501235961914,3.262659788131714
14971,Polar Bears,sarah,4,"i live on the ice.  i live on the snow.  i live on the land by the sea.  if you are looking for a grumpy and bad tempered bear.  look out! turn around! that's me! i am grumpy,  i am gruff,  i like playing rough.   i am a dangerously dangerous bear.   i have five sharped claws on my huge furry paws.  i can walk,  i can swim,  i can run.   if i chase you,  take care!  i am grumpy, i am gruff,  i like playing rough.  i am dangerously dangerous bear.   i eat walrus and seal for midsummer meals.   when i am bored,  i will head south to your dump.  and if your there when i am there and i am hunting.  beware! i' m grumpy,  i'm gruff,  i like playing rough.   i am a dangerously dangerous bear.   my eyesight's not good.   my hearing is poor.   but i can smell you from far away.   if i sniff you,  watch out ! if i smell you,  take care !  i am grumpy,  i am gruff.  i like playing rough! i am a dangerousiy dangerous bear.   my skin is black and white i keep warm in the arctic sun.  if you touch me,  watch out! you should not be that near! i am grumpy,  i gruff i like playing rough.   i am a dangerously dangerous bear.   in the summer,  i hunt.   in the winter,  i sleep.  in the spring,  i teach cubs how to prowl.  if we ask you to play,   take care! stay away!  i am grumpy and gruff ,  i like playing rough.  i am a dangerously bear. ",1299,2.612995147705078,3.528515100479126,3.3007359504699707
32450,Life,sarah,4,"i live in the old west.  i try to do my very best.  i make up my time,  and get payed every day with a dime.  i'm just fine. ",123,3.150437355041504,3.087773323059082,3.2496137619018555
29247,Pretty,sarah,4,roses are red  violets are blue i'm pretty  what happened to you,67,2.888267040252685,3.2085561752319336,3.065648078918457
29113,Time,sarah,4,time goes by                   as fast as you eat lime                    but when you're bored                     pray to the lord                      time can fly     cause' it can be gone in the blink of an eye             so don't sit around and cry                       let's say goodbye!!,300,2.702531337738037,3.475979804992676,3.1103334426879883
29085,FRIENDS,sarah,4,the sun shines so bright             we could fly our kite               with all our might               there is no end in sight              no matter our height                we are still in sight                 flying our kite                  don't tell a lie                  with brirds so high                 sice were still friends                our hearts will mend                       our minds                       make us kind,474,3.44740629196167,3.4735686779022217,3.3085947036743164
29088,Sun,sarah,4,the sun shines so bright            it can have to much light          but it can never be out of sight                         except at night                                             with its gleaming power              it does not look sour                no it doesn't you cowered                                                  with its rays                      it will say                       yes if you may                    for us forever!,458,3.367980480194092,3.4196815490722656,3.259107828140259
54339,Stuck in a Wreath,sarah,4,"if you walk to a store you will see a little boy he'll stare at something odd he'll stare at a certain wreath,  that looks like a toy  now this boy is greedy,  he's just so bad so i guess what happend next well,  isn't really  sad  a wreath fell upon him he's been stuck there since that day oh well for the snot nose boy,  he's still standing there today",354,2.374063014984131,3.242361307144165,2.963512420654297
90979,When The Lights Go Out,sarah,4,when the lights go out every night i here little wispers that i know aren`t so little thy are mosters that come out evry night to scare me so far they are  doing great so evry night when the lights go out i get scared,220,3.161855459213257,3.5280494689941406,3.1429808139801025
102039,The Tree,sarah,4,"there was a little tree,  with a very giant bee.  i'm pretty sure there was three.  then there was a dog,  with about fifty fleas.  then came over the she,  the she who owned the dog with the fifty fleas.  she came with the he,  who owned the three bees.  the she,  the he,  the bees,  and the dog with the fleas,  all went to eat some peas. ",331,3.024260997772217,3.091659545898437,3.1375482082366943
39584,Tyrannosaurus Rex,sarah,4,"tyrannosaurus,  is standing over there,  other tyrannosaurus,  is trying to comb my hair.  third tyrannosaurus,  is banging pots and pans,  fourth tyrannosaurus,  is calling out indian clans.  i have a feeling,  that this day,  is turning out another way.  oh,  well.  guess i'd better shout hooray,  it's tyrannosaurus rex day!",317,3.353008270263672,3.636578559875488,3.276226758956909
32770,The  Mouse,sarah,4,"when i woke one morning.  a mouse was on my arm, i asked where it came from and he said he came from a farm.  i asked what he wanted,  some cheese i gave him what he wanted then he said,  ''i want to go home please. ''",215,3.0247249603271484,3.254908561706543,3.145750045776367
54807,Food,sarah,4,"moon, moon cheesy green cloud, cloud coton candy white sun, sun tangy orange man, the world is tasty",99,3.838694095611572,3.4716267585754395,3.345767974853516
54983,My dreams,sarah,4,you speak in the night taking care of me  you hide in the light you help me be  the person that will fight for my dreams in the night  i fight the battles  i once fought to keep my strenght  for the day to come,213,3.4817731380462646,3.4129650592803955,3.348843812942505
39585,Seven Burglars,sarah,4,"the first little burglar made a lot of noise,  the second little burglar stepped on all the toys.  the third little burglar tripped over a skipping rope,  the fourth little burglar lost all of his hope.  the fifth little burglar ripped apart the bed,  the sixth little burglar jumped upon his head.  the seventh little burglar knocked over the trash can,  and that little burglar was a greedy man. ",393,2.364901065826416,3.472970724105835,3.0636003017425537
39583,Easy!,sarah,4,"oh,  i think that test was easy,  but you say it made you queasy.  oh,  i think that test was simple,  but you say it made you limp-le if i get an a,  i'll be shouting spears and spades.  that's when i looked down at my test,  ''oh my! an f!''",238,2.8933887481689453,3.73020601272583,3.209921360015869
39590,Conversation,sarah,4,''ho! ho!'' said  santa claus.  ''let's fly!''  said the reindeer.  ''oh no!'' cried the mother.  ''i got somethin' in my eye!'' screamed the kid.  ''i failed the test!'' hollared the teen.  ''what a mess!'' chorused the king and queen. ,234,2.683443784713745,3.858339309692383,3.2494797706604004
83311,Perilous Moment,sarah,4,"not your normal storm,  but one of ashes and chaos,  scrambling for shelter,  from the heat.   no way to escape,  many people dead,  blazig as it roars.   a childhood horror,  now into view,  run away,  run away,  don't let it scar you.   a second story window,  no help has arrived,  should you hurl yourself away?  think fast now,  outsmart it,  a matter of survival,  or death. ",366,2.337408781051636,3.630560398101807,2.995271682739258
54409,"Pets,Pets Everywhere",sarah,4,"pets,  pets everywhere  i have three dogs that really care.   i have two cats that arenâ’t to fat we have two horses that love to play.  and all they eat  is hay,  hay,  hay.  we have seven pets  some big some small some bark weird  some are tall.  but you know what i love them all.     . ",285,3.631247043609619,3.424769401550293,3.3426458835601807
21389,Fall and Apples,sarah,4,"fall                               red,  yellow                  changing,  jumping,  raking                    chewing,  eating,  picking                                    apples. ",179,3.258422374725342,3.1312813758850098,3.186657667160034
30361,My Brother the  Mainac,sarah,4,my brother was a mainac until he met a boy named mac who helped him clean his act my brother never broke this fact,117,3.19834566116333,3.171661853790283,3.2806084156036377
29790,Wal/Mart,sarah,4,wal-mart is fun wal-art is cool wal-mart has everything that is so cool when you go into wal-mart you get carried away your mom has to say that's anough for one day!,168,4.068838596343994,3.724076986312866,3.381476640701294
42716,Spring time,sarah,4,"spring,  spring,   a beautiful thing,  i love to sing' its spring!",66,4.385404109954834,3.881701946258545,3.4354827404022217
117143,It Is,sarah,4,"sarah.  it is creative,  helpful,  courageous,  it is 5.  it is like a vibrant photograph,  it is painting a forever changing flower.  it is the memory of pepper,  who taught me to be kind and loving,  when he was being adopted.  my name is sarah,  it means i believe in being yourself and to never give up. ",299,3.600663661956787,3.3568832874298096,3.255209922790528
36999,Cats,sarah,4,cats                cats like mats they play with that like some knats every single cat likes that  every cat likes knats even ones that sat every single cat likes it like that. ,180,3.435032844543457,3.248443841934204,3.2665820121765137
65401,MY SECRET,sarah,4,"how green are the trees  the flowers seem colorful.  i always try to fly like a fairy in the sky.    in all my mind i think i can have red hair.  my name is sarah bloom sebers.  my friend andi lends me the power  of my friendship.  andi,  my only friend who knows my secret .   i know that god knows my secret as i know that secert.  i also like music. ",347,3.664421558380127,3.410571336746216,3.2707884311676025
117062,Flying Dog,sarah,4,"pepper flying in the sky,  flying oh so very high,   never ever even trying,  to even look where he was flying!  for when he flew into a rock,  he was in complete and utter shock.   and when he flew into a tree,  he was forced to hide and flee.   pepper flying in the sky,  flying oh so very high,   never ever even trying,  to even look where he was flying!",351,2.804133892059326,3.704961061477661,2.990042924880981
73924,The Circus,sarah,4,"there once was a circus. it was quite a rukus. the clowns would dance,  while the ballerinas prance. and the acrobats will do their act. the audience claps, and that's a fact. ",172,3.3854730129241943,3.2768287658691406,3.276017904281616
53223,"Me,Myself,and I",sarah,4,"i am always reading and writing.  do you like to read or write?i also love to draw, but drawing can hurt your , sting your eyes, and hurt yourt toes. ",148,3.03877592086792,3.164663553237915,3.139024019241333
112176,Stargazing,sarah,4,"as i lay down in the grass at night when no birds pass just stars and no sun to me,  stargazing is fun looking at all the constellations in the stars,  there may be some complications when i stargaze,  this is what i feel calmness is the real deal",247,3.544841289520264,3.399468421936035,3.3032166957855225
39173,LOVE,sarah,4,"love is like the wind across my face,  when a boy turns me down i feel so disgraced , but when a boy hold on i feel almost gone   till the end of time i will feel just fine. ",174,3.498645782470703,3.634005546569824,3.224242687225342
73784,Blue Goddes,sarah,4,"i like singing of dreamy music,  flowers and firiends,  gardens of red roses,  live above the magic moon wish upon a moment goto the mountain,  with you a tiny turtle watching a dog hide. ",189,3.764150619506836,3.4594216346740723,3.2273566722869877
39234,How Can I?,sarah,4,how can i get up and walk? how can i stay and talk? how can i sing?how can i make this thing? how can i wear some clothes? how can i have a nose? how can i do anything?,171,2.594104290008545,3.2091877460479736,2.8954918384552
45093,Tiddily top,sarah,4,tiddley tiddley top my top is spinning tiddley tiddley top.  it falls it breaks oh my tiddley tiddely top.  i buy a new top oh my its hot tiddley tiddley top.  finally i go to a store and find the perfect tiddley tiddley top,226,3.517897367477417,3.5467262268066406,3.303171396255493
