id,title,author,grade,text,char,valence,arousal,dominance
108639,Flower Baby,aanise,7,there has been a flower baby that has been born. if you want one you take one cup of green coloring and one cup of purple and one cup of pink and one cup of blue then you put them in different bowls.  then you take one baby and put it in medium warm water and let it sit for 20 secounds. then you pour all of the color in the water and let it sit for ten secounds.  then feed the baby some water. then take two cups of dirt and sprinkle it around and then you take the whole thing and let it sit for one min and give it some water and in ten secounds you have your flower baby. ,575,3.372797966003418,3.109241485595703,3.2829718589782715
97166,The Dog And The Peanut,aaron,7,"when i awoke one morning a dog was on my head.   i asked him '' what are you doing there'' he said there was a peanut on your head.  i said well where is it now?  the dog said with a pause i ate it.   i sarcasticly said ''good for you''  now get off of me!!!  and get out of here!  the dog said i don't have to  it's a free world,  because i'm still allowed to eat at dawn,  noon or night.   the boy says it's not a free world  you have to pay taxes.   but i'm a dog i have no paws. ",478,2.8570542335510254,3.555663108825684,3.309335470199585
92808,I am so awesome (not Isaac),aaron,7,"i am so great,  i am so great everybody loves me (not isaac) i am so great",76,4.634098529815674,3.958569049835205,3.417487382888794
53996,Snow,aaron,7,its falling hard its is falling slow o yeah it snow  it fills the roads the walkways too i can't believe there's no school. ,126,2.4931535720825195,3.258975982666016,2.9310052394866943
51050,Equal,aaron,7,"is a bush a tree? why wouldn't it be? all is a tree! can't you see? is a shrub a bush? of course! we're all equal,  in this world.  all is a tree! can't you see? now you tell me,  is a bush a tree?",197,3.048686981201172,3.250274658203125,3.2106261253356934
116765,Sharpie,aaron,7,sharpie is magic.  permanently ready for your notebook paper. ,63,3.7617692947387695,3.564296007156372,3.360801935195923
44388,I Made a Mistake,aaron,7,"i went to the store to buy some hot cheetos,   i made mistake and bought some dorito's.    i went with my friend to go play around,  i made a mistake and fell to the ground.   i went to the store to buy some eggs,  i made a mistake and bought chicken legs.   i went to my house to sit on the couch,  i made a mistake and sat on my mom and said ouch!  i went to my room and began to cry,   i made a mistake and said bye. ",414,2.3656599521636963,3.37778377532959,2.870170831680298
104297,Cookout,aaron,7,my family is a cookout:dad is the grill; always on fire:mom is the charcoal inside the grill; always supporting my dad's fire: my brother is the burger always giving people a mouthful: i am the water: always giving peolpe what they want. ,240,3.5464541912078857,3.350245475769043,3.3342230319976807
91503,Tomatoes VS. Potatoes,aaron,7,"tomatoes,  tomatoes,  oh how i love you tomatoes! you're plumpy, not bumpy or lumpy or jumpy.  tomatoes,  tomatoes,  you're much more delicious than icky potatoes. ",160,4.248517036437988,3.82694149017334,3.483673095703125
49364,Lion,aaron,7,"territory taker,  animal shaker,  \t prey taker,   animal archer,   flesh eater,  animal beater,   blood spiller,  animal killer,   big cat,  not a pat:  one big cat!!!",163,2.5618810653686523,3.7508773803710938,3.318525075912476
73156,Spicy Wings,aaron,7,"i love buffalo wild wings,   tasty wings with every bite,   crunchy on the outside,   soft in the middle,   pounds of barbecue sauce in my mouth,    honey mustard too, ",166,3.825622081756592,3.600097179412842,3.363033533096313
15495,I am alive!,aaron,7,"i am a lonely pine blowing in the wind.   i am a windy,  dreary,  spring day.   i am an asteroid floating with the stars.  i am a blue jay soaring in the open sky.  i am the calm sea on a hot summer day.  i am gold on young ladâ’s neck going to beautiful landscapes.  i am the song lighting up peopleâ’s lives.  i am orange and red panting color into the earth.  i am the light of day putting life into peopleâ’s lives.   i am alive!  i am alive!",440,3.6700439453125,3.6018190383911133,3.3085458278656006
60391,My Video Game,aaron,7,"punching,  throwing,  basing,  smashing,  flying,  beating,  it may not be real,  it is real to me,  it is my video game. ",116,3.0304670333862305,3.45915961265564,3.1898043155670166
65209,My Dog and I,aaron,7,my dog and i were walking down the street behind us we heard tapping of feet we started to run  we knew this wasn't fun i told my dog ''find mr. cone''  i thought i was dead  then i woke up and was home,204,2.4589991569519043,3.4803171157836914,2.863654375076294
72222,Crazy Cat,aaron,7,"active and crazy,  sometimes lazy and hazy,  but never dazy. ",61,2.880211353302002,3.1015470027923584,3.1516568660736084
111799,Baseball,aaron,7,baseball such a fun game hit the ball and run fast fun to hit a homerun and run baseball bat,96,3.806384086608887,3.657803535461426,3.3904387950897217
111809,Food,aaron,7,f ood is amazing o ctupus o atmeal d esert,45,3.9249424934387207,3.6140365600585938,3.3608341217041016
104079,Mr. Red,aaron,7,"hello,  im mr.  red! i love to climb tall oaks but saddens me when im chased up by smokers i feel happy and safe when im with ms. linus i want to tell ms. linus,  â“thanks for protecting me from those smelly huntersâ”. ",219,3.7533462047576895,3.61348032951355,3.3361895084381104
32694,My Bedroom,aaron johnson,7,"the sunshines threw like a summer day,  this is where i like to stay.  sometimes clean, sometimes nice, i'am glad i have no mice. i keep most of my stuff here, when my brothers go in and mess with my stuff i just get mad and say o dear. it is as bright as the summer bloom yes this is my bedroom. ",309,3.47162127494812,3.301227569580078,3.276020765304565
115699,You&apos;re still the one,aarya,7,"hold my hand once and,  i will forget the pain.  trust me once and,  i will be the most trust-worthy person in your life.  care for me once and,  i will be the happiest one.  touch me once and,  i will forget the whole world.  love me once and,  i will be all yours'; only yours'.  coz,  you're still the one",300,3.8979105949401855,3.686575174331665,3.393547773361206
102832,Band,aaryn,7,"i'm in a band i play the drums others sound very grand as the melody sweetly hums flutes,  clarinets,  trumpets and trombones of course there are more with all their beautiful tones instruments,  sounds and music galore! as the day moves by we pack up our things but there is no need to cry we will see what the new day brings. ",327,3.7755093574523926,3.6488869190216064,3.362680673599243
50033,"The Sea,The Mountain,The Breeze and Me",aateka,7,"as i stand in my balcony,  i feel the wind go through my hair.  the red cedar outside my bedroom window moves as if by magic.   it does not talk to me,  but instead, i talk to it.  i tell it about the sea,  who's still waters make me feel one with myself.   i tell it about the mountains,  who share their sorrows and good moments with me i tell it about me,  who is now as calm and peacful as the birds in the distant.   i now tell the red cedar about the sea, the mountains and the breeze.   the distant noise of the vehicles do not disturb me.  the sound of waters and mountains make me feel peaceful.  then i realize that this is me,  and i am very happy to be me. ",655,3.616712093353272,3.411262989044189,3.2794852256774902
37176,Her Ears,abbi,7,"her ears are soft like velvet,  they flap like the flag in the wind.  if i could change her long,  black ears,  to be pointy,  brown ears,  i would not!",149,2.7723724842071533,3.48188853263855,3.269890069961548
105697,Bunnys,abbie,7,"bunnies,  bunnies everyware bunnies,  bunnies in my hair bunnies big and bunnies small bunnies,  bunnies i like them all. ",121,3.6798837184906006,3.41292667388916,3.28153920173645
104704,Eraser,abbie,7,"my eraser sits apon a pencil,  little eyes staring,  big ears sticking out,  a curl of hair on top,  my blue monkey eraser is perfect",132,3.624533653259277,3.411030530929565,3.3401198387146
104701,Kai,abbie,7,"one cute kitten,  walks like a mini lion,  spots and strips,  brown and black,   jumps and glides through the air,  thump,  hits the ground and runs",145,3.348487138748169,3.515538692474365,3.191598653793335
104705,Pencil,abbie,7,"pencil snow white,  jet black tip pressing lightly on the paper,  barely leaves a mark",87,2.924526691436768,2.950889110565185,3.106121063232422
50831,A Sweet Lullaby,abby,7,"as it soars through the air swiftly, as quiet as a mouse,  it likes to sing a peaceful song.  it goes like this. . . tweet, tweet, tweet.     up high in the sky you will here a noise,  a beautiful noise, a song,  a sweet sweet lullaby.      now there it goes,  flying away,  far away, tweet, tweet, tweet. flying away.  far far away.     listen now to the quietness.  it is lonely.  the songs are gone.  the wind is still,  like when it feels as if nothing is there except you.  there goes the song,  the sweet lullaby,  flying away.  far far away!",522,3.4307785034179688,3.4796032905578613,3.2215092182159424
105832,My Shoes,abby,7,my shoes are yellow.  my shoes remind me of a lemon.  my shoes are like a big fat round head.  my shoes hate people. ,116,2.524023056030273,3.169750452041626,3.060628652572632
105662,Person,abby,7,this girl is as funny as a bunny.  her smile shines like the sun.  her hair is  as curly as a fresh  curly fry.  she smells  as fresh as a home made apple pie. ,159,4.067071437835693,3.687397718429565,3.290534496307373
25379,The Big Oak Tree,abby,7,"what a wonderful tree,  the big oak        tree,  that sits outside my house all day.  dreaming of the day it can float away,  and for once be full of glee.   but oh,  no,  it wonâ’t ever move from that spot,  for firmly in the ground it will stay.  it will never float away,  that poor,  poor old oak tree.   i wonder how long itâ’s really been there in that spot? itâ’s whole life iâ’ll never know.  i wonder who really wanted it to thrive and grow? that big oak tree of mine.   i love spending my time with that tree,  it soothes me when iâ’m blue.  i wonder if it will ever be soothing you? iâ’ll never ever know. ",606,3.499246120452881,3.507917881011963,3.233243942260742
91829,Trees,abby,7,out in the forest&lt;br&gt; trees are growing tall and strong&lt;br&gt; they are dying too. ,94,2.7125115394592285,3.164671897888184,3.0295684337615967
109002,Art,abby,7,"a blank canvas untouched,  empty confusing,  mind-twisting,  uncomprehending but,  an idea has struck the artistâ’s mind,  painting,  creating,  fulfilling,  complete,  beautiful a piece of artwork",192,3.7878377437591553,3.6415257453918457,3.356145143508911
109003,The Moon,abby,7,"the moon,  soft in a dark sky,  translucent,  glowing,  as it sheds the only light,  that leads us through the night",114,3.3485970497131348,3.195018529891968,3.1997437477111816
16517,Toes,abby,7,"long,  short,  wide or tall  toes share one foot,  yet aren't the  same at all.   they help you run,  and walk,  and play.   toes are the reason we get by each and  every day.   without toes you would surely fall,   without toes you could not even kick a  ball.    so that is why we need our toes,  to   reach up high,  and smell a pretty rose!",335,3.511971235275269,3.556008815765381,3.378863573074341
84483,I Know I&apos;m Home,abby,7,"mother life is like crossing a road,  i jump in the road,  a car comes,  i jump out,  people keep hitting me and i can't stop it,  i see you standing there telling i can make it,  i feel like i can make,  when i finnaly do i feel warm,  and when i hear your voice,  see your face,  and feel your arms i know i'm home. ",310,3.3200814723968506,3.677544355392456,3.17156982421875
113040,Toast,abby,7,on every full moon in the month of june i eat toast with a crazy baboon.  every tuesday morning at nine i eat toast buttery and fine.  every monday evening at seven  i eat toast with the angels in heaven.  every sunday precisely at lunch i eat toast with a crunch &amp; munch.  the whole wide world should love toast but i think i love it the most. ,347,3.7760162353515625,3.5518336296081543,3.3564453125
80135,Abby,abby,7,a- athletic  b- beatifull  b- bubbly  y- young hearted,59,3.34128212928772,3.07315444946289,3.2399189472198486
117412,Paris,abby,7,"the city of lights,  what a delightful view.  the city of love,  filled with passion and poise.   the city of lights,  shines the exquisite star.  symbolizing freedom and liberty,  the strong eiffel tower.   the city of lights is the most visited city.  but one day,  it tasted a tragic event.   the city of lights,  now in the dark.  the weapons roar throughout the stadium,  and shriek into the night.   the city of lights,  shot down and bombed.  the people who did it,  do not know paris. ",479,3.081411838531494,3.4710123538970947,3.133985996246338
110887,Circle,abby,7,a circle so simple and round it doesn't make the quietest sound it's used for a face  and a mounth open wide and a shoe for someone who's taking a stride,156,3.053427457809448,2.971001148223877,3.1979634761810303
18248,Giggle,abby,7,giggle giggle it's the funnest thing to do just giggle and giggle thats all i do. ,84,4.107309818267822,3.789298534393311,3.3602867126464844
109211,Day Like no Other,abby,7,"today's a day like no other because i get to spend it with everyone whom i love and care about with cousins,  with aunts,  with uncles with grandmas,  with grandpas,  with friends and best of all family time for a feast filled with great food and frosty drinks with rose petals all over the tablecloth it's a day like no other with everyone gathered here so near and dear to my heart it makes me want to cry with joy and never fall apart i don't ever want them to leave me,  never because it's been a day like no other with them here with me",539,3.8784589767456055,3.724912643432617,3.363665819168091
53790,The GaMe gets CaNcElleD!!!,abby,7,"the game is going well people are having fun 1st,  2nd,  3rd, . . . . homerun! another point for the winning team! this day is going great hot dogs and popcorn is what they ate little kids,  adults,  and elderly are having fun screaming yes! and yippie! all of a sudden  it started flooden",283,3.991723775863648,3.810987710952759,3.441224813461304
111772,The Night Path,abby,7,"when night time falls,  and darkness appears  creatures come out while we disappear  with repulsive shadows lurking distinctively  we may just hide inside our own shell  when a glimpse of light strikes the bell  we follow the path till we reach the well  with a toss of a penny and a wish for morning  the sun arises and towers the buildings",346,3.0788369178771973,3.274219751358032,3.106329679489136
111773,Dance,abby,7,dancer are graceful and can jump higher than air  artistic and creative  neatly clean  contains many styles that can express yourself   energetic  and unique,164,3.624677419662476,3.3533432483673096,3.3135366439819336
16800,Next Time I See You,abby,7,"your smile makes me quiver,  as i pass you in the hall.  the thought of you makes me shiver,  your name i want to call.  whenever our paths cross,  i can't help but smile.  it seems my heart is lost,   i just want to be with you,  for just a little while.  you completely ignore me,  not even a glance.  don't you see me here? i don't understand why i don't have a chance.  you know how i feel,  my love is sincere.  so maybe next time i see you,  you'll feel the same way i do. ",467,3.6908347606658936,3.7341556549072266,3.280041456222534
16813,Go Inside A Tear,abby,7,"go inside a tear,  and discover the sorrow,  the sadness it holds.  the cause,  a death,  a dispute,  maybe an important secret told.  tears of anger,  tears of sadness,  no matter the emotion,  they always defeat the gladness.  why can't happiness we find?  why can't we get over our sorrow and leave the tears behind.  we look at our puddle of sadness and trouble.  will our cloud of problems and depression always hover.  go inside a tear and discover the sorrow,  the sadness it holds. ",477,2.5245721340179443,3.2032694816589355,2.930532693862915
111774,Spring,abby,7,as flowers start to bloom rain starts to fall with yellows and pinks filling the air spring has finally came,117,3.641214847564697,3.330113410949707,3.278740644454956
35697,Life,abby,7,"life you may say,  plain ordinary just comes any day.  life you may think,  in this meaning not perfect with still a kink.  life you may state,  great love,  and quality at any rate.  life you may rage,  each day a new page.  life you may declare,  and helping hands with mothers care.  life is a pit that will never stop.  life is so tiring i just want to drop.  life has so many miraculous things,  one minute you're the and one minute bing! you've disappeared you're totally gone,  you're not even there at the crack of dawn. ",516,3.293816328048706,3.3665027618408203,3.1900198459625244
93757,Ocean and Waves,abby,7,"ocean  blue,  wet foaming,  flowing,  rising fish,  shells,  water,  tide pounding,  crashing,  pushing powerful,  noisy waves",121,3.03732967376709,3.365464687347412,3.0896542072296143
38144,One&apos;s Soul,abby,7,"i know my soul very well,  sometimes it's sour like the color mustard,  i wonder if it will ever be happy,  my soul has never been once totally happy,  i know that someday my soul will come to an end.   my soul changes just like the weather,  it goes from sunny to stormy,  from stormy to snowy,  no one can predict,   the only way is by what they say,  know my soul must be put away. ",378,2.578264713287353,3.2203402519226074,2.929450273513794
53689,My Mind I Like.........,abby,7,my mind is like a sponge it absorbs a lot of information my mind is like a computer sometimes fast sometimes slow my mind is like the newspaper full of information my mind is like a tree changing with the seasons my mind is like a flower  blooming and growing. ,265,3.378361701965332,3.2574918270111084,3.1593329906463623
45523,Toby the Dog,abby,7,"i have a dog.  toby's his name.  he likes to eat frogs  and drives me insane.   he eats everything,  that he lays his eyes on.  he runs like the wind and tans on our lawn.   he's brown and black and sometimes a chicken.  he barked at a pot  on the floor of our kitchen. ",266,3.01348614692688,3.326357126235962,3.230027914047241
91475,Mother&apos;s Hands,abdallah,7,"mother's hands took us to school  mother's hands in the morning  mother's hands rain,  protecting us  mother's hands act as awning  mother's hands would hold our face  mother's hands held the tears  mother's hands brail our face  mother's hands read our fears  mother's hands held compassion  mother's hands would bake  mother's hands give us her ration  mother's hands give not take  mother's hands lined by caring  mother's hands not smooth  mother's hands map understanding  mother's hands every groove",507,2.8415021896362305,3.3394620418548584,3.011845827102661
98656,Hurt,abdoul,7,i hurt my self today what i become my greater  friend you can have it all my greater empire state,100,2.4310553073883057,3.432750940322876,3.231388807296753
115240,Stand up to bullying,abi,7,"wake up to school! i hear my mother say i don't want to go  i'd rather stay,   the students at school love it when i'm away.   my mother looks sad and stares at me,   is this the life that's meant to be? what is wrong,  why are you sad you use to think school wasn't that bad but they laugh at me,  they call me names they hurt me and make fun of my face i want to shout,  i want to scream but it seems like the whole school is on their team oh dear i wish you had told me it's easier to share your problems you see if you'd said earlier you'd still have a smile  and i know you will in quite a while.   so i went to school,  and told somebody,    and i went home quite happily  so all you people who got bullied  do something good,  do something happy do something great,  do something amazing and happiness is what you will soon see  if you tell someone just like me. ",861,2.9355454444885254,3.617644786834717,3.2145090103149414
104625,My family,abigail,7,my mom a candy that is sometimes sour but always sweet.  my dad is a candy that make you jump  up and down and go crazy.  my brother ricky is a candy that make  you want to giggle.  my younger brother damian is a candy  that make you want to play all the time. ,260,3.501405715942383,3.366774320602417,3.2390854358673096
112573,Death,abigail,7,"d ecomposing,  gain green kin e ating festering bugs galore a lways lying doing nothing t ender juicy flesh for fungus h olding on to something left",151,2.4714224338531494,3.1329288482666016,3.0200634002685547
100014,Fat Cat,abigail,7,"i saw a cat that was fat,  he was bigger than bat.  i met a dog that lived in a bog,  she looked like a hog.  iâ’ve heard of pig that was big,  she was very,  very,  big.  i met a horse that was hoarse,  he looked like samuel morse.  i saw a mouse that lived in a house with a louse.  i met a shark that swam like a lark,  and also could bark. ",334,2.9765756130218506,3.21741271018982,3.1310980319976807
119915,Faithfulness to God,abigail,7,"lord,  you see me when i stumble  upon satan's rocky road,  but you,  lord god,  shall make me humble  while christ does carry my heavy load  god,  i shall tremble at your name  and sing unto your word for my sin will bring grate shame  but with you,  i fly like a bird  i grasp your holiness and your love,   for you,  christ,  i yell and shout your spirit and grace is as a dove  and i love you,  lord,  no doubt",406,3.5625545978546143,3.622892856597901,3.346536874771118
104525,Morning Poem,abigail,7,"first i said ''good morning everybody'',  then i go and brush my teeth, then my face, then i go to my room and put my uniform, atlast i do my hair and putmit in a ponytail.  at 7:17 a. m.  i got my stuf and tell my dad and mom ''by''and go to the bus stop. ",252,3.331870079040528,3.167231321334839,3.243518829345703
104661,Leaves,abigail,7,"falling lightly  to the ground ,  then being crushed  from all around,   broken and shattered  no one cares.   green and pretty,   in the sky  alive and waving ,  up so high .   now brown and ugly,   on the ground  dead and broken ,  from all around. ",245,2.751659393310547,3.43088436126709,2.9964518547058105
104669,The Lioness,abigail,7,the lioness stalks the lioness seeks her hopeless prey she swishes her tail  waiting  for the right moment to  strike! while daddy  sits and waits!,150,2.858040809631348,3.6316301822662354,3.1460988521575928
104668,The nest,abigail,7,"nesled deep  in branches so thick lies a nest.    sticks and stones weave in and out,   with small white  feathers inside   nestling three tiny,   blue eggs  from a young blue bird.   away from  the wind  away from the chill  lies a nest  full of tiny  blue eggs. ",262,3.1975314617156982,3.1163125038146973,3.199247121810913
22043,The Little Princess,abigale,7,this little princess has it all  this little princess is throwing a ball  this little princess will surely fall  if the little prince she likes doesn't come to the ball. ,172,3.558845043182373,3.525700569152832,3.302780866622925
105710,Handicap Signs,adalynn,7,blue and white show up a night handicap only man they must be lonely  little white squares with  a man in a wheel chair  on the ground get ran over i sit here and think is he alive? i always thought but the answer was  probably not!,235,2.358260154724121,3.39682412147522,2.9220902919769287
105706,Chaos,adalynn,7,i love you you are my dog your ears are all messed up one stands while the other falls your big brown eyes and your big black nose the way you chase my garden hose your white with lots of colorful spots black and grey brown hurray i love you chaos.  you have a really big heart  when you run around my big backyard i think while you wink your big brown eyes! i love you  when im sad  you make me glad chaos  you are the best better than the rest chaos i love you!,465,4.152531623840332,3.9117565155029297,3.3761556148529053
28484,My Basketball,adam,7,smooth in some places rough near the black rubber laces you can say it's defiently worn in some places ripped or torn my basketball is round it bounces high when it hits the ground it smells dusty and old and it always loses air when it's cold,247,2.6531758308410645,3.031257152557373,3.055936098098755
31623,Music,adam,7,the music is loud.  the music is bliss.  it should only be loud.  always to be missed.   never should it be hated.  it should always be loved.  no one should make it hated.   music is great.  it is not bad music is first rate. ,221,4.029546737670898,3.623595714569092,3.4160025119781494
110478,I Gave You Love,adam,7,"i gave you love,  without condition,  held you close,  beanth my wing,   took you high,  and helped you sing,  took you through,  stormy weather,   never let go,  hit the ground,  danced with you,  in the rain,   i wipe your tears,  with my pain,  but now it's time as i take flight,   without your pain,  as i took your pain away,   thank you for letting me share,  with all i can do for you. ",378,3.867802619934082,3.738492012023926,3.3515191078186035
110479,You,adam,7,"itâ’s that look in your eye,  itâ’s the smile on your face; that makes time slip by,  and i know i'm in a better place.   itâ’s the memories of you,  that make any grey sky turn blue,  and let me know these feelings i have,  are true.   getting lost in my dreams,  with the mere image of you.  itâ’s hard to imagine it seems,  a future lost,  one without you.   so i leave my arms open,  and i'll wish and may pray,  eyes focused and hopes,  for your embrace just one more day. ",465,3.59913969039917,3.5576977729797363,3.254638910293579
