id,title,author,grade,text,char,valence,arousal,dominance
120479,I am still standing,sneha,12,"there are two paths in front of me i ask myself ,  ''can't you see?'' the pieces of my broken heart continue to break and fall apart   one path will make my parents proud the other ,  my country proud one path asks for the mind of a thinker the other,  the heart of a selfless leader  but when i start walking down the path of a thinker my heart starts singing that different song more louder the song of guilt and dejection  protesting that the other suited me with perfection  i am going to choose the other path the path of a soldier,  ornated with strength  i am going to choose sacrifice and selflessness not the path endowed with selfishness  but how selfless can this heart be i'll just have to wait and see do these hands have a shield to bear the crowd of enemies coming near?  does this heart have a vest to fight the passion of sadness with all its might  do these eyes have helmets to avoid the sight of a thousand swords coming to pierce me through?  some people will tell me to run away  from no man's land when death comes my way but i will stand still with all my might as bright and strong as a ray of sunlight   they will either find me in no man's land or smiling at them from god's golden land but never in the land of cowards,  never  for i will protect the ones behind me forever  my mind will be my sword always going by my word my heart will be my shield always giving me back some yield  my eyes would be my helmet always checking on the enemies i meet and who all will be my tanks? me,  myself and i,  working still without a word of thanks",1564,2.80552077293396,3.330493688583374,3.089009046554565
116803,Love for my sister,sohil,12,"love for my sister is so great,  i miss her till the dusk days.  my heart melts when i remember you.  oh god! there is no such reason that i can forget you.   though she is my sister from another mother,  she is the only one to whom i bother.  there is a special king of relationship we share,  love, fights, laugh and care.   she is a thing of beauty,  she is as cute as tweety.  soon she'll be going to ahmadabad,  in hindi i'll become",427,4.068068981170654,3.780467748641968,3.3537580966949463
115697,Cruise on Mandovi River,soma,12,"it was the full moon night in december,  along-with santa monica liner- i was lucky to have a cruise on mandovi river.  with the wisp of smoke , santa monica left the land linear.   she stretched her basement across the stream,  she rotates water far and wide in the reflecting moon beam.   as breeze from sea started to blow,  trees on banks were looming like scarecrow.  as the ship moved further with the shaking of water,  people on land were looking couched one after another.   other boats and hover crafts were passing up and down,  their inner lights were resembling as stars and moon.  the moon and stars with their solace grace and beauty- were nature's most precious dignity.   in the cabin, we were in a mystique world- foodstuffs, singing, dancing- everything,  we had.  a singer was singing with a flamboyant voice,  it was adding passengers' extra rejoice.  many of them were dancing and clapping with cheer- where ever the stage was-far or near.  it was the amazing charm which ended in one and half hour,  santa monica returned back to the bank of river,  i was looking back again and again with full of joy and tear. ",1115,3.5383505821228027,3.42880916595459,3.228748083114624
111085,Dead Girl,sonia,12,"no eyes,  but she can still see all,   no nose,  but she can still smell fall,   no lips,  but she can still kiss,   no heart,  but she can still feel it break,   no nerves,  but she can still feel pain,   and all it does,   is drive her insane. ",237,2.532994747161865,3.4816861152648926,2.91028904914856
100130,The light and the darkness of my Lady Vivian,sorin,12,"the light and the darkness  of my lady vivian in memoriam   i will do all the best to complete your project the god is smiling to me and for that i am very happy  inside of my soul as felow poet i am very sad life is an opposition and i don't know what i can choose the white or the black ! all these are for our life a simple question: to be or not to be!  white are the mornings, black are the nights the titan and the light without the stars the warm of your soul, the bed and the end of my dreams all these are for our life a simple question the heaven or the hell  !   i remember the past, i remember the present i am smiling and i am crying and the life is opposite of death.   the past and the bells.   nota bene: can you hear me?",735,3.548239231109619,3.5196774005889893,3.2157270908355717
53684,Im cool,soumya,12,im so pretty ohhhhh so pretty dear me. . . how pretty i am. .  yes yes to you and to me oh dear me on the goodship  lollipop,123,4.360431671142578,3.846827507019043,3.3673949241638184
102045,Love,sovanny,12,why is it called love if it hurts aint love suppose to be a happy thing why is it that love always brings so much pain to the heart! do you think its easy to love?  love hurts more than anything you just wanna feel secure and safe but no the one you love be protecting you!,276,2.7592215538024902,3.584531784057617,3.058096170425415
116033,Car crash,spencer,12,"it started raining at three this morning  so the streets were wet when i was driving  as i turned my car slid without warning  to avoid the guard rail i was striving   i turned hard to the right and dodged the rail and went off the road hitting a speed sign my passenger,  he was looking quite pale it's okay though because we both came out fine  brandon showed up and he was no help at all clay stopped and ask me if i was okay so i got my phone out to make a call i called my mom to see what she would say  she told me to come home and trade our cars i hope i do not end up behind bars",590,2.6894876956939697,3.2778263092041016,2.999009847640991
76532,Fun,spencer,12,"joy! the world is fun! while munching a bun,  the world is fun! why hello there nun! man. . . the world is fun! and now i am done,  eating a bun! the world is fun!",161,4.529612064361572,4.032215595245361,3.4999818801879883
118708,Good Bye,srija,12,"after today i don't think we are going to meet  but the memories of the days spent with you are very sweet.   have i ever told you that your smile leaves me spellbound? ?? i don't have any words to explain that i have been broken down,   i am not going to blame you 'cause i think you haven't break my heart  it's time who betrayed me, who smashed, destroyed all my trusts.  can i ever may get the right to dream about you?  even if it's nightmare,  for me its pleasure to see you.  i know that one day in life you will stretch your hands  to keep roses over my tombstone in the death land.  i know that you're the one who is going to cry 'cause i will be silent for forever and no more there to say you . . . goodbye. ",710,3.370657444000244,3.6150107383728023,3.207283496856689
99686,Just Me,stacey,12,"volleyball star i wish i could be,  the one i love to see.  just once canâ’t they say,  â”yes you can stay. â”  prom queen i wish i could be,  the one i love to see.  â“put the crown,  right side down. â”  in the movie scene,  i wish i could be,  the one i love to see.  â“this is your cue,  itâ’s your turn sue. â”  me is the one i love to see i know who i am who i can be this is â“just me. â”",385,3.506635904312134,3.4206578731536865,3.293332576751709
21774,Loving Her,stacy,12,"when i am with you eternity is a step away,  my love for you continues to grow with each passing day.  this treasure of love i cherish within my soul,  how much i love you you'll really never know.  you bring joy to my heart i never felt before,  with each imagined touch of your hand i love you more and more.  whenever we say goodbye,  whenever we part,  know i hold you dearly deep inside my heart.  so these seven words i pray you hold true,  ''forever and always i will love you. ''",479,4.111545085906982,3.783867359161377,3.367806196212769
21869,Lust or Love?,stacy,12,"to make it in life to be someone's wife to love,  honor,  and cherish to share my fetish which would consist of nothin' but love to be honored  and not monitered with a chip to be whipped to be trusted  or live in nothin' but lust. ",232,3.5125439167022705,3.622986078262329,3.383859872817993
53001,AS SOON AS FRED GES OUT OF BED --- My Version,stan,12,"as soon as fred gets out of bed,  his underwear goes on his head,  and many times his father's said, ",102,3.0374884605407715,3.220313787460327,3.1969032287597656
119456,Winter.,stanzin.,12,"enveloped with blanket.  area covered with smoke.  denizens can be seen,  only in the abode.  it is the meeting season.  unlike the three.  naked trees, half-naked wall,  have its own beauty.  their duty has to be acted by facing chilly gift.  this is a sign of patience, hardwork and love.  restriction overwhelmed.  but, those who overcame made his impression forever.  it is a life trial that redeem may have created.  all have to pass,  as no place for second chance.  by succeeding, surviving becomes possible.  it is a good way to check their patience, perseverance, capability etc. ",570,3.315718650817871,3.2137725353240967,3.239132642745972
95102,Water,stars,12,"when something flushes down my back,  ill know its  water without lack.  ill wipe my shirt clean and dry,  it also is so nile .  because of the river it did file. ",161,3.013805389404297,3.18131685256958,3.200069665908813
111938,Be well,stefan,12,"we can't begin to comprehend the reason why you quickly went to love to hear to understand is what you did,  without demand why people go and leave us so is something that we'll never know if there are thoughts of being sad it's for the time you never had we'll always treasure your respect the way you made people connect we'll try for sure,  once in a while to honor you,  to have a smile",390,3.071012496948242,3.3422114849090576,3.117055177688598
105907,The Perfect Summer,stefanie,12,"summer is coming,  summer is loving! swimming,  playing,  riding my bike,  these are some of the things that i like  summer is stunning,  stupendous,  and super! i love summer and summer loves me!    in summer i love going to the beach,   rather than having someone teach summer is a hundred perfect dreams all in but it seems like it may never end i must tell you one thing though,  summer  is not a bummer",404,4.230258464813232,3.893224954605103,3.4626896381378174
74361,Feelings...,stephan,12,"i once met this girl and thought i had a chance,   my simple life in a dificult dance,   we had our moments and quickly i fell  when suddenly it turned to hell  we talked a while,  exchanged words,  she didnt feel we were right  we shared a special moment,  that lasted all night  we're talking more,  im still falling  when my phone rings i hope its her calling  she means alot to me and i just want her to know  i love you and will never let you go!",449,3.767441511154175,3.838155746459961,3.308082342147827
52834,Darkness,stephan,12,movement in the dark moving mysteriously shadowy figure,58,2.940596580505371,3.0837836265563965,2.994715690612793
62116,I am proud to be who I am,stephanie,12,i am proud to be who i am.  from the top of my head to the bottom of my feet.  i am proud to be who i am.   no matter what other people say.   i am proud to be who i am.  i may not have a father because  he died 4 years ago but i have  a mother to love and care for me.  i am proud to be who i am i don't go to school to play or  act like a fool but to get  an education.  i am proud to be who i am  and i will say it again.   i am proud to be who i am.  i am proud to be who i am.  i am proud to be who i am. ,502,3.67903995513916,3.497134208679199,3.43088173866272
63769,Uncle billy,stephanie,12,uncle bily is so silly he thout he had no willy because thats just uncle billy his mums name is daisy because she is so lazy she  so lazy that ther is cod webs croing in her ears bacause thats just daisy . ,208,2.48121976852417,3.171624660491944,3.1298537254333496
107213,My Cup of Tea,stephanie,12,my cup of tea by: stephanie   my cup of tea sits in front of me as i write my poetry  itâ’s kind of funny that i spent money for a colorful mug with smiling bunnies  i rack my brain i feel the strain this weekâ’s assignment my patience will drain  i pick up mug i sigh &amp; i shrug and then i realize itâ’s coffee,318,3.3600053787231445,3.303924560546875,3.2050302028656006
120504,LIFE,stephanie,12,"the life we see with our eyes can fly many years go away  the birthdays,  parties,  homes,  puppy  plus your partner life.    !0 years pass and you still flying  and itâ’s hard to say goodbye to something in life.   what is life?  life is flying through the years.     15 years pass and you still living  and itâ’s hard to say goodbye to something in life.   what is life?  life is flying through the years of the youth.   20 years pass and you still hear  and itâ’s hard to say goodbye to something in life.   what is life?  life is flying through the world hearing the water waves moves and birds sing now you in heaven life. ",631,3.0390853881835938,3.1889538764953613,3.060246706008911
107904,Time Stands Still,stephanie,12,"god made man and god made woman we are all human.  made of tissue,  bone and flesh,  our bodies at birth are fresh.  made in our mother's womb,  life becomes a bloom.  our bodies become immune to a world sometimes out of tune.  in sickness and in health,  our bodies are our biggest wealth.    the gift of time as we grow,  so many things we do not know.   our bodies can become ill and time stands still.  caner is well known by all,  and if diagnosed is a wake up call.  there are many kinds of cancer,  but still no answer.  still looking for a cure,  no one is ever sure.    please god, hearour prayer for all those in need of care.    we pray for all who suffer in pain,  through god's love we have alot to gain.  cancer spreads like a fire and our bodies become so tired.  all over the world people are sick and dying of caner,  please god send a sign and find an answer.  thank you god for watching over each of us.   those who have gone to rest,  they passed the true test.  now in heaven at your side,  theya re free and will no longer cry.  we believe in you,  your love is true.  you are the cure that keeps our faith secure.   in memory of my mother who passed away with pancreatic cancer.   god bless her. ",1187,3.3476078510284424,3.3158459663391118,3.2182562351226807
67666,love,stephanie,12,love is true  love is blue how about you?,44,3.793177604675293,3.4937744140625,3.346214771270752
24997,Think Spring!,stephanie,12,"come on along and sing this song -  this song of spring.  though winter is still here,  and snow covers everything,  yet there is no need to fear; for spring soon will flowers bring!",184,3.6960957050323486,3.623865127563477,3.3739607334136963
110084,Pets,stephano,12,cats and dogs birds and frogs snakes in lakes and guinea's in cages having a pet is pawsome!,95,3.697923183441162,3.644861221313477,3.344987630844116
51939,My chicken,stephen,12,my mom said i had a chicken she said he lives in the kitchen in my mouth he will go and then it will snow,108,2.768644094467163,3.121420383453369,3.0898120403289795
37215,Judge Me,steve,12,people who judge me  are people i despise.  i guess you'll never know til you see through my eyes why should i lie grown men even cry we are human my whole life i barely had a thing but the small things in life will always bring happiness like a man with wings free to fly away from everything.  not too happy of this life of sin so i get it out through this pad and pen when i reach the gates will they let me in? i've been through it once and never again i'm stuck in the middle of day and night.  i do know what's right and wrong i do what i must to carry on.  it will be this way until i'm gone just remember me when you read this poem life goes on. ,653,2.877936840057373,3.303143262863159,3.1623730659484863
48392,Trolls,steven,12,the hamster rolls in a ball             he was almost eaten by a troll. the troll came back to bad oh well it was only for an ad. ,131,2.3803534507751465,3.172581911087036,2.9329288005828857
111217,The Fall,steven,12,where i stand i am looking at what was once a field of corn now its nothing but ash   where i stand i see an old mansion reduced to nothing but a burnt out hollow shell   where i stand i see the chains of the enslaved liberated by those yankees   where i stand i see men who i called brother only to be betrayed   where i stand i feel the tighten of my neck only to think about my wife and children   where i stand i draw my last breath only to see the fall of the confederacy,479,2.3425097465515137,3.318085193634033,2.8979012966156006
119748,Window Sill,steven,12,a beautiful world lies behind a barrier the world i know is this cursed interior i can only dream what i see through the window for what lies behind i do not know  all this time looking through the window sill how come it never seems real i do not know what may lie on the other side although i know i would not deny a try  i've never known anything beyond this window sill but looking through it makes me feel like i'm only two steps away from my dream but from this side it is only a dream it seems  the beautiful world lies behind a barrier the world i know is this cursed interior i can only dream what i see through the window for what lies behind i do not know,669,2.739757537841797,3.19347620010376,2.889885663986206
112964,Life is going on...,sudarshon,12,"life is going on. . . .  i want to stop it.  but it may not be stop it like a river.  just flow and ever flowing. . .  hope of sediment has deposited when it arrived at flat area,  and it may erode when flow at gentle slop.  like as river,  boulder of problem may change into fine sand on the way .  so,  as of strong hope of river to reach the ocean.  ok,  let's hope! every experience of difficulty should lead towards victory!",417,3.238973617553711,3.370071649551392,3.270692586898804
116038,Mother,summer,12,"when i see your eyes shining in the night,  i feel a world of pain making me cry,  why are my feelings filled with so much fright,  it seems to me you never even try:  my love for you will never ever fade,  i have found many reasons not to stay,  and for all of the times you have portrayed,  it seems my life has stopped in all wrong ways:  so when i think of every kind of hate,  my mind races all around this whole world,  but now my mind is focused on my fate,  now my mind is slow and the past is hurled:  iâ’m sorry mom but you know i have tried,  our time is over they know you have lied. ",588,2.22937560081482,3.48258376121521,2.846979141235352
115977,Mother,summer,12,"when i see your eyes shining in the night,  i feel a world of pain making me cry,  why are my feelings filled with so much fright,  it seems to me you never even try: my love for you will never ever fade,  i have found many reasons not to stay,  and for all of the times you have portrayed,  it seems my life has stopped in all wrong ways: so when i think of every kind of hate,  my mind races all around this whole world,  but now my mind is focused on my fate,  now my mind is slow and the past is hurled: iâ’m sorry mom but you know i have tried,  our time is over they know you have lied. ",586,2.2262861728668213,3.487121343612671,2.845792531967163
115684,I am alive,sunitika,12,you came into my life like a flying mayer you saved me from my past bitter affair with you i decided to spend my whole life to share but you proved to be just a player  you gave me sorrows that i canâ’t compare about your misdeeds i was never aware i thought you would do lots of care   but suddenly your wicked plans made me aware your love was like castle in the air your look was like a millionaire you were my evening prayer but you were not good that was declared   i thought you would be my life thought you would be my pride but  every day you killed me inside for so many nights you made me cry but see i am alive my good time has arrived see i am alive  and my soul is   divine,690,3.1197850704193115,3.603271961212158,3.192016839981079
115860,Endless Footsteps,sup,12,walking through a lonely black road building hopes more n more. . .  dreaming with every drop of rain even sheding tears again n again. . .  no fun to take part no fear to leave apart. . .  walking together for awhile considered to be so worthwhile. . .  unspoken words are plenty still everything left empty. . .  missing a beat with every talk it is endless footsteps having a walk. . . ,374,2.616469383239746,3.249566078186035,2.909874677658081
30239,I Know a child,susan,12,"i know a child that needs some love i know a child that looks from above i know a child that tells silly jokes i know a child that reads all there books i know a child that plays alot and then looks.   i know  a child that has been through so much in so little a time in there only little lives i know a child that doesn't know why,  i know child that crys some times  i know a child that ask's for the answers why,  i know child that keeps seening i know  child that hurts each day.   i know a child that gose down on one knee and pray's asking god to guide them on the right road.   i know  a child that falls and picks them selfs up ,  i know a child with an inquistive  mind asking all of one's questions in this fair land ,  i know a child that completely is dissapointed in lifes little battles but i know this child can concure all and win in there own tiny excisitance for a child is a gift from all that is life and lifes so presscuois a gift just like a bueatie of.   a bright redrose and with tiny petal that grows for each one is this child in one for i know this child has now just begone.  i know a child that the loves all gown for like a redrose the child also can. ",1175,3.1024036407470703,3.227126121520996,3.1466023921966557
18275,Wake Up Call,susan,12,"when i awoke one morning,   a stork was on my head i asked it  ''what are you doing here?'' and this is what it said: ''madam,  you snore so loudly! do you really have no clue? while you're here snoozing soundly- we're wide awake in timbaktoo!''",246,2.785324811935425,3.684780597686768,3.181105375289917
37895,That Kind of Friend,susan,12,"let me be the kind of friend that you have been to me; one who's full of kindness and rich in loyalty.   let me be the kind of friend who will be the sort you need.  to fill those empty spaces with the planting of a seed.   let me be the kind of friend who will nurture the seed to grow,  and blossom beautiful flowers in times you're feeling low.   let me be the kind of friend whom you can understand,  for i know when i can't smile you'll be there to take my hand. ",464,3.5662176609039307,3.3354172706604004,3.3536698818206787
37894,The Gift,susan,12,"god made us men and women,  to love and share and give,  to learn of his great plan for us,  to teach people how to live.   but for now we only wonder,  about this thing called love,  is it as crashing thunder,  or as soft as a gentle dove?  things that we don't know,  that we don't quite understand. . .  why do they always seem to glow when they hold each other's hand?  love is many myriad things that is partial to only a few found even the conquering king that better than one is two.   love holds no fear; keeps no guile,  but is always honest and true.  it's a gift to make us smile,  when we finally say,  ''i do!''",611,3.5883548259735107,3.471141815185547,3.2728726863861084
27089,Cool,susan,12,"girls,  girls they are cool!",30,4.185137271881104,3.9839916229248047,3.4028093814849854
66525,CATS,susan,12,cuddley always there tempermental soft,41,3.188803195953369,2.931912422180176,3.1704518795013428
16807,Lake Side Feelings,suzanne,12,"as i look out on too the world the moring dew is still fresh the sun is  rising in the mountians and the birds fly freely  i look out on the lake and watch the sun sparkle off the cool glassly water  i see a loon off in the distance glinging through the water he calls out,  yet there is no answer to his cries he seems so lost and lonley and yet at the same time he seems at peace as i sit alone on the dock with my toes in the water,  looking out at the world i to feel at peace",482,3.377023220062256,3.2988224029541016,3.1489875316619877
39599,With,suzette,12,"with   with the unique ability to control oneself,   i shall try to understand  how you put life so simply i donâ’t think i can comprehend.    with your calmness under pressure and your selflessness under strain i shall try to rise up to you to live beside you once again.   with the refreshing appeal of your soul it has driven me to my knees how could you have it all,  while i have been released?  with your tendency to smooth the edges,  i shall remorse and reprimand  and i canâ’t compare to this perfection i canâ’t seem to reach its highland.    with the strength you have sacrificed,  to display your vision on life i will never be able to achieve that gift so i will continue to strive.   with this pain i hold in front of me,  in one touch,  you can take it away your purity has left me baffled  and for my impurity i shall pay. ",832,3.254158973693848,3.4748783111572266,3.2680819034576416
