id,title,author,grade,text,char,valence,arousal,dominance
26375,And This is What He Said,tammy,4,"when i woke this morning,  a stork was on my head.  i asked what he was doing there and this is what he said.   ''i was flying 'round late last night with nothing much to do.  i saw your open window,  and into it i flew. ''  ''i landed on your bedroom floor and much to my surprise,  i didn't like the feel of it i'm used to being in the skies. ''  ''i did not know what to do i was really beginning to fear.  but then i saw where i could build a nest,  so i built one in your ear. ''",476,2.9318227767944336,3.3499951362609863,3.0606682300567627
116090,Me and my pet spider in star wars,tamson,4,"a battle droid took my spider, so a sith sliced the droid in two, took the spider,  got a bo bo from mt commando droid, the commando droid took the spider, and gave me my pet spider. ",180,3.3204762935638428,3.2913620471954346,3.271376609802246
73190,~Best Friends~,tamyra,4,best friends are your girls til the end they have your back no matter what best friends are like your sisters through thick and thin they're the ones we mainly turn to when things go bad. ,190,3.437023401260376,3.3519465923309326,3.2786083221435547
73179,Gold is not everything,tamyra,4,gold is not every thimg but i peace of brick. .  if you are kind enuff you will share that brick. .  if you build your house with that brick you wont like it. . .  because you will smell stinky and smell like muffen. . . .  so now you know that gold is just a peace of brick. . . . .  you cant party with it remember its just a brick. . . . ,324,3.1307520866394043,3.19002103805542,3.2682816982269287
73174,I wont turn red!,tamyra,4,"i wont turn red,  just because i ate a apple seed.  i dont want to look like a apple head.  i wont turn red,  just because i ate a apple seed.  i cant stop thinking of it in bed.   i wont turn red,  just because i ate a apple seed.  just stop telling me! i wont turn red,  just because i ate a apple seed.  look at me im a apple tree!  i wont turn red,  just because i ate a apple seed.  your making me want to pout! i wont turn red,  just because i ate a apple seed.  just let me try count. . ",481,2.417889356613159,3.6196322441101074,3.296936273574829
73183,Who Am I?,tamyra,4,"who am i?  by la'kisha j.  grade 10,  tennessee  who am i,  think back,  and figure out,  am i not a woman,  full of love,  for the family,  i am black and beautiful,  i am a strong african woman.  who am i,  think quick,  and make no mistakes,  am i not the first brave one,  out of all these haters out there,  am i not the kind,  whom i love;to me,  he's so divine,  he is the one i can't resist,  no really. .  who am i,  i'm not exactly,  a beauty queen,  but i am a pretty thing",464,3.40242075920105,3.444761276245117,3.281453847885132
82218,The White Hopper,tania,4,its has a big pink ears  it hops and haves tiny feet it digs hoels; im white. ,80,3.0956130027771,3.062278985977173,3.168086290359497
37079,Me and the Frog,tania,4,"when i awoke up one morning,   a frog was in my head.  i  asked ''what are you doing there little frog?'' it looked at me and said ''can i live in your head for the rest of my life''? i said ''no'' because i'm not your wife.  i am a little girl that don't like frogs but instead i like dogs,  because they are small. ",315,2.6526362895965576,3.397536277770996,3.0870766639709477
23483,LIFE,tanisha,4,love is something you give and  i give everyone love finding love is very  exciting and greatful,101,4.558581352233887,3.9035165309906006,3.4664676189422607
110919,Mothers,tanisha,4,"mother you are very kind when i ask for something you never mind.  when you travel,  i cry when you come back,  i smile.  you are a treasure when you are with me,  its a pleasure  mother your heart is made of gold my love for you will never grow old  east or west                       mommy you're the best!",306,4.3257365226745605,3.871089458465576,3.377951145172119
113113,The Softball Rookie,taniyah,4,they call me the big bat the  slamin jamin rookie the throwing arm the athletic catcher    the flash runner the ground slamer the biggest and meanest player the magnifecent player the rookie of the game the most talented player and the best player you will ever meet. ,270,3.6935572624206543,3.58264684677124,3.3728461265563965
73309,The Eraser,tanmay,4,"i didn't do my so,  i had a rough day with my master.  eyery body called him sir.  i was sitting a cold ledge,  because my master of the edge.  i'm very very tiirreed. ",165,2.9228265285491943,3.2011330127716064,3.150449275970459
83607,CATS,tanner,4,"hyper, lazy,  running, jumping, sleeping,  big, fast,  need the open tiger",71,2.9508495330810547,3.350391387939453,3.1725099086761475
42308,Fly,tanner,4,i wish i could fly so high in the sky i wish i could sing so high in the side i wish i could dance around in my house. ,121,3.440759420394897,3.6084136962890634,3.138645887374878
32932,Monkey Business,tanner,4,"one morning i was at school a monkey was on my head,  i asked,  ''what are you doing there?'' it stared at me and said. . .   your head is like my tree  so i came her to see if you had any fleas. ",193,2.7764930725097656,3.3086671829223637,3.0701308250427246
38489,Drums drums,tanner,4,"drums drums can you hear them        pounding in your ear?     i can i can they sound cool.       pound pound,  bum,  bum,  bum. ",127,3.1717722415924072,3.268859386444092,3.168186902999878
54446,Tigers,tanner,4,"tigers very tough eating,  growling,  running like flashes of lightning cats",78,2.6115736961364746,3.345523834228516,3.06673264503479
54069,Tanner is a clammer,tanner,4,tanner is a clammer  he is  a lot of fuss some day he'll drive a bus. ,72,2.813732624053955,3.0444469451904297,3.1294257640838623
86561,The snowday in,tanner,4,when school is canceled  and there's nothing to do you play a game or two.  some times it's warm  somtimes it's cold  and before you now it  all the snow is melted. ,166,3.085865020751953,3.065087080001831,3.1710712909698486
28788,The new kid.,tanner mann,4,one day a new kid came into the room. his hair looked like a ugly brown broom. his shoes wher so ugly they sould be in the news. his pants look like a tail that wags. his shirt looks like a old paperbag. out side the only thing he would play is tag. then i thoght if he's all that his his house should look like a rag. ,315,2.5781359672546387,3.084207057952881,3.0430796146392822
120695,Grandfather Tree,tanya,4,"in my huge backyard,  there is a nice little tree.  itâ’s leaves rustle in the wind. .  on my face i feel the breeze.   and on that tree,  hangs a tire swing.  i hop on,  birds chirping near.  i swing in that tire. . .   until,  the last candle blows out the sun hides behind the mountains the last song is sang. .  until the sun sets. ",323,3.2917797565460205,3.1392006874084477,3.206949472427368
25199,Perfectly Made,tanya,4,"chickmunks and picnics galore soft breezes,  trees,  shade it's perfectly made a picnic i won't ever trade!",108,3.836519241333008,3.5622241497039795,3.396458625793457
25200,Count On Me,tanya,4,"count on me through thick and thin a friendship that will never end  when you are,  will be strong helping you to carry on i can feel the misery i can feel the pain 'cause when i see the light come back there's just a sudden change but when i see you my best friend true all the fright goes away so count on you,  can count on me?",331,3.2438886165618896,3.501654148101806,3.233591079711914
59944,Unlucky Day,tara,4,"today's my unlucky day,  i got stung by a sting-ray,  coffee spilled on my shirt,  i tripped and fell on dirt! the water in my shower turned cold,  in my house,  there's mold! people at work made fun of me,  when i was entering at work,  i lost my key,  a man punched me in the face,  i lost the grand race! i knocked my head on the wall,  i got a scary phone call.  i got lost in a river,  my grandma made me eat pig liver! oh,  today sure is my unlucky day!",449,2.1415529251098637,3.5885329246521,2.8582310676574707
92092,Softer than a Cotton Ball,tara,4,softer than a stuffed animal softer than a fluffy blanket softer than a new pillow softer than a puffy snowflake softer than apiece of cotton candy softer than the sheets on my bed that's how soft my cat's fur is. ,218,3.655326366424561,3.3728222846984863,3.309332132339477
75507,What am i.,tara,4,"i run in a meadow,  i am black and brown,  i love to chase cats,  and i live in a little blue house,  what am i.  i am a dog. ",123,3.241509437561035,3.220417022705078,3.209275007247925
41767,Nazareth,taren,4,"nazareth is the best it's so small.  the best in the west,  and none of the buildings are very tall. ",101,3.6034820079803462,3.3089439868927,3.351014375686645
88030,We Are Family,tarrah,4,"we are family,  even though your fatter than me.  we are family,  even we are leaning about matter.  we are family, ",115,3.40635347366333,3.3719332218170166,3.3832623958587646
88014,My Mom,tarrah,4,"my mom likes peaches and she likes to go to beaches,  when she was born she didn't eat corn. ",94,3.357102394104004,3.1169066429138184,3.2437937259674072
28790,Quieter Than The Whispering Wind,taryn,4,"quieter than the whispering wind,  quieter than a noisy clock ticking,  quieter than my grandpa snoring.  quieter than a woman pouring,  quieter than a young man muttering,  quieter than dinosaur sleeping.  more quieter than my computer snoozing,  much more quieter than my violin playing softly.  that's how quiet a paper land. ",323,2.91921615600586,3.1634631156921387,3.091803789138794
75654,SPONGEBOB,tasha,4,"cute, wise, smart boy, character, favorite spongebob, patrick, mr. krabbs a sponge i am  who am i? who is he?",161,3.5286989212036133,3.270310401916504,3.2365939617156982
27834,Swimming,tasha,4,"i love to go swimming on a saturday night.  when there is nobody in sight.  i like to do some funny things like swim around like a funny clown,  and act like a sad bad stubborn man.  those are the things that i like to do.  what about you?",237,3.576422691345215,3.3819174766540527,3.27266001701355
81676,Kittens,tashjai,4,"kittens soft,  cute,  playful .  pouncing,  purring,  licking.  they are such playful,  cuddly pets.  feline",105,4.028342723846436,3.58730411529541,3.2941458225250244
96074,Spring Makes Me,tasnim,4,spring makes me as plants need water spring is a big rainbow spreading in my life spring sings as summer dances  spring makes me as a flower needs its petals spring makes me what season makes you?,199,3.642489433288574,3.430196762084961,3.262282609939575
37021,Cats and Dogs,tatiana,4,dogs are barking  cats meowing that is the sound of animals talking. ,71,2.991258144378662,3.25278115272522,3.137267827987671
89464,The sky:),tatiana &amp; allison,4,one day we flu into the sky.  then we started to fly.  and the next day we landed in hay.  then that was the end of the day!            yay!!!!!!,145,3.785463333129883,3.831336498260498,3.371809720993042
47330,Marvalo with a rocket!,tatiyana,4,"there once was a guy named marvalo,   he went to the housing store to buy a  rocket.   then he blasted to the moon,   all the way to the moon. ",143,3.33936071395874,3.3053927421569824,3.2714948654174805
47343,When I went to the bathroom!,tatiyana,4,"once there was a morning when i went in to the bathroom,  and i happened to turn around and saw an owl taking a shower.  so that's when i said to it, ''how &amp; why did you get in here''.  so he respondedlike this.  ''w-well,  one of your windows were open &amp; i came through.  hopefully that did not bother you''.  then i said no more. ",334,2.829423427581787,3.17069149017334,3.107485771179199
17737,Clouds,tattianna,4,"clouds are up in the sky up there way up high while birds fly wild and free and somtimes i feel god smiling upon me the clouds take form of what they see they turn to a duck, a bee or even a tree clouds are beautiful and white its a shame when i cant see them at night scince its night and theres no light ill have to say ''goodbye''",335,3.542933940887451,3.5076401233673096,3.219947576522827
93163,My hippo,tatum,4,"my hippo is fat,  my hippo is plump he says all i want is lunch, lunch,  and more lunch              my hippo sleeps,  my hippo jumps,  but my hippo is still very, very plump. ",172,3.3539280891418457,3.3600053787231445,3.240224599838257
95463,Faith,tatyana,4,faith  is  a   name    that  like rains .     when   you   go   in   the   store  you  rille  want  to   know  who''s  faith  ?  do  you   know?  iknow.    yes i kkkkkkkkkknow. ,177,3.1753995418548584,3.204174518585205,3.2111563682556152
106908,Snake,tatyana,4,snakes are deadly  their fat and fluffy  and their venomous too. ,67,2.346642255783081,3.24674654006958,3.0958971977233887
87827,My apple appitie,tatyana,4,"almost every afternoon.  i eat apples with a spoon.  every evening right at nine, ieat apples stacked like a hive. ",114,3.216343402862549,3.0570497512817383,3.2430574893951416
91939,ME,tavaughn,4,i am tall brown i use the phone why am i trap in this buuterfly dome when i see you in the night i get a fright i hate new york alexander not a dork i go to church a man ate my shirt,185,2.2404587268829346,3.517863273620605,3.026363611221313
118734,Just one more minute.,tavin,4,whenever i yell for them they say  just one more minute  i start to get upset  and they say  just one more minute  there food's getting cold and they say   just one more minute  i'm coming down to get you and they say    just one more minute  it's 8:00! they say   just one more minute. ,289,2.4827141761779785,3.451771974563598,3.0310001373291016
84850,Close Your Eyes,tayla,4,"close your eyes,  and open your heart.  believe in yourself,  cause thats where it starts.   the magic is soon,  soon to come true, but right now its time for me to love you. .   me to love you. .   me to love you. . . . . . . . . ",215,3.889141082763672,3.733831167221069,3.445974588394165
35155,Basketball,tayler,4,basketball in basketball.  i always fall.  but it is ok because i like to dribble the ball.  i like the way we dribble up and down the court but basketball is my favorite sport.  that is basketball. ,197,3.463164806365967,3.2889389991760254,3.2727246284484863
45472,You,tayler,4,you are you i am i have your own personality so be you  and i'll be me!,74,3.624115228652954,3.5826964378356934,3.384714841842652
38895,Why are You Here,tayler,4,"why are you here? and why i'm i? i was jumping on the trampoline.  and when poof,  i'm here, what happened to you?        oh by the way do i know you?",150,3.0105319023132324,3.402169704437256,3.0681140422821045
25415,Death has no mercy,taylor,4,death has no mercy but he never saw my dad's socks  and that's nothing to mock one night death went to my house as quiet as a mouse suddenly he smelled my dad's socks and went zap and my dad continued his nap. ,212,2.353294849395752,3.300443172454834,2.970270872116089
32178,Stephanie,taylor,4,"sweatness inside everywhere touching her storys always are encourageing she has always been pretty as a flower helpful she will always be always there nobal intelligent extraordinary beautiful ready outstanding whatever  never misunderstood!          happy  mother's day,                 taylor",297,4.001646518707275,3.642025947570801,3.3378846645355225
15903,The Bunny Bus,taylor,4,"all aboard the buuny bus, pay your fares, and do not fuss. you will find your ride ideal,  there`s a hare behind the weel. passengers, pleas keep your seats as wee speed along the streets.  when you`re going anywere,  rabbit transit gets you there. ",243,3.319251537322998,3.2009615898132324,3.340970754623413
59494,turtles,taylor,4,some  turtles use vivid ( colors while painting ),52,3.1409051418304443,2.949263095855713,3.1691830158233643
45612,I Am crazy about Horses,taylor,4,"white, black, bromn, tan prouncing, kicking, grooming, licking i always whanted a horse.  but my mom siad, ''no''.  so i made one out of doe.   iam crazy about horses. ",160,3.3196396827697754,3.3938891887664795,3.319231986999512
31418,I miss him,taylor,4,"he's been with my all my live, and i wasn't ready to let go, he was the only good thing in my live,  so i what him back,  so i can ride on his back, i miss him, his big black eyes, the big black horse,  i miss him. ",214,3.573892831802368,3.491377830505371,3.320622444152832
18850,Anger,taylor,4,"i think i know what anger is,  it's unfufilled desire.  when when you don't get something you want,  your feelings turn to fire. ",128,2.4790430068969727,3.27767276763916,3.0869100093841557
54749,The slipery dee,taylor,4,the slipery dee came out of the sea the sliperydee  ate everyone buthe did not eat me.  the slipery dee came out of the sea the slipery dee ate everyone but he did not eat. . . . . . . slerp,185,2.5421013832092285,3.158238887786865,3.021911859512329
30454,My Racecar,taylor,4,i have a racecar  it is a big red racecar  it goes very far,63,3.146917819976806,3.149502754211426,3.282604455947876
49292,My Friend,taylor,4,a funny friend really great at math is a very good person super at basketball,80,3.8441720008850098,3.4174180030822754,3.3197596073150635
29847,SOCCER,taylor,4,soccer is the greatest.  it is the latest.  i haven't played in ages.  if i did this poem would take pages. ,118,3.6460392475128174,3.5910308361053467,3.337446928024292
90972,"Tap, Tap, Tap",taylor,4,"the night whistles,  as i lay upon my bed,  all the joy runs through my head,  my heart is pounding with great excitement,   tap,  tap,  tap,  what's that?",151,3.8615550994873047,3.933469295501709,3.3345248699188232
54300,Distured Bird,taylor,4,one morning i fell out of bed. and then i saw only red. i looked up to see an enormous tree and an apple fell on my head. ,122,2.548189640045166,3.397913932800293,2.8146674633026123
18438,Kids,taylor,4,playful usually mind kids who mikd all the rules kids are very reliable and smart very nice  cinquain poem,109,3.6340155601501465,3.196095466613769,3.297130823135376
32554,The Scorpion On My Head,taylor,4,"when i awoke one morning a scorpion was snoozing on my head.  i asked, ''what are you doing there?'' it looked at me and said ''an ant stung me on the back and made me climb on your head and snooze. ''",202,2.515251636505127,3.487933158874512,2.9685990810394287
87366,Elephants,taylor,4,"elephants are so quite big his foot is about the size of a pig he only takes one shower a week thats why he will always stink he always plays in the dity mud  thats another reason bud.  now that you know how they are like why don`t you get one, careful they bite!!",265,2.485558271408081,3.344661235809326,3.1563847064971924
85839,The Love Story,taylor,4,i saw you walk over to me you were feeling kinda scared you told me ''i love you'' but you were dating someone else instead i was mad so i ignored you all day then i finally came up and said that ''i love you my friend'' and then ran away far away from him weeks and months past by so quick i thought i was in a dream he came up to me and said ''your secret is safe with me''.  i was so glad i kept a smile he wanted to stay a while i told him yes he could stay we became great friends forever. ,496,3.640810489654541,3.727576732635498,3.188860893249512
85757,The Secret,taylor,4,it`s was something you could have asked if i had liked you to  of course i thought all day in my mind you moved away so i mailed you  you awnsered me back the next day i was glad as i ever had been you told me you liked me too so put on a big fat grin i hope now you liked my poem  it`s something i`ve never done he called me back  and said that i was number one. ,366,3.757544994354248,3.572307109832764,3.2907168865203857
85431,halloween,taylor,4,halloween comes now crazy costumes fills the streets saying trick or treat,77,3.5222954750061035,3.5363402366638184,3.3026273250579834
30464,Swmming,taylor,4,swimming in a pool keeps me feeling nice and cool wish i'd swim at school,76,3.831409931182861,3.393287181854248,3.352745532989502
26677,Birds,taylor,4,"i hate birds,  they sing little words,  and they drop little turds.  a bird is not a hen,  oh how i hate to see them.  they live in trees,  and woodpeckers peck with ease.  they do alot of loud verbs,  and they also eat herbs.  oh how i hate birds. ",243,2.3480916023254395,3.377357482910156,3.082259178161621
27358,Animals,taylor,4,anteater  bird  cat  dog  elephant  fish  goat  hamster  iguana  jackrabbit  kangaroo  lion  monkey  newt  octopus  pig  quail  rabbit  snake  turtle  unicorn  vulture  walrus  xiphias (swordfish)  yak  zebra!,212,3.247615098953247,3.440113306045532,3.2023956775665283
118197,My tariffic eyes,taylor,4,my eyes are tariffic they let me see like an eagle in the sky eyes eyes wonderfull eyes they change colors as unique as an owl souring through the sky eyes eyes wonderful eyes they will be blue as the sea eyes eyes wonderful eyes. ,233,3.80109977722168,3.6480441093444815,3.2617785930633545
90217,Batting,taylor,4,"i went to a batting game one day.  there i saw gnat.  i decided to play.  then i saw cat.  ohhh no,  i sat next to gnat.  the gnat's name is moe.  the cat's name is snow.   when i was up to bat.  i looked at gnat.  then at cat.  after i got a double,  i thought could gnat and cat ever be a couple? naa, they live in a bubble!",316,2.9984192848205566,3.264979362487793,3.116928815841675
24385,When I awoke one morning,taylor,4,"when i awoke one morning,  a stork was on my head.  i asked, ''what are you doing there?'' it looked at me and said, ''oh the  winter's very cold today and my cheeks are turning red. '' i asked, ''but why oh my head?'' it looked at me with pain and said, ''i think i left a yellow stain!!!!!!!!!!!!!!!!!''",301,2.5695879459381104,3.666114807128906,2.9620683193206787
58588,MOMMA&apos;S LOVE,taylor,4,"bells ring while children play,  tiny feet run away.  winds are changing and so am i but nomatter what you care for all my cuts i have no doubt that you love me mommy",167,3.5383400917053223,3.522967338562012,3.28078293800354
18422,"Me, Taylor",taylor,4,t taylor that's me.  a animals i love.  y yacking on the phone.  l love going to the movies.  o olives yuck! r reading is my thing. ,130,4.06002950668335,3.7396178245544434,3.4246184825897217
21545,Color and Senses,taylor,4,red smells like a sweet rose in the summer.  blue tastes like a yummy blueberry sucker.  green looks like a great big juicy apple.  black sounds like a chrashing thunder storm.  orange feels like a big round pumpkin. ,215,3.6081442832946777,3.4035587310791016,3.256354808807373
35856,My Cousin,taylor,4,lots of babies will be born but you are special on and on.   i only wish you will grow up like me with a loving family that will be  waiting  for you to grow up and say how big you are.   you are my special cousin and will always be.  a loving  gift to you and me.   my trust will  always be in you  i  haved always dreamed of having a little brother  and i will be there like a sister.  i want you to know that i am thinking about you everyday  and hope you come to say that i love you cousin taylor and i will do the same. ,522,3.892352342605591,3.568401336669922,3.3135476112365723
35350,What My Family Means To Me,taylor,4,what my family means to me is well as not unsaid.   what my family means to me is out of harms way.   what my family means to me is in my future in my past.    what my family means to me is love and hate.    what my family means to me is all my life.  and all my soul and all my might.   what my family means to me is fun everyday.   what my family means to me is love from the heart.   what my family means to me is more then just a family.   what my family means to me has now just been said. ,488,3.64841365814209,3.4831323623657227,3.352018117904663
47308,Spring,taylor,4,spring walking and sidewalk chalking.  spring flowers and planting for hours. ,79,3.483288288116455,3.12612533569336,3.215214729309082
32516,&apos;&apos;love&apos;&apos;,taylor,4,"icky, mushy soft and gushy 'makes me wanna puke hug and kiss love-buggish ''thats what i said!'' but she still kissed me!",123,4.112220764160156,4.146637916564941,3.4068410396575928
16623,April,taylor,4,"april is a gloomy month,  a gloomy month.   it is rainy and full of gloom.   it is long and hard cold and gloomy,  rainy too. ",124,2.3603672981262207,3.0597102642059326,2.919717073440552
47231,Wesley,taylor,4,"wesley is my dog he likes water he loves treats he is very cuddley cute and sweet.  wesley is  sleepy,  small,  and loveble but when it comes to playing he is very livley.  he is very fun to be with funny mostly calm but when it comes to hair cuts he dosent like them at all.  wesley is white and likes to bark wesleys fury and a westie and he is an omnivore that is my dog",371,3.5377755165100098,3.241835355758667,3.251017808914185
45725,The Magnifacent School,taylor,4,this is a cool school it has a huge pool it has one rule it's carried by a mule and it sits on a stool its a great tool,122,3.722469568252564,3.376497268676758,3.338217258453369
45738,Breakfast,taylor,4,i woke up one morning and jumped out of bed. it smelled something like breakfast. it smelled good.  i was so hungry!i found out that it was not breakfast it was a dream i had!,175,3.786931991577149,3.967689037322998,3.300270795822144
111364,Can I Have a Turtle?,taylor,4,please can i have a turtle? i will feed it every day. i'll take it for walks and play. i will pay for the food. i'll give it baths and make it sell good. i will tuck it in every night. i'll make sure that it's alright.  so please let me have a turtle!!,249,3.441906452178955,3.409238815307617,3.3506181240081787
