id,title,author,grade,text,char,valence,arousal,dominance
36134,When I Saw You!,ashlee,7,when i first saw you i already knew you were the one i've been waithing for.  so if you are then you'll come to me soon. ,122,3.424107074737549,3.2957866191864014,3.294862985610962
36036,Kumara&apos;s Fight Against the Demon Taraka,ashlee,7,"the sun on a ghastly robe of great and terrible snakes,  curling together,  as if to mark his joy at the death of the enemy demon. ",131,2.9606382846832275,3.4322509765625,3.1350584030151367
99634,The Best Girl,ashlee,7,"my name is ashlee,  i swim like a fish,  i like breastroke and butterfly,  i like to eat alot ecspically pozza,   i have a mum and a dad that like talking to,  but my brother is annoying like a barking dog. ",204,3.2494521141052246,3.1939682960510254,3.1994667053222656
35707,Smile,ashlee,7,"a smile is contagious beautiful and free,  a smile is like sunlight pouring down on me.  a smile can be found from within the darkness lair,  so why are they so rare?",166,4.097760200500488,3.76995849609375,3.3566596508026123
101182,Love that girl.,ashlee&apos;,7,love that girl  like a snake loves to hiss.   i said love that girl like a snake loves to hiss.  love to call her in the morning.  love to call her,147,4.38060188293457,3.79677963256836,3.3269195556640625
103584,"Love,Love",ashleigh,7,"love,  love is in the air  love,  love he probably don't even care love,  love he does'nt even know love,  love how much more do i need to show for him to know how i feel love,  love i wish he understood some of the things he probably should love,  love i don't want to fight and try for him anymore love,  love just went out the door",330,4.242824077606201,4.050366401672363,3.402153730392456
104049,MY BUDDY,ashleigh,7,heâ’s a great soldier.  he is a tender loving heart.  heâ’s my hero.  heâ’s a big bear.  heâ’s clown.  heâ’s my favorite person.  heâ’s like a bank.  heâ’s my daddy!!!,164,4.087000370025635,3.75327730178833,3.354710817337036
51735,Brandyn G. and Me,ashley,7,"i always love to be with you,  to hear the things you say,  i love the things we share together,  in our special way,  the small things,  the important things,   whatever we may do.  brandyn, everything seems right whenever i'm with you.   i love you brandyn with all my heart!!!: )",276,4.269253253936768,3.855388879776001,3.3669192790985107
32803,A Special Person,ashley,7,"i know a special person,  she is my friend.  we share secrets until the end.  we play and laugh with each other,  and that apecial persom is my mother.  the secrets we say,  i will never tell,  because we know each other so well. ",225,3.767188310623169,3.4868412017822266,3.314971446990967
32370,Time To Think,ashley,7,"i like to have a time to think,  a minute will do.   it takes away my fears and puts hopes and dreams in its place.   i like to have a time to think,  a minute will do.  it makes me feel happy.  i think of memories of far away friends and close ones.  i like to have a time to think,   a minute will do. ",298,3.846353769302368,3.4833998680114746,3.287957191467285
76689,My Grandma...,ashley,7,"acts like herself no matter who she is with.  believes that jesus died for our sins.  cares about every person in the world.  doubles the batch of cookies for grandpa.  encourages me to do my best in school.  forgives me when iâ’ve done something bad.  gives to her church to support them.  helps me with my homework.  ignores any bad things said about her.  jumps on the spiders that are in her home.  keeps the promises she makes.  laughs when i get scared of spiders,  even the ones outside.  makes yummy rolls for thanksgiving.  naps on her water bed on sunday afternoons.  obeys the laws.  prays for the problems others are going through.  quiets my cries when iâ’m sad.  rustles through the leaves as she takes walks.  shares her faith with others.  tells the truth no matter what.  understands the actions of others.  values the qualities i have.  wonders what she will do in her free time.  xplains things that i donâ’t understand.  yawns when she watches movies.  zips up her coat when she ventures outside into the snow. ",1007,3.316861152648926,3.193170547485352,3.260127544403076
16949,What if,ashley,7,what if trees were upside down? what if you wore your shorts on your head? what if there was no t. v. ? what if you ate ice cream every day? what if weekends were 5 days long? what if parents were kids servants? what if teachers wore diapers? what if beds could fly? what if magazines were cardboard? what if people could fly like peter pan?,342,2.80325698852539,3.224165916442871,3.040125608444214
16964,Then,ashley,7,what if the trees were upsode down? then the top would be the bottom and the bottom would be the top.  what if you wore your shorts on your head?  then you would have changeable ears.  what if there was no t. v. ? then the kids would laugh and play.  what if you ate ice cream every day? then the world would be cold and yummy. ,327,3.5042507648468018,3.333667278289795,3.295393228530884
16933,The Unknown Adventure,ashley,7,"a long and winding journey,  life's highway,  unknown to me,  light and carefree, happiness,  dark, heavy, anger,  dizzily it goes round and round,  swirling and twirling. ",165,3.265698909759521,3.490708112716675,3.0865354537963867
16894,Waht if...,ashley,7,what if. . .  there was a light that shined down on me?  what if. . .  the grass was to fall from the ski?  what if. . .  there was a flower that made all good deams come true?  what if. . .  trees cold fly into the night?  what if. . .  there are curtians that nevr closed?  what if. . .  forks came alive to make people run for their lives?  what if. . .  there are really two moons that tasted like cheese?  what if. . .  there is a good and a bad?  what if. . .  there is a napkin that never got dirty?  what if. . .  there was love that loved everyone?,530,3.2348005771636963,3.3932223320007324,3.1343929767608643
16863,Scare,ashley,7,"sitting on brown blankets,  i worked up a real scare,  things began munbling,  crumblimg, tumbing in my ear,  mysterious things are near,  staring at me with a glare.   twisting and turning my stomach began,  quentching and squeezing,  my toes ran,  dripping,  drip,  sweat fell from my head.   thinking and blinking my toe peeked out,  grabbing and pulling my arm reached out,  thinking with thought i had to get out,  out of the trap i had no dought.   turning around they,  they still had a glare,  turning around,  it gave me another scare,  runing from what,  i have been,  running away from who i am. ",589,2.5746870040893555,3.584440231323242,2.8941996097564697
16353,The Beach,ashley,7,the sand between my toes the waves rolling in a gentle breeze blows i wish i had a fin so i could swim fast and have lots of fun it would be a blast having fun in the sun,174,3.889719009399414,3.624617576599121,3.330080509185791
23032,Sour  Pickles,ashley,7,sour pickles are worse than sour people;  when they are worse than pickles that's bad. ,89,2.45840072631836,3.03971004486084,3.1277315616607666
88535,Fat Cat,ashley,7,"once there was a fat cat,  he woke up from his nap and was looking for something that would please his stomach.  he jumped up on the fince and saw this fish market,  and by jones,  he loved fish.  he walked his little tail to the fish market and started to pig out on tuna and troat and even salman.  he ate and ate and ate,  but was still hungry.  so he kept eating.  then he saw this beautiful white fluffy fat girl cat and stoped eating.  he cleaned off the sraps of fish on his fur,  and walked over to the pretty white fat girl cat.  she looked hungry so he showed her all the fish in the fish market.  she was pleased,  she walked over to the fish market and ate all she could.  he asked her where she lived so he could walk her home,  but she said she didnt have a home.  so he invited her to come and live with him.  she of course said yes.  they both walked home.  when they got there,  being fat cats and all,  they went straight so sleep.  the end",938,3.48602294921875,3.41399359703064,3.2443602085113525
42656,My dog,ashley,7,dogs are fun but some weigh a ton they are sweet but they love to sleep that good ole dog. ,93,3.65839147567749,3.3884482383728027,3.3116796016693115
35362,Bear,ashley,7,my dog's name is bear it is abut him so here it go it is something like this. . .  b e a r   b is for bear my name   e is for i like to eat  a  is for my owner ashley   r is for right,184,3.093841075897217,3.0096921920776367,3.2077133655548096
25187,Bubblejum,ashley,7,"bubblejum is very yum taste so good you''ll want some chompin,  chewin,  smacking doing the yum,  yum bubblejum bubblejum is very yum. ",134,4.032324314117432,3.5988926887512207,3.332560539245605
94398,My little sister,ashley,7,my little sister is annoying she sits and crys  she will never leave me alone  she wants to go out but i tell her no and she goses and cry my little sister wants to run auay bt i always lock the door and she will never get away my sister loves me so much she won't let me go my sister is so cute but when she lies shes not that cute,336,2.4330081939697266,3.4810566902160645,3.0484659671783447
24382,Dreams II,ashley,7,"the way to dream is clearly letting your feelings come to life,  bursting with laughter and joyfullness  the way to dream is deeply letting your imagination flow free,  through the deep blue sea for all the world to see  the way to dream is peacefully while you have the time alone joyfully,  merrily,  and happily you see you can be anything you want them to be  the way to dream is briefly going to a world of your own not staying very long  the way to dream is continuously never holding back a thought, into a world youv'e never known  the way to dream is swiftly letting your dreams run throughout the night after everyone has turned out the light   the way to dream is gently laying your head on your pillow pretending to be sleeping quietly under a willow. ",761,3.8575711250305176,3.681767702102661,3.300903558731079
73336,Natures Music,ashley,7,"soothing sounds of whispering winds  glowing trees  and flowing flowers  merely sitting there for hours  passing the time with  writtings of love and never ending stars above  whispering winds gently lifting,   lifting me forever past  the never ending blades of grass",270,3.761631965637207,3.5335867404937744,3.2750301361083984
84974,Bad Day,ashley,7,"drip drop  the rain so light the walk so slow  wich was not a delight.  the puddles splashed  the sun was away of course you can say im having a bad day but i walked to school  gloomy and dull wondering when my day would get wonderful when i reached my class  i looked around that nobody was there there was no sound i ran out the class room then down the hall nobody is here at the school nobody at all!  i ran back home to tell what had happend she was in her room laying down still napping!  ''mom!'' i snapped.  she slowly awoke from her nap.  ''no one was at school,  quiet as may. ''  she replied,  ''of course no ones there. ''  ''its presidents day!''",656,2.5640010833740234,3.500746250152588,2.9342174530029297
23076,"Me, Myself, and I",ashley,7,"one day i seen a girl as pretty as can be,  when i went up to her she said let me see,  i said how did you know that i wanted to see your dolly? she answered, ''go ask mommy. '' her mom said that she could read minds,  i ran through the pines;let me get out of here,  then i got shot in the rear!",293,3.0038866996765137,3.653173685073853,3.1600940227508545
23827,The way to count the stars,ashley,7,the way to count the stars is patiently.  counting them one by one.  making sure you count them all.  the way to count the stars is continuously.  night after night never giving up.  the way to count the stars is peacefully.  relaxing in the darkness of the night.  lieing on the soft green grass.  the way to count the stars is cautiously.  wondering how many stars in the sky.  never knowing when you are going to finish. ,416,3.519836664199829,3.265043973922729,3.209045171737671
23824,Dreams,ashley,7,the way to dream is to silently lie your head down on your pillow and slowly escape into another world.   the way to dream is to absently be in your own world.   the way to dream is to repeatedly think of thoughts that may never happen.   the way to dream is to slowly slip away into another world.   the way to dream is to. . . ,325,2.804159641265869,3.0517895221710205,2.9334895610809326
39607,Friends,ashley,7,"my friends are like my sunshine,  they brighten up my day.   they are all the best,  in every single way.   they always try to cheer me up,  whenever i am down.   they always make me smile,  they never let me frown. ",211,4.175584316253662,3.716862916946411,3.355282783508301
39609,Special George,ashley,7,"i have two eyes and a nose,  george has names for all of his toes.   i like hanging at the mall,  george runs head first into walls.   i like math and spelling bees,  george likes talking to the trees.   i like sports and racing too,  george enjoys eating glue. ",257,3.4624176025390625,3.2114481925964355,3.248850107192993
96077,Sunshine,ashley,7,"the sun is day the moon is night as bright as be you see me not ionly look down no matter what i see you all are always bussy no time to sit and look im a real beauty nomatter what you never notice me whatever i do to make you know im so lonley , you will never notice. ",271,3.539475440979004,3.5755152702331543,3.315098524093628
28198,The Sky,ashley,7,"when i look up at the sky my head fills with wonder and i have to sigh i daydream a lot better than any person sings the clouds make me think of all sorts of things there's shapes of dragons,  birds,  and things down low things not even a professor would know the sky is just an endless space i could stare at it forever never setting a pace the sky gives me a feeling in my heart from this current world i depart i imagine myself floating on a cloud i can always be heard; i don't have to be loud when i look up at the sky i get butterflies in my stomach and no one else knows why. ",583,3.633158683776856,3.6006345748901367,3.2671778202056885
34375,*Friends*,ashley,7,"friends are like a butterfly,  if you catch one,  don't let go.  friends are like a shadow,  there always right beside you.  friends can finish your sentence up,  before you even finish it. ",187,3.355867862701416,3.318446636199951,3.2423746585845947
34433,Friends,ashley,7,"true friends are always good to have.   they are there for you when you need them the most.  if not they really aren't yours truly.  through all the fights,  tears,  and laughs you got through it together",202,3.49674391746521,3.3785853385925293,3.293613910675049
32856,My cat,ashley,7,my cat is like a tiger he is orange with stripes.  even if he scratches me i still love him so.  i love him in the winter  time even when it snows.  i love to watch him when he sleeps.  he is so silent and he never makes a peep.  and when he is awake he is wilder than a snake.  he is playful but not so kind.  im proud to say he is only mine.  and if he runs away someday  i will be so sad.  ill laugh and cry while i remember the good times that we had. ,450,3.454932451248169,3.481416702270508,3.2191309928894043
32842,The Four Of Us,ashley,7,the four of us all for one and one for all  best friends forever each other we call never split this quad up  or else youâ’ll be in trouble  we stand up for each other  and cheer when one hits a double  we will be and are best friends for life  thru thick and thin together we will be  these girls are awesome  and you just wait and see  weâ’ll be together forever  donâ’t get mad when  in our group you canâ’t be,417,3.661577224731445,3.755155324935913,3.4572274684906006
18213,My Puppy,ashley,7,my puppy is the sweetest thing she always cheers me up when ever i am down she makes me so happy that i forget all about my troubles and cares and they just float away  her fur is so velvety soft and the was she wags her tail  is just so cute that when ever she does something bad i don't want to punish her i want to cuddle with her  she is a guard dog but she is really sweet inside that is why she is the on the only one for me,433,4.029131889343262,3.684567451477051,3.3484365940093994
46260,"Introducing, Bay-B",ashley,7,"my dog is small.  other dogs in our neighborhood are big or tall.   she's a trouble maker  she cries a lot so we call her a faker.  she doesn't run she hops a lot not after mailmen but after cops.  she's always sniffing something like grass she also runs very fast she can be sweet but also tart,  and you should get away when she's about to fart sometimes when we go to the park we lay hardly at night and usually in the day shes he best pet i've ever had even though i can get mad. ",481,2.7372617721557617,3.278533697128296,3.1633331775665283
25183,That Special Someone,ashley,7,"that special someone,  when saying that love means never having to say your sorry,  forget times you walked by,  forget the times you made me cry,  forget the times you held my hand,  forget the sweet things,  if i can no longer pretend now and forever your just my friend. ",270,3.2026658058166504,3.5350329875946045,3.105944871902466
24488,The Monkey on My Head,ashley,7,"when i woke up one morning,  there was a monkey on my head.  i asked him â“what he was doing here?â” he just looked at me and kept that little smile on his face but i could not help my self to smile  i felt some thing at the bottom of my bed, it was my baby brother luke,  and on my head was his stuffed monkey that he had left on my head  when he was palying on my bed",368,3.4890029430389404,3.459913730621338,3.1645102500915527
24660,A Rainy Day,ashley,7,"the grass is wet and feels  good touching my toes,  i like playing in the rain  with my friends during  a spring shower,  getting  all wet and running around chasing the little children up  and down the street,  trying to  wipe the mud off their face,  that  way they donâ’t get in trouble. ",291,3.6548354625701904,3.4898838996887207,3.2703633308410645
65227,Why,ashley,7,every night i wonder why i wonder why people are mean why people don't like others why no one likes me why i always get in trouble @ home why?  it is something to think about,177,2.4048495292663574,3.219625473022461,2.924419641494751
31578,My Special Shoes,ashley,7,"so pink,  so perfect they latch to my feet and never let go the tips are worn and faded my toes can be seen wiggling through the pink leather outside is smooth and sleek and the once brown soles are black from use you put them on and they take you to another land another world where you can just have fun and not worry if anyone is watching",343,3.667060136795044,3.487002372741699,3.320396661758423
36411,The Moon,ashley,7,the moon is shaped like a diamond ring  it looks like a chocolate chip cookie.   it shines like a white and gray star  it's as beautiful as a ring to me. ,155,3.8100428581237793,3.5221590995788574,3.2716622352600098
106434,Not sure anymore,ashley,7,"screwing up on everything with every breath i breathe but some days i want to stop feeling like everything's wrong, sometimes i can but not for long the only thing about this is its leaving me here, alone and confused unsure of what to do, i try not to see it but i do i see myself every night curled up arms around my knees blood seeking its way threw. im gonna live with those scares not just those ones on my arms i have caused but the ones they have caused to leave in my mind. ",480,2.230818748474121,3.4405016899108887,2.84445595741272
25191,Matt,ashley,7,"i have a cat,  his name is matt.  he likes to eat; he's very fat! he sleeps all day; he's very lazy.  i tried to walk him,  he thought i was crazy! i signed him up for jenny craig.  he cried,  moaned and continued to beg! it didn't work; he was such a cheat,  every chance he'd get he'd eat,  eat,  eat! yes,  my cat matt is still very fat,  but i sure do love him no matter where he's at!",381,3.1713132858276367,3.53501033782959,3.2369091510772705
27634,Imagination,ashley,7,"i look into a book wonders held inside for me to find in my mind my own world,  swirled in a pile that goes round and every sound echoes. ",139,3.3793325424194336,3.4052178859710693,3.219759225845337
45807,A Friend,ashley,7,"she is nice and docile    i talk to her alot my inspiration everyday         i'm not alone for she will understand,  she's always there,        like the sun in the              sky.   through hard times and bad,          she is a friend  and friends are always there for you",273,3.659663200378418,3.3295960426330566,3.258864402770996
22068,The Mouse,ashley,7,"this computer mouse that we buy in the store. . . i know it's real,  i've heard it snore! our cheese disappears,  my cat meows more,  i've found a mousehole,  and droppings galore! it clicks,  but no squeaks; to keep undercover.  these mice cost much more because they are like no other! just make sure you keep a close eye on this rodent,  it's tricky,  it's mysterious. . . ; don't look away for one moment. ",398,2.912933349609375,3.4675896167755127,3.1910789012908936
22079,This Person,ashley,7,"he is the guide to all humanity.  he is the one who helps you through.  he is your friend until the end.  he makes you proud to be who you are when you are feeling blue.  he may not be able to talk back to you,  but you always know he's listening.  he helps your friends and your family too,  he is the compasionate king.  you should thank him for the little things you have,  like your favorite candy or computer game,  because he makes all things possible and he can take it all away.   but never forget whom this person is,  the one who makes all things true,  this person is the son of god who will always be there for you. ",617,3.652228355407715,3.421145439147949,3.337691068649292
62751,Rae,ashley,7,"there once was a gurl named rae,   she never had nothing to say,   she ran around and touched the ground that silly gurl named rae!!!",134,2.978543758392334,3.68867826461792,3.267395257949829
104600,Zoo House,ashley,7,living with my family is living at the zoo.  my mom is the bear always protecting her cubs.   dad is a lion ruling the whole place.  my brothers are monkeys  fighting all the time becouse  monkey see monkey do.  daphne is a hippo  lying on the bed all day.  i'm just the sectator watching it all happen. ,301,3.127107620239258,3.1559901237487797,3.1553971767425537
18683,Thunder Storm,ashley,7,"thunder storm is the lightning god,   he always would nod,    he sits in his chair,    at his lair,    so he can strike when its bare. ",133,3.10467529296875,3.1948671340942383,3.205259084701538
18685,Floppy,ashley,7,"there it started with a tear,    har arms floppy like bunny ears,        soon there was a whimper,    then a temper.        pretty soon she calmed down,     when her parents took her out of     town. ",200,2.726984977722168,3.3242290019989014,3.0154454708099365
117648,Morning Evening?,ashley,7,morning or evening it's of no value as long as in my life i have a friend like you morning or evening it doesn't' that matter by anything we go through we will stay friends forever,183,3.3524532318115234,3.3131062984466557,3.332915067672729
23026,A Day At The Beach,ashley,7,"the beach is a good place to sleep    some people go there just to weep.   i go there to swim and have fun    when i eat,  i eat a hotdog on a bun. ",148,3.640807628631592,3.447758913040161,3.3234522342681885
85759,Thankgiving,ashley,7,merry merry thanksgiving i hope you eat all of your turkey so your tummy is full  have a merry thanksgiving i hope you have fun i hope you are happy  when those bells ring merrry merry thanksgiving you will have a blast and all of your dear ones  will be there to last for a life time and you will have fun  dear all of your hearts thanksgiving is a lot of fun you will have everyone to eat your turkey with thanksgiving is a lot of fun!!!!!!!!!!!!,451,4.228743076324463,3.7943739891052246,3.40974497795105
21431,My clothes.,ashley,7,"very stylish clothes.  colorful in their own way.  now winter has arrived.  time for a chic winter coat.  turtle necks,  long sleaves,  and jogging suits.  christmas is on the way.  lots of clothes shopping to do.   not before long it will be summer again.  shorts,  tanktops no coats that time of year.  i wear very stylish clothes!",324,3.749177932739258,3.536830425262451,3.390329360961914
104358,Oceans,ashley,7,"misty, blue waters&lt;br&gt;glad colorful fishes glide&lt;br&gt;swift ocean queen wave",88,3.587144374847412,3.297950267791748,3.215930938720703
51639,Big Black Car,ashley,7,"my brother has a big black car,  he doesn't take it very far,  he offers to take me anywhere,  just to get me out of his hair,  i really don't care. ",147,3.0000452995300293,3.430964708328247,3.290405035018921
89282,Alexis,ashley,7,collects shiny colorful rocks is soooooooooooooooo funny is also kind and caring,83,4.043376445770264,3.568434715270996,3.3442907333374023
113644,Night,ashley,7,"night iâ’m in mexico sitting by the beach at night,  i see dark waves crashing,  the moon dancing on the water,  sand surrounding me, and boat lights in the distance.  i hear the waves,  footsteps going through the sand,  breathing,  somethings coming closer.  i smell salt water,  the dry air,  and calvin klein cologne,  i start to panic but soon realize its just luke hemmings",370,2.9433841705322266,3.32360315322876,3.0376572608947754
