id,title,author,grade,text,char,valence,arousal,dominance
15658,I Told Ya So,shannon,4,"\t        i told ya so i told ya so,  this is a red bow! i told ya so,  this is not a toe! i told ya so,  this is a green light,  go! i told ta so,  this will too glow! i told ya so,  i do know! i told ya so we are down low. . . .  oh no we're not!! so,  i knew that.   \t\t\t\t \t\t\t",276,3.323896646499634,3.607885837554932,3.3828916549682617
17263,DAY   LIGHT,shannon,4,a round yellow ball fell hot and humid and i come out every day and stand over you,90,3.2003369331359863,3.393553733825684,3.235239267349243
111955,My nose,shannon,4,"my nose is very large,  that is what all my friends say, it blarges out it goes out to way",91,3.020018577575684,3.112492084503174,3.212904930114746
17235,Horses/Donkey,shannon,4,"horses            runners, jumpers        loving, eating, sleeping       saddle,  neighs,  snort, pack       prancing, resting, dancing            fast, stubborn              donkeys",176,3.3109331130981445,3.2615041732788086,3.2190845012664795
17234,Wonders,shannon,4,"as the train whistles past and my wonders dawdle, i wonder of those who are sick in bed or those who are jumpers. i wonder of school if it is great or not and i wonder which math i'll be doing. to me a wondering mind brings me deep in the ocean where mermaids live in sea castles. to a wonder of shimmering mermaids or a king of ireland or france. i know that my wonders everyones wonders is a magic little dot right in your brain. ",429,3.3482587337493896,3.396736621856689,3.160045623779297
29852,Thunder,shannon,4,"thunder-it is loud.  thunder- it is not very proud.  thunder-it is scary, but it is not hairy.  thunder- it is amazing,  but it is not blazing,  for lightning is blazing. ",167,3.3649115562438965,3.627560377120972,3.179662704467773
30693,Shannon,shannon,4,"s is for silly.  h is for happy.  a is for adventureous.  n is for niosy.  n is for, ''i will never be normal! o is for oats,  i like oats.  n is for nibble.  that's how you spell shannon. ",183,3.416106700897217,3.2017359733581543,3.278001546859741
29835,Thunder,shannon,4,"thunder- it is very loud.  thunder- it isn't very proud.  thunder- it is very scary,  but it is not hairy.  thunder is amazing,  but it is not blazing,  for lightning is blazing. ",175,3.138878107070923,3.5548200607299805,3.1090095043182373
116361,Animals,shannon,4,birds fly high in the sky. dog chew logs watching frogs. cats eat rats looking at bats. parrots love carrots and follow ferrets. the mouse in the house was wearing a blouse. a big pig named sig was doing a jig. a sheep named peep who was in a deep sleep. there was a  bear named clair who had know hair so that was not fair. there was a lion named bryan who was crying. there was a fish named trish whose wish was to live in a bigger dish. ,433,2.809873104095459,3.122220993041992,3.0237720012664795
21856,When I awoke one morning,shannon,4,"when i awoke one morning a cow was on my head.  i asked ''what are you doing up there?''it looked at me and said ''where is the food man?''  when i awoke one afternoon,  there was a chicken in my bed.  i asked,  ''what are you doing down there?'' it looked at me and said: ''i need a place to go to bed. ''  when i awoke one evening,  there was a mouse on my head.  i asked: ''what are you doing up there?'' he looked at me and said,  ''it is my house up here. ''  when i awoke one afternoon,  there was a wasp on my nose.  i asked ''what are you doing up there?'' it looked at me and said,  ''can i sting you on your toes?''  when i awoke one morning there was nothing on my head.  i feel so much better now i am going back to bed. ",722,2.842838764190674,3.2171518802642822,3.044232130050659
22006,When I awoke one morning,shannon,4,"when i  awoke one morning,  a cow was on my head.  i asked,  ''what are you doing up there?'' it looked at me and said,  ''where is the food man?''  when i awoke one afternoon,  there was chicken in my bed.  i asked,  ''what are you doing down there?'' it looked at me and said,  ''i need a place to go to bed. ''  when i awoke one evening,  there was a mouse on my head.  i asked,  ''what are you doing up there?'' he looked at me and said,  ''i need to be fed. ''   when i awoke one afternoon,  there was a wasp on my nose.  i asked,  ''what are you doing up there?'' he looked at me and said,  ''can i sting you on your toes?''  when i awoke one morning there was nothing on my head.   i feel so much better now.   i am going back to bed!",724,2.893394470214844,3.300807476043701,3.0891873836517334
17977,Whan I wake up!,shannon,4,"when i woke up this morning,   i couldn't stop yawning.   i put my toast into the toaster,   which was hotter than a roaster.   feeling very tired,  i ate my food in quiet,  and tried to forget about my diet.   that's how i started my day!",235,3.034235715866089,3.4652342796325684,3.13102126121521
18210,When I Woke Up!,shannon,4,"when i woke up this morning,  i couldn't stop yawning.   i put my toast into the toaster,  which was hotter than a roaster.   feeling very tired,  i ate my food in quite,  and tried to forget about my diet.   thats how i started my day,  sorry to say!",246,2.6019864082336426,3.325618267059326,2.9338250160217285
36604,My Sister,shannon,4,"i have a sister (that's a pain) she makes me scream.  she gives me a kick.  yes she is older than me,  she still is a pane.  but i love her anyways. ",147,3.5303943157196045,3.71126389503479,3.3382527828216557
55687,animals,shante,4,"animals,  some are big some are small just like a dog or a frog. ",66,3.0853874683380127,2.96126651763916,3.1783885955810547
55486,IF I WERE IN CHARGE OF THE WORLD,shante,4,"if i were in charge of the world i'd cancel docters and dinest apointment,  brushing my teeth and taking baths. ",114,2.762384414672852,3.3139185905456543,3.2852871417999268
88297,For Someone Who Is Special To Me,shanterica,4,for some-one who means so much to me every day is special  has touched our livesive turned to you so many times for comfort and advice and when i needed help i never had to ask twice i've laughed with you enjoyed with you so many happy things and most of all i've learned from you. the joy true sharing brings love in our heart. love alway. ,342,4.390037536621094,3.860435485839844,3.397777557373047
30684,Spring,shantrice&amp; arioentae,4,spring what does it mean it mean everything spring is when you clean the house and not see a mouse  spring is when you are feeling good and not wearing a hood  spring what does it mean it mean everything,206,3.2768497467041016,3.177711009979248,3.239864587783813
34898,School,shaquile,4,school is boring scool is fun school is both  school is how you get your education school has you do work all day long. <br/>\n school is fun. ,144,3.8245811462402335,3.403762102127075,3.337653875350952
28685,How the cat got fat,shardayee,4,every afternoon i always see a cat and the cat eats the rat and  sits on the mat  and that's how the cat got  fat  just beacause of a little rat,147,2.556187629699707,3.188373565673828,3.0855963230133057
39586,My Shadow,shari,4,"my shadow is everywhere,  around the room across the moon and sometimes past you! it tells me when its bored and shuts the door and hits the spot on my fragile teapot.  its always there when i don't care about it.  when people are mean so mean the shadow just really screams .  it tells me when its hungry or when its turning sick i don't know why anyone tells about it,  its a real friend to help you and then.  it really is the best on a test to give you 100 percent.  if its so nice why it should be the 2nd best. ",512,3.26789927482605,3.397404909133911,3.230147123336792
23930,Halloween,sharon,4,last night it was so cold i was so frightened i can feel it in my soul.  the pumpkins are spread out amidst the autumn leaves.  fall is here for i can see it in the trees.  in every house pumpkins light up the night.  and trick-or-treaters are everywhere in sight. ,263,3.404238700866699,3.433911085128784,3.239079475402832
52549,Green Grass,sharon,4,"greengrass feels like lace, on it anyone can dance with grace. ",64,3.5191397666931152,3.330220937728882,3.304551124572754
91751,Grade My Papper,shashanna,4,roses are red  violets are blue heres my papper  now give me an a+,69,3.29689621925354,3.1756064891815186,3.278000593185425
91740,If you,shashanya,4,if you walk away then all the angels from earth will rise forvever do you see the sun rise? my time will never fade away for the sun and god is on my side if you cry then i have no choice but to cry but my heart will never be the same oh if you cross the ocean and climb the mountain dive into the moon i will follow you oh i will follow you forever if you if you oh if you,376,2.779757261276245,3.524379253387451,3.078000545501709
18406,Students,shasta,4,"people brainstorming kids talking little children very smart,  brainstorming children learning  cinquain poem",111,3.257776021957397,3.0837879180908203,3.206890821456909
59917,My  friend is Billy,shawn,4,"my friend is billy,  he is very silly,  he lives in philly,  and loves to eat chilli. ",85,3.207077980041504,3.129859685897827,3.18420958518982
42463,The lucky dog,shawn,4,the lucky dog is my dog he is luck to be  lucky and he is lucky to be a lucky dog,84,4.0837016105651855,3.628242492675781,3.383004903793335
102998,My Socks,shawn,4,my socks are blue my favorite color i like to wear them my socks are soft they have designs thatâ’s my favorite part i will always like those socks,151,3.877328395843506,3.41824722290039,3.3570735454559326
38350,Roses are red Violets are Blue,shawn,4,violets are red roses are blue flowers are pretty can you be my teacher too?,79,3.5962347984313965,3.30014443397522,3.2308528423309326
40142,The Man with a big nose.,shawn,4,the man with a big nose can twinkle his littel tose.  i'm not a man look at my nose said the man with a big nose.  at night when i snore i shake the town.  that night he snored so loud it shook the town.  the next morning the police took him to jail he said sorry everyone they just said let me go to bed.  so when they wen't to bed he said night everyone but they were alred asleep god night he whispered.  thewalk quietly away good bye he whispered and he walked away. ,467,2.680470466613769,3.272773265838623,3.031022071838379
46011,Witches,shawn,4,"witches here witches there,  witchces everywhere.   why do they make you have dreams of you in public only wearing your under wear  it's unfare.   why are those ugly,  warty witches   everywhere?",194,2.3653674125671387,3.376943588256836,3.074208974838257
55158,Mothers,shawn,4,"mothers are loving and caring,  mothers are loving and sharing.  mothers are great you should not hate,  mothers guard fish with a gate.   usually mothers do not hate,   guarding fish with a gate.  mothers don't fight but sometimes they might.  this is my poem about mothers because they have lots of brothers. ",306,3.33662486076355,3.1817827224731445,3.29911732673645
38349,Toe Jam Sam,shawn,4,"if you pay toe jam sam 25 cents,  he might eat lint if you pay him 50 cents he'll eat dirty mints.   if you pay him one dollar he'll eat your father but best if you pay him five dollars. . .   even though this doesen't rhyme if you give him a dime he'll eat his own  toe jam!!",274,2.6928653717041016,3.4085865020751958,3.273061990737915
44789,There once was a monster named Seaweed,shawn,4,"there once was a monster named seaweed.  who dreamed he was getting married.  then they went on a honeymoon.  seaweed's wife's name was who are you.  then seaweed woke up from his dream and said,  ''i wish i was buried. ",217,3.0064516067504883,3.2112293243408203,3.064337491989136
44775,There once was a man named Freddy,shawn,4,there once was a man named freddy  who eats all the big fat spaghetti.  then he went to eat steak.  then drank a chocolate shake.  and then his friends threw confetti. ,167,3.049598693847656,3.205717802047729,3.166134595870972
62965,Crazy World,shawna,4,children running children screaming children playing everywhere parents running parents screaming parents playing everywhere boy it's a crazy world out there,160,2.7341604232788086,3.4914565086364746,2.987161874771118
21608,October,shawnie,4,"out in the scary dark sky,   cold as an ice cube we go,  trick or treating,  door to door.  owls fly so fast over your head.  black cats hiss as loud as a trumpets.  every house is filled with haunted stuff , run run run or have fun!",229,3.309263229370117,3.678351640701294,3.2340221405029297
33236,Roeses and blueberrys,shawn,4,roses and blueberrys really smell good! since they both grow on a tree top they are really pretty! the end,109,4.1717729568481445,3.7157936096191406,3.4139130115509038
33877,Love,shawntel,4,roses are red  voilets are blue  scooby-doo loves and me too!,64,3.75386381149292,3.627514362335205,3.3781025409698486
100745,Shayda,shayda,4,shayda is cute girl she makes me laugh  she tickles my tummy and also buy me dinner. ,89,4.275391101837158,3.6978821754455566,3.3585705757141118
116947,ABBY,shayda,4,i lay by a house an old rusty house  i wait an wait an wait for a mouse  to scurry on by  while i watch all the birds fly  oh oh oh i watch them fly,151,3.2583065032958984,3.352797031402588,3.139843702316284
23300,Roses are Red,shayla,4,roses are red  violets are blue  my secret is  i love you!,61,4.180800437927246,3.767655372619629,3.352081537246704
16627,The Bird That Wanted To Stay,shayla hayes,4,when i woke up one day a bird was in my way. i said go away.  it said no i want to stay.  i said o. k.  you can be my freind today. ,129,2.9531967639923096,3.3150784969329834,3.196945905685425
30849,Me and my brother,shaylee,4,me and my brother are very very crazy the crazyest of all we are out going and funny and we like to stand on the wall we like to go to and frow up and down around town if you see us stay a far away,200,3.244966983795166,3.5427727699279785,3.2835922241210938
22718,Snow,shayna,4,one day i wake up because i hear the news they say that there is going to be three to five inches.  when i go outside i see a big blanket of fluffy white stuff then i hear kids singing with laughter because no school.  yes!,224,3.4830987453460693,3.7180566787719727,3.2786781787872314
78076,Figure Skating,shea-lee,4,"ice jumps, flips spins, field movments drags shoot the ducks ice is fun cold ice cool",86,3.669082164764404,3.348328828811645,3.3343069553375244
107804,Poor  Little  kitten,shekinah,4,"oh poor little kitten so sad so blue, and don't know what to do,  why won't you play with me too? meow meow boo hoo hoo",120,2.35329008102417,3.35530161857605,2.8629260063171387
27563,Glowing Little Star,shelbi,4,"glowimg,  glowing through the night.  glowing,  glowing like a diamond of light.  sparkling every where you see.  glowing,  glowing they shine down on you. ",153,3.5007243156433105,3.500157117843628,3.2468998432159424
32124,Blue Ball,shelbi,4,little sue bought a ball little sues ball was blue if someone ask to play this is what she'll say ''here you can play if you die someday'' then she'll giggle and she'll wigle.  but when her ball pops i guess i haven't been very nice!,235,2.851162433624268,3.3744781017303467,3.170531988143921
73270,My cat meows EVERYWHERE!!!!,shelbie,4,"everywhere i take my cat,  she meows.   when i get home from school,  she meows.  when i don't feed her for a while,  she meows.  all she does is meow,  meow, meow, meow. ",164,3.121729612350464,3.2335476875305176,3.196785688400269
22622,The Girl,shelby,4,the girl with the curl wearing the pearl had to hurl and then take a twirl on the swirl ride. ,96,3.1649556159973145,3.1339545249938965,3.1748807430267334
108717,A Frog,shelby,4,there once was a frog in my pool i really thought it was cool turns out it was not it got really thought and the frog left to go to school,141,2.969181060791016,3.1064529418945312,3.091830015182495
108710,I Am Thankful,shelby,4,i am thankful for many things i am thankful for the bird's wings i am thankful for teachers i am thankful for creatures  i am thankful i can sing i am thankful for everything,177,4.154822826385498,3.606727123260498,3.362388134002685
91224,When i see the flowers,shelby,4,"when i see the flowers,  i glaze with all excite. when i see all the flowers, i hope to see some more, with all excitment i hope to see,  the colors i wish to see are red, white and green. i will put a bubble over my flowers, but i will need:a medal thing, something that erases somthing, wood. led, carving of the led, somthing that says paper-mate then i get the bubble on, now its good now its done, have some fun",404,3.681143283843994,3.49162220954895,3.315438032150269
61670,Summer,shelby,4,the water is warm the rain has stopped falling summer has arrived,68,3.516059875488281,3.1977791786193848,3.2957475185394287
26831,Mistake,shelby,4,"i went to the market to buy a pig,  made a mistake and bought a wig.   i went to school to learn,   made a mistake and ate a worm.   i went outside to swing on the swings,   made a mistake and flew with wings.   i went to the library to buy a book,  made a mistake and bought some hooks. ",285,2.658595561981201,3.1215949058532715,3.045637369155884
42715,The Frog,shelby,4,that frog ate my dog.  that bad frog.  that's what he does every day and thats what my frog did. ,97,2.2657999992370605,3.370335578918457,3.132154941558838
32556,The  cat  and rat,shelby,4,"the small cat sat on the large mat.  she heard something in the kitchen.  she walked slowly.  it was a rat that sat on a flat piece of cheese,  the next thing she heard was,  ''oh please don't hurt me''.  the rat dropped to his kness, but the cat smiled and splat the rat was gone. ",279,2.8929238319396973,3.340308427810669,3.064854383468628
112324,The Silly Stork,shelby,4,"when i awoke one morning,  a stork was on my head.  i asked what are you doing there,  it looked at me and said,  ''come on please,  let me sit.  today i didn't get so fit!''",171,3.112053871154785,3.53638219833374,3.2352726459503174
17097,I DONT KNOW WHY MY SISTER IS SO HAPPY,shelby,4,"i dont know why my sister is so happy.  it couldnt be because its her birthday or that she got a new horse, and it probably isnt because she got a car, house,  and a new computer.  maybe its that she got a new rabbit or because she got a sadle for her horse i bet its not because she got a millon bucks! i just dont know why my sisters so happy!                                   do you?",385,3.3346493244171143,3.529628038406372,3.240720510482788
21601,OCTOBER,shelby,4,"on halloween it's a frightful night!!! cats are as black as the night!!! the pumpkins are scary,  nice and funny!! on a night that frights you don't look under your bed! be afraid be very afraid!! even though your scared still go trick or treating run run he is right behind he will hurt you!!!",296,2.9522743225097656,3.90070915222168,3.207885503768921
46617,The Black Kitten,shelby,4,i found a black kitten.  i kept the darling and named her midnight.  now midnight is a cat and she had babies but one is white. ,128,3.5199663639068604,3.2906084060668945,3.257295846939087
60959,My  cat,shelby,4,"my cat her name is pat.  she lives in a hat.  she likes to lay on the floor  mat , and she is fat.  she is as black as a bat , but she is a cat. ",142,3.050398349761963,3.0492329597473145,3.150019407272339
19078,Free Verse,shelby,4,summer is a great season here are a few reasons you're out of school you get to swim at the pool you get to ride your bike and maybe even hike these are just a few reasons why i love the summer season,203,4.009727478027344,3.57861852645874,3.439892530441284
19061,Horses and Deer,shelby,4,"horses             smart, strong      walking,  galloping,  cantering        fast,  sleek,  quick,  leap       bouncing,  running,  jumping             graceful,  run                  deer",182,3.386717796325684,3.411036252975464,3.2316315174102783
19051,Four-leafed Clover,shelby,4,"a four-leafed clover     that is blowing in the wind         flys far,  far away",82,3.039602041244507,3.034074306488037,3.140420198440552
39269,Snow Land,shelby,4,one light and cold morning  my class went  out to play.  i climbed mounds of snow that looked like little mountains.  i heard hard  crackling noises of boots in the  snow.  i saw puffs of clouds coming from my breath.  cold gusts of wind hit my face.  that was a  very cold day!,276,2.763341426849365,3.454833745956421,3.0070693492889404
33607,I am,shelby,4,"i am loving, caring, family  i love my family  and my friends i know about the war going on and i wish we could just get along.  we all know fighting is bad but, it is for our safety i am  shelby p. ",197,3.565584659576416,3.403953790664673,3.2507569789886475
33606,Trees,shelby,4,"trees big, tall swaying, drooping, dying swaying in the cool breezze  weeping willow",85,2.708622694015503,3.0798487663269043,2.999333620071411
32944,Springtime,shelby,4,what do they mean when love is in the air? they say it when springtime is there.  why come outside and play while the day is young? just when the spider's web is about spun.   why do you do what you don't want to do?why eat fruit instead of runts? what do they mean do they mean when love is there. . . . . . . . . . . . . ??????       i guess it's springtime. ,348,3.1528422832489014,3.261480569839477,3.1502928733825684
105728,Rain,shelby,4,rain rain such a horable sight,33,2.3553600311279297,3.1988768577575684,2.957850694656372
28092,Swimming,shelby,4,swimming is a sport you can do in rain or shine swimming is a sport of mine swimming is a great way to make friends swimming is a sport that never ends swimming is really boring you can hear lots of snorning  i love swimming,227,3.843984842300415,3.479167938232422,3.34587836265564
109912,In Pain,shelby,4,i saw a train and it started to rain and then my head was aching with pain. so i went to bed and bumped my head and my head started hurting again. ,148,2.1196813583374023,3.4225189685821533,2.727555513381958
105970,My annoying cat,shelby,4,"monstrous impatient never nice irritating  miserable meowing yes,  she's a cat  courageous annoying terrible",110,2.147428512573242,3.430644989013672,3.182959079742432
29079,The Snake,shelby,4,"when i woke up this morning,  i saw a snake slither by.  it was red and yellow and jumped real high.  the snake came down right on my head,  and said, ''i would rather eat you than a red toothed bed!'' he started to come on over,  when pop,  there goes his head!",259,2.6204004287719727,3.683509349822998,3.0345590114593506
29067,The Snake,shelby,4,"when i woke up this morning,  i saw a snake slither by.  it was red and yellow and jumped real high.  the snake came down right on my head,  and said, ''i would rather eat you than a red toothed bed!'' he started to come on over,  when pop, there goes his head!",258,2.623764038085937,3.685120105743408,3.033818244934082
113914,Snow day,shelby,4,its a snow day time for me to go out and play snow snow its so fun all i want to do is run snow snow please snow all day i want the snow to never go away. ,157,3.714170455932617,3.630891084671021,3.3433754444122314
17614,What I Eat,sheldon,4,"almost every time i fly,  i eat peaches in the sky.  there were six,  smooshed with bricks.   i eat oranges with a fork,  on a fried pork.  i eat toothpaste,  that has great taste.   i will eat apples with a knife,  for the rest of my life.  i now even eat meat,  with my feet. ",269,3.502399444580078,3.364078521728516,3.33711576461792
55483,the clock,sheldon,4,tik tock tik tock  no not a tick  nor a flock  but a clock  a nice slow clock. ,81,3.220985174179077,3.0039055347442627,3.201529026031494
18952,You,shelley,4,you are cool just like me i think you need to be like me,59,3.5811047554016118,3.451955795288086,3.349022626876831
90997,Guess Who,shelly,4,i have 4 legs.  i like to run.   you like to ride me.  here is a big hint i am your favorite pet!,97,3.882390975952149,3.7010574340820312,3.416101694107056
32175,MOM&apos;S  LOVE,shelly,4,"moms love their children so kids, obey your moms  with care and love.  moms also love you even when your bad.  so even when you get in trouble remember,  she loves you.   happy mother's day!  love,  shelly",202,4.239870071411133,3.804184913635254,3.395125389099121
18925,MY  TWO  DOG&apos;S,shelton,4,"pupy white, furry, dog running,  jumping, nipping leeping, sleeping, fighting i love my big dogs bar/jake bar, jake",111,3.7711167335510254,3.554207801818848,3.3329198360443115
118354,My hair,shemaia,4,i love my hair  because its strght and long it waves when i run and its very silky.  i love my hair,101,4.256471633911133,3.6936168670654297,3.3999931812286377
88296,Basketball,shemoria,4,"in side out, ball in net a rim inside of the backboard, a game basketball game a ball going in the hoop bounce on the edge of the rim and spin around it and goes in so the air makes it, bounce. ",193,3.113769054412842,3.0269787311553955,3.176187753677368
88294,In White Rain,shemoria,4,"in time of white rain clouds are gray butterflies fly, so high in the sky go through the clouds and go inside to play out side, on the tree branch. ",148,3.283682346343994,3.177971839904785,3.1324052810668945
74292,My Elbow,sheri,4,"pointy,  bony,  bendy holding my arm together pledging allegiance asking a question making a promise shaking hands throwing a ball doing a handstand writing a poem hugging my dog wonderful,  useful,  outstanding",211,3.859140872955322,3.63020920753479,3.332220554351806
102615,Example,sherie,4,i am trying this out for my students to use. ,47,3.414365291595459,3.1432642936706543,3.3542227745056152
60476,Lunch,sherika,4,lunch yucky yucky nasty lunch slimy  and gooey punch disgusting lunch!!!,76,2.076784133911133,3.5420498847961426,3.1094958782196045
