id,title,author,grade,text,char,valence,arousal,dominance
46559,The Bunny,shandana,2,"the bunny,  the bunny that bunny is funny that bunny likes to hop and he also likes honey,  that bunny has lots of money.  he has a son named tony   he  loved  his sons  name  but. . . he  changed  it !  it  was  punny!  also  outside  it  was   sunny the bunny the bunny that funny bunny he   loves honey!",303,3.8498027324676514,3.571293830871582,3.325762987136841
103864,I Known A Dog That Runs Away,shandea,2,i known a dog that runs away in my yard he never stays he runs to the playground and up the steps he goes down the slide and never comes back. his name is gucci if you see him again please call me he`s still my friend. ,220,2.704044342041016,3.228867292404175,3.045161008834839
16484,In the Park,shane,2,"the sun is big and bright.   a bird is guarding her eggs: wings are flapping everywhere.   a little tree is growing â–  the grass is very tall,   and the ants are in their hills,  and the clouds are bright white compared to the  deep black owl hole. ",249,3.401357889175415,3.265709638595581,3.2065589427948
76257,My Favorite Animal,shane,2,"squawk squawk,  what is that noise? it sounds like a stork,   and he flies away. ",81,2.898875951766968,3.3926689624786377,3.087098836898804
73442,Cat,shannan,2,i had a cat named sandy she was sweet as candy sometimes she wanted to wear a hat what a silly cat!,102,3.669754266738892,3.555869579315185,3.27066421508789
84175,The colers of the erth,shannon,2,"the colers of the erth are red,  blue,  green,  oreng,  yoellow,  and those are the colers of the erth",100,3.125723600387573,2.893328189849853,3.1851203441619877
106017,Shannon&apos;s poem,shannon,2,almost every afternoon  i eat hotdog's with a spoon  every night right at eight  i eat soup off a plate. ,107,2.9837841987609863,3.081366062164306,3.1826281547546387
77073,roses  are  red,shannon,2,roses  are red violets  are  blue  you     got  cotton candy  all  over  you. ,84,3.2715954780578613,3.1117618083953857,3.229072332382202
74102,LADY    BUG        LADY        BUG,sharon,2,you   are    calm.  i could pet you.  you    are    round      and     red.  you    have     a     beautful    head.  you     are     ready    to       lay   eggs.  i could  touch you with my finger and hug you.   you are very little. ,231,3.888839244842529,3.5863986015319824,3.2998046875
16648,Broccoli Is Discusting    (2-D),sharon lynne p.,2,broccoli is discusting  it's realy not delicious  even thow it's nutritious  broccoli is discusting,113,2.550438404083252,3.227135181427002,3.061654806137085
89045,Cats,shaun,2,cats   are   cool.  they   are   playful.  they   are   nice.  i   love   my   cat. ,83,4.260489940643311,3.625283479690552,3.340567111968994
97093,rocks in the box,shayla,2,"i have a box.  look! whats in it. rocks! cool rocks, sad rocks,  happy rocks too. i love rocks!",93,4.271609306335449,3.921032905578613,3.4912030696868896
22364,FROGS,shayne,2,"i sit by the lake on a log,   out of the water jumps a frog.   they hop all around,   they make a funny sound.   their skin is green and bumpy  and their eyes are even humpy. ",176,3.0873918533325195,3.230411529541016,3.1082022190093994
115019,Every Time I eat a snack,sheena,2,every time i eat a snack.  i have a little heart attack.  oh no i get a smack attack.  you think iâ’m crazy but iâ’m lazy.  oh no iâ’m having a heart attack.  now i now i am crazy. ,178,2.187241792678833,3.656928300857544,2.990588426589966
112646,How Big An Elephant can be!,shelby,2,an elephant can be small or big it could weigh 100000 pounds!it can be so big it could rap around the earth!i think its name is barth!,137,3.3053486347198486,3.631650924682617,3.256577491760254
48530,The Stork On My Head,shelby,2,"when i awoke one morning,  a stork was on my head. i asked,  ''what  are you doing there?'' it  looked at me and said. . . ''you are in my bed so i am on your head,  if you get out of my bed then i will get off your head. ''",219,2.837756633758545,3.46509313583374,3.1860387325286865
36252,Cats and Dogs,shelby,2,dogs are big and cats are small.  they both like to play and they both like to eat.   that's why i like cats and dogs. ,119,3.5319738388061523,3.2312707901000977,3.288014888763428
57144,Shelby,shelby,2,shelby is helpful eats loves people best at football your friend,72,3.609630107879639,3.1892714500427246,3.307281732559204
60160,Baseball,shemar,2,during the game i go a hit my friend couldn't cath it with his mit he was so upset he almost quit i didn't see any sense in it,129,2.253790140151977,3.251035690307617,2.8901774883270264
60383,Not So Cool,shemar,2,i went to school i was not so cool so i went to the pool the water was cool,78,3.52622127532959,3.28289008140564,3.255084991455078
19031,Aquarium,sherif,2,awesome  water.  quiet  place  to  be.  under  water  is  nice.  algae  is  green.  right  space  to  have  fun.  itâ’s  cool.  unusual  things.  maximum  fun. ,155,3.981811046600342,3.561464071273804,3.36069130897522
88133,Easter,sherry,2,eternal arise salvation trinty everlasting resurrected,57,3.2748241424560547,3.2494957447052,3.2283051013946533
118921,Snowing day,shifa,2,"snow is falling from the sky,  i looked up a small flake drip on my nose,  i felt sad,  because my parents were'nt with me",122,2.219956636428833,3.279546022415161,2.787306547164917
84893,Billy at the beach,shon,2,"billy was a 4 year old child.  he went to the beach,  and took a peach.  he went wild like a 4 year old child.   he met a shark named mark.  he fed mark the peach at the beach.  he heard a screach from the peach.  the peach flew out reach!",236,3.3307037353515625,3.4719786643981934,3.207514762878418
88649,Too Much Food!,shona,2,"apples, and yogart, and strawberrys too.  bananas, and icecream, and lofs of bread.   ohhhhhh! i've got too much food! i don't know what to do! i've got an idia.  i'll throw it on you!",180,3.7445168495178223,3.8515939712524414,3.375344753265381
88624,My Story,shona,2,"today i'll write a story,  and draw some pictures too.  i'll stick in colored paper,  with gooey,  glewy,  glue.  it will be 'bout a kitty,  who has big fight with dog,  then comes in a silly pig,  and then in comes warthog.  a story has a happy ending.  and this one has some hail.  the happy ending in this story. . .   is when they're all in jail!",338,3.3611927032470703,3.299041986465454,3.258150815963745
88850,I Do Not Talk To Strangers,shona,2,"what is your name? i do not talk to strangers.  hey,  this is not a game.  you look like pretty rangers.  oh that is very nice.  yeah,  what would you think? you give me the price.  the price of what? by the way,  your cheek is pink. ",228,3.683486223220825,3.4207441806793213,3.2692556381225586
20722,Shreya,shreya,2,snow hear heart rise  rabbit  rainbow egg yo-yo always  together  amy,72,3.374788999557495,3.255003929138184,3.222050905227661
68323,My Sugar,shreya,2,"roses are red,  violets are blue,  sugar is sweet,  and so are you. ",67,3.396644592285156,3.1014904975891118,3.2209103107452397
112293,LIFE ACT.,shreya,2,"in the time of sunset,  i found myself in a stage,  my life was full of excited,  that i have crossed all my face.  my childhood was very fast,  crossed i thought.  in my young stage,  i enjoyed a lot.  now i am in finishing level,  of my life act.  which i have performed,  from childhood till yet.  then my act will be over,  and i will out of this show.  like the father has to leave,  same way,  i also have to go. ",406,3.672523498535156,3.5804243087768555,3.29707407951355
102727,The ice-cream shop,shrivalli,2,when i went to the ice-cream shop to buy some sundaes here is the sad thing of all. the sundaes are gone from a bandit i was so surprised i had found him in the rivers you know why he is   a bandit because he stole the sundaes without giving money that is not fair so i got the bandit in just in time,302,2.499467372894287,3.426802635192871,3.0267250537872314
105293,THE FAT CAT,siba,2,there was a fat cat. how sat on a mat. it had a hat on it's head. instead the hat there was a map. ,105,2.924506187438965,2.9631409645080566,3.1126809120178223
105319,MY MOTHER,siba,2,i love you my mom. and i love you my father. i love to give you my best gifts. you are the best mom in the world. and you are the sweetest mom in the hole world. ,160,4.503544330596924,3.759246349334717,3.3653507232666016
85299,Who I Am,sidney,2,sometimes i like  to play  video games i am hapy donutse  i like  nice enjoy playing yester day i had a lat of fun,117,4.034637451171875,3.516606569290161,3.413653612136841
100139,The Weather Poem,sidney,2,the sunlight is hot the moonlight is cold if you mix it up a tornado will bowl  and you will not be seen in a little bean,124,2.909837484359741,3.0602564811706543,3.1541531085968018
93324,If all the world were apple pie...,sienna,2,if all the world were apple pie and all the sea were ink  and if all the trees were bread and cheese then what would we have to drink?,137,2.748765707015991,3.041328191757202,3.0416676998138428
19412,Summer,sierra,2,summer is very hot  you eat hot dogs  &amp; smuthys puting your feet   in the sand  surf bouring in hawaii  but its still hot!,129,3.3019559383392334,3.508988618850708,3.2568066120147705
18717,Poems,sierra,2,poems are fun to write.  you can write about anything.  funny poems.  sad poems.  happy poems too.  poems feel good inside.  and i think you will like them too. ,157,4.100612163543701,3.5666515827178955,3.3467049598693848
95940,Green,sierra,2,green green green green is simply great.  i see green every day in my house and in school. even when i go out to play.  green green green green is always great. you always see it on st. patrick 's day. thre are many thing that are green.  i just can't name them all. there are probably enough to make a list as long as i can see.  have you ever seen a green cat wearing a hat? well i have.  i feel so great writing about green. green is my favorite color. what about yours?,464,3.922451496124268,3.527236223220825,3.37009596824646
85297,Who   I   Am,sierra,2,soup   is    geat ill exercises rrally  like  mashed    potatoes really  love  my  family acake  is  swet apples  are  good nice jogging  is  fun eery  time  we   like     to  play  outside lee  is  my  auntie,217,3.837488174438477,3.4772391319274902,3.3262317180633545
114786,The Boom,simon,2,i herd a boom in a box  boom crash bang i don't know what happened  it was crazy and hazy oh my goodness  i don't know what happened all i know  is what i told you,170,2.697266101837158,3.594925165176392,2.9560635089874268
112592,My dog,simon,2,my dog is black and white i did not want a one that was black and white i wanted a one that was not really right,115,2.48105788230896,3.3041234016418457,3.194455623626709
115170,Chocolate icecream,sionna,2,i saw the others and they were different  colors. i saw the pot and it was hot. i saw the pad and it was mad. it was cold but it had mold. i new i was in trouble. ,161,2.466094493865967,3.287408828735352,2.9710161685943604
83753,Poster,siti,2,"i have a poster big and small,  some are short,   some are tall.   i have a poster weird and good,  i just love to have a look!  i have a poster pictures with people sad and bad.   pictures with animals for example a cat,  that looks really really fat. ",249,3.542576789855957,3.572078227996826,3.3007125854492188
29370,Cookie,skye,2,"cookie short, sweet enjoying,  run, love happy,  loved,  cared,  special pet cookie",80,4.223841190338135,3.624910831451416,3.3619117736816406
33912,I lost my sock on a rock,skyler,2,"i onest lost my sock on a rock i cryed my self to sleep then a sheep came over to me and said, dont cry babye then i said did you find my sock it was on a rock oh no he but i will go find it again i said oh thank you thanks so very much",238,2.9698939323425293,3.465975284576416,3.0293538570404053
54430,one day,skyler,2,one day i was walking down the lane and found a lion very tame,65,3.516537666320801,3.3292856216430664,3.2553517818450928
46257,My Favorite Day,skyler,2,"almost every afternoon,                 i eat and watch cartoons.                then about four o'clock,  bugs bunny says ''whats up doc''? then at eight,  i get ready to watch ed, edd and eddy.  now it's time to go to bed,  i'm so tired,  you'll think i'm dead. ",259,2.9126381874084477,3.132629156112671,3.1103646755218506
94560,Our Class Poem,smith1000,2,this is our class poem wouldn't ya like to know um we worked really hard don't think this is a bunch of lard please send us a card!,135,3.2463717460632324,3.4550621509552,3.339677572250366
15461,Rainbow,sneha,2,"rainbow, rainbow, up in the sky you are there,  tell me why? are you signalling the rain ? or are you there to please the sun ? are you there to make the world colorful? red and yellow,  green and blue,  indigo,  violet and orange too!",236,3.5898728370666504,3.5703930854797363,3.299767255783081
15443,The World,sneha,2,"roses are red, violets are blue the earth is made for me and you",66,3.413901329040528,3.158498287200928,3.262468814849853
115020,Summer,sofia,2,"&gt;yay,  summer is here!  summer is a lot of fun.   splash,  into the pool!",77,4.309224605560303,3.895706176757813,3.479135036468506
68228,American flag,sofia,2,american flag american flag o so beautiful as you are we shood all beautiful like you!,89,4.319299221038818,3.873872756958008,3.372690200805664
112488,Sofia,sofia,2,sofia is my name.   i donâ’t look the same.   i like to wear dresses  and i do not like messes.   i like to eat candy.   i read a book about sandy.   i have a pet fish.   i need a second wish.   my favorite food is rice.   i like to eat it without thinking twice.   i have a brother and a mother.   i like to play soccer with my dad.   i am very glad!  i like to go to school!  it is so cool!  my favorite color is blue.   i am not two!  i am eight.   i do not like closing the gate.   i have brown eyes  and i like to eat pies.   i have blonde hair.   i love to share.   i am pretty!  i donâ’t have a kitty.  thatâ’s me!,608,3.768888950347901,3.5673928260803223,3.2964236736297607
112718,Flowers,sofia,2,"flowers flowers in the sping.  can' t they wear a little ring? pink,  yellow,  blue,  and purple,  too.  shinging brightly in the sun.  they can have some fun!  in the pool were it is cool or on the swings doing things! drinking lemonade and eating fruit,  too! flowers love me and they love you!",291,3.9537453651428223,3.7028656005859375,3.36330246925354
83805,All of the people,solange,2,all of the people down the hall all of the people playing with a ball all of the people leaning on a wall all of the people not happy when they fall all of the people really happy at the mall,195,3.685203790664673,3.383939266204834,3.235558271408081
118689,Best friend,sona,2,"he takes me far from stress,  and helps me to choose better dress  he switches on my mood,  whenever i am rude.  he knows where my problems are to be send.  he is the only one, ''my best friend''. ",195,3.351099729537964,3.349208354949951,3.266609668731689
118016,PAPA,sona,2,"i can loose everything,  but not you.  i can fight to anyone,  but not with you.  i can hate anyone,  but not you.  i can live without happiness,  but not without you.  i can't",171,2.41450834274292,3.3860771656036377,3.0999796390533447
102764,WHAT  AM  I ?,sonny,2,"i am big, i have twigs, you might find me in a forest, i hate london, i am like an onion, i like a lot of peace, i never brush my teeth, i can make you pass out, i don`t have a snout, i am part of shrek, i don`t watch star trek, come on can you  guess. ",244,2.9188852310180664,3.277093410491944,3.1759865283966064
110965,Fat cats,sophia,2,i had a cat and it was fat,29,2.4923760890960693,2.998488426208496,2.978401660919189
110968,I went to town,sophia,2,i went to town and saw a clown.  i had a cat and it was fat.  i saw a cat and it  wore a hat. ,95,2.540669202804565,3.1775898933410645,2.981846809387207
89020,The Butterfly Braclet,sophia,2,the butterfly braclet is rather rare. you can find it in a elephant hair. yesterday i found one but it was to big. i gave to my sister she said it helps her dig. ,161,3.3204169273376465,3.1641063690185547,3.263761043548584
99437,My Book,sophia,2,"when i woke up, i found a book sitting on a hook  when i went shopping, i found a crook sitting on a book sitting on a hook!",125,3.449950695037842,3.5712730884552,3.3196804523468018
21822,I love you meagan,sophia.,2,i love you meagan.  i love the way your eyes sparkle in the light.   but i don't know what else to write.   you make me happy when i am sad.  meagan is a 100% good friend!,170,4.362240314483643,3.9092588424682617,3.362194299697876
117467,My scert,sophie,2,my skirt dances in the wind my skirt dances like the ocean wen the lighs go awt i dans in the wind. thats wat i do all night,126,3.372681140899658,3.370333194732666,3.2381627559661865
29213,I Like Me,sophie,2,"i like cookies.  i like tea.  i like fiowers,  but i like me the most!",70,4.016612529754639,3.6226420402526855,3.3235833644866943
57524,Allie,sophie,2,she's  always  funny she is great she hugs me and kisses me a lot,68,4.503129959106445,3.813328504562378,3.326843023300171
95514,Chocolate Heart,sophie,2,"by sophie  i love you like,  a chocolate heart.  you are sweet,  i love every part. ",86,4.536283016204834,3.7903025150299072,3.34319281578064
95533,Growing Apples,sophie,2,growing apple trees eat fruit off for snack at noon it isa good snack,72,3.4588639736175537,3.098021507263184,3.286706686019897
103131,Little sister,sophie,2,my sister is annoying she is cute and silly some times jealous sometimes bossy my sister is nice cries a little bit sometimes smile and her face lit. ,152,3.669613838195801,3.415746688842773,3.2650325298309326
61891,last night i dreamed of aliens,sophie,2,last night i dreamed of aliens there were aliens everywhere they were standing on my head even jumping on my bed i shouted to my mum come and take a look that ones got a green bum there were aliens aliens aliens as far as i could see when i woke up in the morning  there were teeth on top of me. ,299,2.6518187522888184,3.622976303100586,2.9632232189178467
44821,DOGS,sophie,2,poodle and bulldog          chinese crusted                dogs,66,3.167783260345459,2.9977962970733643,3.1882927417755127
22161,Crazy Foods,south,2,"almost every afternoon,  i eat hotdogs with ketchup.  every evening right at six,  i eat hotdogs on bricks.   almost every afternoon,  i eat hamburgers with my hands.  every evening right at six,  i eat hamburgers stacked on bricks.   almost every afternoon,  i eat french fries with cheese.  every evening right at six,  i eat french fries surrounded by fleas. ",353,3.145258903503418,3.132615566253662,3.225959300994873
30305,Oyster Crazy,special ed,2,every morning at nine i eat oysters that are sunblime shortly it will be dark and i will sleep like a lark,109,3.4967775344848637,3.374844551086426,3.264251470565796
38658,My Day,spencer,2,"almost every afternoon,  i eat pizza with a spoon.     every evening right a six,  i eat chicken stacked on bricks.   at ten,  i'm in.   at eight,  i'm late.   at eleven,  i'm lost. ",175,2.954864501953125,3.085335254669189,3.151551485061645
16708,Wait a sec here,spongebob,2,"fun is lovely,  fun is cool,  fun is so wonderfully ever so. . .  april fool!!!!!!!!!!!!!!!!",92,4.517605781555176,3.933317184448242,3.4945077896118164
98271,im hungry,spurdle,2,my stomach is growling my mouth is howling,46,2.8560564517974854,3.797060966491699,3.194748640060425
34896,My Pets,sriramya,2,i have a puppy that knows just how i feel.  when i'm happy he's yappy.  so i don't chill.   i have a cat that knows just how i feel.  when i'm mad she's sad.  so i don't turn into a mean lad.   i have a frog that knows just how i feel.  when i'm lazy he's crazy.   all my pets that i have know how i feel.  i should always be happy not yappy.  and thank god with my heart without being sad or mad. ,391,3.3940725326538086,3.34979248046875,3.2714054584503174
36163,My Pets,sriramya,2,i have a puppy that knows just how i feel.  when i'm happy he's yappy.  so i don't chill.   i have a cat that knows just how i feel.  when i'm mad she's sad.  so i don't turn into a mean lad.   i have a frog that knows just how i feel.  when i'm lazy he's crazy.  all my pets that i have know how i feel.  i should always be happy not yappy.  and thank god with my heart without being sad or mad. ,390,3.394961357116699,3.3504598140716557,3.268292188644409
62477,I like you,stacey,2,roses are red violets are blue you are so wonderful that's why i love you!,77,4.367105960845947,3.82160758972168,3.392232656478882
52917,The Cat,stacia,2,that cat is fat.  it is wearing a black top hat.  the big black cat is wearing a funny hat. ,92,2.793677806854248,3.039074420928955,3.095234632492065
60509,My  Dog,stacy,2,"i really like fog,  but i truly love my dog.  when i had a cat,  i could not have a hat.  then i took the hat,  and really missed my cat.  so i just got a dog,  but then i saw fog.  now i have fog,  and i miss my dog. ",211,3.1492981910705566,3.349730491638184,3.1083767414093018
41084,Spring,stacy,2,"the grass is green,  the air smells clean.  a light wind blows,  and the stream finally flows.  winter is over,  so pick let's pick a four leaf clover because spring is here.  let's all give a cheer. ",196,3.7307143211364746,3.4814293384552,3.375549554824829
104032,FootbaLL,stanly,2,football is athletic. it is a good workout.  you say you don't no to play football it's pretty easy. ,101,3.617269992828369,3.357674121856689,3.3361828327178955
34349,Spring,stardashia,2,spring is coming.    spring is coming.    people are packing  to go somewhere.    flowers are growing  flowers are growing flowers are growing everywhere.   rabbits are hopping  rabbits are hopping down the forest path.    leaves  growing on trees.  the grass is growing green. ,274,3.672788143157959,3.4367117881774902,3.29285740852356
116998,My home,starlena,2,my house is big my house is small there is paint on the wall butt i don't care what they say it is my house and no one can take that away. ,141,3.1250431537628174,3.205637216567993,3.3054332733154297
112050,Sunny Days,stella,2,"sun days sad days,  there all the same you see,  it's like a  bee,  sometimes the honey is sweet and sometimes it has  no sugar at all. ",135,2.4591896533966064,3.1510660648345947,2.9214439392089844
50979,Friends,stephanie,2,"a friend is some one you can trust,  a friend is some one that is kind.  a friend plays with you every time.  a friend has a speacialspace in your heart.  a friend alwaysare with you a step behind.  a friend is everything you need",229,3.62566351890564,3.366903781890869,3.321063280105591
92277,The Mouse,stephanie,2,the mouse was in my house he ran up the couch my mom screamed when the mouse ate the ice cream we will never forget the mouse,128,2.316679000854492,3.4691481590271,2.9755492210388184
18339,Flowers,stephanie,2,"i woke up one morning and there was a flower on my head i said,  what are you doing there?'' and it looked at me and said,  ''i'm sorry, '' i think you got a seed in your head!",176,2.832014560699463,3.5308971405029297,3.103562116622925
30164,The teacher,stephanie,2,my teacher is very nice she lets us have fun sometimes her name is mrs hogg-wood,84,3.78123950958252,3.304094076156616,3.335844755172729
26735,A day as a caterpillar,stephanie,2,i'm a baby caterpillar very small i can't climb anything at all because i'm way to small i think even if i try to climb i'll get lost and fall!,146,2.387312412261963,3.286105155944824,2.9307000637054443
27341,No ones perfect,stephanie,2,no one's perfect you should know if you don't here you go no one's perfect i hope you know so bye all,105,2.679684638977051,3.1183924674987797,3.0798418521881104
14939,Remember Me?,stephanie,2,"remember me from the sea? we played alot can't you see? remember me?  you rode your bike along with me.  we could only visit a little,  even though we could not play the fiddle.  remember me,  yes you do.  i'm so glad we're me and you. ",233,3.7022509574890137,3.4077672958374023,3.262694835662842
35593,Foods,stephen,2,foods are yummy.  foods go in your tummy.  foods are for lunch foods are for brunch foods are for dinner foods are for winners. ,128,3.930337429046631,3.5866923332214355,3.3843276500701904
58188,The Woodpecker,stephen,2,"the woodpecker,  is a wrecker,  to the trees,  and the bees. ",60,2.660811424255371,3.024475574493408,3.0683062076568604
53477,Haiku: Snow,stephine,2,it is very cold.  it is falling very hard.  it is white and soft. ,66,2.7741892337799072,2.9924278259277344,2.9610517024993896
46248,My dog,sterling,2,"my dod is white, brown and black.  he is very short his ears are long. ",71,3.043731927871704,2.919935941696167,3.163879156112671
29198,Blue Car,steven,2,blue blue blue blue blue blue blue start start start start start start vroom vroom vroom vroom vroom drive drive drive drive drive drive screech screech screech screech,172,2.717853307723999,3.265523195266724,3.111299753189087
53425,A  dragon  on  my  head,steven,2,a dragon  was  on  my  head. it  ate  my  cookie  sandwich. it  was  weird.  my  friends  got  scared  ahhhhhhhhhhhhhhhhh!he  got  off. thats  good. no more. i need  to  be  quiet  or  he  will  come  again!,204,3.0991077423095703,3.805652141571045,3.170397996902466
78923,My Cool Scool,steven,2,my cool class  is so fast  we don't play with glass some person has a cast. ,78,3.3193979263305664,3.3533761501312256,3.24203896522522
100021,comp,stuart,2,it lond it bitme comp,24,3.080916404724121,2.887613296508789,3.1632797718048096
105300,the moon and stars,suha,2,the stars are bright and the moon is white the moon sleeps at night and so do you,84,3.5069851875305176,3.255006790161133,3.2258899211883545
