id,title,author,grade,text,char,valence,arousal,dominance
42675,*Symone*,symone,5,symone's a lady.  she likes slim shady.  her momma thinks shes crazy.  but sometimes lazy.  that's ok because that's her baby.  oh oh oh that's her baby. ,151,3.3688693046569824,3.253086566925049,3.2108373641967773
23700,Avonlea,symphonia,5,"the winds a blowin' the wheat fields in       james a.  harrison's yard           ms.  lavendar is just married        in front of echo lodge     anne is having tea with paul at      his grandmother's place  davy is going to bed without his meal        at green gables tonight         gilbert is studying for redmond         at the blythe farm          all of avonlea is sheltered,     from the rainy sunday outside. ",416,3.0757603645324707,2.9651641845703125,3.135744333267212
27113,The Picture,t,5,there is a painting on a wall it is hanging in the hall  every night it changes  and rearranges it turns into a gruesome man  fanning himself with a fan but when i wake up in the morning i realize it is very boring!,219,2.4149537086486816,3.429421901702881,2.9831717014312744
64709,A Waterfall,t,5,a waterfall is a beautiful sight.  you can see it with your eyes.  you can hear it.  you can wonder about it's might. ,118,3.814689159393311,3.535884141921997,3.2659249305725098
47142,The Tack I sat On,t,5,"one day i was eating lunch,  as simple  as that.                                                                        then i sat down right smack on a tack,                                  that tack was pointy,  pointy no doubt and         thats why i jumped up with a screamed and a shout.   from that day i learned a lesson think before you sit and your lunch will be pleasant. ",380,3.11429500579834,3.4064512252807617,3.2418200969696045
98310,baseball,t.j,5,"baseball&lt;br&gt;fun,  ative&lt;br&gt;long,  hard,  waird&lt;br&gt;tiring,  wierd,  funny,  best",94,3.654261350631714,3.392148494720459,3.31544828414917
69915,My Dog,t.j.,5,"my dog is so soft and gentle.  he hasnâ’t ever really done anything to annoy me.  except chew up everything that i own! sometimes i get so mad at him i tackle him and wrestle him until i canâ’t wrestle him anymore.  he always beats me anyway.  i donâ’t really care though.  heâ’s chewed up everything socks,  toys,  pants,  games,  cardboard even a pair of underwear! that poor,  poor pair of underwear.  he drives me crazy!!! i still like him though.  we play and have just like any other boy and his dog. ",497,2.759591579437256,3.535483121871948,3.301718473434448
94662,Summer,ta&apos;nea,5,summer is a time for fun  when we go swimming  and when we play in the sun and then we go in the gym,103,3.578236818313598,3.2469468116760254,3.29839301109314
60095,The Ugly Things I Hate,ta&apos;nisha,5,"demons are red,  fire is hot.  i wonder if you sat in a pot,  you'll get hot in the head. ",89,2.8400206565856934,3.2812066078186035,3.090790271759033
61024,Polk a polk Dots,ta&apos;qiyya,5,i look on the ground and see little white dots.  on the green grass rug i see  polk a dots .   polk a dot's falling to the ground.  everywhere i look i see polk a polk dots.  a red bird eats polk a dots food straight from heaven. ,228,3.4054882526397705,3.3875112533569336,3.206970691680908
50457,Just me,tabatha,5,hair is light as honey the bees might be funny you play music they'll leave a mess in your hair  eyes are hasel  you might not no that but don't hate me becaues i'm beauiful  i'm a danceing flowl,198,3.1224210262298584,3.3518357276916504,3.286928415298462
21560,I  Love  Puppies,tabatha,5,"puppies are playful.  puppies are cute.  puppies come in many colors,  brown,  black,  grey and white.  some are spotted; some are not.  i don't care because i love puppies. ",169,3.86641263961792,3.4897537231445312,3.339634656906128
32088,The River,tabetha,5,"the beauty of the river washes over me as i sit on a rock still as can be, listening to the snow and inside my spirit seems to grow. ",134,3.762134790420532,3.5411033630371094,3.2700021266937256
50353,Its Getting Cold,tabitha,5,its starting to get cold outside. as we start taking out our winter cloths it begians to snow. as we all know when it starts to snow christmas is almost here. ,159,2.917244434356689,3.1939706802368164,3.1633739471435547
50228,One Dark Night,tabitha,5,one dark night a little boy was walking down a road and all a sudden something jumped out of the bushes. ah screamed the little boy. hewas thinking what it could be. all the sudded it roard. he jumped back. he thought it could be a tiger. he got his flashlight and shined it on the creature. he finliy found out whatit was. it was just a squarl. (the roar was the squarl burping),373,2.87564754486084,3.483872890472412,3.053874015808105
50348,The Big Fight,tabitha,5,i was siting in the garden picking flowers talking to my freind.  she said who ist here but i said what are you  talking about i hope it's my cat yeh right!or my dog why would your dog be out 1:00a:m dingdong mom could have let him out yeh thats true dumbo youcircus pig. ,273,2.861783504486084,3.2766613960266118,3.1630635261535645
100477,Horses,tabitha,5,horses horses here and there. horses horses everywere. horses horses run all day. horses horses run away. ,105,2.71997594833374,3.1587047576904297,3.0650899410247803
40621,My Baby Brother,tabitha,5,"my baby brother is so small,  he hasn't even learned to crawl.  he's only been around a week,  and all he seems to do is bawl and wiggle,  sleep. . . and leak. ",155,2.485191822052002,3.1850154399871826,2.8760476112365723
110457,A dip in the stew.,tabor,5,"i have to dip in the turkey stew.   that was overdue.   i hit a break through with my bamboo,   i said get through.   but when i needed to break into it,  i withdrew. ",164,2.808465480804444,3.070000648498535,3.160200357437134
14099,The Poem Of A Person,tacey,5,"this poem of me is easy to see just read it with your pair of eyes and don't give out a pathetic cry i don't know the point of this but you don't either,  dis!   i came to this website and saw a hard fight for i wanted to do a poem  it's hard,  do 'em!",254,2.950536012649536,3.662766456604004,3.360952138900757
114401,Origami,taft,5,"origami can make lots of things it can make a little wolf with wings it can make a person have a lion's mane it can make rainbows in your brain it can make a hot dog eat a shoe it can make unicorns make stew with only a little paper white anything can happen,  if you give it a try",283,3.5081753730773926,3.4169745445251465,3.3099517822265625
74939,My eyes,taha,5,my eyes are glaring black if you look at my eyes you'll see the darkness shadow of me it looks like a black storm that's about to attack this is my lovely eyes i love. ,170,3.368286371231079,3.6486103534698486,3.205275058746338
108910,Summer,taiylor,5,the grass is so green it looks like a movie scene  tank tops and shorts going to a whole bunch of resorts,108,3.301611423492432,3.220128536224365,3.231188535690308
91560,The best,tajreen,5,"roses are red,  violets are blue,  your the best,  till the day i die. ",71,3.610241174697876,3.471114158630371,3.2959177494049072
91557,The world around me,tajreen,5,"the world around me,  is big.  i love this world,  scince the day i was born.  and i'll love it,  until the day comes,   i have to die.  this world were living in,  we might never see it again.  the world around me,  will stay for generations and centries.  the world around me will live until i die.  because i died and i'll never see  the world around me         again. ",362,3.3969078063964844,3.5421719551086426,3.2720329761505127
91654,Having a dream,tajreen,5,"i have a dream,  a dream no one else has.  a dream,  that is very meaningful.  i have a dream.   the power must go up,  we must be brave.  we must stop it,  it cant go this way we must be free.  we must not be treated this way.  i have a dream.  we must stop segraation.  freedom of light,  we must see.  we can't give up,  we must suceed! i want freedom,  i want peace.  we must be together.  we must be even steven.  yes,  i am  dr. martin luther king j. r. ",440,3.372642040252685,3.51134991645813,3.3584582805633545
64376,Volcanoes,tajuan,5,"volcanoes are so loud, louder than a crowd if blown away, there is nothing to say just watch out,  getting blown to the south",126,2.565122365951538,3.392783641815185,2.998049736022949
64367,Memories,tajuan,5,memories are cool remembering from ages sometimes way way back,66,3.785434246063232,3.3947901725769043,3.3293275833129883
97105,I look at you,takohma,5,"i look at you your eyes so,  blue i look at the ocean your eyes match it too.  i look at the sky and it says thatthoose bright blue eyes will match anything you think is butiaful. ",180,3.515415668487549,3.440882921218872,3.2670669555664062
97108,snoring,takohma,5,"snoring and boring they both are so,  boring snoring is boring and somthing boring is snoring",95,2.264911413192749,3.187910318374634,3.0033109188079834
117392,Rainy Day,talaal,5,outside it started to pour my whole family snored  i snuck out of bed and thought on what to do so i thought and i thought on what to do so i thought and i thought but i had no clue i thought of lions in cars and zebras in bizarre i thought of men in skates and mice that hate i thought of cars that cry people that fly so i knew what to do the best thing to do is to think,376,2.5491952896118164,3.298271656036377,2.962744235992432
115755,MY HAIR!!!,talaiara,5,i love my hair not too short not too long dark brown lovely hair i can play with it and design it,100,3.994739532470703,3.5348095893859863,3.3743021488189697
66871,Mary Jane,talal,5,"oh mary jane she is in pain,  but what can we do about it,  call the doctor or a nurse,  i'll pay the money just let me get my purse, ",133,2.66097354888916,3.1763272285461426,3.077986001968384
84899,Halloween,taleejah,5,halloween halloween    halloween is here    i just had a felling it was near    people walking people talking    people scaring in every direction    boo boo boo boo    is all you hear     the next thing you know    ahhhhhhhhhhhhhhhhhhh    it's a ghost    know really it's fake    wow what a joke of the day!!!          this book is cated to mr. b,349,3.6205129623413086,3.8495514392852783,3.279738426208496
119249,Apples,talia,5,"an apple is red try a bite or a slice if it's red or green it taste good mmmm, so nice my grandma says' ''an apple a day always keeps the doctor away. ''  how many should i eat anyway? an apple is red.  i''ll eat one before bed.  an apple is green i enjoy them crisp and clean. ",277,3.8577146530151367,3.4346141815185547,3.356903553009033
93873,In my front porch,talia,5,in my front porch  waiting for a bird to pass   waiting for a crow to crow and waiting for the grass to grow.   in my front porch i can see many animals and buzzing bees. ,172,3.1955714225769043,3.153090000152588,3.144489049911499
40313,My dog is such a cutie,talia,5,"his ears are large,  his tail is waggy,  i don't know were to start! i thing i'll talk about his personality,  that's a good thought.   my dog,  cookie is like a kangaroo,  i don't know why,  but it is true.  he jumps and plays with your shoe.  my dog is such a cutie!  when my dog is with his bone,  he growls and crunches up his nose.  it is funny,  i know.  my dog is such a cutie!  his tail is always in motion.  it always causes comotion.  he gets hyper when i have spoken,  your doll is almost broken.  my dog is such a cutie!  cookie's ears are like a pyramid.  they are big,  large,  and as red as my school experiment.  don't be fooled by his cleverness,  my dog is such a cutie!",670,3.764002084732056,3.6832568645477295,3.348792314529419
104726,School!,talia,5,slam! books on a desk.    yawn! sitting in class.    hi! i say to my teacher.    yuck! school lunch.    school!,110,3.2606351375579834,3.747059345245361,3.2207236289978027
109576,My Bag,talia-rose,5,i love my pink and blue bag with the red white and blue flag that i had to drag i love to brag and nag i have it when i play tag,131,3.930102586746216,3.668403625488281,3.416086435317993
21097,FEELINGS,talisa,5,"when feelings get hurt,   your eyes start to water,  and your heart starts to hurt. ",84,2.054649829864502,3.515524387359619,2.898045301437378
95070,The man from Peru,talita,5,"there once was a man from peru,  who dremt he had slept in his shoe,  he awoke  with a fright and a delight to see that his dream had come true",144,3.565128326416016,3.6640830039978023,3.234540700912476
44016,Rain,taliya,5,seeing all the rian            going down so fast             wishing it will last            the sun is coming out             i am stating to pout            i wish the rain would last,189,2.796984434127808,3.134211540222168,2.9401700496673584
109349,Twas,tamari,5,talented awesome mored angel remembered independed,53,3.669366359710693,3.479525566101074,3.3227272033691406
105042,School,tamea,5,te bad thing about school is it its crule but the good thing is  i got an a on my quiz and i got to get in the pool  when i do my work i have a little smirk my teacher is a real creatcher   we ever get to play not even a minute a day,236,3.527595996856689,3.442941427230835,3.36679482460022
114937,Messy conten candy,tamia,5,so good melt in my mouth favorie pink  so sweet and good mame me keep eating more,84,4.35283088684082,3.7705836296081534,3.41202163696289
94884,My dog,tammy,5,i love my dog .  it is a cute dog.  he is very nice.  i love my dog.  i give him treats.  he likes treats.   especially the bacon yummy ones!!!!! he loves them sooooooo much.  my dog can do tricks he does sit come down up jump  because i taught him toooo!!!!! he is brown and small  i love my dog!!!!!!!! the end,308,4.343047618865967,3.857950210571289,3.410884380340576
27465,Weeping willow,tammy,5,weeping willow  why do you weep?  is it for a love left behind  or is it the world you see  constantly changing for the worst  a tree isn't just a tree  a living gift of gods grace  weeping willow so beautiful your  limbs hang so gracefully  grow tall and strong  with leaves so evergreen  you give others shade on  hot days and sheild everyone  in the forest from the rain  please weeping willow don't weep  your loved by all  big and small. ,445,3.4105420112609863,3.42792010307312,3.2121670246124268
27466,Cherry tree,tammy,5,"if i could be a cherry tree  leaves blowing gracefully  watching the world in front of me  good,  bad,  and all children  different sizes and cultures within  giving my fruit to all who needs to eat  showing off my blossoms in the spring  beautiful white pedals all around.   for everyone to see from the ground  oh what a treat if would be  if i could be a cherry tree. ",370,3.749622106552124,3.592879295349121,3.307369470596313
115002,The Butterflys,tamya,5,butterfly butterfly butterfly i love my butterflys but if  my butterflys give up on me what do i do set right there and just cry but the the fake butterflys talk behind my back and then try to get back at me like don't talk to me.  but then i just look back and  be like your nasty of how you act to me butterfly like why ? then they act all fake and and try to say things that i don't like .  remind yourself of what you said to me now you want to take my friend from  now i'm cry and pray that you will stop bullying me .  but now i'm telling on you that you are bullying me and my friend did not even know  that you were bullying butterfly but guse what now you just got told  on so what now. ,695,2.263507843017578,3.553413152694702,3.0636417865753174
110655,JELLYBEANS!,tamyn,5,almost every morning i eat jellybeans without a warning every evening right at eight i eat jellybeans while bounceing off the gate,133,3.208730936050415,3.40014123916626,3.2692224979400635
92171,Cloud sounds,tanae,5,"its silent sound relaxs my ear,  but every now  and then,  the soft sound of rain thumps against my ear",104,2.866024971008301,3.2711498737335205,3.06402587890625
120265,My Ears,tanay,5,my ears are smaller than pears.  they hear anything near.  cheers for ears! you will not fear when ears are here.  they will get far when your ears are far.  without your ears you couldn't hear.  i love my ears. ,209,3.9597842693328857,3.8423452377319336,3.4034430980682373
21534,What I would put in my brew,tand&apos;raya,5,"i would put cotton candy and a boy named andy,  a black cat and a live rat,  a frog and huge dog. ",98,3.0856332778930664,3.073872327804565,3.18975567817688
43098,I Have A Dream in Honor of MLK Jr.,taneisha,5,"i have a dream that one day we can all live in peace,  that we can put all these wars to a cease.  i have a dream that one day we will let freedom ring,  the whole world will be so happy everyone will sing.  i have a dream that one day we will stand up for our rights,  instead of yelling and causing fights.  to you,  stupid,  this may seem,  but i have a dream.   in honor of martin luther king jr.  january 2004",406,3.5047526359558105,3.477537155151367,3.319305658340454
34528,Skiing,tania,5,"the first time i tried to ski,  i could not see.  the snow was blowing in my face.  it was a big disgrace.  i was about to leave,  but my dad told me to believe.  i was then able to ski.  hooray for me! every year i did not fear,  i was able to ski,  and it was clear!",262,3.612826824188232,3.720984697341919,3.343342065811157
34529,FRIENDS!!!,tania,5,"you and me,  she and he.  we're all alike in many ways.  she has blue eyes,  he has many blue dyes.  you and me,  as he and she can see,  are alike because we're friends!!!!!",171,3.669658899307251,3.591796398162842,3.3601183891296387
18481,Home work,taniqua,5,homework homework i hate it. i just try to act sick but he just it me with a stick. homework oh homework you make me so bored. i try to get away from your homework but it creeps back on me. i ask my family are you part of the family they said yes'you have to get to college. ,273,2.3958849906921387,3.33080530166626,3.011191368103028
118685,The Coin!,taniya,5,"did you know the story of the coin? if not , i'll tell you right now,  he was golden and shiny,  way to clean to be ran around.  one day a dollar note came,  to teach him a lesson,  to stop thinking about himself and start thinking of others! he said yes,  but in his mind,  he really didn't agree.  the very next day,  he sat at home,  looking at mirror &amp; watching tv! then he decided to go outside and see what's going on! but to his dismay,  he saw not a single mirror,  nor a single splay.  so he went to the dollar note,  to ask for some advice,  to make his life perfect again,  without thinking twice.  so the dollar note asked if he had been caring.  so the coin shook his head and said  he wasn't daring! he went back and gave a penny,  he found it rather pleasant,  and gave to his sister jenny,  one by one , he gave away to the children filled with joy,  later then he gave each of them yet another toy! soon his life changed to all good,  and then thanked the dollar note very very much!",983,3.436433792114258,3.44049334526062,3.248840570449829
89709,May,tanna,5,"may has 31 days,  days full of fun,  sun's shining rays.  may has a special day,  it comes once a year,  with a special way is mother's day",137,3.961161851882935,3.597846746444702,3.3805010318756104
24728,Snow,tanner,5,"snow is a big thing for kids! we have been waiting for alot of snow,  but we are in indiana and they don't get much snow.  snow is fluffy and sometimes soft.  snow is very bright and white.  snow is very cold and sometimes wet.  did you know that snow is made out of frozen drops of water? we have had a lot of snow.  i think it wasn't much.  my mom doesn't like snow.  snow is for building,  going skiing,  playing,  sledding,  shoveling,  and snowball fights. ",451,3.2274532318115234,3.256186962127685,3.2274646759033203
106314,I had a dog,tanner,5,"i had a dog,  he was in a fog.  he lost his bone and ran away from home and i had a dog. ",89,2.3012866973876958,3.238804817199707,2.883772611618042
112494,Sadness,tanner,5,grey looks like sadness sadness tastes horrible sadness sounds like screaming sadness smells like death sadness looks like murder sadness makes me feel like all the love has left from the world,197,2.525578498840332,3.39355993270874,2.9607951641082764
97116,Tomatoes,tanner,5,"i know tomatoes can be red,  i know tomatoes are soft as bread,  i don`t like  tomatoes that are green,  i think they are the shape of a lima bean,  i know you are jealous of this poetry,  its time for you to plant a tree. ",221,2.9909508228302,3.1914868354797363,3.2450881004333496
94211,School,tanner,5,"boring math,  headache homework,  annoying teachers,  hard spelling,  nasty lunches,  my hand is falling off,  cruel principal,  gross toilets,  its prison!!!",153,2.0930604934692383,3.6143639087677,3.056633710861206
39345,Sister,tanner,5,sometimes my sister cries all the time tattle tale sometimes.  she loves candy she loves to play.  she loves baby dolls.  she seeks in to my room and + sheâ’s mean to.  i know iâ’m not a poet   and i know  it !,223,3.2622973918914795,3.3864755630493164,3.2241814136505127
33119,I wanna be!,tantaneya,5,"i wanna be free free,  like a bumbaabee i wanna be wild i wanna be know as the wild child  i wanna be greatful gratful and fateful i wanna be you byt what do i do?",165,3.5435595512390137,3.6383376121521,3.3679206371307373
111238,Tis the Season,tanvi,5,tis the season to be jolly  fa la la la la la la la la  christmas is about giving not getting help the homeless and don't be restless   don't be jealous just be generous fa la la la la la la la la  eat healthy and be friendly fa la la la la la la la la,255,3.4212751388549805,3.28296422958374,3.304760217666626
27428,&apos;&apos; Cruel Frederick &apos;&apos;,tanvika,5,"here is cruel frederick,  see! a horrid wicked boy is he; he caught the flies,  poor little things and then tore off their tiny wings.   he killed the birds,  and broke the chairs,  and threw the kitten down the stairs; and oh far worse than all besides he whipped poor mary till she cried. ",288,2.1322789192199707,3.5764875411987305,3.124300241470337
16001,HOW MY UNCLE PAINTS,tanya,5,''i painted our kitchen blue.  i painted you mom's room yellow. i painted your room pink. i painted your brother's  room green. i painted your bath room red.  where else should i paint?my uncle asked? paint on a paper!!,217,3.304231643676758,3.4453067779541016,3.29740309715271
14326,WANT A  BROTHER ?,tanya.,5,"my father has a brother.  my brother has a father.  so if you want to have a brother,  you sould ask your father.  if your father has no brother,  you should ask you mather. ",171,3.009403705596924,3.0249269008636475,3.279738187789917
55001,Summer,tara,5,"summer is the best of all it's better than winter,  spring,  or fall you can dive and swim in the pool so you won't be hot,  but you will be cool summer is also really great because you can stay up very late another reason summer is cool is you don't have to go to your school i do like summer,  spring,  winter,  and fall but this is why summer is the best of all!",363,3.9803121089935294,3.678205728530884,3.394508123397827
76610,T-A-R-A,tara,5,t-alented  a-thletic  r-eliable  a-wsome,43,3.039668560028076,3.0245842933654785,3.150479793548584
14545,Somebody,tara,5,"who are you,  are you loving,  could you write a hiaku? do you dislike shoving? who are you?  do you love me,  could you hug? could you climb a tree,   or catch a bug?",166,3.3231723308563232,3.363292932510376,3.191974878311157
52738,Forige the last moments,tara,5,"forget what had happend in the past forget what will happen next just think about right now how well it goes with love  forgive me for my mistakes,  my problems and my troubles forgive me for everything because mistakes are make by all  now i know that this is it because i am having fun there is not loser no winner at all because there are differences between the snow and the sun!!!",388,3.690870761871338,3.6653785705566406,3.373713254928589
116745,I CANT THINK,tara,5,i cant think of what to write as im at the light i cant when im putting the dishes in the sink i cant think of what to write i just might go on a flight. . .  wait. .  i can think of what to write hahahah i ryme all the time,222,2.6415441036224365,3.2076220512390137,2.9516918659210205
108330,Purple and pink,tara,5,i am one kind.  because pulple sweater.  pink feels so warm.    iam purple grapes are tight.  i feel so empty without pink.  i feel mad with purple but i feel good  inside when i see purple and pink. ,219,3.581854820251465,3.441084623336792,3.23023533821106
104860,dance,tara,5,i like dance dance is eligant dance is calming dance is fun  you should dance,80,4.003651142120361,3.55537223815918,3.3726284503936768
73250,Tara,tara,5,"tara generous,  kind,  responsible,  sibling of  jacob lover of  sadie,  watermelon,  ps2,  my family,  frogs who feels  friendly,  weird,  warm who needs  chocolate,  food,  clothes,  candy,  weirdness who gives  presents,  friendship,  art work who fears sharks,  the mall closing,  global warming who would like to see  niagara falls,  new york city,  my mom walk",351,3.268744945526123,3.2537970542907715,3.1887378692626958
24033,ERIN,taran,5,erin   a    friend a   good  friend she  is  a   nice  girl  a  wonderful  friend,84,3.996619462966919,3.460223436355591,3.329294204711914
91395,Cats,taryn,5,"fluffy,  funny.  jumping,  scraching,  laughing.  their the key to your heart.  domestic tiger. ",92,4.143012523651123,3.8436038494110103,3.4161040782928467
91870,Friends,taryn,5,"fun times.  laughing,  jocking,  playing.  why not have some.  a smile everyday.  come on the road to the good life.  take a look around.  so much love.  that's what friends are for. ",176,4.160339832305908,3.715036869049072,3.432184934616089
91122,Music,taryn,5,"beautiful, sweet.  singing, dancing, playing.  best feeling in the world. culture",78,4.440428256988525,3.821584224700928,3.405858039855957
