id,title,author,grade,text,char,valence,arousal,dominance
103225,Puppies,kayla,6,puppies puppies everywhere  black and brown covered in fluff  when they play it makes me giggle    puppies puppies i do see   playful with everybody  yes puppies are just little puffballs   puppies puppies soft and sweet they get anything they want by wining  i love puppies. ,282,4.108107089996338,3.73823881149292,3.4004786014556885
53140,CHOCOLATE,kayla,6,"can't eat beef,  mad cow. . .   can't eat chicken,  bird flu. . .   can't eat eggs,  salmonella. . .   can't eat pork,  fears that bird flu will infect piggies. . .   can't eat fish,  heave metals in the waters has poisoned their meat. . .   can't eat fruits and veggies,  insecticides and herbicides. . .   hmmmmmmmmmm!!!!!!!!!!!!!!!! m m m m  i believe that leaves chocolate!!!!!!!!!  chocolate is a vegetable.   chocolate is derived from cocoa beans.   beans=vegetable.   sugar is derived from either sugar cane or sugar beets.   both of them are plants,  in the vegetable category.  thus,  chocolate is a vegetable.   to go one step further,  chocolate candy bars also contain milk,  which is dairy.  so candy bars are a health food.   chocolate-covered raisins,  cherries,  orange slices and strwberries all count as fruit,  so eat as many as you want.   remember",831,3.255577087402344,3.56937026977539,3.307441711425781
108822,amimals,kayla,6,i am a snake i can jump 5 feet i sneek up on you i can see you. ,66,3.1188747882843018,3.393062114715576,3.1900570392608643
19860,Love Feeling,kayla,6,"love is pink like a petal falling off a rose because at the end it always falls apart,  it makes my want to sing,  it sounds like romantic music feeling the air,  it taste like ice sundae,  it smells like new roses feeling the air,  it looks like a big heart pumping for room,  its texture is life putting your hand in a cloud,  it moves like the pcean on a beauitful day. ",368,3.928439140319824,3.7337875366210938,3.2290759086608887
24465,Anna,kayla,6,"anna is a big banana,  she has a big bandanna.  she wears it on her head,    but not when she goes to bed.    anna loves to swim,   with only one fin.  while she sings her song,  all day long. ",188,3.486020088195801,3.224710464477539,3.24311637878418
95460,My Name Is Kayla,kayla,6,my name is kayla i want to live in peru i jump around like a kangaroo if you dont belive me it is so true,108,3.1876626014709477,3.3950891494750977,3.266463041305542
53254,My Dog,kayla,6,my dog is part of the family he always knows what to say he will always say that tomorrow  is another normal day you know i really can't hear him  this is all just a lie  but i did hear somthing that very night that made me wounder why,238,2.491886138916016,3.2928645610809326,2.9789624214172363
53508,"Little body, big heart",kayla,6,my body may be small.  but still my heart is as big as the world .  people say pick up you neighborhood trash.  i say i will do the whole block.  they say give some cans to the homeless shelter isay i will give my whole coabard.  they say recycle your trash at home. i say i will recycle the whole school.  that's how big my heart is even though my body's small!,358,3.3935937881469727,3.4987592697143555,3.384895086288452
68866,My Cat,kayla,6,my cat is very fluffy but she's also very mean she bites when she's mad  and claws when she's angry  my cat is a calico which is very colorful everybody thinks she's pretty  but not me,187,2.9681942462921143,3.2720961570739746,3.2013275623321533
78925,Snowstorms,kayla,6,"snowstorms are a pile of coconut,  scattered from the sky,  on the ground coconut is piled high, ",98,2.933179378509521,3.184256792068481,3.154130220413208
38301,I have a great best friend,kayla,6,"i have a great best friend her name is taylor hoehn she is always really nice,  and never is a pain we're almost exactly the same in so many different ways i've known her for quite a while i can always depend on her to make me smile. ",235,4.112273216247559,3.624798536300659,3.366749048233032
83101,Curious George,kayla,6,curious george is my turtle i akmost called him murtle he wandered around day and night as i watched him i filled eith delight he was small and slimy and when i tried to hide from him he always tried to find me curious george was green and hard he actually looked lke a chubby lard he ate alot of food he played when he was in the mood but i love my curios george!,367,3.7770843505859375,3.649057388305664,3.328449010848999
95156,Now,kayla,6,"too many times i've seen it. . . .  rip a hole into our friendship. . . .  look at me now;look at me now  you left me cold, alone. . . .  abandon. . . .  look at me now;look at me now  you won't take my place. . . .  i've know that forever. . . .  look at me now;look at me now  so i guess i'll stay. . . .  suffacating under words of sorrow. . . .  look at me now;look at me now",349,2.3496341705322266,3.296926736831665,2.948023557662964
101409,Christmas Cheer,kayla,6,"christmas is here,  with all the cheer,  our moms always say,  come here my dear.   once or twice,  we flick the lights,  nor two or three,  but the whole tree!  when it is night,  we don't want to fight,  for the jolly st. nick,  will leave us a stick. ",245,3.6126108169555664,3.629892587661743,3.3440043926239014
45952,Myself,kayla,6,i love myself.  i hate myself.  it all comes down to one of these sentences. ,78,2.6978726387023926,3.371551513671875,3.112294912338257
86555,"New York, New York",kayla,6,"i'm walking down the streets of new york the winds whip my hair from side to side the hoots and honks of cars and screaming children slide through my ear this is my new york new york,  new york",195,3.346703052520752,3.5627119541168213,3.261036872863769
45377,Rolando,kayla,6,he always wander round and round.   he studied every witch away.   he loved me very much.  but he always fail to say.  ''i love you'' all the time. ,148,3.7705700397491455,3.48409366607666,3.2456514835357666
45337,Butterflies,kayla,6,they flutter in wind.  they have nice wings and color.  the color so sweet. ,82,3.866177558898926,3.398001194000244,3.24570631980896
108225,Life,kayla,6,"my life is a balance beam and i'm always falling off.  my life is the uneven bars,  swinging and gliding through the air on a different bar.  my life is floor,  working hard and trying something new.  my life is vault,  first calm and then adrenaline is pumping and at the end victory.  my life is gymnastics,  hard work,  effort,  pain,  sorrow,  and happiness. ",353,3.379879951477051,3.4618635177612305,3.234297752380371
24079,The Sun,kayla,6,mr.  sun you are always there mr.  sun you really do care mr.  sun you light up my life\t mr.  sun you are really nice mr sun why do you shine mr.  sun will you be mine?,167,3.784008502960205,3.438931465148926,3.300793409347534
24080,Cira,kayla,6,"her nose is wet her tail is long like a snake\t her ears are huge like a lake she is not fat like a pig but she sure can dig she is my dog loving and kind,  cira she's all mine",179,3.599918365478516,3.4731364250183105,3.3232548236846924
48327,Color,kayla,6,black is . . .  as dark as night  as smooth as hair  as thick as smoke,70,3.1312289237976074,3.195621490478516,3.1331961154937744
48371,Windsor,kayla,6,"windsor                nice, funny              runs, walks, talks             has curly blond hair                  human",124,3.656446695327759,3.2848119735717773,3.247993230819702
110117,The Stork,kayla,6,"when i awoke one morning,  a stork was on my head.   i asked what it was doing there it looked at me and said",111,3.019262313842773,3.3541007041931152,3.098273038864136
48624,Love,kayla,6,"i love you in big ways,  i love you in small ways,  i love you this minute,  and i love you always!",99,4.562177658081055,3.958465337753296,3.4285552501678467
50707,Reading,kayla,6,"reading is fun,  reading is great,  it can take u places. .  how about a lake?! when i am reading  i can be any where! i could be riding on a giant hare! so now u know this story is true,  it can take people places,  how about you?",230,3.961283683776856,3.759098052978516,3.428093433380127
39883,Shopping,kayla,6,"do you love too shop  is it i your blood , clothes and candy so shop till you drop!",85,3.641924381256104,3.745216846466065,3.396634340286255
46961,The dark cold night,kayla,6,"i heard a knock at the door  then i heard a creek in the floor my heart froze and my feet dozzed what could this be at my door then someone yelled more,  more,  more there stood a huge man  with a huge ugly fan he then headed stright for me i thought i could this be when he stepped in the light  he gave me a huge fright i noticed it was my dad at the door. ",361,2.6468605995178223,3.6138744354248047,2.9395596981048584
39416,The Bug,kayla,6,"there once was a day,  when there was nothing to play.  so i squished a bug.  he came and asked why i was such a lug?",117,2.483816385269165,3.1611695289611816,3.035710573196411
29690,"September 11, 2001",kayla,6,"thought they would destory america.  terrorists had joy while they watched.  the time stopped after the buildings blew up.  the lives that were lost are off the charts.  the lost families' hearts were torn in half by the hands of evil.  this tragic event brought americans together.  the people that could do such a thing are idiotic,  but americans are patriotic by flying their american flags and looking at them with pride.  the people of america are all united as one country!",475,3.0989413261413574,3.610385894775391,3.225689649581909
29693,Aunt Patty,kayla,6,"doctors said she'll be fine.  it turns out the doctors lied.  seven months went by no one new the cancer was eating her insides.  by the time the doctors got their heads together,  she was gone asleep forever.  now it's been a year and i still hope that it didn't happen and she was still here. ",292,2.451245784759521,3.2786664962768555,2.8811123371124268
112069,Spring,kayla,6,"there goes the snow,  ice and sleet,  i watched it away as i do my chores. ",76,2.900731086730957,3.0695605278015137,3.1070916652679443
102413,Love,kayla,6,oh this guy named ayden he loves this girl bridget its funny cause he always says hey honey bunny then she goes hey aydey wady its cute as a button,151,3.817730903625488,3.4648303985595703,3.272012233734131
84475,Happy Birthday,kayla,6,"a dream in your pocket,  a wish in your shoe,  a rainbow to wear,  and a moonbeam or two,  a smile on your face,  and a star in your hair~ hope today makes you feel  like your walking on air! happy birthday",204,4.229185581207275,3.853330373764038,3.3626062870025635
94829,Snow,kayla,6,"a white cold flake fall on the ground.  a piece of white snow is found.  it covered the town,  and no one made a frown.   kids always play in the snow,  but soon the leaves and trees will grow.  now i say,  ''lets have fun and play. ''",231,3.390641450881958,3.247865676879883,3.3042266368865967
67108,Someone Special Is...,kayla,6,someone special is kind   someone speccial is thoughtful   someone special is someone i love. ,96,4.0400872230529785,3.4774832725524902,3.335848569869995
30172,BOY-GIRL,kayla,6,boy                girl garden gate      standing kissing  very late          dad comes big boots          boy runs  girl scoots,131,3.2448129653930664,3.204739570617676,3.2222888469696045
28690,THE FROG,kayla,6,"the frog hops in the grass so fast it almost crased through the mud, he looked like a clud but yet he was acting like a dud,  he must of had a clud of mud on his bug that he was going to catch. ",194,2.593856811523437,3.189406394958496,3.057509660720825
100982,My Life,kayla,6,"kayla california daughter of valarie adel poteet, ryan christian strole owner of simba, cash, trevor, hunter, harley, skyleigh, farakon, sky, and oc i love all family and friends i fear spiders and scorpions i am good at drawing and gymnastics i am going for diploma go to college also get married i am thankful that i was born  i am very artsy,  colorful,  and out going",364,3.660027027130127,3.4062557220458984,3.306490898132324
41427,&apos;&apos;Me&apos;&apos;,kayla,6,"as happy as a butterfly,  as purple as grapes as bright as a sunflower,  as comforting as a bed i'm as full of caffiene as pepsi,  as energetic as a light bulb but,  today i'm as cartoony as tweedy bird  as brightening as a sunshine,  as pretty as a shirt as noisy as a child,  as busy as a mom i'm as crowded as the united states,  i'm as early as 6:30 a. m.  but, i'm as floppy as jello. ",382,3.604978561401367,3.5586249828338623,3.233630418777466
86667,Under the sun,kayla,6,under the sun  melting away it feels so nice so i think i'll stay under the sun heating my skin  i don't seem to see the trap that i'm in under the sun under the rays my mind goes blank passing the days under the sun all day long the streams of light are singing a song under the sun when the sky goes black now i'll go home until the sun comes back,353,3.411003589630127,3.2743935585021973,3.189462423324585
107610,Vampire,kayla,6,"vampires creatures of the night.  darkness theyre only delight.  a humans fright,  vampires sinking there fangs into the flesh of your neck quenching theyre thirst vampires,  creatures of the night. ",197,3.1984496116638184,3.6045539379119873,3.1695444583892822
107611,Rose,kayla,6,"beautiful,  delicate being rose,  a sweet smell to bring a room together, a gift for a diner date or whatever the color of blood with little prickly thorns to keep predators away and make sure they dont become prey.  rose",220,3.81513261795044,3.54736876487732,3.3119301795959477
107613,Lone wolf,kayla,6,"alone,  all alone kicked out  outcast hunting for itself  keeping itself alive,  alone fighting defending itself outcast",121,2.403613567352295,3.21734619140625,2.883705377578736
107614,My flower,kayla,6,my flower my oh so lovely flower  how your peddles wisp in the wind.  your beautiful scent covers my nose as i sniff my flower my oh so lovely flower please dont ever leave me,177,4.110464096069336,3.725696802139282,3.3172314167022705
33709,Storms,kayla,6,"some are silent; others are loud not a person on the streets; there's no one to be found  raindrops trickle on the roof,  thunder strikes,  what a goof!  children hide under their beds,  mothers struggle to get their kids fed  this is the end of this looney tune,  so go to bed and eat your prunes!",308,2.662737369537353,3.705517292022705,3.1946861743927
33710,Heroes,kayla,6,"brave,  fighters,  not afraid to win,  patriots to the end willing to die to save another,  willing to leave their mother and father  fighting against their foes,  these unsung heroes fallen heroes come and go,  but they never leave our hearts  children mourn their parents' loss,  others never know of the cost  dedicated to: the brave men and women fighting in the war against terrorism",384,3.0695719718933105,3.347649097442627,3.2049360275268555
84476,Mommy,kayla m.,6,"mommy is so beautiful,   it'll make you want to stare.   mommy is so beautiful,   she looks like my little mare!  mommy is so beautiful,   i hug on her at night,   mommy is so beautiful,  don't worry! it's all right. ",213,4.422128200531006,3.965356349945069,3.385772943496704
109511,One direction,kaylah,6,so hot sing so good harry is so cute and zain is to just like the others are to.  they love to sing just like me .  like  to draw like zain  love to eat like niall. ,168,4.138617038726807,3.687034130096436,3.297459363937378
109683,The Fright!,kaylee,6,"there was no one is site,  i herad a creak from the door.  it gave me a sudden fright that i couldn't ingore  the house was silent,  and it's not funny,  it wasn't as vilent as harry's bunny.   if you thought you we're scard before,  just wait and see oh wait little more. .  just what will happen to you not me.   the creak grew louder and louder,  it was getting so scary,  but it was very hairy.   me and harry we're getting scared,   when all of a sudden we heard a sudden there was no one there.   we looked in the halls,  and down the stairs. . .  then there was balls,  falling for some where!  me and harry ran out of the house and never came back again,  until we remembered the bunny &amp; mouse!",689,2.4552321434021,3.5103776454925537,2.8352038860321045
68781,My Sis,kaylee,6,"my sis, blue eys, long brown hair that shines in the sun-light, she has moms face, dads nose and my personality, my sis. ",118,3.290335178375244,3.10300087928772,3.2466208934783936
48740,My brother is a pest,kaylee,6,my brother is always in my room.   i have to chase him out with a broom. ,74,2.642310857772827,3.472894191741944,3.153603792190552
64581,"Cats, Cats, Oh Wonderful Cats!",kayleigh,6,"cats,  cats,  oh wonderful cats              they're cuddly                            they're sneaky                             they're soft and fiendish                  but playful and cute                       they're acrobatic                          they're skill dramatic                      they're sly and cute enough to cook in a pie they're beautiful they're colorful they love me and you  but best of all,  they hop on your lap right on cue!",458,3.854823112487793,3.6629576683044434,3.324476718902588
112770,Wet Daisies,kayli,6,"dripping,  water runs down,  the edge of the petals,  pouring down like tears from her eyes,  raining",100,2.5589406490325928,3.3745269775390625,2.943512439727783
112771,Stars,kayli,6,"sparkle,  in the night sky,  glistening like candles,  the beautiful light of the night,  stars",94,3.704079151153565,3.420780658721924,3.252112627029419
112772,Reading Books,kayli,6,"i hate reading books,  it's just so boring,  staring at words is so lame,  why read books,  it's a waste of time,  i have the internet to give me information,  computers are much more fun than worthy,  but reading a book is sooo out of my league. . . just kidding! reading is awesome,  don't let computers replace reading!",314,3.307124614715576,3.7697367668151855,3.334371328353882
112773,Lin,kayli,6,"there once was a women named lin,  who fell into a very small tin,  she couldn't get out,  so she started to pout,  she couldn't get out ever again. . . bye bye lin",160,2.36032772064209,3.2150120735168457,2.864254951477051
112769,Basketball,kayli,6,"bounce,  bounce on the court,  dribble,  dribble shoot and score,  basketball is cool!",85,3.9708809852600098,3.84694242477417,3.4544765949249268
112767,Red,kayli,6,"red is powerful,  red is the color of an apple,  red is the color of a rose,  red is the color of a cardinal,  red smells like a burning fire,  red tastes like a jalepino,  red sounds like rock n roll,  red looks like a crab crawling on hot sand,  red feels like heat,  red makes me hot,  red is my favorite color",306,3.617194175720215,3.545064926147461,3.286574602127075
112766,Beach,kayli,6,"beautiful breeze ever changing tides a relaxing clinmate chilly,  salty water hot summer sun",94,3.884243965148926,3.3686628341674805,3.293748140335083
84537,Animal Talk,kaylie,6,"whenever i dream of horses,         i think of what they say.        i know they say â“of coursesâ”,        and also â“what the hay!â”        whenever i dream of a cow,       i think of what he will moo.       i know he doesnâ’t meow,       but will say over spilt milk,  \t\tâ“poo!â”",281,3.325439214706421,3.4491755962371826,3.2761876583099365
92437,Me poem,kaylin,6,"kaylin,      vain,  funny,  confident,  loving     daughter of generous,  kind parents     lover of fried chicken,  ice cream     who feel love,  happiness,  faith     who fears spiders,  alligators     who needs family friends laughter     who gives kindness attention     who would like to see broadway hollywood and paris   resident of my own world which i'm princess",364,3.7183523178100586,3.437922954559326,3.316135168075561
117685,Yourself,kayly,6,"you will be known as nothing never will you here you are amazing and you did great this is wrong the reality is you are a failure thinking that  you did great is pointless and we know living for only hate and violence is the way to live life being loving, kind and considerate is a dumb thing to do trying to forget about that will not be easy  (now read down to up)",368,2.947926521301269,3.440086841583252,3.2627673149108887
75001,My Fence,kaylyn,6,my fence is very brown     it is very holey and worn down    it keeps our horse from escaping     she really wants to do chorus,130,2.790094375610352,3.1095199584960938,3.1245179176330566
48623,My Green Dog Is Very Weird,kaylynn,6,"my green dog is very weird.  people always ask me is that your dog,  i say no that dog is way to weird.  when i take him for a walk,   people ask is that your dog,  i say no that dog is way to weird.  when i let a friend stay the night,  while playing outside,  they ask is that your dog,  i say yes ,  after giving him a bath!",321,2.872076988220215,3.3627634048461914,3.1707139015197754
116886,Gone,kayonna,6,the grief of you gone  the pain  of you not there the sorrow of missing you i carry all these things in my mind everywhere i go reminds of all the good times  i miss you my little angel  i hope you are safe now my sweet little cousin. ,237,3.3232944011688232,3.510904312133789,3.131457090377808
116890,Music to me,kayonna,6,music to me is wonderful powerful warm inspiring  it is my everything  my escape from reality  something that i am good at  my one special talent  it can be rap  it can be hip hop it can be country it can be rock  it can be any genre  as long as it tames my imaginations like a lion at the circus it tames me keeps me sane  keeps me alive  there is nothing i would rather do than jam out to my wonderful gift. ,413,3.9708752632141113,3.6984896659851074,3.432889699935913
105092,love,kaytlin,6,whats up with love  love is no fun  flowers and doves  thats so fun,73,4.252207279205322,3.808561325073242,3.395691156387329
105087,bad day:-(,kaytlin,6,bad day not good i got kicked out of school but hey its fine playing video games all the time!,97,3.187056064605713,3.464619398117065,3.243152141571045
105095,funny dave,kaytlin,6,funny dave  he says he lives in a cave  and eats beets all day  funny dave,77,3.467592239379883,3.241087913513184,3.264320611953736
105096,dreaming all night,kaytlin,6,dreaming at night is a great sight dreaming of kites and bikes  dreaming all night,85,3.6990442276000977,3.489384174346924,3.268887758255005
94155,winter,kaytlyn,6,i love the way winter whispers 2 its shadow on the night of christmas eve!,77,4.197912693023682,3.808178663253784,3.386087656021118
94173,Power,kaytlyn,6,power of beauty  runs beneath  my skin  ripping like only  ask always as  our sordid life!,93,3.8107643127441406,3.836890459060669,3.37258243560791
75249,I see you,kazie,6,"when i awoke,  i saw you here you were really there then i heard your voice  i felt you by my side i thought you went to hide all along i didnâ’t know,  youâ’re really my pet dog",180,3.2194035053253174,3.4256629943847656,3.158609628677368
110111,Ice Cream,kd,6,"almost every morning,   i eat ice cream while it's pouring.  every afternoon,  i eat ice cream to my favorite tune.  and at evening,  while it's breezy,  i eat ice cream and i start to feel queasy",193,2.925341844558716,3.24130916595459,3.1031742095947266
108627,Dracula goes to the food stand,ke&apos;shon,6,"let us see vhat we have here. . . caro5t soup(very nice),  london broil,  some kind of rice,  cheese and fruit,  ah,  vat's cute, small donats making snow men.  hey,  vhats this? i't looks like a knot.  i vill try a small bite.  most unusal.  punget.  yet somthings not right.  ma'm, vhats in this bread? yes butter,  uh huh,  also garlic and. . . vait! these are garlic knots!",358,3.4871675968170166,3.3465590476989746,3.30049729347229
107243,Save yourself,keara,6,i'm suffocating myself with the secrets that i hide i seem okay on the outside but it is all a lie i try to bottle it up but it is too much to bear i would tell my friends but they would be to scared  so if i end up dead nobody would care i would lay alone in my grave and hideaway in my little cave years would pass my friends would be grown up my parents would be old and i would be stuck  all the dreams that i made would all be washed away all because a mistake that i made that day because of what a boy or a friend just because my parents yelled at me did it have to be the end my head wasn't straight and my life wasn't right do me a favor save your own life. ,669,2.1567301750183105,3.4249000549316406,2.8497447967529297
22582,Football,keaton,6,football is very fun you can run and tackle people.  and still have fun.  you get a good workout.  and also can jerk out people. ,128,3.76435923576355,3.553637981414795,3.392852067947388
94161,Your heart,keaura,6,"your heart is like a maze, hard to figure out,  bumps in some places,  but once i have it its worth all the trouble. ",116,3.1508593559265137,3.259096145629883,3.203920602798462
94181,Different,keaura,6,your lovely sweet as pie but when you are around your friends it's like you don't notice me  i'm getting frustrated and i think you are very nice but you are very different you'll see,186,3.112765312194824,3.3229665756225586,3.170771837234497
85948,CHRISTMAS,keegan,6,a day of loving.  outside is full of snow.  its christmas glore. ,65,4.009411334991455,3.601667881011963,3.356290817260742
85636,Roses,keegan,6,hockey is fun on the ice an hour cool game keegan is awsome at the game everyone on my team is awsome your team sucks,120,4.095755100250244,3.716007947921753,3.4110238552093506
105253,R balloonz v5,keegan,6,i like ballonz they are shiny and me?  well i ain't grimy you see  i take a bath once a month (witout soap) there i was a dope,129,3.0206854343414307,3.291365623474121,3.334528923034668
105226,Bobs father,keegan,6,bob had a father  he was smart one day he broke his computer  then he fart,77,2.415879964828491,3.153710126876831,3.0318548679351807
