id,title,author,grade,text,char,valence,arousal,dominance
105876,Meandering,mrs. roseangela&apos;s 2a class,2,meandering meandering looking for it i hit a wall i moved right and moved left i moved up and moved down meandering meandering moving some more then i found,160,2.7394323348999023,3.1449668407440186,2.9821040630340576
103354,Max,ms.,2,"max is my puppy black,  curly and fluffy likes to chase balls comes running when he hears my calls",100,3.2539217472076416,3.208479404449463,3.2292001247406006
117776,Monkey,muriel,2,"this monkey is very funky,  the bananas, too.  the monkey acts unkey, which is not a very zunkey word! lanky,  is the monkey's favorite game,  and the game is as an oonkey, jaguar! manley,  the girl monkey that i am unkely talking about,  is as funny as a banunky!",259,3.634566307067871,3.598875045776367,3.334394693374634
86867,The Magic Box,muskaan,2,i will  put  in  colourful   reanbowes  i will put in drips of rain drops i will put in roulling nutts  i will put in colourful roses i will put  inwindy snowy winter   iwill   put    in colourful roses,205,3.3893744945526123,3.210223197937012,3.2937581539154053
88427,Lions Falling From The Sky,na&apos;quan,2,"i see a lion falling from the sky ahhhhh!  the lion is chasing after me but it did not catch me because i was too fast for the lion.   i ran into my friend i said run friend ,  the lion is chasing after us run,  run,  run hurry up and come  before the lion catches you  we are safe phew!",286,3.645480155944824,3.953596591949463,3.2875306606292725
117778,Just me,nadia,2,"when i'm mad i go in a nook after that i hang my hat on a hook , i have a pet bunny she's very funny and cuddly and that's all about me!",138,3.75602650642395,3.676981687545776,3.427454710006714
67256,Games,nadia,2,it is fun to do lots of things one of them is games.  games are fun one of the games thats fun is plasachane yes iam right. ,125,4.068861484527588,3.5730319023132324,3.380715847015381
34342,Spring,nafisah,2,spring  is  here!   spring is here!  itâ‘s a beautiful time of year.   april showers  have brought may flowers,112,4.168652057647705,3.737937688827514,3.416524171829224
28798,"One,Two,Three Here comes Spring",nailah,2,spring looks like rainbows sparkling in the sky.   spring feels like sunrays touching against my skin.   spring tastes like salad waiting at the table.   spring smells like rain that`s blowing away.   spring sounds like chirping birds at my window. ,247,3.702935218811035,3.483675479888916,3.21030592918396
76847,Going away,nam,2,i will go away by the sun go away. i will sleep on a plane for 1day. where am  going? to canada!i came from  anywhere!,119,3.20629358291626,3.691907405853272,3.291966676712036
90600,Summer,namirh,2,summer tastes like ice cream.  summer sounds like birds.  summer looks like flowers.  summer smells like straw berries.  summer feels like hot. ,142,3.684939861297608,3.397859573364258,3.2127628326416016
73748,Step by step you get older,nancy,2,step by step u get older and more mature for yourself and you start to be come a parent and then your kids start a new life again,132,3.407705783843994,3.209421873092652,3.288053512573242
62186,Cows,nand,2,cool only eats grass walks on four legs strong,50,2.876595973968506,2.9593334197998047,3.1676716804504395
16639,BRUSSEL SPOUT 2D,nandan,2,"brussel sprouts are so slimy,  they make my mouth feel all glimy.   brussel sprouts are so hairy,  i am not going to eat but i will bury it. ",140,2.51485538482666,3.3990612030029297,3.1000964641571045
90599,Summer   Fun,naquan,2,summer tastes like hotness.  summer sounds like people cutting grass.  summer looks like the sun.  summer smells like hot pizza.  summer feels like fresh  air. ,158,3.804175853729248,3.502646923065185,3.263255834579468
90607,The Summer,nashay,2,summer tastes like blue gum.  summer sounds like wind chimes.   summer looks like flowers.  summer  smells like cotten candy.   summer feels like puddles. ,153,3.4926137924194336,3.281790256500244,3.178576231002808
88437,The Blue Bag,nashay,2,"a blue bag in the sky it looks like a rubber frog. it turns me  slowly. blue is a good color. but, if you are not fair, you are selfish. ",134,2.760972499847412,3.13681697845459,3.158265352249145
117794,The best thing ever,nasia,2,i have a pan with a can the can  kissed a clan  the   clan made a nann   the nann made a plan the plan made a san the san made a lan  lan said dan dan said man fan said clan. ,177,3.123305320739746,3.045916795730591,3.2475621700286865
97482,Hawaii,nasirah,2,hawaii  i love hawaii.   if   you do that would be great.   hawaii nice sweet. ,80,4.212858200073242,3.5213942527771,3.2536962032318115
97230,My Neighborhood,nasirah,2,i see a bird flying out my window and a big tree with green leaves looking at me.   i smell my mom cooking sloppy joe's in the kitchen.   i hear all my friends playing hop scotch.   i touch my hands and my feet.    i taste hot dogs and cake and cup cakes. ,254,3.594523429870605,3.403004646301269,3.245518445968628
83021,My cat eats spegetti,nat,2,"my cat has an embicious appitite for mittens,  letters,  and spgetti,  somtimes even fun fetti.  when he eats regular food for cats we throw confetti,  but then he chews on my doll letie.  so one day i made him a suprise regular cat food one rye.  but he did not eat it that made me sigh.  so thats why you never get a cat from a migition. ",334,2.888768196105957,3.203166484832764,3.1647284030914307
43588,Marshmallows,nataile,2,oh   marshmallows  marshmallows  i  love  marshmallows  there  here        there there  oh    marshmallows.            there on  the   bookshelf  there  in   the   stairs. oh   marshmallows  marshmallows  i  see   marshmallows    everywere. ,241,3.846841335296631,3.487003326416016,3.2968146800994877
65244,Who  has  my  name?,natalia,2,some people  have  my name.    its like a scary  game.    its  fun  to  have the same name because  its just   a      freeky     thing  !,138,3.7346348762512207,3.6278042793273926,3.330470561981201
86857,The  Bear  And  The  Bee,natalia,2,once there was a bear and a bee and there was a honey cone and they both wanted it and the bear and then the bee stung the bear and they augreed to share the honey cone.    the end,182,2.9293007850646973,3.1249899864196777,3.162871122360229
88892,Danielle,natalie,2,"danielle eight, tall smart, cool, nice student, daughter, friend, kid sweet, funny, pretty cool, friendly girl. ",105,3.859839677810669,3.335636615753174,3.2824928760528564
88910,Funny fish,natalie,2,i saw a fish&lt;br&gt;who married a dish. ,44,3.289818525314331,3.088324785232544,3.229483366012573
88883,Summer,natalie,2,school is done so lets have some fun.  dont be a fool come to my pool. ,72,3.4354522228240967,3.3562307357788086,3.4285728931427
29194,Dogs,natalie,2,roses are red violets are blue i like dogs and you do too!,61,3.685110569000244,3.5311708450317383,3.3149430751800537
80254,American  Flag,natalie,2,american  flag  fly  like  a  bird.  dreaming  in  my  classroom. dreaming. ,76,3.134713649749756,3.1353554725646973,3.1036109924316406
20071,Dolphins,natalie,2,"playful dolphins out at sea,  in one pod,  with dolphins three.  playing, jumping,  oh! so high,  almost touching the bright blue sky.  gliding through the shallow tide,  making room for rays to slide.  eating tiny tasty krill,  watch out for a pelican bill.  swiminng through the turquoise sea,  looking out for you and me!",315,3.69838285446167,3.59548568725586,3.278566598892212
45993,Playing in the Park,natalie,2,swinging on swings climbing monkey bars sliding down slide crawling through tunnels sitting on benches running races getting wet under sprinklers twirling around poles playing tag hitting balls jumping rope riding bikes shooting hoops throwing footballs walking the track magic shows clowns dancing children laughing,319,3.6418936252594,3.4209556579589844,3.207041025161743
90546,The Sun,natalie,2,the sun is very bright and hot.  the sun is yellow and sparkley i love sparkles. ,82,4.198846817016602,3.7120862007141113,3.3362205028533936
52923,I Love to Hear My Clock,natalie,2,it moves its hands and i watch the sands every morning and every night with my eyes so bright tic toc tic toc i love to hear my clock,136,3.824188947677612,3.597308397293091,3.292109966278076
51305,poems,natalya,2,rose are red swger is sweet in so are you,44,3.7878165245056152,3.3715648651123047,3.3128550052642822
34345,Spring,natania,2,"flowers bloom in the sun.  the grass is  green.     the bees sting me.   the caterpillars grow  like pretty butterflies.  spring is here,  so go outside.  the grass is green. ",173,3.695960998535156,3.352200746536255,3.2693772315979004
39992,Friend,natasha,2,friends are fun.  reading with friends is fun.  i like to have friends.  even if you have  none it is ok.   do you have friends?,127,3.802877426147461,3.382176637649536,3.3217360973358154
97959,the  flag,nate,2,the flag is flat it has a flap and it also has a hat. and it has a nap. ,73,3.087094783782959,2.888408660888672,3.1732919216156006
80699,Torndos,nate,2,torndos spinning on the ground. an old grandma spinning in the air round and round. ,85,3.053775787353516,3.1057488918304443,3.1062018871307373
75553,If Pigs Could Fly,nathan,2,if pigs couid fly.  they would say ''hi'' down by you.  they wouid swoop down and get food. ,92,3.20205307006836,3.101094961166382,3.208972692489624
98482,The bear and the chair,nathan,2,there once was a bear that had a chair.  he had a stroke when the chair broke.  that made me choke!,100,2.32490873336792,3.510279655456543,2.989212274551392
88884,Macy,nathan,2,macy likes to eat big juicy treats.  if macy eats a stick she gets really sick. ,81,3.3724782466888428,3.382586479187012,3.246479749679565
51851,school,nathan,2,school is here school is there school is everywhere,54,3.248258113861084,3.070197582244873,3.2257800102233887
39462,Snowboarding,nathan,2,"snowboarding,  snowboarding,  i like snowboarding! snowboarding is fun,  it is sooooo fun! great!  let's do that again! fun,  fun,  fun!  wow! let me do that off the ramp. . .  back flip,  crash! that was awesome!",207,4.434101104736328,4.063862323760986,3.48023533821106
109855,I am a Flower,nathan,2,i am a flower.  my name is called a tulip.  i live in a flower shop i live in a refrigerator.  i have five leafs.  what is your favorite flower?,144,3.376971244812012,3.136949062347412,3.2219953536987305
90543,Rock,nathaniel,2,rocks the entire party. of all people most of them do rock. can rock the entire world.  knock on thier door and be in thier band!,129,3.548704147338867,3.690098762512207,3.466717481613159
80471,Rabbits,natnat,2,"rabbits here, rabbits there. rabbits,  rabbits  everywhere. one on my head,  one on my leg, one      on my lip now its doing a flip.  fifty on the roof , fifty on the floor. rabbits galore. and thats why you should never live on a rabbit farm!",236,2.8560233116149902,3.433724880218506,3.254350423812866
17667,Noah,neil,2,"noah,  noah built a shark",27,2.8334383964538574,3.114905834197998,3.174474000930786
85296,Who I Am,neilan,2,nice enjoy  playing i am nice to my mom and dad listens to music apples are my favorite never gives up,105,4.0163893699646,3.419761180877685,3.3368799686431885
83754,I Got Flushed Down the Toilet,neo,2,"on monday i went to the toilet.  i pulled the handle before i got off.  then,  i got flushed down the toilet!  i went spinning and spinning,  i got very dizzy! on my way down the toilet,  i saw dirty water and brown stuff,   i remembered the toilet was white.  when i came out i stinked!",283,2.481738567352295,3.74943208694458,2.991727590560913
117867,School sounds,nevaeh,2,"when all the doors shut,  they thumped! at recess,  the workers bumped and thumped!  at recess,  i heard screaming.  i heard basketballs  bouncing.  when we had lunch,  there was a lot of talking.  i heard shoes klopping on the apparatus.    i heard a bump,  why that  bump made me jump!   i heard. . . talking and talking everywhere!  i can hear myself talking outside.    i can hear other people talking to me.    i heard yelling   i heard my friends talking to me   at lunch, i heard a crunch!   at lunch,  i also heard feet klopping. ",526,2.818456649780273,3.721308708190918,3.0578622817993164
83040,Untitled,newell,2,"i like to run ,  run , run. then i jog,  far  far , far. then i run ,  run ,  run ,  run  all the way back. ",101,3.1355433464050293,3.22217869758606,3.191241502761841
43960,The bird,ngoc,2,"the bird is flying in the sky,  it made me looked very shy.  it made me look shy i think i would fly,  i would like to be alone.  i would like to be on my own,  but now i would like to say.  the green grass could be gray, ",218,2.649204969406128,3.154037952423096,2.845367193222046
100166,My     sister,nia,2,my  sister  can   read.   she  reads   downlow  she  reads  uphigh. my   sister  can   read  and  she  loves  peas  with   ts  and  she  love   bugs   that  eat  peas. ,168,3.5582942962646484,3.241490364074707,3.273368120193481
100167,Dog   bug,nia,2,what  is  in   the  cup.   it   looks  a  lot  like   a  dog. but  it  is  not.   it  can  wag  like   a   dog. 2  dog   bugs  can  zip  and  dip  with  a  wip   and   a   pip   and   a   sip   with   a  cip. ,207,3.0528759956359863,2.995846748352051,3.179173231124878
46294,MY HORSE,nia,2,i wish i owned a horse.  i would ride him everday.  i would brush his beautiful brown coat and feed him lots of hay.   we would have so much fun together and we would go to all the horse shows.  i would put ribbons on his tail and i would wear my riding clothes.   i would name him prince and he would be my best friend.  no matter how old i get my love for him would never end. ,375,3.690228939056397,3.5696096420288086,3.3508095741271973
110362,Mom,nia,2,"she is special,  so she is the one she is the one that i  always count.  i love that i'll always know, she is the best she's very smart she knows spanish. ",154,4.108624458312988,3.684253215789795,3.337425947189331
94618,The wombles,niamh,2,"come and visit the wombles it's a great place to be.  come and visit the wombles and maybe have a cup of tea.   the wombles are so sweet they might even offer you a treat.   the wombles welecome me and you come in,  sit down and have a biscuit too.   the wombles are as sweet as pie and when you leave they'll say goodbye. ",320,3.793750762939453,3.388442039489746,3.326667547225952
110964,Minecraft,nicholas,2,i looked up i looked down i looked around    and around because i herd a sound. it sounded like a creeper but i think it is a peeper. ,135,2.86792516708374,3.274456739425659,3.0196993350982666
88249,Jupiter,nicholas,2,jupiter i like you.  you are a cool planet.  jupiter i like you.  red spot looks cool on you.  jupiter i like you.  you have a lot of nice orange on you.  jupiter i like you.  it is cool how you float in space.  jupiter i like you.    your poison gas is very cool.  jupiter i like you.  jupiter where lava is very cool.  jupiter i like you. ,331,4.014256954193115,3.442983627319336,3.267531633377075
112465,Games and Fames,nicholas,2,i just love games just like famers.   iâ’m a hall of famer at playing with gamers.  hall of famers are in games.   iâ’m awesome like a possum! iâ’m not lame at games.   awesome possums like games with fames. ,207,3.9659841060638423,3.672950744628906,3.395947933197021
38689,My Wolf,nicholas,2,"my wolf can play with a ball,  my wolf can catch a bee,  my wolf enjoys a glass of milk,  my wolf takes a bath with me. ",119,3.6765761375427246,3.3547611236572266,3.326689958572388
32275,Ice,nicholas,2,"antarctica hasice,   that are shaped like mice,  and some ice is rice. ",71,2.956372737884521,2.9223392009735107,3.1453888416290283
115344,This Was Crazy,nicholas,2,i saw a robot it felt like i hit the jackpot i saw a man he had a fan he was hairy with a fairy oh quite contrary,118,3.2109029293060303,3.481725215911865,3.176708221435547
115292,Ticks,nicholas,2,flick that tick you almost got bit i hit that nasty tick the tick got bit by another tick,92,2.521315336227417,3.3267159461975098,3.1257894039154053
115254,My amazing mom,nicholas,2,mom is that tom i looked upon it was not gone it was really a waste of time maybe i should write about a lime the lime went gone the lime was green but i have seen a yellow sheep that i will keep,198,2.963216781616211,3.098447322845459,3.158566236495972
114204,My Best Friend,nicholas,2,jolly and happy active at gym creative at art kind,53,3.784557342529297,3.2520899772644043,3.295139074325561
114732,Baseballs,nicholas,2,baseball is really fun ash thatâ’s a flying ball swish thatâ’s another error strike one boom that ball is out of here ah itâ’s coming at me loop it did a loop look the ball fell on me,187,3.3670971393585205,3.581137657165528,3.234695672988892
102746,Hamburger,nicholas,2,"hamburger,  hamburger makes me hungry hamburger,  hamburger nice and meaty hamburger,  hamburger big and small hamburger,  hamburger i ate them all. ",148,3.746241331100464,3.545074701309204,3.3746349811553955
90909,Sound,nick,2,sound sound you help me hear.  sound sound your sound waves are cool.  sound sound you help me talk .  sound sound you help me hear.  sound sound you help me  listen.  sound sound your waves are cool.  the end. ,207,3.5173263549804688,3.2424817085266118,3.231069803237915
108268,Dinosaurs,nick,2,hungry dino the t-rex is eating leaves it ate the whole tree!,64,2.473803997039795,3.466137409210205,3.122565507888794
96121,Armour,nico,2,"red armour, blue arnour,  green armour, brown armour, silver armour,  and black armour. ",85,3.133613348007202,2.91693115234375,3.1612393856048584
100598,I am a spesial boy in the family,nicodemus,2,the speal boy who love and care for his sibilings who listens and work hard on his home work and make his self and stand strong and pround who thinks the feuter holds a lot. ,176,3.356030941009521,3.1680827140808105,3.2697641849517822
58170,My haiku poem,nicole,2,a slow moving thing with a hard thing on it's back it's a turtle of course,78,2.885209560394287,2.990107297897339,3.0674617290496826
44696,Bananas,nicole,2,every day i eat bananas i eat them in my pijamas sometimes i eat them in the mornings sometime i eat them when its storming,126,3.136199474334717,3.1518454551696777,3.248357057571411
46271,Bananas,nicole,2,every day i eat bananas i eat them in my piaamas sometimes i eat them in the morning sometimes i eat them when its storming i eat them almost every afternoon and i eat them with a spoon every evening right at six i eat bananas stacked on bricks. ,248,3.2661666870117188,3.2570109367370605,3.2929937839508057
33187,Caterpilliar,nicole,2,"caterpillar               nice, colorful              living,  crawling,  chewing               making a cocoon               butterfly",141,3.5462961196899414,3.15795373916626,3.2252297401428223
100727,Hav fun,nicole,2,i like to play in winter. i like to play in fall. the thing i like the best is to plasy in fall. i hav alot of fun so play nice. ,128,4.03573751449585,3.5517210960388184,3.3602449893951416
39457,Feelings,nicole,2,hurt feelings funny feelings sad feelings cool feelings feelings are important.  i use them when i need them.  crying is a feeling i use a lot.  playing video games makes me happy.  cleaning makes me mad sometimes.  we all have feelings. ,235,3.3548734188079834,3.294586420059204,3.2541751861572266
32070,Dogs,nicole,2,dogs   dogs kisse dogs play  dogs run i love dogs. ,53,3.8467748165130615,3.441737413406372,3.3432891368865967
53474,Haiku: Summer,nicole,2,the flowers smell good.  bees come out and drink honey.  the fields have flowers. ,82,3.897192478179932,3.432635307312012,3.3182711601257324
91478,The Day,nicole,2,i am excited to bring my turtle into class  unfortunately he likes to eat black bass and black bass makes me pass out so. . .  instead i'll bring some earthworms- a turtle's favorite treat there's something i have to admit my turtle loves to smell my feet,255,3.814815044403076,3.5818495750427246,3.3985037803649902
29998,My Hamster,nicole,2,"my hamster snowflake is very loud.  i am very proud of him.  he is white on the belly and brown on the top,  sometimes us kids accidentally drop him and he goes plop. ",166,3.792981386184693,3.515937328338623,3.3391034603118896
57796,My Dog is a Hog,nigel,2,my dog is a hog! he is an awful dog! his name is mark-not bark!,66,2.18979549407959,3.863349914550781,3.3272879123687744
66019,DEN,nik,2,"when i awoke one morning,  a stork was on my head.   i asked,  â“what are you doing there?â” it looked at me and said. .   ''i want to be your friend den. ",155,3.1813783645629883,3.385301113128662,3.210061550140381
20257,Sweet thoughts to a happy smile,nikita,2,"every day i think of sweet thoughts which make me think of my past memories,  then i think of all those happy smiles i've showed to everyone,  and then i think of how many smiles people have shown me,  i also think about how many smiles i will be showing other people and myself,  and last but not least i think of how other people will show me their smiles. ",357,3.970987319946289,3.6285400390625,3.329878568649292
112487,A Cat on my Head,nikkole,2,"when i awoke one morning,   a cat was purring on my head.   i asked,  â“what are you doing there?â” it looked at me and said,   â“iâ’m taking a deep sleep, â” and then i said,   â“why are you on my head?â”  â“fine iâ’ll go on another head, â” the cat said.  so the cat went to her motherâ’s head  and had his deep sleep.   then,  the mother said,   â“get off my head you go to bed. â” the cat did not like his bed.  so he went to the fatherâ’s head.  the father said,   â“fat cat go sit on that mat. â” so the fat cat sat on the mat  and had a deep sleep  and ate a fat rat. ",562,2.789944887161255,3.228362560272217,3.082598924636841
52825,The Candy shop!,nil,2,"i love candies! i can't live without them! please take me to the candy shop.  i need candies! i will do any thing,  but please take me to the candy shop!!! chill,  dude we just went there.  oh,  sorry. ",199,3.6805074214935294,3.79025936126709,3.361225128173828
78081,Bears Bears,nina,2,bears bears they cklimb every where they are black they are white they are brown they have cubs they hunt for food they kill for food. ,137,2.6756534576416016,3.1241416931152344,3.1164662837982178
103933,Softball Rules!,nina,2,"softball is fun,  though i don't like to run.  i have all the equipment,  though i do not like to hit it.  that ball is not fun.  i told you,  i don't like to run!!! get me my softball,  i won't care! get me my softball,  i really won't be there!",241,2.4798154830932617,3.5720229148864746,3.266402006149292
81474,Mud,nina,2,mud is gross and brown.  mud makes me frown.  i put my feet in it. ,69,2.2775444984436035,3.271899938583374,3.062285661697388
109866,Lipstick,nina,2,"i am lip gloss.  i go on girls.  lips thatâ’s why my name is lipstick.  boys do not like me but girls love me.  as a matter of fact,  i am wearing some right now when you run out of me just go to the store too buy some more but do not show your dad that might throw it out good luck next time i might smell good. ",310,3.385985374450684,3.3851778507232666,3.384407758712769
93575,A duck in a plane,nishan,2,the plane flies like a duck.  the duck flies like a plane.  they both have a short race.  they have to go from the farm to a park.  the plane is shaped like a duck.  and the duck is shaped like a plane.  then the duck goes in a plane. ,231,3.0852293968200684,3.0784239768981934,3.147129774093628
44095,Hats Hats Everywhere,noah,2,"hats,  hats everywhere hats on cats,  hats on mats.  big hats small hats,  even tall and short hats.  happy hats,  sad hats,  funny hats,  light hats,  dark hats,  and day and night  hats.  too much hats,  i'm going to blast!",216,3.649892807006836,3.735327959060669,3.419931650161743
62488,Soccer,noah,2,"i like soccer the most,  im in camp on here on post.   i started about a year ago,  i've liked it from the beginning,  and im going to keep learning.  dave has been teaching me,   as well as lee.  both great coaches,   that like teaching me!",236,3.8358449935913086,3.5483028888702397,3.402627944946289
75394,THE  DOG,noah,2,my dog had a cool collar and then we had to throw it out but we had to buy a new one i can play ball with my dog. ,117,3.2971341609954834,3.301661491394043,3.26595139503479
88915,Pets,noah,2,"maltese  small,  cute barking,  chasing,  running pet,  house,  water,  stores jumping,  playing,  sleeping nice,  mean dog. ",122,3.592304229736328,3.357675552368164,3.2672197818756104
56976,Noah,noah,2,noah is  octopus lover athletic hugs alot,44,3.714150905609131,3.396596908569336,3.278632879257202
106124,Food,noah,2,"almost every after noon, i eat marshmallows on balloons.  every mornin' at 2:00,  i have nice stew with mornin' dew. ",116,3.4992804527282715,3.1754558086395264,3.3022375106811523
114680,My arms,noah,2,my arms. . .  help me shot a basketball  throw a baseball help me lift weights help me do push-ups help me shot a bow and arrow my arms are so ultimate,151,3.723356246948242,3.578442096710205,3.3500545024871826
83032,owls,nolan,2,owls love to hunt mice  well they see at night losers owls are not silintly they fly,87,2.873154163360596,3.0529496669769287,3.146891593933105
40003,Mr.Monkey,nolan,2,mr.  monkey is very chunky  and that's why he's junky.  mr.  monkey why are you so junky mr.  chunkey.  i now why you are very clunky and junky mr.  monkey.  mr.  monkey you are tunky and slunky that's why your junky mr.  monkey. ,224,2.819392204284668,3.0454022884368896,3.1500320434570312
59769,Biting Fruit Bat,nolan,2,biting black fruit bat flying all over his cav so he can find food. ,70,2.678748607635498,3.2532310485839844,3.032658338546753
