id,title,author,grade,text,char,valence,arousal,dominance
72138,Coffee and toffee,kevin,6,i was drinking coffee while eating toffee,44,3.16065001487732,2.964446783065796,3.2073464393615723
72093,Dragons,kevin,6,dragons scales flashing tails smashing dangerous,51,2.562439203262329,3.4141385555267334,3.1064939498901367
32726,Tony,kevin,6,there once was a kid named tony  he was a big foniy he ate kid and scared a pig now he smells like bolony,108,2.5114541053771973,3.199817419052124,3.07502818107605
33734,BASEBALL,kevin,6,baseball hit into the outfeild as i run to go get it sandy alomar  is the catcher enflunced by my team  barry bonds hit a ball and the i hit one then laughed and said you  launched that ball out of hear,206,3.444093704223633,3.4886999130249023,3.301664113998413
69593,The Cheetah,kevin,6,the cheetah is very fast it has very sharp teeth and gets very very big. ,75,2.8947629928588867,3.212428092956543,3.1141040325164795
46810,The car and the bird.,kevin,6,i was walking and a car went past it turned out to be really fast a bird came soaring  as the car came roaring which one would win at last. ,143,3.304903984069824,3.471017360687256,3.168959140777588
32715,The Teacher,kevin,6,there once was a teacher named mr. kee he got stung by a bumble bee he yell ouch and sat on a couch that teacher thought it was me,132,2.3943395614624023,3.2582364082336426,2.96711802482605
81309,The Circe ofLife,kevin &amp; roger,6,the circle of life we all get a slice  life makes you smile even when your in denile,87,3.870738029479981,3.4546921253204346,3.35650372505188
30798,FUNNY  MONEY,kevin+derek,6,you have goerge washington and all those other guys but what you do have is bright blue sky  andrew jackson what a man  that 20 dollar in his hand his jokes were as lames a can  abe what a smart man  died by a gun  in someone's hand,235,3.088341236114502,3.4530060291290283,3.276888370513916
20143,The Baseball Game,kevon,6,"the team takes the field all ready to play the ump yells ''play ball'',  the batter comes up  the first pitch's a strike,  on this sunny day he was hit,  good thing he was wearn' a cup  the runner is trying to steal the base the catcher throws to the base,  and he's out the player walks off after the wild chase ''you are out'',  the ump yelled with a shout  the next batter hits a single to right the next pitch is hit hard into the stands the fans are having a fight for the ball the crowd is cheering before the ball lands  the end of the game is very exciting  after the game the fireworks were lighting",608,3.326395034790039,3.554666519165039,3.312556505203247
119145,Family,keyara,6,"i love my family, they are the best family when you ask for something they are nice about it,  my family is very nice and caring, when you need help they will help you  but the thought of them is always in a special way, there always be a special place for them in my heart. ",273,4.09342098236084,3.5939149856567383,3.3159000873565674
106831,Tiger,keyla,6,"i have a tiger,  my tiger can sometimes be a liar. my tiger is very sweet and likes to eat meat,  but my tiger is a slob and tries to open the knob. i love him very much and his touch. ",186,3.5988283157348637,3.472153186798096,3.267615795135498
86954,Name Acrostic,keylee,6,kind easter yellow loves dogs eats pizza ehhhhhh,51,4.111288070678711,3.629300594329834,3.365234613418579
102932,Pitbulls,keynaja,6,-pitbulls are mean dogs.  -they were used for bull baiting.  -pitbulls were sent to the u. s.  -they became known as stafforshire bull terrier. ,142,2.656579971313477,3.1063108444213867,3.1345415115356445
44594,Just You And Me,keyonna,6,"when i look at you, i see a girl who looks exactly like me. do you see how i am the only one who doesn't flee.  that's because it's just you and me. ",157,3.0636301040649414,3.272359132766724,3.186673402786255
114251,How I See the World,keziah,6,"i do not see rivers of blood,   but not of crystal either.  i see darkness and tears,  screams trapped in silent,  lifeless eyes.  this is a world of hunger,  plague and war,  something we have brought upon ourselves.   but somewhere,  someplace,  the trees are green,  the rivers blue, the tears not of mourning but of joy.  here is a place of happiness,   a place where you never truly die.  so here i still see tears,  darkness and screams,  but i also see smiles,  sunshine and laughs.  yin and yang,  good and bad,  this is how i see the world. ",531,3.316441535949707,3.420124292373657,3.1661880016326904
102965,Baseball,khalid,6,i love baseball no matter when i slip and fall!!!i get right back up and hit the ball. i go swimming to cool off because i think  i am a baseball star!!!!!!,158,3.942970752716065,3.9756288528442383,3.508298873901367
102977,Baseball,khalid,6,"i love baseball even when i slip and fall, i get right up and hit the ball. i go swimming     to cool off because  i think i am a super star!!!",147,3.947551965713501,3.862710952758789,3.443864345550537
90463,Mommy,khatarrie,6,"i get hurt and the first thing i want is my mommy.  i get sick and the first thing i call for is my mommy.  think about it,  mommy is a common name that why i pray for mine everyday. ",182,2.345780372619629,3.472566604614258,2.964576005935669
22225,"Pens,Pens",kheldon,6,"pens,  pens are great pens,  pens relate pens,  pens are small and handy but,  they aren't candy you can take them anywhere,  anytime any fare,  so take a dare  have some care. ",173,3.0659332275390625,3.1258115768432617,3.3175861835479736
22385,Winter,kheldon,6,"on the window panes the icy frost leaves feathered patterns crissed and crossed but in our house the christmas tree is decorated festivly christmas songs familiar,  slow play softly on the radio.  pops and hisses from the fire,  whistle with the bells and choir; my dog is now fast asleep on his back and dreaming deep.  when the fire makes him hot he turns to warm whatever's not.  propped against him on the rug,  i give my friend a gentle hug.  tommorrow's what i'm waiting for; but i can wait a little more. ",507,3.4584057331085205,3.348494052886963,3.202639579772949
22480,Time,kheldon,6,"this thing all things devours.  birds,  beasts,  trees,  and flowers.  gnaws iron,  bites steel.  and grinds hard stones to meal.  slays king , ruins town and beats high mountain down. ",178,2.478898525238037,3.308117389678955,3.1041195392608643
24546,Polotik,kheldon,6,"look at earth from outer space.  everyone must find a place.  give me time and give space.  give me real don't give me fake.  give me strength reserve control.  give me heart and give me soul.  give me time and a first kiss.  tell me your a polotik.      open up your eyes,  give me one cause one is best.  you confuse your confidence.  give me piece of mind and trust.  don't forget the rest of us.  give me strength reserve control.  give me heart and give me soul.  wounds the heel and cracks the fist.  tell me your a polotik.      just open up your eyes,  give me love over this. ",571,3.4236702919006348,3.4484241008758545,3.3554983139038086
111936,Oh dear rain,khooshi,6,"oh dear rain,  i tried running , but in vain so much water on the roads  traffic jams in long chains made me miss the train i tried running, but in vain  clouds grey as pigeons white as crane came rushing together like insane  peacocks and farmers danced and rejoiced while the city people frowned as it was a bane  children playing in wet mane tea vendor thanking god for the sudden gain i tried running,  but in vain",417,2.8548989295959477,3.336651563644409,2.9773027896881104
113013,What a Day,khushi,6,i woke on a pile of hay remembering yesterday  i said another day   i went to school and walked to class  but i forgot which was the way i finally reached class late and my teacher said another day    i came home and sat on the bay looking at the suns last ray then i said tomorrow another day,296,2.6617584228515625,3.085767269134521,2.964196920394897
77918,I&apos;m m an animal,ki ki,6,"one day my mom said i was a bear,  then my brother said i look like a hare.   my sister said i was a cat,  then she said i was a cat with a baseball bat.   but then i relized i was a wolf walking in the woods with a water bottle. ",228,2.9046902656555176,3.217293739318848,3.0648887157440186
40344,Within,kia,6,"i dream of a hate free america one where blacks will be treated equally.  i ask one white friend ''why not look within instead of my skin. '' inside this dark tinted skin lies a soft,  gentle,  loving black girl.  i know what you are like within because i do not look at the skin,  but within. ",290,3.543915271759033,3.4278876781463623,3.2907791137695312
51558,Suffering &amp; War,kia,6,"suffering people everywhere                                              u look   fighting   fear,  fear in their    eyes   riding  in and out   night and day   gold you shall get when you come back? no! a medal,  that years to come everyone will remember your name.    war is never ever    a peaceful place   rain will even bring back those memories of the survivores   and none of it is a good memory",402,2.406177520751953,3.408738613128662,2.927043437957764
51750,Tiny Toat,kiah,6,"i am a tiny toat.  i am always clean on the spot. i always clean here and there, even my room is square. i even clean my neighbors air here and there. i am a tiny toat. i 'm always clean on the spot.      the  end",209,3.423592329025269,3.1429262161254883,3.3369791507720947
38323,TURTLEOPARD,kiana,6,a turtleopard goes so fast it likes to drink from a glass.  we don't know if it comes from the past but we know it goes so fast.  it loves to hear jazz and it goes to a dancing class it loves to eat green grass. ,212,3.338941097259521,3.214607954025269,3.167541980743408
120326,My Pet Trixie,kiana,6,"every day i go to feed the pet,   but when i go,  what do i see?  a rabbit named trixie comes running to meet me.   when i come and see her,  she runs around,  feeling fully free.   she loves when i rub her all over,  that is something i will never forget.   we have four trees in our yard,  her favorite is the plum tree!  but when the poor rabbit died,  we all were very upset. ",373,3.649007558822632,3.579733371734619,3.293951749801636
120329,Our Apple Tree,kiana,6,"what does an apple tree look like? the apple tree and the plum tree are totally not alike!  our apple tree did not do well last year,  but that was ok,  we did not fear.   our apple tree usually hangs with fruit,  even though it didnâ’t bear any fruit,  we still had a hoot.   now what does our apple tree look like in the fall?  it looks like a tree without leaves standing tall.    the end",388,3.155503273010254,3.234993934631348,3.196305751800537
28922,Grandma,kiana,6,"i like my grandma,  she spoils me rotten she gives me treats,  and some times money but that's a secret.  i like my grandma sweet grandma. ",139,3.902768135070801,3.417736530303955,3.2944366931915283
66023,Ice Cream,kiana,6,i like ice cream my favorite is chocolate  ice cream is a good snack but my cousin doesn't like it so he smashed some in my back,131,3.111622810363769,3.2307217121124268,3.2327687740325928
57840,I love you,kiara,6,do you understand that i love you the first day i seen you i thought that i seen you from another place like heaven i loved the way you blink i love the way you talk i love the way you eat. i really really really love you very  much. i love you,245,4.5626325607299805,3.914821147918701,3.391148805618286
29777,My Cat,kiara,6,"my cat is soft and furry,  he sometimes makes me worry.  he jumps off chairs,  leaps in the air.  he has gray fur,  everything's a furry  blur.  he eats and sleeps all day long,  he pounces when we play ping-pong.  my cat is soft and furry. ",235,3.5293936729431152,3.3852007389068604,3.223381757736206
84413,IT`S SO HARD TO SAY GOODBYE,kiara,6,i wish i could see you everyday but you stay so far away everytime i think of you it makes me wanna cry because everytime i see you it seems like it`s so hard to say goodbye  seeing you brigtens up my day like a cherry on top of an ice cream cake your kisses are filled with tears cause i know that you want always be hear it`s like our love is based on so many lies because it`s so hard to say goodbye,405,3.0023181438446045,3.573896884918213,3.0474300384521484
42383,IT&apos;S HIM,kiara,6,it's him that guides me through the night it's him thats with me when i'm fright it's him that's dealt with me all these years but he have ears where he can here my cry when i'm lonely at night when something gives me a fright it's him that heres me through the night i love him so for keeping me oh so close,311,3.532695770263672,3.518417835235596,3.2515223026275635
103729,Family and Friends,kiara,6,"my family, and friends are the best.   we stick up for eachother, and i  love my brother.                                                                                   love my father and my mother.                                            my freinds will stay besties till the end.  they are really good true friends. never forget them even if a new life begins. ",365,3.910390853881836,3.464465618133545,3.294334650039673
38106,Bunnymph,kiara,6,it goes hippity hoppity all day long and is known as the bunnymph.  it sings a song for it is long in beauty but short in size.  it does not love to play outside. ,163,2.9738502502441406,3.013449192047119,3.10541033744812
17719,My Mother....,kiara,6,"my mother is very sweet she gives me a lot of treats,  when i fell down,  she fixed my frown,  and now you see she is neat. ",123,3.835603713989258,3.447392463684082,3.3127119541168213
108625,Washing Machine,kiarah,6,"i'm a washing machine that makes your clothes clean.  so that nobody has to rub: glubita glubita glubita glubita swizzle-dee-wash swizzle-dee-wash  i talk to myself while i do the wash baba-da -swaba i change my song as the cicle moves along soapsuds gurale though my hose then. . . .  blub- blub- a-dubba i rinse the clothes.  blippet-blop-blippety-blop i spin, spin, spin and then. . . . . . i stop. ",390,3.272967338562012,3.1817026138305664,3.27972412109375
43478,Chips,kiera,6,i love to eat chips at night just before i have a big fight.  i love to eat chips on bricks right before i get a thousand licks.  i love chips in the dark and on goey slimy bark.  chips are great in dip i spilt  some on my lip.  chips are great especially on cake.  have you ever tried chips with rake? or have you ever had chips on a lake well you really should.  chips! chips! chips! chips!,389,3.739919424057007,3.654347896575928,3.3931820392608643
20336,Lawn,kiernan,6,"i'm sitting on the lawn today- the one i know so well.  with birds and bees up in the trees where little creatures dwell.   as the sun shines on my face a warmth of golden love,  i feel the breeze of flowing ease fall down from high above.   i lie down on the rain-fresh grass and watch an ant go by.  i change my mood and soon i'm glued to white clouds in the sky.   familiar things move into view a bird,  a swing,  a squirrel.  so soon i know that long ago  i found i loved the world. ",481,3.790407657623291,3.51882553100586,3.271267890930176
17706,A Cardinal,kiersten,6,"a lovely red cardinal came flying across my head.  he huffed and puffed,  no wait maybe it was a wolfnal. ",106,3.507505416870117,3.478154420852661,3.1877870559692383
33451,I pleage thee,kiki,6,i cast my mind   to the wind i open my heart    to the sun i thorw my soul    to the storms i cast my to    god,114,3.180337190628052,3.35224723815918,3.180462598800659
59363,So Far Away,kiley,6,"ever since my dad went away,  i would always get on my knees and pray,  that someday,  somehow my parents would get back together,  and everything would get all better.   then my stepdad came along,  and i loved him very so,  but my feelings were to low to even grow.   i thought i had lost my dad,  which made me very sad and mad,  i always thought to myself my life is so bad,  why can't i run away and cry because i dont have what i had.   then when i was about six,  i started to see my dad again,  i really thought we should become better friends and live like that until the end. ",574,2.569311141967773,3.4008283615112305,2.9233877658843994
109692,Horses,kim,6,"to me a horse is your best  friend,  your  secret keeper.  a horse is always loyal and friendly to you.  and even if they seem not to  understand,  they do.  i love horses and i  hope you do to. ",192,3.756439208984375,3.443397045135498,3.342423439025879
101848,The fat man,kim,6,"once there was a fat man,   he sits on a pan,  he like having a tan,  and he can't say can. ",91,3.355222225189209,3.2136054039001465,3.2393126487731934
17932,Life&apos;s little mystery,kim,6,"you step inside and strech out my skin,  you bend my laces up, down, and sideways,  you don't know it hurts because you probably haven't been stepped on,  i can be old or new,  maybe even shiny or blue,  i might have laces or maybe velcro,   you might see crazy ones too.                what am i?  answer: shoes",307,3.217692852020264,3.402963876724243,3.23750901222229
30311,Night,kim,6,"the night sky is a paint-spattered easil-- a never ending,  mysterious blackness. ",83,2.727604389190674,3.0631282329559326,2.916114568710327
24238,My life,kim,6,my name is kim i love to swim i work hard in school my reward is so cool i have a sister she gives me a blister i have a brother he bothers my mother my father works late he comes home and bakes my mom cleans the house while we chase the mouse my dogs are real wild they act like a child my room is a mess it is the best my house is a charm it keeps us real warm my backyard is real big the bigger it is the better!,421,3.91523814201355,3.6949968338012695,3.3645966053009038
29340,People,kim,6,"life is a careless thing to miss  with if too try to do it posed it  will back this be ready full in  case you have a ready danger when  you grow just think before you do think,  think and  it  by yourself  you are care  not nobody but you  just think carefully okay?",269,2.755845546722412,3.1581616401672363,3.2018768787384038
48817,Kim,kim,6,"kim artsy,  fun,  crazy,  likeable sibilings of samuel lover of cows,  horses,  and friendship who feels misunderstood,  liked,  and cared for who needs caring friends,  to be treated with respect,  and to be loved who gives comfort,  love,  and help who fears terrorists,  bombs,  and being left out who would like to see world peace,  no fighting,  and no drugs",351,3.4859426021575928,3.371485710144043,3.2592217922210693
34261,Food I like,kimberley,6,"i like chicken,  i like cheese! i like gravy all over my peas.  i lkike spaghetti,  chocolate too what about you? i like pizza and beans too,  i like fast food,  yes i do! i like cakes,  biscuits galore,  so please sir can i have some more?",236,3.773882389068604,3.526602506637573,3.308553695678711
15459,Invisible,kimberley,6,"oh my dad is invisable,  of yes it's true one daay he just started turning blur he turned yellow and then green it was the funniest thing you've ever seen you  may think this is not true just wait till you start turning blue",226,3.7130279541015625,3.695148706436157,3.295705556869507
20351,Suddenly,kimberly,6,boom! splash! a fish jumped up.  it was amazing! that was the only     fish that i saw jump out of the water for food now.  itâ’s whole body just flew up.  there! there! there was another! i think that that was the same one.   maybe it wasnâ’t?,244,3.6974029541015625,3.855520248413086,3.268435001373291
18113,Yellow,kimberly,6,yellow is the sun you only need one glance yellow is the water-breathing spogebob squarepants yellow is the shirt i'm wearing right now yellow is a duck that takes a bow yellow is a sports car going in a race yellow is a star floating in space yellow is a kickball played in a game yellow is a color worn to fame,316,3.27742862701416,3.104177236557007,3.2204458713531494
28560,When Again?,kimberly,6,"when again shall i meet your eyes,  eyes that remind me of beautiful blue skies,  when again shall i smile at you,  with a smile that drips of morning dew,  when again shall i walk with grace,  a warm expression splashed across my face,  when again shall my head be mended,  by whom shall my heart be defended,  when again shall i gaze upon your face,  when shall i be rid of my disgrace,  when again shall i grasp your hand,  the hand that slipped through mind like sand,  once again shall i hold my head high,  even though i wish to die",528,3.612052440643311,3.65080451965332,3.2790539264678955
24540,Why?,kimberly,6,the question is why? why do people cry?  the question is why just why? the question is why? why do people lie? the question is why just why? the question is why? why do people die? the question is why just why?,213,2.490793228149414,3.242441415786743,3.0206594467163086
34619,What is Blue?,kimberly,6,"blue is the trickle of running water,  the smell of a blue spruce outback.  blue is the coolness of water,  the laundry drying on the clothesline.  blue's the color of fields of sapphires.  blue is the smell of the fresh breeze blowing through the blue mountains. `",262,3.367269515991211,3.089749336242676,3.221097230911255
43144,The cute little Dog,kimberly,6,"i have a dog that eats like a hog,     he likes to jump like a frog.          he can be funny,                      and cute as an bunny.  after all. . . . ,                           he is my favorite dog of all. ",207,3.7808938026428223,3.4501848220825195,3.2981886863708496
18165,Wish Poem,kimberly,6,i wish i were. . .  j. k.  rowling at the movie scene of the 2nd book casting parts perfectly,91,2.872180700302124,3.197814464569092,3.032198905944824
14026,How I hate the rate,kimberly,6,"how i hate the rate things go these days,  they go so very quick,  what if i was to slow it down,  would it become too thick? would things go slower to and fro,  if i put a weight on them? would they then slow down,  at the sight of a precious gem? well let's find out my friends,   and try all this on them.  ''who's them?'' you may ask.  well,  i don't know,  i just felt like talking about the ones no one knows!",408,3.069584846496582,3.4037880897521973,3.19045639038086
14353,Freedom Is Like A Bird,kimberly,6,"freedom is like a bird,   soaring through the sky.  some grasp it,  some see it,  some don't take notice of it.   love is like a fire,  burning strong.  some grasp it,  some see it,  some don't take notice of it.   hate is like a sickness,  that spreads to everyone and everything.  some grasp it,  some see it,  some don't take notice of it.   bordom is like a line,  that is never-ending.  some grasp it,   some see it,  some don't take notice of it. ",436,3.247302770614624,3.3126351833343506,3.182259082794189
14490,A Book,kimberly,6,"a book is not just a book,  but a good friend too. ",52,3.4165966510772705,3.0767602920532227,3.2676851749420166
14493,War,kimberly,6,"when war ends,  we get peace.   why can't we get peace,  before a war must begin?",81,2.90869140625,3.2157793045043945,3.2340869903564453
14496,Feelings,kimberly,6,"a good way to read someone's feelings is to observe thier actions.   a good way to read what a person will say is to look back in time and think of what has happened in the recent past of the person.   a good way to know these things without doing all that  is to be brave,  and talk to them!  so don''t wonder. . . . . . know!",321,3.0883021354675293,3.4510068893432617,3.3604300022125244
14498,Dreams,kimberly,6,"your dreams will never come true,  untill you make them happen",64,3.046982765197754,3.4706051349639893,3.3155839443206787
14499,Problems,kimberly,6,"some despise problems.  that's normal.  but without problems in life,  what's the point of living?",98,2.6308064460754395,3.0631792545318604,3.09667706489563
14027,The Worm,kimberly,6,"the worm,  is in the dirt,  is in the pot,  is on the shelf,  is in the room,  is in the house,  is in the city,  is in the province,  is in the country,  is on the earth,  is eating yummy,  delicious,  worm food!",208,3.955924034118652,3.689039707183838,3.437763214111328
109648,Spring,kimberly,6,the warm breeze  the polen makes me sneeze i climb throught the trees i feel like hercules i smell the sweet peas as these flees attack on me i walk to the beach and smell the sea breeze as the day ends alls at ease i go home and go to sleep,246,3.505895137786865,3.463642835617065,3.251133680343628
87160,My favorite colors remind me of....,kimberly,6,"(red, black, pink, orange and, yellow)    once i woke up saying a poem right in the sky about my favorite colors. red is for apples flying side to side. black is a color that can write. pink is for a butterfly flying free in the sky. orange is a fruit that is my favorite. and yellow is for a banana which is a monkey's favorite fruit. ",329,3.49076509475708,3.214836597442627,3.2402803897857666
53086,LOVE,kimi,6,love is a hug. it makes you feel like your in love. love is a kiss. that makes you wish. love is a dance.  that makes you prance. love is shopping. just like your poping popcorn. love is a sport.  like you playing on a court.  love is friend. thtat will love you to the end. love is a car. that will take you far. love is a game. and you will not be shame. ,344,4.019697189331055,3.774521827697754,3.326810121536255
111558,Peanut butter,kimmar,6,"peanut butter, oh peanut butter when i see it makes me studder, and when i have that crisp spoon in my hand i can't help my self i eat that whole can",150,3.678171634674072,3.6445741653442383,3.405901908874512
66118,My Mother&apos;s Love,kimmy,6,"my motherâ’s love is special unique comforting,  worth it,  and wonderful donâ’t be jealous its nice knowing mother loves me coming from school knowing that iâ’ll be surrounded by motherâ’s love feels great my motherâ’s love",239,4.333414554595947,3.779780864715576,3.3892312049865723
