id,title,author,grade,text,char,valence,arousal,dominance
15916,I&apos;m the God&apos;s Child.,stephanie,4,"i'm the god's child.  i pray to god when i need help,  i pray to god when i thank to god,  i pray to god before i sleep,  i pray to god before i eat.  and god'will help you and your soul will go to heaven not the hell,  where the fire dungeon is when you die.  so,  i wish you guys to beilive in god.   i'll pray about that too. . .   i'm the god's child.  i read bible whenever i forget about how to behave in god's rule.  then,  you'll get bless from god.  and you'll go to heaven.  please beilieve in god.   i'm the god's child.  i psalm whenever i need help from god,  whenever i thank god,  before i sleep,   and before i eat.     and god will help you and bless you.  i hope you beilieve in god.            the lord's prayer.   our fatherwhich art in heaven,   hallowed be thy name.   thy kingdom come,   thy will be done on us, as it is in heaven.   give us this day our daily bread.   and forgive us our depts,  as we forgive our deptors.   and lead us not into temtation,  but deiliever us from evil.   for thine is the kingdom,  and thepower,  and the glory, forever,  amen",1046,3.3645033836364746,3.216902732849121,3.254250288009644
51761,My hamster,stephanie,4,"we spend a little time,  he sometimes likes to klimb,  when i put him in his ball,  he rolls down the hall,  that is what i like about him!",141,3.852817535400391,3.66096830368042,3.409661293029785
15298,&apos;&apos;You Don&apos;t want to fight with a lion&apos;&apos;,stephanie,4,you don't want to fight with a lion  or otherwise it might get tirin' he'll pull at your hair like a big mean black bear and then he'll soon let you go,154,2.5505027770996094,3.514559745788574,3.2311360836029053
35126,Puggy boy,stephanie,4,"my dog is tired,  but he still runs around.  i see him like a bird in the sea,  hi puggy. ",89,3.143993616104126,3.128045082092285,3.163806676864624
119985,The cat!,stephanie,4,"i spy a cat,   sitting on a mat,  playing with wool,  looking for a stool. ",74,3.08709716796875,3.1069154739379883,3.1783154010772705
120049,The cat!,stephanie,4,"there was a cake,  who had to bake,  i need to be iced,  but i accedently added spice. ",86,3.2488045692443848,3.1440343856811523,3.288537740707397
120003,Silly Milly!,stephanie,4,"there was a sleepy cat,   watching the time,   the cat was on a mat,   the cat would normally wyne,  the cats friend milly,  who was a little silly,  went to see billy,  that was useually silly. ",190,2.7359416484832764,3.0342321395874023,3.069493770599365
15872,"Shining,Shining",stephanie,4,"shining, shining like a star.  shining, shining from afar.  shining, shining way up high.  shining,  shining in the sky.  what could it be?  i cannot see.  for it is only night.  so have no fright.   i'll be back in the morning. ",220,3.3671083450317383,3.39095401763916,3.210319995880127
15875,"Tick, Tock",stephanie,4,"tick,  tock,  tick,  tock can you hear my specail clock? every day at half past ten you will hear a hen go tick,  tock,  tick,  tock. ",130,3.082538366317749,3.242370128631592,3.1660890579223637
15877,Oh Dear,stephanie,4,"oh dear,  oh dear don't fear my dear.  for i will peer inside your ear.  then you will hear the deer you fear run out of your very own ear my dear. ",147,2.79316520690918,3.3999319076538086,3.092848062515259
15879,What am I,stephanie,4,"i come in all shapes and sizes.  with lot's of surprises.  i change colors in the fall,  and the children have a ball.  when they jump on me they fill with glee.  so can't you see i am a leaf.  the end.  what a relief. ",214,4.011470794677734,3.816362857818604,3.371234178543091
47671,Brothers,stephanie,4,bothers me.  rob is his name.  offers a lot to me.  the pain of our family.  he smells really bad.  ears are huge.  reads like he's blind.  stephanie is the one he like to bother. ,176,2.475546360015869,3.1954050064086914,2.980750560760498
20016,My Alliteration,stephanie,4,handsome harry hud's hero has a huge harmful h on his head. ,62,2.671994209289551,3.1621739864349365,3.095452070236206
14670,You,stephanie,4,you are cool and funny too! i watched a movie about you.  you are nice and a good poet did you know it?,105,4.152640342712402,3.708673000335693,3.3382084369659424
109936,I AM,stephanie,4,i am ideas and feelings i wonder what they think i hear the howling wind i see the dancing sun i want the moment trapped in words i am ideas and feelings  i pretend to see things from another's eyes i feel ideas moving my hand i touch the smooth page i worry they disagree i cry for another i am ideas and feelings  i understand the power of words i say things from my heart i dream of stories untold i try to make them understand i hope someday they will i am ideas and feelings,482,3.273583173751831,3.368580102920532,3.18644642829895
91247,Every Afternoon,stephanie,4,almost every afternoon        i eat ice cream with a spoon every evening right at six i eat ice cream stacked on bricks  almost every afternoon i eat spaghetti with a spoon every night at three i eat spaghetti in a tree   every afternoon i eat honey with a spoon every night at five a bee comes from a hive  every afternoon i eat brocolli on a spoon  every night at seven i eat dinner like i'm in heaven,411,3.515937328338623,3.396841049194336,3.286487340927124
45541,The Trip,stephanie,4,"at the end of the day,  we went to central bay,  a fisher went by,  our family said â“hiâ”,  and so we walked on,   i yawned and i yawned,  then i realized it was closed,  and so we went back home. ",196,3.005568504333496,3.058091402053833,3.034573554992676
24375,When I Awoke One Morning,stephany,4,"when i awoke one morning a leopard was on my head,  and i said what are you doing on the top of my head; it looked at me and said i thought it looked like a nice place to sleep  because i want to live here; see my favorite food is rice but you might have thought i'd like mice right? right? oh! no one gets my jokes. ",318,3.2703399658203125,3.461153745651245,3.2008864879608154
49450,One day I saw a cat,stephen,4,"one day i saw a cat.  he was really,  really fat.  he sat on a rug.  i gave him a tug,  and then he just turned flat!",115,2.829357147216797,3.4548232555389404,3.112149477005005
87238,This is What I do,stephen,4,i'm not a rhymer  i am a timer  i will climb a tree and you will laugh at me i make tornados you make potatos i fly by  and you say hi i laugh and you look like a giraffe.  i swing low and you say go.  this is a song  this is getting too long.  this is what i do and you can too. ,279,3.5430870056152344,3.524137496948242,3.318104982376098
88645,Dragons,stephen,4,"â“dragonsâ” (rhyming poem) i imagined in my mind fire breathing dragons of every kind  long tails swinging,  redness in their eyes running through villages what a surprise?  here comes the knights ready to slay the dragon is scared and flies away. ",249,3.394787311553955,3.62738561630249,3.1927762031555176
88411,Flying squirrels,stephen,4,once there was a flying squirrel that was green and blue all around they fly and glide and eat and chew i love flying squirrels but that stupid winnie the pooh,162,2.9044065475463867,3.338942766189575,3.280249834060669
19434,A Nose,stephen,4,"be glad your nose is on your face,  not pasted on some other place,  for if it were where it is not,  you might dislike your nose a lot.   imagine if your precious nose were sandwiched in between your toes,  that clearly would not be a treat,  for you'd be forced to smell your feet.   your nose would be a source of dread were it attached atop your head,  it soon would drive you to despair,  forever tickled by your hair.   within your ear,  your nose would be an absolute catastrophe,  for when you were obliged to sneeze,  your brain would rattle from the breeze.   your nose,  instead,  through thick and thin,  remains between your eyes and chin,  not pasted on some other place-- be glad your nose is on your face!",707,2.9259800910949707,3.409639596939087,3.171381711959839
30896,WIND,stephen,4,the wind is like a knight taking flight at night.  it is strong it is neat you can feel it on your feet.  it is soft never caring if it touches light.  it comes like a  tiger goes like a cat.  never stoping or resting. ,217,3.286743640899658,3.345395565032959,3.189616441726685
30906,NIGHT,stephen,4,night is dark still and cold.  can't be told what to do.  the moon is oh so high.  stars telling you which way to go. sleep comes last off you go lemondrops and lollipops. ,170,3.3767881393432617,3.3071627616882324,3.186431884765625
34020,Man from Mars,stephen,4,"there was a man from mars, who came to earth wearing stars. he did not know he only had a toe and eighteen fingers all in a row. he had one cycloptic eye, which was always watery as if about to cry. and were you think the mouth usally goes. . . there's a four nostriled nose. the man's hair was put in a stylish mohawk, his skin was pale as chalk. so now you know about aliens fingers and toes, so don't trust anyone. . . no one knows. ",423,2.8259940147399902,3.0779342651367188,3.076641798019409
22424,Rope,stephen,4,a rope is flat.  a rope is dumb; all it does is sit around.  when it is used it's very lazy.  until next year it forms a daisy. ,127,2.774341583251953,2.953155517578125,3.1272501945495605
29535,Things,stephen,4,apple                                  baby                                   car  egg  finger  guy  hand  insect  jelly  kid  leaf  mouth nick orange  pot queen red stuff thumb under vine white  x-ray yoyo zig zag,217,3.159435987472534,2.9923222064971924,3.1498825550079346
29710,On My Way Home from School,stephen,4,"when my brother gets on the bus,  i say hi to him.  i ask,  ''how many stars?'' he says,  ''seven,  as usual. ''  he tells me to sit with him.  i say,  ''tomorrow, '' and go to the back to sit by alex.   the bus starts to move.  i look out the window.  weeds,  a shed,  then a thump over the speed bump.   we pass everybody else's stops.  my brother yells and says,  ''mr.  ski,  someone said a bad word!'' nobody says anything.   off the bus and heading for home,  i see new snow as white as clouds.   i pick up a handful,  make a snowball,   and throw it at my brother.   looking behind me,  i race into our house,  take off my things and sit down on the couch like nothing happened. ",661,3.177361488342285,3.304500102996826,3.223278522491455
40200,THE MOUSE,stephen,4,once there was a mouse who lived in the wall of my house his wife always wore a blouse but when she was loud he couldn`t here a sound,136,2.773838996887207,3.031521797180176,3.0928423404693604
37903,Cars,stephen,4,\t\tcars cars are fun to drive.  my favorite is big trucks.  cars are really cool. ,85,3.9452624320983887,3.509223937988281,3.349249601364136
29583,Cheesy Macoroni,stephen,4,"i love cheesy macoroni so much,  i would marry it!",52,4.238439083099365,3.917741298675537,3.482007503509521
19563,I trigre,stephen g.,4,"i was drianand a drean a was waking and a egloa taking and lion taki me.  and , i run away ande i full and .  a man say me and i ,  a buekap    and my  homewood was with me. ",172,3.087942123413086,3.535635232925415,3.0829520225524902
54182,Some Days,sterling,4,"some days when i am unhappy the sky is a dark dreary gray the willow trees look lifeless and broken.   other days i am cheerful and there isnâ’t a cloud in the bright blue sky the sun is brightly shining,  the birds are singing softly.  thatâ’s that,  itâ’s not my fault my mood changes with the weather. ",303,3.5251941680908203,3.4124226570129395,3.239183187484741
44498,Cool School,sterling,4,"i have a cool school i dueled i lost so i took the school to the pool the pool is cool then the bull ate the school poor mrs. bowman,  bryant,  and kent the bull ate them to",173,2.8855173587799072,3.318976402282715,3.1726949214935303
90223,Homerun,steve,4,"the pitcher pitches the ball,  it is a pitch the batter likes,  he swings and misses.  the umpire yells",103,2.7565550804138184,3.279388189315796,3.197173833847046
26601,Skin,steve,4,my skin is white my skin is blue  i don't care if my skin looked like a zoo i am still beautiful no matter what,115,3.630547046661377,3.528740882873535,3.3978111743927
33129,Big Blue Butterflys,steve,4,"i saw a big blue butterfly who always liked to lie,  when his mother wasn`t looking he flew up in the sky. iwent inside to get my net,  when i came back out he was getting in his bedset. after that i let him go and then he finally told me his name was joe. ",255,3.2273545265197754,3.201572895050049,3.1265735626220703
52564,Summer,steven,4,"summer is riseing ,  teachers are no longer supervising,  no more school!!  we can jump in the pool and act like a fool,  and that is cool",138,3.447521924972534,3.6003198623657227,3.4125757217407227
18209,Bubble Gum,steven,4,juicy mouthwatering exploding bursting squashing as messy as goo magnificant!,80,3.501645088195801,3.883090734481812,3.273810148239136
115988,The Baseball Show,steven,4,you get up to bat and swing or you go buy a shirt with some bling.  you might get a base hit or you quit.  double or triple you go or down you slow.  home run or rbi's  or you might even get some pop flies.  you win or lose and teamwork helps you choose. ,253,3.3931188583374023,3.3041815757751465,3.3719499111175537
15845,The Sun,steven,4,the sun is a lightbulb  shining high and bright  the sun is a lightbulb  sparkling at a tremendous height,108,3.488375186920166,3.383178234100342,3.2435152530670166
25408,A little dude,steven,4,"there once was a little dude who had a shoe on his head.  he wasn't so bright or a sprite,  and he had no clue. ",112,2.6471047401428223,2.986743688583374,3.0519907474517822
14456,The mean kid,steven,4,i have a next door neighbor.  she is very mean to me she takes my stuff.  she is even mean to my blue bird. i had a word game and she broke it.  she is very mean i don't like her as a nextdoor  neighbor. ,202,2.2198150157928467,3.3428969383239746,3.124274015426636
16771,My Beach Haiku,steven,4,at the sunny beach hear the big loud waves crashing during summer time  at the hissing beach wind started to blow very hard during a small storm  at the rainy beach now rain started to come down at my small beach house,221,2.640709400177002,3.1594958305358887,2.9909145832061768
101529,T is for Trees,steven,4,families put up trees for christmas eve christmas trees do not have leaves,77,2.786897659301758,2.993112564086914,3.0706446170806885
46340,My Room,steven,4,my room is mine. you can`t  have it it`s mine,47,3.2759690284729004,3.286019802093506,3.385626792907715
47565,My  brother`s room,steven,4,in my brother`s room all i can see is dark.  i`m glad i`m at the park.  now i can see white its a dog oh no its going to bite. ,127,3.148102283477783,3.416929244995117,3.1127960681915283
47550,Dog stew,steven,4,nothing for my stew i know my dog is perfect.  pepper is perfect yum no i need water my body has liquid and blood.  ahhhhh the taste is sour oh well i can`t do anything who will. ,179,3.590137720108032,3.5702993869781494,3.21296763420105
81052,My dog,steven,4,my dog is so nice but when he goes wild i tell him to calm down so he does and he goes to sleep and i say good night. ,120,3.3980860710144043,3.2302026748657227,3.246227502822876
72448,drogon,steven,4,dragons could be real  dragons can fly in the sky dragons can breath fire,76,3.1902875900268555,3.180792093276977,3.178322553634644
85690,The Football Game,steven,4,ten more seconds. zoom!goes the guy.  bang! goes the tackle.  seond down.  the guys huff and puff.  blue forty-two set hike.  touchdown!buzz! panthers win.  yahoo.  goes the fan. ,173,3.7597227096557617,3.7573513984680176,3.408184766769409
20186,How To Annoy Your Teacher,steven,4,"only raise your hand when you want to sharpen your pencil, or go to the bathroom.  repeat every ten minutes.  never raise your hand when you want to answer a question:instead,  yell,  ''oooh! oooh! oooh!''and then say,  ''i forgot what i was going to say. '' lean your chair back, take off your shoes,  and put your feet on your desk.  act surprised when the teacher puts all four legs of your chair back on the floor.   how to torture your teacher  by bruce lansky  only raise your hand when you want to sharpen your pencil or go to the bathroom.  repeat every ten minutes.   never raise your hand when you want to answer a question: instead,  yell,  ''oooh! oooh! oooh!'' and then,  when the teacher calls on you,  say,  ''i forgot what i was going to say. ''  lean your chair back,  take off your shoes,  and put your feet on your desk.  act surprised when the teacher puts all four legs of your chair back on the floor. ",904,2.8126583099365234,3.382075071334839,3.223071813583374
16229,The violin,steven,4,a violin is very thin.  it is so thin that you  must tie a pin around the tin. ,80,2.9083471298217773,2.929403305053711,3.1272480487823486
15291,Snowman,steven,4,"snowman   round, chubby, jolly   slowly melting in my yard   round and fat he is. ",82,2.873607635498047,3.112302780151367,3.0825514793396
90696,All In Black,steven,4,"the cat was dressed in black, he lossed his hat, then came a rat down his shoe, and he said ''ac-choo'' and then another one came with his parashcute. . . !",153,2.9356789588928223,3.3797075748443604,3.2208409309387207
94691,I like and don&apos;t like,steven,4,i like tips and chips. i don't like rips and clips. i like rocks and socks.  i don't like locks and tocks. i like more but i don't like tore. ,140,2.920334815979004,2.999332904815674,3.209547281265259
45773,Summer Evening,steven,4,"one summer evening,      hot, nice, cool, sweet, fun, dry, warm          runing, fast, slow, walk",96,3.796839952468872,3.4090967178344727,3.275439739227295
15772,Snowman,steven,4,"snowman                       round,  chubby,  jolly        slowly melting in my yard      round and fat he is. ",112,3.0532894134521484,3.207358360290528,3.145725011825561
28443,Tomatos,stevie,4,"tomatoes are red and have green   leaves,    tomatoes are in salads and also on some pizzas,    tomatoes are juicy you find them in gardens,    tomatoes are the color of me when i get mad!!!!",191,3.634251117706299,3.715737581253052,3.417042016983032
30703,My,stevie,4,my hair is like dark brown old bark on my desart scalp my eyes are like a rainbow all differnt colors my eye brows thin &amp; long my heart holds a stroung free spirit the color of the oldest rose my house is the sky i live on lost sols,239,3.2842836380004883,3.3082547187805176,3.205634832382202
83616,Lost friend,stewart,4,"didn't know it was bad until it happened.  breathing stopped.  mysterious mark.  what was it?  rabies  silence nothing to hear but the tear.  he was the  one that made us laugh, he was the one  that made us smile.   now gone forever. ",232,3.1024575233459477,3.411179542541504,3.0589940547943115
57345,Mornings,stoem,4,when i awoke in the morning.  my dad was still snoring.  and at seven.  my brother keven.  took my piece of bread.  and hit me in the head. ,137,2.5405311584472656,3.4304895401000977,3.035203218460083
64881,Untitled,stone,4,cars without wheels oranges without peels a guitar without strings a bird without wings. ,91,2.8344740867614746,2.942255973815918,3.096331834793091
29649,The Dog in the Do House,storey,4,once there was a dog named tracker  he was the only dog like her     he was the sleepiest dog ever he can sleep through any kind of weather     theres no other time he's slepping in his dog house he's so quiet he's like a mouse     his owners thinks he's run away  but he always there all day     theres nothing else he wants to do  but say goodnight and the roosteer goes kookoo      that the dog in the dog house i told u he's like a mouse,444,3.0825719833374023,3.3384804725646973,3.135934829711914
96191,Stormy weather,stormy,4,boom crash the lights go out go to bed be safe monters will crawl in to be saved                     watch out. ,114,3.1330738067626958,3.3127965927124023,3.191225290298462
106297,Spring Time,stowie,4,"bees buzzing all around,  flowers blooming in the ground,  wind and rain hear them blow,  here comes sun bye-bye snow. ",118,3.379655122756958,3.355675220489502,3.2171614170074463
95589,roses are red vilots are blue,stuart,4,roses are red&lt;br&gt; violets are blue&lt;br&gt; you are my dad and i  love you,84,3.918249130249024,3.430612087249756,3.309218168258667
95590,Cinquain poetry,stuart,4,spagetti             messy  spicy          slurping sliding falling    between my plate and mouth                delicious,125,3.635489463806152,3.364691972732544,3.2717864513397217
14050,My Life In A Family,stuart,4,"every day,  nothing to do,  every day,  a knead there and here,  (it hurts) so i just moo,  then they get off of me in front of the mirror,  so if you want to switch,  be my guest, because you will twitch.  lazy brothers,  cool friends,  there's a big difference between me and a friend,  so if you are new around here you just might like it here than where you used to live,  come on i'll be your friend,  so i give you this list (it spells my name) so very kind and friendly, ) the very kid who will always make you smile) uranium laughter bombs that won't hurt) a kid who likes to be fair) resting is my favorite thing to do) the kid who wrote this poem) stuart spells my name!",670,3.530954122543335,3.4625558853149414,3.328575372695923
21246,School,stuart,4,"you won't believe my school.  my teacher's having a duel.  my friend has a mule.   my school needs a pool,  and that would be so cool.  jewel is a fool.  bob is cool.  that is my school. ",182,3.4080257415771484,3.446051597595215,3.3078489303588867
47913,"Mocking Bird, Oh Mocking Bird",stuart,4,"mocking bird,  oh mocking bird reapeating what you hear.   mocking bird,  oh mocking bird talking with no fear.    mocking bird,  oh mocking bird don't care what you say.           mocking bird,  oh mocking bird why don't you go away. ",231,3.0747079849243164,3.2044153213500977,3.2031729221343994
32386,Red,sue,4,i see red in my head when i go to bed.   i see blue on my shoe when i have the flu.   i see yellow on a nice fellow when he bellows,134,3.0949902534484863,3.1377015113830566,3.148746967315674
34195,$$$$$$$$$,sukhman,4,"i spy with my little eye a pennie , a nickel, a quarter, a dime , if you are luky you will see in a dollar theres a picture of. . . me!!!",133,3.330333709716797,3.604442834854126,3.4047248363494877
14430,I once had a little bird,summer,4,"i once had a little bird,  her name was clemintine.  i once had a little bird,  and i talked to her.  i once had a little bird,  one day she flew away.  i once had a little bird,  oh how i miss her so. ",197,3.0510270595550537,3.1692047119140625,3.04718017578125
99357,Why,summer,4,why do i have to comb my hair why do i get grounded when i do something wrong why do i brush my teeth and go to school and when we are done learning that subject why do we take a test. i just wish i knew why. ,211,2.4461586475372314,3.2688145637512207,3.0172455310821533
84942,Annaliz,summer,4,i love my little sister because when i tickle her she giggles and i laugh.  i love my little sister. ,102,4.446695804595947,3.7483434677124015,3.3768420219421387
111677,My New Hat,summer,4,"i got this new hat, it is really fat, its shaped like a mat, and acts like a bat. my new hat is weird, it even has a beard, it can roll up into a sphere, and then he gets his beard. my new hat will fight, it will also bite, its is such a sight, it can turn white. my new hat can paint, he will also faint, he can lift a weight, he is such a baint!",335,3.2700581550598145,3.5520124435424805,3.276435136795044
118255,Bubble Way,summer,4,"bubble way bubble say bubble leads to wild craze like a maze, bubble trouble bubble wouble  bubble way bubble say bubble leads to awesome day, s  to a barn what a warn bubble leads to loving day, s",197,3.637282133102417,3.433382749557495,3.280210018157959
84633,Flowers,summer,4,roses are red violets are blue the sun is in the sky and the moon is too.  you are a good teacher and a nice one to. you make me think of flowers that are red and blue. that is all i have to say thank you for your nice way. ,223,3.964846849441528,3.391097068786621,3.288779020309448
90528,Loyalists and Patriots,summer,4,"loyalists finally facing the fact,  facing the fact that britain is mean as a bat.  patriots playing dress up   indians,  making the world's largest pot of english tea.  king george's kids being loyal.   like a dog facing his royal.   patriots anger beginning to boil.   britain as evil like a snake in it's coil.  like a cat attacking a rat,  laying on the stamp act.   tea act,  stamp act intolerable too.  patriots anger now hot like a stew.  ''rally mowhawks,  bring out your axes tell king george we'll pay no taxes!'' loyalists angry at all patriots.   all of the colonies now in debt,  'cuz of the tea in the depth of the ocean.  the harbor still green from tea leaves like new spring grasses.  while britain still rules it will not be for long. ",737,2.6771950721740723,3.3505167961120605,3.2148616313934326
56652,candy,summer,4,candy yum yum candy want some its really dandy,49,4.192847728729248,3.661743879318237,3.414059400558472
56649,Icecream,summer,4,"icecream is yummy,  tasty and sweet it comes in different colors and its a very good treat",92,4.226386070251465,3.6811909675598153,3.412245273590088
52123,Blue,sumner,4,blue the color of the tough auburn tigers.  it looks like the flowing sea.  it sounds like the rain fills a pond on a sunny clear day  it taste like freash sky air coming in.  it smells like the salty air at the beach.  it feels like cold inside blue the color of the auburn tigers,280,3.3365578651428223,3.235288381576538,3.151652574539185
