id,title,author,grade,text,char,valence,arousal,dominance
96984,I want to go to space,preston,2,"i want  to go space , so i can be in ace. so i can see the far reaches of the universe so i can study it at the university of mit",130,3.2345190048217773,3.212690830230713,3.2850472927093506
33758,The seasons go by,priya,2,in summer time it's hot  in winter time it's cold (shiver) in fall time it's chilly in and in spring it rains and now we start's again                         reapeat,169,2.983856201171875,2.995811700820923,3.10086989402771
33317,P my name is priya,priya,2,p my name is priya and my friends name is prelutsky we come from pakistan priya is a panda and prelut polar bear and we sell pampers,135,3.1890666484832764,3.0207855701446533,3.19246506690979
52161,SPRING,priyanka,2,spring is here! it's in the month may! may! may!  i'm so happy spring is here guess what! my birthday's near!  i hope i get lots of presents  this year!,156,4.227978706359863,3.944634437561035,3.4834868907928467
46544,I hate my Block Clock,priyanka,2,i saw a block and made a clock! it ran and i got shocked! when i came from school it knocked on my lock! so then i said ''i hate my block clock!'' and then it cried to my surprise i said i'm sorry  block clock i didn't mean it.  then my block clock got happy.  i said ''see that bee on my knee?'' the block clock ran after the bee and went in the sea! i said now i can cook and look at my book. ,395,3.311583995819092,3.774746417999268,3.175265073776245
107349,Baseball,quinn,2,a baseball is round and a player stays down on the ground   he does not jump high  he does not jump to the sky   when he hits a 'home run'he hits the ball to his home and it lands on his doorstep. ,204,3.386617660522461,3.37617826461792,3.3291046619415283
81689,The Flower,r&apos;kaisa,2,the flower is hot cold the wind is cold.  it is it is cold.  apple is cold in winter. ,86,2.7501721382141118,2.94596004486084,3.032336950302124
105959,eating,rachael,2,almost everyday at 5 i eat backen in the sky right at 8 i eat steak with some cake,85,3.35011625289917,3.1634058952331543,3.253570795059204
52953,A Whale,rachel,2,"a whale can be pale,  a whale can be green.  there are dancing whales,  and there are funny whales.  the whales like to read and jump. ",133,3.51277494430542,3.2718710899353027,3.201841354370117
77037,THE   SUN,rachel,2,the  sun   bright. the  sun  is   so  light. it   shins  bright.    by rachel. ,78,3.5100908279418945,3.2862441539764404,3.2233035564422607
41598,Jackrabbits,rachel,2,jackrabbits jackrabbits are soft jackrabbits are furry jackrabbits are brown jackrabbits,91,3.1352813243865967,2.9703502655029297,3.193540334701538
41597,MINNIE MOUSE MUNCHES,rachel,2,minnie mouse munches on marshmellows.      willam wells likes watermelon.      buggy bugs ben and bill.       buddy bell bats in baseball.     gayla gaorilla gets gavin's gears.         freda fish finds her food.                the end!!,234,3.259446620941162,3.2669265270233154,3.2398815155029297
74270,Rosess,rachel,2,"roses are red ,  violets are blue,  you love me ,  and i love you. ",66,4.276469707489014,3.741691112518311,3.364901304244995
75184,Halloween,rachel,2,i have a little jack-o-lantern i have a broom and a witch that rides all over town saying he he ha ha  i have a goblin to say we he we i have a ghostti named him blobber blue hokwen  to the park people screamed and said ghost say that i have a goblin with a witch and a broom!,279,2.974904060363769,3.494990348815918,3.21404767036438
69889,frogs,rachel,2,my frog is green so he looks mean.  my frog is quick so he made me sick. ,74,2.520727157592773,3.194577217102051,2.997964382171631
90542,Dino Dude,rachel,2,"dino dude plays a guitar once, he saw a wishing star he loves the pool  trust me, he is cool plus he loves school  dino dude is alwaysin a colorful mood he is very good once, he got attacked by snakes but he loves to make cakes and his friend bakes",248,3.8296327590942383,3.4874143600463867,3.3296210765838623
90531,Rainbows,rachel,2,"rainbows are coiorful. they're made with rain and light, they're also in the sky. they're tall but thin. it has an arch shape. rainbows are cool. ",143,3.7226109504699703,3.368407249450684,3.2588231563568115
30013,The Sheep,rachel,2,"one morning i found a sheep in my room.  it wouldn't go out when i swat my hand,  it wouldn't budge.  no matter how loud i shout. ",129,2.589546203613281,3.290375232696533,3.086258172988892
47950,Fast,rachel,2,faster then a car  faster then a shooting star,49,3.2176129817962646,3.3779451847076416,3.226431131362915
106980,Fun In The Spring,rachel,2,what fun   there's tons of buns   and the baseball season comes all the flowers    are sprouting with power   and the birds   are chirping words   the trees   and the leaves   are green   the bees are buzzing   and the rain is pouring   down on me. . .    what fun in the spring!,279,4.014828205108643,3.739593505859375,3.352116107940674
89800,Global Warming,rachel,2,"way up in the north where polar bears walk back and forth.  there is a problem that's scary and also unnecessary.     people burn oil,   and throw away foil,  and other things that spoil the homes for animals way up north.   we know global warming is bad and it makes me quite sad.  some people think that global warming is not so bad.  but it is!",343,2.442977905273437,3.3167591094970703,3.0840485095977783
58191,The baby!,rachel,2,a baby cries when it sees flies and a fly cries when it sees fries,69,2.4925875663757324,3.2838268280029297,3.022660970687866
58193,The baby!,rachel,2,"a baby cries,  when it sees flies,  and a fly cries,  when it sees fries, ",73,2.578233480453491,3.2602458000183105,2.9923434257507324
26586,Rachel&apos;s book,rachel,2,i hope you enjoy the poems that i have got.  there are lots of poems in the pot.  thank you a lot!,99,3.978914976119995,3.487278699874878,3.286043882369995
29342,Great  Teacher!,rachel,2,rose'es are red voilits aere blue the  world would be nothing with out you. you are so splended with what you do. ,115,3.332904815673828,3.3311972618103027,3.256025075912476
87892,Summer,rachel,2,"summer is fun,  it's totally fun,  you can have so much fun in the sun,  you get to sit in the shade,  or watch a silly parade.  eat strawberry ice cream,  or watch a baseball team.  you don't have to go to school.  summer is totally cool. ",234,4.119473934173584,3.676301956176758,3.369386911392212
57835,Money,radhika,2,a vending machine a vending machine wating to take him away! he will try to eskape! he dose not like it because it is  dark! in there and makes a horribel noise like:voooy ching chang gengo his worst! emeny to him aaaaaaaaaa!,228,2.524752140045166,3.7913761138916016,3.070620059967041
99385,butterfly,raffi,2,bug uneek tall tiki edmarald raket fly leap yikes,52,2.962608337402344,3.0398707389831543,3.167513132095337
29372,The Easter Egg,ragen,2,the easter egg i will buy an egg to boil at the store  tthe easter egg i will buy an egg to boil at the store easter sunday for an easter hunt,152,3.2157113552093506,3.057866334915161,3.2673351764678955
16637,Pizza is Yummy in my Tummy 2-D,ragi,2,"pizza is delicious,  broccoli is nutritious.  pizza is tasty,  broccoli is lasty.  pizza is yummy in my tummy. ",110,4.084412097930908,3.5711874961853027,3.3842902183532715
104415,My Neighbors,raina,2,my neighbors are my friends as nice as they can be when they are outside playing so is my family the next time i see them i will have eight times twirled on the eighth time i will yell out you are the best neighbors in the world!,234,3.974503517150879,3.816498279571533,3.477051019668579
53937,Pillow  Fight,rakan,2,i threw a pillow at my sister and my cousin.  they threw three pillows at me.  whack!  whack!  whack! i threw them back.  they attacked back? yes they did!!!!!! they threw and they ducked.  they threw and they ducked.  they threw and whack!!!!!!,244,2.679703712463379,4.008668899536133,3.1757843494415283
104023,My Mom,rami,2,roses are red. violets are blue. i like to sit with you and you do to. ,71,3.40047025680542,3.073485851287842,3.231755495071411
103098,Green,randy,2,what is green? green is a leaf green is the animal alligater and a lizard,76,3.1222569942474365,2.9701077938079834,3.1687653064727783
76205,my    mom    is    sweet,randy,2,my   mom   is   sweet   my    mom      is nice  she   is   she   is     i     love my    mom,95,4.164405345916748,3.545633554458618,3.258899688720703
75392,My Dog,randy,2,my dog she likes to kiss  she always picks she wants to jump on the couch her name is kriste she sometimes bites,116,3.373356580734253,3.3504834175109863,3.22475266456604
49196,Haiku-Sun,randy,2,"the sun keeps us alive and gives us heat too when the sun is out,  go play",76,3.551156520843506,3.292124032974243,3.358151197433472
28819,Spring Days,raquel,2,"spring looks like singing,  dancing flowers.   spring feels like windy,  cool air.  spring tastes like cold,  delicious strawberries.   spring smells like green juicy big apples.   spring sounds like soft beautiful music. ",217,3.8559823036193848,3.4859628677368164,3.229412317276001
45980,Kingdom of Hearts,raquel,2,soara born on an island builds a raft races reque wins a powpoo gets an eagle egg catches 3 fish finds 3 mushrooms collects 5 coconuts soara goes home sees a black ball talks to reque runs to cave door opens door enters new world,232,3.340598821640014,3.2645719051361084,3.1998040676116943
63804,Who I Am,ravenlynn,2,reading is fun ! apples are good for you! vases are where  flowers go! enjoys reading!  never gives up! loves to play with toys! you are cool! never fights with my friends!  neat!,183,4.340141773223877,3.9298601150512695,3.4366390705108643
54542,Ang,raymond,2,angels angels angels so so bright flying with their  precious wings in the snowy  sky.  laughter and joy with god! peacfully,127,4.3184428215026855,3.9916698932647705,3.4065816402435303
117436,Cam dabbs,reagan,2,cam is the best dabber on earth he's the dabb king. he is a good quarterback for north carolina. he does his as a quarterback  he's a great quarterback with good teamates. ,173,3.5759572982788086,3.259485006332397,3.3723304271698
63830,Cook,rebecca,2,"cook,  look in the book.  and in the hook,  there is another cook.  the other cook took the book.  cook do you like the book?",123,3.2037229537963867,2.9837379455566406,3.1839325428009038
63831,Knock first,rebecca,2,hello knock first! you never knock on my door first! so now you half to pay me back o. k!,91,3.469931125640869,3.827182292938232,3.395746946334839
59992,A Fat Mat,rebecca,2,there was a cat with a tall hat who had a mat that jiggled and giggled when the cat sat on the mat. ,102,3.3713879585266118,3.209147453308105,3.17246413230896
30776,Hello,rebecca,2,hello mello ya look like a. . . .  yellow lemmo!!!! hahahahahahah whats up pup? i am great but sorry i'm late!    how is it mate? ohhhh its great! my cat is like a mat it has a hat that looks! like a mat!,203,4.086879253387451,3.950068950653076,3.3317625522613525
33542,Flowers,rebecca,2,flowers are as beautiful as a butterly wing.  you can almost here them sing!!!! they remind me of a wedding ring.  their song is like the ding of a bell.  shhhhhh don't tell. ,174,3.73001766204834,3.7373437881469727,3.295337915420532
95722,Halloween,rebecca,2,halloween is treeats.  halloween is candy.  halloween is costumes.  halloween is sweet. ,87,3.85445237159729,3.409677743911743,3.302199602127075
42105,Whats the best about summer,rebecca,2,you can swim.  you can jump and you can spin.  you can play and splash in a bay.  and you can have the wind blow on you. ,121,3.472100019454956,3.309243679046631,3.26678729057312
46092,My three best Friends,rebecca,2,amber is a caring nice friend.  melanie is a nice beautiful friend.   and kristen is a friend thats always  there for me.   there always there for me. ,150,3.850125789642334,3.3465425968170166,3.2793610095977783
26983,Moms,rebecca,2,"moms       nice, cuddly jogging,  cleaning,   helping,      moms  are  nice          person",90,3.919240713119507,3.374716758728028,3.33207106590271
95493,The Special Day!,rebecca,2,"there is a special february day.   itâ’s as wonderful as a pretty blue jay.   itâ’s as fun as riding in a sleigh,   the special day is&#x85; valentineâ’s day!  hooray!",169,4.172562599182129,3.811999082565308,3.43365740776062
95535,Tree,rebecca,2,"blossoms pink and white,  waving branches to the wind,  apples from my tree",76,3.37341833114624,3.196738719940185,3.2236340045928955
95602,Tree,rebecca,2,there is a apple tree in my backyard.  i eat apples from it everyday.  my friends like it to.  (:,97,3.5909886360168457,3.215977907180786,3.3165037631988525
16642,My 2-D yummy ice cream,rebecca,2,"i love my ice cream cause it tast so yummy,   and when i am served them it tast so good in my tummy.  so when i go out i aways order ice cream,   and i aways order cream. ",170,3.978494167327881,3.568495035171509,3.4326512813568115
18215,Flowers,rebecca,2,"flowers,  flowers in the air.  flowers,  flowers everywhere.  flowers,  flowers spring is here! flowers,  flowers everywhere. ",122,4.038241863250732,3.682604312896729,3.326088190078736
19940,Wild Animals True and Mythical,rebecca,2,"there are unicorns and horses, wallabies and morses.  there are salamaders and newts,  snewts,  and smartamanders.  there are kittens in mittens.  there are macaws,  dogs with mud balls,  and unknown things with hairy paws.  there are creepy frogs with huge mogs.  there are huge sharks with enormous jaws.  there are animajaws with candy jaws.  there are canamals and tanisaws.  there are anigis that live in cangi.  there are bookalaws and nancals.  i like all the animals.  i'm sorry the poem has to end,  i've run out of ideas,  so good-bye,  that's the end!",546,3.20865249633789,3.2742691040039062,3.1389732360839844
19895,I Packed a Picnic Basket,reece,2,"i packed a picnic basket.  i brung it to the beach.  i unpacked my picnic basket.  i unpacked every treat.  i quickly gobbled up all of the yummy things,  i brought to eat. ",170,3.7831504344940186,3.516282558441162,3.376647710800171
107352,This is how I eat my jellybeans,reece,2,this is how i eat my jellybeans i stack them on top of each other!   this is how i eat my jellybeans i stack them on a wall hopefully they won't fall!   this is how i eat my jellybeans i sort them by color!   this is how i eat my jellybeans i sort them by size!,264,3.5433809757232666,3.666135787963867,3.4243640899658203
57010,Reece,reece,2,reece is exciting  excellent student cool enjoys games,60,3.990612030029297,3.5247573852539062,3.417001962661743
96129,Snow,reenna,2,"snow is when winter is here.  snow you are white.  snow, you can make snowmen.  snow, you can play with snowballs.  snow, you are playing with us.  snow you are winter. ",163,3.4839751720428467,3.277096748352051,3.313473463058472
94519,Birthday,regan,2,"today i'm feeling blue,  i'm telling you the truth,  because my birthday's not today,  and that is not ok.  i think i've got the flu.   it's been a very long time,  since a present has been mine.  my birthday's almost here,  let's dance around and cheer,  three hundred sixty-four more days 'til i'm nine. ",299,2.807891845703125,3.467647075653076,3.1468722820281982
94517,What&apos;s So Great About  Horses?,regan,2,"if i could i'd be a horse,  strong,  beatiful and shiny,  a big girl would own me of course.  i would be perfectly free.  i'd whip my mane in the air,  rearing,  rolling in the grass,  fast as lightning without a care,  until she yells out, ''whoooooa!''",247,3.497236490249634,3.781033992767334,3.4024128913879395
116913,Jack O lanterns,reid,2,big fat orange white shinny jack o lanterns lite the night. faces faces all a galore pick the pumpkin you adore carve a face and strip the skin will your jack o lantern win. ,175,3.5037124156951904,3.437927722930908,3.369489908218384
83025,Football,remy,2,i love football it is cool. i would play it in a pool. i would play it with a tool. i would play it with a fool. i would play it with a mule. i would play it with newell.  i would play it with a stool. ,198,3.620514154434204,3.3419132232666016,3.328919649124145
100538,"Jellybeans, Jellybeans!",renee,2,almost every afternoon i eat jellybeans with a spoon every evening right at six i eat jellybeans stacked on bricks every thursday right at five i eat jellybeans by my beehive on this friday afternoon i will eat jellybeans with a big baboon!,245,3.5938634872436523,3.6230735778808594,3.3937289714813232
19024,Aquarium,renee,2,awesome  fish quick   dolphin  unusual angelfish  reefs interesting under water  manatee,92,3.599153518676758,3.3083086013793945,3.245861291885376
30303,French-fries,"rhonda, lori, stephanie",2,i want some french-fries to eat they just canâ’t be beat we have put them to the test and found they are the best&#x85;. ,125,3.688404083251953,3.519282817840576,3.4360504150390625
60389,The Cop,ria,2,there was a cop who saw me hop he told me to stop so i walked in to a shop,77,2.665072202682495,3.225048780441284,3.129584789276123
34594,Ice Cream,ria,2,"yummy yummy in my tummy.  melting,  melting melting down.    napkin,  napkin,  napkin now!  chocolate,  strawberry,  vanila yum! marshmallows,  m&amp;m's,  whipped cream.  yum! yummy yummy in my tummy. ",194,4.197340488433838,3.8256239891052246,3.3723435401916504
102755,what am i,richie,2,i have a hard shell.  i can go in my shell.  i have litle. ,59,3.130894660949707,2.9447522163391118,3.2405502796173096
94511,Mountains,ricky,2,as i look out my window i see mountains in the background.  they make me think of alligator teeth and camel humps.  they are light brown in the distance.  i wonder how long they've been there. ,192,3.0913610458374023,3.1360790729522705,3.1294138431549072
89652,Kangroo,ridley,2,"kangroo    brown,  hair    jumping,  running,  sleeping    pouch,  tail,  mammal,  red      browsing,  kicking,  standing    ears,  eyes    joey",138,3.082797050476074,3.086984157562256,3.1707026958465576
107350,Crazy Is,riley,2,"hyper,  coo coo,  not right,  but not wrong,  or loud and noisy.      when i think of it i think of blair, bryce and aunt whitney.                        some times crazy can be fun or make no sense.                                   some things make you crazy like coffee or to much sugar that stuff makes you jumpy!",312,2.8508708477020264,3.3355679512023926,3.167161226272583
117187,Rain,riley,2,rain rain you will not go away you lie to me and come the next day so get away from me now take a trip out of town and then go in the ground rain rain do not come again your not welcome any day do not come back you cloud that is gray,236,2.4776759147644043,3.372520685195923,3.2429420948028564
110939,Rectangle,riley,2,a rectangle looks like a block.  a rectangle looks like a piece of paper.  a rectangle can be any color. ,105,3.140200614929199,2.899320125579834,3.1913435459136963
116910,Pets,riley,2,pets pets need no bets                                             cats are not like rats and dogs are not like frogs . all are different you will see just. ask . me. some have hair but where where are pets. no bets. ,214,2.9605612754821777,3.007529020309448,3.2201545238494877
107348,A  Clock,riley,2,when i put on my sock and i found a clock then stepped on a rock and put on my     crock.                                     later the clock got sick and went to doc and got shocked and got a new clock and new socks.                                 my clock can talk and walk and rock a lot too and locked me out of my room his name is tick tock. ,348,2.8150839805603027,3.183583498001098,3.0998075008392334
86148,The wind blows,riley,2,the wind blows oh how the wind blows it blows in my hare it blows evre whare,79,3.0703930854797363,3.227452754974365,3.196251630783081
92258,Riley,riley,2,ris for resoresful i is for intellagent l is for good lerner e is for exalent friend y is for yippe you can count on me,122,3.4815938472747803,3.2559850215911865,3.3072597980499268
28932,Puppies,riley,2,"puppy cute,   fun,  play foul i love my puppy!",48,4.428915500640869,3.8860697746276855,3.491119146347046
26977,Cheers,riley,2,cute creative cheers he hollers out loud excellent at jumps everyone tumbles together rooting for the team shouting really loud!!!!!!,136,3.79315996170044,4.018277168273926,3.3961751461029053
95799,DANCING CLOUDS,rina,2,"dancers dancing on the sapphire  floor,   dance to the heavenly  music of  the winds.  .   torn and tossed , they gather and get shattered.    when they turn grey  in  their high abode,   they  pour and pour down below  giving  themselves back  to nature again. ",260,3.2963757514953613,3.4312427043914795,3.192857027053833
75397,My  Pet,rishi,2,i sat on a mat my dog is fat my fish is wearing a hat but my cat is chasing a rat. ,85,2.3388729095458984,3.160764217376709,2.9115631580352783
85291,Who I Am,robert,2,run alot on computer bike riding with my cousi enjoys my mom and my dad robert  is my dad name to toys i play with,117,3.418921709060669,3.131093263626098,3.2708547115325928
24963,If I was One Inch Tall,robert,2,"if i was 1 inch tall i'd have a problem with my shoes.  they'd be too big,  they'd smell like figs,  i really wanted blue.  my mom bought red but i liked blue be-ter.     (i need something to ryhme with better. )",209,2.733151912689209,3.130090475082397,3.1020777225494385
20282,Look,robin,2,look at me i can see the city where i hurt my knee so badly. ,63,2.161374092102051,3.38577651977539,2.82907509803772
78928,My Cat,rochelle,2,"she looked at me like a butterfly.  i saw her with my own eye.  we had a lot of fun.  gosh,  we played out in the sun! the day was like an awesome rhyme,  with an ending of an awesome time!",187,4.323958873748779,3.938282012939453,3.421917200088501
51734,Phone,rocio,2,phone is the kind of words that you hear when you feel fear.  phone is the toy that gives every child joy.  phome makes riddle noise to annoy the person on the other line.  phone is the sound of ''hola'' in the spanish home.  how many ''hola'' can a phone really know? phone is the beauty that makes girls go ozzy.  phone has the buttons that make the numbers go jump'in.  phone is the cry of every girls good-bye.  phone is the fun and joy that you find in every other home. ,471,3.649317502975464,3.5370752811431885,3.2904980182647705
53468,Haiku:  Rainbows,rodrigo,2,rainbows are oval.  rainbows are so colorful.  rainbows look pretty. ,69,4.006074905395508,3.556522846221924,3.2696211338043213
40010,Room,rodrigo,2,don't come to our room only if you dare you would see the chickens eating the cheese left.  october now that you're in the jungle you should say goodbye. ,155,2.652617931365967,3.1782283782958984,3.1899220943450928
16592,Paramus 2H,roger,2,i like icecream because you are so sweet. you are so cool to eat. i wish you are in my yummy tummy. you are so yummy. yummy yummy yummy yummy!,142,4.484060764312744,3.873657464981079,3.4127774238586426
75176,The  Dog,rohith,2,the dog was in the farm the dog had 5 animals the dog took them to park when he took them the animals say fishes and animals he crashed the stop sign the police was shouting he went back to the farm he took bath,215,2.5447072982788086,3.278902769088745,3.066493511199951
114150,What I Do When I am Bored,roman,2,"almost every afternoon,  i go around and eat cocoons.  early evening right at eight,   i start my rocket with my mate. ",119,3.256477117538452,3.1213059425354004,3.2520911693573
90384,Fat Bunny,romeo,2,"there was a fat fat bunny,  never had no money.  but he had a honey,  and she had money.  she was funny! rabbit was kicking the door and took the money.  and the old men was at the door,  saying give me my money!",209,3.4763646125793457,3.620049953460693,3.2746365070343018
90398,Eagle,romeo,2,"eagle- flying,  crying sits on trees swimming in the sky strong",65,3.076040506362915,3.243323802947998,3.1318135261535645
26978,Sharks,ron,2,"sharks                        dangerous,  strong       eating,  crunching,  swimming,           sharks are very cool.                 fish. ",137,3.564870834350586,3.350383758544922,3.216464042663574
30212,The Silly Dog,ronak,2,there once was a dog who got stuck in a bog. when he came out he got stuck in fog. then he began to be in a deep weep. finnly he began to sleep. ,144,2.239521741867065,3.137253761291504,2.7925961017608643
33154,Baseball,ronak,2,"baseball               hard, fun      hitting, cathing, throwing      winning and losing games              sport",113,3.4955921173095703,3.249509334564209,3.2880189418792725
112453,Mercy,roopa,2,crying for mercy trying for jersey riding on horsey,56,2.426879405975342,3.137605905532837,2.901389837265014
78087,Rainbow,rosalie,2,the rainbow is up in the sky the sky is wet the ground is green rain from the clouds the rainbow is in the sky,113,3.4654364585876465,3.2340221405029297,3.178163528442383
101982,I&apos;m so cool,rose,2,i am cool too cool for school too cool to even think about going to school.  i am cool.   i am fun i am so fun.  i am fun.   i am wicked i am so wicked don't say i'm not 'cause i am.  i am cool. ,192,3.92272424697876,3.7588329315185542,3.395960807800293
15147,My very happy dog,rose,2,"my very happy dog has a little cute face,  and he likes to jump around all over the place,   his name is murphy,  as cute as the sky. ",133,4.138024806976318,3.667072057723999,3.341505765914917
105363,Awesome Mummy,roseangela,2,mummy is so awesome.   she is beautiful and cute.  she looks pretty all the time.  but that is not the reason she gathers things together.  in fact she is the getter.  she also works harder so she is the provider,210,4.034426689147949,3.6710033416748047,3.393849372863769
92202,the cat,rosella,2,the cat had a hat that loved to chat and chat somemore and had a smore oh that cat,85,3.2858805656433105,3.2483606338500977,3.228836297988892
