id,title,author,grade,text,char,valence,arousal,dominance
103187,Funky Monkey,triston,5,"this may sound funky,  i have a monkey.  this monkey is indeed funky and somewhat chunky.  she likes to jump and land on her rump.  her name is hannah and would like a banana.  this is the story of my indeed funky monkey. ",219,3.167625188827514,3.163118362426758,3.211299180984497
118147,Hands,trivell,5,"my hands do many things.  like help me eat cheez its,  and help me pick things up.  my hands are capable of   anything,  like ejecting objects like baseballs and footballs. ",172,3.307352066040039,3.251919984817505,3.325817823410034
103458,Halloween Poem,troy,5,"out of the light.  on halloween night,   itâ’s very risky,  since monsters can bite.  running around,   treat after treat,  up and down,  every street.  to me halloween,  is really sweet!",185,4.004446506500244,3.797316312789917,3.3805625438690186
103449,Santa Letter,troy,5,"troy p.           dear santa,             on this very special day,  please put these things in your sleigh: petey wants a dog that drools,  and sam would love some swimming pools.  greg could use a hockey stick,  and please give jack the movie ''click''.  edison would like another soccer ball,  and lucy wants a shopping mall.  connor wants an itouch in its box,  and allan wants a rabid fox.  alex wants some reeses pieces,  and charlotte wants some big dog leashes.  claire wants a tiger that's tame,  while hana wants a lot of fame.  stephen needs a baseball bat,  and kate would like a rookie hat.  matthew wants a surprise box,  while corey wants the chicken pox.   jessica wants â“toy storyâ” the movie,  and olivia wants to meet the famous scooby.   kirsten wants a piece of cake,  and stephanie wants a piranha filled lake.  and underneath the christmas tree,  leave an x-box 360 just for me.              love,                 troy",935,3.416625022888184,3.243298053741455,3.260751724243164
82721,Trung,trung,5,talented respectful unique neat green,40,3.582831382751465,3.169163703918457,3.293745756149292
87653,I want a pet,truyen,5,i want a monkey  but i need some money and it is so funny we walk in the sunny and i have a bunny,100,3.614255428314209,3.452630043029785,3.2865610122680664
113806,Fun,trynity,5,fun is every where united states and other countries new york city and the rest,82,3.487621068954468,3.237470865249634,3.315424919128418
78258,Shoes,trysten,5,the reason i like shoe is because i like the color blue i like 2 investicate clues not only i like shoes but i love shoes and so does shorty too. ,148,3.8047897815704346,3.407045602798462,3.334770441055298
78261,My family,trysten,5,in my family we have six kids we sit on bricks and eat pixy stix we play lots of games and after pictures we have lots of frames my sisters and brothers dont ever take the blamed but im ok its going too happen too them one day,229,3.2046680450439453,3.1445326805114746,3.2276699542999268
78263,Lolly pop land,trysten,5,lolly land of phones and shoes with diamonds and perfumes and sing alongs too and kasaroll and yummy food. ,109,3.708570957183838,3.366263628005981,3.2754571437835693
78262,Some Shoes,trysten,5,some shoes are red           some shoes are blue           some shoes are cool           some shoes just drule           but my shoes are cool           and jakes are too,184,3.3637514114379883,3.135971546173096,3.2281086444854736
51890,Bones,ts 2,5,bones are tough because they play rough.  milk will help your bones but not silk! if bones are red there prety much dead! so be nice to your bone and eat lots of rice!,169,3.369631767272949,3.4707984924316406,3.346275568008423
90570,The star from tv,tuck,5,"when i woke one morning,  patrick star was on my head,  i asked ''what are you doing?'' ''i'm waiting to go to the car'' ''what car , is it on planet mars?'' ''no you dummy,   it's on planet gummy!'' ''do you have a rocket''      ''no but i live under a rock''      ''do you have anything in your pocket''",307,2.943540334701538,3.5466408729553223,3.197003126144409
109660,Pie,tucker,5,i like pie.  i like pie cuz cakes a lie.  my pie is the best cause its not cake. ,81,3.715090751647949,3.388458251953125,3.3275399208068848
103041,Chocolates,tuyet,5,"chocolates are like forgiveness of love to eat to hold and to hug creamy surface on the outside  crunchy center on the inside  if you make someone sad or someone makes you sad,  you,  or them,  will probably give them. . . . .  chocolate chocolates are like forgivness of love",271,3.599520206451416,3.3472900390625,3.3063225746154785
92978,Hannah,tweet-tweet,5,h-happy hippo a-acceptable alligator n-nice nat n-neat newt a-awesome anaconda h-helpful hamster,99,3.825007200241089,3.4347498416900635,3.324268579483032
92457,Me poem,ty,5,"ty     enthusiastic, active, kind, and   reverent,     son of kind and caring parents,      lover of basketball, baseball, and freedom,      who feels joy, love, and sadness,     who fears spiders, insects, and tornadoes,      who needs love, smiles, and laughter     who gives hugs, kisses, and kindness     who would like to see hawaii, great wall of china, and italy,    resident of a white sox world.  a",388,3.694113254547119,3.407723903656006,3.2708499431610107
113458,Eagle peak,ty,5,as he soars through the open sky  when his feathers flutter in the star night  he searches for his prey in the moon light  he dips down and picks them up with his beak  and he takes them to his peak,202,3.211965560913086,3.351661443710327,3.273961305618286
50333,Halloween,ty,5,its a night you might die of fright when the goblens come out to play.  when night falls  stay in the light  and stay alive and the evil lepercons  will just kill you. ,171,2.353621244430542,3.514575481414795,3.052912473678589
50210,My  back yard,ty,5,"as drie as the  desert,  as color less as a old movie as dead as a piese of papper as junky as a junk yard thats what my back yard looks like. ",145,2.58705997467041,3.13435173034668,3.094926118850708
61553,Palm Tree,ty,5,ty sees a palm tree  a coconut hit his head ty loves coconuts,64,3.4644432067871094,3.2895021438598637,3.2760684490203857
22510,The three kids,ty,5,"there are three kids on my block,  the first kids name is doc.  the second kid is like a turkey,   and always will agree.  the third kid likes his bed,   and always smashes eggs on his head.  me,  i donâ’t pay attention,  because this is me,  in another dimension. ",258,3.1478381156921387,3.197476863861084,3.257295608520508
120661,School Blues,ty,5,i like cherries  but i don't like the library  because there's this man named jerry  and he was from the military  he looked ve scary  because he was so hairy.  i don't want to go back to the library   i hate school  because there's a lot of fools the only thing that's cool  is when there's no school  i consider myself as a champ i play ball  better than them all   there's this boy that whines  and he likes to write straight lines he writes signs so that nobody can find. . . a way,484,2.477796792984009,3.3828060626983643,3.078486680984497
32495,Snake on my head,ty&apos;kerious,5,"when i awoke one morning a snake was on my head.  i asked,  ''what are you doing there?'' he looked at me and said,  ''i'm cooking waffles!'' ''but why on my head?''i said.  ''this is the best spot,  all black and  prickley.  my family and i like to cook here. '' ''well o. k. '' i said. ",281,3.249196767807007,3.463956117630005,3.24276065826416
96906,Invisibility,ty-hunter,5,i want to talk to her but i get shy.  we say hi we say by.  i walk pass her nothing said.  i want her to notice me i'm going insane in my head.  i flop on the calling my friends. help me! help me! i get no advise.  i wonder if she see's me invisibility. ,250,2.7062690258026123,3.3895483016967773,2.9743239879608154
49269,TWINS,tyler,5,"i love working on my tan,  and the girl at the taco stand and twins and twins,  i love the red wite and blue and twins and i love you!",135,4.305167675018311,3.8438351154327393,3.429228544235229
92108,Fastest thing alive,tyler,5,faster then a cheatah faster then lightning faster then wind  it's really quite frightning it runs so fast faster then a bird some don't belive it thats what i heard i can't explain it it's faster then a horse and guees what it's me in a dream of course,256,3.0068798065185547,3.5624566078186035,3.061816453933716
109043,Snoring,tyler,5,my dad snores louder than a dragon roar.  when my dad roars he lets off a storm. ,82,3.1109023094177246,3.432239055633545,3.2326221466064453
14136,I don&apos; like my sister,tyler,5,i don't like my sister  because she acts like a cat.    i don't like my sister  because she can't swing a baseball bat.   i don't like my sister  because she is mean and turns green. ,183,2.3340048789978027,3.3030054569244385,3.143627882003784
62834,O great knees,tyler,5,knees if i dident have them how wold i run the laps around the track at our school and ride my dirt bike aourond the track that i ride it on and  how wold i ride my bike around the blockand ride it to school also how wold i ride my skte bord around. ,252,2.9673726558685303,3.158759117126465,3.221515655517578
50592,roses are,tyler,5,roses are  red  violet are blue and so are you,50,3.175386905670166,2.938638210296631,3.1793806552886963
50518,DIRT RED SLYES,tyler,5,"there is dirt and gold               in the room             somewhere out there        the ground can get some of it         because sometimes it falls                so you know,            it flies in the wind            as happy as can be           in the dirt and gold,         could actually be a flea.                in the usa              i love to be      i donâ’t have to flee,  so it be            i can get it wet,        but it wonâ’t be as good as a pet                 can you guess?               itâ’s my hair!!!",529,3.2864041328430176,3.408578872680664,3.2176945209503174
66104,Butter For Breakfast,tyler,5,this morning i had butter for breakfast  it was gooey and osey and had rhy toast   it had been in the green frige for years  it is brown and blue andhas a hoast   thats why i hate my grandmas toast,202,2.557339668273926,3.203310966491699,3.1111390590667725
96260,Doggy,tyler,5,(read up to down then down to up)    listen and tail his chase catch lay sit fetch sleep but everything did and love in fell he and stray a got i day next the  eat? you won't why friendly.  being just i'm enemy you'r not i'm play you won't why doggy,251,3.215894222259521,3.282471179962158,3.238408088684082
90578,Hungery dog,tyler,5,"when i woke up one morning,  a dog was on my head.  i asked, ''what are you doing?'' it looked at me and said,  ''i don't know. '' i said,  ''well get off i'm trying to sleep. '' ''go get me some food and i leave. '' i went and got it some peeps then fell asleep",257,2.7732863426208496,3.239754199981689,3.0293242931365967
114497,Wolf,tyler,5,fluffy and cute.  fuzzy and small.  with that little tale.  with those big blue eyes.  fun to play.  my little stuffed wolf,121,3.921199083328247,3.498392105102539,3.3242523670196533
36210,Going into Hyperdive,tyler,5,going into hyperdrive going near lightspeed bypassing all other ships a victory is all i need.  the race is almost finished i need just one more lap once the race is over i think i'll take a nap. ,197,3.30105209350586,3.4143993854522705,3.2892167568206787
73895,THE FLYING BISON,tyler,5,there once was a bison named george  who lived in a great big gorge all he ate was choclate and also a big secret it was that he had great wings  that aloud him to go steady  but sadly he couldn't cause he was  just to heavy,227,2.879901647567749,3.073194742202759,3.0667836666107178
73896,The worm boy,tyler,5,there once was a boy named jeff who loved being a chef but one day he found a great worm and now he never cooks again,120,2.737527847290039,3.06571102142334,3.072385549545288
114517,Rain,tyler,5,pouring and getting you wet.  splashing against your face.  spilling down the side walk.             nice cool rain,115,3.161264419555664,3.246480226516724,3.1040523052215576
39218,Couch,tyler,5,"people sit on me all the time  i'm still as a rock and as quite as a mime there's a remote control on my side.   they never get off of me and go outside.  they are always comfy on me.  but the don't know i'm a little sad,  they can't see.  sometimes the kids jump up and down.  they play on me and roll all around.  i think my life is super and fine.  i love my family because they're all mine. ",392,3.5186281204223637,3.395403861999512,3.2292673587799072
21886,The Stork On My Head,tyler,5,"when i awoke one morning i asked what  are you doing there? it looked at me and said. . .   i figured it was a good nesting spot; it's warm and comfortable and you do not have to pay for it it's free,  it looked back up and i said.  .  .   get off my head.  does it look like a nest to you? it may look free but it's not.  it is not for sale.  the bird flew away,  and i never saw it again. ",382,3.177079677581787,3.242955684661865,3.224576234817505
103652,Roping,tyler,5,roping is cool there arenâ’t many rules  excepted for a few   thereâ’s not that much to do intel they call your name when they do  you should do  what they tell you to  you get in the box  and hope thereâ’s no rocks  and go out and rope the steer it may appear  that the steer stinks  i hope that you catch  but donâ’t be upset  if you have to try again. ,360,3.134403944015503,3.165124893188477,3.3036935329437256
53906,Cucumbers,tyler,5,cucumbers are like lumber i think about them in my slumber my stomach grumbles for cucumbers as loud as thunder am i addicted to cucumbers i wonder,150,3.065969944000244,3.4294979572296143,3.180624723434448
48542,She just a kid,tyler,5,i know she just a kid but i dont care.    she always a brat.  i wish she would go away i wish i wish she was a bug.  o no. . . .  were did she go. ,142,2.294018030166626,3.2653074264526367,2.998378038406372
36542,Colors,tyler,5,"colors,  colors what do you see  i see red,  yellow,  blue,  and green.  colors,  colors all around  i see red,  orange,  and brown so when you see colors remember  the bees you say this poem colors,  fall,  and leaves,  trees. ",220,3.297408103942871,3.1590914726257324,3.189751148223877
113532,Soccer,tyler,5,soccer is my favorite sport its fun when you play with everyone i think that it is the best sport it is a great way to go outside and play with your friends it is the best when you score a goal for the win,208,4.028821468353272,3.636950969696045,3.4371464252471924
37972,"Freindship, something hard losing",tyler,5,"they are walking down the street,  stomping their feet,  because they have just lost there friendship,  something hard losing.  they feel the pain,  in every turns that they made,  because of something that they lost,  which is their friendship,  something hard losing. ",265,2.1547112464904785,3.400516986846924,2.832746744155884
49264,MONSTER!,tyler,5,tough as nails.  mean like a tornado.   black as night and orngea as a orngea.  fast as wind.  smart as rob m.  and stupid as a bum!,130,2.4273531436920166,3.642990112304688,3.242448091506958
42872,My ant,tyler,5,shorter than a giant  shorter than a tree  shorter then a bee that's how my ant can grow to be. ,98,3.0619242191314697,3.079618215560913,3.197639226913452
16318,My rabbit,tyler,5,mybunny has a red nose and alittel tail .  he's the best rabbit beeter than a dog becaus he acts like a dog and eat's like a pig a big pig hes the best. . . . ,157,3.457748413085937,3.360069751739502,3.3160319328308105
55393,My nameis tyler karlskind,tyler,5,my name is tyler k. ilove to run and play i'm very athletic and i love to make that basket i love baseball i also love to break your nose in face for real that's they true tyler k,181,3.7062363624572754,3.600144147872925,3.403918743133545
53914,Dog,tyler,5,"the dog chases the frog as it jumped into a log.  the dog went back into the deep fog to look for another frog,  but instead it encountered a hog who scared the dog.  the dog ran home.  the end. ",193,2.5697641372680664,3.233671188354492,3.0052506923675537
47613,The Lonely Dragon,tyler,5,"i am a lonely dragon  very lonely indeed  and when people see me  they spite at what they see   i live in a cave  dark and cold  and i sit here  so i won`t be told.   i am a lonely dragon  sitting in my cave  but then one day a girl came  in and gave a little wave.   i am not a lonely dragon,   now i have a friend  and now i know our friendship  will never end. ",364,3.0441811084747314,3.272023200988769,3.104498624801636
37286,I Made a Mistake,tyler,5,i went to walk my dog but i made a mistake and walked the frog.  i meant to go to school i made a mistake and went in the pool.  i meant to lock the door but i made a mistake and locked my drawer.  i meant to go to bed i made a mistake and woke up with no head.  i meant to pet my cat but made a mistake and shaved the cat.  i gave my mom a hug but made a mistake and gave her a bug.  i went to my room but made a mistake and tripped over the broom.  i went outside to play but made a mistake and fell in the lake. ,510,2.5256142616271973,3.16597318649292,2.94618558883667
95151,My Dream Car,tyler,5,my dream car would be a lamborghini murcielago.  i could hear the roar of the v-12 engine and see the shine of the bright headlights.                              i could see the sparkling of the chrome wheels and i could see the clean and sleek windshield.                           that would be my dream car. ,311,3.4866199493408203,3.359439849853516,3.2628893852233887
41694,Useless things,tyler,5,a horse without legs  a chicken without eggs.  a person without eyes.  a bakery withot pies.   a guitar without strings.  a bangs without a bings.  delaware withot dover.  this poem is over. ,187,2.852207660675049,2.982706308364868,3.0966742038726807
101512,Bob,tyler,5,here lies bob.  he really was a snob.   his private jet hit the ocean.  they didn't use a potion and now he's dead. ,115,2.2701079845428467,3.250929832458496,3.017693281173706
50371,Glasses,tyler,5,glasses are wird glasses are a pain but it help me play my game football it the same when you losse your glasses it a shame when you go home your mom  and dad well be nsian they will say your not  responible for your things. ,227,2.678739547729492,3.142055034637451,3.066899061203003
28299,The crook,tyler,5,one day i saw a crook.  he took a red jewel.  he was smiling until the cops came and hopped out of their car and took the crook to jail  and put him for sale. ,160,3.412287712097168,3.390644788742065,3.232002019882202
50248,The fly,tyler,5,"the fly is buzzing by me he siting right besideme buz, buz, buz to bad hes my cuze or i wold snap and splat hes back that a fact. ",130,2.650057315826416,3.3875598907470703,3.18166184425354
54985,Fall,tyler,5,"whirling winds,  falling leaves.  this is a sign that fall is here.  school starting,  halloween almost here.  fall has to be here.  fall is far,  fall is near,  fall is there,  bur when will it be here.  finally finally,  fall is here.  fall is far,  fall is near,  fall is there,  and fall is here. ",288,3.3427984714508057,3.296383857727051,3.2334578037261963
64137,Football,tyler,5,f un sport for fall o utrageously fun sport o ut side sport t oatly fun b ad when you get hurt a s fun as lazertag l ots of fun l ots of $cash$,146,3.656160831451416,3.5297605991363525,3.351195812225342
42482,Road,tyler,5,"the road goes on and on down from the door where it began now far ahead the road has gone,  and i must follow if i can,  purcuing it with eager feet,  until it joins some larger way where many paths ands errands meet.  i cannot say. ",231,3.033021211624145,3.2143959999084477,3.182501792907715
119491,My dog mya,tyler,5,my dog mya.  she is adorable and small her face is round just like a ball.  when i throw the ball she runs after the ball.  she is playful and funny just like a bunny. ,167,3.8037304878234863,3.488030433654785,3.2789652347564697
93872,The Fish,tyler,5,the fish was dead.  the fish had no head.  the fish had his own bed.  the fish was fred.   the fishb happy,105,3.483414649963379,3.284706354141236,3.2768800258636475
94008,Pencil,tyler,5,a pencil is used for writting  so do not use it for bitting it it used anywere at all  so go have a ball anywere  but remember bring a pencil,144,2.976529598236084,3.0365262031555176,3.3026812076568604
58714,My dog,tyler,5,i have a dog his name is ranger he keeps me from danger from a stranger. ,75,3.30318021774292,3.255476951599121,3.302597999572754
91254,Camping,tyler,5,"adventure, exercise&lt;br&gt;exploring, fishing, hiking&lt;br&gt;an interesting experience&lt;br&gt;exploring",109,3.5471649169921875,3.2599356174468994,3.277763605117798
24016,THE DRAGON,tyler,5,for every knight i annihilate i grow.  i guard the jewel of sorcery.  to get the  i am a dragon from long ago.   jewel you must kill me.  the king of castle zee.  is very very greedy.  i laugh with glee.  when the knight finds that he cannot beat me.  i guard it for the humans safety .  for if a human gets it human life will no longer be.  the king is foolish for he will get the jewel of sorcery.  for he is infinitesimal unlike me!,428,2.968347549438477,3.689544200897217,3.3202383518218994
93677,Basketball,tyler,5,i love basketball but i am really small but i no im the best of them all i usally shoot the ball  with them all i no i need to share the ball  like a team we alway share but we always share i love to play basketball but with to balls is more fun at the end i get a hot dog with a bun and i go to my friend kun we always have fun with kun we always have hot dogs with buns,374,3.7153878211975098,3.520082950592041,3.393737554550171
105691,A Monkeys Life,tyler,5,"monkeys have a cool life,  but i think they have head lice.  they always stratch and stratch but never stratch their backs.  i think its kind of funky,  but hay. . . . . . . . .  that a monkeys!",184,3.138601064682007,3.453817367553711,3.230983257293701
42767,Outer space,tyler,5,in outer space its no gravity.  you can't walk in space you just float around like a boat. ,92,2.847784280776977,2.940234422683716,3.002160787582397
93865,The Fly and The Guy,tyler,5,"there was a fly that said ''hi'',  the guy said ''bye fly'',  the fly flew by,  while the guy ran by,   the fly few by the guy's wife,  his wife said ''shoo fly'',  the guy ran by the tie's house,  the fly flew with one eye",227,3.1083226203918457,3.226801872253418,3.145953416824341
19917,Stick man,tyler,5,"you donâ’t know where theyâ’re facing,  unless you see their nose,  thatâ’s their only facial feature  that they ever show.  they do a lot of things that we normally do,  like jumping,  skiing,  and even the matrix too.   these crazy little doodles are playing twenty-four seven,  if you were to visit them you would think that youâ’re in heaven.  they are absolutely normal just like us,  they run,  they jump,  they swim,  and even miss the bus.  even though theyâ’re drawings they can still do anything,  they can surf,  skateboard,  and maybe even swing.  if you want to make them,  just grab a piece of paper,  draw a head then some lines donâ’t forget the nose.  next you cut him out and heâ’ll come alive,  i suppose? now you have a stickman,  now go run and play,  shouldnâ’t be bored,  forever more.  now have fun for the rest of the day. ",825,3.3717055320739746,3.359736442565918,3.3118550777435303
40036,THE DARKNESS,tyler,5,the darkness has smartness but the smartness has no darkness when the smartness is in the darkness. ,102,2.9661927223205566,3.0258288383483887,3.1450765132904053
47158,When my brother sleeps in bed.....,tyler,5,when my brother sleeps in bed he just looks like he is dead.   he won't get up to eat some bread.  you can scream you can shout  he won't get up if he were in a pig snout.   the only way he'll get up is if you say he'll blow up. ,228,2.315025806427002,3.505552291870117,3.07905650138855
15684,Mixed  Dog,tyler,5,a small  dog got  stuk  in  a  log like  a  big  hog and  ate  a  tiny  frog. ,80,2.640724897384644,3.112111091613769,3.052126169204712
61822,Louder than a clap,tyler,5,louder than a clap louder than an eagles scream.  louder than a dragons fire.  or a dozen football players,107,3.020429372787476,3.442573547363281,3.1575381755828857
114061,Tyler&apos;s pieí ½í¸±í ½í¸±í ½í¸±í ½í¸±í ½í¸±,tyler,5,"pie is sweet it , taste like feet,  my pie flew high in the sky,  it's nose was big,  it had a little jig,  it's head was gigantic, and looked like the titanic",156,3.569880723953247,3.6009345054626465,3.2711644172668457
33948,I love basebal,tyler,5,i love baseball hearing the cracking noise of the bat i love baseball  the crowd going crazy after a home run i love baseball  someone getting a game winning hit i truly love baseball!,187,4.353327751159668,3.899215936660767,3.4970853328704834
120714,The Bush,tyler,5,"hold up everybody be quiet don't want the enemy seeing me spying silencer on the pistol,  you on the ground crying flying off of launch pads landing in  the trees snipe from above picking through the leaves playing hide and seek,  yeah i'm deadly with the squeeze listen,  you can look around but you'll never find me! ha ha!",325,2.9591739177703857,3.720073938369751,3.251160860061645
49385,Meerkat,tyler.a,5,there once was a young meerkat who got in to lots of trouble. his name was neo he was like a punk type of meerkat. so one day that all changed he turned into a nice meerkat. ,174,3.345609426498413,3.212777137756348,3.237456083297729
102681,Double Bubble,tylre,5,double bubbles find double bubbles puppies to play with.  as the bubbly bubbles play they find other doubles to play with.  the bubbly bubbles find pickles to double bubble with.  in bounced a bubbly bubble catcher and popped all the bubbly bubbles,249,3.4553539752960205,3.208634614944458,3.274881601333618
