id,title,author,grade,text,char,valence,arousal,dominance
96285,Love,la&apos;jean,6,"love,  what is love?  do you want to know about love? well,  love is companionship and commitment.  love can hurt.  love can stink.  love can be happiness.  love can be joyful and surprising. ",192,3.866764068603516,3.626260042190552,3.3148739337921143
87335,Dog,lacey,6,chasing frog on the log i see them jump watch out for that bog they look like a big lump,91,2.8357162475585938,3.2092504501342773,3.082779884338379
88256,Lacey,lacey,6,l-loving for animals a-awesome with babys c-cool e-exciting to have fun y-yorkie lover,89,4.196410179138184,3.627756118774414,3.3998591899871826
92138,On the cay by the bay,lacey,6,"one hot day in may my friends decided to play,  down by the bay.  they got tired so they layed,  on the cay.  i wanted to go but they decided to stay!  hey, hey!",159,3.500950813293457,3.631908416748047,3.280580282211304
61866,me,lachandra,6,"im pretty,  im cute,  im talented,  im myself,  im interested , im curious , im suspicious , im satisfied,  im thankful , im greatful , im lachahndra. ",143,4.11997127532959,3.6867518424987793,3.356117486953736
36861,It Will Get Better,laci,6,"sometimes i have bad dreams and i get a little paranoid,  sometimes i hear screams and want to run and hide.  nine,  one,  one has changed my life now i won't take a chance,  people always say to move on,  but it isn't like being dumped at the valentines dance.  you just cant move on all the way but you get a little better,  when i am grown i`ll tell my kids that its always a good thing even if its bad at first nine,  one,  one made me think of the kids that are dying of thirst.  so remember the good,  remember the bad but never get low to where you're always sad. ",561,3.1451733112335205,3.491718292236328,3.2263340950012207
28754,Whos That Man?,laci,6,whos that man that sit in thaat chair whos that always makes everybody laugh whos that man that loves everybody  whos that man that everybody loves you will never know he gone for now,186,3.2010693550109863,3.263824224472046,3.1735026836395264
53507,Secrets lay ahead,lacie,6,secrets lay ahead finding prints to the solution secrets lay ahead carrying not a burden but a reward secrets lay ahead of something worth while or something you would consider unclean but today you will consider a good solution to a great thing today you will consider the reward today you will consider the thing worth while today and everyday,348,3.3513128757476807,3.241497039794922,3.316257953643799
53510,Never leaving,lacie,6,im never leaving this place i never want to go i thought you would know im never leaving this place i like it better when we were home in our house i like it better when kitten was chasing the mouse,201,3.06262731552124,3.4322242736816406,3.163831949234009
43166,It had to end,lacy,6,i loved you.  you loved me.  but    it had to end.  because another girl stood in our way till today. ,101,2.74997615814209,3.3716742992401123,3.051685094833374
43169,Why???,lacy,6,why did you go.  you left with the flow.  but still why did you have to go?,76,2.62184476852417,3.0677945613861084,2.9743714332580566
102968,My mom,ladrea,6,i love my mom yes i do but sometime she can be mean but i love her anyway yes i do,85,3.745251178741455,3.406898021697998,3.3268730640411377
113278,Reading,laiba and faiza,6,reading is my favourate hobby i like mysterious and funny books  i like to read them when i am free or bored  better to read books than wasting time because they are our best friend,184,3.704751491546631,3.3738083839416504,3.3502066135406494
106272,Papa died,laiken,6,"papa when you died,  i cried,  you lived your days through and wide,  when you got done you came inside,  you went here you went there,  that leaves us to say you went everywhere,  no matter if you are near or far i will always have you in my heart!",246,3.316093683242798,3.6101231575012207,3.268284797668457
46462,Emotional,laila,6,i cry to now my mom has cancer.  i ask her why? she has no reply! i am scared she will die  i cry to see her lie  the doctor said the time is know  there is no other time to say good bye  i cry i cry,201,2.0232162475585938,3.590592384338379,2.797210454940796
107544,Believe in yourself,lailah,6,"believe in yourself,  because there is only one of you.  believe in yourself because you should know what to do.  believe that you don't have to act like a fool to be cool.  never let anybody boss you,  which you should never let.  believe in yourself because you are you. ",269,3.2063651084899902,3.343116283416748,3.455052137374878
65165,What am I?,laina,6,"this instrument is not a toy,  but playing it brings great joy.  it's played by adults,  boys,  and girls,  and your heart will begin to twirl.  this instrument has four strings,   at the end of the song it will zing. ",213,3.898568630218506,3.681802272796631,3.400597333908081
84928,Friends,lak &amp; rachel,6,when you are blue  friends are true  try to be kind   they won't mind  try it today  you might be repayed,108,2.964374542236328,3.040231704711914,3.1704697608947754
33569,Anger,lakedra,6,"anger is an expression.  it expresses time &amp; time again.    it could be towards an enemy.  it might be towards a friend.    anger is deep down.  deep down in your soul.    and if you don't make it up,  the anger starts to grow.    you feel like hitting and kicking.  hurting someone, you right now hate.    you actually can't explain it.  so put it on debate.    this expression,  is expressed by feelings.    i hope,  you are willing,    to except anger.  anger is being mad.    it also makes you  sad.  if someone hurts your feelings or emotions,    it makes you want to get a notion.  this is my definition of anger. ",604,2.4271371364593506,3.372791290283203,3.1646950244903564
33447,Everytime,lakedra,6,"everytime i see your face,  my memories start to erase.    everytime i hear your voice,  other things get sort of coarse.    everytime i see your eyes,  oh your eyes, they hypmitize.    everytime i lose my dignity,  oh you're my rymady.    cause i love you,  and you love me.    it's the way, it's suppose to be.  everytime it's you and me. ",330,3.7142157554626474,3.7136969566345215,3.3317644596099854
69258,Flower,lakeesha,6,i see purple  i see blue i see a flower so cut and smells good too,69,3.849196434020996,3.542027473449707,3.341603755950928
30040,Night Bright,lakeshia,6,as i see you in the night it makes me start to fright.  i guess im not the bades type that makes me want to fight.  im not the girl you have been thinking of i am not the star above.  you see me in the darkness night maybe im not so bright but i will be shining in the night to see you all to night so go to bed and don't wake up till the sky is bright. and i will be back some time to night so get thoes questions right,419,2.8448076248168945,3.401540994644165,3.1817800998687744
80942,Fight,lala,6,"fight till the light is gone,  fight for rocky",48,2.938377857208252,3.357261657714844,3.3469159603118896
48275,Roses,lameshia,6,roses are red and violets are cute mothers are sweet and i love you     happy mothers day !!!!!,98,4.509138584136963,3.9447500705718994,3.43466591835022
31486,M IS FOR MONKEY,lamont,6,m is for monkey ti's good enough for me.  oh m is for monkey it's good enoughfor me.  oh m is for monkey it's good enough for me.  oh monkey monkey monkey monkey monkey. ,169,3.4264845848083496,3.2037482261657715,3.270132064819336
83386,Mom,lana,6,my mom is great  she loves to paint if she'll mess up her happy face will be a lump,86,3.757458448410034,3.4997329711914062,3.3472156524658203
51883,I dont love you,lana,6,"life is not fair,  live with it,  is it fair that your heat beats,  and mine does not,  mine has not  beat from that day,  that dreaded day,  when you said those words,  those four dreaded words,  i dont love you",207,2.258634090423584,3.548095226287842,2.9005396366119385
51895,When you ...i wish,lana,6,"when  you dont listen,  when you dont notice me,  when you dont talk to me,  i feel invisible,  i wish you would notice me or talk to me",135,2.4937047958374023,3.2389607429504395,2.9219648838043213
100296,My Hamster,lance,6,my hamster was small and brown he heard me walk into my room he saw my whole house he wanted a small little squeaky toy my hamster was small and brown he pretended to be a dog he felt my warm cozy bed he liked to touch my shirts he cried when his leg broke he understood if i wanted to sleep,294,3.276456832885742,3.326742649078369,3.074580192565918
85182,Who,lance,6,who can play the yoyo very good from here out to china?          i can! who need learn the english in this beautiful city?          i did! who will fly and have muscle and want to be the hero!          i will! who can sit and watch tv all day          i might!,263,3.544229507446289,3.730692863464356,3.4021551609039307
85397,Life in the fast lane,landon,6,"on top of a snowy mountain a guy coming down on skies,  swish slash coming fast.  he was like a deer coming so fast. he looked like lighting flashing out of the sky. oh how fast life passes you by. ",197,3.111311435699463,3.5101873874664307,2.979997396469116
48352,The book and the bookworm,landon,6,a book on how to cook the bookworm  the book worm is reading it look he found a recipe for black eyed peas the was put on a hook,131,3.217303991317749,3.068034648895264,3.2412004470825195
114803,Fish In The Sea,landon,6,fish are smart and fast.  in a race their never last.  they find a way to win.  with their tiny little fins.  fish are smart and fast. ,137,3.5995993614196777,3.4682414531707764,3.349663734436035
114586,I am supper croc,lane,6,i am supper croc who will i eat next  will i go away  i try to make friends i just eat them i am supper croc,111,3.1850128173828125,3.128448963165283,3.197622776031494
17007,Water Angels,lani,6,a graceful water angel  gliding through the sea  ever so peaceful  and happy  they take life as it comes  and mourn as it has passed  then a new life begins  a new door opens   for the sea and its inhabitants  forever calm  an ever-lasting family,252,3.935482978820801,3.5861449241638184,3.311141967773437
110366,I am poem,lanni,6,"i am caring\t i wonder if  i will get into nyc collage\t i hear  the whistle of the wind  i see the stars shining in the sky at night  i am amazing  i pretend that i am superman  i feel  grouchy in the mornings  i touch  my cats  fur  i worry that my brother will get hurt  i cry  when bad things happen in life  i am understandable  i understand  people canâ’t always get what they want in life  i say  â“go with it and something good will come of it. â” i dream  one day i will live in manchester,  england  i try my best in school  i hope  one day my brother will do something great  i am  hopeful and unique",618,3.579963445663452,3.617595672607422,3.2713797092437744
27814,FUN,laquan,6,fun is a time when your not feeling sad.  fun is a time when you are with your friend.  fun is when you're having a good time.  i like fun. ,139,4.032630920410156,3.538931369781494,3.3417346477508545
66009,BASKETBALL,laquan,6,when i come down the court everbody saying my name when i pass the ball they say quan you lame then i say who is to blame then i say you mad because i got fame,162,2.414361000061035,3.4505248069763184,3.170959711074829
45617,The hardships of love.,laquentin,6,grass is grass blueberries are blue i have something very important to tell you. you might not like me but my heart is with you and if your heart changes    mine will still be here waiting for you. ,199,3.355868101119995,3.3757925033569336,3.338637590408325
83738,The World,laquisha,6,"the sky is so beautiful in the day and even more at night when it is raining,  thundering,  and lighting,  it gives me a fright when the sun is shining,  the plants will grow even plants need rain you know sunshine or rain,  snow or slet the world is a big place,  that we neat  the world is a busy place,  as busy as thousands of bumble bees the world is always rotating around and around like a kick ball rolling on the ground the world is a place where i live,  i wouldn't have it any other way goodbye for now and have a worderfully,  terrific day",545,3.707809448242188,3.568382024765014,3.3027498722076416
40045,My Cat,lara,6,"she looks like a beautiful lion headed creature,  fluffy tail,  and her spots make her look like she jumped into paint. ",120,3.4200668334960938,3.397511959075928,3.1712331771850586
52513,My World,larisa,6,"my world is a place where my dreams come alive,  from mermaids and fairies and unicorn springs,  from dragons and witches and little short things. ",147,3.741295337677002,3.5430922508239746,3.2946419715881348
73469,When I,laronn,6,"when i grow up i would like to be a basketball player,  basketball reporter, basketball trainer,  or even a cheif were i can  cook to my death football player , football trainer  football reporter,  but what  i probably want to be when i  grow up have not come yet",263,2.9217920303344727,3.2193260192871094,3.151089191436768
66805,Karla,larraine,6,"my dog karla has long ears.  when she does something funny it brings in tears.  karla really small,  and not that tall.  karla is black and brown.   what good colors is that. ",172,3.514763355255127,3.3386263847351074,3.2206082344055176
77463,Baby Sister,lary,6,i was sucking on a lollipop.  when i saw the strangest thing.  it wasn't like you or me.  it wasn't even a human being.  it was small and never would ever speak.  was it a he or she? it was my baby sister.  and she looks alot like me. ,232,2.9652106761932373,3.3004150390625,3.0200207233428955
93812,Grape Juice,lasca,6,"my mother,           she made a sign,            no more coke,          my father. . .  we had a talk,            i should not smoke.                      i'll miss the coke,  but smoke?!            now i'll have a phlegmy head,                when i go to bed,      oh well. . .  i'll grape juice instead!",295,2.804502487182617,3.26442813873291,3.210716485977173
95301,A funny cat,lataiya,6,their were a funny cat.  she was walking down the hall way and saw a big funny honey money cat . she was so mean she had kid out the big funny honey money cat. ,160,3.560204267501831,3.5023913383483887,3.238319158554077
17790,The Dogs,latasha,6,"my dogs are fluffy they like to chew on their bones they play with my cat they eat grass my dogs are black and brown they hate the trains loud noise my dogs like to sleep they love to chase groundhogs,  rabbits,  squirrels,  and birds.  and i really love them!",259,3.918593645095825,3.696433067321777,3.3608028888702397
18547,My  cat,latasha,6,my cat lives in a hat.  that cat is really fat.  he sat in a tree.  had a big laugh and fell on a dog.  then he went into the house and fell into a fish tank. ,157,3.1988019943237305,3.37403416633606,3.1210711002349854
107334,Traping,lathen,6,trapping is fun trapping is great excitement and fun winter and spring summer and fall,90,4.106895923614502,3.6641056537628174,3.440984010696411
15175,LATIFAH FUTURE,latifah,6,"latifahs  future           my future             a star is what i wanna be           like ashanti and aaliyah            maybe even bigger                           i want fans screaming                latifah latifah             throwing me roses              red, white and pink               a star is what i wanna be             like my very own me thatâ’s what i wanna be a growing star  poster signing ssh people screaming ahh fans fainting huh and a sigh of relief  maybe ill add a clothing line sean john is pretty good nah ill stick to what i know singing is me a star to be",614,3.464194059371948,3.443815231323242,3.262953519821167
15238,The heart beat,latoya,6,my heart beat every time some ones says somrthing i do not like but ikeep to my self so i would not get in trouble i do not say much but here's something i can say my heart is a speacil heart that is what i must remand,222,2.904411792755127,3.3350131511688232,3.2292754650115967
48199,Brown,lauen,6,brown is:     as musty as old books     as filthy as dirt     as dark as my hair,83,2.434307098388672,3.126190662384033,3.0222058296203613
73980,My cat and his hat.,laura,6,"i have a cat that has a hat and loves to play with his hat on my mat.   i use my bat to scare off some cats that try to take the hat off my cat.   one morning i had a little troble with trying to find my cats hat.  i found my bat and went to find my cat, but then i saw it under my mat.   i told my cat that i found his hat and he jumped and leped on to my mat with the hat. ",372,3.012076139450073,3.309347152709961,3.2032101154327397
85739,Beauty,laura,6,the sunset rolls in.  magic colours paint the sky.  beauty shows its life. ,75,3.9609336853027344,3.61478328704834,3.313497304916382
48827,&apos;&apos; Old Not True Beliefs&apos;&apos;,laura,6,"i used to believe in the boogie man,  but now i know that he is not true.  i used to get my dad to look under my bed,  but now he would say,  ''i told you!''  i used to believe in fairy tales,  but now i know that there are gone.  they are only in books and movies,  like bambi the baby fawn  i used to believe in santa,  but now i think he's such a fake.  i always see my mom and dad,  eating santa's cake  i can't believe i believed it,  i believed everthing they said.  it's just so hard to think about,  but it is out of my head.  so don't try to fool me,  because now i know it's not true.  now if you come up to me,  don't say,  ''i told you!''",635,2.686091661453247,3.372096538543701,3.107454538345337
46831,Daisy,laura,6,"a chocolate milk cow named daisy is a pet of mine who is lazy.  she sleeps in every day,  and eats a lot of hay but i will always love her,  maybe. ",147,3.274737596511841,3.127857446670532,3.1819589138031006
93243,Zack,laura,6,i shine in the sun light  im as golden as golden gets i was found with half my tail cut off i ran away one day bam!!!! i crashed into a car i have a good friend beautie she's a coal black color like the pollution in the air i can make the puppy dog face  why all my kind can do the same  im a dog and zack is my name,319,3.29089879989624,3.666449069976807,3.27628755569458
47298,Clay,laura,6,"playing with clay,  forming and molding it into pottery and sculpture.  symbolizing creativity and new life.   starting out soft and pliable,  i pinch crush and squeeze you,  turning out stiff and new.   i coil and shape you into a beautiful vase,  adding designs applying a coat of colorful gloss,  acting like a shield of a reflecting rainbow from a gray dull endless sky   finally,  after dabbing you with water,  i look you over inserting you to the burning kiln.   waiting for you to steady yourself in the kiln with the hazardous heat,  i start to think about my next clay project. ",579,3.39404034614563,3.2560129165649414,3.2961575984954834
30653,Friends,laura,6,they can keep a secret.  they are happy to see you everyday.  they call you mostly everyday.  and they will be you friend no matter what happens.  they think of you always. ,173,3.7147412300109854,3.374681234359741,3.285853147506714
85938,BIGGER***,laura,6,"bigger than the sun,   bigger than the sea,  bigger than the galaxy,  and louder than your dreams!!!",100,3.678279876708984,3.8520255088806152,3.368874311447144
92568,Eerie eyed cat,laura,6,"the eerie eyed cat,  stares at you from his mat,   like the king of the house,  he can catch any mouse,   his name is harry,  that no surprise because he really is hairy,    striped black and gray he eyes his pray but then decides to call it a day",247,2.9753870964050293,3.268653154373169,3.138664722442627
92567,The problem with Waffles,laura,6,"almost every morning,  my mother feeds me falafels,  but me,  i prefer cinnamon waffles.  i tried eat my waffles in bed,  but then my mother said:",144,3.088578701019287,3.1581430435180664,3.193676471710205
92566,The Dog,laura,6,"isoceles ears,  has no fears,   twinkle toes,  no on dares to go,   for her bark is vicious and her dog food nutritious,   her eyes are daunting,  wanting your food,   the dog with the twinkle toes,  i don't think i will go. ",219,2.5050408840179443,3.408942937850952,2.983170747756958
52987,Tsunami,laura,6,something catastrophic has happened to us! crying now and emotions still ni a fus. i'm standing here on this very peak! just thinking about it makes me weak! i fear today i fear tommarow i life of them i don't wish to borrow,226,2.037686824798584,3.68996524810791,2.828798055648804
44744,The Frogs,laura,6,"there was a frog,  his name was jim and all day he sat on a basketball rim jim had a next door neighbor george was his name,  it gave him flavor for these two frogs were the only ones who had names that were actually fun they ran away from terrible trouble and didn't play in the garbage rubble so they lived happily ever after  in the gutters and the rafters",360,3.4624176025390625,3.2789511680603027,3.256192445755005
29689,Bow Wow,laura,6,"i need a home! i'm big but loving. . .  i'm fast but fun.  friendly is my name.  i'll keep you save from harm,  sleep with you at night.  i'll keep clean and fluffy; i'll give kids rides, inside and outside.  friendly is my name. . .  please take me home!",247,3.896195411682129,3.729669094085693,3.412936210632324
76616,Time Past,laureen,6,the raining clouds came\t                \t into a dry land to rain \t\t\t     it rain for days\t\t\t,104,2.8322198390960693,3.023324966430664,3.0534474849700928
35219,I Love My Dad,laurel,6,"i love my dad.  even when he gets mad.  that's why he has his own day he's been waiting since may.  i love my dad so,  like chocolate chip cookie dough. ",151,4.04926061630249,3.686103343963623,3.386518716812134
24158,Teachers,lauren,6,"some teachers are blue some teachers are new some teachers are cool  some teachers have had a gunfight dule some teachers are mean some teachers are nice  some teachers eat food with very weird spice some teachers are spanish some teachers are not some teachers have dresses with poka dots some teachers are great,  especially mine my teacher when in the jungle can swing on a vine",383,3.518555164337158,3.3249568939208984,3.273942708969116
110194,Volleyball Hiku,lauren,6,i love volleyball volleyball is amazing volleyball is life,61,4.288417816162109,3.7924227714538574,3.462143659591675
102309,Spring,lauren,6,as the warm sun beats down on my face i feel the soft grass under my bare feet and hear the bark of our neighbor dog mace summer just can't be beat!,151,3.789216279983521,3.7383127212524414,3.3444809913635254
20427,My Brother&apos;s Trophies,lauren,6,my brother's trophies are big and shiny they stand upon a shelf and even though i have some ribbons i wish i had trophies myself. ,132,3.29226016998291,3.301631450653076,3.258878231048584
20429,Stacks of Cards,lauren,6,my cousin has some trading cards the stacks never end they go up into the sky with lots of curves and bends!,111,3.348208427429199,3.425955295562744,3.246821165084839
20474,My Texas Haiku,lauren,6,the trees are pretty outside it is very hot that is my texas. ,64,3.290689706802368,3.116734027862549,3.1351253986358643
22592,I love you and I hate you!!!!,lauren,6,"i love you! i love when you talk to me.  i love you when you stare.  i love you when you turn around and look up at me when i'm looking down.  i love you.  i love the way you brush your hair.  and the way your pearly whites are.  i hate you! i hate the way you don't hug me.  i hate the way you don't love me.  i hate your corny jokes.  when i'm standing by.  i hate your stupid comic books; and i hate the way you don't brush your hair.  i also hate the way you brush your teeth.   i hate the way i wrote this poem; it even makes me rhyme,   it also even makes me cry.  i hate the way you don't even know it when i do! i hate you and i love you!!",636,3.684523582458496,3.91418194770813,3.3536555767059326
48147,Dancing,lauren,6,"dance  you move gracfully to the melody,  as you cleverly come up with rythmical steps,  that match the tonal pattern of the music.   whirls of color blurr your vision,  as you spin faster,  faster,   and faster still.   you stand on point,  and spring into the air.  your leg is like an arrow laced with ribbon,  aiming for the worn-out,  wooden floor.   your hair is flying behind you,  as if trying to break free from the wind.  you land in perfect position.   back arched,  toes pointed,   head thrown back proudly.   dance",513,3.297421455383301,3.486003875732422,3.2315804958343506
112261,Fighting,lauren,6,fighting is just like dirt people making fun of your tee shirt  kids laughing in the hall always making you fall  the cause a rumor from a ''friend'' the relationship now an end  love takes them away  never saying it was just play   talking behind your backs  giving us panic attacks  a friend would never do this  when you see us you hiss   this talk is no longer  we have grown stronger  goodbye for now now go take a bow,430,2.598149299621582,3.50783109664917,3.038279294967652
103486,Perfect sound,lauren,6,the touch makes the sound black and white up and down sounds high and express the way you feel with a beautiful melody  the piano. ,133,3.8113644123077393,3.5086593627929688,3.3169119358062744
111541,Softball,lauren,6,the windup  the pop up you might get put at first if you trip in the dirt slide at third if your about to get out by a little yellow bird they threw it to the ground so you need to get down  don't miss the plate  cause it will be too late,242,2.6717214584350586,3.2115774154663086,3.113982915878296
