id,title,author,grade,text,char,valence,arousal,dominance
93256,SS Impossible,theresa,5,the impossible the unimaginable  has come alive  everyone knew it would  deep down  and here i float  in the middle of impossible  drifting though  impossible debrees  inhaling the impossible taste and smell of stormy salt  and hearing the crashing of waves  that i hoped never to hear  when it came you had three moments  three moments before you can't tell which way was up  and my mind is only here   the rest another place  another time  another world  and all the time i knew  that this flood would be here  that it would happen  that it was possible,559,2.73624324798584,3.381047248840332,2.9293758869171143
64060,Red Smarties,theresa,5,"when you eat your smarties,  do you eat the red ones last? do you chew them very slowly,  or crunch them very fast.  now can you tell me do you eat the red ones last?",166,2.9262583255767822,3.1394731998443604,3.165759801864624
50688,SPONGEBOB,thoel,5,silly poris orginized not boring gregarious energetic boating student ocean inhabitant baloney speaking,106,2.900825500488281,2.9676222801208496,3.210505723953247
32128,My Stuffed Animal,thomas,5,my stuffed animal is a puppy.    it is a dalmation.    it has lots of black spots.    my puppy stays  in my room.    he is white and black.    i flip him up in the air  and throw him up in the air and throw him up  in the air again,230,3.1155309677124023,3.1931047439575195,3.1980068683624268
24911,Stars,thomas,5,"stars,  i may,  stars,  i might,  i wish,  i may have a wish tonight.  from the stars up high and the wishes downn low you should always have something to know. ",157,3.350531101226806,3.204105854034424,3.254133939743042
58062,Tiny sheep?,thomas,5,"were is the tiny sheep is he hiding in the hay heep? her wool is white as snow its finly groomed,  not to hard to see will you bring her back to me?  please,  please help me!",175,2.959016799926758,3.4288997650146484,3.177675008773804
50287,My dog,thomas,5,i say go fetch boy he says bark bark he zooms by me to grab the flahing willow stick he gives me back a wet stick that smells like dog breath if i leave well i can't  he gets me before i reach the door even if i sprint if i get away the next day were out again so this is probley like a traditon to me my dog and i gladly playing fetch,338,2.8232855796813965,3.3511266708374023,3.1208016872406006
119936,my head,thomas,5,i love my head because whiout it id  be dead,47,3.753716945648194,3.5936708450317383,3.369404554367065
23856,Tasty Hot Chocolate,thomas,5,"iâ’m hot and brown,  people drink me when they frown.  you can drink me when itâ’s cold,  but,  iâ’m sorry iâ’ve been sold.  you pour milk in me to make me cool,  and you donâ’t ever drink me in a swimming pool.  i warm you up,  and people put me in a large cup.  you put whip cream on me,  and iâ’d be mad if you drank tea. ",318,2.946562528610229,3.2039873600006104,3.263219118118286
111400,Hunters Survival,thomas,5,"i put the shiny round in the  chamber as the hissing fit gets closer,  closer. . .  grave danger i think. . .  just do it! the short thunder from the 22.  fills the sky as the round rips pant the sft flesh.  defeated,  i told the dead rattlesnake.  defeated. ",250,2.7165098190307617,3.575561046600342,3.1932568550109863
22865,The Whale On My Head,thomas,5,"when i awoke one morning a whale was on my head.  i said, ''what are you doing there?'' it looked at me and said, ''your head tastes like a goldfish. '' the whale said, ''do i look fat up here?'' i said, ''yes you look like a cow!'' the whale finally rolled off my head and flopped to the kichen.  i said,  ''now what are you doing?'' he said,  ''i'm hungry for ice cream,  fish,  and meat!'' i said,  ''you're not getting any food unless you buy it yourself then!!!'' he said,  ''no!'' since he had an attitude,  i threw him out the door; and never heard from that whale again. ",567,2.581125974655152,3.703349113464356,3.223956346511841
37442,"Boom, Boom",thomas,5,"the lightning goes flash,  the thunder goes boom,  the man goes thumb thumb,  the rain goes splash,  splash and the tornado rips through and the thunder goes boom. ",162,2.7781577110290527,3.456544876098633,2.959768533706665
39943,A Crazy Leopard,thomas,5,"an angry leopard who lost his spots,  started cooking dinner with pots.   he had gone crazy mad,  which was really quite sad.  now we hope that his food doesn't rot. ",164,2.37322998046875,3.306785345077514,3.017363786697388
36006,Traveling,thomas,5,"i like to travel,   we travel all morning,   and we start by doing this,   riding our bikes up the mountains,   walking up streets,   playing with our dog named beets,    we travel thought tunnels,  we went wild safari trips thought the jungle,  and we meet the furry tiger named blip,  the day is coming to an end and it is time to start a fire so we do all the stuff over again,  we meet a tiger,   we went though the safari,  we travel though the tunnel,  we play with our dog,  beets,  we walk up the streets,  riding our bikes down the mountains,  and thatâ’s we end our trip,  so we start the fire,  put up the tent,  roast our marshmallows,  and tell funny hints.  we fall asleep in our tents and the next morning we will do it all over again. ",731,3.3688387870788574,3.2891016006469727,3.2370617389678955
115510,Dogs and Frogs,thomas,5,dogs are frogs they live in a bog under a log in the fog in a hog then the dog turned back into a frog went out of the hog  and out of the bog and began to sob then drank some nog,183,2.5817790031433105,3.085784435272217,2.952604293823242
26659,The Dangerous Device,thomas,5,the stapler is a sticking device.   it is not like a sticky glueing device.  you mostly staple into paper.  but not in somebody's index finger.   how does it shoot into paper? it dosen't go into metal devices.  but it it's like fang of a viper.   it's as black as tar.  you hit it with such force.  it could hit you in the tootsie puss.   so you better be careful.  or there will be blood all over the table. ,401,2.68212628364563,3.278451681137085,3.151539087295532
22755,Pizza,thomas,5,"almost every afternoon,  i eat pizza with a spoon.  every afternoon right at noon,  i eat pizza with a cacoon.   every evening right at five,  i eat pizza from a hive.  at night for a snack,  i eat pizza in a shack.   every morning right at six,  i eat pizza with toothpicks.  every evening right at eight,  i eat pizza on a date. ",323,3.3271732330322266,3.132511138916016,3.27104115486145
74501,Roses are Red,thomas,5,"roses are red,  violets are blue,  suger is sweet,  and so are you!",67,4.144444942474365,3.701519966125488,3.3453376293182373
74502,Roses are Red,thomas,5,"roses are red,  violets are blue,  you might like me,  but i dont like you!",75,2.550351142883301,3.4898247718811035,3.2805988788604736
89960,Average Day,thomas,5,i call my friends and go outside to play football.  i usually play near glendale mall.  when i am standing ready to run i see a man who is tall.  when i look for the football it is falling.  after my team scores i hear my mom calling.  we all run back and my friends go home because on time.  i look forward for the next day when i have a lime!,341,3.4909629821777344,3.532137632369995,3.2837183475494385
46140,Brother Love,thomas,5,when he was born i was happy.  now i still am.  i say it's dandy to have a brother who loves you like mine dose.  we are brothers forever. ,138,3.985605716705322,3.597073793411255,3.356794595718384
46141,Peeper,thomas,5,"peeper is a sleeper.  when all the other animals are playing, he's laying around all day.  but at night he wakes up and plays.  in the morning he goes to sleep and the animals would say peeper is a sleeper. ",205,2.9972691535949707,2.9692866802215576,3.069704294204712
88670,Death Star,thomas,5,it is a black fire a ball of blackholes it will devour you with all its might it will suck you into its core not letting you out until you are burned to the bone it is aware of you so don't imtimidate it because it will come for you,235,2.4785544872283936,3.4810752868652344,3.042438745498657
88981,Lynx,thomas,5,i walk i hunt i kill my prey  i eat i sleep i do this all day  you may mistake me for a bobcat but i have bigger pawas and will kick its butt. ,145,2.695259094238281,3.5116970539093018,3.3324732780456543
120748,Monster trucks,thomas,5,crash boom smash trucks gone  smells of fuel and fire yuck!!!  ears ringing hands in the air excitement!  i jump in the air!!!,129,3.386960744857788,4.067269325256348,3.323298215866089
21194,Nature,thomas,5,"a woodpecker pecking on a tree.    the rain pouring on houses.   the slimey goo is on you.    oh,  please what can i do?   you can do it,  it's all up to you. ",156,2.6985974311828613,3.3485875129699707,3.054847717285156
39178,Movies,thomas,5,"many people watch me some interesting,  some boring,  some funny,  some pointless if you have not guessed,  i am a movie i come in g,  pg,  pg13 and r kids springing out of their seats because they are terrified  popcorn flying all over the room everyone laughing and having a good time. ",289,3.78668212890625,3.6168737411499023,3.342254638671875
112520,Baseball,thomas,5,"baseball is a great game,  and on the back you have your name! the only reason you came is to play baseball with your team,  and if your keen,  you would try to hit the ball past the foul beam. ",194,3.752081871032715,3.631486654281616,3.4483892917633057
112611,If This Wasn&apos;t Me,tia,5,"if this wasn't possibly me,  who could i possibly be? am i a real coward? is my real name howard? or did i fall from a coconut tree?",134,2.3139381408691406,3.39843225479126,2.97999906539917
119776,My beautiful family,tia,5,"''i love my family a super bunch. '' ''they care for me,  they help me if i have injured myself,  and they always watch out for me,   also. . .  ''last but not least,  we both love each other a 100%!'' ''we are always going to be a nice family until the end!!!''",257,4.186423301696777,3.869791030883789,3.4250056743621826
51337,Best friends,tia and loren,5,best friends are forever  but sometimes however you may get into a fight dont worry there might be a bite presents on your birthday are really really cool its really fun when we both go in the pool watching tv with your best frends is fun you can throw stuff at the tv like a bun,282,3.961349487304688,3.706605672836304,3.3872745037078857
32238,Friends,tiana,5,"friends, friends always have friends to care for and have a good time with having friends are good to all ends always get someone special and they'll make you happy even by clapping.  i will always remember to have friends all the time every time each one special in every way each day my friends through all the ends. ",319,3.8839845657348633,3.465402126312256,3.352487802505493
111866,I&apos;m so mad,tiana,5,"i'm so mad everything stinks! i kick,  i scream,  and i throw things across the room! i'm so mad i don't know what to do!",122,2.175942897796631,4.0841169357299805,3.1516830921173096
92526,Wrong and right,tiana,5,why is something wrong and why is somehting right because if your not wrong your right so why is someone wrong and why is someone right,138,2.775625467300415,3.084590435028076,3.174577474594116
117477,Wonder,tiana,5,"i am a wonder the eye can see i am like you,  and you are like me  sometimes our differences start to show but i am a wonder,  we all should know",146,3.535638332366944,3.507387161254883,3.31071138381958
92522,spring,tiana,5,spring spring is so great beautiful flowers bloom in sun spring spring you are so fun,88,4.536790370941162,3.835070848464966,3.393473863601685
92525,Swimming,tiana,5,swimming swimming is so fun if i could swim every hour of the day i would swimming swimming is so fun. ,106,4.138204097747803,3.6948628425598153,3.362828016281128
81044,Friendship,tiana,5,friendship is something to      remember      and also is important to many people          you should always think about your friends becuase you wouldn't want to lose         them they are very speical people and everytime you get a new one make sure you remember them!,289,3.466977596282959,3.466482639312744,3.3707425594329834
107473,Acrostic poem,tiana,5,forever trusting  remember each other always is nice exciting together never keep secrets danielle is my friend  r&gt;,121,3.692924976348877,3.320396423339844,3.2793970108032227
117318,Flowers,tiana,5,"flowers are in the spring beautiful and bright different pretty colors orange, yellow and feels so right",106,4.101976871490479,3.5816545486450195,3.321231842041016
94413,Danceing,tiana,5,when i dance i feel like i am flying.  i feel as free as a peace of  paper flying in the wind.  spinning leepind leepind spinning.  dancing through the night dancing through the day.  all i do is dance dance dance!,213,3.806607723236084,3.794758558273315,3.3477256298065186
31816,Schools Out!,tiana,5,"no more schoolwork,  no more books,  no more cafeteria cooks.  no more reading,  no more math,  no more waking up  to take a bath.  schools out! schools out! everybody shout! shout! shout!      shout!",197,3.1570885181427,3.849044799804688,3.4338879585266118
107627,Cow from France,tiana,5,there once was a cow from france  who always enjoyed eating pants  she climbed on a wall   and had a great fall  oh what a cow from france,141,3.8328394889831534,3.561168670654297,3.3403470516204834
29963,If it got that thing,tiara,5,if it got that thing give that thing a swing  if it got that thing give that thing a change if it got that thing then you just do your thing,143,3.066502094268799,3.0099918842315674,3.2804863452911377
29964,Love,tiara,5,love is something that might bring butterflies to your belly or make tears go down your face love is something  that is great it's from your heart it makes you happy from the heart or make you cry love is joy you need to love like it's something great. ,255,4.352796077728272,3.958467960357666,3.4173483848571777
97167,Candy,tiara,5,candy candy every were candy candy in my hair.  candy candy i like to eat candy candy on my feet.  candy candy i made a big pit candy candy i think i'm going to be sick. ,170,3.213426113128662,3.51421856880188,3.2024247646331787
96913,My Silly Willy Dream,tiara and shannon,5,"in my dream i am flying on a purple dinasaur.  i'm twirling and swirling and going in circles,  i'm falling calling and cooking purple nurples.   the cat barks at me and it makes a scary noise.  the dog bites on his bone while the snail talks on the phone.  a monster comes and eats my brother out the door comes my mother.  my mother threw the monster through the air to the moon and he gets smothered- in cheesey juice.  the dinasaur flings me off his back and i am flying through the air.  i kick a dinasaur and land on a bear.   i hope i wake up-this i swear. ",557,2.9209132194519043,3.5109448432922363,3.061081886291504
91768,Cheerleading,tiarra,5,"cheerleading                pretty and nice     cheerleading is hard,  stronge, and fun              good and happy                  cheerful",142,4.026148796081543,3.540929079055786,3.339362382888794
14264,Maryland,tickle,5,"marylands going to win the national championship all over the states,  boy they are the best then no other basketball team",124,3.7593023777008057,3.651648998260498,3.490387439727783
42648,Weird,tierra,5,weird as a cat crying weird as a dog driving weird as a fly dieing weird as a crow rhyming weird as a man gossiping weird as a woman burglar robbing weird as a grown person whining weird as an old person needing grooming weird as a poor person and a rich person rooming  that is how weird my nieces and nephews are!,318,2.559725284576416,3.429882526397705,3.082942485809326
25370,My nightgown,tiersa and claren,5,i started to frown when i saw a clown  running through town in my nightgown it started to drown and i started to frown and there i was standing in town. ,155,2.289198398590088,3.3716304302215576,2.817552328109741
42533,Spring Break,tifanie,5,"spring break is my favorite break,  it never never brake! i like it very much,  it helps me get a crush. ",105,4.120504856109619,3.7535810470581055,3.4189469814300537
77531,Spaghetti Seeds,tiffani,5,these are the best spaghetti seeds the farmer promised me and each of them will grow to be a fine spaghetti tree.  i planted them a year ago that farmer is a phony i've not got one spaghetti tree just fields of macaroni. ,222,3.4401564598083496,3.3011131286621094,3.351496934890747
97290,Cheerleading,tiffany,5,red hot what we got  we got alot we got a team that's red hot  we got a team that's red hot are team is what? red hot are team is what? red hot are team is r-e-d red h-o-t hot   we can help is what we got  were good you know it  and we are here to show it,258,3.522045135498047,3.47375226020813,3.3541853427886963
97183,cookies,tiffany,5,cokkies are good  cookies are sweet  so are you it is good to eat,68,3.871840953826904,3.408137798309326,3.356802701950073
36462,There Once was a Cat,tiffany,5,"there once was a cat,  who sat on a mat,  that purred all day,  until it owner would say,  get off the mat,  you silly cat. ",122,2.581305265426636,3.291224241256714,3.194059133529663
59364,Snow,tiffany,5,"snow is white and soft it can also be fluffy thats the end of the snow ,  fluffy peom",87,3.27309799194336,3.0933988094329834,3.2245569229125977
15395,Today,tiffany,5,"today when i woke up i heard the wierdest thing.  little did i know all the hatred this day would bring.   today when i woke up was the day of an attack.  now all america is doing,  is trying to fight back.   tonight when i was in bed i heard a little voice.  it was president bush on tv telling people of our nations choice.   tonight when i was in bed now that i was asleep.  i knew tomorrow would bring sadness,  so tomorrow i will weap. ",436,2.3434643745422363,3.3660430908203125,2.9391019344329834
99953,Flowers for you,tiffany,5,roses are red like our love violets are blue like your shoe,62,3.288482189178467,3.0744123458862305,3.192445516586304
93297,Moutains,tiffany,5,moutains so high moutains so green i know you're looking down on me with your cold clear rivers and bright sun  you're a whole lot of fun. ,141,4.052028179168701,3.632885456085205,3.3548386096954346
86109,Cherry Blossom,tiffany,5,"cherry blossom,  cherry blossom.  a faded pink,   glowing against the dark blue sky.  cherry blossom,  cherry blossom.  growing in peaceful japan.  cherry blossom,  cherry blossom,  your name is sakura in japanese.  cherry blossom,  cherry blossom,  an anime character is named after you.  cherry blossom,  cherry blossom.  you are a symbol of love,  loyalty and samurai.  cherry blossom,  cherry blossom.  such a flower,  you seem as if you make everything seem bright. ",453,3.5167531967163086,3.2362756729125977,3.2274720668792725
16335,Puddy Bear,tiffany,5,i have a little teddy   he's soft and stiched with love    his name is puddy    and he's my buddy    and that is my song    he's matted brown-yellow    and quite a good fellow   he's huggable too   it's very very true   and thats my teddy bear,248,3.893226385116577,3.560902833938598,3.343338251113892
23473,I Could Care Less,tiffany,5,my brother is a pest even though he could care less! my dog is a pest . . . but i still could care less! my cat is a pest. . . but i could care less i guess! i am not a pest i could not care less! my vest is a pest zipping up or down. . .  but still i could care less!,262,2.177209615707397,3.773006200790405,3.308358907699585
35073,Julia,tiffany,5,"julia the sweet cat.  she loves to sit in a hat.  even if she is fat,  she loves to sit in a hat,  julia the sweet cat. ",118,3.790311336517334,3.354735851287842,3.248233795166016
114119,Math is hard,tiffany,5,math is hard  and math is fun math is a card and math is dum math is a pice of harder cake and math is a dummy cake,118,3.1470394134521484,3.04355263710022,3.1782219409942627
114578,Earthquakes,tiffany,5,"rattle, rumble,  shake and shook,  tremble, trouble,  scream earthquake!  beneath the earth,  nothing waits,  strike and slip,  plate tectonics. . . .  pushing, grinding,  will it halt? what will happen,  to the fault?  rattle, rumble,  shook,  and shake,  tremble, trouble,  scream earthquake!",276,2.6042017936706543,3.697741985321045,3.104690790176392
20615,Orange,tiffany,5,orange is the color of friendship with friends that stick together.    orange is the color of the sun that shines way up in the sky.   orange is the color of my family that i love so much!  orange is the color of things i do in my life!   orange is my favorite color.               what's yours?,295,3.970291376113892,3.656481027603149,3.3651442527771
100205,Your Heart,tiffany,5,look into your heart and tell me what you see.  am i still on your mind? are you thinking of me?do you wake in the night and let out a sigh? do you whisper my name and wonder why? icant be there with you with me hugging you tight. ,232,3.1151223182678223,3.531712532043457,3.1175084114074707
35493,One minute of sadness,tiffany,5,"when you get sad you think no one cares,  but they do brothers,  sisters when they are sad you help them and they return it to you only have one minute of sadness. ",164,3.074763059616089,3.1592321395874023,3.154057264328003
35494,Have Hope,tiffany,5,"have hope,  when your scared.  have hope when nothings going your way.  have hope when you think someone is going to tell on you for something you did not do.  have hope when you think you are failing. ",200,3.191945075988769,3.3271753787994385,3.190637826919556
101352,my heart,tiffany,5,hard to breath fills like floating i love math so much i keep on floating,76,3.8510549068450928,3.656487703323364,3.3245418071746826
84360,sisters,tiffany,5,"anyoing, playful, sometimes fun, nonstop, full of surprizes, it just them. ",72,3.83148193359375,3.5975124835968018,3.3012704849243164
73247,Tiffany,tiffany,5,"tiffany \t  caring,  smart,  brave \t sidling of   \t\t adam,  tasha,  todd,  jr.  \t lover of  \t pets,  summer,  spelling \t who feels \t kind,  like a winner,  careful \t who needs   understanding,  generosity,  people to care \t who gives \t  \tfriendship,  care,  happiness \t who fears  \t tornados,  heights,  mean stray dogs \t who would like to see \t\t worlds of fun,  adventure land \t\t\t\t\t\t\t\t",399,3.50137710571289,3.309452533721924,3.291330099105835
105880,Miss i didnt do my homework,tiffany,5,"one school day in may i traveld with my cousin shay then i remembered that i didnt do my homework. . .  it was hard explaining it to my teacher but i said  ''miss i didnt do my homewrok my dog eat it,  the chicken pick it and the cammel sat on it''  then after the whip sat on my behind leaving me with a terrible cry :(",321,2.176063776016236,3.375770092010498,2.8611977100372314
27732,My Shoes,tiffany,5,my shoes are black they came in a pack  my shoes have scrapes i think they need tapes  my shoes has brown buckel it's kind of like my knuckle  my shoes have little heals it's has small has little seals  my shoes are my shoes thei the shoes that i chose,255,3.011463165283203,3.0470457077026367,3.205908298492432
26780,Talented Family,tiffany,5,my family's very talented; i am certain you'll agree.  we each possess a special skill that anyone can see. ,109,3.735517501831055,3.4655652046203613,3.4146885871887207
14692,Afraid,tiffany,5,when i first saw you  i was afraid to know you   now that i know you  iam afraid to like you   now that i like you  i am afraid to love you  now thati love you  i am afraid to loose yoo,188,3.4066057205200195,3.6164417266845694,3.1892964839935303
62823,My Playful Legs!!,tiffany,5,legs are my favorite part why? run up run down run all around jump jump reach for the sky! joglaps around and around  play play lets play a game! looking at these little legs say what can they do? there's that playful spirit in you!!!,237,3.9176526069641113,3.8441920280456543,3.4246647357940674
100890,PARTIES,tiffany,5,"parties,  arcade fun rides to go on ttdes to watch it's all about you!!!!!! even presents to rip through start planning",121,3.740673542022705,3.76204776763916,3.4098708629608154
27888,MY FAMILY,tiffany511,5,my family is weird aunty lisa is very rare   my brothers are brats my cousin is scared of rats  my granfather drinks while my grandmother thinks  so now you see that i am right as can be,189,2.784867286682129,3.2571399211883545,3.118884563446045
101893,Scenery of Dawn,tiger,5,"mountains are high,  melt into the sky,  with their white hats as white as snow.  while very down low,  riding the seas,  racing the trees,  with their super green leaves.  the sun rises slow,  making the mountains glow,  reflecting like a piece of gold.  i'm lost in this scene,  stuck in a daydream.  everything stands still,  this beauty,  i want to forever hold. ",355,3.503201484680176,3.5096821784973145,3.216312885284424
102016,My House,tiger,5,"my house is empty,  though i have plenty,  just for you and me.  i have a television,  but it's not in your vision.  'cause it's inside the wall,  not in my big hall.  just press the large button,  it will show then,  so you can watch channel ten.  there is the kitchen,  with a hole like a mitten,  where a conveyor belt goes through.  it reaches the table,  just with one cable.  that's when we can have a feast,  where we all get to eat.  who wants to play golf? just go find the wolf.  he'll give you a ball,  just shout him a call.  there are more sports to do,  they are really fun too.  and then you can get a patio to rest.  isn't my house just the best?!",643,3.4432969093322754,3.280574083328247,3.323132276535034
101667,Riding Tornados,tiger,5,"riding tornadoes riding tornadoes,  looking for my small potatoes.  i am dizzy,  i need something fizzy.  i am here,  but i don't know where.  riding tornadoes riding tornadoes,  i have found my sweet potatoes.  they are still very sweet.  it is time for me to eat!",259,3.52746057510376,3.542700290679932,3.3007514476776123
