id,title,author,grade,text,char,valence,arousal,dominance
110985,Love blinds a kind soul,oscar,12,"she does everything for him  she puts him on a high pedestal.  she thinks nothing bad of him she will love him till the end.  he does not have a job.  he does drugs and has emotional instability he beats her up and makes her weep.  he gives her bruises and strangles her  yet she still cannot see he is not the right one.  she is now pregnant with his child.  she does not have a job any longer.  she lives with her mom and he lives with them as well she feels like there is no hope for raising her child.  he has neither car nor a truck she cheated on hi,  with a guy from starbucks he does not want to own up to these new responsibilities what can she do? she does not care what he does she will forever love him eternally. ",720,2.54443359375,3.452393054962158,3.0192928314208984
110986,My first Baby,oscar,12,"i remember the first time you opened your eyes.  hat sparkle in your eyes they were filled with so much love and hope.  your body fit perfectly in my arms.  that very first laugh brought me tears of joy.  those first steps she took were the most precious strides of all.  she had the cutest little toes and little nose.  i miss seeing her play with her light brown golden hair.  she was the happiest of children never would you hear her bother.  until she got sick and sad,  she never got this way she never used to whine.  there was something very wrong it brought us such sorrow.  the doctors explained that she would not have a lot of time.  we cried and never slept until that dreadful morning came.  the sun rose nice shiny and bright but our baby was lifeless cold and descended from this life.  never again will i see that small smiling face again.  never again shall i hear the pitter,  patter of on the floors within my doors again. ",930,3.676434278488159,3.6700034141540527,3.236563444137573
85107,The Crashing Game,osita,12,"the crashing game   the ball is rolling though kicks are feeble players are limping while keepers are unstable defenders are attacking when attackers are defending  goalposts expanding crossbars drifting higher defenses staying porous offence striking slimmer scores very deficient  coaches raining curses referees hanging biased linesmen posing perplexed pitch losing grasses spectators lacking cheering as the game comes crashing lost game,  nigerian politics.                        by osii,  ojobo.                       ogwuiyimbuke nsukka,                       30th march 2007. ",583,2.661888599395752,3.0931220054626465,3.0219287872314453
39686,Messy Brother,ouit,12,my messy brother was  always crying when he was washing dishes he'd rather catch fishes. ,91,2.3517653942108154,3.1721978187561035,2.971197366714477
115674,Of Shadows and Winds,ovi,12,"in the morning light,   i will come like a wind.   windows of horror; hovered the past night.   calling my name at the witching hour  and the vultures hovered nearby,   gathering and revolving in a four square junction.    did they call my name?  did i ponder and wonder?  did i sail away?  did i get frightened?  where did the vultures go?   banners of shadows trailing everywhere; the witches of night's terror in motion.   waiting for an unholy rush and they scattered and shattered,  in one little touch. ",504,2.5891242027282715,3.5200400352478027,2.8984711170196533
62586,A Proud Man,p,12,its strange to me  how these females fail to see the beauty in me i wasnâ’t trained to be  the man u see  but it was i who thought me to be a man i am my father wasnâ’t their to guide me  so forgive the wrongs i do  i did the best i can  and i am proud of the man i am so just love me for who i am,300,3.5722458362579346,3.5529046058654785,3.3449041843414307
99959,&apos;&apos;Green Is All Around Us&apos;&apos;,paige,12,green green is the grass gently swaying in the breeze green is the grass stains on your knees green is the stem of an elegant flower green is the color after a rain shower green is the wild vines tangled on a tree green is the color of a never ending canopy green is the life of the new and old green is a story you haven't been told green could be an inmpossible dream green is a lily pad in a flowing stream green is a nation coming together green is shown after stormy weather green is the beauty of a single peacock feather green is a glow that will never get duller if you think about it green is more than just a color. ,628,3.490777015686035,3.2492895126342773,3.2299365997314453
120459,Inside Tears,paine,12,the tree twinkled their toes  as the cloud weeping in despair  the blady grass agony  that echoed the heart's misery,119,2.265347003936768,3.30555272102356,2.842468738555908
99113,inner cirle poem #4,paolo,12,"sometimes,  you have to let go of a string for a beetle to fly",66,2.923656702041626,3.086575508117676,3.1159768104553223
120444,Flower Power,patria,12,"those blaming faults,  they chase and they follow they feed on my cries and grunting bitter tears that i'm obliged to swallow my ugliness seems enchanting.   thy imagination is as hallow,  like birds,  feathers are landing.  please take back the life you made me borrow.  prayers were never sending.                                                    -",348,3.271898031234741,3.515566110610962,3.1613929271698
101573,Five beautiful kids,patricia,12,"five beautiful stars,  god send from afar to brighten up my life.  when i am lonely sad or blue,  my stars knows just what to do.  won't you wish you had them too?",162,3.943591594696045,3.6827471256256095,3.328951120376587
51204,Why me,patricia,12,"as i sit on my bed,  i hear vioces in my head,  are these my fears? why i am i here,  my face is drowned with tears thinking to flee.   i wish i was free. . . . . . . . . .  just tell me , why me?",184,2.241483688354492,3.6079509258270255,2.8123857975006104
115600,"Snowy Love, Lovely Snow",patrick,12,"snowy days,  winter days.  hands numb with cold fingers,   i find myself thinking of my love,  her images always lingers.   always and always,  i have been forever in love,   she makes my mind fly away,  like a soaring dove.   trudging through this thick snow,  i see my love everywhere,   but she always out of reach,  oh my despair.   profess your love for her,  make her yours forever.   do not be a fool,  that is only for a dream,   oh how i long to look into her eyes that gleam.   thick snow,  cold snow,  thick heart,  cold heart,   always been silent,  ever since the start.   fly away,  away from the snow,  away from my love,   close your heart and stow.   forever in love,  forever in snow. ",682,3.476891040802002,3.6532750129699703,3.2259950637817383
96070,the cat,patrick,12,i saw a cat.  it was very fat. ,33,2.5374584197998047,3.056030750274658,2.972768068313598
26747,I Am Beautiful,patrick,12,i am so beautiful.  to everybody.   oh yes. ,44,4.541177749633789,3.815606832504273,3.3379271030426025
63029,My Neighbors Dog,pattie,12,my neighbor has a dog.   that always comes over.   he is nice and sweet   but runs when i want to meet  because if he won't afraid  maybe he woud't run away. ,158,3.059288024902344,3.167991876602173,3.143096923828125
22133,&apos;&apos;Billy the Kid&apos;&apos;,paul,12,billy the kid        lies in a boot hill grave out west.   denied his three score and ten  by a bullet from the gun of a friend.   some say he got what he deserved.   is he mourned by anyone  this captive of hollywood movies -   this smiling little killer   forever aged twenty-one . ,283,2.347238063812256,3.316259860992432,3.0341033935546875
24600,Lost In A Dream,paula,12,"i sit in a beautiful meadow i do not see the beauty around  me for my eyes are filled with tears i hear a soothing, warm voice just beyond the willow tree. . . .  why are you cry? i have come for you just as i said i would, i told you i would always be here for you and i am .   he comes to me,  gets on one knee and wipes away my tears as they fall. . .  he takes my hand and gently says to me ''please do not shed no more tears for i am here now with you where i will always be,  even when we are apart i will still remain with you deep in your heart where i shall stay. ''  i look up into the most deepest blue eyes one has ever seen,  i smile and say ''yes you are here today,  you will be by my side tomorrow but what about after that? will you be with me forever till my last breath is spent?'' i do not get to hear his answer for i am awoken by the ring of my phone. . . . .  but my pillow is soaked with tears,  i know i will be forever lost in the dream for you aren't really with me. ",975,3.1043875217437744,3.479400634765625,3.080002546310425
14715,Summertime,paula,12,"i wish it was summertime,  it would be warm.  i wish it was summertime,  i would sleep late.  i wish it was summertime,  and we would not be at school i wish it was summertime!!!!!",178,2.9388790130615234,3.668947696685791,3.0386593341827397
114646,The Answer to the Holiest Believer,paula,12,"sweet believer,  bend your ears,  let me now assuage your fears! all the sins you fear you feel now is cleansâ’d from head to heel.  rivers flow upon your shores,  feel your anguished guilt no more.   i see the work your hands create and feel your passion,  oh so great and in return,  i offer you that sweet respite you scramble to your lack of goods gives me no pause thy soul is clean,  so good your cause  acknowledging your humble prayer i give to you a gift so rare cloaking you in love and peace offering your soul a lease - a place in heaven waits for you; your rock of ages hides you too. ",592,3.7467312812805176,3.660056829452514,3.378352165222168
74970,Shopping,paula,12,"i love to go shopping even when i feel like dropping.  when the clock strikes seven pulling into the mall feels like heaven! i love the mall,  stores big and small.  nordstrom,  limited,  even the express to buy clothes,  shoes,  or a cute dress.  my favorite thing is to accessorize necklaces,  bracelets no matter the size.  money is easy to spend as you can expect,  being a teacher money is no object! so of all the places n the world to be,  i would always prefer a shopping spree!",477,3.961432456970215,3.74761700630188,3.390815258026123
120569,Love,pavel,12,"i've been fooled,  hoodwinked through bliss by a slayer who came from the abyss that living convulsion,  irrational shove the endless-mirage,  celebrated as love",162,3.0400760173797607,3.5382275581359863,3.173657894134521
107227,Through  My  Eyes,peggy,12,"my dog is soft and fluffy, kind of like when he was a puppy, but then he grew up and no longer a pup,  and the pup is a big dog now.  sometimes he looks so scary but thats just because he's so hairy.  his black fur is still so soft and fluffy,  and i guess thats why when i look at him,  all i see is my little fluffy puppy.  my dog is all grown up now,  we have a lot in common,  sometimes in the afternoon we both like to take naps,  but he forgets how big he is and can no longer fit into my lap.  i wonder if my dog remembers how we used to play and stuff,  and no matter how big he gets,  or if he whines and cries,  he'll always be my little puppy,  even if it's through my eyes only. ",677,3.0523102283477783,3.221501588821411,3.154152631759644
117907,BORN TO BE,pertunia,12,"some people were born to be musicians some people were born to be singers while some people were born to be teachers n give knowledge some people were born to be doctors and heal people  me i was born to be a singer, dancer, poet n a novelist i was born to make my dreams comes true i was born to have successful life n do what is good for me as i know that i am in a journey i was born to make good things for my self because if time wasted it will never regain no, no, no i can't just do nothing with my talents because my future is in my hands  later on i was having doubts. . . wondering if i will be able to reach exactly what i want in life but suddenly i just find a good way to make my dreams come true i've just realise that who ever i want to be first thing i must have hope n ambitious in order to successed  as i knw that life is all about opportunities me too i've receive opportunity to show others what i'm capable of now i'm ready to make my dream come true no, no, no i don't feel guality and shame for how i am or who i am but what i can say is dat i am a special human being and i deserve opportunities like others i was born to live this life ouh what a life!!!!!! the end",1186,3.551923513412476,3.5797312259674072,3.3807144165039062
115640,TRUE OF LOVE,peter,12,sun like sunday moon like monday i like one day that is your birth day. . . . . . . . . .   by peter m,95,3.287447452545166,3.09073257446289,3.1762688159942627
57736,the nobodys,phat and nightfox,12,there once was a family.  they were as big a mt.  everest thay had no friends,78,2.54130220413208,3.0576696395874023,2.982736349105835
54661,Phil,phil of the future,12,phil  is not ill phil likes to chill phil is cool!,53,3.9489219188690186,3.5804662704467773,3.367823839187622
31174,Smart  Spell,phoebe,12,"spirits send the words,  from all across the land allow me to absorb them,  through the touch of either hand for 24 hours from 7 to 7,  i will understand all meaning of the words from here to heaven. ",199,3.525998592376709,3.437405586242676,3.2823173999786377
31173,Buggy Man,phoebe,12,"i am one too strong to fight,  return to dark where shadows dwell you cannot have this halliwell.  go away and leave my sight and take with you this endless night. ",165,2.5497326850891118,3.2910523414611816,3.1579508781433105
110783,It&apos;s nice to eat rice and pork with a fork!,phuoc,12,"almost every afternoon i eat rice that i cooked the night before it's nice to know that  when i am hungry as a loon i can always eat my rice heated up in the microwave oven  i also make my own stir fries sometimes slow cooked chicken or pork i use a fork instead of chopsticks but when the rice sticks to the bowl then a fork won't do  when i cook my own food i know what's good for me  i trim the fat,  skim the salt i use fresh ingredients  without all the additives  store bought food cooked in salt fat and all bad stuffs  when i am done eating i know i am all good to go without feeling bad that i've done the right stuff for me it can be addictive  if you give it a try! you won't want to buy  store bought cooked food but want to make more stir fries!",762,3.518368721008301,3.4333791732788086,3.4147696495056152
54919,Pie,pie,12,burning in th oven u love the pie but dont eat it (to hot),61,2.985725879669189,3.1262574195861816,3.192348003387451
25682,Sad,pig,12,i am sad you are mad,23,2.219122886657715,3.2922096252441406,3.055487632751465
31172,Fear,piper,12,"locked in,  boxed in.   full of fear,  my panic grows manic.  till i canâ’t hear.   in need of reprieve.   so that i can breathe remove my fear.   please make it leave. ",164,2.432101964950561,3.452733039855957,2.971176862716675
31175,Truth Spell,piper,12,"for those who want the truth revealed,  open hearts and secrets unsealed,  from now until it's now again after which the memory ends for those who are now in this house shall hear the truth from their own mouths",212,3.181934118270874,3.280639171600342,3.3150429725646973
115449,The unexpected life,piyush,12,"life is so unexpected, it takes so much twist and turn,    at each turn waits a new experience to judge your earn,  giving you a misty way to travel on a road full of pebbles,   with the hope of achieving eternity and love as you move on you are knocked down by obstacles,  still i stood up,  dressed up and showed this vicious world my confidence to walk,   having mild smile on my face and the name of my lord in my talk,  life is so unexpected that when you think you actually got someone he slowly slips away,   moves away swiftly as the feathers blow away,   you try to catch him,  hold him to stay,   he is like a floating cloud which always sway,   life is so unexpected yet majestic it tones you up for everything,   making you hard as shell so that you never repent for anything,  life fills many sparkling and shining experiences but has some black ones too,   at each step it illustrates we have to accept them too,  sometimes it offers joy and happiness,   sometimes it offers disappointment and sadness,  yet it's life and it goes on like a beautiful flowing river taking manifolds,   it's up to you whether you enjoy the journey or let it beholds,   life is so unexpected it offers you pain so tactfully just to test your courage,   when you handle it you get purified with the tears of your sage,   lies in life a never ending process of rebirth,   everyday you grow up with a new lesson tied to your girth,   life is a one time opportunity use it wisely,   love everyone, spread knowledge of wisdom likely,   life is so unexpected it often goes the opposite way we think,  just as to test our patience and often makes us wink,  still in this unexpected life lies a marvellous relation of friendship,    the most prestigious and pure form ofâ  relationship,   it fills joy in everyone's life irrespective of your nature and age,   giving you strengh everytime you loose your courage,  a true friend is the life's most precious treat to a person,   his silent care,  love and support carves you out a better person,   there is still tenderness connected to this unexpected life,   as it gives you most beautiful parents which always care for you no matter how much agonised is your life,   never wish to break their trust since they make your way to success,   they act as friends sometimes stern and rigid,  sometimes soft and loving only to make the best that you can posses,   life is so unpredictable you never know what a new day may bring,   might be happiness or sorrow but they are a temporary thing,  life is unexpected only for the mortal,    but for my lord which is immortal it's just a stage where we all are merely players in his hands playing their roles which are subtle. ",2659,3.4750289916992188,3.45397424697876,3.248234510421753
50898,I Want a Car,pj,12,"i want a car like the jetsons fly small and sporty and buzzes through the sky.   i want a car like the beverly hillbillyâ’s drive rocking chair included and that horn&#x85;to let everyone know iâ’ve arrived!  i want a car like the general lee the one the good oleâ’ boys from hazard had and outrunning the cops is a hazard guarantee.   i want a car like the batmobile with itâ’s fancy fins and grimacing grill  gizmos and gadgets aplenty to thrill.   i want a car unlike what my parents own stranding me,  strapped to the back seatâ’s safety zone until my parents deem me fully grown!",584,3.356322288513184,3.588474750518799,3.3412129878997803
74430,Kitty and Squiddy,poetrymaniac117,12,kitty had a friend his name was squiddy.  squiddy liked kitty who lives in piggy.  piggy is a city.   the end,109,3.2115960121154785,3.0153281688690186,3.1955482959747314
50357,My Sister,portia,12,my sister is a little brat she hits and kicks and throws a bat my only problem is i spoil her. she gets all the attention from my parents.  it really does'nt matter because me have fun any way.  do'nt forget beware of the sister she will get you. ,246,3.1487112045288086,3.382942914962769,3.322008848190308
119582,Under the moonless sky,prabhudatta,12,"under the moonless sky two full moons have already gone,  but my sky is still dark and alone. . .  the moon which was glowing there,  shining bright,  pouring love n care,  never rose again from the horizon,  after that cursed night of the season.  again a humble-heart did get scars,  it was all seen by me and the stars.  in this dull desert i am a wanderer,  with same scars of the past nearer.  roving around to forget the departed,  to fetch bliss, this journey was started.  fountain of joy,  water of truth,  shade of care,  grass bed of youth,  nectar of love,  moonlight so cool,  are all phrases so poetic to fool- someone like me who gave his heart,  had-have loved though she tore it apart.  the path was gorgeous unlike it ended,  the sky and the stars have me befriended,  these empty nights are empty no more,  the dim starlight is brighter than before.  i was to cross deserts,  mountains,  oceans. .  to heal my heart,  to bury those emotions. .  to search the lost moon across the horizon,  the sky stopped, stay here for a reason.  stop looking for a disc with fake light,  my friend,  the sun is real n burns  bright,  the night was long,  but hope is a boon,  stay awake with me,  the dawn will come soon. ",1186,3.383917808532715,3.4498519897460938,3.2020933628082275
117625,A True Friend Ceci,pramu,12,"she came with lot of passions,   energy and friendship. . .  expecting little love,   care and comfort&#x85;  she devoted completely to the friendship  without fear and gave everything to the relationship. .  she had full of confidence,   never lost hope till the last day even then. .   was expecting the ultimate word till the last day. . .  however she could not ask the reason of rejection  and never believed the kind of outcome. .   probably her friend was not trust worthy,   having less confidence. . .  not made for each other&#x85; probably,  he was in dilemma,  what to do. . .   to choose between the fear and friendship. . .  may be he was not brave enough  to discuss the problem and confusion. . .  so ultimately the fear won over friendship. . .    was it worth?? her friend believe so. . .  as it is good to miss a friend than  missing the love of his life. . .  as love stays forever and it wins over friendship. . .   love never dies and fails,   it stays till the last moment of life. . .  friends get changed over the time  but not love and feelings. . .  it stays in heart and will stay  as it was somebody's pure feelings. . .  this could be one of the relationships,   but unique to her friend&#x85; as it was of full of passions,  joys,   beliefs,  trusts,  true feelings. . .   god should be kind enough to give  that kind of feelings to every friendship. . .   every moments of his life will miss that friendship  and a true friend. . .   she didn't care of anybody's response,   feedback to her friendship. . .  was always ready to give everything  possible to the relationship. . .  she was a brave person with great heart and soul. . .   her friend could not get a chance to explain  and not brave enough to say sorry or goodbye. .  but it was one of his toughest decisions of his life  to ignore a pure friendship. . .  was he brave enough?? could be or may not be. . .   but that was the destiny. .   she is one of his twin souls,   but not the ultimate soul mate. . .   as she came and changed his life  with lot of care and love which he was not worth it. . .   now he wishes her every day for a better and happy life. . .  hope she would have forgotten everything  and enjoying the new chapter of her life. .  which she deserved of it&#x85;",2181,3.191065788269043,3.254502773284912,3.1769187450408936
116099,Life,pravinay,12,"a seed that sprouts hearing the thunders of the clouds will see the water and air in his lifeâ’s first round it will,  have small,  tiny leaves like eyes of a bee it will,  grow a bit big finding its place to be now it would have learnt how to live what to ignore and what to believe it will become a grownup plant a bit too angry and a bit slant dreaming to be a big fine tree  without any worries and feeling free it will have branches and a millions of leaves like our relatives and our buddies it will,  also laugh and cry for its fury but now it is a grown up tree feeling 100% free after passing many seasons,  sometimes living without any reason has passed many phases of life,  with fruits,  some birds and bee hives its seeds have gone deep into the ground to take a deep sleep no disturbance and  no sounds to rise up one day giving company to its comapanions  either cherry,  banana,  oranges or it may be lemon now its roots has loosen,  as it is on the phase to be fallen  but still it is happy,  at this ending page as clouds have started thundering it will be raining again and that old tree will have new children to live ahead",1137,3.307929039001465,3.264859199523926,3.232827425003052
111468,And We Should,preston,12,"the future is forever unknown.  its all inside our heads,  we fear what we can't control.   everyone's doing it wrong,  thinking of what will be and not what is,  the future is forever unknown.   imagining what's in the darkness thats what drives us crazy; we fear what we canâ’t control.   not knowing what's coming all you have is hope,  because,  the future is forever unknown.   the cat and the lion one domestic,  one wild we fear what we canâ’t control.   growing old,  dying,  aliens,  gods? all part of life,  the future is forever unknown we fear what we can control. ",563,2.4413836002349854,3.278353214263916,2.837090015411377
119699,Agony,priya,12,"there's an agony held in my heart,  agony of dereliction,  dereliction towards most important years of my life.  could have left no stones unturned to reach my aim.  but i got caught in the game of vain.  flying colours did the judges claimed,  maybe i got flowed away insane.  judgement day turned out to be my doom's day,  no answers did i have for the blame.  life took an unpoised turn and i found myself standing at a crunk.  everything happens for good,  some heavenly whispered in my ears i give you a second chance,  he declared.  that was a boon for me; but my heart roamed abouy just pondering on dreams.  gathered myself to hit back hard now here i am,  waiting. .  anxiously for the bricks to fall apart. . . ",704,2.5067930221557617,3.3712968826293945,2.9306557178497314
