id,title,author,grade,text,char,valence,arousal,dominance
118935,The New World,andrew,7,the cave was cold  the cave was old  there are many stories to be told this cave shaped like a bowl the moonlight comes in through a hole  the crystal shines bright  you touch the tip to see the light the world was the best sight you knew the world was a moor it really got to your core,290,3.593991279602051,3.488233089447021,3.2669458389282227
16724,WHAT IF....,andrew,7,what if the world didn't exist? what if there was peace throughout the earth? what if parents were kids again? what if we didn't have friends to get help from? what if we weren't there to help friends? what if north america didn't exsist? what if there was no human race? what if my parents weren't devorced? what if everything was free?  what if nobody died?,363,2.6277246475219727,3.3151912689208984,2.945418119430542
28466,My Goldfish,andrew,7,"i was laying in my room one night,  yes laying in my bed,  when i felt a big sharp pain deep inside my head,  so i went to get some medicine,  when i noticed my goldfish,  he looked like he had gone right to the abyss,  little did i know that he was sleeping on his side,  even though i had a clue i thought that he had died,  so i picked him up as he lye,  the emotions grew to big for me i thought that i would cry,  as i walked sluggish and slow,  i was in a pasing stride,  i put him in about to flush,  when he woke up in a rush,  then i put him in hes tank,  my name is little hank,  and as i sat there i had to say,  my goldfish,  my goldfish,  my goldfish",647,2.6370553970336914,3.4458675384521484,2.9391770362854004
104643,Crazy Creatuers,andrew,7,cabby the crab went to california     to buy cacyus from cuttlefish.      cocadile crawls cazy to the candy      shop where cats aells candy. camle      cables bought converse from crusty     the cluter maker. confusions couses     ceriters to act crazy coming back     to california. ,284,3.032710552215576,2.999650478363037,3.1451761722564697
84981,My dog,andrew,7,"a small dog,  minture if you say,  she looks like a hot dog,  usually coverd in fleas.   small legs running in the grass,   ears flopping in the air,   a squeak for a bark,  always smiling at me.   chasing small bug shadows,  in the bright sun,  on the front lawn,  a young dog that knows many tricks.   my dog's name is penny. ",318,3.468707323074341,3.290433645248413,3.249377012252808
29129,BASEBALL,andrew,7,"you swing the bat,  you wear your hat,  you catch the ball,  you take a fall,  you see it go over the wall. ",106,2.731611490249634,3.160972595214844,3.049180030822754
51141,Alligators,andrew,7,all alligators are angrey about andrew and adam's akraback all arond alaska,78,2.9440484046936035,2.984348773956299,3.1547062397003174
64166,The Trumpet,andrew,7,"the trumpet  gold and silver.  fun and joyous to play,  makes me feel all good inside.       the trumpet all the music you can play,  just makes me feel all good inside.   the trumpet, trumpet, , the trumpet",204,4.02925443649292,3.7065060138702393,3.408266067504883
112731,Swirly line,andrew,7,"oh swirly line why you so shy? when i see you do you turn away? do you like me? oh swirly line,  vanish if you must when i turn the page&#x85; will you come back? will you return? pleading i will,  for swirly line to come again&#x85;&#x85;. ",242,3.0516035556793213,3.1561641693115234,3.079547882080078
80928,Pickels,andrew,7,"green, jucie, lumpy   lives in jar  greenthings",48,2.968296766281128,2.8686890602111816,3.1424825191497803
80930,Elephants,andrew,7,elephants are big elephants are fat elephants are mean because they squshed my cat,86,2.5443835258483887,3.2174038887023926,3.126129150390625
104610,Red Eggs and Turkey,andrew,7,there was a turkey his name was kam  he ate some turkey he thought it was good and now he is very happy red eggs and turkey!,127,4.09455156326294,3.676809310913086,3.4144375324249268
45733,Paradise,andrew,7,"a paradise is what i want peacfull,  quiet,  and away from stess there i will live in perfect peace away from pain away from anguish were everybody gets along and nobody does wrong you will never reach this place in your lifetime but when you pass on you will journy to this magnificent place  only if you belive. ",314,3.6586217880249023,3.483893156051636,3.331483602523804
118936,Fall,andrew,7,leafs dancing in the wind while all the kids grinned now it's fall the leafs will make a wall the twisting tornado of leafs going through the trees this weather will make you sneeze it should be cold but it should hold so keep yourself together  this is the loveliest weather,280,3.798622131347656,3.615173578262329,3.3029167652130127
24494,All I Know,andrew,7,"all i know is about the snow,  all i know is jim lives down low,  but what i know is not enough,  i still have a bunch of stuff,  all i know is i like fruit,  but no body gives a toot,  all i know is about the sky,  itâ’s so blue and high,  now,  that was very funny,  itâ’s as funny as a blue and white bunny,  i donâ’t care if you donâ’t like it,  i read it from my poem kit,  so go ahead and not laugh,  iâ’ll just go take a bath,  but when i return youâ’ll be sorry,  because all i know is that i wonâ’t worry,  about the damage i have done,  because all i know is to have fun.  so you can cry till your eyes burn,  but i still wonâ’t give you a turn,  at the much wanted bunny,  because you all thought i wasnâ’t funny,  but know you all will learn,  because jim is laughing cause his throat burns,  so you can still not think iâ’m nice,  but all i know,  is that you hate mice,  really i lie about liking punny,  because all i know,  is that iâ’m not funny,  sorry for the pain that i have caused,  cause iâ’m really santa claus!",1007,3.2167558670043945,3.429616451263428,3.2645862102508545
118940,The Cat on the Hill,andrew,7,there once was a cat on a hill.  he frolicked on top of the hill.  but his ankle bent and crash! he went down at the bottom of the hill. ,137,2.5341358184814453,3.322528839111328,2.895721435546875
65252,Food,andrew,7,eating food is what i like i burn the foods by riding my bike my favorites is steak and fries and i don't tell many lies going out to eat is what i do  and when there is somthing i don't like i go ''ew!'',207,3.2623496055603027,3.44763445854187,3.401685953140259
30876,McLaren F1 CAS,andrew,7,sleek and shiny fits three people sub air car it is lethal rips through the air at amazing speeds it satisfies your killing needs it is full of secret features  to fend off your evil teachers,194,3.1675682067871094,3.489151954650879,3.225648164749145
105751,I am a vietnamese person who likes animals,andrew,7,"andrew,   i am a vietnamese person who likes animals.  i wonder why i get laugh at.  i hear that their jealous.  i see the people hitting me.  i want to be a whale shark.  i am a vietnamese that likes animals.  i pretend to be mean.  i feel pain when people laugh at me.  i touch the a tiger half lion.  i worry about dying.  i cry when i am being killed.  i am a vietnamese person who like animals.  i understand that i am not the only one.  i say that i am a one of a kind.  i dream to be a american.  i try to be nice when im mad.  i hope it will change.  i am a vietnamese person who likes animals. ",587,2.581033229827881,3.287909030914306,3.013084173202514
113553,Ball is Life,andrew,7,"i say ''ball is life'' i pretend its like my wife to other people its just a ball some say it is life,  but i don't see them taking it down the hall",150,3.04258131980896,3.0790841579437256,3.1819615364074707
53746,The Baseball Bat,andrew,7,"people always throw balls at me,  and i continually get hit sending the ball away.  then there are the evil people,  just like ortiz,  who don't only swing me , but throw me,  too.  that's the life of a baseball bat,   a helpless stick of wood. ",239,2.309807538986206,3.3301150798797607,3.053431749343872
32848,Animals,andrew,7,"animals,  the meat we live on,  animals,  the things that keep us warm.  animals,  the living things that help us through bad times,  animals,  they come stuffed at meijer.  animals,  the color that meets our eye,  animals,  the entertainment since the beginning.  animals,  the creatures in our lives,  animals are monkeys,  giraffes,  dogs,  cats,  deer,  fish,   cows,  horses,  ducks and anything else.  we are animals ourselves. ",416,3.463168144226074,3.268027305603028,3.26086163520813
15492,To Become,andrew,7,why do my parents argue? because they donâ’t understand each other?  why do my sisters fear me? because i torment them?  why do friends pick on me? because i seem weak?  why do cops become cops? to prove justice in the world?  why do rivers never freeze? because theyâ’re in a fury?  body why donâ’t you attract? because i donâ’t treat you right?  why doesnâ’t harry potter 5 come out? are there too many angry mobs?  why do they not show the twin towers? to build awe in the audience?    by: andrew sutterfield,515,2.4618959426879883,3.376786470413208,3.1148924827575684
102898,My Fat Cat,andrew,7,oh my cat my cat is very fat her name is tobie i think she's a dobey oh my cat my cat is very fat sometimes she smells like a dog but looks like a hog oh my cat my cat is very fat she feels like a big ball of hair  but she's actually a big black bear  oh my cat she's really really fat,290,2.634962558746338,3.3223886489868164,2.981447696685791
55535,Out on the street.,andrew,7,"tall cars on on a black creek of assfalt,  convincing people it not your falt.   living by the rules is stait-up weirrd when you are out here with a long gray beard.   when you don't have a friend  sticking up for you,  your siting out here in a pile of poo.   when you live in a box,  cold and wet,  you can't even have a house hold pet. ",334,2.3292362689971924,3.1740455627441406,3.02483344078064
31850,Mom,andrew,7,"mom,  you gave birth to a good looking,  funny family member,  you gave birth to me in the month of december,  i gave you a gift but if you want to get me one to,  you may,  so i hope you have an awsome mothers day. ",215,3.789907455444336,3.538980007171631,3.344036817550659
108628,Cheesepuffs,andrew,7,i eat cheesepuffs every day i eat them when i work i eat them when i play i dont really care that i eat them like a bear  they munch and they crunch i eat them a bunch  cheesepuffs are fine with a touch of lemon lime makes them sublime,238,3.5459372997283936,3.417862892150879,3.3770883083343506
30412,Pigs,andrew,7,pigs flying in dreams in clouds up above ears are their wings leisurely grazing  pigs fall  from above wings give in flight  cant see anything  just drop from sky,166,2.973319292068481,3.166210174560547,3.063208103179932
54046,Snowboard,andrew,7,"upon the ice caped mountians,  ride the masters of ice.   but the masters would be nothing without their steeds.  it never fails me,  never will  though we stand out, black against white,  you only catch a glimps us,  for we are too fast for you!",242,3.115840196609497,3.432352066040039,3.280991554260254
28304,Haiku-Summer breeze,andrew,7,the wind blows softly through the trees and the rivers cooling with its touch,80,3.229825258255005,3.041513681411743,3.150538206100464
84953,My Dog,andrew,7,"my dog may be small,   but can catch a ball.  my dog has a brother,  but you can tell one from the other.  my dog can run fast,   and sometimes finishes last.  he is a wonderful dog. ",179,3.689883232116699,3.4431729316711426,3.3436739444732666
44639,A Sunrise so beautiful,andrew costa,7,"i saw a sunrise so beatiful and fair.  when you look at a sunrise the way i do you start to look at the sky so blue.  shorter and shorter the sun looks.  its firey shape like an angry hook.  their i sit its almost down so then i have no frown.  to then i stand and walk back home,  i am done looking at a sunrise to beautiful. ",323,3.628752231597901,3.503770112991333,3.274348735809326
51084,School,andria,7,"brinnnng. . .  there goes the late bell.  as i'm running,  running,  running down  the hall i bump into a teaher followed        by a detetion  it's a relife to see lunch   but then my milk is spilling,  spilling,  spilling all over me.    during my next class i relize i forgot my boring,  boring,  boring homework.  it's my last class and i have a quiz and i keep forgotting,  forgotting,  forgotting the answers.  finnaly it's time to go home and my mom pulls up with a bunch of screaming,  screaming,  screaming kids. ",507,2.538405418395996,3.435001373291016,2.9742472171783447
104623,Crazy creatures,andrwe,7,cabby the crab went to california to buy  cactus from cuttlefish. crocadile crawls  crazy to the candy shop where cat sells candy. camle cables bought converse from  crusty the clutter maker. confusins couses criters to act crazy coming back to california,255,2.9870190620422363,3.0716137886047363,3.165597438812256
49507,Stepping Up aka Graduation,andy,7,stepping up is very hard just like driving a car.  the old teachers are not done  the new teacher are not fun all the kids stepping up do not think adout what they have learn from the teachers that are standing over their. they are all care free but them teachers put alot of time and affair to see kids succeed in the out side world. ,337,2.627561092376709,3.184782028198242,3.085493803024292
75269,My dog,andy,7,my dog fells like fur.  my dog taest like hair.  he smells like a wet puppy.  i see him a lot.  i hear him barking at night. ,123,2.8333888053894043,3.3224878311157227,3.081552267074585
91877,Friends,andy,7,"friends stay,  and friends go,  but the ones that really care will stay for the show.  some are smart and some are funny,  and some are so crazy they jump around like a bunny.  forever and ever i know i'll have friends,  i even know they'll be there til' the end. ",260,3.3616318702697754,3.3649067878723145,3.2861135005950928
51122,My Cats,andy,7,my girl cat is not fat when i looked at her sitting in my hat she reminded me of her mother and then out came her brother whom whanted to play but he hadlost his toy that day so there we all just sat. ,203,3.019503593444824,3.2012648582458496,3.1390113830566406
30918,Me,andy,7,my hair is uncombed and oily my skin is pale and soily my ears are big my hands are small but even with all my faults i am just me. ,134,2.764612913131714,3.0329689979553223,3.070971727371216
39850,The Lamp post,andy,7,"watching the lamp post,  all shiny and black,  it's out in our yard,  it's out in the back.   when it gets dark,   we turn on the lamp post.  it lights up the patio,  and scares away the ghost.   the lamp has three fixtures,  the bulbs are very bright.  as bright as the sun,   it shines through the night. ",298,3.3932600021362305,3.3212878704071045,3.2758376598358154
14075,Last Game,andy,7,"hockey is a fast fast game you skate,  you shoot,  and you feel pain it's okay to fall as long as you're having a ball   as the period comes to an end you know the game wont last so as you come down to that one last shift  you push and pull to get that last goal and then the buzzer blasts  you know it was the last. ",317,2.8210854530334477,3.343344211578369,3.116095304489136
102214,Me,anfernee,7,i'm a basketball player.   i like to have fun.   i have a great grade in school.   my teeth are white and very clean.   i have some big ears.   i have a lovely face and voice. ,174,3.9717044830322266,3.504401683807373,3.378703117370605
94967,FRIDAYS,angel,7,"fiday  is the day  we look foward to,  its the day we love most but it seems the longest.   when the bell rings we scream in joy and as we walk home,  our body fills up with felicity.   before we go to bed,  we thank friday for coming  and we hope it comes again.  then we start to count sheep,   but before you know it,  your fast asleep. ",334,3.938296794891357,3.7422285079956055,3.302255868911743
103902,School,angel,7,i like school because i learn alot i like school but not too much when it's hot,82,3.4398417472839355,3.161592960357666,3.2786757946014404
110270,To Be Up Above,angel,7,"the ceiling hangs low above me,  soft as cotton,  white as snow.  below,  a shimmering lake lays still,  blue,  but pale as ice,  and smooth as silk.  all around me are islands,  giants and dwarves,  floating,  drifting,  their edges sparkling as they catch the brilliant sunlight.  they say this is where heaven is,  where rain falls and clouds roam.  i say it is a patch of freedom,  of paradise,  of white and pale blue.  i say,  it is the sky. ",432,3.4760067462921143,3.280722618103028,3.213056802749634
110269,Chessboard,angel,7,"so.  a chess board.  small,  insignificant,  five feet below.  white and black figurinesâ—-is that a knight?â—-lay scattered across the checkered landscape.  down,  down below.  feeling like,  a king! almighty! how easy it would be to disrupt the calm and quiet world laying at my feet.  still.  very still.  until,  suddenlyâ—-   blinking,  look down again.  no,  up.  gasp.  tall soldiers,  closing in.  immobile,  but,  how do they say it? strong and silent.  and i? small,  insignificant,  five millimeters short.  tiny person.  so. ",515,2.9772300720214844,3.479857444763184,3.113731384277344
51453,DownTown,angel,7,"the downtown city lights are bright , you can also hear the cars, buses,  and trains.  i like shopping downtown and eating,  those are the things i like about  downtown. ",167,3.7367022037506095,3.381223678588867,3.3196280002593994
104350,Sounds of Rap,angel,7,"boom boom-boom boom boom boom-boom boom  the speaker shakes and vibrates the ground,   pow pow-pow pow pow pow-pow pow the dj.  mixes the beat tillwe get down ,   bop bop-bop bop bop bop-bop bop we all sing and move our hands,    cluck cluck-cluck cluck cluck cluck-cluck cluck as we all move and dance. ",302,3.3946213722229004,3.467716693878174,3.2433807849884038
116289,MY SECRET LOVE,angel,7,"the day i saw you i never knew,  that this day my dream would come true,  this secret. . . no one else must know,  the love,  that took time to grow this indescribable feeling that's inside me every day i wonder,  what you think of me my secret love continues to be  no one else must know except u and me. ",300,3.8701400756835938,3.769956111907959,3.326305627822876
104107,Soccer Ball,angel,7,"soccer ball by: angel   bouncing,  going left to right and up and down being hit and being seen  i go into the net  and you scream goal. ",140,3.105072259902954,3.643758773803711,3.1431238651275635
67843,Tornado,angel,7,"when the air stood still as it started to rain it was not a thrill it was horror and pain as it swirled around my feet came off the ground i was scared my dog was flying in mid-air then i landed with a horrible fright i guess i was alright well, when the air stood still as it started to rain it was not a thrill it was horror and pain",338,2.383673429489136,3.506767749786377,2.7846710681915283
41358,My TV,angel,7,i love my tv more than ever before if i didn't have it then i would be doomed  if there was no tv everybody would be bored with nothing to do until summer that is,165,3.1436450481414795,3.417324542999268,3.200483083724976
51142,Friends,angela,7,"friends,    friends are there until the end,  even when u trend or need them in a recomend,  friends should always be by your side or when your blind or when your kind, u can borrow trust or custom anything when u have a friend like a cadillac or a  big blue benz !friends!",272,3.5538201332092285,3.5959014892578125,3.380932092666626
113575,Moon,angela,7,"she silently ascends the pitch black sea,  emanating pure white light,  igniting a sprinkle of fiery blazes across the night sky,  evading from the clouds hoping to extinguish her radiance,  casting an eerie glow while creating dark twisted shadows,  and bathing the world in her light,  until dawn comes and she quietly slips away as if she was never there. ",356,3.253466844558716,3.385700225830078,3.138613700866699
113576,Rose,angela,7,red petals like velvet opens gently in the moonlight sharp thorns that prick your finger exquisite but dangerous,115,2.873487949371338,3.2527613639831543,3.069352865219116
113577,Cherry Blossoms,angela,7,exquisite blossoms petals drifting in the wind forever fleeting,67,3.690127372741699,3.428882360458374,3.2561299800872803
16718,School&apos;s Out!,angela,7,"the bell rang,  school was out teachers started to  scream and shout.   the buses drove in and kid's ran out i sat in the back eating my snack.   the bus stopped i ran in the house where my mom was looking all about.   my mom said, ''start  packing for summer school.  i'm going to workout. '' i screamed, ''oh,  no not more school. '' and ran out. ",343,2.664970874786377,3.768695831298828,3.0864951610565186
50768,Shoes,angela,7,"shoes,  shoes,  in all colors they come,   red,  or blue and maybe even plum.  stylish or wacky,  oh so many types,  even slippers that look like mice.  so many choices,  big and small,  making a decision can drive you up a wall.  stinky feet and guber gunk,   between your toes you find the junk.  pointe shoes and tap shoes that make funny sounds,  picking out new shoes. . .  can make you jump leaps and bounds.  shoes,  shoes,  what can you say?",432,3.088026285171509,3.3763718605041504,3.186000108718872
51671,A New Home,angela,7,"my stem is loose and lonely until. . .  a slap of breeze,  snaps my leaves,   and tickles my tummy,  as i trickle down to a new town.  swerving swiftly through the silent wind,  making my way down in the ground. ",206,3.3323469161987305,3.4489002227783203,3.2107093334198
99625,My cat!!,angela,7,my cats name is snowy  his really quite slowey its white  and doesnt fight  his really fat &amp; lazy o i know he must be crazy,130,2.643328189849853,3.0202035903930664,3.0567855834960938
40623,Puppy,angela,7,"loud as can be white,  soft,  fluffy  prances like a king  eats like a pig  little,  small eyes like big chocolate doughnuts",125,3.233081817626953,3.21066951751709,3.20458722114563
87368,Stars of Sapphire,angela,7,"stars of blue,  a deep sapphire  the colour which,  does not tire  soft rich petals wavering  the winds passing,  savouring  the fresh scent,  ever so sweet  no matter in the cold or the heat  everywhere,  blooming all around  under rocks,  in a mound  stars of blue,  a deep sap phire  the colour which,  does not tire. ",321,3.658434391021729,3.379257917404175,3.247443914413452
39290,Think,angela,7,i think all day and every day your are always on my mind and i wonder why. ,77,2.902516841888428,3.245817184448242,3.071366548538208
38182,My Rocks,angelia,7,"my rock is purpol  my rock is pretty  my rock is a geod  i have a nother rock that is fossiol  and another is fossil wood  i have shiny rocks  i have rough rocks  small rocks and big rocks  green rocks too  hey,  you name it i have it. ",237,3.4774904251098637,3.2887911796569824,3.292280673980713
38194,Bud,angelia,7,bud is a black dog   he folloed my dad around  he was a cool dog  i think he was 7 when he was put asleep  iwas 4  i wish he was still alive   i never found out what kind he was  i really miss him  bud dog was his nickname,225,2.977876663208008,3.2221622467041016,3.077019691467285
53974,I&apos;ll Pretend,angelic,7,"iâ’m going to smile like nothingâ’s wrong and the worlds ok.  iâ’m going to laugh as though by doing this,  my problems will go away.  iâ’m going to act like my life is just one big dream.  my world isnâ’t perfect though  thatâ’s how it  may seem.  and every single time i cry iâ’ll just say they are tears of joy&#x85; but those times that i truly am happy,  iâ’ll have to learn to enjoy.  and i every time i want to just  let my emotions run&#x85; iâ’ll write a poem,  just like this one. ",486,3.768023729324341,3.60093355178833,3.362480401992798
104318,Yummy Yum Gummy Gum,angelica,7,"i am gummy gum.  i only want to make your breath smell, taste, and have good flavor! you make me sad when you don't like my flavor and you decide to tell me ''later!'' you make me blush when you chew me and compliment me.  to make me more adorable i would like to change my color to green or purple.  if i would yell out, ''please don't throw me to the floor,  or i'd be stuck to someone else. ",389,3.643055438995361,3.721713304519653,3.3871641159057617
31792,"Spring, Spring",angelica,7,"spring, spring all around,  birds in the air and flowers on the ground,   i love to watch them all day long and listen to my favorite song. ",140,4.016707897186279,3.5373544692993164,3.33001446723938
84988,The Butterfly poem,angelica,7,butterflies futter butterflies fly i see butterflies  in the sky.   butterflies are blue  butterflies are back a butterfly just landed on my back.   i love butterflies i truly do if i could  i would give 1 to you.   butterflies live but then they die and thats the part  that makes me cry. ,289,3.6027565002441406,3.648981094360352,3.2483489513397217
53883,All Alone,angelina,7,"i was left all alone by someone who told me they loved me. it felt like something real, something unlikely to feel. something i never saw be for it was him, i liked him for so long i thought he was the one until he left me and proved me wrong. ",259,3.3242759704589844,3.591313362121582,3.1257333755493164
53884,All Alone,angelina,7,"i was left all alone by someone who told me they loved me. it felt like something real,  something unlikely to feel something i never saw be four it was him , i liked him for so long i thought he was the one until he left me and proved me wrong             i was left all alone by someone who told me they loved me. it felt like something real, something unlikely to feel. something i never saw be for it was him, i liked him for so long i thought he was the one until he left me and proved me wrong. ",501,3.333554744720459,3.5024776458740234,3.1040616035461426
