id,title,author,grade,text,char,valence,arousal,dominance
57819,Â“The English letterÂ”,kylie,12,"boast some anguish to all and sundry,  what kind of tongues language? no ones body lives here by that name,  scripted by words from a minds game,  i put the halo of arrogance above my name,   where do my green eyes find ability? to fixate on lies,  spill from a jaws utility,  carnage of seventeen years in my theory,  how can i possibly reach down? and break the hostility?  episode five billion of my worries,  extreme odium seems to engulf me see,  why do i seem the need? to defend your useless inability? empathy in a theoretical picture,    such a powerful cast,  split between behavior a mask,  it makes you the right feel,  i need a start,  nothing like this peace will ever last,  home based,  iâ’m learning to forgive and forget,   but danced a second light,  you make a bet,  then with this,  what do you expect? hidden hypocrisy is all youâ’ll ever get,  a new uncared for depredation,  maybe one day,  what you give youâ’ll get,   your only hopeful teacher,  with shame on my shoulders,  iâ’ll try and draw a picture,  keep it close,  for interpretation,  donâ’t exceed the dose,  but until then iâ’ll find a median. ",1103,2.5964667797088623,3.3974742889404297,3.1114344596862797
117913,World,kyrex,12,"what is this world???  i never thought i will came here this is a miracle i came here but i must accept the reality i already trapped here for the first time i came until now its my choice to stay with them  iâ’m grateful for that in this world,  i met with many fellow shawol we spazzing together like a crazy person itâ’s the precious moment in my life but when i saw one by one leave this world finally i know what people say about in every beginning there must be an end so in every meeting there must be a farewell so that why iâ’m scared i m scared maybe next time will be my turn to leave this world can i do that? leave someone who always makes me amazing with what they do i hope i will stay forever with them but we must know we didnâ’t know about our future what will happen but if in the future has been written that i would leave this world for some reason i hope i can remember all of the memories we spent together when we do many thing to support them but now because iâ’m still here let me collect more beautiful memories with u guys so i will never be able to forget later&#x85;",1099,3.3092360496521,3.4486613273620605,3.1709635257720947
35006,Heart of mine,la mona,12,"i found what i wanted.   i thought at least i did.  things with you are fun but so hard to deal with.  i found my heart lost and hopeless and i ask him if he was willing to go on,  he was so hurt and confused  he couldn't answer.  what do you think i should do to make him better? but i don't know,  i'm afraid i can't i'm falling apart too!!!!!! poor heart of mine i wish i could help him but i think thats life,  is there somebody out there that is willing to help  but carefully somebody that really want to care and love him oh my oh my  poor heart<br/>\nof mine. ",565,2.420465469360352,3.5364012718200684,2.9102261066436768
35146,Can I Runaway With You?,la mona,12,"love ! is that what i feel inside? can i ever forget what happened between us? can everything just be cool with us? can the three of us runaway and be happy? i feel that you try,  but just not hard sure you are the love of my life or am i confused? should i just closed my eyes and let things be? but why is this love what i feel inside or is it just a  matter of time? can i take you away and let my heart decide?",416,3.344489336013794,3.645336627960205,3.1824724674224854
50025,NOT AFRAID,lafayette,12,i know i may look frighten but im not afraid to stand her and speak for you but im only in 3grade,101,2.682968616485596,3.1813435554504395,3.063805341720581
117697,Lakisha,lakisha,12,lovely advocate kind intelligent supportive happy advisor,60,4.1062493324279785,3.438843250274658,3.329408407211304
117693,Concrete,lakisha,12,"the scissors is to snip, cut it off, rip it off,  tear it off,  pull out,  and break it off the pieces of papers. ",111,2.8608956336975098,3.140793800354004,3.2414066791534424
120527,The essence of your words,lakshya,12,"the word  ''word''  is made up of only 4 alphabets but how we use it can't be explain by all 26 alphabets some'' word ''have the power to melt your heart might be in a poem or a quote ,  when it relates  to the events happened or happening in your life .  but it might kill  a person from inside,  if you don't use your ''word '' wisely ,  whether you abuse or say them wrongly your ''word'' might make a person happy  for which they had waited so long to listen,   it might be  a remedy for a person   for they might be heart break or life break. ",545,2.942976951599121,3.237950801849365,3.150848627090454
84703,God,lalitha,12,"in your smile in the sunshine in the leaves green in the azure blues as i lay upon my back and sleep in the nature's bed i can feel the touch of god tenderly he curls around in an aroma into my nostrils as a musical note into my heart as a raindrop when the hotness tears me apart dry he is in you and she yet i love to call him he he can dance and fight too in valour and modesty too he nests his eggs are kids of innocence in kind words he skates a by in timely help he glitters shy my god is not in churches nor in temples and mosques he is with me around my looks guiding me like a star giggling with humour every stride in my pain he silently sobbs watches me quietly when i sin papa is he,  mama is he,  you and me in love he is the full moon night. ",756,3.7207846641540527,3.619052171707153,3.2351460456848145
113361,Faint Emotions,laquitta,12,sadness lives within us all but happiness is a lent emotion that happens when given to us by someone else.    for love is extreme sadness and sadness is extreme happiness.  for ones heart grows fonder within loves greatest joy.    overcome by joy we express our emotions just to realize it's our own fantasy but reality is faint like our dreams,344,3.8332772254943848,3.6701526641845694,3.298482179641724
84496,A Woman&apos;s Dance,laramie,12,"i pound the earth beneath my feet,  the air swirling around me sweet,  the storm inside gives way to calm,  as the veil flows and flutters in my arms.  the rain sparkles in my eyes,  velvet night and starry skies,  a smile of joy,  a glimpse of sorrow,  i live today and hope of tomorrow.  this is a womanâ’s dance,   grace of being and confidence,  born not of youth or even beauty,  but living,  breathing,  creativity. ",413,3.935125827789306,3.748613595962525,3.3167686462402344
64301,&apos;&apos;Let Me Be The One&apos;&apos;,latisha,12,"when your needs need attention, i wanna be in contention.  when the mood calls for romance,  come on boy take a chance.  when you need someone to care it's me who's gonna be right there.   in your life in your heart let me be the one.   let's share the lover's touch when the moment means so much.  i want to be apart of all you are if love takes us that far.   someone who need ya love someone who wants ya love ''let me be the one''",429,3.662298202514648,3.625671625137329,3.437478542327881
33818,Never stay home alone,latoya,12,never stay haome alone when the moon bright. ,47,2.863184928894043,3.046753168106079,3.1969165802001958
49927,Limerick,lauds,12,there was once a boy named jerome who always forgets to bring things from his home he wrote me a letter forgot to sign as the sender and sent it to maine 'stead of rome!,172,2.9432573318481445,3.308213233947754,3.213514804840088
62544,Love,laura,12,"love  love is a feeling you have for someone deep inside and you care for them so much,  when you love someone each day,  you always take care of them,  and be with them,  even if they are having a sad day you will hold them and tell them its ok,   love is always around us each day whether we feel it or see it,  its happiness all around us,  when someone is hurt or injured and you love them,   you will cry each day hoping they will become better,  love is emotional,  love is what fills the air with happiness and joy,  when you love someone you hug them,  kiss them,  hold them in your arms and tell them that you love them with all your heart and soul.  you will promise things to them,  promising that you will never hurt them or leave them and that you will always be with them for ever.  love is a great thing and beautiful and lovely thing. ",838,4.015023231506348,3.757389068603516,3.355924367904663
20492,ONLY YOU,laura,12,i've watched you through the midnight hour hoping you and i embrace but of a whsiper i long for your tender kisses soft and sweet to feel a gentle touch so warm emerge together as if fate a simple stroke of love endured my thoughts of you keep me awake,255,3.764183282852173,3.669542789459229,3.2777647972106934
89925,Chicken,laura,12,"almost every morning,   i eat chicken with a spoon.   every evening right at six,   i eat chicken on a stick.  mainly chicken in the grill,  is what it's my specialty.   having chicken in my life,   is what keeps me feeling satisfied. ",231,3.777030467987061,3.506983518600464,3.4213685989379883
118785,My brown hairy couch,lauralee,12,"i have a large brown couch that is a soft as a cloud.  it is good for watching movies when its not so loud.  my kids love the bounce of it,   but they know that jumping is not allowed.  the dogs love the texture and leave their hair around.  the vacuum visits often and that is very loud.  i just love my big brown hairy couch. . .  that one day will be no more",355,3.653782367706299,3.3983163833618164,3.3073818683624268
92571,The Fat Funky Ferrets,lauren,12,"the fat funky ferrets are flying about,    they flutter and flip and fretfully shout,   ''get away! stay away! i can't take much more!''   because each of these ferrets smells like manure.   â  ''you stink!'' they cry with disgust and with worry,   holding their noses with paws that are frightfully furry.   yet then,  their eyes widen- this cannot be!  that horrible smell is coming from me???",393,2.3272411823272705,3.8899078369140634,3.12762188911438
96104,The Fat Funky Ferrets,lauren,12,"the fat funky ferrets are flying about,    they flutter and flip and fretfully shout,   ''get away! stay away! i can't take much more!''   because each of these ferrets smells like manure.     â ''you stink!'' they cry with disgust and with worry,     holding their noses with paws that are frightfully furry.    yet then,  their eyes widen- this cannot be!    that horrible smell is coming from me???",399,2.3301053047180176,3.890763521194458,3.133746385574341
120160,If We Meet Again,lauren,12,"stop telling yourself  that weâ’ll meet again,   and fall in love  just to make yourself feel better  over missing countless opportunities  to tell me you loved me,   or to treat me better because you had so many opportunities  and you just didn't take them.   and i promise you  that if one day we do meet again,   due to a miraculous twist of fate,    i will not fall in love with you.   we will not live happily ever after.   all will not be forgotten.   you will always be the boy  i loved so intensely   and i will always be the girl  who wasn't worth the fight. ",563,2.9796180725097656,3.5252811908721924,3.232227563858032
64729,Flow The Dog,lauren,12,once there was a dog named flow  who ate a lot of snow but the snow didn`t mind to be treated so unkind  it was just glad to keep her so cold,148,3.222846984863281,3.1929678916931152,3.1997230052948
34540,Life- Is it Hope?,leah,12,"life. . . is it hope? is it joy? is it what everyone has and will not give up on trying? not everyone will succeed with it,  but now we know what it is.  it's our hope and dreams!",177,3.878878593444824,3.713657379150391,3.398627996444702
118898,Project management,leanne,12,the art is to believe in yourself  and reign the horses of life  it's to grip all your ideas together to create a chain full of power  once you.  have power you have discipline and the rest falls into place like a single string pulling together through the pattern thread of life.   execute your ideas and let the tree of planning come into full light like the moon twinkling at night like twins sentimental  and bright reaching out for there father's hand and touching the deal of the feather from a dive that creates beauty and light belive all this and you will achieve because of yourself and the business you create you can own the night. ,644,3.437917709350586,3.38917875289917,3.3738017082214355
100738,Wonderful,lee,12,your so sweet and wonderful   and beautiful  just know my love is forever strong  how could life be so very wrong  why do you live so far away  wish we could both just fly miles away why is life so cruel and unfair  i cant help but feel so much despair  but whatever in life the things we do just remember that i will always love you,337,3.663647413253784,3.692728281021118,3.211047649383545
118116,Soul of sprit,lee,12,what wondrous life my head into my hands themselves i do reach.  as i stumbled the thoughts in my mind.  from pleasure off happiness that i draw  straight line to create words of wounder in the shades of darkness there comes of the light with that comes that of flower fruit can rippen that slow the heart of wanting to give you what is already yours.  the breath of summer  found by one who hears of there own heart beat.  what to call tha smell of the rain that what is inside me that falls,491,3.7749063968658447,3.645832538604736,3.3093128204345703
101892,HOW TIME LAPSED,lekshmi mini,12,"i never knew how time lapsed my face all wrinkled now  that i once was a beautiful maiden the face i owned then was loved by all.   i never knew how time lapsed my memories dying now that i once kept them cherished  of those who i loved the most.   though time lapsed  my face wrinkled my memories dying i always kept my love alive.   it was lost forever from me but still remains in my heart all the love i wanted to give to get.    i never knew how i fell in love but i knew i was the feel was so nice like heaven on earth  the feel was nice so saccharine that i wanted it to last longer.   i knew it wouldn't and i was right as time lapsed it took me away far away but my love was cherished  and the face so clearly among all.     time lapsed,  my face wrinkled my memories dying my heart beating faster i lonely await that i once will get it back.   knew that was childlike but a ray of hope  still lingered in me.   itâ’s a moonlit night a night i always dreamed of i hoped ,  i wished ,  i prayed that i could live my life again  i could see the face i longed to meet.        my heart was giving up iâ’ll sleep forever if i missed a beat i never let my lids close for i still had a ray of hope lingering in me  awaiting the face i longed to meet the love i longed to get the love iâ’d lost forever&#x85;&#x85;.   my heart giving up but the ray of hope can hold me on i thought&#x85;&#x85;&#x85;.   time lapsed i lost hope,  i welcomed death i knew it was coming i knew it was inevitable  my lids were closing the ray of hope vanished my heart crumbled to pieces  my lids closing my breath slowed&#x85;&#x85; i didn't want to die the darkness pulling me i wanted to live the dream  to get the love i longed for the face i longed to meet knew my life was worthless but still wished to live&#x85;&#x85;&#x85;  i hoped i wished i prayed in the new life i get i wanted the same love the same face to meet&#x85;&#x85;.           i knew i was not wrong               i knew i was right it has happened i lived the dream i wanted to live. ",2027,3.148192882537842,3.434060573577881,3.0479607582092285
74160,Trickle Down Theory,len,12,"trickle down theory by len b (copyright 2006)   imagine living life  out of a cardboard box,  selling matches in the snow,  walking barefoot through the eye of a needle,  on a downward spiral around and around,  collecting bottles and cans sideways on a ferris wheel,  riding on the bus or subway up to a crowded elevator,  nowhere to go,  just to arrive at a dead end down existant's escalator,  getting nothing more than crumbs to bite on baited hook,  drinking polluted water fro from filthy puddles,  through hoops and obstacle courses,  stoned with drugs and alcohol existing and not living,  suffocating in the toxic air dying on death's lonely streets,  barefoot and naked not affording shoes and socks,  helplessness and hopelessness for bag ladies and bag men,  on the east side and the west side about poverty's port and aft side,  not enough life boats to support us all.  where is the land of bread and honey? where is the land of milk and promise? the titanic sank,  there was nineteen hundred,  twenty-nine.  then came the great depression,  throngs of forsaken people jumping out of port-holed windows,  jumping over blood-crimsoned rails,  jumping through ensnarled spider webs.  dolphins and porpoises watch out for the piranahs and the sharks,  falling,  falling out of rafts riddled with holes.  has the new deal become the raw deal? for only impoverishment is trickling down. ",1371,2.4260058403015137,3.144887924194336,2.905543565750122
119569,WE ARE FAMILIY,leovilin,12,"i wish people could be like you a best,  cute dancers as every flower that glooms for being happy is just a part of being kinship loving my new friend on a place where the queen rests her smiles touches me unexpectedly with a very warm and extra hugs and kisses when yesterdays all shouted  it zooms the phrase ''we are family''",330,4.140778064727783,3.761776924133301,3.351346731185913
89942,Moon Apples.,leslie,12,"when i look up at the moon,  i eat apples in my room.  when the stars shine bright,  i eat apples every night. ",111,3.5400333404541016,3.304750919342041,3.309234857559204
103616,Dog,leslie,12,torre  long and whiny with short fur.   she loves to  burrow under pillows and my sheets. ,91,3.350098133087158,3.177985668182373,3.2209279537200928
115765,Princess Kamo,letsaba,12,"princess kamo oh fallen words let the roots renew my vessels.  your beauty,  heaven's door your lips,  last taste of altramel  your body,  my guitar strings.  oh gold skin let my word make ya fall deep into rainbow's heart ,  into your own world.  your smile makes the world a better place to be.  indeed god is a winner,  look how beautiful you are.  indeed god is a greater ,  now walk let the world feel and fall for you.   oh slender my taxi to heaven (princess) my first glass of namaqua (kamo) dear heaven please renew my contract till i found the secret of her beauty.  buhlebendao,  summer's colors the world best song",618,3.966273307800293,3.673530817031861,3.3279597759246826
103988,Dive,levi,12,"the sun comes up,  my head comes up i look toward the sun and feel a connection i take to my feet and realize my luck the world is my oyster,  i'm as free as a traveling dolphin the ocean stays my place of refuge a simpler world where species live for life the choice to live as a sea animal i would not refuse so when i make a trip to dive in the sea i savor the environment and species that surround me i imagine my world as a creature of the reef a simpler world,  free from society",485,3.6652331352233887,3.501140117645264,3.3370792865753174
109082,Winter is here,levi,12,winter is here by levi sites  winter is here and so is snow people are singing and snowflakes flow  winter is great you can watch a christmas show we can eat cookies that are made from dough  it can be fun donâ’t let your bow blow before your christmas party everyone will notice or know you can put snowflakes on your tongue you can see a crow the snowâ’s as white as a polar bearâ’s fur donâ’t injure a toe  it can be very chilly and also very cold it might be ten degrees thatâ’s why you shouldnâ’t get your house sold,525,3.588050842285156,3.417844295501709,3.319328546524048
115999,Through My Eyes,lexie,12,"trying to see the world through my eyes is hard  it can be difficult leaving me scarred  all my insecurities and flaws you don't see  wishing all i could do was feel free  i feel trapped like no one can hear me i just wish people would let me be i wish they could feel the pain i feel knowing that it is very much real  my life was turned upside down feeling the tears in which i drown i couldn't see the light i could feel my throat begin to get tight  the pain just won't go away living with the struggles day by day it feels like no help can be found trying with everything i have to keep my feet on the ground  i feel trapped inside this place wishing people would just give me my space i feel like there's no hope  always finding and learning ways i can cope  i now feel like iâ’m being heard my life is no longer being blurred i slowly begin to; again see the light i now have nothing to fear at night  realizing those feelings don't last forever  i won't feel like that again,  not now not ever  my life gets hard at times  but i sit alone waiting to hear the wonderful chimes  life can get hard but never be afraid to let down the guard it will all be okay  just never let it get in your way",1202,2.482494354248047,3.3511886596679688,2.8650786876678467
101300,Chasing paper,leyana,12,we chase paper me and my homie we chase paper you aint got no money so you can catch us later we chase paper we chase paper,126,2.853978157043457,3.30324125289917,3.194803476333618
116413,Nice,liam,12,"nice people everywhere,   donâ’t know the shame,  that clouds the air.  bad people next to,  nice people who donâ’t know,  that bad exists.  but nice people donâ’t understand,  where problems arise,  that makes the bad people exist.  why are there bad people? who bring others down,  and damages them from the inside out.  who were once nice,  now they think twice,  whether to be bad or nice.  now nice hardly exists,  in todayâ’s world.  we were born innocent,   and died arrogant.  in order just to get somewhere,  in todayâ’s world,  you got to be bad,  because the nice guy dies,  with nothing to show for in his life. ",604,2.400956153869629,3.17920994758606,3.0512003898620605
104229,Ticking Clocks,lian,12,"ticking clocks and whispered voices,   failed attempts explain emotions love for you,  only increasing,  with every feeling hearts pounding minds racing only counting down the days everything will piece itself together hand in hand like smile upon smile that will never fade  and will always remain as long as im yours. ",319,3.759963989257813,3.695487499237061,3.280892133712769
110861,What i love about you,libby,12,i love the way you look at me when you see me i love the way you smile at me when you see me i love the way you put your arm around me i love every thing about you,166,4.524292469024658,3.873774528503418,3.3877110481262207
86527,MY MATHEMATICAL LOVE,lilimei,12,"solving my love problem is the hardest thing to do it is like finding for the square root of negative two i know it would be impossible to computa for the answer but i am very sure it's not an imaginary number  my love has the greatest exponent,  the highest degree but still in your world you want to cancel me my feeling for you is not congruent to what you feel but still,  i want to prove to you that this is real  i want to factor-out all the worries in your life but how,  if there's another variable in your mind and heart hoping that even a little percent,  i will have a part but i can't think of any formula that is right  so many questions,  but still i have no solution how did i arrive to 143,  without any operation and now,  i finally have my own conclusion that it is you,  who will satisfy my love-equation. . . ",821,3.0309600830078125,3.357234001159668,3.1649768352508545
109524,Cat Atack,lily,12,one day a girl named carly opend the door to got the news paper cabam a cat atact she called her mom said hgfydgfjgduvbfdyug her mom said what what she dident anser  she called her dad and said jgjkfhgjkfhgjhtuighkht her dad said what what the monky called his friends they came and atacted,293,2.941462755203247,3.1651551723480225,3.0938217639923096
23529,My teacher&apos;s desk,lily,12,"i saw the mess she had on it,  my teacher's desk is pretty bad,  with all the junk strewn across,  i say it looks pretty sad,   i asked her if i could clean it up,  all she did was shake her head,  she said, ''i'm waiting for recess,  i have to eat instead. ''  she pulled out her sandwich,  and left the wrapper there,  she got mustard on her desk,  and ketchup in her hair.   then she drank some of her milk,  but spilled it on her paper and pen,  she did it once,  twice,  and all over again!",483,2.448272705078125,3.305342674255371,3.023033380508423
