id,title,author,grade,text,char,valence,arousal,dominance
38797,ME,will,5,i have brown eyes  i have brown hair i do not know what to wear.   should i wear red should i wear blue now what should i do?  i shall wear blue so i'll look neat now what shall i eat?  i will not eat turnips i will not eat steak i will not eat cake.   i shall just eat rice that will be nice so what about my shoes?  i have big feet but i have small shoes oh what shall i do?  i shall just be myself that is all i will be i will just be ''me''. ,446,2.845055103302002,3.084540367126465,3.0785162448883057
37829,Tumbling Turtles,will,5,"tumbling turtles tumble  down tickle top tower,  turtles tumble,  rumble,  and fumble  down tickle top tower,    but the turtles tumble and tumble and tumble  down tickle top tower until  crash  they hit the bottom",214,2.594327211380005,3.2749524116516118,2.9806036949157715
37819,Basketball,will,5,"running on the court all day sweat running down your back take the hard foul for the team with floor burns on your knees  dribble,  pass,  shoot the ball take it to the hole box out,  rebound,  outlet pass take it up the court  running down the court all day  with sweat running down your back that is what a true player is a fighter 'til the end",345,3.2598447799682617,3.472837448120117,3.2967183589935303
116944,The contraption,will,5,he runs through the barn&lt;br&gt;wood and tools clutched in his arms&lt;br&gt;back to work he goes!,103,3.167794704437256,3.5557336807250977,3.3515994548797607
72954,What Chickens Do,will,5,"what do chickens do?  well they really like to chew,  sometimes on wood,  i wish could,  do what chickens do,  chickens also fight,  with all of their might,  what do chickens like to do,  chickens like to eat,  cause their names are pete that's what chickens like to do. ",266,2.9283039569854736,3.224604845046997,3.183159112930298
61988,Death Comes,will,5,not fun the end of all it will come slow or fast it olny last a few seconds,78,2.578906297683716,3.0999443531036377,3.064316272735596
62001,Ginger bread men,will,5,i know a clan  of ginger bread man  they have hands  they have bands  they hate everyone  but they still have fun,116,3.419902801513672,3.298657178878784,3.280620813369751
62029,Punk,will,5,i saw a punk.  he had some junk.  he ate some chese.  then he fell to his knees. ,80,2.337080955505371,3.2320780754089355,3.0005812644958496
119782,my bird,will,5,that bird so small.  it sometimes falls.  it makes a small sound. it sings haply. ,81,2.9134087562561035,3.051553726196289,3.022219181060791
101878,Metro 29 Diner,will,5,"on the ceiling are lots of vents,  it does make sense.  it has a bathroom with a vent with a wire,  in the kitchen there is a fryer.  i'd like to eat the grilled cheese,  please,  it's made with real cheese.  the fruit punch tastes good,  the benches are made of wood.  i have a smile on my face,  metro 29 diner is a smiley place!",324,3.9198131561279297,3.5688717365264893,3.350255250930786
109399,Money poem,will,5,"hellow my name is will.   my great grandpa is on a fifty dollor bill.  i'm not good at writing poems but i think yours are swell.   did you see granpa grant on the fifty dollor bill  why are bills crisp can you willow the wisp.  i really don't know what to say i'm having a bad day, but i hope your day is well.   you know you can burn a hole  without any fire a hole in yor pocket.  buying a kindle fire.   talking about a kindle.  they are great.  did you know that their only one twenty eight.  their a mini ipad when i get one  ill really be glad.   i have many my self one seventy five to be exact did you know i have a pet named clive he got in trouble with a big bee hive well now im done now i hope when you read this youll have big fun.  peace off",749,3.5449373722076416,3.351391553878784,3.3025567531585693
27130,"Too big, too tall",willa,5,"i'm too big,  too tall,  too round,  too wide,  too skinny,  my hairs too short and it won't grow.  i have too many freckles and too many teeth.  my feet are to small and my hands are huge.  when i'm offered a sweet i say i'd prefer a fig.  my lips are too fat,  my legs are too long,  i can't swim,  i'm a terrible writer,  i can't sit still and read.  i can't go on overnights,  i sleep with two nightlights.  i have braces and wear glasses.  i eat too much food,  i'm not tidy. . . anything else you want to know?",498,2.5093929767608643,3.1154770851135254,3.0084316730499268
117964,THE TREE OUTSIDE MY HOUSE,willem,5,the tree outside my house has been there all my life  but i never noticed how the branches stretch toward the sky like the arms of a hundred people trying to touch the clouds the limbs like a spider's spinning a dainty web and it looks like it is saying something and if it said something it probably said â‘â’iâ’d really like to touch your house and please and please donâ’t turn me into a shedâ’â’ and because of its expression i think iâ’d call it norman&#x85;. .  the tree,478,3.083099365234375,3.1810224056243896,3.191455602645874
89962,Spotty,william,5,"spotty is black and has one stripe.  he can jump.  up , up , and away.  spot is big mean and lean. hear him roar! spotty can run, run, run.  fast, fast fast.  spotty likes to eat.  yum,  yum,  yum.  spotty likes to sit in the front yard to see the.  sun,  sun,  sun.  so if you see a black dog with one white stripe thaaaats spotty!",316,3.470719575881958,3.667944431304932,3.35738205909729
45186,Lord of the Rings,william,5,"hobbits frodo,  merry and sam wizards,  gandolf,  too lord of the rings is what i like also return of the king",110,3.645518779754639,3.3666586875915527,3.327165365219116
109731,Flirty Gerite,william,5,"i once knew a girl named gertie.  she was oh very dirty,  i think she was thirty.  we used to play squirty,  but she was very flirty. ",132,2.5537681579589844,3.208668708801269,3.0771126747131348
109785,There&apos;s a T- Rex on my block,william,5,ther's a t- rex on my block i glared at my clock. there's lots of time so i climed out the windo with my kindle. i heard the the dead grass sliping away as i entered a cave.  oh its just a baby t- rex. ,201,3.001434564590454,3.150287628173828,3.152573585510254
109760,Ed,william,5,i know a man his name is ed.  he always lays in bed with his shiny bald head.  his friend ted was a fed.  he was also a baldhead who now always lays in bed.  but he loves italian french bread.  so does ed. ,203,3.278530597686768,3.155672788619995,3.2297251224517822
38384,My Writing Stick,william,5,"my writing stick has an incredible trick it can write day and night it can write on the flight the sharp point jots down the story of medieval times and and all the knight's glory it wrote until noon in the dark black lagoon i wrote about magic it was quite tragic i wrote about a war people thought it was a bore i wrote something else about caroling bells i wrote about stuff the billy goats gruff people who incinerate the houses that are just too late lions,  tigers,  bears,  oh my! can barnhouses really fly? dragons in their dreadful lairs swirling,  gaping,  towering stairs a touch of this a touch of that a rabbit jumping out of a hat people laugh,  people tremble can't they see it's just my pencil?",707,3.178408145904541,3.467096328735352,3.196477174758911
39926,The Cat Who Could Fly,william,5,"there once was a cat who could fly,  it's good that he didn't lie,  but he lost his wings,  and fell on sharp things,  he was relieved his rear end didn't fry. ",158,2.7821216583251958,3.306180953979492,3.0195491313934326
20858,Thinking of a Poem,william,5,writing a poem can be fun when thoughts come they fall to the page other than white space i fear to have so much fun think and write till the end. ,149,3.694183111190796,3.423025608062744,3.2966151237487797
55386,Internet,william,5,"i love the computer,  yes i do,  how about you.  the internet rocks.  internet",77,4.1189398765563965,3.676243543624878,3.460034132003784
50617,Dogs,william,5,"furry and cute barking, holing, graling protecking me when i need him pets",75,3.3950648307800293,3.514530658721924,3.276991128921509
115499,Animals,william,5,bark bark iâ’m a cat meow meow iâ’m a cow chirp chirp iâ’m a frog  hiss hiss iâ’m a fish moo moo iâ’m a chicken roar roar iâ’m a boar  squeal squeal iâ’m llama  oink oink iâ’m a whale  welcome to my mind,207,3.418718099594116,3.3441619873046875,3.2147200107574463
14395,The Funky Chicken,william,5,there once was a funky chicken.  he moex instead of cluking. then he started ducking.  for those flying egg's of goop.  which through him a loop. then he through a leg to see a secert egg. the funky chicken,203,3.0023303031921387,3.178866386413574,3.1498453617095947
18667,Soccer,william,5,we had a good game.   are socks are as wet as the ocean.  we did have some fame.  all the kids were in motion.  we had a good game!,130,3.9701223373413086,3.69636344909668,3.439204692840576
95097,The One $ Bill,william,5,"you are green and black.  you are easy to pack.  you carry great value,  as i spend you. ",88,3.568624258041382,3.2577455043792725,3.3952200412750244
95092,Baseball,william,5,"baseball, baseball i love you.  you are very fun to play.   i would play you but i have the flu.  when i get better i`ll play you one day. ",137,4.041445255279541,3.633454561233521,3.39150333404541
83315,My dog Oof,william,5,i once had a dog name oof.  he used to be a goof.  i once had a dog name rover.  he used to roll over. ,103,2.6362404823303223,3.084057569503784,3.094377279281616
112367,Video games,william,5,i love video games.  click click click goes the controller.  run run run goes the person.  i love video games. ,110,3.815199851989746,3.5248565673828125,3.360161066055298
41529,My computer,william,5,fun entertaining  cool interesting games search for information  my computer white can play games download cool games slow computer obeys black screen,156,3.6099071502685542,3.302179336547852,3.2996091842651367
15725,Mike,william,5,"his name is mike,  he loves to ride a bike.  bikes he realy likes,  but he hates to write.  he also likes to fly a kite,  he does???. . .  phyc. ",139,3.397900104522705,3.2290101051330566,3.2221133708953857
117637,Rain drop,william,5,on one sunny day i sit in a puddle waiting to be evaporated. i want to be in the air in a cloud any where else than a puddle. i want to be a human they have legs. one day i realize i do have legs i start to evaporate i am in a cloud. i fall down again in a puddle. that was fun. ,276,3.516256332397461,3.5254898071289062,3.198061227798462
46683,The Rainy Day,william,5,it's raining it's pouring  if the old man is snoring then we can not hear him over all off the rain.  the doors creak  the roofs leak it's truly a miserable day.  flash! crash! i hear lightning thrash why can't the rain go away?  crash! the wind bashed open the door.  a shadowy figure steps inside.  flash! crash! lightning goes again.  bright light quickly flashes against his face.  whew! it's just my dad. ,406,2.5195138454437256,3.538872718811035,2.947824239730835
47651,Chairs,william,5,do chairs like supporting our weight?  when we sit in them is it us they hate? do chairs dislike our bony backs? are chairs always hoping that they will not crack?,166,2.7543208599090576,3.0984785556793213,3.1011321544647217
114069,Basketball,william,5,when i think of people cherry i think a basketball and when i think of a basketball goal  i think of scoreing basket's and when i get the ball i think i have a chance to get the ball in the net. ,197,3.2575128078460693,3.307271957397461,3.318519830703736
73912,Future,william,5,future i wonder about the future.  \twill there be flying cars.   were all you have to do is lean back say your destination and it takes you there.  \twill there be robots that do all your chores and you could relax more.   then we will do no more work.  \twill there be a device that you would use to give all the knowledge you need in life .   will schools seize to exist.  \twill gasoline run out and the flying cars run on milk.  \t,432,3.295644760131836,3.218958616256714,3.231421709060669
49637,Winter,william,5,frozen lakes  hot pankakes lots of snow hot cocoa skates and skies  evergreen trees funny hats thermostats sunset blaze holidays snowball fights fireplace nights chimneys steaming winter dreaming. . . ,201,3.4487075805664062,3.2852468490600586,3.22645115852356
113788,My favorite car,william,5,"my favorite car is a bugatti veyron i like it because it go up to 500 mph that mean that it is very fast and i like how it look and i like how the inside and how the color go hard.  the bugatti veyron is an 8-litre,  mid engine grand touring car.  the super sport version is the fastest road-legal production car in the world with a top speed of 267 mph and was designed and developed by the volkswagen group. how would you define the most amazing production car in the world? would it be: the car with the most horsepower? the car with the fastest top speed and acceleration? the most expensive car? at the moment,  the bugatti  veyron appears to have it all:it is the most important car on the lot it cost up to 1 million dollar  a w-16 engine that can produce 1, 001 horsepower a top speed of 250+ mph (400+ kph) a zero-to-60 time of three seconds a zero-to-180 time of 14 seconds a price tag somewhere in the $1. 2 million range.  in this article,  we will take an in-depth look at this amazing automobile and see how it is possible to fit so much performance into a single machine.  it all starts with the engine. . . so let's start with the engine.  how would you begin the design process for an engine this powerful? if you have read how car engines work,  you know that if you want to create a 1, 000-horsepower engine,  it has to be able to burn enough gasoline to generate 1, 000 horsepower.  that works out to about 1. 33 gallons (5 liters) of gasoline per minute.  we need a 16-liter engine to burn 1. 33 gallons of gas per minute.  that actually makes sense -- the engine in the dodge viper is 8. 0 liters in displacement and produces 500 hp.  but there's a problem: a 16-liter v-8 engine would be very large.  and the pistons would be massive,  so there would be no way it could turn at 6, 000 rotations per minute (rpm).  it might turn at a maximum of 2, 000 rpm,  meaning that you would need an immense 48-liter engine to generate 1, 000 hp.  clearly an engine that big is impossible in a passenger car.  so how did bugatti fit 1, 000 horsepower into a passenger car? let's find out.  a bugatti is the most car that is valuable",2110,3.321381092071533,3.251492738723755,3.26858139038086
44872,The Noisy dog,william,5,my dog is very noisy  she has a pink nose that constantly blows  she's full of courage her courage will discourage  even though she is afraid of a storm  her eyes are a dark brown that shows she is not down,209,2.972673892974853,3.4243533611297607,3.164362668991089
53903,Dancing in the rain!,william,5,i'm dancing in the rain people call me insane please don't complain i just can't help dancing in he rain. ,108,2.534562587738037,3.328765869140625,3.040045022964477
30830,My Hamster,william,5,"my hamster, he sleeps all day long,   that's only when he's tired,   at night his squeeky voice sounds like  a song,   because it get's higher and higher. ",153,3.07615327835083,3.282792091369629,3.1400153636932373
18468,I&apos;m Going To Go Insane,william,5,"oh, no homework! mrs. hill lighten up you give too much please lighten up! i, m about to go bonkers you have no choice but to lighten up please no homework! i may soon throw up",176,2.4948410987854004,3.727150917053223,3.3014752864837646
85592,When I Awoke One Morning,william,5,"when i awoke one morning a fox was on my head i asked, ''what are you doing there?'' he looked at me and said , ''i'm running away from the bear. ''",148,2.628852128982544,3.560441017150879,3.033190488815308
22111,Tom,william,5,"stupid fat tom,  went on kids. com.  played a game,  thought it was lame,   so instead,   he went to bed. ",102,2.363848924636841,3.121448040008545,3.078016996383667
22287,Red,william,5,"there once was a guy named pat.  everyone thought he was fat.  he wanted satisfaction,   so he took action,  and suddenly he was as thin as a rat. ",145,3.1257762908935547,3.328145265579224,3.2512996196746826
91766,DESTRUCTION,willie,5,destruction can happen everywhere.  you might not know when it happens it can happen anywhere. ,97,2.4644644260406494,3.1942291259765625,3.042259454727173
62495,Cats,willow,5,"do you like cats?   they sleep on mats.  they jump high,  they almost reach the sky.  they are so soft,  they feel like cloth.  they sleep sixteen hours a day,  then they get up and play.  cats like chicken,  turkey,  and fish that is a very good dish.  they sometimes kill mice and birds they dice them up real nice,  then they give them a wack and enjoy a snack.   cats are very nice,  when they do not kill mice.  my cat is orange and white he never bites.  he does not get in a fight,  but maybe sometimes with a dog. ",508,3.5513181686401367,3.335457324981689,3.2644193172454834
109328,Peaches and Leaches,wilmer,5,if you eat some peaches you'll get attacked by some leaches. the leaches will be on some beaches. they'll be on the hunt for some peaches so look out for some leaches. ,168,2.966679573059082,3.215453624725342,3.193420171737671
90347,Wacky willy,wilson,5,wacky willy went to billy who went to kelly who got a berry who past the berry to billy who past it to wacky willy. ,121,2.988022565841675,2.9433250427246094,3.177814722061157
90824,Emotions,wilson,5,star star oh so far i wonder where you are now i know how to show my emotions for you i hopeyou do to.             not a true sory,251,2.9037656784057617,3.2543506622314453,3.0403778553009038
54872,POET&apos;S TREE,wing,5,"underneath the poet tree come and rest awhile with me,  and watch the way the word-web weaves between the shady story leaves.  the branches of the tree reach from the mountains th the sea.  so come and dream,  or come and climb just don't get hit by falling rhymes. ",265,3.3454551696777344,3.174470901489258,3.2052104473114014
120255,Feet,winnie,5,"feet,  feet walk around, .  then starts running,   faster and faster! then slows down,  i bend down to tie my shoes,  then i jump up! i wiggle my toes.  then i think long or short,  small or big,  fat or skinny,  i love my feet!",221,3.760575771331787,3.981689929962158,3.3810620307922363
41538,The Best Brother in the World,winnie,5,"dennis is his name,  funny as a clown,  old yet young,  has a neat job,  he is smart as a nerd,  always helps me with difficulty in my homework,  glued to the computer,  glued to the tv,  heâ’s all mine. ",199,3.6736035346984863,3.399193525314331,3.328073740005493
42761,Pay Attention!!!,winnie,5,"look at me,  iâ’m a bookworm,  you can tell â‘cause my nose is in the book,  you canâ’t see my face,  â“pay attentionâ” says the teacher,  but do i? nope,   â“iâ’m at the best part, â” i wail,  the teacher takes it,   iâ’m forced to pay attention,  â“snoreâ” i go,  i have fallen asleep. ",280,3.1956183910369877,3.4624276161193848,3.27018141746521
97186,P.E.,winston,5,iâ’m running.  iâ’m hopping.  iâ’m skipping.  iâ’m jumping.  every thing i do  i canâ’t stop moveâ’n. ,102,3.1729061603546143,3.583286762237549,3.317745923995972
55306,Hibernation,winston,5,"a small squirrel scurries, up trees gatering ripe nuts, storing for the winter. ",80,3.046175003051758,3.05154800415039,3.1921427249908447
77614,Clock,wlkes,5,"the clock makes a click noise,  the clock has black numbers on it,  the hands on the clock move. ",97,3.080991268157959,3.165624618530273,3.111894130706787
31373,Hizzel Shnizzel Dizzel,wordup,5,what is up in this hizzel i wonder if it is cause of the drizzel how old are you i am 10 i think ull like me if your a man,125,2.96127986907959,3.203129768371582,3.1595213413238525
75981,Creepy Crawly Home,writer,5,a house made of millions of grains of sand piled on top of each other.  a house lit by the bright bright sun shining through the hole to the underground passage.  a house in the forest behind a newly built house in a little town.  a house inhabited by little red and black ants crawling in and out of their sandy little home. ,325,3.088503837585449,3.0159294605255127,3.115781784057617
86464,Bird with a tie,writer,5,one bright day i think it was sunday there was bird on my head the color of lead it glared at me  it said that i have to pay a fee i said why and he said for this fancy tie thats not mine  he said,199,2.610434055328369,3.3149993419647217,3.084352731704712
50385,I Wish I Studied,writer,5,"my mom gets me out of bed, then suddenly i feel a little bit of dread.  oh no! i didn't study for my test, and it's today! instead of studying i went outside to play.  i said to my mom",183,2.327410697937012,3.6079392433166495,2.922253131866455
94326,The Name Game,writer,5,"the lollipop lady patrolled the streets,  i thought her job was selling sweets.  til the day i started school,  i asked her like an innocent fool: hi there miss what have you got? chocolate,  liquorice or lollipop? i have 10 pence,  its not alot,  enough for sweeties from your shop.  she looked at me with a mighty grin,  said",322,3.386017084121704,3.4030206203460693,3.272555351257324
20145,Mr. Mosquito,wwbtds,5,"mr.  mosquito went to get a burrito,   but got hit by a torpedo and that was the end of mr.  mosquito. ",102,2.5669057369232178,3.1402130126953125,3.0353729724884038
111301,Winter,wyatt,5,everyday it is snowing  fa la la la la la la   and my tree is up and blinking  fa la la la la la la   the holly and the ivy are blooming  fa la la la la la la   and everyone is glowing  fa la la la la la la,210,3.5996310710906982,3.452730655670166,3.243337631225586
70704,i not here,wyatt,5,i not here i'm out at the pier thinking about deer that is why i not here,76,2.5430357456207275,3.1353321075439453,3.106341600418091
77635,Sports,wyman,5,"my name is wyman and i love sports, all kind of sorts, from basketball, to football, and soccer i love them all, and trust me you don't have to be tall. you could look at me i'm short but i play them all. but trust me i'm very good i'm very good i'm the best kid in my neighborhood. well that's from me to you about sports and remember you can play all sorts. ",354,3.893364429473877,3.562852621078491,3.4345874786376958
78763,roses are red,wynn,5,roses are red violets are blue.   my gym socks smell but they're better than you. ,83,3.2166216373443604,3.153883457183838,3.2469241619110107
14661,My Friend,wynne,5,"i've got a friend with black shiny hair  and never cares of what she wears.  her huge round eyes shine like stars,  and follows the rule all the time,  and makes words rhyme,  rhyme,  rhyme.  her sweet young voice sings like the nightingale.  she sits by the ocean and watch the whales,  and listen to their tales.  she loves the song that are classical and always think they are musical.  she weights 75 pounds  and is five feet tall and eight inches.  she walks little by little,  inch by inch.  she always is so clean  and never leaves a pinch of dust around.  she never is so mean  and never frowned.  so you wish you would know who is this splendid girl.   that makes you twirl,  and is my pal.  why it's my cousin crystal!",719,3.662398099899292,3.5040879249572754,3.3024332523345947
66106,My littel twerpy brother,wynter,5,that littel thing that bugs you alot follows you all around i don't know why i tought  him how to walk  he's always around me  he even bothers mein school  he bothers me to much ''i hate him'' he battled me to a yu-gi-yo dule  it's about time he left with him {his dad}  but now that he left  there's someone new her name is kim,331,2.43133807182312,3.4087438583374023,3.082849740982056
116250,My Dog,xander,5,"my dogs' ears smell like socks,  my dog has a big brain,  my dog has feet the size of rocks;  my dog is faster than a car,  my dog is the size of a log,  my dog can jump like a deer,  my dog likes my favorite teddy bear;  my dog feels like a cloud,  my dogs' bark is like a sonic scream,  my dog is like a little buddy,  my dog is my little treasure,  my dog is like a fluffy ball of cotton.   if you have a dog like mine,  you would feel golden through out your life;",463,3.7507128715515137,3.643004894256592,3.3068478107452397
117161,In 20 years,xander,5,in 20 years i would have two dogs i would have a good job and even win the lottery  maybe in 20 years i would make something helpful live in a nice and wonderful house  be at least 80 years old and be with loved ones  maybe in 20 years i will be famous even have a pool but ii will always remember right now << /p=\\>\n\n\n\t\t\t\t\t\t</<>,342,3.559896945953369,3.337808132171631,3.33345103263855
109046,xavier.B,xavier,5,when my dad snores he sounds like a org. ,43,2.702341079711914,2.9982028007507324,3.076155424118042
114052,Bananas,xavier,5,bananas are good they taste so sweet it is better than pie unless u make banana pie you can by them at a store u can by them at a bakery's,141,3.736790657043457,3.38169264793396,3.371861696243286
21277,Snow,xavier,5,"it turns into ice crystals  when it rains it always happens in winter never happens in summer people make them into ice balls  they throw them at people,  too what are these little ice crystals called that fall from the sky?",226,2.7678592205047607,3.1945934295654297,3.105259656906128
112303,Life,xavier,5,life is hard it could be tough in life  in life i didn't get lot of stuff in life in the war life was hard we get push around but,132,2.309469223022461,3.0515151023864746,2.8858296871185303
53528,Falling,xavier,5,im falling. . . falling. . down below.  falling to a place i do not  know.  falling down into the mist.  to a place i would be missed.   im falling. . . falling. . . falling. . into darkness. ,177,2.4297821521759038,3.28603744506836,2.764141321182251
