id,title,author,grade,text,char,valence,arousal,dominance
84006,Me,ali,7,my nose is gold my teeth are old my face looks like a big brass bowl i have 5 dots upon my nose i cannot sing and dont know why i wear a tie around my thigh it might be wierd but i dont care i wear a bow around my toe,220,2.9169788360595703,3.224987030029297,3.142084836959839
104261,Life  is But  A Dream,ali,7,life is but a dream when your on the spot whether your happy or sad cold or hot  my life is my canvas my mind is my paint brush living my life gives me a rush,164,3.909335851669312,3.741424083709717,3.3742353916168213
66007,Brett,ali,7,"his ears like old socks,  he looks like a pirate with  with his black eye-patch.  heâ’s often mistaken for a dalmation.  he is full of spots that are seeds in the middle of an apple.  is loving and loyal,  he loves to give me kisses. ",234,3.648274183273315,3.431903839111328,3.234208345413208
84507,The Last Day,ali,7,"it was cold,  very,  very cold a gentle breeze swung in the air in a distance you could hear a cry,  very familiar cry the sound of death rung in the air and yet i sit without a care trying to live my life without looking back,  as i lay down and cry. . .  good-bye",261,2.202056884765625,3.501647472381592,2.7940433025360107
35623,Best Friends Forever!,alice,7,"since kindergarden we have been best friends,  even through that really big fight. . . but now we're friends again and i am sorry for everything i have said to that has hurt your feelings! cause girl,  your too nice for that stuff! i know what you are dealing with.  well i dont but i know of it. . . and if you ever need anyone just gimme a call cause i'm always there for you. . . i know this doesn't rhyme,  but its just for and you we will make it rhyme.  cause this friendship is meant to me!",486,3.452324867248535,3.586779832839966,3.3533942699432373
30383,Gum,alice,7,"i love to chew gum it makes you say yum yum i blow bubbles with my tounge i chew gum with my chum i like gum  chewy,  gooey gum twedaly-dedaly dum don't blow it to big  it's as pink as a pig i like gum  lovable,  hugable gum i put it on my thumb i swirl it and twirl it too it gets stuck on my shoe i like gum  when i chew gum  i have lots of fun  and i am aloof  i'd chew gum on my roof i like gum",401,3.8102636337280273,3.530258893966675,3.34173583984375
105811,BASKET-BALL&apos;S,alicia,7,"basket-ball's are round  they make a strange sound  sort of like rain on a window pain  it makes me laugh when it goes boom,  boom , boom makies you want to sat zoom,  zoom , zoom",178,3.446382761001587,3.539031982421875,3.2506320476531982
46696,*Untitled*,alicia,7,"you speak words that were never spoken being with you my heart wont be broken no one has ever really cared though my heart hasn't shared love is so new to me you've set my soul free without you,  incomplete i'd be daylight,  is what i wouldnt see i really truelly am in love with you i pray that you feel this way too",319,3.815777540206909,3.7932324409484863,3.33159613609314
38838,Can you see me?,alicia,7,can you see a dark place where it rains? can you see me? can you see a crying child? can you see me? can you see me trapped in a mask? can you see me,153,2.5490524768829346,3.265669345855713,2.855186939239502
35287,Angels Of My Life,alicia,7,"i have met many angels,  but none at all like you,  the angels of my life,  my friends including you.  but you are very special,  very special indeed,  out of all the angels in this world,  only you i need. ",203,3.973130702972412,3.672963857650757,3.316679716110229
30392,Nights of the Owls,alicia,7,"owls at night,  at the middle of twilight,  owls at night,  with a scary fright",79,2.494802951812744,3.421689510345459,2.906816005706787
44404,Every Time.....,alicia,7,i have this feeling deep down inside it's a feeling i can't describe  it's a feeling i just feel everyday  right now you're my only crush every time i see you i blush  every time i get a hug i always feel warm and snug  every time i talk to you on the phone i think i love you to the bone,293,4.130610466003418,3.881645679473877,3.407636880874634
32873,They say,alicia,7,they look like us we say   they sound like us too we think   but if they look like us  we say  and they sound like us too we think  why do people say theyre better than us  we observe,187,2.914473056793213,3.065426588058472,3.1585466861724854
38854,~~*Forever Friends*~~,alicia,7,"we are the tightest of friends people can try to beat us but our relationship will never end  nothing could ever tear us apart our friendship,  our memories remain in my heart  just remember how much i care and when your lonely remember i'm always there  when you're feeling down just think of all the good times all the good things we've shared an turn that frown upside down  we're pals and buds we're cool for sure we've seen more than others will ever endure forever friends. . . ",483,3.64130973815918,3.5663743019104004,3.318612813949585
28460,Dreams,alicia,7,when i dance i feel intence the sweat rolls down my face  when i step up to the stage i feel like i'm in a cage people are sorounding everywhere  we walk on stage the music plays my mind go totally blank  people stare but i don't seem to care i just think of what to do  the music stops we walk off stage awards are about to start  we get a gold but i thought i told that this is just a dream,395,3.28338623046875,3.5080790519714355,3.1690316200256348
105509,ThOmAs and GLEnN!!!!!!!,alicia,7,"thomas is awesome.  thomas is a person.  he is not a train.  he is different.  glenn you no glenn.  no you dont know glenn.  glenn is blind,  but he is still da bomb. thomas and glenn are best freinds.  thomas and glenn are from a movie.  i forget the name of the movie. i love thomas and glenn.  thomas=glenn!!!",303,3.911333322525024,3.7873377799987793,3.3469574451446533
105545,LOVE!,alicia,7,"when i saw you i was overwhelmed by those looks you gave me, i couldnt breath, for a moment my life stopped, then you talked to me, it became dark,  and night had fallen,  i was upset when i was called i had to go in and i wish the was never finished. ",249,2.726874828338623,3.5193464756011963,2.882751703262329
105573,My best freind!,alicia,7,i met this girl at dance she seemed pretty cool we started to talk  we talked for a while  the next week i was so excited to go to dance.  we hung out and talked the whole class.  we had a blast.   she came over for the first time  my parents loved her i liked her too we have the best times together  her name is alex and she is my best freind!!,346,4.265522480010986,3.9346768856048575,3.388071298599243
116460,Love,alina,7,"love is mysterious.   it makes people so happy,  and some so sad.   it brings tears of joy,  and tears of sadness.   it is so powerful,  and so powerless.   love will never be understood by anyone,  ever. ",200,3.9165093898773193,3.758464336395264,3.268473863601685
105060,Age Old Tree,alina,7,you have bends and twists.  crooked and dying limbs. your a tree an age old. you have seen the cars fly by.  and the seasons change. your an age old tree. you listen to the busy street. and the birds that sing to you. your an age old tree. you are tall and old.  yet you'll bear new leaves. you are an age old tree,306,3.2126777172088623,3.0734105110168457,3.1866209506988525
62187,love is in the air,alisa,7,love is in the air  love is in the air that is why i care that love is so rare  thati dare to asy the one with true afair thats why i care that loveis in the air,164,3.8852970600128174,3.652311325073242,3.39516282081604
85556,Dogs,alisa,7,dogs are so exiciting and fun. ,33,4.490768909454346,3.82177996635437,3.3857409954071045
36434,Alisha,alisha,7,"alisha  caring,  honest,  responsible,   wishes to become a beautician,   dreams of helping the poor,   wants to become rich.   who wonders what's going on in  heaven.   who fears spiders.   who is afraid of homeless people.   who likes boys with a shortcut and bright skin.   who believes in god.   who loves peanut butter cookies.  who loves going to the movies.  who loves pizza and tacos.  who loves family.   who plans to have a faithful husband.  who plans to live an honest life.  who plans to explore the world. ",505,3.5872159004211426,3.3470146656036377,3.2720096111297607
53706,Busy Times,alisha,7,"busy times- summer.  weddings to plan.  love is around  in every way.   anniversary's to celebrate.   birthdays.  forth of july.  cousins come up.  have a good time.  busy times.    swimming,  basketball,  hanging out with family.    have jobs to do too.  being a flower girl.  driving a buggy at a wedding.   everything happens when the weather starts changing.  when the sun comes out people run out to play,  all happy and gay.  being with your family makes you shine.  it's summer.  busy times. ",481,3.81351375579834,3.508042335510254,3.342605829238892
14808,Animals,alisha,7,frogs leap while birds go cheap horses run and cows have fun  chewing their cud  standing in the mud,103,3.125452041625977,3.223410129547119,3.230735540390014
46259,Food,alisha,7,food is good  and food is great some like meat  and some like cake and another thing i know  is that it will make you fat so do yourself a favor and don't end up like my cat,176,3.607796669006348,3.401797294616699,3.388758897781372
46135,Family,alisha,7,family is their for you when friends are not they help you to do things and help you in knots  but something they can't do  is read your mind  so make it easier for them  and don't waste time,194,3.1191940307617188,3.1694819927215576,3.25256896018982
39575,&apos;&apos;Myself &apos;&apos;,alisha,7,"i used to think  i was most important,   so important that   nothing else mattered.  nothing could change the            greediness inside  until now.   when you start looking  at what's ahead,  and what's more important,  it makes everything different.  you have a friend  who has troubles  at  school or home,   so you help them every day        to ease their way.  you see a frown on their face,          and because of you or myself,  they have a better day.   now they have that frown  turned upside down.    now i know everything isn't about me,   it's about you too.   it's about your family and friends.  it's about the trees that will someday end.  it's about forgiveness,  sharing and helping one another and nothing could change the way i feel now!",745,3.2116403579711914,3.414870262145996,3.298783779144287
61976,The Last Day Of School,alisha,7,"the last homework was given,  the last bell has rang it's time to go home now to rest my little brain.   say good bye teachers,  good bye icky lunch food! and now for once,  my teacher's in a good mood.   we all run outside,  throw our papers in the air.  while the teachers are thinking,  ''this isnt fair!''  ''now we have to clean up! janitors get your brooms! sweep,  sweep,  sweep! when your done,  clean all the rooms!''  now all the kids run home to their t. v.  set but we have another year! i can't forget.   to start all over.  new teacher to fool.  but theirs one thing to look foward to,  and that's the last day of school!",621,3.4100663661956787,3.6032137870788574,3.376259088516236
47799,The River Way,alishia,7,"i traveled to the woods that fine,  spring day,   and walked among the trees so tall and so strong.  there in the forest lies the river way,  a river flowing so far and so strong.   peace and serenity are the reasons,  for people to see this beautiful stream.  it is so graceful in all four seasons,  like you strayed into a lovely,  calm dream.   the river winds around the plants and trees,  nothing ever disturbed,  nothing will change.  for this pleasing sight,  the day you will seize,  for this setting,  only god could arrange.   no more shall i sit by rivers and lay,  never again to see,  the river way. ",596,3.70182991027832,3.4982285499572754,3.300049066543579
118938,A Favorite Food,alison,7,"fried rice is so good,  it is an excellent type of food.  crunch! the sound of chewing a piece of onion in the rice,  that taste was ever so nice.  fried rice is heaven compressed into a dish; eating it is pure bliss.  carrots,  onions,  eggs,  and some meat,  are reasons why this is dish is such a treat.  fried rice is like a roller coaster,  itâ’s so fun in the moment,  but youâ’ll miss it when youâ’re done with it.  oh,  right now,  i wish i could be eating just a small bit of it!",477,4.069681167602539,3.775005340576172,3.392741203308105
118937,A New Day: Haiku,alison,7,"the sun is smiling,  animals begin to wake up,  morning has arrived. ",69,3.8496134281158447,3.4467649459838867,3.288754463195801
28488,My Cat,alison,7,"there is no other cat i know with bright,  orange fur and dots of white snow as my cat with his soft purr.   there is no other cat that lays in the sun beams to nap as i feel his fluffy tail pat then stretch on my warm lap. ",224,3.552800178527832,3.420329570770264,3.240320205688477
104075,"Music is fun, music is cool,",alissa,7,"music is fun,  music is cool,   and music is the thing that  wakes me up to go to school.   music can be funny,  music can be sad,   but my cousin likes the one  that reminds her of her dad.   there are many types of music.   there is rock and there is pop,   there is even some that can make you hop.   this is what music can do,  but hopefully music                 has the same feeling about you",392,3.731463432312012,3.43848729133606,3.3131754398345947
100824,A Jap&apos;s View,alissa,7,a japanease view\t\t  i remember when my family was took from home. . and i got pulled out of class to go with a soldier.   i remember when my family got towed in cars. . . buses. . .  and even just walking.   i remember when my family was put in a small place and roomed.   and when my family was held in a small room with many others. . . to eat. . sleep and even just live.   i remember were my family stayed. . . in a wooden almost,418,2.7030766010284424,3.1159825325012207,2.9780097007751465
45817,Bright Sunlight,alivia,7,"the sunset is as bright as a lit lightbulb in your face,  it blinds you for a short time.  the sunset is like a vast swirl of red,  orange and yellow on the sky.  you feel mezmerized by the multi-colors given off by the sky.  the sun blends with the pale blue sky,  giving a simple red and purple.  thr sunset droops past a few trees,  and gently creates a line on the horizon as the sun sets,  a newday will begin,  many people venture outside to see such a beautiful creation we get to see every afternoon.  a warm,  fuzzy feeling fills the air. . .  long live the sunset!",562,3.6697440147399902,3.528628349304199,3.259084463119507
45838,Creation Operation: Drawing,alivia,7,i drew today a pretty little painted picture it is beautiful  more manga today i'm inspired by many artists it's very unique  anime &amp; manga  far different from other cartoons they encourage me,200,3.889693975448608,3.554399013519287,3.35821795463562
98714,Roses,aliya,7,roses are red violets are blue i go to school to do what i do. ,65,3.163681030273437,3.0291850566864014,3.2478890419006348
104922,Sammy the Bear,aliyah,7,always sitting down.       always wearing clothes.         he always listens. ,78,3.168614387512207,2.956661939620972,3.1952123641967773
95774,The feeling of a meadow,aliyah,7,warm yellow sun smiling brightly in your face birds singing majesticaly in the trees wild flowers swaying in the cool breeze   grass crisp and yellow you must be in a meadow,176,3.673438549041748,3.3715622425079346,3.24385666847229
104111,Thoughts Of a volleyball,aliza,7,"â“thoughts of a volleyballâ” by: aliza   i love to swoop down over the net and score,  although you hit so hard it makes me sore.  my favorite thing to do is win with you,   when you lock me up in the closet  it makes me cry,  â“boo hoo boo hooâ” you may think i donâ’t think just  because i am round and pink,   but when i am alone  i can make sound and even wink.   so as i wait in darkness and despair,  slowly and solemnly i am loosing air,   still wondering if you even care.  i dream and flashback on the days we had,  knowing that itâ’s over makes me sad.  so i sit and canâ’t help but wonder when volleyball will come back hoping it will never end. ",649,2.891443014144897,3.421844005584717,3.0534093379974365
120587,The King Will Rise,allana,7,once a human/ not a man/  together united/ by hand/  flesh/ blood/ spirit/  beloved by god/ when the earth bleeds/ the king will rise/,137,3.3212730884552,3.337014675140381,3.322345495223999
73339,The Girl Who Cried Inside,allee,7,a girl stands going through through the motions oflife  with a smile plastered  upon her face nobody looks close enough to realize  that her smile is fake she really is crying on the inside  falling apart  and drowning in her pain,234,2.364861249923706,3.420323848724365,2.841037511825561
25679,I Met Myself the Other Day,allegia,7,"i met myself the other day,  in skys of blue and clouds of gray,  sitting in the flowers of may,  relaxing in an exciting way,  that was when it happened.   i was shocked,   and with a shout,  jumped up and went to check it out.   i circled the forest  at least three times! then i finally got frustrated,  and hit the ground  with that head of mine! then it happend again.   i jumped up,  as quick as lightning!  i tried to pursue it,  it sure was exciting! i lost it half way through.  it's like it just dissapeared!  i couldn't remember what it looked like,  but then my mind cleared.  i waited for it to ''happen''.   i awoke with a jump,  how long had i been out!  i looked around,  something had been about.  i prowled around to get some answers,  i followed clues and prints.  something moved behind me,  and there was a sudden smell of mints! that was when i saw it.   it was misty and tall white,  funny lookin' and no distinguishable shape at all! i expected something more,  something scary,  something with gore.  then it spoke.   (to be continued)",1040,3.264317035675049,3.6770808696746826,3.142567873001098
15308,Love,allegra,7,love is that feeling when you know he is near love is a tingle when he touches your hand it is a sensation that overfalls your body love is when your heart splitts in two it is when you get goosbumps when he walks by love is when your heart melts love is those teary nights it is when you sense his gaze love is when you think of him 24/7 love is simply love,361,4.139403343200684,3.925446033477783,3.3119542598724365
17497,The Bush,allie,7,sticks coming out from every which way.  very stubby with flowers starting to bloom.  the thorns protect it by poking entruders.  some sticks are smaller than others.  some sticks are coming out of others. ,204,3.128152370452881,3.088585138320923,3.189896821975708
17500,"Mommy, Mommy",allie,7,"mommy,  mommy i love you mommy,  mommy do you love me too? mommy,  mommy come and see mommy,  mommy are you watching me? mommy,  mommy watch this move mommy,  mommy look at my groove! mommy,  mommy do you see mommy,  mommy what's happening to me? mommy,  mommy it seems like i dont care mommy,  mommy how do you bare? mommy,  mommy go away mommy,  mommy i'm too old to play! mommy,  mommy dont tell me what to do moomy,  mommy i dont want to talk to you! mommy,  mommy i could care less mommy,  mommy i wont pick up my mess! mommy,  mommy i probably should mommy,  mommy i wish i would.   mommy,  mommy please dont go mommy,  mommy i'll miss you so.  mommy,  mommy you wiped my tears mommy,  mommy you cured my fears.  mommy,  mommy i pray to you to forgive me,  because i miss you. ",758,3.2889060974121094,3.601280689239502,3.176992416381836
29242,Upon A Cresent Moon,allie,7,"gently i float,  dreaming in a reality far beyond,   and to intense that it boils  thy blood.  and it makes  me wonder,  that upon a cresent moon,  will i love again?",164,3.1418581008911133,3.4747865200042725,3.0999677181243896
30315,I use to be...,allie,7,"i use to be a rock in the galaxie but now i am the earth,   i use to be a piece of wood but now i am a neighborhood,   i use to be a word  but now i am a novel,   i use to be a child  but now i am an angel. ",206,3.2920618057250977,3.279134511947632,3.208088159561157
30336,If I were...,allie,7,"if i were a bird,      i would soar through the sky like a plane,     i would search for food as if i were a fox,     i would relax in a comfy nest as if i were sleeping in my bed,  if i were a bird,     i would feel free and peaceful as if  i were wind,     i would flap my wings gracefully like a ballerina dancing on her toes. ",330,3.5353996753692627,3.46724271774292,3.257496118545532
105792,Sun rays,allie,7,the sun rays beat down on the delicate flowers on a hot summer day warming up the whole town.  melting the ice cubes of cold lemonade and warming up the delicious homemade cookies. then the steaming sun goes down to sleep as dawn comes out for a peep. ,252,3.661536455154419,3.3141427040100098,3.2653393745422363
51920,Dont mind me,allie,7,dont mind me im just dust in the wind you act like you dont care and your never there dont mind me,101,2.7117977142333984,3.0515031814575195,3.214396476745605
103427,My dog Daisy,allie,7,"my dog daisy is as spoiled as can be! she has a maid,  a chef,  and a bigger room than me! she gets collars,  she gets treats; she gets vegetables,  she gets meats; my dog dog daisy is as spoiled as can be! daisy gets groomers from japan; she gets a private booth to tan.  daisy gets a jet to take her anyplace.  everyone in town knows her face! she is your typical spoiled rotten girl; but i wouldn't trade her for anything in the world!",435,3.890064239501953,3.7301442623138423,3.386647939682007
31746,Mother,allie,7,"my mom is outstanding.  the way she cares helps me eeveryday,  really i mean it. ",81,4.052323818206787,3.616225719451904,3.410398244857788
31723,Softball,allie,7,softball is the best.  it's better than the rest.  it's fun and great.  and loud and great it's better than the rest. ,117,4.285401344299316,3.785762071609497,3.432054042816162
31718,Mom&apos;s Poem,allie,7,"roses are red,  violets are blue,  you are special and,  i love you!",68,4.342154026031494,3.868497133255005,3.373929977416992
87972,Friend,allie,7,autumn leaves are  f   a     l       l         i           n             g to the ground,92,3.1078872680664062,2.884619951248169,3.1498539447784424
54873,But why...,allisa,7,yesterday we where fighting now where friends.  i no you will turn on me at the very end.  i should enjoy it well i can your my best friend but why am i sad,157,2.743823528289795,3.335298538208008,3.065418004989624
25301,The Jetmaester,allison,7,"my cat is like a dog,  but he sits there like a log.  he gallops like a horse down the hall and when he sleeps he's just a black,  furry ball.  he has a sense of humor,  he acts just like a man.    hey there he goes down the stairs,  you should've seen how he ran!",260,3.372171401977539,3.4863009452819824,3.282453775405884
41833,True Love,allison,7,"life must move on but every second that you're gone i'll be thinking only of you you know it's true,  oooh  and i will love you still,  and i'll be here waiting for you just call my name,  and i'll be there that's all you gotta do",230,3.615707874298096,3.6543822288513184,3.3223111629486084
105527,Spring,allison,7,"spring is here,  so its time to cheer baseball is is in full gear the phillies are back and better than ever and lets hope for wins  kids still in school so the books are still in session but schools almost out so its time to scream and shout but lets get ready for summer so lets hit the beach",296,3.5325160026550293,3.570974826812744,3.399517774581909
105510,Lauren,allison,7,"lauren is a girl she is in 7th grade she loves to read and play softball and volleyball  but if you weren't close friends with lauren,  you would not know this so i will tell you more  she has two brothers and rabbit she loves the beach and to hang out in the sand but when it comes to school,  she is a genius even if she doesnt like it so that is lauren",358,3.3740992546081543,3.284965991973877,3.292590379714966
105494,Summer,allison,7,"sand and shells salty water sandcastles,  and surfing the fun has just begun  late nights out icecream and waterice sleepovers on weekdays sleeping in days at the pool even though there is summer reading at least your not at school so lets hope for a great summer,  because it won't last forever. ",298,3.573271512985229,3.35184907913208,3.295105457305908
26344,Bored,allison,7,"i am bored.  very bored.  boredom is boring.  but what exactly is boredom? dullness,  unexcitment,  and uninteresting someone once told me if you're bored,  then you are a boring person.  oh well,   this poem is also boring and i bet you're bored by now so i guess that makes you a boring person now?",295,2.455928087234497,3.1291489601135254,3.0100975036621094
17829,Oh Rose,allison,7,"oh rose,  oh rose you are so unqiue  with your spiraling maze leadind us to your romantic heart  oh rose,  oh rose  with your scarlet petals  wet from a short spring rain  the fringe flaming off the top of your   lips will glisten in our hearts always",252,3.9212143421173096,3.690709114074707,3.271738290786743
54184,A lost friend,allison,7,"people think a friend is some one who is always there.  my perspective is some one who doesent care.  along lost friend,  now some dust in the wind she use to be sharper then a safty pin.  i look out the window and see the wet cold rain wondering if she could feel my pain.  theres nothing in my mind but a lost frend. ",316,2.399075746536255,3.239996910095215,2.8951635360717773
